countyCode,countyName,cityCode,cityName,HotelCode,HotelName,HotelRating,Address,Attractions,Description,FaxNumber,HotelFacilities,Map,PhoneNumber,PinCode,HotelWebsiteUrl
DO,Dominican Republic,102208,Bávaro,1197816,Grand Memories Splash & Grand Memories Punta Cana,FourStar,Highway Macao Bavaro Playa Arena GordaBávaroPunta Cana ,Distances are displayed to the nearest 0.1 mile and kilometer. <br /> <p>Arena Gorda Beach - 0.1 km / 0.1 mi <br /> Hard Rock Golf Club at Cana Bay - 1.4 km / 0.9 mi <br /> Punta Blanca Golf Course - 2.7 km / 1.7 mi <br /> Iberostar Golf Course - 5.7 km / 3.6 mi <br /> White Sands Golf Course - 8 km / 5 mi <br /> Princess Tower Casino Punta Cana - 8.9 km / 5.5 mi <br /> Casino Diamante Punta Cana Grand - 9.9 km / 6.2 mi <br /> Cortecito Beach - 10 km / 6.2 mi <br /> Aromas Museum - 10.9 km / 6.8 mi <br /> Los Corales Beach - 11.6 km / 7.2 mi <br /> Cocotal Golf and Country Club - 11.6 km / 7.2 mi <br /> Manati Park Bavaro - 11.8 km / 7.3 mi <br /> Macao Beach - 12.5 km / 7.8 mi <br /> Palma Real Shopping Village - 12.8 km / 8 mi <br /> Bavaro Beach - 13.5 km / 8.4 mi <br /> </p><p>The preferred airport for Royalton Splash Punta Cana Resort & Spa - All Inclusive is Punta Cana Intl. Airport (PUJ) - 27.8 km / 17.3 mi </p>,"<p>HeadLine : Near Hard Rock Golf Club at Cana Bay</p><p>Location : When you stay at Royalton Splash Punta Cana Resort & Spa - All Inclusive in Punta Cana, you ll be near the beach, a 1-minute drive from Arena Gorda Beach and 6 minutes from Hard Rock Golf Club at Cana Bay.  This 4-star property is 7.8 mi (12.5 km) from Macao Beach and 8 mi (12.8 km) from Palma Real Shopping Village.</p><p>Rooms : Make yourself at home in one of the 273 air-conditioned rooms featuring minibars and flat-screen televisions. Complimentary wireless Internet access is available to keep you connected. Bathrooms with showers are provided. Conveniences include safes and complimentary bottled water, and housekeeping is provided daily.</p><p>Dining : This property is all inclusive. Rates include meals and beverages at onsite dining establishments. Charges may be applied for dining at some restaurants, special dinners and dishes, some beverages, and other amenities. <p>Grab a bite at GRAZIE TRATTORIA, one of the property s 5 restaurants, or stay in and take advantage of the room service (during limited hours). Snacks are also available at the coffee shop/café. Relax with a refreshing drink from the bar/lounge or one of the 2 poolside bars. </p></p><p>Renovations : This property is closed from March 20 2020 to September 30 2020 (dates subject to change).</p><p>CheckIn Instructions : Extra-person charges may apply and vary depending on property policy Government-issued photo identification and a credit card, debit card, or cash deposit may be required at check-in for incidental charges Special requests are subject to availability upon check-in and may incur additional charges; special requests cannot be guaranteed Minimum Spring Break check-in age is 20 years old Safety features at this property include a smoke detector</p><p>Special Instructions : This property doesn t offer after-hours check-in. Front desk staff will greet guests on arrival.</p>",809-552-1617,ATM/banking Concierge services Gift shops or newsstand Snack bar/deli Laundry facilities Spa tub Beach towels Accessible bathroom Roll-in shower Arcade/game room In-room accessibility Airport transportation (surcharge) Garden Express check-in Waterslide Bar/lounge - 1 Coffee/tea in common areas Fitness facilities Number of poolside bars - 2 Full-service spa Free water park access 24-hour front desk Business center Grocery/convenience store Express check-out Meeting rooms Tours/ticket assistance Coffee shop or café - 1 Dry cleaning/laundry service Free WiFi Sauna Free valet parking Outdoor pool Health club Smoke-free property Computer station Children's pool Safe-deposit box at front desk Terrace Luggage storage Wheelchair accessible  no Hair salon,18.73253|-68.468773,829-954-8177,23000,https://www.memoriesresorts.com/resort/grand-memor
DO,Dominican Republic,102208,Bávaro,1200536,NH Punta Cana,ThreeStar,Alemania El Cortesito Bavaro Beach Bavaro BeachPunta Cana ,Distances are displayed to the nearest 0.1 mile and kilometer. <br /> <p>Cocotal Golf and Country Club - 0.6 km / 0.4 mi <br /> Los Corales Beach - 1 km / 0.6 mi <br /> Palma Real Shopping Village - 1.1 km / 0.7 mi <br /> Aromas Museum - 1.4 km / 0.8 mi <br /> Cortecito Beach - 2.1 km / 1.3 mi <br /> Bavaro Beach - 2.9 km / 1.8 mi <br /> Princess Tower Casino Punta Cana - 3.4 km / 2.1 mi <br /> Dolphin Island - 3.9 km / 2.4 mi <br /> Manati Park Bavaro - 4.1 km / 2.5 mi <br /> Casino Diamante Punta Cana Grand - 4.6 km / 2.8 mi <br /> White Sands Golf Course - 4.8 km / 3 mi <br /> Bavaro Lagoon - 5.3 km / 3.3 mi <br /> San Juan Shopping Center - 5.3 km / 3.3 mi <br /> Downtown Punta Cana - 6.7 km / 4.2 mi <br /> Arena Gorda Beach - 7.3 km / 4.6 mi <br /> </p><p>The preferred airport for WHE Bávaro is Punta Cana Intl. Airport (PUJ) - 18.2 km / 11.3 mi </p>,"<p>HeadLine : Near Palma Real Shopping Village</p><p>Location : When you stay at WHE Bávaro in Punta Cana, you ll be in a shopping district, within a 15-minute walk of Palma Real Shopping Village and Los Corales Beach.  This hotel is 1.8 mi (2.9 km) from Bavaro Beach and 4.2 mi (6.7 km) from Downtown Punta Cana.</p><p>Rooms : Make yourself at home in one of the 66 air-conditioned rooms featuring minibars and LCD televisions. Complimentary wireless Internet access keeps you connected, and satellite programming is available for your entertainment. Bathrooms with showers are provided. Conveniences include phones, as well as safes and coffee/tea makers.</p><p>Dining : Grab a bite to eat at NH Restaurante, a restaurant which features a bar/lounge, or stay in and take advantage of the 24-hour room service. Meet other guests and eat at the complimentary reception. Buffet breakfasts are available for a fee.</p><p>CheckIn Instructions : Extra-person charges may apply and vary depending on property policy Government-issued photo identification and a credit card, debit card, or cash deposit may be required at check-in for incidental charges Special requests are subject to availability upon check-in and may incur additional charges; special requests cannot be guaranteed Safety features at this property include a fire extinguisher, a smoke detector, a security system, a first aid kit, and window guards</p><p>Special Instructions : Front desk staff will greet guests on arrival.</p>",1-809-5526851,Bar/lounge elevator Fitness facilities 24-hour front desk Business center Restaurant Tours/ticket assistance Coffee shop or café Free self parking Dry cleaning/laundry service Free WiFi Smoke-free property Computer station Safe-deposit box at front desk Free reception Terrace Wheelchair accessible  no Breakfast available (surcharge) Concierge services Gift shops or newsstand Conference center Ballroom Laundry facilities One meeting room Garden,18.67805|-68.419425,1-809-221464,23000,http://https://www.nh-hotels.com/hotel/nh-punta-cana
DO,Dominican Republic,102208,Bávaro,1232562,Grand Palladium Punta Cana Resort & Spa,FourStar,Calle El Cortecito Playa BávaroPunta Cana ,Distances are displayed to the nearest 0.1 mile and kilometer. <br /> <p>Cortecito Beach - 0.5 km / 0.3 mi <br /> Aromas Museum - 1.8 km / 1.1 mi <br /> Princess Tower Casino Punta Cana - 2 km / 1.2 mi <br /> Los Corales Beach - 2.5 km / 1.6 mi <br /> Cocotal Golf and Country Club - 2.9 km / 1.8 mi <br /> Casino Diamante Punta Cana Grand - 3.2 km / 2 mi <br /> White Sands Golf Course - 3.3 km / 2.1 mi <br /> Arena Blanca Beach - 3.5 km / 2.1 mi <br /> Katmandu Park - 4.1 km / 2.6 mi <br /> Iberostar Golf Course - 6.3 km / 3.9 mi <br /> Arena Gorda Beach - 7.9 km / 4.9 mi <br /> Punta Blanca Golf Course - 8.2 km / 5.1 mi <br /> The Lakes Barcelo Bavaro Golf Course - 8.3 km / 5.2 mi <br /> Manati Park Bavaro - 8.3 km / 5.2 mi <br /> Cana Bay Golf Club - 9 km / 5.6 mi <br /> </p><p>The preferred airport for Grand Palladium Punta Cana Resort & Spa - All Inclusive is Punta Cana Intl. Airport (PUJ) - 23.7 km / 14.7 mi </p>,"<p>HeadLine : Near Cortecito Beach</p><p>Location : With a stay at Grand Palladium Punta Cana Resort & Spa - All Inclusive in Punta Cana, you ll be 0.3 mi (0.5 km) from Cortecito Beach and 10.8 mi (17.5 km) from Macao Beach.  This 4-star property is 5.8 mi (9.4 km) from Bavaro Beach and 4.9 mi (7.9 km) from Arena Gorda Beach.</p><p>Rooms : Treat yourself to a stay in one of the 582 guestrooms, featuring indoor private spa tubs and flat-screen televisions. Your memory foam bed comes with premium bedding. Rooms have private furnished balconies. Cable programming and MP3 docking stations are provided for your entertainment, while complimentary wireless Internet access keeps you connected. Private bathrooms with shower/tub combinations feature jetted bathtubs and complimentary toiletries.</p><p>Dining : This property is all inclusive. Rates include meals and beverages at onsite dining establishments. Charges may be applied for dining at some restaurants, special dinners and dishes, some beverages, and other amenities. <p>Enjoy Italian cuisine at Portofino, one of the property s 13 restaurants, or stay in and take advantage of the room service (during limited hours). When you are in need of a refreshing drink, visit the bar/lounge or one of 2 beach bars, or 6 swim-up bars. </p></p><p>CheckIn Instructions : <ul>  <li>Extra-person charges may apply and vary depending on property policy</li><li>Government-issued photo identification and a credit card, debit card, or cash deposit may be required at check-in for incidental charges</li><li>Special requests are subject to availability upon check-in and may incur additional charges; special requests cannot be guaranteed</li><li>This property accepts credit cards; cash is not accepted</li><li>Safety features at this property include a smoke detector and a security system</li><li>Please note that cultural norms and guest policies may differ by country and by property; the policies listed are provided by the property</li>  </ul> <ul>  <li>Room service is available 11 AM-10:30 PM at no additional cost and from 10:30 PM to 11 AM for a surcharge.</li>  </ul></p><p>Special Instructions : Front desk staff will greet guests on arrival.</p>",1-809-2218150,Parking (limited spaces) Babysitting or childcare (surcharge) Number of slot machines - 8 Outdoor entertainment area Number of VIP gaming rooms - 1 Water sports equipment Number of gaming tables - 8 Free WiFi Casino floor size square feet - 1500 Number of bars/lounges - 1 Number of poolside bars - 1 Number of outdoor pools - 6 Number of beach bars - 2 Number of swim-up bars - 6 In-room accessibility (in select rooms) Wheelchair accessible parking Roll-in shower (in select rooms) Tours/ticket assistance Accessible bathroom (in select rooms) Casino floor size square meters - 139 Outdoor tennis courts - 6 Multilingual staff Conference center Evening entertainment Wheelchair-accessible meeting spaces/business center Laundry facilities Children's club (free) Fitness facilities Supervised childcare/activities (free) Basketball on site Games Banquet hall Ballroom Reception hall Foosball Karaoke Wheelchair-accessible registration desk Wheelchair-accessible public washroom Arcade/game room Well-lit path to entrance Garden Wedding services Beach towels Miniature golf on site Luggage storage Express check-out Porter/bellhop Business center 24-hour front desk Playground on site Rafting on site Kayaking on site Hair salon Tennis on site Terrace ATM/banking Concierge services Pilates classes on site Gift shops or newsstand Dry cleaning/laundry service Beach volleyball on site Shopping on site Newspapers in lobby (surcharge) Pool umbrellas Number of meeting rooms - 7 Conference space size (meters) - 56 Swimming pool Designated smoking areas Sailing on site Scuba diving on site On private beach Turkish bath/Hammam Casino Wheelchair accessible (may have limitations) Beach umbrellas Nightclub Health club Spa treatment room(s) Full-service spa Volleyball on site Windsurfing on site Yoga classes/instruction on site Billiards or pool table Lifeguard on site Golfing nearby Spa services on site Snorkeling nearby Safe-deposit box at front desk Snack bar/deli Children's pool Sauna Steam room Free self parking Conference space Computer station Beach sun loungers Pool sun loungers Conference space size (feet) - 605,18.694443|-68.42856,1-809-2218149,23000,http://www.palladiumhotelgroup.com/de/punta-cana/g
DO,Dominican Republic,102208,Bávaro,1237908,Sunscape Bávaro Beach Punta Cana,FiveStar,Av. Alemania A B 108 Bavaro La Altagracia El Cortecito23000 BávaroPunta Cana ,,"Impressive Punta Cana - All Inclusive is located on the seafront in Punta Cana surrounded by tropical gardens with natural shade. Featuring a 24-hour front desk, a la carte restaurants with sea views and live music, casino, 3 outdoor pools. A tour desk can provide information on the area.

At the resort, each room includes a terrace. All rooms are equipped with air conditioning, and some rooms at Impressive Punta Cana - All Inclusive have a balcony. At the accommodation every room has a flat-screen TV with satellite channels.

At the resort guests are welcome to take advantage of a fitness room. You can play darts and mini-golf at Impressive Punta Cana - All Inclusive. Guests are required to show a photo identification and credit card upon check-in. Please note that all Special Requests are subject to availability and additional charges may apply.
When booking 10 rooms or more, different policies and additional supplements may apply.",001 809 2210814,Spa lounge/relaxation area Spa/wellness packages Massage chair Fitness Yoga classes fitness classes Personal trainer kids' pool Swimming pool Beach Stand-up comedy Movie nights Parking Restaurant Room service meeting/banquet facilities Bar 24-hour front desk Sauna Fitness centre Golf course (within 3 km) Garden Non-smoking rooms babysitting/child services Laundry dry cleaning Facilities for disabled guests Barber/beauty shop Games room Casino Ironing service Free parking internet services Safety Deposit Box Currency exchange Spa and wellness centre Massage children's playground Darts Hot tub/jacuzzi Tour desk Luggage storage wifi Mini golf Outdoor pool Free WiFi Air conditioning ATM/cash machine on site Snack Bar outdoor pool (all year) concierge service Entertainment staff nightclub/dj Special diet menus (on request) Trouser press vending machine (drinks) kids' club Beachfront Evening entertainment Daily housekeeping grocery deliveries parking on site Private parking wifi available in all areas Public Bath board games/puzzles kids' outdoor play equipment Kid-friendly buffet secured parking Accessible parking Infinity pool Pool with view Pool Bar Shallow end sun loungers or beach chairs Sun umbrellas Outdoor furniture Fence around pool Beauty Services Facial treatments Waxing services Make up services hair treatments Manicure Pedicure hair cut hair colouring hair styling Body Treatments Body scrub Body wrap Light therapy Spa Facilities face masks for guests available Themed dinner nights Live music/performance Aerobics 24-hour security Key access Key card access Smoke alarms CCTV in common areas CCTV outside property Fire extinguishers Swimming pool use of cleaning chemicals that are effective against coronavirus linens  towels and laundry washed in accordance with local authority guidelines guest accommodation is disinfected between stays guest accommodation sealed after cleaning physical distancing in dining areas food can be delivered to guest accommodation staff follow all safety protocols as directed by local authorities shared stationery such as printed menus  magazines  pens  and paper removed hand sanitizer in guest accommodation and key areas process in place to check health of guests first aid kit available contactless check-in/check-out cashless payment available physical distancing rules followed mobile app for room service screens or physical barriers placed between staff and guests in appropriate areas invoice provided property is cleaned by professional cleaning companies all plates  cutlery  glasses and other tableware have been sanitized guests have the option to cancel any cleaning services for their accommodation during their stay breakfast takeaway containers delivered food is securely covered thermometers for guests provided by property,18.68866|-68.41749,001 866 786 7227,23000,http://www.sunscaperesorts.com/bavaro-beach
DO,Dominican Republic,102208,Bávaro,1244188,Palladium Hotels & Resorts Punta Cana,FiveStar,"C/ El Cortecito, Playa Bavaro Higuey Republica Dom ",Dolphin Island Park: within 11000 metre  Kviar Casino: within 20000 metre  Bavaro Beach: within 8800 metre  Bavaro Adventure Park: within 10200 metre  Dolphin Explorer: within 9400 metre ,"Set in the midst of a coconut plantation and lush tropical vegetation, the marvellous Grand Palladium Punta Cana Resort & Spa enjoys a fantastic location directly on the famous Playa de Bávaro, known for its unparalleled beauty, its wonderful sand and the crystal-clear waters of the Caribbean Sea. It features 13 restaurants, 14 bars and an excellent spa and wellness centre. Punta Cana international airport can be reached within 30 minutes.",,Hotel American Express MasterCard Visa Bathroom Shower Hairdryer Toiletries Direct dial telephone TV Cable TV Radio Alarm clock Minibar Ironing set Centrally regulated air conditioning Individually adjustable air conditioning Safe Steam bath Wake-up service Hot tub Desk Massage Smoke detector Housekeeping Late Check-out Mobile phone coverage Local and international calls Car hire Transfer service Secure parking Airport shuttle Room service Laundry service Launderette Medical service Bicycle hire service Day-care centre Multilingual staff 24-hour security Bellboy service Smoke detector Hotel safe Currency exchange facilities Cloakroom Newspaper stand Supermarket Shop Garden Terrace Bicycle storage Gym Private pool Private beach area Café Bar Restaurant Non-smoking area Smoking area Highchairs Poolside snack bar Air conditioning in Restaurant Conference room Meeting room Photocopier Sun loungers Parasols Children playground À la carte dinner Set menu dinner Breakfast and dinner Breakfast and lunch Full board Full board with drinks All inclusive Deposit on arrival Identification card at arrival Aqua fit Banana boating Motor board ride Diving Windsurfing Catamaran sailing Canoeing Table tennis Aerobics Archery Basketball Beach volleyball Billiards Mini golf Tennis Paddle tennis Badminton Darts Other Protocol Spa treatments Hairdressing salon Beauty salon Spa centre Earth Check Breakfast Breakfast buffet Continental Breakfast Hot breakfast Buffet lunch À la carte lunch Set menu lunch Buffet dinner Kids club Entertainment programme for adults Entertainment programme for children Casino TV lounge Theatre / auditorium Game room Nightclub Sauna,18.693217|-68.426356,,23000,http://www.fiestahotelgroup.com
DO,Dominican Republic,102208,Bávaro,1261188,Stanza Mare Coral Comfort,ThreeStar,"Playa El Cortecito, Bavaro PUNTA CANA ",,"The Stanza Mare Coral Comfort are fantastic apartments, surrounded by the lush vibrant vegetation and beautiful palms, sparkling waters and white sand, which provide the privacy of summer homes combined with the best services of a hotel. They are located on the east coast of the Dominican Republic in the white sandy beach of Playa Bavaro. This complex hotel offers first-rate facilities and services of the highest standard. This is a fantastic getaway from the daily routine.",,Bathtub Direct dial telephone TV Kitchen Fridge Cooker Microwave Individually adjustable air conditioning Safe Balcony Garden Bar Restaurant Aparthotel MasterCard Visa Bathroom Shower,18.71667|-68.45,,2331,www.coralstanzamare.com
DO,Dominican Republic,102208,Bávaro,1261330,Hard Rock Hotel and Casino,FourStar,"Boulevard Turístico Del Este Km 28, #74 Macao km 28 No.74MacaoPunta Cana ",Distances are displayed to the nearest 0.1 mile and kilometer. <br /> <p>Punta Blanca Golf Course - 4.8 km / 3 mi <br /> Cana Bay Golf Club - 4.9 km / 3.1 mi <br /> Arena Gorda Beach - 5.7 km / 3.5 mi <br /> Iberostar Golf Course - 7.7 km / 4.8 mi <br /> Macao Beach - 9.4 km / 5.8 mi <br /> White Sands Golf Course - 9.6 km / 5.9 mi <br /> Arena Blanca Beach - 10.3 km / 6.4 mi <br /> Princess Tower Casino Punta Cana - 10.4 km / 6.5 mi <br /> Cocotal Golf and Country Club - 11.3 km / 7 mi <br /> Cortecito Beach - 11.6 km / 7.2 mi <br /> Casino Diamante Punta Cana Grand - 12.4 km / 7.7 mi <br /> Aromas Museum - 13.2 km / 8.2 mi <br /> Los Corales Beach - 13.5 km / 8.4 mi <br /> Manati Park Bavaro - 14.5 km / 9 mi <br /> Katmandu Park - 15.8 km / 9.8 mi <br /> </p><p>The preferred airport for Hard Rock Hotel & Casino Punta Cana All Inclusive is Punta Cana Intl. Airport (PUJ) - 29.4 km / 18.2 mi </p>,"<p>HeadLine : Near Cana Bay Golf Club</p><p>Location : When you stay at Hard Rock Hotel & Casino Punta Cana All Inclusive in Punta Cana, you ll be on the beach and 8 minutes by car from Punta Blanca Golf Course.  This 4.5-star property is 3.1 mi (4.9 km) from Cana Bay Golf Club and 3.5 mi (5.7 km) from Arena Gorda Beach.</p><p>Rooms : Treat yourself to a stay in one of the 1775 individually decorated guestrooms, featuring outdoor private spa tubs. Rooms have private furnished balconies. Complimentary wireless Internet access keeps you connected, and satellite programming is available for your entertainment. Conveniences include laptop-compatible safes and desks, and housekeeping is provided daily.</p><p>Dining : This property is all inclusive. Rates include meals and beverages at onsite dining establishments. Charges may be applied for dining at some restaurants, special dinners and dishes, some beverages, and other amenities. <p>Grab a bite at Ipanema, one of the property s 10 restaurants, or stay in and take advantage of the 24-hour room service. Snacks are also available at the coffee shop/cafe. Wind down with a drink at one of the 20 bars/lounges or 4 poolside bars. A complimentary buffet breakfast is served daily from 7:00 AM to 11:30 AM. </p></p><p>CheckIn Instructions : <ul>  <li>Extra-person charges may apply and vary depending on property policy</li><li>Government-issued photo identification and a credit card, debit card, or cash deposit may be required at check-in for incidental charges</li><li>Special requests are subject to availability upon check-in and may incur additional charges; special requests cannot be guaranteed</li><li>This property accepts credit cards; cash is not accepted</li><li>Safety features at this property include a smoke detector</li>  </ul></p><p>Special Instructions : This property doesn t offer after-hours check-in. Front desk staff will greet guests on arrival.</p>",1-809-731-0001,Gift shops or newsstand Beach volleyball on site Shopping on site Free water park access Babysitting or childcare (surcharge) Pool umbrellas Conference space size (meters) - 6039 Swimming pool Free WiFi Number of bars/lounges - 20 Number of spa tubs - 1 Number of poolside bars - 4 Number of outdoor pools - 13 Number of swim-up bars - 3 In-room accessibility (in select rooms) Wheelchair accessible parking Roll-in shower (in select rooms) Tours/ticket assistance Accessible bathroom (in select rooms) Fitness classes on site Scuba diving on site Free Buffet Breakfast LED light bulbs Free breakfast Outdoor tennis courts - 2 Multilingual staff Conference center Daily Turkish bath/Hammam Number of coffee shops/cafes - 1 elevator Children's club (free) Fitness facilities Supervised childcare/activities (free) secured parking Wheelchair accessible Ballroom Reception hall Nightclub Meeting rooms Television in common areas Golfing on site Arcade/game room Health club Spa treatment room(s) Garden Full-service spa Wedding services Volleyball on site Yoga classes/instruction on site Designer stores on site Luggage storage Grocery/convenience store Porter/bellhop 24-hour front desk Lifeguard on site Playground on site Spa services on site Safe-deposit box at front desk Smoke-free property Snack bar/deli Children's pool Free self parking Conference space Waterslide Lazy river Hair salon Computer station Beach sun loungers Terrace ATM/banking Wheelchair accessible path of travel Golf course on site Conference space size (feet) - 65000 Concierge services Pilates classes on site,18.7333|-68.48248,1-809-687-0000,23000,http://www.hardrockhotelpuntacana.com
