countyCode,countyName,cityCode,cityName,HotelCode,HotelName,HotelRating,Address,Attractions,Description,FaxNumber,HotelFacilities,Map,PhoneNumber,PinCode,HotelWebsiteUrl
DO,Dominican Republic,102208,Bávaro,1156989,Grand Palladium Palace Resort Spa & Casino All Inc,FourStar,Francia Playas De Bavaro Higuey S N Playas de Bavaro Playas de Bavaro HigueyPunta Cana ,Distances are displayed to the nearest 0.1 mile and kilometer. <br /> <p>Cortecito Beach - 0.6 km / 0.4 mi <br /> Princess Tower Casino Punta Cana - 1.5 km / 0.9 mi <br /> Aromas Museum - 2.3 km / 1.4 mi <br /> Casino Diamante Punta Cana Grand - 2.6 km / 1.6 mi <br /> Cocotal Golf and Country Club - 2.8 km / 1.7 mi <br /> White Sands Golf Course - 2.8 km / 1.8 mi <br /> Arena Blanca Beach - 2.9 km / 1.8 mi <br /> Los Corales Beach - 3 km / 1.9 mi <br /> Katmandu Park - 4 km / 2.5 mi <br /> Iberostar Golf Course - 5.8 km / 3.6 mi <br /> Arena Gorda Beach - 7.3 km / 4.6 mi <br /> Punta Blanca Golf Course - 7.6 km / 4.7 mi <br /> The Lakes Barcelo Bavaro Golf Course - 7.8 km / 4.8 mi <br /> Manati Park Bavaro - 7.8 km / 4.9 mi <br /> Bavaro Beach - 8.4 km / 5.2 mi <br /> </p><p>The preferred airport for Grand Palladium Palace Resort Spa & Casino - All Inclusive is Punta Cana Intl. Airport (PUJ) - 23.2 km / 14.4 mi </p>,"<p>HeadLine : Near Cortecito Beach</p><p>Location : With a stay at Grand Palladium Palace Resort Spa & Casino - All Inclusive in Punta Cana, you ll be 0.4 mi (0.7 km) from Cortecito Beach and 10.2 mi (16.5 km) from Macao Beach.  This 4-star property is 5.2 mi (8.4 km) from Bavaro Beach and 4.6 mi (7.3 km) from Arena Gorda Beach.</p><p>Rooms : Treat yourself to a stay in one of the 366 guestrooms, featuring indoor private spa tubs and flat-screen televisions. Rooms have private furnished balconies. Satellite programming and MP3 docking stations are provided for your entertainment, while complimentary wireless Internet access keeps you connected. Private bathrooms with shower/tub combinations feature jetted bathtubs and complimentary toiletries.</p><p>Dining : This property is all inclusive. Rates include meals and beverages at onsite dining establishments. Charges may be applied for dining at some restaurants, special dinners and dishes, some beverages, and other amenities. <p>Enjoy Indian cuisine at Bhogali, one of the property s 13 restaurants, or stay in and take advantage of the room service (during limited hours). Relax with a refreshing drink at the bar/lounge, the poolside bar, or one of 2 beach bars. A complimentary buffet breakfast is served daily from 7:00 AM to 10:00 AM. </p></p><p>CheckIn Instructions : <ul>  <li>Extra-person charges may apply and vary depending on property policy</li><li>Government-issued photo identification and a credit card, debit card, or cash deposit may be required at check-in for incidental charges</li><li>Special requests are subject to availability upon check-in and may incur additional charges; special requests cannot be guaranteed</li><li>This property accepts credit cards; cash is not accepted</li><li>Safety features at this property include a smoke detector and a security system</li><li>Please note that cultural norms and guest policies may differ by country and by property; the policies listed are provided by the property</li>  </ul> <ul>  <li>Room service is available 11 AM-10:30 PM at no additional cost and from 10:30 PM to 11 AM for a surcharge.</li>  </ul></p><p>Special Instructions : This property offers transfers from the airport (surcharges may apply). Guests must contact the property with arrival details before travel, using the contact information on the booking confirmation. Front desk staff will greet guests on arrival.</p>",1-809-2210819,Parking (limited spaces) Babysitting or childcare (surcharge) Number of slot machines - 8 Outdoor entertainment area Number of VIP gaming rooms - 1 Number of gaming tables - 8 Sailing nearby Free WiFi Casino floor size square feet - 4000 Number of bars/lounges - 1 Number of spa tubs - 1 Casino shuttle (surcharge) Number of poolside bars - 1 Number of outdoor pools - 6 Number of beach bars - 2 Number of swim-up bars - 1 In-room accessibility (in select rooms) Wheelchair accessible parking Roll-in shower (in select rooms) Tours/ticket assistance Accessible bathroom (in select rooms) Casino floor size square meters - 372 Porter/bellhop Outdoor tennis courts - 6 Multilingual staff Conference center Evening entertainment Wheelchair-accessible meeting spaces/business center Laundry facilities Children's club (free) Fitness facilities Supervised childcare/activities (free) Basketball on site Bicycle rentals on site Reception hall Karaoke Wheelchair-accessible registration desk Wheelchair-accessible public washroom Arcade/game room Well-lit path to entrance Garden Free newspapers in lobby Wedding services Beach towels Miniature golf on site Luggage storage Pool sun loungers Conference space size (feet) - 605 Business center Personal motorized watercraft on site 24-hour front desk Archery on site Playground on site Rowing or canoeing on site Kayaking on site Hair salon Tennis on site Motor boating on site Terrace ATM/banking Concierge services Pilates classes on site Gift shops or newsstand Dry cleaning/laundry service Beach volleyball on site Shopping on site Pool umbrellas Number of meeting rooms - 7 Conference space size (meters) - 56 Designated smoking areas Skydiving on site Scuba diving on site Free Buffet Breakfast Airport transportation (surcharge) On private beach Free breakfast Daily Turkish bath/Hammam Casino Wheelchair accessible (may have limitations) Beach umbrellas Nightclub Windsurfing nearby Health club Spa treatment room(s) Full-service spa Volleyball on site Area shuttle (surcharge) Yoga classes/instruction on site Billiards or pool table Lifeguard on site Golfing nearby Spa services on site Snorkeling nearby Safe-deposit box at front desk Snack bar/deli Children's pool Sauna Free self parking Conference space Computer station Beach sun loungers,18.692572|-68.4322,1-809-2210719,23000,https://www.palladiumhotelgroup.com/es/punta-cana/grand-palladium-palace-resort-spa-casino
DO,Dominican Republic,102208,Bávaro,1161410,Los Corales Beach Village,ThreeStar,Calle Los Corales Bavaro Playa Los CoralesBavaro23000  Punta Cana ,Distances are displayed to the nearest 0.1 mile and kilometer. <br /> <p>Los Corales Beach - 1 km / 0.6 mi <br /> Aromas Museum - 1.1 km / 0.7 mi <br /> Cocotal Golf and Country Club - 2 km / 1.2 mi <br /> Katmandu Park - 2.7 km / 1.7 mi <br /> Cortecito Beach - 3.2 km / 2 mi <br /> Princess Tower Casino Punta Cana - 4 km / 2.5 mi <br /> Casino Diamante Punta Cana Grand - 5 km / 3.1 mi <br /> White Sands Golf Course - 5.4 km / 3.3 mi <br /> The Lakes Barcelo Bavaro Golf Course - 5.5 km / 3.4 mi <br /> Arena Blanca Beach - 5.6 km / 3.5 mi <br /> Bavaro Beach - 6.2 km / 3.8 mi <br /> Bavaro Lagoon - 6.8 km / 4.2 mi <br /> San Juan Shopping Center - 6.9 km / 4.3 mi <br /> Downtown Punta Cana - 7.2 km / 4.5 mi <br /> Arena Gorda Beach - 9.9 km / 6.2 mi <br /> </p><p>The preferred airport for Los Corales Beach Village is Punta Cana Intl. Airport (PUJ) - 19.8 km / 12.3 mi </p>,"<p>HeadLine : Near Los Corales Beach</p><p>Location : When you stay at Los Corales Beach Village in Punta Cana, you ll be next to a golf course, within a 5-minute drive of Los Corales Beach and Cocotal Golf and Country Club.  This beach resort is 2.5 mi (4 km) from Princess Tower Casino Punta Cana and 3.1 mi (5 km) from Casino Diamante Punta Cana Grand.</p><p>Rooms : Make yourself at home in one of the 36 air-conditioned rooms featuring minibars. Your room comes with a pillowtop bed. Rooms have private balconies. Complimentary wireless Internet access is available to keep you connected. Bathrooms feature showers, complimentary toiletries, and hair dryers.</p><p>Dining : At Los Corales Beach Village, enjoy a satisfying meal at the restaurant. Relax with your favorite drink at the bar/lounge or the beach bar. Full breakfasts are available daily from 8:00 AM to 11:00 AM for a fee.</p><p>CheckIn Instructions : <ul>  <li>Extra-person charges may apply and vary depending on property policy</li><li>Government-issued photo identification and a credit card, debit card, or cash deposit may be required at check-in for incidental charges</li><li>Special requests are subject to availability upon check-in and may incur additional charges; special requests cannot be guaranteed</li><li>Minimum Spring Break check-in age is 16 years old</li><li>The name on the credit card used at check-in to pay for incidentals must be the primary name on the guestroom reservation</li><li>This property accepts credit cards, debit cards, and cash</li>  </ul></p><p>Special Instructions : This property offers transfers from the airport (surcharges may apply). Guests must contact the property with arrival details before travel, using the contact information on the booking confirmation. The front desk is open daily from 8:00 AM - 8:00 PM. Front desk staff will greet guests on arrival.</p>",1-809-9156584,Dry cleaning/laundry service Fishing nearby Beach umbrellas Babysitting or childcare (surcharge) Airport transportation Pool umbrellas Swimming nearby Sailing nearby Windsurfing nearby Scuba diving nearby Free WiFi Number of bars/lounges - 1 Number of outdoor pools - 1 Number of beach bars - 1 Water skiing nearby Garden Wheelchair accessible parking Full-service spa Tours/ticket assistance Beach towels Boat tours nearby Rooftop terrace Airport transportation (surcharge) On private beach Golf lessons with a pro Clubhouse Luggage storage Golf lessons available nearby Parasailing nearby Front desk (limited hours) Breakfast available (surcharge) Spa services on site Snorkeling nearby Safe-deposit box at front desk Smoke-free property Rowing or canoeing on site Laundry facilities Children's pool Surfing/bodyboarding nearby Kayaking nearby Free self parking Beach sun loungers Terrace Wheelchair accessible path of travel Pool sun loungers,18.683197|-68.413327,1-809-9156584,23301,http://loscoralesvillage.com/
DO,Dominican Republic,102208,Bávaro,1161585,VIK Arena Blanca & VIK Cayena Beach,ThreeStar,Carretera Arena Gorda Bávaro PUNTA CANA ,,"This comfortable hotel is located in Bavaro. There are a total of 47 rooms at VIK Arena Blanca & VIK Cayena Beach. Guests will not be bothered during their stay, as this is not a pet-friendly hotel.",18092214658,Hotel,18.70822|-68.44216,18092216640,9999,http://www.vikhotels.com/de/vik-hotel-cayena-beach-punta-cana.html
DO,Dominican Republic,102208,Bávaro,1161587,Occidental Caribe,ThreeStar,"Playa Arena Gorda, Carretera Macao Playa Arena Gorda23301 Punta CanaLa Altagracia ",Distances are displayed to the nearest 0.1 mile and kilometer. <br /> <p>Cana Bay Golf Club - 1.5 km / 0.9 mi <br /> Arena Gorda Beach - 2.6 km / 1.6 mi <br /> Punta Blanca Golf Course - 3.2 km / 2 mi <br /> Iberostar Golf Course - 6.7 km / 4.2 mi <br /> White Sands Golf Course - 8.3 km / 5.2 mi <br /> Arena Blanca Beach - 8.9 km / 5.5 mi <br /> Princess Tower Casino Punta Cana - 9.3 km / 5.8 mi <br /> Cocotal Golf and Country Club - 9.4 km / 5.8 mi <br /> Cortecito Beach - 10.2 km / 6.3 mi <br /> Casino Diamante Punta Cana Grand - 10.5 km / 6.5 mi <br /> Aromas Museum - 11.2 km / 7 mi <br /> Los Corales Beach - 12.1 km / 7.5 mi <br /> Macao Beach - 12.2 km / 7.6 mi <br /> Manati Park Bavaro - 13 km / 8.1 mi <br /> Katmandu Park - 13.8 km / 8.6 mi <br /> </p><p>The preferred airport for Occidental Caribe - All Inclusive is Punta Cana Intl. Airport (PUJ) - 28.3 km / 17.6 mi </p>,"<p>HeadLine : Near Arena Gorda Beach</p><p>Location : Located in Punta Cana, Occidental Caribe - All Inclusive is by the sea, within a 10-minute drive of Punta Blanca Golf Course and Arena Gorda Beach.  This all-inclusive property is 2.5 mi (4 km) from Cana Bay Golf Club and 7.6 mi (12.2 km) from Macao Beach.</p><p>Rooms : Make yourself at home in one of the 798 air-conditioned rooms featuring heated floors and LCD televisions. Complimentary wireless Internet access keeps you connected, while iPod docking stations help you enjoy your music in the comfort of your room. Conveniences include phones, as well as laptop-compatible safes and desks.</p><p>Dining : This property is all inclusive. Rates include meals and beverages at onsite dining establishments. Charges may be applied for dining at some restaurants, special dinners and dishes, some beverages, and other amenities. <p>Enjoy Mexican cuisine at La Hacienda, one of the property s 8 restaurants, or stay in and take advantage of the room service (during limited hours). Relax with a refreshing drink at the beach bar, the poolside bar, or one of 8 bars/lounges. A complimentary buffet breakfast is served daily from 7:00 AM to 10:30 AM. </p></p><p>CheckIn Instructions : <ul>  <li>Extra-person charges may apply and vary depending on property policy</li><li>Government-issued photo identification and a credit card, debit card, or cash deposit may be required at check-in for incidental charges</li><li>Special requests are subject to availability upon check-in and may incur additional charges; special requests cannot be guaranteed</li><li>Minimum Spring Break check-in age is 15 years old</li><li>The name on the credit card used at check-in to pay for incidentals must be the primary name on the guestroom reservation</li><li>This property accepts credit cards, debit cards, and cash</li><li>Safety features at this property include a fire extinguisher, a smoke detector, a security system, and a first aid kit</li>  </ul></p><p>Special Instructions : The check-in location differs from the property location. To check in, go to During spring break, check-in may be at the theatre To make arrangements for check-in please contact the property ahead of time using the information on the booking confirmation. If you are planning to arrive after midnight please contact the property in advance using the information on the booking confirmation. Guests must contact the property in advance for check-in instructions. Front desk staff will greet guests on arrival.</p>",001 809 412 2288,Hair salon Tennis on site Access to nearby indoor pool Terrace ATM/banking Concierge services Pilates classes on site Gift shops or newsstand Dry cleaning/laundry service Beach volleyball on site Free water park access Proposal/romance packages available Babysitting or childcare (surcharge) Number of slot machines - 23 Number of VIP gaming rooms - 1 Number of gaming tables - 3 Free WiFi Casino floor size square feet - 11 Number of bars/lounges - 8 Number of spa tubs - 1 Number of poolside bars - 1 Number of outdoor pools - 3 Number of beach bars - 1 Number of swim-up bars - 1 In-room accessibility (in select rooms) Bicycle rentals nearby Wheelchair accessible parking Roll-in shower (in select rooms) Tours/ticket assistance Accessible bathroom (in select rooms) Casino floor size square meters - 1 Wheelchair-accessible lounge Wheelchair-accessible on-site restaurant Multilingual staff Handrails in stairways Handrails in hallways Wheelchair-accessible meeting spaces/business center Segway rental/tour nearby Laundry facilities elevator Children's club (free) Fitness facilities Supervised childcare/activities (free) Basketball on site Banquet hall Wheelchair-accessible concierge desk Table tennis Wheelchair-accessible path to elevator Wheelchair-accessible spa Wheelchair-accessible registration desk Television in common areas Wheelchair-accessible fitness center Wheelchair-accessible pool Wheelchair-accessible public washroom Arcade/game room Garden Picnic area Wedding services Beach towels Shopping mall on site Luggage storage Porter/bellhop Children's club Personal motorized watercraft on site 24-hour front desk Scooter/moped rentals nearby Playground on site Kayaking on site Windsurfing on site Yoga classes/instruction on site Rock climbing on site Cave exploring/spelunking nearby Grocery/convenience store Billiards or pool table Golfing nearby Safe-deposit box at front desk Snack bar/deli Children's pool Sauna Steam room Free self parking Shopping on site Conference space Ziplining nearby Waterslide Pool umbrellas Computer station Conference space size (meters) - 8 Pool sun loungers Swimming pool Conference space size (feet) - 87 Designated smoking areas Sailing on site Fitness classes on site Free Buffet Breakfast Free breakfast Parasailing nearby Water dispenser Daily Ecotours nearby Coffee/tea in common areas Casino Surfing/bodyboarding on site Mountain biking nearby Wheelchair accessible (may have limitations) Nightclub Skydiving Nearby Spa treatment room(s) Marina on site Full-service spa Tennis lessons on site Volleyball on site Water skiing on site,18.733461|-68.472336,1-809-4767777,23301,http://https://www.barcelo.com/en-us/hotels/dominican-republic/punta-c
DO,Dominican Republic,102208,Bávaro,1166262,Primaveral Hotel,ThreeStar,Avenida Estados Unidos Arena GordaBávaroPunta Cana ,,"Family operated since opening in 2010, Hotel Dominicana Plus Bavaro guests enjoy personalized service and attention from the moment they book their stay. Guests can contact the hotel after making their reservation to enroll in the Guest Satisfaction and Concierge Service, where they can have someone help arrange the rest of their trip to the Dominican Republic - including transfers, activities and sightseeing

Surrounded by lush vegetation, Hotel Dominicana Plus Bavaro features an outdoor swimming pool and rooms with air conditioning.  Manatí Park is 1 km away.

Hotel Dominicana Plus Bavaro offers free onsite parking and free Wi-Fi throughout.

This hotel offers a restaurant and a bar. Guests are welcome to use the gym facilities of the building next door with a surcharge.

Each functional room at Hotel Dominicana Plus Bavaro comes with a safe, a small fridge and a satellite TV. There is also a ceiling fan, a seating area and a private bathroom.

Punta Cana International Airport is 20 minutes drive away.",+18095521579,Family rooms Free self parking Internet access Safe-deposit box at front desk Tour desk Fax/photocopying Luggage storage Free WiFi Outdoor pool Free WiFi Air conditioning Designated smoking areas Terrace Outdoor seasonal pool Concierge services Private check-in/check-out Free area shuttle Area shuttle (surcharge) Airport transportation (surcharge) Television in common areas Daily housekeeping Parking onsite Private parking Open-air bath Swimming pool toys Children television networks Street parking Restaurant Room service Bar/lounge 24-hour front desk Garden Terrace Non-smoking rooms Airport shuttle,18.69202|-68.45627,+18094767177,23000,https://www.booking.com/hotel/do/primaveral.html
DO,Dominican Republic,102208,Bávaro,1166266,Garden Suites by Meliá  All inclusive,FourStar,Playa de Bávaro Punta Cana ,Distances are displayed to the nearest 0.1 mile and kilometer. <br /> <p>Cocotal Golf and Country Club - 1 km / 0.6 mi <br /> Katmandu Park - 1.2 km / 0.7 mi <br /> Aromas Museum - 2.6 km / 1.6 mi <br /> Los Corales Beach - 2.6 km / 1.6 mi <br /> The Lakes Barcelo Bavaro Golf Course - 4 km / 2.5 mi <br /> Bavaro Beach - 4.2 km / 2.6 mi <br /> Princess Tower Casino Punta Cana - 4.5 km / 2.8 mi <br /> Cortecito Beach - 4.6 km / 2.9 mi <br /> Bavaro Lagoon - 5.4 km / 3.3 mi <br /> San Juan Shopping Center - 5.5 km / 3.4 mi <br /> Downtown Punta Cana - 5.7 km / 3.6 mi <br /> Casino Diamante Punta Cana Grand - 6.7 km / 4.2 mi <br /> White Sands Golf Course - 6.9 km / 4.3 mi <br /> Arena Blanca Beach - 7.5 km / 4.7 mi <br /> Iberostar Golf Course - 9.9 km / 6.1 mi <br /> </p><p>The nearest major airport is Punta Cana Intl. Airport (PUJ) - 18.3 km / 11.4 mi</p>,"<p>HeadLine : Near Katmandu Park</p><p>Location : Located in Punta Cana, Garden Suites by Meliá  All inclusive is connected to the convention center, a 3-minute drive from Cocotal Golf and Country Club and 9 minutes from Downtown Punta Cana.  This 4.5-star property is 1.8 mi (2.9 km) from Los Corales Beach and 2.9 mi (4.7 km) from Bavaro Beach.</p><p>Rooms : Make yourself at home in one of the 190 air-conditioned rooms featuring minibars. Rooms have private balconies. Complimentary wireless Internet access keeps you connected, and satellite programming is available for your entertainment. Private bathrooms with separate bathtubs and showers feature jetted bathtubs and rainfall showerheads.</p><p>Dining : This property is all inclusive. Rates include meals and beverages at onsite dining establishments. Charges may be applied for dining at some restaurants, special dinners and dishes, some beverages, and other amenities. <p>Grab a bite at Mizu, one of the property s 4 restaurants, or stay in and take advantage of the 24-hour room service. Mingle with other guests at the complimentary reception, held daily. Visit one of the 2 bars/lounges, 3 beach bars, and 2 poolside bars for a refreshing drink. A complimentary buffet breakfast is served daily from 6:30 AM to 11 AM. </p></p><p>CheckIn Instructions : <ul>  <li>Extra-person charges may apply and vary depending on property policy</li><li>Government-issued photo identification and a credit card, debit card, or cash deposit may be required at check-in for incidental charges</li><li>Special requests are subject to availability upon check-in and may incur additional charges; special requests cannot be guaranteed</li><li>Special cancellation policies or charges may apply for group reservations (more than 8 rooms for the same property / stay dates)</li><li>This property accepts credit cards, debit cards, and cash</li><li>Noise-free guestrooms cannot be guaranteed</li><li>Please note that cultural norms and guest policies may differ by country and by property; the policies listed are provided by the property</li>  </ul></p><p>Special Instructions : Front desk staff will greet guests on arrival. For more details, please contact the property using the information on the booking confirmation.  The credit card used to book the reservation must be presented by the cardholder at check-in along with matching photo identification. Any other arrangements must be coordinated with the property prior to arrival.</p>",1-809-6885800,Golf cart Proposal/romance packages available Optional golf privileges Conference space size (feet) - 31754 Babysitting or childcare (surcharge) Golf clubs (equipment) Outdoor furniture Outdoor entertainment area Water sports equipment Free WiFi Number of bars/lounges - 2 Number of poolside bars - 2 Braille or raised signage Number of outdoor pools - 4 Number of beach bars - 3 Number of swim-up bars - 1 In-room accessibility (in select rooms) Wheelchair accessible parking Roll-in shower (in select rooms) Tours/ticket assistance Accessible bathroom (in select rooms) Wheelchair-accessible lounge Wheelchair-accessible on-site restaurant Outdoor tennis courts - 4 Sign language-capable staff Visual alarms in hallways Multilingual staff Conference center Evening entertainment Wheelchair-accessible meeting spaces/business center Free theme park shuttle Laundry facilities Children's club (free) Fitness facilities Supervised childcare/activities (free) Infant/toddler toys Wheelchair-accessible concierge desk Dock Wheelchair-accessible van parking Wheelchair-accessible spa Pool access ramp on site Wheelchair-accessible registration desk Television in common areas Wheelchair-accessible fitness center Wheelchair-accessible pool Wheelchair-accessible public washroom Arcade/game room Well-lit path to entrance Garden Picnic area Wedding services Beach towels Golf lessons on site Pro shop Clubhouse Luggage storage Porter/bellhop Business center Trampoline Pool toys Personal motorized watercraft on site 24-hour front desk Playground on site Racquetball/squash on site Kayaking on site Hair salon Tennis on site Terrace ATM/banking Golf course on site Parasailing on site Concierge services Gift shops or newsstand Dry cleaning/laundry service Beach volleyball on site Shopping on site Beach yoga on site Pool umbrellas Free reception Number of meeting rooms - 13 Conference space size (meters) - 2950 Swimming pool Designated smoking areas Sailing on site Fitness classes on site Free Buffet Breakfast On private beach Free breakfast Daily Barbecue grill(s) Turkish bath/Hammam Coffee/tea in common areas Surfing/bodyboarding on site secured parking Casino nearby Wheelchair accessible (may have limitations) Beach umbrellas Change of bed sheets (on request) Health club Spa treatment room(s) Change of towels (on request) Full-service spa Tennis lessons on site Volleyball on site Yoga classes/instruction on site Free beach shuttle Lifeguard on site Golfing nearby Spa services on site Safe-deposit box at front desk Snack bar/deli Children's pool Free self parking Free beach cabanas Conference space Waterslide Free pool cabanas Beach sun loungers Wheelchair accessible path of travel Pool sun loungers,18.676243|-68.41299,1-809-6885000,23000,http://www.melia.com/en/hotels/dominican-republic/punta-cana/the-reserve-at-paradisus-palma-real/index.html
