countyCode,countyName,cityCode,cityName,HotelCode,HotelName,HotelRating,Address,Attractions,Description,FaxNumber,HotelFacilities,Map,PhoneNumber,PinCode,HotelWebsiteUrl
DO,Dominican Republic,102208,Bávaro,1090954,Majestic Colonial Club,FiveStar,Carretera El Macao - Arena Gorda PUNTA CANA ,,"This sophisticated adults-only hotel is located in Bavaro. A total of 318 guest rooms are available for guests' convenience. The reception does not work around the clock. Thanks to the wide range of health amenities, those staying at this hotel will be able to indulge themselves during their stay. For the most active ones, there is an extensive offer of sports and activities available. A fee may be chargeable for some services.",,Smoking area Poolside snack bar Casino Game room Nightclub Steam bath Hot tub Massage Spa centre Breakfast Only Adults Non-smoking establishment Banana boating Hotel Valet parking Room service Laundry service Medical service 24-hour security Bellboy service Hotel safe Currency exchange facilities Lift access Shop Garden Luggage room Private beach area Towels and bed linen Bar Restaurant Windsurfing Table tennis Fitness Golf Surfing Tennis Golf practice facility Diving,18.734|-68.466,,23000,http://www.majesticcolonialresort.com/colonial_club.asp
DO,Dominican Republic,102208,Bávaro,1093549,Paradisus Palma Real Golf & Spa Resort,FiveStar,Playa de Bávaro Punta Cana ,Distances are displayed to the nearest 0.1 mile and kilometer. <br /> <p>Cocotal Golf and Country Club - 1 km / 0.6 mi <br /> Katmandu Park - 1.2 km / 0.7 mi <br /> Aromas Museum - 2.6 km / 1.6 mi <br /> Los Corales Beach - 2.6 km / 1.6 mi <br /> The Lakes Barcelo Bavaro Golf Course - 4 km / 2.5 mi <br /> Bavaro Beach - 4.2 km / 2.6 mi <br /> Princess Tower Casino Punta Cana - 4.5 km / 2.8 mi <br /> Cortecito Beach - 4.6 km / 2.9 mi <br /> Bavaro Lagoon - 5.4 km / 3.3 mi <br /> San Juan Shopping Center - 5.5 km / 3.4 mi <br /> Downtown Punta Cana - 5.7 km / 3.5 mi <br /> Casino Diamante Punta Cana Grand - 6.7 km / 4.1 mi <br /> White Sands Golf Course - 6.8 km / 4.3 mi <br /> Arena Blanca Beach - 7.5 km / 4.7 mi <br /> Iberostar Golf Course - 9.9 km / 6.1 mi <br /> </p><p>The nearest major airport is Punta Cana Intl. Airport (PUJ) - 18.3 km / 11.3 mi</p>,"<p>HeadLine : Near Katmandu Park</p><p>Location : You ll be centrally located in Punta Cana with a stay at Paradisus Palma Real Golf & Spa Resort All Inclusive, within a 15-minute walk of Cocotal Golf and Country Club and Katmandu Park.  This 5-star property is 1.8 mi (2.9 km) from Los Corales Beach and 2.9 mi (4.7 km) from Bavaro Beach.</p><p>Rooms : Make yourself at home in one of the 596 individually furnished guestrooms, featuring free minibar items and espresso makers. Your pillowtop bed comes with premium bedding. Rooms have private furnished balconies. 42-inch flat-screen televisions with cable programming provide entertainment, while complimentary wireless Internet access keeps you connected. Bathrooms with separate bathtubs and showers feature deep soaking bathtubs and rainfall showerheads.</p><p>Dining : This property is all inclusive. Rates include meals and beverages at onsite dining establishments. Charges may be applied for dining at some restaurants, special dinners and dishes, some beverages, and other amenities. <p>Enjoy international cuisine at THE LUNCH BOX FAMILY KITC, one of the property s 8 restaurants, or stay in and take advantage of the 24-hour room service. Visit one of the 11 bars/lounges, 3 beach bars, and 3 poolside bars for a refreshing drink. A complimentary buffet breakfast is served daily from 7:00 AM to 10:30 AM. </p></p><p>CheckIn Instructions : <ul>  <li>Extra-person charges may apply and vary depending on property policy</li><li>Government-issued photo identification and a credit card, debit card, or cash deposit may be required at check-in for incidental charges</li><li>Special requests are subject to availability upon check-in and may incur additional charges; special requests cannot be guaranteed</li><li>Special cancellation policies or charges may apply for group reservations (more than 8 rooms for the same property / stay dates)</li><li>This property accepts credit cards, debit cards, and cash</li><li>This property uses a grey water recycling system and eco-friendly cleaning products</li><li>Please note that cultural norms and guest policies may differ by country and by property; the policies listed are provided by the property</li>  </ul></p><p>Special Instructions : Front desk staff will greet guests on arrival. For more details, please contact the property using the information on the booking confirmation.  This property does not permit name changes on reservations. The name on the booking must match the name of the guest who is checking in and staying at the property; photo ID is required. The credit card used to book the reservation must be presented by the cardholder at check-in along with matching photo identification. Any other arrangements must be coordinated with the property prior to arrival.</p>",1-809-552-0572,Golf cart Proposal/romance packages available Grey water recycling system Optional golf privileges Free parking nearby Babysitting or childcare (surcharge) Game drive nearby Eco-friendly cleaning products used Golf clubs (equipment) Swimming nearby Bicycle on site Free WiFi Number of bars/lounges - 11 Number of poolside bars - 3 Braille or raised signage Number of outdoor pools - 11 Number of beach bars - 3 Number of swim-up bars - 2 In-room accessibility (in select rooms) Wheelchair accessible parking Roll-in shower (in select rooms) Tours/ticket assistance Accessible bathroom (in select rooms) Free shopping center shuttle Wheelchair-accessible fitness center Eco-friendly toiletries Wheelchair-accessible pool Farming classes Golfing on site Recycling Wheelchair-accessible public washroom LED light bulbs Arcade/game room Wheelchair-accessible lounge Well-lit path to entrance Wheelchair-accessible on-site restaurant Garden Surf lessons - nearby Picnic area Outdoor tennis courts - 4 Visual alarms in hallways Multilingual staff Handrails in stairways Conference center Electric car charging station Wheelchair-accessible meeting spaces/business center Segway rental/tour nearby Laundry facilities elevator Children's club (free) Fitness facilities Safari nearby Supervised childcare/activities (free) Wine release events Tasting room Wheelchair-accessible concierge desk Wheelchair-accessible path to elevator Wheelchair-accessible spa Wheelchair-accessible registration desk Television in common areas Stair-free path to entrance Free newspapers in lobby Wedding services Beach towels Boat tours nearby Golf driving range on site Golf lessons on site Pro shop Clubhouse Private picnics Couples/private dining Luggage storage Porter/bellhop Business center 24-hour front desk Scooter/moped rentals nearby Playground on site Racquetball/squash on site Kayaking on site Hair salon Tennis on site Terrace ATM/banking Golf course on site Concierge services Pilates classes on site Gift shops or newsstand Dry cleaning/laundry service Beach volleyball on site Shopping on site Beach yoga on site Ziplining nearby Pool umbrellas Number of meeting rooms - 13 Conference space size (meters) - 2950 Swimming pool Designated smoking areas Sailing on site Fitness classes on site Scuba diving on site Free Buffet Breakfast On private beach Winery attached Free breakfast Parasailing nearby Daily Barbecue grill(s) Turkish bath/Hammam Ecotours nearby Coffee/tea in common areas Canoe on site Motor boating nearby Wheelchair accessible (may have limitations) Fishing nearby Beach umbrellas Change of bed sheets (on request) Windsurfing nearby Health club Spa treatment room(s) Change of towels (on request) Full-service spa Tennis lessons on site Volleyball on site Yoga classes/instruction on site Free area shuttle Free beach shuttle Grocery/convenience store Lifeguard on site Spa services on site Snorkeling nearby Safe-deposit box at front desk Snack bar/deli Children's pool Free beach cabanas Conference space Free pool cabanas Computer station Beach sun loungers Wheelchair accessible path of travel Pool sun loungers Conference space size (feet) - 31754,18.676298|-68.412964,1-809-6885000,23000,https://www.melia.com/en/hotels/dominican-republic/punta-cana/paradisus-palma-real-golf-and-spa-resort/index.html
DO,Dominican Republic,102208,Bávaro,1103225,Villas Del Sol II,ThreeStar,Residencial Costa Bavaro Boulevar Bavaro Bavaro Suite 500Plaza IntercaribeResidencial Costa Bavaro ,Distances are displayed to the nearest 0.1 mile and kilometer. <br /> <p>Palma Real Shopping Village - 1.8 km / 1.1 mi <br /> Manati Park Bavaro - 2 km / 1.2 mi <br /> Bavaro Beach - 2.3 km / 1.4 mi <br /> Cocotal Golf and Country Club - 2.4 km / 1.5 mi <br /> Los Corales Beach - 2.6 km / 1.6 mi <br /> Dolphin Island - 2.9 km / 1.8 mi <br /> Aromas Museum - 4 km / 2.5 mi <br /> Bavaro Lagoon - 4.2 km / 2.6 mi <br /> San Juan Shopping Center - 4.6 km / 2.9 mi <br /> Cortecito Beach - 4.7 km / 2.9 mi <br /> Downtown Punta Cana - 6.6 km / 4.1 mi <br /> Iberostar Golf Course - 7.7 km / 4.8 mi <br /> White Sands Golf Course - 8.2 km / 5.1 mi <br /> Arena Gorda Beach - 8.5 km / 5.3 mi <br /> Punta Blanca Golf Course - 9.6 km / 6 mi <br /> </p><p>The preferred airport for Villas Del Sol II is Punta Cana (PUJ-Punta Cana Intl.) - 18.5 km / 11.5 mi </p>,"<p><b>Property Location</b> <br />A stay at Villas Del Sol II places you in the heart of Bavaro, within a 5-minute drive of Manati Park Bavaro and Palma Real Shopping Village.  This condo is 1.4 mi (2.3 km) from Bavaro Beach and 1.6 mi (2.5 km) from Cocotal Golf and Country Club.</p><p><b>Rooms</b> <br />Make yourself at home in one of the air-conditioned rooms featuring kitchens with refrigerators and microwaves. Conveniences include coffee/tea makers and irons/ironing boards.</p><p><b>Amenities</b> <br />Enjoy recreational amenities such as an outdoor pool and a fitness center.</p><p><b>Dining</b> <br />At Villas Del Sol II, enjoy a satisfying meal at the restaurant.</p>",,Fitness facilities Gift shops or newsstand Multilingual staff Outdoor pool Restaurant Shopping on site Tennis on site,18.66476059|-68.422958374,+1 809 412 2294,10124,
DO,Dominican Republic,102208,Bávaro,1110051,RIU Palace Punta Cana All Inclusive,FourStar,Playa de Arena Gorda Punta Cana ,Distances are displayed to the nearest 0.1 mile and kilometer. <br /> <p>Arena Gorda Beach - 0.7 km / 0.4 mi <br /> Punta Blanca Golf Course - 2.4 km / 1.5 mi <br /> Iberostar Golf Course - 2.8 km / 1.8 mi <br /> Cana Bay Golf Club - 4.7 km / 2.9 mi <br /> White Sands Golf Course - 6.5 km / 4 mi <br /> Arena Blanca Beach - 6.8 km / 4.2 mi <br /> Princess Tower Casino Punta Cana - 7.4 km / 4.6 mi <br /> Cocotal Golf and Country Club - 7.5 km / 4.7 mi <br /> Cortecito Beach - 8.1 km / 5.1 mi <br /> Casino Diamante Punta Cana Grand - 8.6 km / 5.4 mi <br /> Aromas Museum - 9.4 km / 5.8 mi <br /> Los Corales Beach - 10.1 km / 6.3 mi <br /> Manati Park Bavaro - 11.1 km / 6.9 mi <br /> Katmandu Park - 11.9 km / 7.4 mi <br /> Macao Beach - 13.8 km / 8.6 mi <br /> </p><p>The preferred airport for RIU Palace Punta Cana All Inclusive is Punta Cana Intl. Airport (PUJ) - 26.3 km / 16.3 mi </p>,"<p>HeadLine : Near Arena Gorda Beach</p><p>Location : When you stay at RIU Palace Punta Cana All Inclusive in Punta Cana, you ll be on the beach and 8 minutes by foot from Arena Gorda Beach.  This 4.5-star property is 12.3 mi (19.8 km) from Bavaro Beach and 3.6 mi (5.8 km) from Cana Bay Golf Club.</p><p>Rooms : Make yourself at home in one of the 676 guestrooms featuring minibars and flat-screen televisions. Rooms have private patios. Complimentary wireless Internet access keeps you connected, and satellite programming is available for your entertainment. Private bathrooms have designer toiletries and hair dryers.</p><p>Dining : This property is all inclusive. Rates include meals and beverages at onsite dining establishments. Charges may be applied for dining at some restaurants, special dinners and dishes, some beverages, and other amenities. <p>Grab a bite to eat at one of the property s 6 restaurants, or stay in and take advantage of the 24-hour room service. Snacks are also available at the coffee shop/cafe. Relax with a refreshing drink from the poolside bar or one of the 4 bars/lounges. A complimentary buffet breakfast is served daily from 7 AM to 11 AM. </p></p><p>CheckIn Instructions : <ul>  <li>Extra-person charges may apply and vary depending on property policy</li><li>Government-issued photo identification and a credit card, debit card, or cash deposit may be required at check-in for incidental charges</li><li>Special requests are subject to availability upon check-in and may incur additional charges; special requests cannot be guaranteed</li><li>Minimum Spring Break check-in age is 21 years old</li><li>The name on the credit card used at check-in to pay for incidentals must be the primary name on the guestroom reservation</li><li>This property accepts credit cards; cash is not accepted</li><li>This property reserves the right to pre-authorize the guest s credit card prior to arrival.</li><li>Safety features at this property include a fire extinguisher, a smoke detector, and a first aid kit</li><li>Please note that cultural norms and guest policies may differ by country and by property; the policies listed are provided by the property</li>  </ul></p><p>Special Instructions : This property offers transfers from the airport. Guests must contact the property with arrival details before travel, using the contact information on the booking confirmation. Guests planning to arrive outside of normal check-in hours will receive an email with check-in instructions. Front desk staff will greet guests on arrival.  This property does not permit name changes on reservations. The name on the booking must match the name of the guest who is checking in and staying at the property; photo ID is required.</p>",1-809-689-1481,Kayaking on site Hair salon Tennis on site Beach sun loungers ATM/banking Parasailing on site Gift shops or newsstand Dry cleaning/laundry service Beach volleyball on site Shopping on site Free water park access Babysitting or childcare (surcharge) Free WiFi Number of bars/lounges - 4 Designated smoking areas Number of poolside bars - 1 Number of outdoor pools - 3 Number of swim-up bars - 1 In-room accessibility (in select rooms) Tours/ticket assistance Accessible bathroom (in select rooms) Fitness classes on site Scuba diving on site Free Buffet Breakfast Free airport transportation LED light bulbs No accessible airport shuttle Free breakfast Multilingual staff Indoor tennis courts - 4 Daily Barbecue grill(s) Coffee/tea in common areas Number of coffee shops/cafes - 1 elevator Children's club (free) Fitness facilities Supervised childcare/activities (free) Surfing/bodyboarding on site Wheelchair accessible Reception hall Express check-in Nightclub Television in common areas Arcade/game room Spa treatment room(s) Garden Free use of nearby fitness center Full-service spa Wedding services Beach towels Fishing on site Windsurfing on site Wheelchair accessible  no Luggage storage Express check-out Grocery/convenience store Porter/bellhop Billiards or pool table Children's club 24-hour front desk Golfing nearby Spa services on site Children's pool Sauna Free self parking Waterslide,18.722275|-68.459785,+18096874242,23000,http://www.riu.com/de/Paises/dominikanische-republik/punta-cana/hotel-riu-palace-punta-cana/index.jsp
DO,Dominican Republic,102208,Bávaro,1122125,Family Club at Barceló Bávaro Palace Deluxe,FiveStar,"Carretera Bávaro, Km. 1 HIGÜEY ",Higuey: within 40000 metre ,"Located east of the Dominican Republic in the Caribbean Sea, Playa Bavaro is approximately 40 km from the city of Higüey, 200 km from the capital Santo Domingo, and just 800 m from one of the 10 best beaches in the world. The family-friendly beach hotel is approximately 32 km from Punta Cana International Airport and around 300 km from Las Americas International Airport.

Built in 2010, this modern club resort is ideal for families wishing to relax in a wonderful setting with lush flora and fauna, in harmony with the gentle coastal breeze. It was designed with the philosophy and premise of preserving the environment. With a total of 180 guest rooms, the air-conditioned beach hotel offers guests a lobby with 24-hour reception, a hotel safe, auditorium, casino, children's playground, kids' club and a bar and restaurant for guests to sample the excellent cuisine. Guests may also make use of the WLAN Internet access (fees apply), room service, a laundry service (fees apply) and a car park.

All rooms have a sensor lighting system, air conditioning, a ceiling fan, a 32-inch LCD TV with USB and DVD player, a radio alarm clock with connection for iPod and MP3, telephones in different areas, an in-room safe, ironing set and weighing scales. Each room additionally features a minibar, microwave, king-size bed and tea and coffee making facilities. All rooms have a complete modern en suite bathroom with 1600-watt hairdryer, mirror, relaxing shower, slippers and bathrobes. Guests may also relax on their private balcony or terrace which features in all rooms as standard.",18096865859,Golf practice facility TV lounge Theatre / auditorium Game room Nightclub Sauna Steam bath Hot tub Turkish bath (hamam) Massage Spa treatments Hotel American Express MasterCard Visa Bathroom Shower Hairdryer Direct dial telephone Radio Minibar Microwave Ironing set Safe Balcony Terrace Late Check-out Local and international calls Car hire Transfer service Secure parking Airport shuttle Room service Laundry service Launderette Medical service Day-care centre Babysitting service Multilingual staff 24-hour security Bellboy service Smoke detector Hotel safe Currency exchange facilities Lift access Shop Garden Gym Golf desk Bar Restaurant Non-smoking area Smoking area Poolside snack bar Banquet hall Show cooking Swim-up bar Sun loungers Parasols WaterSlides Children playground Kids club Entertainment programme for adults Entertainment programme for children Casino Tennis Paddle tennis Darts Putting green Hairdressing salon Beauty salon Spa centre Breakfast buffet Continental Breakfast Hot breakfast Buffet lunch Set menu lunch Buffet dinner À la carte dinner Set menu dinner All inclusive All inclusive with alcoholic drinks top brands Special dietary options Vegetarian meal Snacks Aqua fit Banana boating Jet ski Motor board ride Diving Windsurfing Sailing Catamaran sailing Canoeing Pedal boating Table tennis Aerobics Fitness Basketball Volleyball Beach volleyball Billiards Bowling alley Mini golf Golf Surfing,18.667236|-68.398312,+ 1 809 227 2356,23301,https://www.barcelo.com/en-us/hotels/dominican-republic/punta-cana-beach-bavaro/barcelo-bavaro-palace-family-club/
DO,Dominican Republic,102208,Bávaro,1122126,Club Premium Deluxe At Barcelo,FiveStar,Carretera Bávaro Km. 1 Playa Bávaro PO Box 317723301 BávaroHiguey ,,HotelDescription#This sophisticated Hotel is in Bavaro.,+118097000000,Hotel,18.667295|-68.400336,0018092272356,23301,https://www.barcelo.com/en-us/hotels/dominican-republic/punta-cana-beach-bavaro/
DO,Dominican Republic,102208,Bávaro,1134028,whala!bávaro,FourStar,Las Corales El Cortecito de BávaroBávaroPunta Cana ,Distances are displayed to the nearest 0.1 mile and kilometer. <br /> <p>Los Corales Beach - 0.6 km / 0.4 mi <br /> Aromas Museum - 0.7 km / 0.4 mi <br /> Cocotal Golf and Country Club - 1.7 km / 1 mi <br /> Katmandu Park - 2.4 km / 1.5 mi <br /> Cortecito Beach - 2.9 km / 1.8 mi <br /> Princess Tower Casino Punta Cana - 3.7 km / 2.3 mi <br /> Casino Diamante Punta Cana Grand - 4.8 km / 3 mi <br /> White Sands Golf Course - 5 km / 3.1 mi <br /> The Lakes Barcelo Bavaro Golf Course - 5.2 km / 3.2 mi <br /> Arena Blanca Beach - 5.2 km / 3.3 mi <br /> Bavaro Beach - 5.8 km / 3.6 mi <br /> Bavaro Lagoon - 6.5 km / 4 mi <br /> San Juan Shopping Center - 6.6 km / 4.1 mi <br /> Downtown Punta Cana - 6.8 km / 4.2 mi <br /> Arena Gorda Beach - 9.6 km / 6 mi <br /> </p><p>The nearest major airport is Punta Cana Intl. Airport (PUJ) - 19.4 km / 12.1 mi</p>,"<p>HeadLine : Near Los Corales Beach</p><p>Location : When you stay at whala!bavaro in Punta Cana, you ll be next to a golf course, within a 10-minute walk of Los Corales Beach and Aromas Museum.  This 4-star resort is 3.6 mi (5.8 km) from Bavaro Beach and 6 mi (9.6 km) from Arena Gorda Beach.</p><p>Rooms : Make yourself at home in one of the 263 air-conditioned rooms featuring refrigerators. Rooms have private balconies or patios. Complimentary wireless Internet access keeps you connected, and satellite programming is available for your entertainment. Private bathrooms with showers feature complimentary toiletries and hair dryers.</p><p>Dining : All-inclusive rates are available at this resort. Meals and beverages at onsite dining establishments are included in all-inclusive rates. Charges may be applied for dining at some restaurants, special dinners and dishes, some beverages, and other amenities. <p>Enjoy Caribbean cuisine at Buffet restaurant, one of the resort s many dining establishments, which include 3 restaurants and a coffee shop/cafe. When you are in need of a refreshing drink, visit the beach bar or one of 2 bars/lounges, or 2 poolside bars. A complimentary buffet breakfast is served daily from 7:30 AM to 10:30 AM. </p></p><p>CheckIn Instructions : <ul>  <li>Extra-person charges may apply and vary depending on property policy</li><li>Government-issued photo identification and a credit card, debit card, or cash deposit may be required at check-in for incidental charges</li><li>Special requests are subject to availability upon check-in and may incur additional charges; special requests cannot be guaranteed</li><li>This property accepts credit cards, debit cards, and cash</li><li>Safety features at this property include a smoke detector</li>  </ul></p><p>Special Instructions : Front desk staff will greet guests on arrival.</p>",1-809-5520822,Gift shops or newsstand Dry cleaning/laundry service Pool umbrellas Swimming pool Sailing nearby Scuba diving nearby Free WiFi Number of bars/lounges - 2 Designated smoking areas Number of poolside bars - 2 Number of outdoor pools - 5 Number of beach bars - 1 Water skiing nearby Bicycle rentals nearby Tours/ticket assistance Free Buffet Breakfast Rooftop terrace On private beach Free breakfast Golf lessons available nearby Multilingual staff Parasailing nearby Daily Barbecue grill(s) Ecotours nearby Number of coffee shops/cafes - 1 Laundry facilities Fitness facilities Beach umbrellas Windsurfing nearby Garden Full-service spa Beach towels 24-hour fitness facilities Boat tours nearby Luggage storage Coin laundry on site 24-hour front desk Scooter/moped rentals nearby Playground on site Golfing nearby Snorkeling nearby Snack bar/deli Kayaking nearby Beach sun loungers Terrace ATM/banking Pool sun loungers Concierge services,18.685379|-68.415401,1-809-6881612,23000,http://www.whalabavaro.com
