countyCode,countyName,cityCode,cityName,HotelCode,HotelName,HotelRating,Address,Attractions,Description,FaxNumber,HotelFacilities,Map,PhoneNumber,PinCode,HotelWebsiteUrl
GT,Guatemala,109234,Antigua,1183180,Hotel Meson De Maria,ThreeStar,3A. Calle Poniente #8 La Antigua Guatemala ,,"The hotel is located just 200 meters from the Central Park of Antigua, it is a charming house from the colonial period with all the details of the time and which was converted into a hotel. Its rooms are located around 2 beautiful patios full of charm in where the guest can enjoy his stay with peace of mind. Its location allows you to be close to everything, the Antigua Cathedral and a craft market are a 5-minute walk away, shops, restaurants, museums and all kinds of activities. La Aurora International Airport is 45 km away. The reception is open 24 hours and the reception staff can provide you with information on different activities so that you can enjoy your visit to beautiful Antigua Guatemala.

Rooms at the Mesón de María feature elegant colonial-style décor and cable TV. All rooms have a safe, telephone and a private bathroom with a hairdryer and free toiletries. Each stylish room includes free Wi-Fi. Please inform Meson de Maria in advance of your expected arrival time. You can use the Special Requests box when booking, or contact the property directly with the contact details provided in your confirmation.
In response to Coronavirus (COVID-19), additional safety and sanitation measures are in effect at this property.
Due to Coronavirus (COVID-19), this property is taking steps to help protect the safety of guests and staff. Certain services and amenities may be reduced or unavailable as a result.
Food & beverage services at this property may be limited or unavailable due to Coronavirus (COVID-19).
Spa and gym facilities at this property are unavailable due to Coronavirus (COVID-19).
Due to Coronavirus (COVID-19), please ensure that you are only booking this property following the local government guidelines of the destination, including but not limited to the purpose of travel, and maximum allowed group size.
Guests are required to show a photo identification and credit card upon check-in. Please note that all Special Requests are subject to availability and additional charges may apply.
It is not possible to stay at this property for Coronavirus (COVID-19) quarantine purposes.
Guests under the age of 18 can only check in with a parent or official guardian.",+50278326070,Walking tours Bike tours Themed dinner nights Cooking class use of cleaning chemicals that are effective against coronavirus linens  towels and laundry washed in accordance with local authority guidelines guest accommodation is disinfected between stays guest accommodation sealed after cleaning Restaurant Room service Bar 24-hour front desk Garden Terrace Non-smoking rooms Airport shuttle Business centre babysitting/child services Laundry Facilities for disabled guests Family rooms internet services express check-in/check-out Solarium Safety Deposit Box Massage Packed lunches Tour desk Luggage storage wifi Free WiFi Non-smoking throughout Sun terrace concierge service shuttle service (additional charge) Special diet menus (on request) airport shuttle (additional charge) grocery deliveries wifi available in all areas Kid meals secured parking Wine/champagne Fruits airport pick up airport drop off coffee house on site Shuttle service physical distancing in dining areas food can be delivered to guest accommodation staff follow all safety protocols as directed by local authorities shared stationery such as printed menus  magazines  pens  and paper removed hand sanitizer in guest accommodation and key areas process in place to check health of guests first aid kit available contactless check-in/check-out cashless payment available physical distancing rules followed invoice provided all plates  cutlery  glasses and other tableware have been sanitized guests have the option to cancel any cleaning services for their accommodation during their stay breakfast takeaway containers delivered food is securely covered face masks for guests available,14.55834|-90.73498,+50278326068+50278326070,03001,https://www.booking.com/hotel/gt/mesa3n-de-maraa.html
GT,Guatemala,109234,Antigua,1196210,Villa Colonial,ThreeStar,Alameda Del Calvario 28 Antigua GuatemalaSacatepéquez ,Distances are displayed to the nearest 0.1 mile and kilometer. <br /> <p>Iglesia de la Escuela de Cristo - 0.7 km / 0.4 mi <br /> House of the Giants - 1 km / 0.6 mi <br /> Church of San Francisco - 1.1 km / 0.7 mi <br /> Santa Clara Convent - 1.1 km / 0.7 mi <br /> Tanque La Unión - 1.2 km / 0.7 mi <br /> Museo del Hermano Pedro - 1.2 km / 0.8 mi <br /> San Jose el Viejo Ruins - 1.3 km / 0.8 mi <br /> Antigua Guatemala Colonial Art Museum - 1.3 km / 0.8 mi <br /> Choco Museum - 1.4 km / 0.9 mi <br /> Jade Maya Factory and Museum - 1.5 km / 0.9 mi <br /> Central Park - 1.5 km / 0.9 mi <br /> Antigua Tabaco Compania S.A. - 1.5 km / 0.9 mi <br /> Antigua Guatemala Cathedral - 1.5 km / 1 mi <br /> Palace of the Captains-General - 1.5 km / 1 mi <br /> Las Capuchinas Convent - 1.6 km / 1 mi <br /> </p><p>The preferred airport for Villa Colonial is La Aurora Intl. Airport (GUA) - 41 km / 25.4 mi </p>,"<p>HeadLine : Near Iglesia de la Escuela de Cristo</p><p>Location : Located in Antigua Guatemala, Villa Colonial is in the historical district, within a 15-minute walk of Iglesia de la Escuela de Cristo and House of the Giants.  This hotel is 1.1 mi (1.8 km) from Casa Santo Domingo Museum and 1.2 mi (1.9 km) from Central Park.</p><p>Rooms : Make yourself at home in one of the 54 individually decorated guestrooms. Complimentary wireless Internet access keeps you connected, and cable programming is available for your entertainment. Private bathrooms with showers feature complimentary toiletries and hair dryers. Conveniences include phones and in-room child care (surcharge), and housekeeping is provided daily.</p><p>Dining : Stop by the hotel s restaurant, Bugambilias, for lunch or dinner. Dining is also available at the coffee shop/cafe, and room service (during limited hours) is provided. Wrap up your day with a drink at the bar/lounge. Full breakfasts are available for a fee.</p><p>CheckIn Instructions : <ul>  <li>Extra-person charges may apply and vary depending on property policy</li><li>Government-issued photo identification and a credit card, debit card, or cash deposit may be required at check-in for incidental charges</li><li>Special requests are subject to availability upon check-in and may incur additional charges; special requests cannot be guaranteed</li><li>The name on the credit card used at check-in to pay for incidentals must be the primary name on the guestroom reservation</li><li>This property accepts credit cards, debit cards, and cash</li>  </ul></p><p>Special Instructions : This property offers transfers from the airport (surcharges may apply). Guests must contact the property with arrival details before travel, using the contact information on the booking confirmation. The front desk is open daily from 7:00 AM - 10:00 PM. This property doesn t offer after-hours check-in. Front desk staff will greet guests on arrival.</p>",502-78322154,Conference space Terrace Wheelchair accessible path of travel Dry cleaning/laundry service Banquet hall Wheelchair accessible Ballroom Reception hall Pool umbrellas Meeting rooms Wired Internet access - surcharge Free WiFi Number of bars/lounges - 1 Designated smoking areas Number of outdoor pools - 1 Garden Internet access in public areas - high speed Wheelchair accessible parking Free newspapers in lobby Internet access - wireless Wedding services Airport transportation - drop-off (surcharge) Airport transportation (surcharge) No accessible airport shuttle Luggage storage Porter/bellhop Multilingual staff Front desk (limited hours) Breakfast available (surcharge) Safe-deposit box at front desk Number of coffee shops/cafes - 1 Laundry facilities Free self parking,14.545743|-90.72991,502-78321050,01010,http://www.villasdeguatemala.com/hoteles
GT,Guatemala,109234,Antigua,1198511,Hotel Casa Antigua by AHS,ThreeStar,"3Rd Calle Poniente, 5 Antigua Gautemala ",,"Hotel Casa Antigua is housed in a historical building only 2 minutes walk from Antiguas central park, and offers a rooftop terrace with panoramic views. Free Wi-Fi, free coffee and free bottled water in public areas are included.

Rooms at this hotel feature a work desk, wardrobe and cable TV. The bathrooms are decorated with traditional painted tiles and come with a shower, while bedrooms feature antique furniture and traditional Guatemalan textiles.

Hotel Casa Antigua has on-site shops, meeting facilities, terraces and 3 gardens with fountains. The hotel staff is bilingual and Spanish lessons are available. Guests can also use the swimming pool and sauna at the hotels sister property for a small extra fee.

The hotel serves breakfast for an additional charge, and vending machines with snacks and drinks can be found on site.

Paid parking is available nearby. La Aurora International Airport can be reached in a 40-minute drive. Please inform Hotel Casa Antigua by AHS in advance of your expected arrival time. You can use the Special Requests box when booking, or contact the property directly with the contact details provided in your confirmation.
Guests are required to show a photo identification and credit card upon check-in. Please note that all Special Requests are subject to availability and additional charges may apply.
The payment of your reservation is made in the propertys local currency (quetzales). The displayed amount in the currency you choose is indicative and based on the exchange rate at the time the booking was confirmed.

Guests can also use the swimming pool and sauna at the hotels sister property for a small extra fee.

When reserving 3 nights you get a free 1 day pool pass per person, if you reserve 5 or more nights you get 2 (two) 1 day pool passes per person. The free pool pass is only valid if someone reserves nights in, April, May, June, August, September and October. It doesnt apply, on high season or Holidays.

Please note that the parking place needs prior reservation and it is located 5 minutes drive from the property.

Please note that only 1 pet per room is allowed at USD 5.

Please note a 6% fee will be charged when paying with credit card.",00502 78329191,Parking Pets allowed Room service 24-hour front desk Sauna Garden Terrace Non-smoking rooms Airport shuttle babysitting/child services Laundry Facilities for disabled guests Family rooms breakfast in the room Ironing service internet services express check-in/check-out Smoke alarms CCTV in common areas CCTV outside property Fire extinguishers bicycle rental use of cleaning chemicals that are effective against coronavirus linens  towels and laundry washed in accordance with local authority guidelines Safety Deposit Box Currency exchange Massage Packed lunches Car hire Tour desk Fax/photocopying Luggage storage wifi Free WiFi Non-smoking throughout designated smoking area Snack Bar Sun terrace concierge service Private check-in/check-out shuttle service (additional charge) Special diet menus (on request) airport shuttle (additional charge) Daily housekeeping Private parking wifi available in all areas Kid meals Street parking Public transport tickets Wheelchair accessible Wine/champagne Fruits airport pick up airport drop off Pet basket Pet bowls Sun umbrellas Outdoor furniture Picnic area Full body massage Shuttle service Walking tours Bike tours Tour or class about local culture 24-hour security Key access Security alarm guest accommodation is disinfected between stays guest accommodation sealed after cleaning physical distancing in dining areas food can be delivered to guest accommodation staff follow all safety protocols as directed by local authorities hand sanitizer in guest accommodation and key areas process in place to check health of guests first aid kit available cashless payment available physical distancing rules followed all plates  cutlery  glasses and other tableware have been sanitized guests have the option to cancel any cleaning services for their accommodation during their stay delivered food is securely covered face masks for guests available,14.55824|-90.73489,00502 78329090,03001,https://www.booking.com/hotel/gt/casa-antigua.html
GT,Guatemala,109234,Antigua,1198513,Mesón del Valle,ThreeStar,5th Ave Sur 11C 2 blocks south of central park Antigua ,Distances are displayed to the nearest 0.1 mile and kilometer. <br /> <p>San Jose el Viejo Ruins - 0.1 km / 0.1 mi <br /> Central Park - 0.2 km / 0.2 mi <br /> El Fotografo Gallery - 0.3 km / 0.2 mi <br /> Museo del Hermano Pedro - 0.3 km / 0.2 mi <br /> Palace of the Captains-General - 0.3 km / 0.2 mi <br /> Antigua Guatemala Colonial Art Museum - 0.3 km / 0.2 mi <br /> Tanque La Unión - 0.4 km / 0.2 mi <br /> Antigua Guatemala Cathedral - 0.4 km / 0.2 mi <br /> Palacio del Ayuntamiento - 0.4 km / 0.3 mi <br /> Museo del Libro Antiguo - 0.4 km / 0.3 mi <br /> House of the Giants - 0.5 km / 0.3 mi <br /> Santa Clara Convent - 0.5 km / 0.3 mi <br /> Centro de Formación de la Cooperación Española - 0.5 km / 0.3 mi <br /> Antiguo Colegio de la Compañía de Jesús - 0.5 km / 0.3 mi <br /> Santa Catalina Arch - 0.6 km / 0.4 mi <br /> </p><p>The preferred airport for Hotel Meson del Valle is La Aurora Intl. Airport (GUA) - 40.6 km / 25.2 mi </p>,"<p>HeadLine : Near House of the Giants</p><p>Location : A stay at Hotel Meson del Valle places you in the heart of Antigua Guatemala, steps from San Jose el Viejo Ruins and 3 minutes by foot from Central Park.  This family-friendly hotel is 0.8 mi (1.3 km) from Casa Santo Domingo Museum and 0.2 mi (0.3 km) from El Fotografo Gallery.</p><p>Rooms : Make yourself at home in one of the 10 guestrooms featuring DVD players. Your Tempur-Pedic bed comes with premium bedding. Complimentary wireless Internet access keeps you connected, and cable programming is available for your entertainment. Bathrooms have complimentary toiletries and hair dryers.</p><p>Dining : Grab a bite from the snack bar/deli, or stay in and take advantage of the hotel s room service (during limited hours). Cooked-to-order breakfasts are available daily from 7 AM to 10 AM for a fee.</p><p>CheckIn Instructions : <ul>  <li>Extra-person charges may apply and vary depending on property policy</li><li>Government-issued photo identification and a credit card, debit card, or cash deposit may be required at check-in for incidental charges</li><li>Special requests are subject to availability upon check-in and may incur additional charges; special requests cannot be guaranteed</li><li>This property accepts credit cards, debit cards, and cash</li><li>Safety features at this property include a fire extinguisher, a smoke detector, a security system, a first aid kit, and window guards</li>  </ul></p><p>Special Instructions : This property offers transfers from the airport (surcharges may apply). To arrange pick-up, guests must contact the property 24 hours prior to arrival, using the contact information on the booking confirmation. Front desk staff will greet guests on arrival.</p>",502-7882-4469,Computer station Terrace Concierge services Dry cleaning/laundry service Distance from property (meters) - 400 Mountain biking nearby Wheelchair accessible (may have limitations) Vending machine Food and water bowls Ziplining nearby Outdoor furniture Outdoor entertainment area Shared microwave Free WiFi Designated smoking areas Garden Bicycle rentals nearby Wedding services Tours/ticket assistance Shopping center shuttle (surcharge) Area shuttle (surcharge) Rooftop terrace Beach shuttle (surcharge) Airport transportation (surcharge) Luggage storage Distance from property (ft) - 1312 Express check-out Porter/bellhop Multilingual staff 24-hour front desk Water dispenser Breakfast available (surcharge) Scooter/moped rentals nearby Golfing nearby Spa services on site Safe-deposit box at front desk Ecotours nearby Coffee/tea in common areas Snack bar/deli Hiking/biking trails nearby Laundry facilities Use of nearby fitness center (discount) Offsite parking discounted rates available Offsite parking reservations required,14.55415|-90.734161,502-7882-4469,03001,http://hotelmesondelvalle.com
GT,Guatemala,109234,Antigua,1214107,Hostal Las Marías,ThreeStar,Calle A San Bartolo Lotificacion Las Jacarandas Lotificacion Las Jacarandas00010 Antigua ,,"This hotel is set 10 minutes walk from the centre of Antigua. It offers a pretty garden and terrace, a free Wi-Fi zone and colonial-style rooms with cable TV and free breakfast.

Rooms at Hotel Las Marias feature stylish décor and a private bathroom with handmade toiletries. Suites also include a fireplace, a king-size bed and a private terrace.

There are several bars and restaurants within 5 minutes walk of the property and both the Central and Artesan Markets are 5 minutes walk away.

Las Marias is 8 minutes walk from Central Park and 15 minutes walk from San José Cathedral. You can drive to the impressive Agua Volcano in around 15 minutes.

The property offers an airport shuttle for an extra fee and is 40 km from La Aurora International Airport. Antigua Bus Terminal is just 350 metres away. Please inform Hotel Las Marias in advance of your expected arrival time. You can use the Special Requests box when booking, or contact the property directly with the contact details provided in your confirmation.
In response to Coronavirus (COVID-19), additional safety and sanitation measures are in effect at this property.
Food & beverage services at this property may be limited or unavailable due to Coronavirus (COVID-19).
Due to Coronavirus (COVID-19), this property is taking steps to help protect the safety of guests and staff. Certain services and amenities may be reduced or unavailable as a result.
Due to Coronavirus (COVID-19), this property adheres to strict physical distancing measures.
Due to Coronavirus (COVID-19), wearing a face mask is mandatory in all indoor common areas.",+50255501476,invoice provided all plates  cutlery  glasses and other tableware have been sanitized guests have the option to cancel any cleaning services for their accommodation during their stay delivered food is securely covered Family rooms Ironing service Free parking internet services Safety Deposit Box Tour desk Luggage storage wifi Free WiFi Non-smoking throughout designated smoking area shuttle service (additional charge) airport shuttle (additional charge) Daily housekeeping parking on site Private parking board games/puzzles secured parking Wheelchair accessible Wine/champagne airport pick up airport drop off Outdoor furniture Shuttle service Walking tours Bike tours Themed dinner nights Tour or class about local culture 24-hour security Fire extinguishers use of cleaning chemicals that are effective against coronavirus linens  towels and laundry washed in accordance with local authority guidelines guest accommodation is disinfected between stays guest accommodation sealed after cleaning physical distancing in dining areas food can be delivered to guest accommodation staff follow all safety protocols as directed by local authorities hand sanitizer in guest accommodation and key areas process in place to check health of guests cashless payment available physical distancing rules followed Parking 24-hour front desk Garden Terrace Non-smoking rooms Airport shuttle Laundry Facilities for disabled guests,14.55598|-90.74131,+50255169147,03001,https://www.booking.com/hotel/gt/hostal-las-marias.html
GT,Guatemala,109234,Antigua,1214108,Hotel La Casa de Don Pedro,ThreeStar,Calle De Los Duelos #4 Antigua Guatemala ,Distances are displayed to the nearest 0.1 mile and kilometer. <br /> <p>Iglesia y Convento de Santo Domingo - 0.3 km / 0.2 mi <br /> Casa Santo Domingo Museum - 0.3 km / 0.2 mi <br /> Jade Maya Factory and Museum - 0.4 km / 0.2 mi <br /> Antigua Tabaco Compania S.A. - 0.6 km / 0.4 mi <br /> Choco Museum - 0.7 km / 0.4 mi <br /> Iglesia de la Candelaria - 0.7 km / 0.4 mi <br /> Las Capuchinas Convent - 0.7 km / 0.5 mi <br /> Church of San Francisco - 0.8 km / 0.5 mi <br /> House of the Giants - 0.9 km / 0.5 mi <br /> Central Park - 0.9 km / 0.5 mi <br /> Palacio del Ayuntamiento - 0.9 km / 0.5 mi <br /> Museo del Libro Antiguo - 0.9 km / 0.5 mi <br /> Tanque La Unión - 0.9 km / 0.5 mi <br /> Santa Clara Convent - 0.9 km / 0.6 mi <br /> Antigua Guatemala Colonial Art Museum - 1 km / 0.6 mi <br /> </p><p>The nearest major airport is La Aurora Intl. Airport (GUA) - 39.5 km / 24.5 mi</p>,"<p>HeadLine : Near Iglesia y Convento de Santo Domingo</p><p>Location : With a stay at Hotel La Casa de Don Pedro in Antigua Guatemala, you ll be within a 5-minute walk of Iglesia y Convento de Santo Domingo and Casa Santo Domingo Museum.  This bed & breakfast is 0.6 mi (0.9 km) from Central Park and 0.4 mi (0.6 km) from Antigua Tabaco Compania S.A..</p><p>Rooms : Stay in one of 7 guestrooms featuring flat-screen televisions. Complimentary wireless Internet access keeps you connected, and cable programming is available for your entertainment. Bathrooms with showers are provided. Conveniences include ceiling fans, and housekeeping is provided daily.</p><p>Dining : A complimentary breakfast is included.</p><p>CheckIn Instructions : <ul>  <li>Extra-person charges may apply and vary depending on property policy</li><li>Government-issued photo identification and a credit card, debit card, or cash deposit may be required at check-in for incidental charges</li><li>Special requests are subject to availability upon check-in and may incur additional charges; special requests cannot be guaranteed</li><li>This property accepts credit cards</li>  </ul></p><p>Special Instructions : Front desk staff will greet guests on arrival.</p>",502-502-41092255,Dry cleaning/laundry service Garden Tours/ticket assistance Luggage storage Free breakfast 24-hour front desk Terrace Free WiFi,14.55885|-90.7264,502-502-78321118,03001,http://www.hotellacasadedonpedro.com/index.html
GT,Guatemala,109234,Antigua,1214162,Hotel Casa Bella,ThreeStar,2Da Avenida Sur 5 03001 Antigua Guatemala ,Distances are displayed to the nearest 0.1 mile and kilometer. <br /> <p>Tanque La Unión - 0.1 km / 0.1 mi <br /> Santa Clara Convent - 0.1 km / 0.1 mi <br /> Antigua Guatemala Colonial Art Museum - 0.2 km / 0.1 mi <br /> Choco Museum - 0.2 km / 0.1 mi <br /> Museo del Hermano Pedro - 0.2 km / 0.1 mi <br /> House of the Giants - 0.3 km / 0.2 mi <br /> Central Park - 0.3 km / 0.2 mi <br /> Antigua Tabaco Compania S.A. - 0.3 km / 0.2 mi <br /> Antigua Guatemala Cathedral - 0.3 km / 0.2 mi <br /> Palace of the Captains-General - 0.3 km / 0.2 mi <br /> Las Capuchinas Convent - 0.4 km / 0.2 mi <br /> Palacio del Ayuntamiento - 0.4 km / 0.2 mi <br /> Museo del Libro Antiguo - 0.4 km / 0.2 mi <br /> El Fotografo Gallery - 0.4 km / 0.3 mi <br /> Church of San Francisco - 0.4 km / 0.3 mi <br /> </p><p>The nearest major airport is La Aurora Intl. Airport (GUA) - 40.4 km / 25.1 mi</p>,"<p>HeadLine : Near Santa Clara Convent</p><p>Location : With a stay at Hotel Casa Bella in Antigua Guatemala, you ll be just steps from Tanque La Unión and Santa Clara Convent.  This bed & breakfast is 0.5 mi (0.9 km) from Casa Santo Domingo Museum and 0.5 mi (0.9 km) from Central Park.</p><p>Rooms : Make yourself at home in one of the 8 guestrooms featuring minibars and Smart televisions. Complimentary wireless Internet access keeps you connected, and cable programming is available for your entertainment. Bathrooms have showers and hair dryers. Conveniences include phones and coffee/tea makers.</p><p>Dining : Grab a bite from the snack bar/deli serving guests of Hotel Casa Bella. Quench your thirst with your favorite drink at the bar/lounge. A complimentary continental breakfast is served daily.</p><p>CheckIn Instructions : <ul>  <li>Extra-person charges may apply and vary depending on property policy</li><li>Government-issued photo identification and a credit card, debit card, or cash deposit may be required at check-in for incidental charges</li><li>Special requests are subject to availability upon check-in and may incur additional charges; special requests cannot be guaranteed</li><li>Guests must contact this property in advance to reserve cribs/infant beds</li><li>This property accepts credit cards</li>  </ul></p><p>Special Instructions : This property offers transfers from the airport (surcharges may apply). Guests must contact the property with arrival details before travel, using the contact information on the booking confirmation. Front desk staff will greet guests on arrival.</p>",502-7-8324081,Airport transportation (surcharge) Luggage storage Free breakfast 24-hour front desk Free WiFi Number of bars/lounges - 1 Daily Garden Smoke-free property Snack bar/deli Accessible bathroom (in select rooms) Self parking (surcharge) Free continental breakfast Concierge services,14.555843|-90.731129,0-502-77904040,3001,http://www.thecasabellahotel.com
GT,Guatemala,109234,Antigua,1214163,Casa Ovalle,ThreeStar,"2a Avenida norte, 3 ANTIGUA ",,"This lovely hotel can be found in Antigua Guatemala. With a total of 9 guests rooms, this is a nice place to stay. Customers will not be bothered during their stay, as this is not a pet-friendly property.",+50278320275,Hotel,14.55692|-90.73096,100556643306,03001,http://www.hotelcasaovalle.com/
