countyCode,countyName,cityCode,cityName,HotelCode,HotelName,HotelRating,Address,Attractions,Description,FaxNumber,HotelFacilities,Map,PhoneNumber,PinCode,HotelWebsiteUrl
GT,Guatemala,109234,Antigua,1108033,Hotel Casa Noble,FourStar,Segunda Avenida Sur 29  ,,"Set in Antigua Guatemala and with Miraflores Museum reachable within 32 km, Casa Noble Hotel offers a tour desk, non-smoking rooms, a garden, free WiFi throughout the property and a terrace. The property is around 38 km from National Palace Guatemala, 38 km from Popol Vuh Museum and 1 km from Santa Catalina Arch. Private parking can be arranged at an extra charge.

Rooms are complete with a private bathroom equipped with a shower and a hairdryer, while certain units at the hotel also have a balcony. At Casa Noble Hotel all rooms come with a desk and a TV.

An American breakfast is available every morning at the accommodation.

With staff speaking English and Spanish, information is available at the reception.

Hobbitenango is 8.5 km from Casa Noble Hotel, while Pacaya Volcano is 38 km away. The nearest airport is La Aurora Airport, 38 km from the hotel.",+502(0)78320868,wifi Free WiFi Non-smoking throughout Daily housekeeping Private parking wifi available in all areas Outdoor furniture 24-hour security Key access Key card access Security alarm Fire extinguishers use of cleaning chemicals that are effective against coronavirus linens  towels and laundry washed in accordance with local authority guidelines guest accommodation is disinfected between stays Parking 24-hour front desk Garden Terrace Non-smoking rooms internet services Safety Deposit Box Tour desk guest accommodation sealed after cleaning physical distancing in dining areas food can be delivered to guest accommodation staff follow all safety protocols as directed by local authorities shared stationery such as printed menus  magazines  pens  and paper removed hand sanitizer in guest accommodation and key areas process in place to check health of guests first aid kit available physical distancing rules followed screens or physical barriers placed between staff and guests in appropriate areas invoice provided all plates  cutlery  glasses and other tableware have been sanitized guests have the option to cancel any cleaning services for their accommodation during their stay,14.55284|-90.7311,5 (027) 832-0864,03001,https://www.booking.com/hotel/gt/casanoble.html
GT,Guatemala,109234,Antigua,1108036,La Casa De Los Suenos,ThreeStar,1A Avenida Norte #1 AntiguaSacatepéquez ,Distances are displayed to the nearest 0.1 mile and kilometer. <br /> <p>Jade Maya Factory and Museum - 0.2 km / 0.2 mi <br /> House of the Giants - 0.3 km / 0.2 mi <br /> Tanque La Unión - 0.3 km / 0.2 mi <br /> Santa Clara Convent - 0.3 km / 0.2 mi <br /> Choco Museum - 0.3 km / 0.2 mi <br /> Church of San Francisco - 0.4 km / 0.2 mi <br /> Casa Santo Domingo Museum - 0.4 km / 0.2 mi <br /> Antigua Tabaco Compania S.A. - 0.4 km / 0.3 mi <br /> Central Park - 0.4 km / 0.3 mi <br /> Antigua Guatemala Colonial Art Museum - 0.4 km / 0.3 mi <br /> Antigua Guatemala Cathedral - 0.4 km / 0.3 mi <br /> Palace of the Captains-General - 0.5 km / 0.3 mi <br /> Museo del Hermano Pedro - 0.5 km / 0.3 mi <br /> Las Capuchinas Convent - 0.5 km / 0.3 mi <br /> Palacio del Ayuntamiento - 0.5 km / 0.3 mi <br /> </p><p>The preferred airport for La Casa de los Sueños is La Aurora Intl. Airport (GUA) - 39.9 km / 24.8 mi </p>,"<p>HeadLine : Near Jade Maya Factory and Museum</p><p>Location : With a stay at La Casa de los Sueños in Antigua Guatemala, you ll be within a 5-minute walk of Jade Maya Factory and Museum and House of the Giants.  This bed & breakfast is 0.3 mi (0.5 km) from Casa Santo Domingo Museum and 0.2 mi (0.4 km) from Antigua Tabaco Compania S.A..</p><p>Rooms : Make yourself at home in one of the 8 guestrooms. Complimentary wireless Internet access keeps you connected, and cable programming is available for your entertainment. Private bathrooms with bathtubs or showers feature complimentary toiletries and hair dryers. Conveniences include phones, as well as desks and coffee/tea makers.</p><p>Dining : A complimentary continental breakfast is served daily from 7 AM to 10 AM.</p><p>CheckIn Instructions : <ul>  <li>Extra-person charges may apply and vary depending on property policy</li><li>Government-issued photo identification and a credit card, debit card, or cash deposit may be required at check-in for incidental charges</li><li>Special requests are subject to availability upon check-in and may incur additional charges; special requests cannot be guaranteed</li><li>Be prepared: check the latest COVID-19 travel requirements and measures in place for this destination before you travel.</li>  </ul></p><p>Special Instructions : </p>",502-502-78329897,Library Picnic area Number of meeting rooms - 1 Daily Terrace Luggage storage Number of outdoor pools - 1 Free continental breakfast Concierge services Reception hall Free breakfast Tours/ticket assistance Free self parking Dry cleaning/laundry service Free WiFi Airport transportation (surcharge) Smoke-free property Bicycle rentals on site Garden,14.55657|-90.7297,502-78329898,03001,http://www.lacasadelossuenoshotel.com
GT,Guatemala,109234,Antigua,1154425,Museo Casa Santo Domingo,FourStar,3a Calle Oriente No. 28A AntiguaGuatemala ,Distances are displayed to the nearest 0.1 mile and kilometer. <br /> <p>Casa Santo Domingo Museum - 0.1 km / 0.1 mi <br /> Jade Maya Factory and Museum - 0.1 km / 0.1 mi <br /> Antigua Tabaco Compania S.A. - 0.3 km / 0.2 mi <br /> Las Capuchinas Convent - 0.4 km / 0.3 mi <br /> Choco Museum - 0.5 km / 0.3 mi <br /> Iglesia y Convento de Santo Domingo - 0.5 km / 0.3 mi <br /> Church of San Francisco - 0.6 km / 0.4 mi <br /> Museo del Libro Antiguo - 0.6 km / 0.4 mi <br /> House of the Giants - 0.6 km / 0.4 mi <br /> Central Park - 0.6 km / 0.4 mi <br /> Palacio del Ayuntamiento - 0.6 km / 0.4 mi <br /> Tanque La Unión - 0.7 km / 0.4 mi <br /> Santa Clara Convent - 0.7 km / 0.4 mi <br /> Santa Catalina Arch - 0.8 km / 0.5 mi <br /> Iglesia de la Candelaria - 0.8 km / 0.5 mi <br /> </p><p>The preferred airport for Hotel Museo Spa Casa Santo Domingo is La Aurora Intl. Airport (GUA) - 39.9 km / 24.8 mi </p>,"<p>HeadLine : Near Casa Santo Domingo Museum</p><p>Location : When you a stay at Hotel Museo Spa Casa Santo Domingo in Antigua Guatemala, you ll be in the historical district, just steps from Casa Santo Domingo Museum and Jade Maya Factory and Museum.  This 4.5-star hotel is 0.4 mi (0.6 km) from Central Park and 0.2 mi (0.3 km) from Antigua Tabaco Compania S.A..</p><p>Rooms : Make yourself at home in one of the 132 air-conditioned rooms featuring fireplaces and Smart televisions. Cable television is provided for your entertainment. Conveniences include phones, as well as safes and minibars.</p><p>Dining : Enjoy Fusion cuisine at El Refrectorio, one of the hotel s 2 restaurants, or stay in and take advantage of the room service (during limited hours). Relax with a refreshing drink from the poolside bar or one of the 2 bars/lounges. Full breakfasts are available daily from 7:00 AM to 11 AM for a fee.</p><p>CheckIn Instructions : <ul>  <li>Extra-person charges may apply and vary depending on property policy</li><li>Government-issued photo identification and a credit card may be required at check-in for incidental charges</li><li>Special requests are subject to availability upon check-in and may incur additional charges; special requests cannot be guaranteed</li><li>This property accepts credit cards and cash</li><li>This property reserves the right to pre-authorize the guest s credit card prior to arrival.</li><li>This property uses a grey water recycling system</li><li>Safety features at this property include a fire extinguisher, a smoke detector, and a first aid kit</li><li>Please note that cultural norms and guest policies may differ by country and by property; the policies listed are provided by the property</li>  </ul> <ul>  <li>This property charges a fee of USD 45 per night for use of the sofabed.</li>  </ul></p><p>Special Instructions : Front desk staff will greet guests on arrival. For more details, please contact the property using the information on the booking confirmation.</p>",502-78-20 12 21,Wheelchair-accessible meeting spaces/business center Safe-deposit box at front desk Smoke-free property Laundry facilities Sauna Steam room Dry cleaning/laundry service Free self parking Wheelchair accessible (may have limitations) Ziplining on site Showcase for local artists Fitness facilities Comprehensive recycling policy Conference space Grey water recycling system Hair salon Terrace ATM/banking Wheelchair accessible path of travel Concierge services Meeting rooms Wheelchair-accessible registration desk Free WiFi Number of bars/lounges - 2 Health club Number of poolside bars - 1 Number of outdoor pools - 1 Garden In-room accessibility (in select rooms) Wheelchair accessible parking Free newspapers in lobby Full-service spa Tours/ticket assistance Airport transportation (surcharge) Off-street parking Vegetable garden Energy-saving features in guest rooms Luggage storage Wheelchair-accessible on-site restaurant Express check-out Business center 24-hour front desk Water dispenser Electric car charging station Breakfast available (surcharge),14.558408|-90.728349,502-7-8201220,03001,https://www.casasantodomingo.com.gt/
GT,Guatemala,109234,Antigua,1162675,Hotel EuroMaya,FourStar,7Ma Calle Poniente No. 43 La Antigua Guatemala 2 03001 La Antigua Guatemala ,Distances are displayed to the nearest 0.1 mile and kilometer. <br /> <p>Antigua Market - 0.5 km / 0.3 mi <br /> San Jose el Viejo Ruins - 0.5 km / 0.3 mi <br /> Handicraft Market - 0.5 km / 0.3 mi <br /> El Fotografo Gallery - 0.6 km / 0.4 mi <br /> Palace of the Captains-General - 0.6 km / 0.4 mi <br /> Antigua Guatemala Colonial Art Museum - 0.6 km / 0.4 mi <br /> Antigua Guatemala Cathedral - 0.7 km / 0.5 mi <br /> Central Park - 0.7 km / 0.5 mi <br /> Santa Clara Convent - 0.8 km / 0.5 mi <br /> House of the Giants - 0.8 km / 0.5 mi <br /> Church of San Francisco - 0.8 km / 0.5 mi <br /> Old Textile Museum - 0.9 km / 0.5 mi <br /> Santa Catalina Arch - 0.9 km / 0.6 mi <br /> Choco Museum - 1 km / 0.6 mi <br /> Nim Po't Traditional Textiles Center - 1 km / 0.6 mi <br /> </p><p>The preferred airport for Hotel EuroMaya Suites is Guatemala City (GUA-La Aurora Intl.) - 41 km / 25.5 mi </p>,"<p><b>Property Location</b> <br />With a stay at Hotel EuroMaya Suites in Antigua Guatemala, you'll be within a 15-minute walk of La Merced Church and San Jose el Viejo Ruins.  This spa inn is 0.4 mi (0.6 km) from El Fotografo Gallery and 0.4 mi (0.6 km) from Antigua Guatemala Colonial Art Museum.</p><p><b>Rooms</b> <br />Stay in one of 11 guestrooms featuring LCD televisions. Digital television is provided for your entertainment. Private bathrooms with showers feature complimentary toiletries and hair dryers. Conveniences include desks and complimentary bottled water, and you can also request rollaway/extra beds (surcharge).</p><p><b>Amenities</b> <br />Relax at the full-service spa, where you can enjoy massages, body treatments, and facials. Additional amenities at this inn include complimentary wireless Internet access and tour/ticket assistance.</p><p><b>Dining</b> <br />Take advantage of the inn's room service (during limited hours). A complimentary full breakfast is served daily from 7 AM to 10:30 AM.</p><p><b>Business, Other Amenities</b> <br />Featured amenities include dry cleaning/laundry services and laundry facilities.</p>",502-000-78324722,Dry cleaning/laundry service Free WiFi Free breakfast Full-service spa Garden Laundry facilities Number of floors - 2 One meeting room Smoke-free property Spa services on site Spa treatment room(s) Terrace Total number of rooms - 11 Tours/ticket assistance,14.554236|-90.734374,(502) 78324722,03001,http://www.euromayasuites.com/euromayasuites/
GT,Guatemala,109234,Antigua,1162677,Casa Santa Rosa Hotel Boutique,ThreeStar,1A Calle Oriente No.11 Alameda Santa Rosa Alameda Santa RosaLa Antigua Guatemala ,Distances are displayed to the nearest 0.1 mile and kilometer. <br /> <p>Las Capuchinas Convent - 0.3 km / 0.2 mi <br /> Iglesia y Convento de Santo Domingo - 0.3 km / 0.2 mi <br /> Antigua Tabaco Compania S.A. - 0.4 km / 0.2 mi <br /> Iglesia de la Candelaria - 0.4 km / 0.3 mi <br /> Iglesia y Convento de Nuestra Señora de la Merced - 0.5 km / 0.3 mi <br /> La Merced Church - 0.5 km / 0.3 mi <br /> Casa Santo Domingo Museum - 0.5 km / 0.3 mi <br /> Nim Po t Traditional Textiles Center - 0.5 km / 0.3 mi <br /> Choco Museum - 0.5 km / 0.3 mi <br /> Santa Catalina Arch - 0.6 km / 0.3 mi <br /> Jade Maya Factory and Museum - 0.6 km / 0.4 mi <br /> Museo del Libro Antiguo - 0.7 km / 0.4 mi <br /> Palacio del Ayuntamiento - 0.7 km / 0.4 mi <br /> Central Park - 0.7 km / 0.4 mi <br /> Tanque La Unión - 0.7 km / 0.4 mi <br /> </p><p>The nearest major airport is La Aurora Intl. Airport (GUA) - 40.5 km / 25.2 mi</p>,"<p>HeadLine : Near Las Capuchinas Convent</p><p>Location : Located in Antigua Guatemala, Casa Santa Rosa Hotel Boutique is in the historical district, a 3-minute walk from Las Capuchinas Convent and 6 minutes by foot from La Merced Church.  This hotel is 0.4 mi (0.7 km) from Central Park and 0.5 mi (0.8 km) from Antigua Guatemala Cathedral.</p><p>Rooms : Make yourself at home in one of the 9 individually decorated guestrooms, featuring minibars and plasma televisions. Your Tempur-Pedic bed comes with down comforters and premium bedding. Rooms have private furnished balconies or patios. Complimentary wireless Internet access keeps you connected, and cable programming is available for your entertainment. Private bathrooms with showers feature complimentary toiletries and hair dryers.</p><p>Dining : A complimentary full breakfast is served daily from 8:00 AM to 10:00 AM.</p><p>CheckIn Instructions : <ul>  <li>Extra-person charges may apply and vary depending on property policy</li><li>Government-issued photo identification and a credit card may be required at check-in for incidental charges</li><li>Special requests are subject to availability upon check-in and may incur additional charges; special requests cannot be guaranteed</li><li>Minimum Spring Break check-in age is 18 years old</li><li>This property accepts credit cards and debit cards; cash is not accepted</li>  </ul></p><p>Special Instructions : This property offers transfers from the airport (surcharges may apply). To arrange pick-up, guests must contact the property 24 hours prior to arrival, using the contact information on the booking confirmation. The front desk is open daily from 8 AM - 6 PM. This property doesn t offer after-hours check-in. Front desk staff will greet guests on arrival.</p>",502-7-8320895,elevator Free self parking Concierge services Mountain biking nearby Free full breakfast Parking (limited spaces) Babysitting or childcare (surcharge) Free WiFi Garden Bicycle rentals nearby Free newspapers in lobby Wedding services Tours/ticket assistance Airport transportation (surcharge) Wheelchair accessible  no Luggage storage Free breakfast 24-hour front desk Daily Safe-deposit box at front desk Smoke-free property Ecotours nearby Hiking/biking trails nearby Laundry facilities,14.56085|-90.73031,+50278320391,03001,http://www.boutiquehotelsantarosa.com/indexgerman.htm
GT,Guatemala,109234,Antigua,1163012,Posada Doña Luisa,ThreeStar,7A Ave Norte #4 Antigua Guatemala ,Distances are displayed to the nearest 0.1 mile and kilometer. <br /> <p>Centro de Formación de la Cooperación Española - 0.1 km / 0.1 mi <br /> El Reposo Spa - 0.2 km / 0.1 mi <br /> Antiguo Colegio de la Compañía de Jesús - 0.2 km / 0.2 mi <br /> Monumento a Landívar - 0.3 km / 0.2 mi <br /> Antigua Market - 0.3 km / 0.2 mi <br /> El Fotografo Gallery - 0.3 km / 0.2 mi <br /> Central Park - 0.3 km / 0.2 mi <br /> Palace of the Captains-General - 0.3 km / 0.2 mi <br /> Handicraft Market - 0.4 km / 0.2 mi <br /> Antigua Guatemala Cathedral - 0.4 km / 0.3 mi <br /> Palacio del Ayuntamiento - 0.5 km / 0.3 mi <br /> Museo del Libro Antiguo - 0.5 km / 0.3 mi <br /> Santa Catalina Arch - 0.5 km / 0.3 mi <br /> Nim Po t Traditional Textiles Center - 0.6 km / 0.4 mi <br /> Antigua Guatemala Colonial Art Museum - 0.6 km / 0.4 mi <br /> </p><p>The preferred airport for Posada Doña Luisa is La Aurora Intl. Airport (GUA) - 40.6 km / 25.2 mi </p>,"<p>HeadLine : Near Antigua Market</p><p>Location : A stay at Posada Doña Luisa places you in the heart of Antigua Guatemala, steps from Centro de Formación de la Cooperación Española and 3 minutes by foot from El Reposo Spa.  This family-friendly guesthouse is 0.4 mi (0.7 km) from Central Park and 0.7 mi (1.2 km) from Casa Santo Domingo Museum.</p><p>Rooms : Make yourself at home in one of the 8 individually decorated guestrooms, featuring refrigerators and microwaves. Prepare your meals in the shared/communal kitchen. Cable television is provided for your entertainment. Private bathrooms with showers feature complimentary toiletries and hair dryers.</p><p>Dining : Grab a bite from the snack bar/deli, or stay in and take advantage of the guesthouse s room service.</p><p>CheckIn Instructions : <ul>  <li>Extra-person charges may apply and vary depending on property policy</li><li>Government-issued photo identification and a credit card, debit card, or cash deposit may be required at check-in for incidental charges</li><li>Special requests are subject to availability upon check-in and may incur additional charges; special requests cannot be guaranteed</li><li>This property accepts credit cards and debit cards; cash is not accepted</li>  </ul></p><p>Special Instructions : This property offers transfers from the airport (surcharges may apply). To arrange pick-up, guests must contact the property 24 hours prior to arrival, using the contact information on the booking confirmation. This property doesn t offer after-hours check-in. Front desk staff will greet guests on arrival.</p>",01150278323414,24-hour front desk Dry cleaning/laundry service Scooter/moped rentals nearby Distance from property (meters) - 200 Golfing nearby Mountain biking nearby Safe-deposit box at front desk Parking (limited spaces) Smoke-free property Babysitting or childcare (surcharge) Ecotours nearby Theme park shuttle (surcharge) Snack bar/deli Hiking/biking trails nearby Laundry facilities Hair salon Terrace Wheelchair accessible path of travel Concierge services Express check-in Shared microwave Shared refrigerator Garden Bicycle rentals nearby Free newspapers in lobby Tours/ticket assistance Shopping center shuttle (surcharge) Area shuttle (surcharge) Beach shuttle (surcharge) Airport transportation (surcharge) Luggage storage Distance from property (ft) - 656 Express check-out Grocery/convenience store Multilingual staff,14.556749|-90.736227,+50278323414,03001,http://www.hoteldonaluisa.com/
GT,Guatemala,109234,Antigua,1167457,Posada Don Valentino by AHS,ThreeStar,"5Th Calle Poniente, 28 Antigua ",,"Located 33 km from Miraflores Museum, Hotel Posada Don Valentino offers 3-star accommodation in Antigua Guatemala and features a garden, a shared lounge and a terrace. This 3-star hotel offers a tour desk. The accommodation provides a 24-hour front desk, airport transfers, a shared kitchen and free WiFi.

At the hotel every room is equipped with a private bathroom.

National Palace Guatemala is 38 km from Hotel Posada Don Valentino, while Popol Vuh Museum is 38 km away. The nearest airport is La Aurora Airport, 39 km from the accommodation.",00502 7832 0384,24-hour front desk Fire extinguishers use of cleaning chemicals that are effective against coronavirus linens  towels and laundry washed in accordance with local authority guidelines guest accommodation is disinfected between stays physical distancing in dining areas staff follow all safety protocols as directed by local authorities shared stationery such as printed menus  magazines  pens  and paper removed hand sanitizer in guest accommodation and key areas contactless check-in/check-out cashless payment available physical distancing rules followed invoice provided guests have the option to cancel any cleaning services for their accommodation during their stay Garden Terrace Non-smoking rooms Airport shuttle Laundry Family rooms internet services Tour desk wifi Free WiFi Non-smoking throughout designated smoking area Sun terrace Private check-in/check-out shuttle service (additional charge) airport shuttle (additional charge) Shared kitchen shared lounge/TV area Daily housekeeping airport pick up airport drop off Outdoor furniture Shuttle service 24-hour security CCTV in common areas CCTV outside property,14.55627|-90.73729,50278320384,03001,https://www.booking.com/hotel/gt/posada-don-valentino.html
GT,Guatemala,109234,Antigua,1182541,Casa Encantada,FourStar,9A Calle Pte. Esquina 1 Antigua Guatemala ,Distances are displayed to the nearest 0.1 mile and kilometer. <br /> <p>San Jose el Viejo Ruins - 0.1 km / 0.1 mi <br /> Central Park - 0.5 km / 0.3 mi <br /> El Fotografo Gallery - 0.5 km / 0.3 mi <br /> Museo del Hermano Pedro - 0.5 km / 0.3 mi <br /> Palace of the Captains-General - 0.5 km / 0.3 mi <br /> Antigua Guatemala Colonial Art Museum - 0.5 km / 0.3 mi <br /> Tanque La Unión - 0.5 km / 0.3 mi <br /> Iglesia de la Escuela de Cristo - 0.6 km / 0.4 mi <br /> Antigua Guatemala Cathedral - 0.6 km / 0.4 mi <br /> Santa Clara Convent - 0.6 km / 0.4 mi <br /> Palacio del Ayuntamiento - 0.6 km / 0.4 mi <br /> Museo del Libro Antiguo - 0.7 km / 0.4 mi <br /> House of the Giants - 0.7 km / 0.4 mi <br /> Centro de Formación de la Cooperación Española - 0.7 km / 0.5 mi <br /> Church of San Francisco - 0.8 km / 0.5 mi <br /> </p><p>The nearest major airport is La Aurora Intl. Airport (GUA) - 40.8 km / 25.4 mi</p>,"<p>HeadLine : Near San Jose el Viejo Ruins</p><p>Location : A stay at Casa Encantada by Porta Hotels places you in the heart of Antigua Guatemala, steps from San Jose el Viejo Ruins and 6 minutes by foot from Central Park.  This 4-star bed & breakfast is 0.9 mi (1.5 km) from Casa Santo Domingo Museum and 0.3 mi (0.5 km) from El Fotografo Gallery.</p><p>Rooms : Make yourself at home in one of the 10 individually decorated guestrooms. Your pillowtop bed comes with down comforters and Egyptian cotton sheets. Complimentary wireless Internet access keeps you connected, and cable programming is available for your entertainment. Private bathrooms have complimentary toiletries and hair dryers.</p><p>Dining : Enjoy a meal at the restaurant, or stay in and take advantage of the bed & breakfast s room service (during limited hours). Quench your thirst with your favorite drink at the bar/lounge. Local cuisine breakfasts are available daily from 7:00 AM to 10:00 AM for a fee.</p><p>CheckIn Instructions : <ul>  <li>Extra-person charges may apply and vary depending on property policy</li><li>Government-issued photo identification and a credit card, debit card, or cash deposit may be required at check-in for incidental charges</li><li>Special requests are subject to availability upon check-in and may incur additional charges; special requests cannot be guaranteed</li><li>This property accepts credit cards, debit cards, and cash</li><li>Noise-free guestrooms cannot be guaranteed</li><li>Safety features at this property include a fire extinguisher, a security system, a first aid kit, and window guards</li>  </ul></p><p>Special Instructions : This property offers transfers from the airport (surcharges may apply). To arrange pick-up, guests must contact the property 48 hours prior to arrival, using the contact information on the booking confirmation. Front desk staff will greet guests on arrival.</p>",502-7832-7908,Dry cleaning/laundry service Comprehensive recycling policy Proposal/romance packages available Vegetarian breakfast available Free parking nearby Babysitting or childcare (surcharge) Locally-owned & organized tours & activities Free WiFi Number of bars/lounges - 1 Number of outdoor pools - 1 Garden Bicycle rentals nearby Free use of nearby fitness center Free newspapers in lobby Wedding services Tours/ticket assistance Fireplace in lobby Airport transportation - pickup (surcharge) Energy-saving features in guest rooms LED light bulbs Water dispenser use by guests actively encouraged Wheelchair accessible  no Luggage storage Vegetarian menu options available Express check-out Multilingual staff 24-hour front desk Water dispenser Breakfast available (surcharge) Scooter/moped rentals nearby Golfing nearby Spa services on site Safe-deposit box at front desk Smoke-free property Ecotours nearby Coffee/tea in common areas Snack bar/deli Terrace Pool sun loungers Locally-sourced food on site (80% or more) Sustainability/community reinvestment (10% revenue or more) Concierge services Guest education on local ecosystems and culture,14.552258|-90.734322,502-7832-7905,03001,http://www.casaencantada-antigua.com
