countyCode,countyName,cityCode,cityName,HotelCode,HotelName,HotelRating,Address,Attractions,Description,FaxNumber,HotelFacilities,Map,PhoneNumber,PinCode,HotelWebsiteUrl
GT,Guatemala,109234,Antigua,1260272,Las Iglesias,ThreeStar,"2A AVENIDA SUR, 44B ANTIGUA GUATEMALA ",,"This charming hotel boasts a unique location in the heart of Antigua Guatemala, a city in the central highlands of Guatemala, famous for its well-preserved Spanish Baroque influenced architecture and spectacular ruins of colonial churches. Guests will find themselves close to some of the most important tourist sites in the city, such as the Santa Clara Convent and Choco Museum. This property welcomes guests with traditional hospitality and attention to detail, creating a comfortable homely atmosphere. The accommodation units provide all the necessary modern services and amenities to guarantee a restful stay, such as complimentary Wi-Fi internet connection and bottled water. Tastefully decorated and finely furnished, the guest rooms are ideal to take a good rest in the middle of a busy tourist day.",,Hotel American Express MasterCard Visa Bathroom Shower Hairdryer Direct dial telephone TV Terrace Mobile phone coverage Garden,14.554642515056042|-90.731131137434375,,,www.lasiglesiashotel.com
GT,Guatemala,109234,Antigua,1296758,Casa Madeleine Boutique Hotel and Spa,ThreeStar,69 Calle del Espiritu Santo 03001 Antigua ,Distances are displayed to the nearest 0.1 mile and kilometer. <br /> <p>Cementerio General - 0.2 km / 0.1 mi <br /> San Lazaro General Cemetery - 0.2 km / 0.1 mi <br /> Handicraft Market - 0.6 km / 0.4 mi <br /> Monumento a Landívar - 0.6 km / 0.4 mi <br /> Antigua Market - 0.7 km / 0.4 mi <br /> La Recoleccion - 0.8 km / 0.5 mi <br /> Centro de Formación de la Cooperación Española - 1 km / 0.6 mi <br /> San Jose el Viejo Ruins - 1 km / 0.6 mi <br /> Central Park - 1 km / 0.6 mi <br /> El Fotografo Gallery - 1 km / 0.7 mi <br /> Colegio de San Jerónimo - 1.1 km / 0.7 mi <br /> El Reposo Spa - 1.1 km / 0.7 mi <br /> Palace of the Captains-General - 1.1 km / 0.7 mi <br /> Old Textile Museum - 1.1 km / 0.7 mi <br /> Antigua Guatemala Colonial Art Museum - 1.1 km / 0.7 mi <br /> </p><p>The nearest major airport is La Aurora Intl. Airport (GUA) - 41.4 km / 25.7 mi</p>,"<p>HeadLine : Near Cementerio General</p><p>Location : With a stay at Casa Madeleine Boutique Hotel & Spa in Antigua Guatemala, you ll be within a 5-minute walk of Cementerio General and San Lazaro General Cemetery.  This hotel is 0.7 mi (1.1 km) from Central Park and 1.3 mi (2 km) from Casa Santo Domingo Museum.</p><p>Rooms : Make yourself at home in one of the 6 guestrooms featuring minibars and flat-screen televisions. Complimentary wireless Internet access keeps you connected, and cable programming is available for your entertainment. Private bathrooms with showers feature hair dryers and bathrobes. Conveniences include safes and complimentary bottled water, and housekeeping is provided daily.</p><p>Dining : Enjoy a meal at the restaurant, or stay in and take advantage of the hotel s room service (during limited hours). A complimentary cooked-to-order breakfast is included.</p><p>CheckIn Instructions : <ul>  <li>Extra-person charges may apply and vary depending on property policy</li><li>Government-issued photo identification and a credit card, debit card, or cash deposit may be required at check-in for incidental charges</li><li>Special requests are subject to availability upon check-in and may incur additional charges; special requests cannot be guaranteed</li><li>This property accepts credit cards; cash is not accepted</li><li>Safety features at this property include a fire extinguisher, a smoke detector, and a first aid kit</li>  </ul></p><p>Special Instructions : This property offers transfers from the airport (surcharges may apply). Guests must contact the property with arrival details before travel, using the contact information on the booking confirmation. There is no front desk at this property. This property doesn t offer after-hours check-in. The host will greet guests on arrival.</p>",502-7-8329348,Airport transportation (surcharge) Wheelchair accessible (may have limitations) Free breakfast Wheelchair-accessible registration desk Free WiFi Spa services on site Garden Smoke-free property In-room accessibility (in select rooms) Tours/ticket assistance Accessible bathroom (in select rooms) Free self parking Terrace Free Cooked-to-Order Breakfast Concierge services,14.554397|-90.741768,+502 7 8329358,03001,http://www.casamadeleine.com
GT,Guatemala,109234,Antigua,1296765,El Convento Boutique Hotel,FourStar,2Da Avenida Norte #11 Antigua Guatemala Antigua Guatemala ,Distances are displayed to the nearest 0.1 mile and kilometer. <br /> <p>Las Capuchinas Convent - 0.1 km / 0.1 mi <br /> Antigua Tabaco Compania S.A. - 0.3 km / 0.2 mi <br /> Iglesia y Convento de Nuestra Señora de la Merced - 0.4 km / 0.2 mi <br /> La Merced Church - 0.4 km / 0.3 mi <br /> Choco Museum - 0.4 km / 0.3 mi <br /> Iglesia y Convento de Santo Domingo - 0.4 km / 0.3 mi <br /> Nim Po t Traditional Textiles Center - 0.5 km / 0.3 mi <br /> Santa Catalina Arch - 0.5 km / 0.3 mi <br /> Casa Santo Domingo Museum - 0.5 km / 0.3 mi <br /> Iglesia de la Candelaria - 0.6 km / 0.3 mi <br /> Museo del Libro Antiguo - 0.6 km / 0.4 mi <br /> Palacio del Ayuntamiento - 0.6 km / 0.4 mi <br /> Central Park - 0.6 km / 0.4 mi <br /> Tanque La Unión - 0.6 km / 0.4 mi <br /> Santa Clara Convent - 0.6 km / 0.4 mi <br /> </p><p>The preferred airport for El Convento Boutique Hotel is La Aurora Intl. Airport (GUA) - 40.4 km / 25.1 mi </p>,"<p>HeadLine : Near Las Capuchinas Convent</p><p>Location : A stay at El Convento Boutique Hotel places you in the heart of Antigua Guatemala, steps from Las Capuchinas Convent and 3 minutes by foot from Antigua Tabaco Compania S.A..  This 4-star hotel is 0.4 mi (0.6 km) from Central Park and 0.6 mi (0.9 km) from Casa Santo Domingo Museum.</p><p>Rooms : Make yourself at home in one of the 25 air-conditioned rooms featuring fireplaces. Complimentary wireless Internet access is available to keep you connected. Conveniences include phones, as well as safes and desks.</p><p>Dining : Satisfy your appetite for lunch or dinner at the hotel s restaurant, Restaurante El Convento, or stay in and take advantage of the room service (during limited hours). Quench your thirst with your favorite drink at the bar/lounge. A complimentary full breakfast is served daily from 7:00 AM to 10:00 AM.</p><p>CheckIn Instructions : <ul>  <li>Extra-person charges may apply and vary depending on property policy</li><li>Government-issued photo identification and a credit card, debit card, or cash deposit may be required at check-in for incidental charges</li><li>Special requests are subject to availability upon check-in and may incur additional charges; special requests cannot be guaranteed</li><li>This property accepts credit cards and cash</li><li>Safety features at this property include a carbon monoxide detector, a fire extinguisher, a smoke detector, a security system, a first aid kit, and window guards</li>  </ul></p><p>Special Instructions : This property offers transfers from the airport (surcharges may apply). Guests must contact the property with arrival details before travel, using the contact information on the booking confirmation. If you are planning to arrive after 11:30 PM please contact the property in advance using the information on the booking confirmation. Front desk staff will greet guests on arrival.</p>",50223329770,Dry cleaning/laundry service Wheelchair accessible (may have limitations) Free full breakfast Proposal/romance packages available Parking (limited spaces) Reception hall Number of meeting rooms - 1 Wheelchair-accessible registration desk Free WiFi Wheelchair-accessible pool Number of bars/lounges - 1 Wheelchair-accessible public washroom Number of outdoor pools - 1 Well-lit path to entrance Upper floors accessible by stairs only Garden Bicycle rentals nearby Internet access in public areas - high speed Wheelchair accessible parking Internet access - wireless Wedding services Accessible bathroom (in select rooms) Airport transportation (surcharge) Couples/private dining Luggage storage Wheelchair-accessible on-site restaurant Free breakfast Porter/bellhop Multilingual staff Handrails in stairways 24-hour front desk Daily Safe-deposit box at front desk Smoke-free property Laundry facilities Free self parking Terrace Concierge services,14.560594|-90.731026,502-772-07272,03001,http://www.elconventoantigua.com/
GT,Guatemala,109234,Antigua,1296775,Posada Hermano Pedro,TwoStar,3 Calle 3 Antigua Guatemala ,Distances are displayed to the nearest 0.1 mile and kilometer. <br /> <p>Choco Museum - 0.1 km / 0.1 mi <br /> Antigua Tabaco Compania S.A. - 0.1 km / 0.1 mi <br /> Central Park - 0.2 km / 0.1 mi <br /> Palacio del Ayuntamiento - 0.2 km / 0.1 mi <br /> Museo del Libro Antiguo - 0.2 km / 0.1 mi <br /> Antigua Guatemala Cathedral - 0.2 km / 0.1 mi <br /> Las Capuchinas Convent - 0.3 km / 0.2 mi <br /> Tanque La Unión - 0.3 km / 0.2 mi <br /> Antigua Guatemala Colonial Art Museum - 0.3 km / 0.2 mi <br /> Palace of the Captains-General - 0.3 km / 0.2 mi <br /> Museo del Hermano Pedro - 0.3 km / 0.2 mi <br /> El Fotografo Gallery - 0.4 km / 0.2 mi <br /> Santa Clara Convent - 0.4 km / 0.3 mi <br /> Santa Catalina Arch - 0.4 km / 0.3 mi <br /> Antiguo Colegio de la Compañía de Jesús - 0.4 km / 0.3 mi <br /> </p><p>The preferred airport for Hotel Posada del Hermano Pedro is La Aurora Intl. Airport (GUA) - 40.5 km / 25.2 mi </p>,"<p>HeadLine : Near Choco Museum</p><p>Location : With a stay at Hotel Posada del Hermano Pedro in Antigua Guatemala, you ll be just steps from Choco Museum and Antigua Tabaco Compania S.A..  This hotel is 0.2 mi (0.3 km) from Central Park and 0.7 mi (1.1 km) from Casa Santo Domingo Museum.</p><p>Rooms : Make yourself at home in one of the 56 guestrooms. Complimentary wireless Internet access keeps you connected, and cable programming is available for your entertainment. Bathrooms with showers are provided. Conveniences include safes, and housekeeping is provided daily.</p><p>Dining : You can enjoy a meal at Posada del Hermano Pedro serving the guests of Hotel Posada del Hermano Pedro, or stop in at the snack bar/deli. A complimentary continental breakfast is served daily from 7 AM to 10 AM.</p><p>CheckIn Instructions : <ul>  <li>Extra-person charges may apply and vary depending on property policy</li><li>Government-issued photo identification and a credit card, debit card, or cash deposit may be required at check-in for incidental charges</li><li>Special requests are subject to availability upon check-in and may incur additional charges; special requests cannot be guaranteed</li><li>This property accepts credit cards</li><li>Safety features at this property include a fire extinguisher</li>  </ul></p><p>Special Instructions : Front desk staff will greet guests on arrival.</p>",502-502-77905100,Concierge services Wheelchair accessible path of travel Free continental breakfast Terrace Tours/ticket assistance Snack bar/deli Smoke-free property Safe-deposit box at front desk Garden Daily Library Free WiFi 24-hour front desk Meeting rooms Free breakfast Luggage storage Ballroom,14.557819|-90.732184,502-502-77905100,00000,http://www.hotelposadahermanopedro.com/
GT,Guatemala,109234,Antigua,1297622,Hotel Lo De Bernal,ThreeStar,1 Calle Poniente 23 La Antigua GuatemalaGuatemala ,Distances are displayed to the nearest 0.1 mile and kilometer. <br /> <p>Old Textile Museum - 0.2 km / 0.1 mi <br /> La Merced Church - 0.3 km / 0.2 mi <br /> Nim Po t Traditional Textiles Center - 0.4 km / 0.2 mi <br /> La Recoleccion - 0.4 km / 0.2 mi <br /> Santa Catalina Arch - 0.4 km / 0.3 mi <br /> Antigua Market - 0.6 km / 0.4 mi <br /> Handicraft Market - 0.6 km / 0.4 mi <br /> Central Park - 0.7 km / 0.4 mi <br /> El Fotografo Gallery - 0.7 km / 0.5 mi <br /> Las Capuchinas Convent - 0.8 km / 0.5 mi <br /> Palace of the Captains-General - 0.8 km / 0.5 mi <br /> Antigua Guatemala Cathedral - 0.9 km / 0.5 mi <br /> Choco Museum - 1 km / 0.6 mi <br /> Antigua Guatemala Colonial Art Museum - 1 km / 0.6 mi <br /> Tanque La Unión - 1.1 km / 0.7 mi <br /> </p><p>The preferred airport for Hotel Lo De Bernal is La Aurora Intl. Airport (GUA) - 41 km / 25.5 mi </p>,"<p>HeadLine : Near Santa Catalina Arch</p><p>Location : A stay at Hotel Lo De Bernal places you in the heart of Antigua Guatemala, within a 5-minute walk of La Merced Church and Santa Catalina Arch.  This hotel is 0.5 mi (0.8 km) from Las Capuchinas Convent and 0.5 mi (0.8 km) from Antigua Guatemala Cathedral.</p><p>Rooms : Stay in one of 9 guestrooms featuring flat-screen televisions. Complimentary wireless Internet access keeps you connected, and cable programming is available for your entertainment. Bathrooms have complimentary toiletries and hair dryers. Conveniences include safes and complimentary bottled water, and housekeeping is provided daily.</p><p>Dining : At Hotel Lo De Bernal, enjoy a satisfying meal at the restaurant. A complimentary continental breakfast is served daily from 7 AM to 10 AM.</p><p>CheckIn Instructions : Extra-person charges may apply and vary depending on property policy. <br />Government-issued photo identification and a credit card, debit card, or cash deposit may be required at check-in for incidental charges. <br />Special requests are subject to availability upon check-in and may incur additional charges. Special requests cannot be guaranteed. <ul> </ul></p><p>Special Instructions : Front desk staff will greet guests on arrival.</p>",502-783-23244,Multilingual staff Garden Computer station Smoke-free property Airport transportation (surcharge) Wheelchair accessible parking Free WiFi Free self parking Restaurant Business center Free breakfast Reception hall 24-hour front desk Concierge services Free parking nearby Luggage storage Terrace,14.56076|-90.736807,502-783-23242,1,http://www.lodebernal.com/
GT,Guatemala,109234,Antigua,1297624,Hotel Casa Rustica By Ahs,ThreeStar,6A Avenida Norte 8 03001 Antigua Guatemala ,,"Hotel Casa Rustica is just a 2-minute walk from Antigua Guatemalas Central Park and a 5-minute walk  to La Merced Church. It offers free Wi-Fi, a shared kitchen and charming gardens and terraces with wonderful volcano views.

All rooms at the Casa Rustica overlook the gardens and include a TV, desk and safe. Some rooms have a private bathroom, hairdryer and free toiletries, while others offer access to shared bathrooms.

At Hotel Casa Rustica you will find outdoor seating areas and a 24-hour front desk with a travel service. Off-site Parking is available at an extra cost.

A wide range of bars, restaurants and museums can be found in the streets around the Casa Rustic. The Agua Volcano is 4 km away, while Guatemala City and La Aurora International Airport are within 40 km. Guests are required to show a photo identification and credit card upon check-in. Please note that all Special Requests are subject to availability and additional charges may apply.
The payment of your reservation is made in the propertys local currency (quetzales). The displayed amount in the currency you choose is indicative and based on the exchange rate at the time the booking was confirmed.

When reserving 3 nights you get a free 1 day pool pass per person, if you reserve 5 or more nights you get 2 (two) 1 day pool passes per person. The free pool pass is only valid if someone reserves nights in, April, May, June, August, September and October. It doesnt apply, on high season or Holidays.

Please note a 6% fee will be charged when paying with credit card.",502-7832-0694,hand sanitizer in guest accommodation and key areas process in place to check health of guests first aid kit available contactless check-in/check-out cashless payment available physical distancing rules followed all plates  cutlery  glasses and other tableware have been sanitized guests have the option to cancel any cleaning services for their accommodation during their stay delivered food is securely covered face masks for guests available Key access 24-hour security Live sport events (broadcast) Cooking class Tour or class about local culture Bike tours Walking tours Shuttle service Full body massage Picnic area Outdoor furniture Sun umbrellas sun loungers or beach chairs coffee house on site Pet bowls Pet basket airport drop off airport pick up Fruits Wine/champagne Public transport tickets Kid meals board games/puzzles Public Bath wifi available in all areas Private parking Daily housekeeping shared lounge/TV area Shared kitchen airport shuttle (additional charge) shuttle service (additional charge) Private check-in/check-out concierge service Sun terrace Snack Bar designated smoking area Non-smoking throughout Free WiFi wifi Luggage storage Horse riding Fax/photocopying Tour desk Car hire Hiking Billiards Massage Currency exchange Safety Deposit Box express check-in/check-out internet services Family rooms Laundry Airport shuttle Non-smoking rooms Terrace Garden Sauna 24-hour front desk meeting/banquet facilities Room service Pets allowed Restaurant Parking staff follow all safety protocols as directed by local authorities food can be delivered to guest accommodation physical distancing in dining areas guest accommodation sealed after cleaning guest accommodation is disinfected between stays linens  towels and laundry washed in accordance with local authority guidelines use of cleaning chemicals that are effective against coronavirus bicycle rental Fire extinguishers CCTV outside property CCTV in common areas Smoke alarms Security alarm,14.55682|-90.73532,01150278323709,03001,https://www.booking.com/hotel/gt/casa-rustica.html
GT,Guatemala,109234,Antigua,1303074,Hotel El Carmen,ThreeStar,3A. Avenida Norte #9 La Antigua Guatemala ,Distances are displayed to the nearest 0.1 mile and kilometer. <br /> <p>Choco Museum - 0.1 km / 0.1 mi <br /> Antigua Tabaco Compania S.A. - 0.1 km / 0.1 mi <br /> Central Park - 0.2 km / 0.1 mi <br /> Palacio del Ayuntamiento - 0.2 km / 0.1 mi <br /> Museo del Libro Antiguo - 0.2 km / 0.1 mi <br /> Antigua Guatemala Cathedral - 0.2 km / 0.1 mi <br /> Las Capuchinas Convent - 0.3 km / 0.2 mi <br /> Tanque La Unión - 0.3 km / 0.2 mi <br /> Antigua Guatemala Colonial Art Museum - 0.3 km / 0.2 mi <br /> Palace of the Captains-General - 0.3 km / 0.2 mi <br /> Museo del Hermano Pedro - 0.3 km / 0.2 mi <br /> El Fotografo Gallery - 0.4 km / 0.2 mi <br /> Santa Catalina Arch - 0.4 km / 0.3 mi <br /> Santa Clara Convent - 0.4 km / 0.3 mi <br /> Antiguo Colegio de la Compañía de Jesús - 0.4 km / 0.3 mi <br /> </p><p>The nearest major airport is La Aurora Intl. Airport (GUA) - 40.5 km / 25.2 mi</p>,"<p>HeadLine : Near Choco Museum</p><p>Location : A stay at El Carmen Hotel places you in the heart of Antigua Guatemala, steps from Choco Museum and Antigua Tabaco Compania S.A..  This hotel is 0.2 mi (0.3 km) from Central Park and 0.7 mi (1.1 km) from Casa Santo Domingo Museum.</p><p>Rooms : Make yourself at home in one of the 22 air-conditioned rooms featuring flat-screen televisions. Your Tempur-Pedic bed comes with down comforters and Egyptian cotton sheets. Complimentary wireless Internet access keeps you connected, and cable programming is available for your entertainment. Private bathrooms with showers feature complimentary toiletries and hair dryers.</p><p>Dining : Enjoy a meal at the restaurant or snacks in the coffee shop/cafe. The hotel also offers room service (during limited hours). Quench your thirst with your favorite drink at the bar/lounge. A complimentary cooked-to-order breakfast is served daily from 7:00 AM to 11:00 AM.</p><p>CheckIn Instructions : <ul>  <li>Extra-person charges may apply and vary depending on property policy</li><li>Government-issued photo identification and a credit card, debit card, or cash deposit may be required at check-in for incidental charges</li><li>Special requests are subject to availability upon check-in and may incur additional charges; special requests cannot be guaranteed</li><li>This property accepts credit cards, debit cards, and cash</li><li>Noise-free guestrooms cannot be guaranteed</li><li>Safety features at this property include a fire extinguisher, a security system, and a first aid kit</li>  </ul></p><p>Special Instructions : This property offers transfers from the airport (surcharges may apply). Guests must contact the property with arrival details before travel, using the contact information on the booking confirmation. Front desk staff will greet guests on arrival.</p>",502-78323847,Tours/ticket assistance Accessible bathroom (in select rooms) Free Cooked-to-Order Breakfast Rooftop terrace Airport transportation (surcharge) Couples/private dining Luggage storage Distance from property (ft) - 984 Free breakfast Multilingual staff Handrails in stairways 24-hour front desk Daily Spa services on site Distance from property (meters) - 300 Wheelchair accessible (may have limitations) Proposal/romance packages available Free parking nearby Number of meeting rooms - 1 Wheelchair-accessible registration desk Free WiFi Number of bars/lounges - 1 Garden In-room accessibility (in select rooms) Stair-free path to entrance Roll-in shower (in select rooms) Wedding services Concierge services Terrace Free self parking Laundry facilities Number of coffee shops/cafes - 1 Smoke-free property Safe-deposit box at front desk,14.557835|-90.732187,+502 78323850,03100,http://elcarmenhotel.com/
GT,Guatemala,109234,Antigua,1310683,Hotel La Casona De Antigua,ThreeStar,Calle De Los Duelos Residenciales Dona Beatriz  ,Distances are displayed to the nearest 0.1 mile and kilometer. <br /> <p>Iglesia y Convento de Santo Domingo - 0.2 km / 0.1 mi <br /> Casa Santo Domingo Museum - 0.4 km / 0.3 mi <br /> Jade Maya Factory and Museum - 0.5 km / 0.3 mi <br /> Iglesia de la Candelaria - 0.6 km / 0.4 mi <br /> Las Capuchinas Convent - 0.6 km / 0.4 mi <br /> Antigua Tabaco Compania S.A. - 0.8 km / 0.5 mi <br /> Choco Museum - 0.9 km / 0.6 mi <br /> Church of San Francisco - 0.9 km / 0.6 mi <br /> Iglesia y Convento de Nuestra Señora de la Merced - 1 km / 0.6 mi <br /> House of the Giants - 1 km / 0.6 mi <br /> La Merced Church - 1 km / 0.6 mi <br /> Tanque La Unión - 1 km / 0.6 mi <br /> Santa Catalina Arch - 1 km / 0.6 mi <br /> Santa Clara Convent - 1 km / 0.6 mi <br /> Nim Po t Traditional Textiles Center - 1 km / 0.6 mi <br /> </p><p>The preferred airport for Hotel La Casona de Antigua is La Aurora Intl. Airport (GUA) - 39.6 km / 24.6 mi </p>,"<p>HeadLine : Near Iglesia y Convento de Santo Domingo</p><p>Location : With a stay at Hotel La Casona de Antigua in Antigua Guatemala, you ll be a 2-minute walk from Iglesia y Convento de Santo Domingo and 5 minutes by foot from Casa Santo Domingo Museum.  This hotel is 0.7 mi (1 km) from Central Park and 0.4 mi (0.6 km) from Iglesia de la Candelaria.</p><p>Rooms : Stay in one of 10 guestrooms featuring plasma televisions. Complimentary wireless Internet access keeps you connected, and cable programming is available for your entertainment. Private bathrooms with shower/tub combinations feature deep soaking bathtubs and rainfall showerheads. Conveniences include desks and complimentary bottled water, and housekeeping is provided daily.</p><p>Dining : At Hotel La Casona de Antigua, enjoy a satisfying meal at the restaurant. A complimentary local cuisine breakfast is served daily from 7 AM to 10 AM.</p><p>CheckIn Instructions : <ul>  <li>Extra-person charges may apply and vary depending on property policy</li><li>Government-issued photo identification and a credit card, debit card, or cash deposit may be required at check-in for incidental charges</li><li>Special requests are subject to availability upon check-in and may incur additional charges; special requests cannot be guaranteed</li><li>This property accepts credit cards</li><li>Onsite parties or group events are strictly prohibited</li>  </ul></p><p>Special Instructions : This property offers transfers from the airport (surcharges may apply). Guests must contact the property with arrival details before travel, using the contact information on the booking confirmation. To make arrangements for check-in please contact the property at least 48 hours before arrival using the information on the booking confirmation. If you are planning to arrive after 11:00 PM please contact the property in advance using the information on the booking confirmation. Guests must contact the property in advance for check-in instructions. Front desk staff will greet guests on arrival. For more details, please contact the property using the information on the booking confirmation.</p>",502-502-78328288,Airport transportation (surcharge) Wheelchair accessible  no Luggage storage Free breakfast Multilingual staff Free breakfast (local cuisine) 24-hour front desk Daily Safe-deposit box at front desk Free self parking Terrace Concierge services Dry cleaning/laundry service Number of stairs to reach property - 2 Banquet hall Gravel flooring in public areas Cobblestone flooring in public areas Free WiFi Designated smoking areas Upper floors accessible by stairs only Garden Wedding services Tours/ticket assistance,14.55983|-90.72656,502-502-78328288,03001,
