countyCode,countyName,cityCode,cityName,HotelCode,HotelName,HotelRating,Address,Attractions,Description,FaxNumber,HotelFacilities,Map,PhoneNumber,PinCode,HotelWebsiteUrl
HK,Hong Kong,145656,Hong Kong,1004766,Ovolo Central,FourStar,2 Arbuthnot Road Central CentralHong Kong ,Distances are displayed to the nearest 0.1 mile and kilometer. <br /> <p>Lan Kwai Fong - 0.1 km / 0.1 mi <br /> Hollywood Road - 0.1 km / 0.1 mi <br /> Tai Kwun - Centre for Heritage and Arts - 0.2 km / 0.1 mi <br /> Mid-levels Escalators - 0.3 km / 0.2 mi <br /> Soho - 0.3 km / 0.2 mi <br /> HSBC Hong Kong Headquarter Building - 0.7 km / 0.4 mi <br /> IFC Mall - 0.7 km / 0.4 mi <br /> The Peak Tram - 0.7 km / 0.5 mi <br /> International Finance Centre - 0.8 km / 0.5 mi <br /> Hong Kong Park - 0.9 km / 0.6 mi <br /> The Hong Kong Observation Wheel - 1.1 km / 0.7 mi <br /> Hong Kong - Macau Ferry Terminal - 1.2 km / 0.7 mi <br /> Central Ferry Piers - 1.3 km / 0.8 mi <br /> Pacific Place - 1.4 km / 0.9 mi <br /> Central Harbourfront Event Space - 1.5 km / 0.9 mi <br /> </p><p>The preferred airport for Ovolo Central is Hong Kong International Airport (HKG) - 37.5 km / 23.3 mi </p>,"<p>HeadLine : In Hong Kong (Central & Western District)</p><p>Location : With a stay at Ovolo Central in Hong Kong (Central & Western District), you ll be steps from Lan Kwai Fong and 4 minutes by foot from Soho.  This 4-star hotel is 0.5 mi (0.8 km) from The Peak Tram and 0.9 mi (1.5 km) from IFC Mall.</p><p>Rooms : Make yourself at home in one of the 41 air-conditioned rooms featuring refrigerators and free minibar items. Wired and wireless Internet access is complimentary, while 42-inch LCD televisions with cable programming provide entertainment. Private bathrooms with showers feature designer toiletries and hair dryers. Conveniences include safes and desks, and housekeeping is provided daily.</p><p>Dining : You can enjoy a meal at VEDA serving the guests of Ovolo Central, or stop in at the snack bar/deli. Wrap up your day with a drink at the bar/lounge. Continental breakfasts are available daily from 7:30 AM to 10 AM for a fee.</p><p>CheckIn Instructions : <ul>  <li>Extra-person charges may apply and vary depending on property policy</li><li>Government-issued photo identification and a credit card may be required at check-in for incidental charges</li><li>Special requests are subject to availability upon check-in and may incur additional charges; special requests cannot be guaranteed</li><li>This property accepts credit cards and cash</li><li>Onsite parties or group events are strictly prohibited</li><li>Safety features at this property include a fire extinguisher, a smoke detector, a security system, and a first aid kit</li>  </ul></p><p>Special Instructions : Front desk staff will greet guests on arrival.</p>",852-37553006,Dry cleaning/laundry service Luggage storage Reception hall Meeting rooms 24-hour front desk Breakfast available (surcharge) Free WiFi Number of bars/lounges - 1 Safe-deposit box at front desk Smoke-free property In-room accessibility (in select rooms) Snack bar/deli Laundry facilities Free newspapers in lobby Roll-in shower (in select rooms) Tours/ticket assistance Accessible bathroom (in select rooms) elevator Concierge services,22.280249|114.154499,+852-3755-3000,N A,http://www.ovologroup.com
HK,Hong Kong,145656,Hong Kong,1004767,Mia Casa Hotel,ThreeStar,2 Hau Wo Street Kennedy Town Kennedy TownHong Kong ,Distances are displayed to the nearest 0.1 mile and kilometer. <br /> <p>Victoria Harbour - 0.7 km / 0.4 mi <br /> University of Hong Kong - 0.9 km / 0.6 mi <br /> Cyberport - 2.5 km / 1.6 mi <br /> Hollywood Road - 2.6 km / 1.6 mi <br /> Hong Kong - Macau Ferry Terminal - 3 km / 1.9 mi <br /> Soho - 3.2 km / 2 mi <br /> Mid-levels Escalators - 3.3 km / 2.1 mi <br /> Tai Kwun - Centre for Heritage and Arts - 3.4 km / 2.1 mi <br /> Peak Tower - 3.7 km / 2.3 mi <br /> Lan Kwai Fong - 3.7 km / 2.3 mi <br /> IFC Mall - 4 km / 2.5 mi <br /> Central Ferry Piers - 4.1 km / 2.5 mi <br /> HSBC Hong Kong Headquarter Building - 4.2 km / 2.6 mi <br /> The Peak Tram - 4.3 km / 2.7 mi <br /> Hong Kong Park - 4.3 km / 2.7 mi <br /> </p><p>The preferred airport for Mia Casa Hotel is Hong Kong International Airport (HKG) - 36.7 km / 22.8 mi </p>,"<p>HeadLine : In Hong Kong (Central & Western District)</p><p>Location : With a stay at Mia Casa Hotel in Hong Kong (Central & Western District), you ll be within a 10-minute drive of Ocean Park and Hong Kong Convention and Exhibition Centre.  This hotel is 0.6 mi (1 km) from Victoria Harbour and 2.8 mi (4.4 km) from Lan Kwai Fong.</p><p>Rooms : Make yourself at home in one of the 33 air-conditioned guestrooms. Complimentary wireless Internet access keeps you connected, and cable programming is available for your entertainment. Private bathrooms with showers feature complimentary toiletries and hair dryers. Conveniences include blackout drapes/curtains, as well as phones with free local calls.</p><p>Dining : Take advantage of the hotel s room service.</p><p>CheckIn Instructions : <ul>  <li>Extra-person charges may apply and vary depending on property policy</li><li>Government-issued photo identification and a credit card, debit card, or cash deposit may be required at check-in for incidental charges</li><li>Special requests are subject to availability upon check-in and may incur additional charges; special requests cannot be guaranteed</li><li>This property accepts credit cards; cash is not accepted</li><li>Heating is not provided</li><li>Onsite parties or group events are strictly prohibited</li><li>Noise-free guestrooms cannot be guaranteed</li><li>Safety features at this property include a smoke detector</li>  </ul></p><p>Special Instructions : To make arrangements for check-in please contact the property at least 24 hours before arrival using the information on the booking confirmation. Guests must contact the property in advance for check-in instructions. Front desk staff will greet guests on arrival.</p>",852-3-7522977,Wheelchair accessible (may have limitations) Wheelchair-accessible path to elevator 24-hour front desk Wheelchair-accessible registration desk Free WiFi Well-lit path to entrance Smoke-free property In-room accessibility (in select rooms) Stair-free path to entrance Tours/ticket assistance Accessible bathroom (in select rooms) elevator Terrace,22.28292|114.1281,+85237522988,999077,http://miacasa.com.hk/
HK,Hong Kong,145656,Hong Kong,1004783,mini hotel Central,ThreeStar,38 Ice House Street Central DistrictHong Kong ,Distances are displayed to the nearest 0.1 mile and kilometer. <br /> <p>Lan Kwai Fong - 0.1 km / 0.1 mi <br /> Hollywood Road - 0.3 km / 0.2 mi <br /> Tai Kwun - Centre for Heritage and Arts - 0.4 km / 0.3 mi <br /> HSBC Hong Kong Headquarter Building - 0.4 km / 0.3 mi <br /> Mid-levels Escalators - 0.5 km / 0.3 mi <br /> The Peak Tram - 0.5 km / 0.3 mi <br /> Soho - 0.5 km / 0.3 mi <br /> IFC Mall - 0.7 km / 0.4 mi <br /> Hong Kong Park - 0.7 km / 0.4 mi <br /> Cat Street - 0.8 km / 0.5 mi <br /> International Finance Centre - 0.8 km / 0.5 mi <br /> Central Ferry Piers - 1 km / 0.6 mi <br /> Hong Kong - Macau Ferry Terminal - 1.1 km / 0.7 mi <br /> Pacific Place - 1.2 km / 0.8 mi <br /> Central Harbourfront Event Space - 1.4 km / 0.9 mi <br /> </p><p>The preferred airport for Mini Central  is Hong Kong International Airport (HKG) - 37.3 km / 23.2 mi </p>,"<p>HeadLine : In Hong Kong (Central & Western District)</p><p>Location : With a stay at Mini Central , you ll be centrally located in Hong Kong, a 3-minute drive from Hong Kong Convention and Exhibition Centre and 8 minutes from Ocean Park.  This hotel is 0.9 mi (1.4 km) from Lan Kwai Fong and 1.5 mi (2.4 km) from Victoria Harbour.</p><p>Rooms : Make yourself at home in one of the 196 air-conditioned rooms featuring LCD televisions. Complimentary wireless Internet access is available to keep you connected. Bathrooms have showers and hair dryers. Conveniences include laptop-compatible safes and blackout drapes/curtains, as well as phones with free local calls.</p><p>CheckIn Instructions : <ul>  <li>Extra-person charges may apply and vary depending on property policy</li><li>Government-issued photo identification and a credit card may be required at check-in for incidental charges</li><li>Special requests are subject to availability upon check-in and may incur additional charges; special requests cannot be guaranteed</li><li>This property accepts credit cards; cash is not accepted</li>  </ul></p><p>Special Instructions : Front desk staff will greet guests on arrival.</p>",852-21571113,Safe-deposit box at front desk Smoke-free property Tours/ticket assistance Luggage storage elevator Multilingual staff 24-hour front desk Free WiFi,22.280387|114.156177,852-21030999,N A,http://www.minihotel.hk
HK,Hong Kong,145656,Hong Kong,1004784,Bridal Tea House Hotel Ap Lei Chau,ThreeStar,No. 19 Wai Fung St. Ap Lei Chau Apleichau ,,"HotelDescription#The hotel is located on the Ap Lei Chau main street and close to Ap Lei Chau Promenada, Abedrdeen Promenada and Ocean Park. It offers convenient transport links, enabling guests to travel across the city efficiently.

The 20-room city hotel is specially designed for exquisite travellers, providing a high quality living environment at a reasonable price. Guests can make use of the hotel's restaurant and room service.

The hotel provides clean and comfortable rooms with sufficient lighting and daily room cleaning service. Each room features a private bathroom with hairdryer, TV, direct dial telephone, Internet access, a mini fridge and individually regulated air conditioning.

Guests may select breakfast from a buffet or take the à la carte option for lunch and dinner.

In order to get to the hotel, guests have to take the A10 airport bus or the 171 city bus directly from Hung Hom Station and get off at South Horizons Bus Terminus. Then take the 37A minibus from Yi Nam Road (South Horizons Market) and get off at Wai Fung Street, which is right by the hotel.",+85223321293,NO Connecting rooms Hotel MasterCard Visa Bathroom Hairdryer Internet access Direct dial telephone TV Mini fridge Individually adjustable air conditioning   NO Small pets allowed (under 5 kg) NO Large pets allowed (over 5 kg) NO Wheelchair-accessible NO Car park NO Garage Room service Restaurant Breakfast   À la carte lunch À la carte dinner,22.24303|114.15387,(852) 35538412,0000,http://www.bthhotel.com
HK,Hong Kong,145656,Hong Kong,1004785,Mingle On The Wing,ThreeStar,"105 Wing Lok Street, Sheung Wan HONG KONG ",,"A one-minute walk from Shueng Wan MTR Station, Mingle On The Wing offers modern rooms with free Skype calls and iPod docks. Rooms also come with free Wi-Fi and flat-screen TVs.

Mingle On The Wing is a 10-minute walk from trendy SoHo and Lan Kwai Fong. Peak Tram Station, which takes guests up to scenic Victoria Peak, is about 1.2 km from the hotel.

Decorated in soothing neutral colours, the air-conditioned rooms feature high-tech fingerprint identification which recalls desired room settings like temperature and music. A DVD player and free audio/visual library with internet radio can be enjoyed in all rooms.

Soft Aroma Cafe on the hotel's ground floor serves freshly brewed coffee and light refreshments. Several restaurants are within a 10-minute walk from the hotel.",,Hotel MasterCard Visa Shower Hairdryer Toiletries Slippers TV Radio DVD player Alarm clock Minibar Wake-up service Air conditioning in public areas Lift access,22.2861|114.15157,,A,http://www.mingleplace.com
HK,Hong Kong,145656,Hong Kong,1007844,The Royal Garden,FiveStar,69 Mody Road Tsimshatsui EastKowloonHong Kong ,Distances are displayed to the nearest 0.1 mile and kilometer. <br /> <p>Tsim Sha Tsui Promenade - 0.1 km / 0.1 mi <br /> Granville Road - 0.3 km / 0.2 mi <br /> Hong Kong Polytechnic University - 0.5 km / 0.3 mi <br /> Knutsford Terrace - 0.6 km / 0.4 mi <br /> K11 Shopping Mall - 0.6 km / 0.4 mi <br /> Kowloon Park - 0.8 km / 0.5 mi <br /> Hong Kong Coliseum - 0.9 km / 0.5 mi <br /> Chungking Mansions - 0.9 km / 0.6 mi <br /> Hong Kong Space Museum - 1 km / 0.6 mi <br /> Hung Hom Promenade - 1.1 km / 0.7 mi <br /> Peninsula Hong Kong - 1.1 km / 0.7 mi <br /> Hong Kong Cultural Centre - 1.2 km / 0.7 mi <br /> Hong Kong Museum of Art - 1.2 km / 0.7 mi <br /> Harbour City - 1.2 km / 0.7 mi <br /> Canton Road - 1.2 km / 0.8 mi <br /> </p><p>The preferred airport for The Royal Garden is Hong Kong International Airport (HKG) - 34.3 km / 21.3 mi </p>,"<p>HeadLine : In Kowloon (Tsim Sha Tsui)</p><p>Location : With a stay at The Royal Garden, you ll be centrally located in Kowloon, a 8-minute walk from K11 Shopping Mall and 12 minutes by foot from Hong Kong Space Museum.  This 5-star hotel is 0.9 mi (1.5 km) from Harbour City and 1.8 mi (2.9 km) from Sky 100.</p><p>Rooms : Stay in one of 445 guestrooms featuring LED televisions. Complimentary wireless Internet access keeps you connected, and satellite programming is available for your entertainment. Private bathrooms have complimentary toiletries and hair dryers. Conveniences include phones, as well as laptop-compatible safes and desks.</p><p>Dining : Enjoy Italian cuisine at Sabatini Ristorante, one of the hotel s 6 restaurants, or stay in and take advantage of the room service (during limited hours). Snacks are also available at the coffee shop/cafe. Quench your thirst with your favorite drink at the bar/lounge. Buffet breakfasts are available daily from 6:30 AM to 10:30 AM for a fee.</p><p>CheckIn Instructions : <ul>  <li>Extra-person charges may apply and vary depending on property policy</li><li>Government-issued photo identification and a credit card may be required at check-in for incidental charges</li><li>Special requests are subject to availability upon check-in and may incur additional charges; special requests cannot be guaranteed</li><li>The name on the credit card used at check-in to pay for incidentals must be the primary name on the guestroom reservation</li><li>This property accepts credit cards and cash</li><li>Onsite parties or group events are strictly prohibited</li><li>Safety features at this property include a fire extinguisher, a smoke detector, a security system, and a first aid kit</li><li>Please note that cultural norms and guest policies may differ by country and by property; the policies listed are provided by the property</li>  </ul></p><p>Special Instructions : Front desk staff will greet guests on arrival. For more details, please contact the property using the information on the booking confirmation.  The credit card used to book the reservation must be presented by the cardholder at check-in along with matching photo identification. Any other arrangements must be coordinated with the property prior to arrival.</p>",852-23-699976,Gift shops or newsstand Dry cleaning/laundry service Shopping on site Banquet hall Wheelchair accessible (may have limitations) Wheelchair accessible Wheelchair-accessible concierge desk Meeting rooms Number of meeting rooms - 8 Wheelchair-accessible path to elevator Wheelchair-accessible registration desk Limo or Town Car service available Free WiFi Number of bars/lounges - 1 Health club Spa treatment room(s) Designated smoking areas Number of outdoor pools - 1 Well-lit path to entrance Wedding services Tours/ticket assistance Accessible bathroom (in select rooms) 24-hour fitness facilities Shopping mall on site Wheelchair-accessible lounge Luggage storage Wheelchair-accessible on-site restaurant Porter/bellhop Multilingual staff 24-hour front desk Breakfast available (surcharge) Spa services on site Number of coffee shops/cafes - 1 Sauna elevator Fitness facilities Valet parking (surcharge) Concierge services,22.298815|114.177499,852--27215215,N A,http://www.rghk.com.hk
HK,Hong Kong,145656,Hong Kong,1008266,Metropark Hotel Causeway Bay Hong Kong,FourStar,148 Tung Lo Wan Road Causeway BayHong Kong ,Distances are displayed to the nearest 0.1 mile and kilometer. <br /> <p>Victoria Park - 0.6 km / 0.4 mi <br /> Victoria Harbour - 0.9 km / 0.5 mi <br /> Hong Kong Sogo - 1.1 km / 0.7 mi <br /> Times Square Shopping Mall - 1.4 km / 0.8 mi <br /> Happy Valley Race Course - 1.6 km / 1 mi <br /> Wan Chai Road - 1.8 km / 1.1 mi <br /> North Point Ferry Pier - 1.9 km / 1.2 mi <br /> Central Plaza - 2.4 km / 1.5 mi <br /> Wan Chai Market - 2.5 km / 1.6 mi <br /> Hong Kong Convention and Exhibition Centre - 2.7 km / 1.7 mi <br /> Hong Kong Arts Centre - 2.8 km / 1.7 mi <br /> Kowloon Bay - 2.8 km / 1.7 mi <br /> Hong Kong Academy for Performing Arts - 3 km / 1.8 mi <br /> Central Government Office - 3.3 km / 2.1 mi <br /> Taikoo Place - 3.3 km / 2.1 mi <br /> </p><p>The preferred airport for Metropark Hotel Causeway Bay HK is Hong Kong Intl. Airport (HKG) - 41 km / 25.4 mi </p>,"<p>HeadLine : Near Victoria Park</p><p>Location : A stay at Metropark Hotel Causeway Bay HK places you in the heart of Hong Kong, within a 15-minute walk of Victoria Harbour and Victoria Park.  This 4-star hotel is 0.7 mi (1.1 km) from Hong Kong Sogo and 2.2 mi (3.6 km) from Hong Kong Convention and Exhibition Centre.</p><p>Rooms : Stay in one of 266 guestrooms featuring LCD televisions. Complimentary wired and wireless Internet access keeps you connected, and cable programming provides entertainment. Private bathrooms have complimentary toiletries and hair dryers. Conveniences include phones, as well as laptop-compatible safes and desks.</p><p>Dining : Enjoy a meal at the restaurant, or stay in and take advantage of the hotel s room service (during limited hours). Wrap up your day with a drink at the bar/lounge. Buffet breakfasts are available daily from 6:30 AM to 10 AM for a fee.</p><p>Renovations : This property is closed until March 31 2021 (date subject to change).   The following facilities will be closed during January and February:<ul><li>Swimming pool</li></ul></p><p>CheckIn Instructions : Extra-person charges may apply and vary depending on property policy Government-issued photo identification and a credit card, debit card, or cash deposit may be required at check-in for incidental charges Special requests are subject to availability upon check-in and may incur additional charges; special requests cannot be guaranteed No onsite parking is available</p><p>Special Instructions : Front desk staff will greet guests on arrival.  Airport shuttle service is available at scheduled times from 6:30 AM to 11 PM. Fees may apply. Contact the property in advance to make arrangements.</p>",852-26-001111,Conference space size (feet) - 291 Laundry facilities Spa tub In-room accessibility Airport transportation (surcharge) Wheelchair-accessible path to elevator Multilingual staff Express check-in Bar/lounge Free shopping center shuttle elevator Fitness facilities 24-hour front desk Conference space Business center Porter/bellhop Restaurant Express check-out Meeting rooms Tours/ticket assistance Dry cleaning/laundry service Free WiFi Sauna Outdoor pool Health club Limo or Town Car service available Free wired Internet Smoke-free property Free area shuttle Conference space size (meters) - 27 Luggage storage Breakfast available (surcharge) Concierge services,22.281311|114.191956,852--26001000,A52,http://www.metroparkhotel.com
HK,Hong Kong,145656,Hong Kong,1010398,pentahotel Hong Kong Kowloon,FourStar,19 Luk Hop Street Sun Po Kong San Po Kong San Po KongKowloonHong Kong ,Distances are displayed to the nearest 0.1 mile and kilometer. <br /> <p>Mikiki - 0.6 km / 0.4 mi <br /> Plaza Hollywood - 0.8 km / 0.5 mi <br /> Chi Lin Nunnery - 1.1 km / 0.7 mi <br /> Nan Lian Garden - 1.2 km / 0.7 mi <br /> Wong Tai Sin Temple - 1.4 km / 0.9 mi <br /> Kowloon Walled City Park - 1.5 km / 0.9 mi <br /> Kowloonbay International Trade and Exhibition Centre - 2.1 km / 1.3 mi <br /> Kowloon Bay - 2.3 km / 1.4 mi <br /> Ma On Shan Country Park - 2.9 km / 1.8 mi <br /> Victoria Harbour - 3 km / 1.8 mi <br /> Kwun Tong Promenade - 3.4 km / 2.1 mi <br /> Grand Century Place - 3.8 km / 2.4 mi <br /> Yuen Po Bird Market - 4 km / 2.5 mi <br /> Nathan Road Shopping District - 4 km / 2.5 mi <br /> Ladies  Market - 4.5 km / 2.8 mi <br /> </p><p>The preferred airport for pentahotel Hong Kong  Kowloon is Hong Kong International Airport (HKG) - 36.1 km / 22.4 mi </p>,"<p>HeadLine : Near Plaza Hollywood</p><p>Location : Located in Kowloon (Eastern Kowloon), pentahotel Hong Kong, Kowloon is within a 10-minute walk of Mikiki and Plaza Hollywood.  This 4-star hotel is 0.7 mi (1.1 km) from Nan Lian Garden and 0.7 mi (1.2 km) from Chi Lin Nunnery.</p><p>Rooms : Make yourself at home in one of the 695 guestrooms featuring iPod docking stations and LED televisions. Complimentary wireless Internet access keeps you connected, and cable programming is available for your entertainment. Private bathrooms with showers feature rainfall showerheads and slippers. Conveniences include phones, as well as laptop-compatible safes and desks.</p><p>Dining : Enjoy a satisfying meal at eatstreet @ pentalounge serving guests of pentahotel Hong Kong, Kowloon. Wrap up your day with a drink at the bar/lounge. Cooked-to-order breakfasts are available daily from 7:30 AM to 10 AM for a fee.</p><p>Renovations : The following facilities are closed seasonally each year. They will be closed from October 1 to April 30:<ul><li>Swimming pool</li></ul></p><p>CheckIn Instructions : <ul>  <li>Extra-person charges may apply and vary depending on property policy</li><li>Government-issued photo identification and a credit card, debit card, or cash deposit may be required at check-in for incidental charges</li><li>Special requests are subject to availability upon check-in and may incur additional charges; special requests cannot be guaranteed</li><li>Special cancellation policies or charges may apply for group reservations (more than 8 rooms for the same property / stay dates)</li><li>Guests must contact this property in advance to reserve high chair</li><li>This property reserves the right to pre-authorize the guest s credit card prior to arrival.</li><li>Long-term renters welcome</li><li>Safety features at this property include a smoke detector</li><li>Be prepared: check the latest COVID-19 travel requirements and measures in place for this destination before you travel.</li><li>Please note that cultural norms and guest policies may differ by country and by property; the policies listed are provided by the property</li>  </ul></p><p>Special Instructions : This property doesn t offer after-hours check-in. Front desk staff will greet guests on arrival. This is a designated quarantine hotel. The property can only accept bookings from travelers who are required to quarantine (i.e. international travelers). You may be asked to provide evidence of this on arrival.</p>",852-3112-8233,Wheelchair-accessible on-site restaurant Wheelchair-accessible lounge Visual alarms in hallways Designated smoking areas (fines apply) elevator Locally-owned & organized tours & activities Number of bars/lounges - 1 Well-lit path to entrance Guest education on local ecosystems and culture Internet access in public areas - high speed 24-hour front desk Comprehensive food waste policy Vegetarian menu options available Dry cleaning/laundry service Free WiFi Games No single-use plastic straws Swimming pool Outdoor seasonal pool Foosball Reusable tableware only Safe-deposit box at front desk Luggage storage Proposal/romance packages available Coin laundry on site Breakfast available (surcharge) Designated smoking areas Wheelchair accessible (may have limitations) Reception hall Laundry facilities Vegetarian breakfast available Accessible bathroom 24-hour fitness facilities Roll-in shower Wheelchair-accessible public washroom Wheelchair-accessible concierge desk In-room accessibility Braille or raised signage Wheelchair-accessible path to elevator Multilingual staff Wheelchair-accessible registration desk Fireplace in lobby Wheelchair-accessible pool Wheelchair-accessible fitness center Wheelchair-accessible meeting spaces/business center,22.337011|114.199772,852-311-28222,00000,http://www.pentahotels.com
HK,Hong Kong,145656,Hong Kong,1012015,Sky Dragon House,OneStar,"7/F, KAM LING BUILDING, 231 NATHAN ROAD, KOWLOON KOWLOON ",,"The hotel is conveniently located in close proximity to a transportation hub, as it is just about 10 metres from Jordan MTR Station exit C1.

The hotel provides its guests with fully equipped facilities, together with its platinum star personal services, to deliver a regal living style for all visiting guests. In addition to a lobby the hotel offers room service for an additional fee payable locally.

The hotel offers spacious and comfortable rooms at a modest price with free broadband wireless Internet access, satellite TV, bathroom, direct dial telephone and a fridge. Each of the rooms features individually regulated air conditioning.",+85227303123,Hotel MasterCard Visa Room service,22.304736|114.17146300000002,0085227359986,,http://www.hkyiya.com
