countyCode,countyName,cityCode,cityName,HotelCode,HotelName,HotelRating,Address,Attractions,Description,FaxNumber,HotelFacilities,Map,PhoneNumber,PinCode,HotelWebsiteUrl
HK,Hong Kong,145656,Hong Kong,1023772,Hotel LBP,ThreeStar,4F Hollywood Centre 77 91 Queens Road West 77-91 Queen's Road West 77-91 Queens Road WestHong Kong ,Distances are displayed to the nearest 0.1 mile and kilometer. <br /> <p>Hollywood Road - 0.1 km / 0.1 mi <br /> Cat Street - 0.3 km / 0.2 mi <br /> Hong Kong - Macau Ferry Terminal - 0.7 km / 0.4 mi <br /> Soho - 0.9 km / 0.5 mi <br /> Mid-levels Escalators - 0.9 km / 0.6 mi <br /> Tai Kwun - Centre for Heritage and Arts - 1 km / 0.6 mi <br /> University of Hong Kong - 1.1 km / 0.7 mi <br /> Lan Kwai Fong - 1.3 km / 0.8 mi <br /> International Finance Centre - 1.3 km / 0.8 mi <br /> IFC Mall - 1.5 km / 0.9 mi <br /> Central Ferry Piers - 1.7 km / 1.1 mi <br /> HSBC Hong Kong Headquarter Building - 1.7 km / 1.1 mi <br /> The Peak Tram - 2 km / 1.3 mi <br /> Hong Kong Park - 2.1 km / 1.3 mi <br /> Central Harbourfront Event Space - 2.3 km / 1.5 mi <br /> </p><p>The preferred airport for the Figo is Hong Kong International Airport (HKG) - 35.8 km / 22.2 mi </p>,"<p>HeadLine : In Hong Kong (Central & Western District)</p><p>Location : With a stay at the Figo in Hong Kong (Central & Western District), you ll be a 4-minute drive from Hong Kong Convention and Exhibition Centre and 10 minutes from Ocean Park.  This hotel is 0.8 mi (1.3 km) from Lan Kwai Fong and 1.5 mi (2.4 km) from Victoria Harbour.</p><p>Rooms : Make yourself at home in one of the 46 air-conditioned rooms featuring refrigerators and minibars. Wired and wireless Internet access is complimentary, while 32-inch LCD televisions with satellite programming provide entertainment. Private bathrooms with showers feature rainfall showerheads and complimentary toiletries. Conveniences include safes and desks, as well as phones with free local calls.</p><p>Dining : Grab a bite from the snack bar/deli serving guests of the Figo.</p><p>CheckIn Instructions : <ul>  <li>Extra-person charges may apply and vary depending on property policy</li><li>Government-issued photo identification and a credit card or cash deposit may be required at check-in for incidental charges</li><li>Special requests are subject to availability upon check-in and may incur additional charges; special requests cannot be guaranteed</li><li>This property accepts credit cards and cash</li><li>Safety features at this property include a fire extinguisher, a smoke detector, a security system, and a first aid kit</li><li>Please note that cultural norms and guest policies may differ by country and by property; the policies listed are provided by the property</li>  </ul></p><p>Special Instructions : Front desk staff will greet guests on arrival.  This property is not suitable for guests who are required to quarantine, due to the property s communal areas. This property s optional cleaning fee covers additional sanitation costs, to be imposed if a guest receives a positive COVID-19 test result during their stay at the property.</p>",852-2681-9389,Dry cleaning/laundry service Wheelchair accessible (may have limitations) Reception hall Number of meeting rooms - 1 Conference space size (meters) - 27 Free wired Internet Wheelchair-accessible registration desk Television in common areas Free WiFi Wheelchair-accessible public washroom Arcade/game room Garden In-room accessibility (in select rooms) Roll-in shower (in select rooms) Tours/ticket assistance Accessible bathroom (in select rooms) Wheelchair-accessible lounge Luggage storage Multilingual staff Business center 24-hour front desk Conference center Library Barbecue grill(s) Safe-deposit box at front desk Smoke-free property Coffee/tea in common areas Snack bar/deli Laundry facilities elevator Fitness facilities Conference space Computer station Terrace Conference space size (feet) - 300 Concierge services,22.286416|114.14722,852-2681-9388,00000,http://www.hotellbp.com.hk/
HK,Hong Kong,145656,Hong Kong,1027488,Hotel Pennington by Rhombus,FourStar,13-15 Pennington Street Causeway BayChinaHong Kong ,Distances are displayed to the nearest 0.1 mile and kilometer. <br /> <p>Victoria Harbour - 0.1 km / 0.1 mi <br /> Causeway Bay Shopping Plaza - 0.1 km / 0.1 mi <br /> Lee Gardens - 0.2 km / 0.1 mi <br /> Hong Kong Sogo - 0.4 km / 0.2 mi <br /> Times Square Shopping Mall - 0.6 km / 0.4 mi <br /> Hong Kong Stadium - 0.7 km / 0.4 mi <br /> Victoria Park - 0.7 km / 0.4 mi <br /> Happy Valley Race Course - 0.8 km / 0.5 mi <br /> Wan Chai Road - 1 km / 0.6 mi <br /> Tin Hau Temple - 1.1 km / 0.7 mi <br /> Wan Chai Market - 1.6 km / 1 mi <br /> Central Plaza - 1.6 km / 1 mi <br /> Hong Kong Arts Centre - 2.1 km / 1.3 mi <br /> Pacific Place - 2.3 km / 1.5 mi <br /> Hong Kong Academy for Performing Arts - 2.4 km / 1.5 mi <br /> </p><p>The preferred airport for Hotel Pennington by Rhombus is Hong Kong (HKG-Hong Kong Intl.) - 41.1 km / 25.5 mi </p>,"<p>HeadLine : Near Hong Kong Sogo</p><p>Location : With a stay at Hotel Pennington by Rhombus in Hong Kong (Causeway Bay), you ll be steps from Victoria Harbour and 5 minutes by foot from Hong Kong Sogo.  This 4-star hotel is 0.4 mi (0.6 km) from Times Square Shopping Mall and 0.4 mi (0.7 km) from Victoria Park.</p><p>Rooms : Make yourself at home in one of the 79 air-conditioned rooms featuring LCD televisions. Complimentary wired and wireless Internet access is available. Private bathrooms with showers feature rainfall showerheads and complimentary toiletries. Conveniences include phones, as well as safes and desks.</p><p>Dining : Satisfy your appetite at one of the hotel s 3 restaurants. Quench your thirst with your favorite drink at the bar/lounge. Continental breakfasts are available daily from 7:30 AM to 10:30 AM for a fee.</p><p>CheckIn Instructions : Extra-person charges may apply and vary depending on property policy. <br />Government-issued photo identification and a credit card, debit card, or cash deposit are required at check-in for incidental charges. <br />Special requests are subject to availability upon check-in and may incur additional charges. Special requests cannot be guaranteed. <ul>  Please note that cultural norms and guest policies may differ by country and by property. The policies listed are provided by the property. </ul> <strong>Guests planning to check in with a pet must book a second room for the pet to stay in. </strong> The pet s health certificate should be provided in advance.  Guests must also contact the hotel directly after booking to make arrangements for the pet s stay, using the contact details found on the booking confirmation.</p>",86-852-39700699,Safe-deposit box at front desk Conference space size (meters) - 0 Terrace Bar/lounge Luggage storage Elevator/lift Breakfast available (surcharge) Concierge services Conference space size (feet) - 0 24-hour front desk Tours/ticket assistance Television in common areas Accessible bathroom Roll-in shower Dry cleaning/laundry service Free WiFi In-room accessibility Airport transportation (surcharge) Smoke-free property,22.278608|114.186154,852-39-700688,00000,http://www.hotelpennington.com.hk
HK,Hong Kong,145656,Hong Kong,1027491,Lodgewood by Lhotel Mongkok Hong Kong,FourStar,1131 Canton Road Mongkok Kowloon ,Distances are displayed to the nearest 0.1 mile and kilometer. <br /> <p>Nathan Road Shopping District - 0.1 km / 0.1 mi <br /> Langham Place Mall - 0.4 km / 0.3 mi <br /> Ladies  Market - 0.6 km / 0.4 mi <br /> Temple Street Night Market - 1.9 km / 1.2 mi <br /> Victoria Harbour - 2.1 km / 1.3 mi <br /> Kowloon Park - 2.3 km / 1.5 mi <br /> Canton Road - 2.4 km / 1.5 mi <br /> Granville Road - 2.7 km / 1.7 mi <br /> Knutsford Terrace - 2.8 km / 1.8 mi <br /> Harbour City - 2.9 km / 1.8 mi <br /> Elements Shopping Mall - 2.9 km / 1.8 mi <br /> Hong Kong Polytechnic University - 2.9 km / 1.8 mi <br /> Hong Kong China Ferry Terminal - 2.9 km / 1.8 mi <br /> Sky 100 - 3.1 km / 1.9 mi <br /> International Commerce Centre - 3.2 km / 2 mi <br /> </p><p>The preferred airport for Lodgewood by Nina Hospitality?Mong Kok is Hong Kong International Airport (HKG) - 32.3 km / 20.1 mi </p>,"<p>HeadLine : In Kowloon (Mong Kok)</p><p>Location : A stay at Lodgewood by Nina Hospitality?Mong Kok places you in the heart of Kowloon, a 3-minute drive from Harbour City and 6 minutes from Hong Kong - Macau Ferry Terminal.  This 4-star hotel is 4.7 mi (7.5 km) from Soho and 4.7 mi (7.6 km) from Hong Kong Convention and Exhibition Centre.</p><p>Rooms : Make yourself at home in one of the 87 air-conditioned rooms featuring refrigerators and flat-screen televisions. Complimentary wired and wireless Internet access keeps you connected, and satellite programming provides entertainment. Private bathrooms with showers feature rainfall showerheads and complimentary toiletries. Conveniences include laptop-compatible safes and desks, and housekeeping is provided daily.</p><p>Dining : Enjoy a satisfying meal at canton pot serving guests of Lodgewood by Nina Hospitality?Mong Kok.</p><p>CheckIn Instructions : <ul>  <li>Extra-person charges may apply and vary depending on property policy</li><li>Government-issued photo identification and a credit card, debit card, or cash deposit may be required at check-in for incidental charges</li><li>Special requests are subject to availability upon check-in and may incur additional charges; special requests cannot be guaranteed</li><li>This property accepts credit cards; cash is not accepted</li>  </ul></p><p>Special Instructions : Front desk staff will greet guests on arrival.</p>",852-3-9687788,Dry cleaning/laundry service Wheelchair accessible (may have limitations) Vending machine Luggage storage Multilingual staff 24-hour front desk Free wired Internet Free WiFi Safe-deposit box at front desk Smoke-free property In-room accessibility (in select rooms) Laundry facilities Tours/ticket assistance Accessible bathroom (in select rooms) elevator Computer station Terrace Shopping mall on site Concierge services,22.321321|114.166686,852-3-9687777,000000,http://www.lodgewood.com.hk/en/mongkok
HK,Hong Kong,145656,Hong Kong,1027498,Travelodge Kowloon,ThreeStar,Saigon Street Jordan Kowloon. 23 JordanKowloonHong Kong 999044 ,Distances are displayed to the nearest 0.1 mile and kilometer. <br /> <p>Temple Street Night Market - 0.2 km / 0.1 mi <br /> Jade Market - 0.4 km / 0.2 mi <br /> Yau Ma Tei Fruit Market - 0.5 km / 0.3 mi <br /> Queen Elizabeth Hospital - 0.6 km / 0.4 mi <br /> Kowloon Park - 0.6 km / 0.4 mi <br /> St Andrews Church - 0.7 km / 0.4 mi <br /> Nathan Road Shopping District - 0.8 km / 0.5 mi <br /> Canton Road - 0.9 km / 0.5 mi <br /> Knutsford Terrace - 1 km / 0.6 mi <br /> The One - 1 km / 0.6 mi <br /> Granville Road - 1.1 km / 0.7 mi <br /> Ladies  Market - 1.2 km / 0.7 mi <br /> Hong Kong Polytechnic University - 1.2 km / 0.8 mi <br /> K11 Shopping Mall - 1.3 km / 0.8 mi <br /> Harbour City - 1.3 km / 0.8 mi <br /> </p><p>The preferred airport for Travelodge Kowloon is Hong Kong International Airport (HKG) - 32.7 km / 20.3 mi </p>,"<p>HeadLine : In Kowloon (Yau Tsim Mong)</p><p>Location : A stay at Travelodge Kowloon places you in the heart of Kowloon, within a 5-minute walk of Temple Street Night Market and Jade Market.  This hotel is 0.4 mi (0.6 km) from St Andrews Church and 0.6 mi (0.9 km) from Yau Ma Tei Fruit Market.</p><p>Rooms : Make yourself at home in one of the 126 air-conditioned rooms featuring refrigerators and LED televisions. Complimentary wired and wireless Internet access keeps you connected, and digital programming provides entertainment. Private bathrooms with showers feature complimentary toiletries and hair dryers. Conveniences include safes and desks, as well as phones with free local calls.</p><p>CheckIn Instructions : <ul>  <li>Extra-person charges may apply and vary depending on property policy</li><li>Government-issued photo identification and a credit card or cash deposit may be required at check-in for incidental charges</li><li>Special requests are subject to availability upon check-in and may incur additional charges; special requests cannot be guaranteed</li><li>This property accepts credit cards; cash is not accepted</li><li>Safety features at this property include a fire extinguisher, a smoke detector, and window guards</li><li>Please note that cultural norms and guest policies may differ by country and by property; the policies listed are provided by the property</li>  </ul></p><p>Special Instructions : Front desk staff will greet guests on arrival.  This property is not suitable for guests who are required to quarantine, due to the property s communal areas. Customers may be requested by the property to provide documentation of recent travel history (such as showing passport immigration stamps) and complete a health declaration.</p>",852-31996188,Smoke-free property In-room accessibility (in select rooms) Wheelchair accessible (may have limitations) Luggage storage elevator 24-hour front desk Free WiFi,22.307056|114.172354,852-31996199,000,http://www.travelodgehotels.asia
HK,Hong Kong,145656,Hong Kong,1030704,JEN Hong Kong by Shangri-La,FourStar,508 Queen Western District Western DistrictHong Kong ,Distances are displayed to the nearest 0.1 mile and kilometer. <br /> <p>University of Hong Kong - 0.4 km / 0.3 mi <br /> Hollywood Road - 1.4 km / 0.9 mi <br /> Victoria Harbour - 1.6 km / 1 mi <br /> Hong Kong - Macau Ferry Terminal - 2.1 km / 1.3 mi <br /> Soho - 2.2 km / 1.4 mi <br /> Mid-levels Escalators - 2.3 km / 1.4 mi <br /> Tai Kwun - Centre for Heritage and Arts - 2.4 km / 1.5 mi <br /> Lan Kwai Fong - 2.7 km / 1.7 mi <br /> IFC Mall - 2.8 km / 1.7 mi <br /> International Finance Centre - 2.9 km / 1.8 mi <br /> Cyberport - 2.9 km / 1.8 mi <br /> HSBC Hong Kong Headquarter Building - 3.1 km / 1.9 mi <br /> Peak Tower - 3.2 km / 2 mi <br /> Central Ferry Piers - 3.2 km / 2 mi <br /> The Peak Tram - 3.2 km / 2 mi <br /> </p><p>The preferred airport for JEN Hong Kong by Shangri-La is Hong Kong International Airport (HKG) - 35.6 km / 22.1 mi </p>,"<p>HeadLine : In Hong Kong (Central & Western District)</p><p>Location : A stay at JEN Hong Kong by Shangri-La places you in the heart of Hong Kong, within a 5-minute drive of Hong Kong - Macau Ferry Terminal and Victoria Harbour.  This 4-star hotel is 1.9 mi (3.1 km) from Soho and 2.2 mi (3.6 km) from Lan Kwai Fong.</p><p>Rooms : Make yourself at home in one of the 283 guestrooms featuring refrigerators and LCD televisions. Complimentary wired and wireless Internet access keeps you connected, and cable programming provides entertainment. Private bathrooms with showers feature complimentary toiletries and hair dryers. Conveniences include phones, as well as safes and desks.</p><p>Dining : For lunch or dinner, stop by Cafe Malacca, a restaurant that specializes in Malaysian cuisine. Dining is also available at the coffee shop/cafe, and room service (during limited hours) is provided. Wrap up your day with a drink at the bar/lounge. Buffet breakfasts are available daily from 7:00 AM to 10:30 AM for a fee.</p><p>CheckIn Instructions : <ul>  <li>Extra-person charges may apply and vary depending on property policy</li><li>Government-issued photo identification and a credit card, debit card, or cash deposit may be required at check-in for incidental charges</li><li>Special requests are subject to availability upon check-in and may incur additional charges; special requests cannot be guaranteed</li><li>This property accepts credit cards and cash</li><li>Onsite parties or group events are strictly prohibited</li><li>Safety features at this property include a fire extinguisher, a smoke detector, a security system, and a first aid kit</li><li>Please note that cultural norms and guest policies may differ by country and by property; the policies listed are provided by the property</li>  </ul> <ul>  <li>Guests who book breakfast-inclusive rate plans will receive breakfast for guests age 12 and older.</li>  </ul></p><p>Special Instructions : This property offers transfers from the airport (surcharges may apply). To arrange pick-up, guests must contact the property 24 hours prior to arrival, using the contact information on the booking confirmation. Front desk staff will greet guests on arrival.  Guests who book breakfast-inclusive rate plans will receive breakfast for guests age 12 and older.</p>",852-29-740333,Dry cleaning/laundry service Parking (limited spaces) Express check-in Meeting rooms Conference space size (meters) - 96 Swimming pool Free wired Internet Television in common areas Limo or Town Car service available Free WiFi Number of bars/lounges - 1 In-room accessibility (in select rooms) Free newspapers in lobby Roll-in shower (in select rooms) Wedding services Tours/ticket assistance Accessible bathroom (in select rooms) 24-hour fitness facilities Airport transportation (surcharge) Luggage storage Express check-out Multilingual staff Business center 24-hour front desk Breakfast available (surcharge) Outdoor seasonal pool Safe-deposit box at front desk Smoke-free property Coffee/tea in common areas Number of coffee shops/cafes - 1 Laundry facilities elevator Fitness facilities Conference space Wheelchair accessible path of travel Conference space size (feet) - 1033 Concierge services,22.286112|114.13501,852-2974-1234,00001,http://www.hoteljen.com
HK,Hong Kong,145656,Hong Kong,1031943,Ramada by Wyndham Hong Kong Grand,ThreeStar,23 Austin Avenue Tsimshatsui TsimShaTsuiKowloon ,Distances are displayed to the nearest 0.1 mile and kilometer. <br /> <p>Knutsford Terrace - 0.3 km / 0.2 mi <br /> Granville Road - 0.4 km / 0.2 mi <br /> Hong Kong Polytechnic University - 0.4 km / 0.2 mi <br /> Kowloon Park - 0.4 km / 0.3 mi <br /> Canton Road - 0.7 km / 0.4 mi <br /> Temple Street Night Market - 0.8 km / 0.5 mi <br /> K11 Shopping Mall - 0.8 km / 0.5 mi <br /> Tsim Sha Tsui Promenade - 0.8 km / 0.5 mi <br /> Harbour City - 1.1 km / 0.7 mi <br /> Hong Kong Coliseum - 1.1 km / 0.7 mi <br /> Hong Kong China Ferry Terminal - 1.2 km / 0.7 mi <br /> Hong Kong Space Museum - 1.3 km / 0.8 mi <br /> Chungking Mansions - 1.3 km / 0.8 mi <br /> Hong Kong Cultural Centre - 1.4 km / 0.9 mi <br /> Peninsula Hong Kong - 1.4 km / 0.9 mi <br /> </p><p>The nearest major airport is Hong Kong International Airport (HKG) - 33.2 km / 20.6 mi</p>,"<p>HeadLine : In Kowloon (Tsim Sha Tsui)</p><p>Location : With a stay at Ramada Hong Kong Grand Tsim Sha Tsui in Kowloon (Tsim Sha Tsui), you ll be within a 5-minute drive of Ladies  Market and Victoria Harbour.  This hotel is 3.5 mi (5.6 km) from Hong Kong Convention and Exhibition Centre and 3.8 mi (6.1 km) from Hong Kong - Macau Ferry Terminal.</p><p>Rooms : Make yourself at home in one of the 396 guestrooms featuring minibars and flat-screen televisions. Complimentary wireless Internet access is available to keep you connected. Private bathrooms with showers feature complimentary toiletries and hair dryers. Conveniences include safes and electric kettles, as well as phones with free local calls.</p><p>Dining : At Ramada Hong Kong Grand Tsim Sha Tsui, enjoy a satisfying meal at the restaurant. Full breakfasts are available daily from 7:00 AM to 10:00 AM for a fee.</p><p>CheckIn Instructions : <ul>  <li>Extra-person charges may apply and vary depending on property policy</li><li>Government-issued photo identification and a credit card, debit card, or cash deposit may be required at check-in for incidental charges</li><li>Special requests are subject to availability upon check-in and may incur additional charges; special requests cannot be guaranteed</li><li>The name on the credit card used at check-in to pay for incidentals must be the primary name on the guestroom reservation</li><li>Special cancellation policies or charges may apply for group reservations (more than 8 rooms for the same property / stay dates)</li><li>This property accepts credit cards and cash</li><li>Safety features at this property include a fire extinguisher, a smoke detector, a security system, a first aid kit, and window guards</li>  </ul></p><p>Special Instructions : To make arrangements for check-in please contact the property ahead of time using the information on the booking confirmation. If you are planning to arrive after 5:30 AM please contact the property in advance using the information on the booking confirmation. Guests must contact the property in advance for check-in instructions. Front desk staff will greet guests on arrival.</p>",852-27309328,Dry cleaning/laundry service Shopping on site Luggage storage Meeting rooms 24-hour front desk Breakfast available (surcharge) Free WiFi Designated smoking areas Safe-deposit box at front desk In-room accessibility (in select rooms) Wheelchair accessible parking Laundry facilities Tours/ticket assistance Accessible bathroom (in select rooms) elevator Fitness facilities Wheelchair accessible path of travel Concierge services,22.303107|114.174681,852-3122-6222,00000,http://www.bestwesterngrandhotel.com
HK,Hong Kong,145656,Hong Kong,1032741,Ramada Hong Kong Harbour View,FourStar,"239 Queen MTR Sai Ying Pun Station, Exit A1 MTR Sai Ying Pun Station Exit A1Hong Kong ",Distances are displayed to the nearest 0.1 mile and kilometer. <br /> <p>Tsan Yuk Hospital - 0.2 km / 0.1 mi <br /> Hollywood Road - 0.4 km / 0.2 mi <br /> University of Hong Kong - 0.6 km / 0.4 mi <br /> Man Mo Temple - 0.7 km / 0.5 mi <br /> Hong Kong - Macau Ferry Terminal - 1 km / 0.6 mi <br /> Soho - 1.2 km / 0.7 mi <br /> Mid-levels Escalators - 1.2 km / 0.8 mi <br /> Tai Kwun - Centre for Heritage and Arts - 1.3 km / 0.8 mi <br /> Lan Kwai Fong - 1.7 km / 1.1 mi <br /> IFC Mall - 1.8 km / 1.1 mi <br /> International Finance Centre - 1.8 km / 1.1 mi <br /> HSBC Hong Kong Headquarter Building - 2.1 km / 1.3 mi <br /> Central Ferry Piers - 2.2 km / 1.3 mi <br /> The Peak Tram - 2.3 km / 1.4 mi <br /> Hong Kong Park - 2.5 km / 1.5 mi <br /> </p><p>The preferred airport for Ramada Hong Kong Harbour View is Hong Kong International Airport (HKG) - 35.4 km / 22 mi </p>,"<p>HeadLine : In Hong Kong (Central & Western District)</p><p>Location : With a stay at Ramada Hong Kong Harbour View in Hong Kong (Central & Western District), you ll be steps from Tsan Yuk Hospital and 8 minutes by foot from University of Hong Kong.  This 4-star hotel is 0.8 mi (1.3 km) from Hong Kong - Macau Ferry Terminal and 0.8 mi (1.3 km) from Man Mo Temple.</p><p>Rooms : Make yourself at home in one of the 432 air-conditioned guestrooms. Complimentary wireless Internet access keeps you connected, and satellite programming is available for your entertainment. Private bathrooms with showers feature complimentary toiletries and hair dryers. Conveniences include phones, as well as safes and electric kettles.</p><p>Dining : Enjoy a satisfying meal at Terrace Cafe serving guests of Ramada Hong Kong Harbour View.</p><p>Renovations : The following facilities are closed seasonally each year. They will be closed from November 01 to May 31:<ul><li>Swimming pool</li></ul></p><p>CheckIn Instructions : <ul>  <li>Extra-person charges may apply and vary depending on property policy</li><li>Government-issued photo identification and a credit card or cash deposit may be required at check-in for incidental charges</li><li>Special requests are subject to availability upon check-in and may incur additional charges; special requests cannot be guaranteed</li><li>The name on the credit card used at check-in to pay for incidentals must be the primary name on the guestroom reservation</li><li>This property accepts credit cards; cash is not accepted</li><li>Safety features at this property include a fire extinguisher, a smoke detector, a security system, and a first aid kit</li>  </ul></p><p>Special Instructions : Front desk staff will greet guests on arrival. This is a designated quarantine hotel. The property can only accept bookings from travelers who are required to quarantine (i.e. international travelers). You may be asked to provide evidence of this on arrival.</p>",85-255-91266,Dry cleaning/laundry service Wheelchair accessible (may have limitations) Babysitting or childcare (free) Vending machine Express check-out Express check-in Multilingual staff Business center Number of meeting rooms - 1 24-hour front desk Television in common areas Free WiFi Designated smoking areas Outdoor seasonal pool Safe-deposit box at front desk Designated smoking areas (fines apply) Laundry facilities Free newspapers in lobby elevator Fitness facilities Concierge services,22.286863|114.143524,852-25-999888,N A,http://www.bestwesternhotelharbourview.com/tc/
