countyCode,countyName,cityCode,cityName,HotelCode,HotelName,HotelRating,Address,Attractions,Description,FaxNumber,HotelFacilities,Map,PhoneNumber,PinCode,HotelWebsiteUrl
HK,Hong Kong,145656,Hong Kong,1094947,Four Seasons Hong Kong,FiveStar,8 Finance Street Central Hong Kong 0 CentralHong Kong ,Distances are displayed to the nearest 0.1 mile and kilometer. <br /> <p>IFC Mall - 0.2 km / 0.1 mi <br /> International Finance Centre - 0.3 km / 0.2 mi <br /> Exchange Square - 0.6 km / 0.3 mi <br /> Central Ferry Piers - 0.8 km / 0.5 mi <br /> Shun Tak Centre - 0.8 km / 0.5 mi <br /> Hong Kong - Macau Ferry Terminal - 0.8 km / 0.5 mi <br /> Lan Kwai Fong - 1 km / 0.6 mi <br /> Mid-levels Escalators - 1 km / 0.6 mi <br /> Tai Kwun - Centre for Heritage and Arts - 1 km / 0.6 mi <br /> Soho - 1 km / 0.6 mi <br /> Hollywood Road - 1.1 km / 0.7 mi <br /> Central Harbourfront Event Space - 1.2 km / 0.7 mi <br /> HSBC Hong Kong Headquarter Building - 1.2 km / 0.8 mi <br /> Man Mo Temple - 1.3 km / 0.8 mi <br /> The Peak Tram - 1.6 km / 1 mi <br /> </p><p>The preferred airport for Four Seasons Hotel Hong Kong is Hong Kong International Airport (HKG) - 37.1 km / 23 mi </p>,"<p>HeadLine : Near IFC Mall</p><p>Location : With a stay at Four Seasons Hotel Hong Kong, you ll be centrally located in Hong Kong, steps from IFC Mall and within a 5-minute walk of International Finance Centre.  This 5-star hotel is 0.4 mi (0.7 km) from Exchange Square and 0.5 mi (0.8 km) from Central Ferry Piers.</p><p>Rooms : Make yourself at home in one of the 399 air-conditioned rooms featuring iPod docking stations and minibars. Your pillowtop bed comes with down comforters and premium bedding. LED televisions with satellite programming provide entertainment, while complimentary wireless Internet access keeps you connected. Private bathrooms with separate bathtubs and showers feature deep soaking bathtubs and designer toiletries.</p><p>Dining : Enjoy international cuisine at The Lounge, one of the hotel s 8 restaurants, or stay in and take advantage of the 24-hour room service. Snacks are also available at the coffee shop/cafe. Relax with a refreshing drink from the poolside bar or one of the 2 bars/lounges. Cooked-to-order breakfasts are available daily from 7:00 AM to 10:30 AM for a fee.</p><p>CheckIn Instructions : <ul>  <li>Extra-person charges may apply and vary depending on property policy</li><li>Government-issued photo identification and a credit card, debit card, or cash deposit may be required at check-in for incidental charges</li><li>Special requests are subject to availability upon check-in and may incur additional charges; special requests cannot be guaranteed</li><li>This property accepts credit cards, debit cards, and cash</li><li>Safety features at this property include a fire extinguisher, a smoke detector, a security system, a first aid kit, and window guards</li><li>Please note that cultural norms and guest policies may differ by country and by property; the policies listed are provided by the property</li>  </ul></p><p>Special Instructions : Front desk staff will greet guests on arrival.  Guests booked in rooms with Club Lounge access included receive access for up to 2 guests.</p>",852-31-968899,Gift shops or newsstand Dry cleaning/laundry service Shopping on site Babysitting or childcare (surcharge) Terrace Pool sun loungers Limo or Town Car service available Number of bars/lounges - 2 Number of spa tubs - 1 Number of poolside bars - 1 Number of outdoor pools - 2 In-room accessibility (in select rooms) Wheelchair accessible parking Roll-in shower (in select rooms) Tours/ticket assistance Accessible bathroom (in select rooms) Multilingual staff Breakfast available (surcharge) Number of coffee shops/cafes - 1 Laundry facilities elevator Fitness facilities Wheelchair accessible Ballroom Concierge services 24-hour business center Express check-in Meeting rooms Spa treatment room(s) Full-service spa Wedding services 24-hour fitness facilities Shopping mall on site Area shuttle (surcharge) Yoga classes/instruction on site Luggage storage Express check-out Porter/bellhop Business center 24-hour front desk Spa services on site Safe-deposit box at front desk Smoke-free property Sauna Steam room Conference space Valet parking (surcharge) Hair salon Computer station,22.28673|114.15614,852-31-968888,0,http://www.fourseasons.com/hongkong/
HK,Hong Kong,145656,Hong Kong,1096719,Two Macdonnell Road,FourStar,Two Macdonnell Road Mid Level Mid-Level 2 MacDonnell RoadHong Kong ,Distances are displayed to the nearest 0.1 mile and kilometer. <br /> <p>Hong Kong Park - 0.5 km / 0.3 mi <br /> The Peak Tram - 0.6 km / 0.4 mi <br /> Lan Kwai Fong - 0.8 km / 0.5 mi <br /> HSBC Hong Kong Headquarter Building - 0.9 km / 0.6 mi <br /> Hollywood Road - 1 km / 0.6 mi <br /> Tai Kwun - Centre for Heritage and Arts - 1.1 km / 0.7 mi <br /> Pacific Place - 1.1 km / 0.7 mi <br /> Mid-levels Escalators - 1.2 km / 0.7 mi <br /> Soho - 1.3 km / 0.8 mi <br /> IFC Mall - 1.4 km / 0.9 mi <br /> Central Harbourfront Event Space - 1.4 km / 0.9 mi <br /> Cat Street - 1.6 km / 1 mi <br /> Hong Kong Academy for Performing Arts - 1.8 km / 1.1 mi <br /> Central Ferry Piers - 1.8 km / 1.1 mi <br /> International Finance Centre - 2 km / 1.2 mi <br /> </p><p>The preferred airport for Two MacDonnell Road is Hong Kong International Airport (HKG) - 39.4 km / 24.5 mi </p>,"<p>HeadLine : Near The Peak Tram</p><p>Location : With a stay at Two MacDonnell Road, you ll be centrally located in Hong Kong, a 4-minute drive from Hong Kong Convention and Exhibition Centre and 9 minutes from Ocean Park.  This 4-star aparthotel is 1.2 mi (1.9 km) from Lan Kwai Fong and 2.1 mi (3.4 km) from Victoria Harbour.</p><p>Rooms : Make yourself at home in one of the 213 air-conditioned rooms featuring kitchenettes with stovetops and microwaves. LED televisions with digital programming provide entertainment, while complimentary wireless Internet access keeps you connected. Conveniences include safes and coffee/tea makers, as well as phones with free local calls.</p><p>Dining : Enjoy local and international cuisine at café bar on 8, a restaurant where you can take in the garden view, or stay in and take advantage of the room service (during limited hours). Quench your thirst with your favorite drink at the bar/lounge.</p><p>CheckIn Instructions : <ul>  <li>Extra-person charges may apply and vary depending on property policy</li><li>Government-issued photo identification and a credit card or cash deposit may be required at check-in for incidental charges</li><li>Special requests are subject to availability upon check-in and may incur additional charges; special requests cannot be guaranteed</li><li>The name on the credit card used at check-in to pay for incidentals must be the primary name on the guestroom reservation</li><li>Guests must contact this property in advance to reserve cribs/infant beds</li><li>This property accepts credit cards; cash is not accepted</li><li>Safety features at this property include a fire extinguisher, a smoke detector, a security system, and a first aid kit</li>  </ul></p><p>Special Instructions : This property offers transfers from the airport (surcharges may apply). Guests must contact the property with arrival details before travel, using the contact information on the booking confirmation. Front desk staff will greet guests on arrival.</p>",852-21311000,Dry cleaning/laundry service Covered parking secured parking Uncovered parking Parking (limited spaces) Babysitting or childcare (surcharge) Reception hall Number of meeting rooms - 1 Free WiFi Number of bars/lounges - 1 Free newspapers in lobby Wedding services Airport transportation (surcharge) Wheelchair accessible  no Luggage storage Porter/bellhop Business center 24-hour front desk Safe-deposit box at front desk Laundry facilities elevator Self parking (surcharge) Concierge services,22.27606|114.1559,85221322132,031103,http://twomr.com.hk
HK,Hong Kong,145656,Hong Kong,1107974,Le Meridien Cyberport,FiveStar,100 Cyberport Road Pokfulam Hongkong ,Distances are displayed to the nearest 0.1 mile and kilometer. <br /> <p>Cyberport - 0.1 km / 0.1 mi <br /> Aberdeen Fishing Village - 2.8 km / 1.7 mi <br /> Sai Wan Swimming Shed - 2.9 km / 1.8 mi <br /> Peak Tower - 3.4 km / 2.1 mi <br /> Victoria Harbour - 3.5 km / 2.2 mi <br /> University of Hong Kong - 3.7 km / 2.3 mi <br /> Tai Kwun - Centre for Heritage and Arts - 6.1 km / 3.8 mi <br /> Soho - 6.2 km / 3.8 mi <br /> Hong Kong Zoo and Botanical Gardens - 6.3 km / 3.9 mi <br /> Lan Kwai Fong - 6.9 km / 4.3 mi <br /> Central Ferry Piers - 7.1 km / 4.4 mi <br /> IFC Mall - 7.2 km / 4.5 mi <br /> HSBC Hong Kong Headquarter Building - 7.3 km / 4.5 mi <br /> Ocean Park - 7.3 km / 4.5 mi <br /> Central Harbourfront Event Space - 7.4 km / 4.6 mi <br /> </p><p>The preferred airport for Le Méridien Hong Kong  Cyberport is Hong Kong International Airport (HKG) - 40.8 km / 25.4 mi </p>,"<p>HeadLine : In Hong Kong (Southern District)</p><p>Location : Located in Hong Kong (Southern District), Le Méridien Hong Kong, Cyberport is within a 15-minute drive of Sai Wan Swimming Shed and Hong Kong - Macau Ferry Terminal.  This 5-star hotel is 4.3 mi (6.9 km) from Lan Kwai Fong and 4.5 mi (7.3 km) from Ocean Park.</p><p>Rooms : Make yourself at home in one of the 170 guestrooms featuring refrigerators and plasma televisions. Complimentary wireless Internet access is available to keep you connected. Private bathrooms with showers feature complimentary toiletries and hair dryers. Conveniences include phones, as well as safes and desks.</p><p>Dining : Enjoy Japanese cuisine at Umami, one of the hotel s 3 restaurants, or stay in and take advantage of the 24-hour room service. Relax with your favorite drink at the bar/lounge or the poolside bar. Buffet breakfasts are available daily from 7:00 AM to 10:30 AM for a fee.</p><p>Renovations : The following facilities or services will be unavailable from December 19 2022 to February 10 2023 (dates subject to change): <ul><li>Swimming pool</li></ul></p><p>CheckIn Instructions : <ul>  <li>Extra-person charges may apply and vary depending on property policy</li><li>Government-issued photo identification and a credit card, debit card, or cash deposit may be required at check-in for incidental charges</li><li>Special requests are subject to availability upon check-in and may incur additional charges; special requests cannot be guaranteed</li><li>Be prepared: check the latest COVID-19 travel requirements and measures in place for this destination before you travel.</li><li>Please note that cultural norms and guest policies may differ by country and by property; the policies listed are provided by the property</li>  </ul></p><p>Special Instructions : This property offers transfers from the train station (surcharges may apply). To arrange pick-up, guests must contact the property 24 hours prior to arrival, using the contact information on the booking confirmation. Front desk staff will greet guests on arrival.  Due to COVID-19, this propertys hotel facilities or services options may be limited pursuant to local regulations.</p>",852-2980 7888,Wheelchair-accessible registration desk Wheelchair-accessible pool Wheelchair-accessible fitness center Wheelchair-accessible meeting spaces/business center Wheelchair-accessible on-site restaurant Picnic area Express check-in Wheelchair-accessible lounge Number of outdoor pools - 1 Handrails in stairways Wheelchairs available on site Theme park shuttle (surcharge) elevator Fitness facilities Stair-free path to entrance 24-hour front desk Pool access ramp on site Porter/bellhop Express check-out Dry cleaning/laundry service Self parking (surcharge) Limo or Town Car service available Swimming pool Food and water bowls Distance from property (ft) - 0 Number of meeting rooms - 14 Terrace Luggage storage Train station pickup (surcharge) Concierge services Conference center Wheelchair accessible (may have limitations) Pool umbrellas Lifeguard on site Barbecue grill(s) Number of bars/lounges - 1 Number of poolside bars - 1 Train station drop-off (surcharge) Conference space Tours/ticket assistance Electric car charging station Free WiFi Pool sun loungers Sauna Smoke-free property Outdoor seasonal pool Safe-deposit box at front desk Breakfast available (surcharge) 24-hour business center Ballroom Banquet hall Laundry facilities Wheelchair accessible path of travel Accessible bathroom Roll-in shower Wheelchair-accessible public washroom Wheelchair accessible parking Wheelchair-accessible concierge desk Wedding services In-room accessibility Wheelchair-accessible van parking Braille or raised signage Valet for wheelchair-equipped vehicle Garden Wheelchair-accessible path to elevator Multilingual staff,22.262206|114.129364,+85229807788,X,http://www.hongkong.lemeridien.com
HK,Hong Kong,145656,Hong Kong,1117907,Winland 800 Hotel,ThreeStar,No.1 Tsing Yi Road  ,Distances are displayed to the nearest 0.1 mile and kilometer. <br /> <p>Maritime Square - 1.7 km / 1.1 mi <br /> Nina Towers - 3.8 km / 2.4 mi <br /> Tsuen Wan Plaza - 4 km / 2.5 mi <br /> Nathan Road Shopping District - 8.5 km / 5.3 mi <br /> Victoria Harbour - 8.6 km / 5.3 mi <br /> Langham Place Mall - 9 km / 5.6 mi <br /> Ladies  Market - 9.4 km / 5.8 mi <br /> Elements Shopping Mall - 9.6 km / 5.9 mi <br /> Sky 100 - 9.6 km / 6 mi <br /> International Commerce Centre - 10 km / 6.2 mi <br /> Temple Street Night Market - 10 km / 6.2 mi <br /> Kowloon Park - 10 km / 6.2 mi <br /> Hong Kong China Ferry Terminal - 10.4 km / 6.4 mi <br /> Harbour City - 10.4 km / 6.5 mi <br /> Granville Road - 10.5 km / 6.5 mi <br /> </p><p>The nearest airports are:<br />Hong Kong International Airport (HKG) - 27.1 km / 16.8 mi<br /> Shenzhen Intl. Airport (SZX) - 60.6 km / 37.6 mi<br /> </p><p></p>,"<p>HeadLine : Near Maritime Square</p><p>Location : Located in Tsing Yi, Winland 800 Hotel is within a 10-minute drive of Ladies  Market and Victoria Harbour.  This hotel is 8 mi (12.8 km) from Kowloon Bay and 8.3 mi (13.4 km) from Hong Kong - Macau Ferry Terminal.</p><p>Rooms : Make yourself at home in one of the 800 air-conditioned rooms featuring LED televisions. Digital television is provided for your entertainment. Private bathrooms with showers feature complimentary toiletries and hair dryers. Conveniences include phones, housekeeping is provided daily, and you can request irons/ironing boards.</p><p>Dining : Stop by the hotel s restaurant for lunch or dinner, or grab snacks at the coffee shop/cafe. Local cuisine breakfasts are available daily from 7:00 AM to 10:00 AM for a fee.</p><p>Renovations : The following facilities are closed seasonally each year. They will be closed from May 01 to September 30:<ul><li>Swimming pool</li></ul></p><p>CheckIn Instructions : <ul>  <li>Extra-person charges may apply and vary depending on property policy</li><li>Government-issued photo identification and a credit card, debit card, or cash deposit may be required at check-in for incidental charges</li><li>Special requests are subject to availability upon check-in and may incur additional charges; special requests cannot be guaranteed</li><li>This property accepts credit cards; cash is not accepted</li><li>Please note that cultural norms and guest policies may differ by country and by property; the policies listed are provided by the property</li>  </ul></p><p>Special Instructions : Front desk staff will greet guests on arrival.  This property is not suitable for guests who are required to quarantine, due to the property s communal areas. Customers may be requested by the property to provide documentation of recent travel history (such as showing passport immigration stamps) and/or complete a health declaration.</p>",852-21297777,Dry cleaning/laundry service Wheelchair accessible  no Luggage storage 24-hour front desk Breakfast available (surcharge) Free WiFi Outdoor seasonal pool Smoke-free property Number of coffee shops/cafes - 1 Laundry facilities Tours/ticket assistance elevator Fitness facilities Concierge services,22.344291|114.109228,852-21297888,000000,http://www.mexan-harbour.com/index.html
HK,Hong Kong,145656,Hong Kong,1117909,B & B Cheung Chau,ThreeStar,83 Tung Wan Road Cheung Chau Basement Cheung ChauHong Kong ,Distances are displayed to the nearest 0.1 mile and kilometer. <br /> <p>Cheung Sha Beach - 8.6 km / 5.3 mi <br /> Silvermine Beach - 9.9 km / 6.2 mi <br /> Golden Beach - 32.3 km / 20.1 mi <br /> Hung Hom Promenade - 46 km / 28.6 mi <br /> </p><p>The nearest airports are:<br />Hong Kong International Airport (HKG) - 19 km / 11.8 mi<br /> Macau Intl. Airport (MFM) - 76.9 km / 47.8 mi<br /> </p><p></p>,"<p>HeadLine : Near the beach</p><p>Location : With a stay at B&B Cheung Chau in Cheung Chau, you ll be near the beach, and 5.3 mi (8.6 km) from Cheung Sha Beach and 6.2 mi (9.9 km) from Silvermine Beach.  This beach bed & breakfast is 20.1 mi (32.3 km) from Golden Beach and 28.6 mi (46 km) from Hung Hom Promenade.</p><p>Rooms : Make yourself at home in one of the 10 air-conditioned rooms featuring refrigerators and flat-screen televisions. Complimentary wireless Internet access is available to keep you connected. Bathrooms feature showers, complimentary toiletries, and hair dryers. Conveniences include electric kettles and complimentary bottled water, and housekeeping is provided daily.</p><p>Dining : Satisfy your appetite with German cuisine at Eggenberg Restaurant, one of the bed & breakfast s 2 restaurants. Wrap up your day with a drink at the bar/lounge. Self-serve breakfasts are available daily from 8:00 AM to 10:30 AM for a fee.</p><p>CheckIn Instructions : <ul>  <li>Extra-person charges may apply and vary depending on property policy</li><li>Government-issued photo identification and a credit card, debit card, or cash deposit may be required at check-in for incidental charges</li><li>Special requests are subject to availability upon check-in and may incur additional charges; special requests cannot be guaranteed</li><li>This property accepts credit cards; cash is not accepted</li>  </ul></p><p>Special Instructions : The front desk is open daily from 8:00 AM - midnight. The check-in location differs from the property location. To check in, go to No. 83 G/F Tung Wan Road Cheung Chau ?????83??? To make arrangements for check-in please contact the property at least 24 hours before arrival using the information on the booking confirmation. Guests planning to arrive outside of normal check-in hours must contact the property in advance for check-in instructions and lockbox information. Front desk staff will greet guests on arrival.</p>",852-29869980,Tours/ticket assistance Terrace Gift shops or newsstand Dry cleaning/laundry service Shopping on site Luggage storage Front desk (limited hours) Breakfast available (surcharge) Free WiFi Number of bars/lounges - 1 Smoke-free property Laundry facilities,22.211897|114.027852,+852 29869990,999077,http://www.bbcheungchau.com.hk
HK,Hong Kong,145656,Hong Kong,1117913,Caritas Oswald Cheung InternationalHouse,ThreeStar,20 Tin Wan Street Aberdeen Southern District Tin WanAberdeenHong Kong ,Distances are displayed to the nearest 0.1 mile and kilometer. <br /> <p>Cyberport - 2.3 km / 1.4 mi <br /> Ocean Park - 3.2 km / 2 mi <br /> Peak Tower - 4.3 km / 2.7 mi <br /> Hung Shing Yeh Beach - 4.4 km / 2.7 mi <br /> Repulse Bay - 6.3 km / 3.9 mi <br /> Causeway Bay Shopping Plaza - 6.7 km / 4.2 mi <br /> Happy Valley Race Course - 6.9 km / 4.3 mi <br /> Hong Kong Adventist Hospital - 7 km / 4.4 mi <br /> Repulse Bay Beach - 7.1 km / 4.4 mi <br /> Wan Chai Road - 7.2 km / 4.5 mi <br /> Hong Kong Sogo - 7.5 km / 4.7 mi <br /> Central Plaza - 8.1 km / 5 mi <br /> Victoria Harbour - 8.2 km / 5.1 mi <br /> University of Hong Kong - 8.3 km / 5.1 mi <br /> Pacific Place - 8.3 km / 5.2 mi <br /> </p><p>The preferred airport for Caritas Oswald Cheung International House is Hong Kong International Airport (HKG) - 41.7 km / 25.9 mi </p>,"<p>HeadLine : In Hong Kong (Southern District)</p><p>Location : Located in Hong Kong (Southern District), Caritas Oswald Cheung International House is within a 10-minute drive of Ocean Park and Hong Kong Convention and Exhibition Centre.  This hotel is 5.1 mi (8.2 km) from Victoria Harbour and 5.8 mi (9.3 km) from Lan Kwai Fong.</p><p>Rooms : Make yourself at home in one of the 119 guestrooms featuring minibars. Complimentary wireless Internet access is available to keep you connected. Bathrooms have complimentary toiletries and slippers. Conveniences include safes and desks, and housekeeping is provided daily.</p><p>Dining : Enjoy a meal at the restaurant, or stay in and take advantage of the hotel s room service (during limited hours). Cooked-to-order breakfasts are available daily from 7:30 AM to 10:00 AM for a fee.</p><p>CheckIn Instructions : <ul>  <li>Extra-person charges may apply and vary depending on property policy</li><li>Government-issued photo identification and a credit card, debit card, or cash deposit may be required at check-in for incidental charges</li><li>Special requests are subject to availability upon check-in and may incur additional charges; special requests cannot be guaranteed</li><li>This property accepts credit cards; cash is not accepted</li>  </ul></p><p>Special Instructions : There is no front desk at this property. The host will greet guests on arrival.</p>",852-852-29030101,Dry cleaning/laundry service Smoke-free property In-room accessibility (in select rooms) Accessible bathroom (in select rooms) Luggage storage elevator Number of meeting rooms - 1 Wheelchair accessible path of travel Breakfast available (surcharge) Free WiFi,22.249789|114.149389,1-852-29030111,0,http://www.caritas-chs.org.hk/chi/index.asp
HK,Hong Kong,145656,Hong Kong,1117925,Y Loft Youth Square,ThreeStar,"12Th Floor Youth Square No.238 Chai Wan Road, Chai Wan Chai WanHong Kong ",Distances are displayed to the nearest 0.1 mile and kilometer. <br /> <p>Lei Yue Mun Park and Holiday Village - 2.1 km / 1.3 mi <br /> Big Wave Bay Beach - 2.7 km / 1.7 mi <br /> Victoria Harbour - 3.9 km / 2.4 mi <br /> Taikoo Place - 4.8 km / 3 mi <br /> Shek O Beach - 4.9 km / 3 mi <br /> Chun Yeung Street Market - 6.1 km / 3.8 mi <br /> Victoria Park - 7.5 km / 4.6 mi <br /> Stanley Main Beach - 7.8 km / 4.8 mi <br /> Hong Kong Central Library - 7.8 km / 4.9 mi <br /> Stanley Market - 8.1 km / 5 mi <br /> Causeway Bay Shopping Plaza - 8.2 km / 5.1 mi <br /> Hong Kong Sogo - 8.6 km / 5.3 mi <br /> Times Square Shopping Mall - 8.8 km / 5.5 mi <br /> Happy Valley Race Course - 8.9 km / 5.5 mi <br /> Apm Shopping Mall - 9 km / 5.6 mi <br /> </p><p>The preferred airport for Y Loft Youth Square is Hong Kong International Airport (HKG) - 47.1 km / 29.3 mi </p>,"<p>HeadLine : In Hong Kong (Hong Kong East)</p><p>Location : With a stay at Y Loft Youth Square in Hong Kong (Hong Kong East), you ll be within a 15-minute drive of Ocean Park and Kowloon Bay.  This hotel is 2.3 mi (3.7 km) from Victoria Harbour and 6.2 mi (10 km) from Hong Kong Convention and Exhibition Centre.</p><p>Rooms : Make yourself at home in one of the 148 air-conditioned guestrooms. Complimentary wireless Internet access keeps you connected, and satellite programming is available for your entertainment. Bathrooms have showers and hair dryers. Conveniences include safes and desks, as well as phones with free local calls.</p><p>Dining : At Y Loft Youth Square, enjoy a satisfying meal at the restaurant.</p><p>CheckIn Instructions : <ul>  <li>Extra-person charges may apply and vary depending on property policy</li><li>Government-issued photo identification and a credit card, debit card, or cash deposit may be required at check-in for incidental charges</li><li>Special requests are subject to availability upon check-in and may incur additional charges; special requests cannot be guaranteed</li><li>This property accepts credit cards and cash</li><li>Safety features at this property include a fire extinguisher, a smoke detector, a security system, a first aid kit, and window guards</li>  </ul></p><p>Special Instructions : This property doesn t offer after-hours check-in. Front desk staff will greet guests on arrival.</p>",85-2-37218990,Gift shops or newsstand Vending machine Meeting rooms Free WiFi Arcade/game room Braille or raised signage Garden In-room accessibility (in select rooms) Roll-in shower (in select rooms) Tours/ticket assistance Accessible bathroom (in select rooms) Wheelchair accessible  no Luggage storage Business center 24-hour front desk Conference center Water dispenser Safe-deposit box at front desk Smoke-free property Laundry facilities elevator Fitness facilities Computer station Terrace Concierge services,22.263256|114.237012,85-2-37218989,,http://www.youthsquare.hk/
