countyCode,countyName,cityCode,cityName,HotelCode,HotelName,HotelRating,Address,Attractions,Description,FaxNumber,HotelFacilities,Map,PhoneNumber,PinCode,HotelWebsiteUrl
HU,Hungary,109715,Badacsony,5238604,Sandahl Rezidencia,All,Római Út 203 1  ,,"Situated in Badacsonytomaj, within 31 km of Thermal Lake Hévíz and 33 km of Sümeg Castle, Sandahl Rezidencia features accommodation with a terrace and free WiFi as well as free private parking for guests who drive. The property is around 7.3 km from Szigliget Castle and Museum, 13 km from Tapolca Lake Cave and 18 km from St Michael Hill and St Michael Chapel. The property is non-smoking and is set 40 km from Tihany Abbey.

The rooms are fitted with air conditioning, a flat-screen TV with satellite channels, a fridge, a kettle, a shower, a hairdryer and a desk. All units at the guest house come with a private bathroom and bed linen.

A continental, vegetarian or vegan breakfast is available each morning at the property.

Festetics Castle is 25 km from Sandahl Rezidencia, while Balaton Museum is 26 km from the property. The nearest airport is HévízBalaton Airport, 40 km from the accommodation. Please inform Sandahl Rezidencia in advance of your expected arrival time. You can use the Special Requests box when booking, or contact the property directly with the contact details provided in your confirmation.
This property will not accommodate hen, stag or similar parties.
Guests are required to show a photo identification and credit card upon check-in. Please note that all Special Requests are subject to availability and additional charges may apply.
In accordance with government guidelines to minimise transmission of the Coronavirus (COVID-19), this property can only accept bookings from essential workers/permitted travellers, during dates where such guidelines exist. Reasonable evidence must be provided on arrival. If it isnt provided, your booking will be cancelled on arrival.
In response to Coronavirus (COVID-19), additional safety and sanitation measures are in effect at this property.
In accordance with government guidelines to minimise transmission of the Coronavirus (COVID-19), this property may request additional documentation from guests to validate identity, travel itinerary and other relevant information, during dates where such guidelines exist.
Please note that the property has no 24-hour reception. Early or late check-in is only possible upon prior confirmation by the property. Contact details are stated in the booking confirmation.",,Key access Smoke alarms use of cleaning chemicals that are effective against coronavirus hand sanitizer in guest accommodation and key areas cashless payment available invoice provided Parking Terrace Non-smoking rooms Free parking internet services Heating wifi Free WiFi Non-smoking throughout Air conditioning designated smoking area parking on site Private parking Street parking Wine/champagne Outdoor furniture,46.79081|17.49102,,8261,https://www.booking.com/hotel/hu/sandahl-rezidencia.html
HU,Hungary,109715,Badacsony,5398195,Badacsony Camping,All,0303 1.Hrsz.  ,,"Situated in Badacsonytomaj in the Veszprem region and Kisfaludy Viewpoint reachable within 3.4 km, Badacsony Camping features accommodation with free WiFi, a childrens playground, a restaurant and free private parking.

Each unit features a patio, a kitchenette with a microwave, a dining area and a seating area with a flat-screen TV, while the private bathroom includes a shower. There is also a fridge, stovetop and a coffee machine.

The camping offers a barbecue.

Guests at Badacsony Camping can enjoy table tennis on site, or go hiking or cycling in the surroundings.

Szegedy Roza House Literature Museum is 3.4 km from the accommodation. The nearest airport is HévízBalaton Airport, 28 km from Badacsony Camping. Please inform Badacsony Camping in advance of your expected arrival time. You can use the Special Requests box when booking, or contact the property directly with the contact details provided in your confirmation.
This property will not accommodate hen, stag or similar parties.
A damage deposit of EUR 30 is required on arrival. This will be collected as a cash payment. You should be reimbursed on check-out. Your deposit will be refunded in full in cash, subject to an inspection of the property.",,BBQ facilities children's playground guest accommodation is disinfected between stays Fire extinguishers Shared kitchen Mini-market on site staff follow all safety protocols as directed by local authorities Sauna use of cleaning chemicals that are effective against coronavirus Fishing Massage cashless payment available Free parking linens  towels and laundry washed in accordance with local authority guidelines Parking internet services invoice provided Non-smoking throughout guest accommodation sealed after cleaning Cycling Private parking wifi available in all areas Non-smoking rooms Pets allowed Restaurant Beachfront kids' outdoor play equipment Water sport facilities (on site) Hiking Terrace Air conditioning 24-hour front desk hand sanitizer in guest accommodation and key areas Facilities for disabled guests designated smoking area Private beach area Table tennis first aid kit available wifi Free WiFi On-site parking property is cleaned by professional cleaning companies,46.7834|17.49923,,8261,https://www.booking.com/hotel/hu/badacsony-camping.html
HU,Hungary,109715,Badacsony,5477276,Óbester Panzió,All,Római Út 203  ,,"Surrounded by vineyards, Óbester Panzió enjoys a quiet location 1500 metres from the centre of Badacsony. With a seasonal grill restaurant and a wine cellar, it offers barbecue dishes with local vegetables. The traditional country-style building with a terrace provides panoramic views of Lake Balaton and the Badacsony Mountain.

The tastefully decorated pension features air-conditioned rooms and apartments with free Wi-Fi access and satellite TV. The private bathroom comes with a shower.

Panzió Óbester offers buffet breakfast. Guests can relax in the garden with a terrace. Free private parking is possible.

The lakeshore of Balaton can be reached in a 15-minute walk. Train station Badacsony is 1.5 km away.",,Terrace invoice provided wifi available in all areas Heating Smoke alarms Sun terrace Free WiFi Fire extinguishers designated smoking area Free parking internet services Non-smoking rooms Air conditioning wifi Restaurant Family rooms Non-smoking throughout Parking On-site parking Garden Luggage storage,46.78979|17.48997,(87) 431 181,8261,https://www.booking.com/hotel/hu/abester-panzia3.html
HU,Hungary,109715,Badacsony,5626238,Anna Villa Badacsony,All,Park Utca 80.  ,,"Boasting garden views, Anna Villa Badacsony offers accommodation with water sports facilities and a balcony, around 31 km from Sümeg Castle. There is an in-house restaurant, plus free private parking and free WiFi are available.

The apartment is fitted with 2 bedrooms, 1 bathroom, bed linen, towels, a TV with satellite channels, a dining area, a fully equipped kitchen, and a patio with lake views.

The apartment offers a terrace. Guests at Anna Villa Badacsony can enjoy hiking and fishing nearby, or make the most of the garden.

Thermal Lake Hévíz is 32 km from the accommodation, while Tihany Abbey is 38 km from the property. The nearest airport is HévízBalaton Airport, 41 km from Anna Villa Badacsony. This property will not accommodate hen, stag or similar parties.
Managed by a private host",,Free parking internet services Hiking Heating Horse riding wifi Free WiFi Non-smoking throughout Air conditioning water sport facilities on site grocery deliveries parking on site Private parking wifi available in all areas Parking garage Parking Restaurant Tennis Court Garden Beach invoice provided Terrace Non-smoking rooms Fishing Family rooms,46.79405|17.51092,,8261,https://www.booking.com/hotel/hu/anna-villa-badacsony.html
HU,Hungary,109715,Badacsony,5717978,Badacsony VendÉghÁz,All,Újhegy Út. 53.  ,,"Badacsony Vendégház is a holiday home with a terrace, situated in Badacsonytördemic. The property is 22 km from Hévíz and accessible via mountain roads. Free WiFi is provided. Free private parking and the electric vehicle charging station are available on site.

The kitchen comes with a dishwasher, a toaster and a refrigerator and there is a private bathroom with slippers and a hair dryer. A TV is available. Other facilities at Badacsony Vendégház include a barbecue.

The area is popular for horse riding and cycling. Siófok is 45 km from Badacsony Vendégház, while Balatonfüred is 35 km away. Payment before arrival via bank transfer is required. The property will contact you after you book to provide instructions.
Please inform Badacsony Vendégház in advance of your expected arrival time. You can use the Special Requests box when booking, or contact the property directly with the contact details provided in your confirmation.
Please note that the property accessible via a dirt road. Badacsony Vendégház apologises for any inconvenience.
Managed by a private host",,Parking Pets allowed Garden Terrace Non-smoking rooms Facilities for disabled guests Family rooms Free parking internet services Hiking BBQ facilities Heating wifi Free WiFi Non-smoking throughout Air conditioning shuttle service (additional charge) parking on site Private parking wifi available in all areas kids' outdoor play equipment electric vehicle charging station Pet bowls sun loungers or beach chairs Outdoor furniture Picnic area Outdoor fireplace Shuttle service Key access CCTV outside property Fire extinguishers use of cleaning chemicals that are effective against coronavirus guest accommodation is disinfected between stays guest accommodation sealed after cleaning staff follow all safety protocols as directed by local authorities shared stationery such as printed menus  magazines  pens  and paper removed first aid kit available contactless check-in/check-out cashless payment available,46.80254|17.48321,,8263,https://www.booking.com/hotel/hu/badacsony-vendeghaz.html
HU,Hungary,109715,Badacsony,5745972,Levendula Apartmanhaz,All,Park Utca 50  ,,"Situated 31 km from Sümeg Castle, Levendula Apartmanház offers a garden, a terrace and air-conditioned accommodation with a patio and free WiFi.

The units come with parquet floors and feature a fully equipped kitchen with a fridge, a dining area, a flat-screen TV with cable channels, and a private bathroom with shower and a hairdryer. A microwave, a stovetop and toaster are also available, as well as a coffee machine and a kettle.

The apartment offers a barbecue.

If you would like to discover the area, hiking and cycling are possible in the surroundings and Levendula Apartmanház can arrange a bicycle rental service.

Thermal Lake Hévíz is 32 km from the accommodation, while Tihany Abbey is 38 km from the property. The nearest airport is HévízBalaton Airport, 42 km from Levendula Apartmanház. This property will not accommodate hen, stag or similar parties.
In response to Coronavirus (COVID-19), additional safety and sanitation measures are in effect at this property.
Managed by a private host",,Parking Tennis Court Garden Terrace Non-smoking rooms Fishing Family rooms Free parking internet services Windsurfing Canoeing Hiking BBQ facilities Cycling Heating Horse riding wifi Mini golf Free WiFi Air conditioning designated smoking area Private check-in/check-out water sport facilities on site Evening entertainment parking on site Private parking wifi available in all areas Outdoor furniture Picnic area Outdoor fireplace Beach temporary art galleries Pub crawls Walking tours Bike tours CCTV outside property bicycle rental use of cleaning chemicals that are effective against coronavirus linens  towels and laundry washed in accordance with local authority guidelines guest accommodation is disinfected between stays guest accommodation sealed after cleaning staff follow all safety protocols as directed by local authorities shared stationery such as printed menus  magazines  pens  and paper removed hand sanitizer in guest accommodation and key areas process in place to check health of guests contactless check-in/check-out cashless payment available physical distancing rules followed screens or physical barriers placed between staff and guests in appropriate areas invoice provided property is cleaned by professional cleaning companies guests have the option to cancel any cleaning services for their accommodation during their stay,46.7915|17.50864,,8261,https://www.booking.com/hotel/hu/levendula-apartmanhaz-badacsonytomaj.html
HU,Hungary,109715,Badacsony,5783585,Romai Apartman,All,Romai Ut 168.  ,,"Situated in Badacsonytomaj, in the centre of Badacsony, 50 meters from the Istvándy Bormuhely and 1.9 km from Kisfaludy Viewpoint, Római Apartman és Horgászház features an outdoor pool and views of the mountain. Free WiFi is available throughout the property and free private parking is available on site.

Guests can enjoy free wine tasting at the property. Continental breakfast is available 500 metres from the property for an additional fee.

All units feature a flat-screen TV. Some units have a dining area and/or terrace. There is also a kitchenette, fitted with a microwave. A fridge and coffee machine are also featured. Bed linen is offered.

Római Apartman és Horgászház also includes a barbecue. Several restaurants and wine cellars are reachable in a radius of 300 metres.

Szegedy Roza House Literature Museum is 2.2 km away. The nearest airport is HévízBalaton Airport, 28 km from the property. This property will not accommodate hen, stag or similar parties.
Please note that the property also accepts a Szep Card, OTP, K&H, and MKB card as a payment method.",,physical distancing rules followed invoice provided property is cleaned by professional cleaning companies all plates  cutlery  glasses and other tableware have been sanitized Parking Garden Terrace Non-smoking rooms Fishing Laundry Family rooms Free parking internet services BBQ facilities Heating wifi Free WiFi Air conditioning designated smoking area Sun terrace parking on site Private parking wifi available in all areas kids' outdoor play equipment Accessible parking sun loungers or beach chairs Outdoor furniture Outdoor fireplace use of cleaning chemicals that are effective against coronavirus linens  towels and laundry washed in accordance with local authority guidelines guest accommodation is disinfected between stays guest accommodation sealed after cleaning physical distancing in dining areas staff follow all safety protocols as directed by local authorities shared stationery such as printed menus  magazines  pens  and paper removed contactless check-in/check-out cashless payment available,46.79038|17.50502,,8258,https://www.booking.com/hotel/hu/romai-apartman-es-horgaszhaz.html
