countyCode,countyName,cityCode,cityName,HotelCode,HotelName,HotelRating,Address,Attractions,Description,FaxNumber,HotelFacilities,Map,PhoneNumber,PinCode,HotelWebsiteUrl
LT,Lithuania,128635,Moletai,1891004,Oro Dubingiai,ThreeStar,Giraiciu Kaimas 8 Dubingiu Seniunija33260 Moletu Rajono Savivaldybe ,,"Situated in a woodland area 100 metres from the Lake Asveja, Dubingiai boasts a private beach. Its guests can take advantage of a wide range of wellness and leisure facilities, such as a billiards room, a fitness centre or hot tubs. Free Wi-Fi access is available.

Dubingiai offers accommodation in classically decorated rooms and apartments, each of which comes with a TV and a private bathroom with a shower. Some come with a well-equipped kitchenette. Towels and linen are provided.

The resort provides such facilities as a tennis court, a bowling alley, and a complex of spa and steam baths with a heated pool. Guests can also enjoy karaoke or a game of table tennis. The beach comes with a pier and a rental of boats and other beach equipment. Dressing cabins are also available.

The Dubinge restaurant specialises in traditional Lithuanian cuisine, but also offers a selection of European dishes, as well as snacks. Picnic baskets can be provided.  The restaurant comes with a large terrace and boasts a view of the old pine forest.

Dubingiai is 10 km from the national road number A14. The nearest store is within 3 km, and Vilnius is 45 km away. Guests are required to show a photo identification and credit card upon check-in. Please note that all Special Requests are subject to availability and additional charges may apply.",,Parking Restaurant Room service meeting/banquet facilities Bar Tennis Court Sauna Fitness centre Garden Terrace Non-smoking rooms Airport shuttle Fishing Business centre Laundry Facilities for disabled guests Skiing Family rooms Free parking internet services lift express check-in/check-out Safety Deposit Box Valet parking Spa and wellness centre Massage children's playground Billiards Table tennis Soundproof rooms Hiking BBQ facilities Packed lunches Cycling Bowling hammam Heating Fax/photocopying Diving Snorkelling Luggage storage wifi Indoor pool Free WiFi designated smoking area Private beach area Snack Bar indoor pool (all year) Private check-in/check-out shuttle service (additional charge) ski equipment hire on site water sport facilities on site airport shuttle (additional charge) Lockers Beachfront Key access Water park Security alarm Daily housekeeping Smoke alarms parking on site Private parking wifi available in all areas CCTV in common areas CCTV outside property Fire extinguishers Swimming pool bicycle rental board games/puzzles kids' outdoor play equipment Kid meals Kid-friendly buffet secured parking Accessible parking Wheelchair accessible Pool with view Heated pool Wine/champagne Fruits airport pick up tennis equipment Badminton equipment coffee house on site sun loungers or beach chairs Outdoor furniture Picnic area Outdoor fireplace Beauty Services Body wrap Spa Facilities Spa lounge/relaxation area Spa/wellness packages Back massage Neck massage Foot massage Couples massage Head massage Hand massage Full body massage fitness/spa locker rooms Swimming pool Beach Shuttle service Walking tours Bike tours Themed dinner nights Happy hour Tour or class about local culture Live music/performance 24-hour security,55.04726|25.49506,,LT-33260,https://www.booking.com/hotel/lt/dubingiai.html
LT,Lithuania,128635,Moletai,1891127,Dubingiu Zirgynas,All,Zalktynes Kaimas 14A 33263 Moletu Rajonas Savivaldybe ,,"Dubingiu irgynas is located in a quiet area by a lake in Dubingiai. The property features an indoor horse riding hall, as well as an outdoor yard.

The rooms feature free WiFi and private bathrooms with a shower. Each room will also provide you with a view of the lake.

Dubingiu irgynas houses a restaurant and a bar, as well as a mini zoo. The property also offers meeting facilities and a sauna. Free parking is provided. Guests under the age of 18 can only check in with a parent or official guardian.",,Wine/champagne sun loungers or beach chairs Outdoor furniture Beach Walking tours 24-hour security Key access Security alarm Smoke alarms CCTV in common areas Fire extinguishers cashless payment available invoice provided Parking Restaurant meeting/banquet facilities Bar Sauna Terrace Non-smoking rooms Free parking children's playground Packed lunches Tour desk Heating Horse riding Non-smoking throughout designated smoking area parking on site Private parking board games/puzzles kids' outdoor play equipment Kid meals Kid-friendly buffet Street parking,55.04009|25.41407,,LT-33263,https://www.booking.com/hotel/lt/dubingiu-zirgynas.html
LT,Lithuania,128635,Moletai,5280421,Senoji ueiga,All,Vilniaus G. 29  ,,"Located in Moletai, Senoji ueiga offers accommodation in the citys centre, only 450 metres from the beach on the lake shore. It offers rooms with free Wi-Fi and private bathrooms.

The rooms of Senoji ueiga are elegant and bright. All include a shower, minibar and an electric kettle. Most have a satellite TV.

The property boasts a restaurant serving local and international cuisine. In the morning breakfast is served here. There are free public parking spaces available on site.

The nearest bus stop is within 300 metres. The Church of the Apostles St Peter and St Paul is within 200 metres away.",,Parking Restaurant Pets allowed Room service meeting/banquet facilities Bar Garden Terrace Non-smoking rooms Laundry Family rooms breakfast in the room Ironing service Free parking internet services express check-in/check-out Packed lunches Heating Fax/photocopying wifi Free WiFi Non-smoking throughout Air conditioning Private check-in/check-out Beachfront Daily housekeeping parking on site wifi available in all areas Kid meals Kid-friendly buffet secured parking Wine/champagne Fruits Outdoor furniture Beach Key access Security alarm Smoke alarms CCTV in common areas CCTV outside property Fire extinguishers staff follow all safety protocols as directed by local authorities invoice provided,55.23311|25.42138,,LT 33101,https://www.booking.com/hotel/lt/senoji-ua3-4eiga-guest-house.html
LT,Lithuania,128635,Moletai,5280429,Camping Mindunai,All,Kamuzes Kaimas Mindunai Raj. Moletai Aps.  ,,"Located in Moletai, Camping Mindunai is located 300 metres from the beach on Baltieji Lake. Surrounded by Labanoras forest, it offers rooms with a TV set and a private bathroom with a shower.

All guests have access to the common kitchen. They can also play a game of football or basketball, rent a boat or canoe. There also is a designated barbecue area on site.

The town of Moletai is within 10 km, and the Lithuanian Lithuanian Museum of Ethnocosmology is 20 km away. The Fishing Lake Museum is within 1.2 km from the Camping Mindunai.",,Parking Pets allowed Sauna Terrace Non-smoking rooms Family rooms internet services children's playground Canoeing Cycling Tour desk wifi Free WiFi Shared kitchen parking on site Private parking Open-air bath board games/puzzles kids' outdoor play equipment secured parking Street parking Outdoor furniture Picnic area Outdoor fireplace CCTV in common areas CCTV outside property Fire extinguishers bicycle rental invoice provided,55.22021|25.55976,,LT 30200,https://www.booking.com/hotel/lt/camping-mindunai.html
LT,Lithuania,128635,Moletai,5317249,Vila Kelmyne,All,Sporto G. 64  ,,"Vila Kelmyne is located in a woodland area of Moletai, 80 metres from a lake. Free Wi-Fi access is available.

The rooms are spacious and decorated in warm colours. Each comes with a flat-screen TV with cable channels, and some come with a private bathroom with a shower. Towels and linen are provided.

At Vila Kelmyne you will find a garden provided with barbecue facilities. Breakfast, included in the room rate, is served daily.

The Lake Siesartis is 500 metres from the property. The centre of Moletai is 2 km away, and the A14 national road is within 500 metres. Please inform Vila Kelmyne in advance of your expected arrival time. You can use the Special Requests box when booking, or contact the property directly with the contact details provided in your confirmation.",,wifi Kid meals Garden CCTV outside property Water park Parking children's playground Free parking Heating Free WiFi CCTV in common areas invoice provided Packed lunches Beachfront Bar Private parking Smoke alarms Daily housekeeping internet services Family rooms Security alarm Pets allowed Fishing Fire extinguishers On-site parking Sun terrace Hiking meeting/banquet facilities,55.23132|25.44451,,LT 33139,https://www.booking.com/hotel/lt/vila-kelmyne.html
LT,Lithuania,128635,Moletai,5428253,Azuluokesos Sodyba,All,Azuluokesa  ,,"Situated in Moletai in the Utena county region, Auluokesos sodyba features accommodation with free private parking. The accommodation is air conditioned and has a sauna.

The country house provides guests with a terrace, lake views, a seating area, a flat-screen TV, a fully equipped kitchenette with a fridge and a microwave, and a private bathroom with shower. A stovetop and kettle are also offered.

A private beach area can be found at Auluokesos sodyba, along with a barbecue.

Lithuanian Ethnocosmology Museum is 18 km from the accommodation, while European Center Golf Club is 37 km from the property. The nearest airport is Vilnius International Airport, 69 km from Auluokesos sodyba. Managed by a private host",,Parking Pets allowed Sauna Terrace Non-smoking rooms Fishing Family rooms Free parking BBQ facilities Heating Non-smoking throughout Air conditioning Private beach area water sport facilities on site parking on site Private parking Outdoor furniture Picnic area Steam room Beach Smoke alarms Fire extinguishers staff follow all safety protocols as directed by local authorities shared stationery such as printed menus  magazines  pens  and paper removed hand sanitizer in guest accommodation and key areas,55.20808|25.40773,,33159,https://www.booking.com/hotel/lt/azuluokesos-sodyba.html
LT,Lithuania,128635,Moletai,5843085,Guest House Guba,All,"Levanikiu G. 2, Levanikiai  ",,"Guest House Guba is located 50 metres from the Duriai Lake and it offers accommodation in quiet surroundings. There is a food shop in the same building.

The rooms are done in lively colours and each comes with a private bathroom with a shower, an electric kettle, a refrigerator and a TV with satellite channels.

Breakfast can be served in the room at guests request. The nearest restaurant is 4 km away.

The bus stop is 100 metres from Guest House Guba and Moletais town centre is 3 km away. Managed by a private host",,Parking Free parking internet services Heating wifi Free WiFi Non-smoking throughout minimarket on site parking on site Private parking invoice provided,55.26077|25.43653,,LT 33174,https://www.booking.com/hotel/lt/guest-house-guba.html
LT,Lithuania,128635,Moletai,5921025,Gerugne,All,Vilniaus 66 C  ,,"Gerugne is located in the centre of Moletai, by the road number 172. It offers free Wi-Fi and private monitored parking.

The rooms are simply furnished and decorated in warm colours. Each comes with an electric kettle and a private bathroom with a shower.

At Gerugne you will find a terrace, as well as bar which serves European dishes.

Labanoras Regional Park with its numerous lakes is 2.4 km away. The lake Siesartis is within 2.7 km, and the A14 motorway is within 2.5 km. Please inform Gerugne in advance of your expected arrival time. You can use the Special Requests box when booking, or contact the property directly with the contact details provided in your confirmation.
If you expect to arrive outside reception opening hours, please inform Gerugne by phone in advance.",,Parking Pets allowed Terrace Non-smoking rooms Family rooms Free parking internet services Heating wifi Free WiFi Non-smoking throughout designated smoking area parking on site Private parking wifi available in all areas invoice provided,55.2295|25.41434,,LT33136,https://www.booking.com/hotel/lt/gerugne.html
LT,Lithuania,128635,Moletai,6005261,Kempingas Obuoliu sala,All,Salos G. 3  ,,"Offering city views, Kempingas ""Obuoliu sala"" in Moletai offers accommodation, a garden, a shared lounge, a terrace and a bar.

For added convenience, the property can provide towels and bed linen for an extra charge.

The country house features a childrens playground.

Lithuanian Ethnocosmology Museum is 27 km from Kempingas ""Obuoliu sala"", while European Center Golf Club is 38 km from the property. The nearest airport is Vilnius International Airport, 69 km from the accommodation. This property will not accommodate hen, stag or similar parties.",,Picnic area Darts BBQ facilities Heating Fax/photocopying designated smoking area shared lounge/TV area Beachfront Evening entertainment parking on site Private parking water slide board games/puzzles kids' outdoor play equipment secured parking tennis equipment Badminton equipment Pet bowls Outdoor furniture Beach Pub crawls Live sport events (broadcast) Key access Smoke alarms CCTV in common areas CCTV outside property Fire extinguishers staff follow all safety protocols as directed by local authorities hand sanitizer in guest accommodation and key areas invoice provided Tennis Court Garden Terrace Non-smoking rooms Fishing Laundry Family rooms Free parking Safety Deposit Box children's playground Billiards Table tennis Parking Pets allowed meeting/banquet facilities Bar,55.1608|25.31094,,33284,https://www.booking.com/hotel/lt/kempingas-quot-obuoliu-sala-quot.html
LT,Lithuania,102078,Pakruojis,1419265,Pakruojis Manor Hotel Stadala,ThreeStar,Karcemos g.9 83166 Pakruojis ,Distances are displayed to the nearest 0.1 mile and kilometer. <br /> <p>Siauliai Saint Disciple Peter and Paul Cathedral - 38.7 km / 24 mi <br /> Photography Museum - 39.3 km / 24.4 mi <br /> Sundial Square - 39.3 km / 24.4 mi <br /> Bicycle Museum - 40.3 km / 25.1 mi <br /> Hill of Crosses - 40.9 km / 25.4 mi <br /> Museum of Cats - 41.5 km / 25.8 mi <br /> Siauliai Arena - 42.7 km / 26.5 mi <br /> Cido Arena - 49 km / 30.5 mi <br /> Panevezys College - 50.2 km / 31.2 mi <br /> Juozo Miltinio Theatre - 50.5 km / 31.4 mi <br /> Juozas Miltinis Sculpture - 50.9 km / 31.7 mi <br /> </p>,"<p>HeadLine : In Pakruojis</p><p>Location : With a stay at Pakruojis Manor s Palace Boutique Hotel in Pakruojis, you ll be 24 mi (38.7 km) from Siauliai Saint Disciple Peter and Paul Cathedral and 24.4 mi (39.3 km) from Photography Museum.  This hotel is 24.4 mi (39.3 km) from Sundial Square and 25.1 mi (40.3 km) from Bicycle Museum.</p><p>Rooms : Make yourself at home in one of the 11 individually decorated guestrooms. Complimentary wireless Internet access is available to keep you connected. Private bathrooms with bathtubs feature complimentary toiletries and hair dryers. Conveniences include desks and blackout drapes/curtains, and housekeeping is provided daily.</p><p>Dining : Enjoy a meal at the restaurant or snacks in the hotel s coffee shop/cafe. Wrap up your day with a drink at the bar/lounge. Full breakfasts are served on weekdays from 8:00 AM to 10:00 AM and on weekends from 8:30 AM to 10:30 AM for a fee.</p><p>Renovations : The property is closed between October 1 and April 30.</p><p>CheckIn Instructions : <ul>  <li>Extra-person charges may apply and vary depending on property policy</li><li>Government-issued photo identification and a credit card, debit card, or cash deposit may be required at check-in for incidental charges</li><li>Special requests are subject to availability upon check-in and may incur additional charges; special requests cannot be guaranteed</li><li>Guests must contact this property in advance to reserve cribs/infant beds</li><li>This property accepts credit cards and cash</li>  </ul></p><p>Special Instructions : To make arrangements for check-in please contact the property ahead of time using the information on the booking confirmation. If you are planning to arrive after 6 PM please contact the property in advance using the information on the booking confirmation. Guests must contact the property in advance for check-in instructions. Front desk staff will greet guests on arrival.</p>",370-000-00000000,Banquet hall Wheelchair accessible  no Express check-out Express check-in Number of meeting rooms - 3 Conference space size (meters) - 150 24-hour front desk Breakfast available (surcharge) Number of bars/lounges - 1 Upper floors accessible by stairs only Garden Picnic area Smoke-free property Coffee/tea in common areas Number of coffee shops/cafes - 1 Tours/ticket assistance Free self parking Conference space,55.9859|23.87908,370-370-65749700,83166,http://pakruojo-dvaras.lt/
LT,Lithuania,102078,Pakruojis,1825931,Pakruojo Dvaras,ThreeStar,Karciamos G. 9 83165 PakruojisLietuva ,Distances are displayed to the nearest 0.1 mile and kilometer. <br /> <p>Siauliai Saint Disciple Peter and Paul Cathedral - 38.7 km / 24 mi <br /> Photography Museum - 39.3 km / 24.4 mi <br /> Sundial Square - 39.3 km / 24.4 mi <br /> Bicycle Museum - 40.3 km / 25.1 mi <br /> Hill of Crosses - 40.8 km / 25.4 mi <br /> Museum of Cats - 41.5 km / 25.8 mi <br /> Siauliai Arena - 41.6 km / 25.9 mi <br /> Cido Arena - 49 km / 30.5 mi <br /> Panevezys College - 50.2 km / 31.2 mi <br /> Juozo Miltinio Theatre - 50.5 km / 31.4 mi <br /> Juozas Miltinis Sculpture - 50.9 km / 31.7 mi <br /> </p>,"<p>HeadLine : In Pakruojis</p><p>Location : With a stay at Pakruojo dvaras in Pakruojis, you ll be 24 mi (38.7 km) from Siauliai Saint Disciple Peter and Paul Cathedral and 24.4 mi (39.3 km) from Photography Museum.  This hotel is 24.4 mi (39.3 km) from Sundial Square and 25.1 mi (40.3 km) from Bicycle Museum.</p><p>Rooms : Stay in one of 22 guestrooms featuring flat-screen televisions. Complimentary wireless Internet access keeps you connected, and cable programming is available for your entertainment. Bathrooms have showers and hair dryers. Conveniences include desks and complimentary bottled water, and housekeeping is provided daily.</p><p>Dining : Enjoy a meal at the restaurant or snacks in the hotel s coffee shop/cafe. Mingle with other guests at the complimentary reception, held daily. Wrap up your day with a drink at the bar/lounge. A complimentary local cuisine breakfast is served on weekdays from 8 AM to 10 AM and on weekends from 8:30 AM to 10:30 AM.</p><p>CheckIn Instructions : <ul>  <li>Extra-person charges may apply and vary depending on property policy</li><li>Government-issued photo identification and a credit card, debit card, or cash deposit may be required at check-in for incidental charges</li><li>Special requests are subject to availability upon check-in and may incur additional charges; special requests cannot be guaranteed</li><li>Minimum Spring Break check-in age is 18 years old</li><li>Guests must contact this property in advance to reserve cribs/infant beds</li><li>This property accepts credit cards; cash is not accepted</li>  </ul></p><p>Special Instructions : The front desk is open daily from 6 AM - 11 PM. To make arrangements for check-in please contact the property ahead of time using the information on the booking confirmation. If you are planning to arrive after 6 PM please contact the property in advance using the information on the booking confirmation. Guests must contact the property in advance for check-in instructions. Front desk staff will greet guests on arrival.</p>",370-370-65749700,Free reception Meeting rooms Free WiFi Number of bars/lounges - 1 Designated smoking areas Horse riding/rental on site Picnic area In-room accessibility (in select rooms) Wheelchair accessible parking Tours/ticket assistance Accessible bathroom (in select rooms) Area shuttle (surcharge) Luggage storage Free breakfast Express check-out Multilingual staff Front desk (limited hours) Free breakfast (local cuisine) Daily Spa services on site Designated smoking areas (fines apply) Number of coffee shops/cafes - 1 Free self parking Wheelchair accessible path of travel Bicycle rentals on site,55.98613|23.87918,370-370-65749700,83165,http://www.pakruojo-dvaras.lt
LT,Lithuania,102078,Pakruojis,5516822,Pakruojis Manor's Palace Boutique Hotel,ThreeStar,Parko G. 1  ,Distances are displayed to the nearest 0.1 mile and kilometer. <br /> <p>Siauliai Saint Disciple Peter and Paul Cathedral - 38.7 km / 24 mi <br /> Photography Museum - 38.9 km / 24.2 mi <br /> Sundial Square - 38.9 km / 24.2 mi <br /> Hill of Crosses - 40.9 km / 25.4 mi <br /> Museum of Cats - 41.2 km / 25.6 mi <br /> Bicycle Museum - 42 km / 26.1 mi <br /> Siauliai Arena - 46 km / 28.6 mi <br /> Cido Arena - 49 km / 30.5 mi <br /> Panevezys College - 50.2 km / 31.2 mi <br /> </p>,"<p>HeadLine : In Pakruojis</p><p>Location : With a stay at Pakruojis Manor s Palace Boutique Hotel in Pakruojis, you ll be 24 mi (38.7 km) from Siauliai Saint Disciple Peter and Paul Cathedral and 24.2 mi (38.9 km) from Photography Museum.  This hotel is 24.2 mi (38.9 km) from Sundial Square and 25.4 mi (40.9 km) from Hill of Crosses.</p><p>Rooms : Make yourself at home in one of the 11 individually decorated guestrooms. Complimentary wireless Internet access is available to keep you connected. Private bathrooms with bathtubs feature complimentary toiletries and hair dryers. Conveniences include desks and blackout drapes/curtains, and housekeeping is provided daily.</p><p>Dining : Enjoy a meal at the restaurant or snacks in the hotel s coffee shop/cafe. Wrap up your day with a drink at the bar/lounge. Full breakfasts are served on weekdays from 8:00 AM to 10:00 AM and on weekends from 8:30 AM to 10:30 AM for a fee.</p><p>Renovations : The property is closed between October 1 and April 30.</p><p>CheckIn Instructions : <ul>  <li>Extra-person charges may apply and vary depending on property policy</li><li>Government-issued photo identification and a credit card, debit card, or cash deposit may be required at check-in for incidental charges</li><li>Special requests are subject to availability upon check-in and may incur additional charges; special requests cannot be guaranteed</li><li>Guests must contact this property in advance to reserve cribs/infant beds</li><li>Be prepared: check the latest COVID-19 travel requirements and measures in place for this destination before you travel.</li>  </ul></p><p>Special Instructions : To make arrangements for check-in please contact the property ahead of time using the information on the booking confirmation. If you are planning to arrive after 6 PM please contact the property in advance using the information on the booking confirmation. Guests must contact the property in advance for check-in instructions. Front desk staff will greet guests on arrival.</p>",370-000-00000000,Free self parking Smoke-free property Number of coffee shops/cafes - 1 Garden Conference space size (meters) - 150 Picnic area Express check-in Number of meeting rooms - 3 Coffee/tea in common areas Wheelchair accessible  no Breakfast available (surcharge) Number of bars/lounges - 1 Upper floors accessible by stairs only 24-hour front desk Banquet hall Conference space Express check-out Tours/ticket assistance,55.9859|23.87908,370-370-65749700,83166,
LT,Lithuania,132026,Palanga,1001322,Zalias Namas,ThreeStar,Vytauto Gatve 97 00134 Palanga 00134 Palanga ,,"alias namas modern apartments are in the centre of Palanga, 400 metres from the Baltic Sea. All rooms have free Wi-Fi and cable TV.

The accommodation offered by alias namas features an elegant interior design. Each room has a refrigerator and a private bathroom. Many have a living room.

Free private parking is available on-site.

The Apartment is located 1 km from Basanaviciaus Street. The beach is 900 metres away. This property will not accommodate hen, stag or similar parties.",+3703651231,staff follow all safety protocols as directed by local authorities shared stationery such as printed menus  magazines  pens  and paper removed contactless check-in/check-out cashless payment available physical distancing rules followed invoice provided all plates  cutlery  glasses and other tableware have been sanitized guests have the option to cancel any cleaning services for their accommodation during their stay Pets allowed Non-smoking rooms Family rooms internet services Heating wifi Free WiFi Non-smoking throughout designated smoking area wifi available in all areas Key access Smoke alarms Fire extinguishers use of cleaning chemicals that are effective against coronavirus linens  towels and laundry washed in accordance with local authority guidelines guest accommodation is disinfected between stays guest accommodation sealed after cleaning physical distancing in dining areas,55.92458|21.07029,+370846051231,LT-86652,https://www.booking.com/hotel/lt/zalias-namas.html
