countyCode,countyName,cityCode,cityName,HotelCode,HotelName,HotelRating,Address,Attractions,Description,FaxNumber,HotelFacilities,Map,PhoneNumber,PinCode,HotelWebsiteUrl
MO,Macau,151142,Macau,1380205,JW Marriott Hotel Macau,FiveStar,"Galaxy Macau Cotai Esperança, s/n Estrada da Baía da Nossa Senhora da Esperança s/nCotaiMacau ",Distances are displayed to the nearest 0.1 mile and kilometer. <br /> <p>Qube at the Venetian - 0.5 km / 0.3 mi <br /> TeamLab SuperNature Macao - 0.7 km / 0.4 mi <br /> Museum of Taipa and Coloane History - 0.8 km / 0.5 mi <br /> Macau Matsu - 0.8 km / 0.5 mi <br /> Cotai Strip - 0.8 km / 0.5 mi <br /> Cotai Arena - 0.8 km / 0.5 mi <br /> The Grand Canal Shoppes - 0.8 km / 0.5 mi <br /> Rua do Cunha - 0.9 km / 0.6 mi <br /> Venetian Macao Casino - 0.9 km / 0.6 mi <br /> Taipa Houses-Museum - 1 km / 0.6 mi <br /> Tai Pa Village - 1 km / 0.6 mi <br /> Our Lady of Carmel Church - 1.1 km / 0.7 mi <br /> Carmel Garden - 1.3 km / 0.8 mi <br /> Flower City Garden - 1.3 km / 0.8 mi <br /> City of Dreams - 1.5 km / 0.9 mi <br /> </p><p>The nearest airports are:<br />Macau Intl. Airport (MFM) - 5.4 km / 3.4 mi<br /> Hong Kong International Airport (HKG) - 61.7 km / 38.3 mi<br /> Zhuhai (ZUH-Jinwan) - 48.8 km / 30.3 mi<br /> </p><p>The preferred airport for JW Marriott Hotel Macau is Macau Intl. Airport (MFM). </p>,"<p>HeadLine : Near Qube at the Venetian</p><p>Location : A stay at JW Marriott Hotel Macau places you in the heart of Cotai, a 3-minute drive from Cotai Strip and 6 minutes from University of Macau.  This 5-star hotel is 3.7 mi (5.9 km) from Macau Tower Convention and Entertainment Centre and 3.8 mi (6.1 km) from Macau Tower.</p><p>Rooms : Make yourself at home in one of the 1015 individually furnished guestrooms, featuring refrigerators and LED televisions. Your bed comes with down comforters and premium bedding. Complimentary wireless Internet access is available to keep you connected. Private bathrooms with separate bathtubs and showers feature complimentary toiletries and hair dryers.</p><p>Dining : Enjoy Chinese cuisine at Man Ho, one of the hotel s 4 restaurants, or stay in and take advantage of the 24-hour room service. Snacks are also available at the coffee shop/cafe. Relax with a refreshing drink from the poolside bar or one of the 2 bars/lounges. Buffet breakfasts are available daily from 7 AM to 10:30 AM for a fee.</p><p>Renovations : The following facilities are closed seasonally each year. They will be closed from December 29 to March 13:<ul><li>Swimming pool</li></ul></p><p>CheckIn Instructions : <ul>  <li>Extra-person charges may apply and vary depending on property policy</li><li>Government-issued photo identification and a credit card, debit card, or cash deposit may be required at check-in for incidental charges</li><li>Special requests are subject to availability upon check-in and may incur additional charges; special requests cannot be guaranteed</li><li>This property accepts credit cards, debit cards, and cash</li><li>Please note that cultural norms and guest policies may differ by country and by property; the policies listed are provided by the property</li>  </ul> <ul>  <li>Rooms with club lounge access include benefits for single or double occupancy. Additional charges apply if occupancy is more than 2 guests.</li><li>Please note breakfast-inclusive rate plans include breakfast for a maximum of 2 adults. Additional charges apply for more than 2 adult guests.</li>  </ul></p><p>Special Instructions : To make arrangements for check-in please contact the property at least 72 hours before arrival using the information on the booking confirmation. Guests must contact the property in advance for check-in instructions. Front desk staff will greet guests on arrival. For more details, please contact the property using the information on the booking confirmation.</p>",853-8-886300,Number of coffee shops/cafes - 1 Laundry facilities elevator Offsite parking discounted rates available Fitness facilities Children's club (surcharge) Banquet hall Ballroom Express check-in Wheelchair-accessible van parking Meeting rooms Valet for wheelchair-equipped vehicle Wheelchair-accessible spa Wheelchair-accessible pool Health club Spa treatment room(s) Free newspapers in lobby Full-service spa Wedding services Free area shuttle Luggage storage Express check-out Business center 24-hour front desk Library Playground on site Spa services on site Safe-deposit box at front desk Smoke-free property Children's pool Sauna Steam room Conference space Gift shops or newsstand Dry cleaning/laundry service Shopping on site Parking (limited spaces) Free wired Internet Limo or Town Car service available Free WiFi Number of bars/lounges - 2 Number of spa tubs - 1 Number of poolside bars - 1 Braille or raised signage Number of outdoor pools - 1 Free casino shuttle Assistive listening devices available In-room accessibility (in select rooms) Wheelchair accessible parking Roll-in shower (in select rooms) Tours/ticket assistance Accessible bathroom (in select rooms) Free shopping center shuttle Free ferry terminal shuttle Free airport transportation Rooftop terrace Wheelchair-accessible on-site restaurant Visual alarms in hallways Multilingual staff Breakfast available (surcharge) Wheelchair-accessible meeting spaces/business center Self parking (surcharge) Waterslide Lazy river Hair salon Computer station ATM/banking Wheelchair accessible path of travel Concierge services,22.146706|113.55562,+85388866888,000000,http://www.marriott.com/hotels/travel/mfmjw-jw-marriott-hotel-macau/
MO,Macau,151142,Macau,1387958,Broadway Hotel,FourStar,Sul Da Marina Taipa Sul Junto A Rotunda Do Dique Oeste Taipa Macau ,Distances are displayed to the nearest 0.1 mile and kilometer. <br /> <p>Venetian Macao Casino - 1.4 km / 0.9 mi <br /> Cotai Strip - 1.5 km / 0.9 mi <br /> Museum of Taipa and Coloane History - 1.5 km / 0.9 mi <br /> Macau Matsu - 1.5 km / 0.9 mi <br /> Qube at the Venetian - 1.5 km / 1 mi <br /> Tai Pa Village - 1.7 km / 1 mi <br /> TeamLab SuperNature Macao - 1.7 km / 1 mi <br /> Rua do Cunha - 1.7 km / 1 mi <br /> Taipa Houses-Museum - 1.7 km / 1.1 mi <br /> Cotai Arena - 1.8 km / 1.1 mi <br /> The Grand Canal Shoppes - 1.8 km / 1.1 mi <br /> Eiffel Tower at The Parisian Macao - 1.8 km / 1.1 mi <br /> Our Lady of Carmel Church - 1.9 km / 1.2 mi <br /> Studio City Water Park - 1.9 km / 1.2 mi <br /> Flower City Garden - 1.9 km / 1.2 mi <br /> </p><p>The nearest airports are:<br />Macau Intl. Airport (MFM) - 5.3 km / 3.3 mi<br /> Hong Kong International Airport (HKG) - 61.5 km / 38.2 mi<br /> Zhuhai (ZUH-Jinwan) - 50.4 km / 31.3 mi<br /> </p><p></p>,"<p>HeadLine : Near Cotai Strip</p><p>Location : When you stay at Broadway Hotel in Taipa, you ll be near the beach, within a 5-minute drive of Pou Tai Un and Qube at the Venetian.  This 4.5-star hotel is 1.3 mi (2 km) from Venetian Macao Casino and 1.7 mi (2.8 km) from City of Dreams.</p><p>Rooms : Make yourself at home in one of the 314 air-conditioned rooms featuring free minibar items and LCD televisions. Complimentary wired and wireless Internet access keeps you connected, and digital programming provides entertainment. Private bathrooms with bathtubs or showers feature complimentary toiletries and bathrobes. Conveniences include safes and desks, and housekeeping is provided daily.</p><p>Dining : Grab a bite to eat at one of the hotel s 20 restaurants, or stay in and take advantage of the 24-hour room service. Snacks are also available at the 20 coffee shops/cafes. Relax with a refreshing drink at one of the 5 bars/lounges. Continental breakfasts are available daily from 8:00 AM to 11:00 AM for a fee.</p><p>CheckIn Instructions : <ul>  <li>Extra-person charges may apply and vary depending on property policy</li><li>Government-issued photo identification and a credit card, debit card, or cash deposit may be required at check-in for incidental charges</li><li>Special requests are subject to availability upon check-in and may incur additional charges; special requests cannot be guaranteed</li><li>This property accepts credit cards; cash is not accepted</li><li>Safety features at this property include a smoke detector</li>  </ul></p><p>Special Instructions : Front desk staff will greet guests on arrival.</p>",853-88836668,Gift shops or newsstand Dry cleaning/laundry service Shopping on site Free water park access Free wired Internet Free WiFi Number of bars/lounges - 5 Health club Braille or raised signage Number of outdoor pools - 1 In-room accessibility (in select rooms) Bicycle rentals nearby Wheelchair accessible parking Free newspapers in lobby Tours/ticket assistance Accessible bathroom (in select rooms) Free area shuttle Free airport transportation Luggage storage Express check-out 24-hour front desk Breakfast available (surcharge) Smoke-free property Snack bar/deli Number of coffee shops/cafes - 20 Laundry facilities elevator Free self parking Fitness facilities ATM/banking Wheelchair accessible path of travel Concierge services,22.146675|113.551576,+853 8883 3338,n a,https://www.broadwaymacau.com.mo/en/macau-broadway-hotel
MO,Macau,151142,Macau,1390835,5 Footway Inn Project Ponte 16,TwoStar,8 Rua de Constantino Brito Macau ,Distances are displayed to the nearest 0.1 mile and kilometer. <br /> <p>Almeida Ribeiro Street - 0.1 km / 0.1 mi <br /> St. Dominic s Church - 0.5 km / 0.3 mi <br /> Luis de Camoes Garden and Grotto - 0.5 km / 0.3 mi <br /> Senado Square - 0.6 km / 0.4 mi <br /> St. Joseph s Seminary and Church - 0.6 km / 0.4 mi <br /> St. Augustine s Church - 0.6 km / 0.4 mi <br /> Ruins of St. Paul s Cathedral - 0.6 km / 0.4 mi <br /> Dom Pedro V Theatre - 0.6 km / 0.4 mi <br /> Macau Cathedral - 0.6 km / 0.4 mi <br /> Old Protestant Cemetery - 0.6 km / 0.4 mi <br /> St. Lawrence s Church - 0.8 km / 0.5 mi <br /> New Yaohan Department Store - 0.8 km / 0.5 mi <br /> Museum of Macau - 0.9 km / 0.5 mi <br /> Fortaleza do Monte - 0.9 km / 0.5 mi <br /> Cineteatro Macau - 1 km / 0.6 mi <br /> </p><p>The nearest airports are:<br />Macau Intl. Airport (MFM) - 9 km / 5.6 mi<br /> Hong Kong International Airport (HKG) - 58 km / 36 mi<br /> Zhuhai (ZUH-Jinwan) - 47.8 km / 29.7 mi<br /> </p><p>The preferred airport for 5footway.inn Project Ponte 16 is Macau Intl. Airport (MFM). </p>,"<p>HeadLine : Near Ruins of St. Paul s Cathedral</p><p>Location : A stay at 5footway.inn Project Ponte 16 places you in the heart of Macau, steps from Almeida Ribeiro Street and 6 minutes by foot from St. Dominic s Church.  This guesthouse is 0.8 mi (1.3 km) from Lisboa Casino and 1.1 mi (1.8 km) from Ruins of St. Paul s Cathedral.</p><p>Rooms : Make yourself at home in one of the 24 air-conditioned rooms featuring flat-screen televisions. Complimentary wireless Internet access is available to keep you connected. Private bathrooms with showers feature rainfall showerheads and complimentary toiletries. Conveniences include safes and desks, as well as phones with free local calls.</p><p>CheckIn Instructions : <ul>  <li>Extra-person charges may apply and vary depending on property policy</li><li>Government-issued photo identification and a cash deposit may be required at check-in for incidental charges</li><li>Special requests are subject to availability upon check-in and may incur additional charges; special requests cannot be guaranteed</li><li>This property accepts credit cards</li>  </ul></p><p>Special Instructions : To make arrangements for check-in please contact the property ahead of time using the information on the booking confirmation. If you are planning to arrive after 6 PM please contact the property in advance using the information on the booking confirmation. Guests must contact the property in advance for check-in instructions. Front desk staff will greet guests on arrival. For more details, please contact the property using the information on the booking confirmation.</p>",65-65-63487101,Dry cleaning/laundry service Wheelchair accessible (may have limitations) Luggage storage Lockers available No single-use plastic straws Multilingual staff Change of bed sheets (on request) 24-hour front desk Reusable cups only Free WiFi Housekeeping on request Change of towels (on request) Smoke-free property Coffee/tea in common areas Laundry facilities Computer station Terrace,22.196609|113.536899,853-28923118,,http://www.5footwayinn.com/#9
MO,Macau,151142,Macau,1418837,Studio City-Celebrity and Star Tower,FiveStar,Estrada do Istmo CotaiMacau ,Distances are displayed to the nearest 0.1 mile and kilometer. <br /> <p>Studio City Water Park - 0.2 km / 0.1 mi <br /> Eiffel Tower at The Parisian Macao - 0.4 km / 0.2 mi <br /> The Londoner Macao - 0.4 km / 0.3 mi <br /> Venetian Macao Casino - 0.5 km / 0.3 mi <br /> City of Dreams - 0.9 km / 0.6 mi <br /> Macau East Asian Games Dome - 1 km / 0.6 mi <br /> Taipa Village - 1.1 km / 0.7 mi <br /> Hard Rock Casino - 1.2 km / 0.7 mi <br /> Macau University of Science and Technology - 1.3 km / 0.8 mi <br /> Cotai Strip - 1.3 km / 0.8 mi <br /> TeamLab SuperNature Macao - 1.4 km / 0.9 mi <br /> Cotai Arena - 1.4 km / 0.9 mi <br /> Karting Track - 1.6 km / 1 mi <br /> The House of Dancing Water - 1.6 km / 1 mi <br /> Macau Orient Golf Club - 1.6 km / 1 mi <br /> </p><p>The nearest airports are:<br />Macau Intl. Airport (MFM) - 3.8 km / 2.4 mi<br /> Hong Kong International Airport (HKG) - 61.6 km / 38.2 mi<br /> Zhuhai (ZUH-Jinwan) - 51.8 km / 32.2 mi<br /> </p><p>The preferred airport for Studio City is Macau Intl. Airport (MFM). </p>,"<p>HeadLine : Near Studio City Water Park</p><p>Location : When you stay at Studio City in Cotai, you ll be connected to the convention center, just steps from Studio City Water Park and 11 minutes by foot from City of Dreams.  This 5-star hotel is 0.7 mi (1.1 km) from Venetian Macao Casino and 5.1 mi (8.1 km) from Macau Fisherman s Wharf.</p><p>Rooms : Make yourself at home in one of the 1598 air-conditioned rooms featuring minibars and espresso makers. Wired and wireless Internet access is complimentary, while 55-inch LCD televisions with digital programming provide entertainment. Bathrooms have rainfall showerheads and complimentary toiletries. Conveniences include safes and desks, as well as phones with free local calls.</p><p>Dining : Enjoy Chinese cuisine at Pearl Dragon-???, one of the hotel s 7 restaurants, or stay in and take advantage of the 24-hour room service. Snacks are also available at the 3 coffee shops/cafes. Relax with your favorite drink at the bar/lounge or the poolside bar.</p><p>CheckIn Instructions : <ul>  <li>Extra-person charges may apply and vary depending on property policy</li><li>Government-issued photo identification and a credit card, debit card, or cash deposit may be required at check-in for incidental charges</li><li>Special requests are subject to availability upon check-in and may incur additional charges; special requests cannot be guaranteed</li><li>This property accepts credit cards; cash is not accepted</li><li>Safety features at this property include a carbon monoxide detector, a fire extinguisher, a smoke detector, a security system, a first aid kit, and window guards</li><li>Please note that cultural norms and guest policies may differ by country and by property; the policies listed are provided by the property</li>  </ul> <ul>  <li>Indoor pool access is available for guests booked in Star room types at this property.</li>  </ul></p><p>Special Instructions : Front desk staff will greet guests on arrival. For more details, please contact the property using the information on the booking confirmation.</p>",853-88698888,Sauna Free self parking Conference space Waterslide Free valet parking Pool cabanas (surcharge) Hair salon Computer station Terrace ATM/banking Wheelchair accessible path of travel Pool sun loungers Conference space size (feet) - 43056 Concierge services Dry cleaning/laundry service Pool umbrellas Conference space size (meters) - 4000 Free wired Internet Limo or Town Car service available Free WiFi Number of bars/lounges - 1 Number of poolside bars - 1 Number of outdoor pools - 1 Free casino shuttle Number of indoor pools - 1 In-room accessibility (in select rooms) Wheelchair accessible parking Tours/ticket assistance Accessible bathroom (in select rooms) Multilingual staff Conference center Number of coffee shops/cafes - 3 Laundry facilities elevator Fitness facilities Casino nearby Ballroom Nightclub Health club Spa treatment room(s) Garden Free use of nearby fitness center Free newspapers in lobby Full-service spa Wedding services Free area shuttle Luggage storage Business center 24-hour front desk Spa services on site Safe-deposit box at front desk,22.141147|113.563307,853-88658888,853,http://www.studiocity-macau.com
MO,Macau,151142,Macau,1420962,The St. Regis Macao Cotai Central,FiveStar,"Estrada Do Istmo. S N Estrada do Istmo, S/N Cotai ",Distances are displayed to the nearest 0.1 mile and kilometer. <br /> <p>The Londoner Macao - 0.1 km / 0.1 mi <br /> City of Dreams - 0.2 km / 0.1 mi <br /> Hard Rock Casino - 0.3 km / 0.2 mi <br /> Venetian Macao Casino - 0.3 km / 0.2 mi <br /> Macau University of Science and Technology - 0.6 km / 0.4 mi <br /> The House of Dancing Water - 0.7 km / 0.4 mi <br /> Cotai Arena - 0.8 km / 0.5 mi <br /> Eiffel Tower at The Parisian Macao - 0.9 km / 0.5 mi <br /> Macau East Asian Games Dome - 1 km / 0.6 mi <br /> Taipa Village - 1.2 km / 0.7 mi <br /> Studio City Water Park - 1.2 km / 0.7 mi <br /> TeamLab SuperNature Macao - 1.2 km / 0.7 mi <br /> Carmel Garden - 1.3 km / 0.8 mi <br /> Cotai Strip - 1.3 km / 0.8 mi <br /> The Grand Canal Shoppes - 1.3 km / 0.8 mi <br /> </p><p>The nearest airports are:<br />Macau Intl. Airport (MFM) - 4.8 km / 3 mi<br /> Hong Kong International Airport (HKG) - 61.1 km / 38 mi<br /> Zhuhai (ZUH-Jinwan) - 48.7 km / 30.2 mi<br /> </p><p></p>,"<p>HeadLine : Near Hard Rock Casino</p><p>Location : With a stay at St. Regis Macao in Cotai, you ll be in a shopping district, within a 15-minute walk of Cotai Arena and Taipa Village.  This 5-star hotel is 0.8 mi (1.2 km) from The Grand Canal Shoppes and 1.2 mi (2 km) from Museum of Taipa and Coloane History.</p><p>Rooms : Make yourself at home in one of the 400 guestrooms featuring refrigerators and LED televisions. Wired and wireless Internet access is complimentary, while iPod docking stations and cable programming provide entertainment. Bathrooms with separate bathtubs and showers feature deep soaking bathtubs and designer toiletries. Conveniences include phones, as well as safes and desks.</p><p>Dining : Enjoy a meal at the restaurant, or stay in and take advantage of the hotel s 24-hour room service. Unwind at the end of the day with a drink at the bar/lounge or the poolside bar. Buffet breakfasts are available daily from 6:30 AM to 10:30 AM for a fee.</p><p>CheckIn Instructions : <ul>  <li>Extra-person charges may apply and vary depending on property policy</li><li>Government-issued photo identification and a credit card, debit card, or cash deposit may be required at check-in for incidental charges</li><li>Special requests are subject to availability upon check-in and may incur additional charges; special requests cannot be guaranteed</li><li>The name on the credit card used at check-in to pay for incidentals must be the primary name on the guestroom reservation</li><li>This property accepts credit cards; cash is not accepted</li><li>Safety features at this property include a carbon monoxide detector, a fire extinguisher, a smoke detector, a security system, a first aid kit, and window guards</li>  </ul></p><p>Special Instructions : This property offers transfers from the ferry terminal (surcharges may apply). Guests must contact the property with arrival details before travel, using the contact information on the booking confirmation. Front desk staff will greet guests on arrival.</p>",853-28828890,Tours/ticket assistance Ferry terminal shuttle (surcharge) Wheelchair-accessible on-site restaurant Visual alarms in hallways Dry cleaning/laundry service Shopping on site Number of meeting rooms - 1 Free wired Internet Limo or Town Car service available Free WiFi Number of bars/lounges - 1 Designated smoking areas Number of spa tubs - 1 Number of poolside bars - 1 Braille or raised signage Number of outdoor pools - 3 Assistive listening devices available In-room accessibility (in select rooms) Wheelchair accessible parking Roll-in shower (in select rooms) Multilingual staff Breakfast available (surcharge) Wheelchair-accessible meeting spaces/business center Laundry facilities elevator Fitness facilities Banquet hall Wheelchair accessible (may have limitations) Ballroom Wheelchair-accessible concierge desk Express check-in Wheelchair-accessible path to elevator Wheelchair-accessible spa Wheelchair-accessible registration desk Wheelchair-accessible fitness center Wheelchair-accessible pool Wheelchair-accessible public washroom Spa treatment room(s) Well-lit path to entrance Conference space size (meters) - 628 Free newspapers in lobby Full-service spa Wedding services 24-hour fitness facilities Shopping mall on site Designer stores on site Luggage storage Express check-out Porter/bellhop Business center 24-hour front desk Spa services on site Outdoor seasonal pool Safe-deposit box at front desk Designated smoking areas (fines apply) Sauna Steam room Conference space Self parking (surcharge) Hair salon Terrace ATM/banking Wheelchair accessible path of travel Conference space size (feet) - 6760 Concierge services,22.147524|113.565492,+85328828898,853,http://www.stregismacao.com
MO,Macau,151142,Macau,1465525,Man Wa,TwoStar,"No 30 Rua da Caldeira, 30-32-34 Macau ",,"Man Va Hotel is a popular choice amongst travelers in Macau, whether exploring or just passing through. The hotel has everything you need for a comfortable stay. Free Wi-Fi in all rooms, daily housekeeping, 24-hour front desk, luggage storage, Wi-Fi in public areas are just some of the facilities on offer. Comfortable guestrooms ensure a good night's sleep with some rooms featuring facilities such as internet access  wireless (complimentary), non smoking rooms, air conditioning, desk, television. The hotel offers various recreational opportunities. Man Va Hotel is an excellent choice from which to explore Macau or to simply relax and rejuvenate.",,Hotel,22.195273|113.537329,,,http://manvahotelmacau.com/
MO,Macau,151142,Macau,1496016,Grand Harbour Hotel,TwoStar,8 Travessa De Lam Mau Macau ,Distances are displayed to the nearest 0.1 mile and kilometer. <br /> <p>Luis de Camoes Garden and Grotto - 0.2 km / 0.1 mi <br /> Old Protestant Cemetery - 0.7 km / 0.4 mi <br /> Almeida Ribeiro Street - 0.8 km / 0.5 mi <br /> Ruins of St. Paul s Cathedral - 0.8 km / 0.5 mi <br /> Museum of Macau - 1 km / 0.6 mi <br /> Fortaleza do Monte - 1.1 km / 0.7 mi <br /> St. Dominic s Church - 1.1 km / 0.7 mi <br /> Senado Square - 1.2 km / 0.8 mi <br /> Macau Cathedral - 1.3 km / 0.8 mi <br /> St. Joseph s Seminary and Church - 1.3 km / 0.8 mi <br /> Avenida da República - 1.3 km / 0.8 mi <br /> St. Augustine s Church - 1.3 km / 0.8 mi <br /> Dom Pedro V Theatre - 1.3 km / 0.8 mi <br /> Tap Seac Multisport Pavilion - 1.4 km / 0.9 mi <br /> St. Lawrence s Church - 1.5 km / 1 mi <br /> </p><p>The nearest airports are:<br />Macau Intl. Airport (MFM) - 8.8 km / 5.5 mi<br /> Hong Kong International Airport (HKG) - 56.8 km / 35.3 mi<br /> Zhuhai (ZUH-Jinwan) - 45.7 km / 28.4 mi<br /> </p><p></p>,"<p>HeadLine : Near Luis de Camoes Garden and Grotto</p><p>Location : With a stay at Grand Harbour Hotel in Macau, you ll be in the historical district, just a 2-minute walk from Luis de Camoes Garden and Grotto and 8 minutes by foot from Old Protestant Cemetery.  This hotel is 1 mi (1.6 km) from Ruins of St. Paul s Cathedral and 1.3 mi (2.1 km) from Lisboa Casino.</p><p>Rooms : Make yourself at home in one of the 90 air-conditioned guestrooms. Complimentary wireless Internet access is available to keep you connected. Bathrooms have showers and complimentary toiletries. Conveniences include desks and complimentary bottled water, and housekeeping is provided daily.</p><p>Dining : At Grand Harbour Hotel, enjoy a satisfying meal at the restaurant.</p><p>CheckIn Instructions : <ul>  <li>Extra-person charges may apply and vary depending on property policy</li><li>Government-issued photo identification and a credit card, debit card, or cash deposit may be required at check-in for incidental charges</li><li>Special requests are subject to availability upon check-in and may incur additional charges; special requests cannot be guaranteed</li><li>This property accepts credit cards; cash is not accepted</li>  </ul></p><p>Special Instructions : Front desk staff will greet guests on arrival.</p>",853-853-28952080,Dry cleaning/laundry service Smoke-free property Wheelchair accessible (may have limitations) Luggage storage elevator 24-hour front desk Free WiFi,22.20244|113.53771,853-853-63721818,,
