countyCode,countyName,cityCode,cityName,HotelCode,HotelName,HotelRating,Address,Attractions,Description,FaxNumber,HotelFacilities,Map,PhoneNumber,PinCode,HotelWebsiteUrl
MO,Macau,151142,Macau,1254088,Golden Crown China Hotel,ThreeStar,Opposite To The Macau International Airport MacauTaipa ,Distances are displayed to the nearest 0.1 mile and kilometer. <br /> <p>Macau University of Science and Technology - 1.5 km / 1 mi <br /> Venetian Macao Casino - 1.7 km / 1 mi <br /> Taipa Ferry Terminal - 1.7 km / 1 mi <br /> Cotai Arena - 2 km / 1.2 mi <br /> Carmel Garden - 2 km / 1.3 mi <br /> City of Dreams - 2.1 km / 1.3 mi <br /> Our Lady of Carmel Church - 2.2 km / 1.3 mi <br /> The House of Dancing Water - 2.2 km / 1.3 mi <br /> Hard Rock Casino - 2.2 km / 1.4 mi <br /> The Londoner Macao - 2.2 km / 1.4 mi <br /> Qube at the Venetian - 2.3 km / 1.4 mi <br /> Rua do Cunha - 2.3 km / 1.4 mi <br /> TeamLab SuperNature Macao - 2.3 km / 1.4 mi <br /> Flower City Garden - 2.4 km / 1.5 mi <br /> Taipa Houses-Museum - 2.4 km / 1.5 mi <br /> </p><p>The nearest airports are:<br />Macau Intl. Airport (MFM) - 3.4 km / 2.1 mi<br /> Hong Kong International Airport (HKG) - 61.2 km / 38 mi<br /> Zhuhai (ZUH-Jinwan) - 52.6 km / 32.7 mi<br /> </p><p>The preferred airport for Golden Crown China Hotel is Macau Intl. Airport (MFM). </p>,"<p>HeadLine : Near Taipa Ferry Terminal</p><p>Location : Located in Taipa, Golden Crown China Hotel is on the Strip, within a 5-minute drive of Macau University of Science and Technology and Flower City Garden.  This hotel is 1.8 mi (2.8 km) from City of Dreams and 2 mi (3.2 km) from Venetian Macao Casino.</p><p>Rooms : Make yourself at home in one of the 300 air-conditioned guestrooms. Complimentary wireless Internet access is available to keep you connected. Private bathrooms with showers feature hair dryers and slippers. Conveniences include desks and coffee/tea makers, and housekeeping is provided daily.</p><p>Dining : At Golden Crown China Hotel, enjoy a satisfying meal at the restaurant. Buffet breakfasts are available daily from 7 AM to 10 AM for a fee.</p><p>CheckIn Instructions : <ul>  <li>Extra-person charges may apply and vary depending on property policy</li><li>Government-issued photo identification and a credit card, debit card, or cash deposit may be required at check-in for incidental charges</li><li>Special requests are subject to availability upon check-in and may incur additional charges; special requests cannot be guaranteed</li><li>This property accepts credit cards; cash is not accepted</li>  </ul></p><p>Special Instructions : Front desk staff will greet guests on arrival.</p>",85-3-28851199,Dry cleaning/laundry service Banquet hall Wheelchair accessible (may have limitations) Express check-out 24-hour front desk Breakfast available (surcharge) Free WiFi Safe-deposit box at front desk Smoke-free property elevator Conference space,22.158642|113.573715,85-3-28851166,MO,https://www.htlchina.com.mo/html/en/index.html
MO,Macau,151142,Macau,1255297,Crowne Plaza Macau,FiveStar,The Residencia Tower 7 Rua da Perola Oriental Tower 7Rua Da Perola Oriental ,Distances are displayed to the nearest 0.1 mile and kilometer. <br /> <p>Gongbei Port - 0.9 km / 0.5 mi <br /> Portas do Cerco - 1.3 km / 0.8 mi <br /> Kun Iam Temple - 1.3 km / 0.8 mi <br /> Sun Yat Sen Park - 1.7 km / 1 mi <br /> Macau Ferry Terminal - 2.2 km / 1.4 mi <br /> Guia Hill Air Raid Shelter - 2.2 km / 1.4 mi <br /> Avenida da República - 2.3 km / 1.4 mi <br /> Tap Seac Multisport Pavilion - 2.4 km / 1.5 mi <br /> Guia Fortress - 2.5 km / 1.5 mi <br /> Fortress Hill Park - 2.5 km / 1.6 mi <br /> Macau Forum - 2.5 km / 1.6 mi <br /> Lotus Square - 2.5 km / 1.6 mi <br /> Luis de Camoes Garden and Grotto - 2.6 km / 1.6 mi <br /> Old Protestant Cemetery - 2.6 km / 1.6 mi <br /> Macau Fisherman s Wharf - 2.6 km / 1.6 mi <br /> </p><p>The nearest airports are:<br />Macau Intl. Airport (MFM) - 7.5 km / 4.7 mi<br /> Hong Kong International Airport (HKG) - 53.6 km / 33.3 mi<br /> Zhuhai (ZUH-Jinwan) - 52.2 km / 32.4 mi<br /> </p><p></p>,"<p>HeadLine : Near Gongbei Port</p><p>Location : A stay at Crowne Plaza Macau, an IHG Hotel places you in the heart of Macau, within a 5-minute drive of Gongbei Port and Kun Iam Temple.  This 5-star hotel is 1.6 mi (2.6 km) from Macau Fisherman s Wharf and 1.8 mi (2.9 km) from Ruins of St. Paul s Cathedral.</p><p>Rooms : Make yourself at home in one of the 208 guestrooms featuring minibars and LED televisions. Complimentary wired and wireless Internet access keeps you connected, and satellite programming provides entertainment. Private bathrooms with separate bathtubs and showers feature rainfall showerheads and designer toiletries. Conveniences include phones, as well as safes and desks.</p><p>Dining : Enjoy international cuisine at Cafe Azure, one of the hotel s 2 restaurants, or stay in and take advantage of the 24-hour room service. Wrap up your day with a drink at the bar/lounge. Buffet breakfasts are available daily from 6:30 AM to 10:30 AM for a fee.</p><p>CheckIn Instructions : <ul>  <li>Extra-person charges may apply and vary depending on property policy</li><li>Government-issued photo identification and a credit card, debit card, or cash deposit may be required at check-in for incidental charges</li><li>Special requests are subject to availability upon check-in and may incur additional charges; special requests cannot be guaranteed</li><li>Guests must contact this property in advance to reserve rollaway/extra beds</li><li>This property accepts credit cards; cash is not accepted</li><li>Please note that cultural norms and guest policies may differ by country and by property; the policies listed are provided by the property</li>  </ul></p><p>Special Instructions : Front desk staff will greet guests on arrival.  Guests booked in breakfast included rate plans receive breakfast for up to 2 adults who are sharing a guestroom. Breakfast fees apply for additional guests. All guests are required to present a green Macau Health Code at check-in. Guests booked in dinner included rate plans receive dinner for up to 2 adults who are sharing a guestroom. Dinner fees apply for additional guests.</p>",853-28888686,Dry cleaning/laundry service Wheelchair accessible (may have limitations) Ballroom Babysitting or childcare (surcharge) Express check-in Meeting rooms Conference space size (meters) - 1100 Free wired Internet Free WiFi Number of bars/lounges - 1 Braille or raised signage Assistive listening devices available Number of indoor pools - 1 In-room accessibility (in select rooms) Internet access in public areas - high speed Free newspapers in lobby Roll-in shower (in select rooms) Tours/ticket assistance Accessible bathroom (in select rooms) 24-hour fitness facilities Luggage storage Porter/bellhop Multilingual staff Business center 24-hour front desk Breakfast available (surcharge) Playground on site Safe-deposit box at front desk Smoke-free property Laundry facilities elevator Fitness facilities Conference space Self parking (surcharge) Valet parking (surcharge) Tennis on site ATM/banking Conference space size (feet) - 11840 Concierge services 24-hour business center,22.21148|113.557632,853-2888-6888,046707,http://www.crowneplaza.com
MO,Macau,151142,Macau,1255405,StarWorld Hotel,FiveStar,AVENIDA DA AMIZADE MACAU ,,"The hotel is located in downtown Macau on the main street. Restaurants and bars can be found in the immediate vicinity. Jinmen is just a 5-minute walk away. Kun Iam Ecumenical Centre, Nam Van Lake Cybernetic Fountain and the Ruins of St. Paul's can all be reached by public transport.

This deluxe 5-star luxury hotel features contemporary design and state-of-the-art facilities. With around-the-clock gaming, dining and entertainment all under one roof, this landmark hotel is an exciting total-leisure destination, a shining beacon for entertainment lovers in the city. The hotel offers a choice of over 500 deluxe hotel rooms and suites spread across 38 floors. It is air-conditioned and has a lobby, 24-hour check-out service, lift access, a bar, casino, a choice of restaurants, conference facilities and a laundry service. Parking facilities are available to guests arriving by car.

The hotel offers prestigious and comfortable accommodation to discerning guests. All rooms and suites come equipped with luxury facilities and advanced environmental and noise-control systems. The all-inclusive amenities include a 42-inch Plasma TV, high-speed broadband Internet access, individually regulated air conditioning, an en suite bathroom, minibar, tea/coffee making facilities and a safe deposit box.

The gaming areas at the hotel and casino provide fast-paced and exciting entertainment with various live performances from all over the world, including Star Divas Show, Mambo Dance & Magic Show, and Star Stroller Trio. There is a heated swimming pool and massage treatments and gym facilities also feature. Regardless of their interests, guests will find something enjoyable at this hotel.

There are various restaurants on site, offering a wide range of cuisines and dining experiences. These include Temptations with its elegant surrounds, Laurel restaurant and Bi Feng Tang. Whatever guests' preferences, there is certain to be something to suit their tastes.",,Hotel American Express MasterCard Visa Laundry service 24-hour security Air conditioning in public areas Lift access Gym Bar Air conditioning in Restaurant Conference room Casino Massage Breakfast buffet Fitness Other Protocol,22.1899333|113.5478573,,00853,http://starworldmacau.com/en
MO,Macau,151142,Macau,1269137,Lan Kwai Fong,ThreeStar,Rua De Luis Gonzaga Gomes 230 Macau Null Macau ,Distances are displayed to the nearest 0.1 mile and kilometer. <br /> <p>Rio Casino - 0.1 km / 0.1 mi <br /> Lotus Square - 0.2 km / 0.1 mi <br /> Grand Prix Museum - 0.2 km / 0.1 mi <br /> Macau Forum - 0.4 km / 0.2 mi <br /> Macau Fisherman s Wharf - 0.6 km / 0.4 mi <br /> Macau Cultural Centre - 0.7 km / 0.4 mi <br /> Macau Museum of Art - 0.7 km / 0.4 mi <br /> Handover Gifts Museum of Macau - 0.7 km / 0.4 mi <br /> Roman Amphitheatre - 0.7 km / 0.5 mi <br /> Macau Fisherman s Wharf Convention and Exhibition Centre - 0.8 km / 0.5 mi <br /> Guan Yin Statue Waterfront Park - 0.9 km / 0.6 mi <br /> Tap Seac Multisport Pavilion - 1 km / 0.6 mi <br /> Lisboa Casino - 1 km / 0.6 mi <br /> Hospital Conde S. Januario - 1 km / 0.6 mi <br /> Statue of Guan Yin - 1 km / 0.6 mi <br /> </p><p>The nearest airports are:<br />Macau Intl. Airport (MFM) - 7.3 km / 4.5 mi<br /> Hong Kong International Airport (HKG) - 56.2 km / 34.9 mi<br /> Zhuhai (ZUH-Jinwan) - 46.9 km / 29.2 mi<br /> </p><p>The preferred airport for Million Dragon Hotel is Macau Intl. Airport (MFM). </p>,"<p>HeadLine : Near Rio Casino</p><p>Location : A stay at Million Dragon Hotel places you in the heart of Macau, steps from Rio Casino and Lotus Square.  This spa hotel is 0.6 mi (0.9 km) from Macau Fisherman s Wharf and 1.2 mi (1.9 km) from Lisboa Casino.</p><p>Rooms : Make yourself at home in one of the 290 air-conditioned rooms featuring minibars and LCD televisions. Complimentary wireless Internet access keeps you connected, and cable programming is available for your entertainment. Bathrooms feature showers, complimentary toiletries, and hair dryers. Conveniences include phones, as well as safes and desks.</p><p>Renovations : The following facilities or services will be unavailable from March 1 2023 to February 23 2025 (dates subject to change): <ul><li>Breakfast</li></ul></p><p>CheckIn Instructions : <ul>  <li>Extra-person charges may apply and vary depending on property policy</li><li>Government-issued photo identification and a credit card, debit card, or cash deposit may be required at check-in for incidental charges</li><li>Special requests are subject to availability upon check-in and may incur additional charges; special requests cannot be guaranteed</li><li>This property accepts credit cards; cash is not accepted</li>  </ul></p><p>Special Instructions : Front desk staff will greet guests on arrival.</p>",853-82912680,Dry cleaning/laundry service Wheelchair accessible (may have limitations) Luggage storage Reception hall Multilingual staff Business center 24-hour front desk Free WiFi Designated smoking areas Safe-deposit box at front desk Laundry facilities Free newspapers in lobby Full-service spa Tours/ticket assistance elevator ATM/banking Concierge services,22.19285|113.552246,853-28800888,230,http://www.macaulkf.com/
MO,Macau,151142,Macau,1283069,New Orient Landmark Hotel,FourStar,555 Avenida da Amizade Macau ,Distances are displayed to the nearest 0.1 mile and kilometer. <br /> <p>Lisboa Casino - 0.5 km / 0.3 mi <br /> Rio Casino - 0.6 km / 0.4 mi <br /> Guan Yin Statue Waterfront Park - 0.7 km / 0.4 mi <br /> Grand Prix Museum - 0.7 km / 0.4 mi <br /> Lotus Square - 0.7 km / 0.4 mi <br /> Statue of Guan Yin - 0.7 km / 0.5 mi <br /> Macau Cultural Centre - 0.8 km / 0.5 mi <br /> Macau Museum of Art - 0.8 km / 0.5 mi <br /> Handover Gifts Museum of Macau - 0.8 km / 0.5 mi <br /> Jardim do Sao Francisco - 0.9 km / 0.5 mi <br /> Almeida Ribeiro Street - 0.9 km / 0.5 mi <br /> Roman Amphitheatre - 0.9 km / 0.5 mi <br /> Hospital Conde S. Januario - 1 km / 0.6 mi <br /> Macau Forum - 1 km / 0.6 mi <br /> Cineteatro Macau - 1 km / 0.6 mi <br /> </p><p>The nearest airports are:<br />Macau Intl. Airport (MFM) - 7.6 km / 4.7 mi<br /> Hong Kong International Airport (HKG) - 56.3 km / 35 mi<br /> Zhuhai (ZUH-Jinwan) - 47.3 km / 29.4 mi<br /> </p><p>The preferred airport for New Orient Landmark Hotel is Macau Intl. Airport (MFM). </p>,"<p>HeadLine : Near Lisboa Casino</p><p>Location : A stay at New Orient Landmark Hotel places you in the heart of Macau, within a 5-minute drive of Senado Square and Macau Tower Convention and Entertainment Centre.  This 4.5-star hotel is 1.2 mi (2 km) from Guia Fortress and 1.4 mi (2.3 km) from Museum of Macau.</p><p>Rooms : Make yourself at home in one of the 439 guestrooms featuring refrigerators and LED televisions. Private bathrooms with separate bathtubs and showers feature deep soaking bathtubs and designer toiletries. Conveniences include phones, as well as safes and desks.</p><p>Dining : Grab a bite at The Cave, one of the hotel s 3 restaurants, or stay in and take advantage of the 24-hour room service. Snacks are also available at the coffee shop/cafe. Relax with a refreshing drink from the poolside bar or one of the 2 bars/lounges.</p><p>CheckIn Instructions : <ul>  <li>Extra-person charges may apply and vary depending on property policy</li><li>Government-issued photo identification and a credit card or cash deposit may be required at check-in for incidental charges</li><li>Special requests are subject to availability upon check-in and may incur additional charges; special requests cannot be guaranteed</li><li>Guests must contact this property in advance to reserve cribs/infant beds and rollaway/extra beds</li><li>This property accepts credit cards and cash</li>  </ul></p><p>Special Instructions : Front desk staff will greet guests on arrival.</p>",853-28786611,Dry cleaning/laundry service Shopping on site Long-term parking (surcharge) Wheelchair accessible (may have limitations) Babysitting or childcare (surcharge) Reception hall Free WiFi Number of bars/lounges - 2 Designated smoking areas Number of poolside bars - 1 Number of indoor pools - 1 Tours/ticket assistance Luggage storage Porter/bellhop 24-hour front desk Number of coffee shops/cafes - 1 Steam room elevator Fitness facilities Self parking (surcharge) Computer station ATM/banking Concierge services,22.190774|113.548905,853-287-81781,999078,http://www.landmarkhotel.com.mo/
MO,Macau,151142,Macau,1285442,City of Dreams Nüwa Macau,FiveStar,1 Estrada Do Istmo City of DreamsCotaiMacau ,Distances are displayed to the nearest 0.1 mile and kilometer. <br /> <p>City of Dreams - 0.1 km / 0.1 mi <br /> The Londoner Macao - 0.2 km / 0.1 mi <br /> Venetian Macao Casino - 0.2 km / 0.1 mi <br /> Macau University of Science and Technology - 0.4 km / 0.3 mi <br /> Hard Rock Casino - 0.4 km / 0.3 mi <br /> Cotai Arena - 0.6 km / 0.4 mi <br /> The House of Dancing Water - 0.7 km / 0.4 mi <br /> Eiffel Tower at The Parisian Macao - 0.8 km / 0.5 mi <br /> TeamLab SuperNature Macao - 1 km / 0.6 mi <br /> Studio City Water Park - 1 km / 0.6 mi <br /> Carmel Garden - 1 km / 0.6 mi <br /> Our Lady of Carmel Church - 1.1 km / 0.7 mi <br /> Qube at the Venetian - 1.1 km / 0.7 mi <br /> Cotai Strip - 1.1 km / 0.7 mi <br /> The Grand Canal Shoppes - 1.1 km / 0.7 mi <br /> </p><p>The nearest airports are:<br />Macau Intl. Airport (MFM) - 5.7 km / 3.5 mi<br /> Hong Kong International Airport (HKG) - 61.9 km / 38.5 mi<br /> Zhuhai (ZUH-Jinwan) - 52.3 km / 32.5 mi<br /> </p><p>The preferred airport for City of Dreams  Nüwa Macau is Macau Intl. Airport (MFM). </p>,"<p>HeadLine : Near City of Dreams</p><p>Location : When you stay at City of Dreams  Nüwa Macau in Cotai, you ll be connected to a shopping center, just steps from City of Dreams and 3 minutes by foot from Venetian Macao Casino.  This 5-star hotel is 1 mi (1.7 km) from Studio City Water Park and 1.2 mi (1.9 km) from Macau East Asian Games Dome.</p><p>Rooms : Make yourself at home in one of the 300 guestrooms featuring MP3 docking stations and minibars. Complimentary wired and wireless Internet access keeps you connected, and digital programming provides entertainment. Private bathrooms with separate bathtubs and showers feature rainfall showerheads and complimentary toiletries. Conveniences include safes and desks, as well as phones with free local calls.</p><p>Dining : Satisfy your appetite for lunch or dinner at Jade Dragon-???, a restaurant which specializes in Chinese cuisine, or stay in and take advantage of the 24-hour room service. Relax with your favorite drink at the bar/lounge or the poolside bar.</p><p>CheckIn Instructions : <ul>  <li>Extra-person charges may apply and vary depending on property policy</li><li>Government-issued photo identification and a credit card, debit card, or cash deposit may be required at check-in for incidental charges</li><li>Special requests are subject to availability upon check-in and may incur additional charges; special requests cannot be guaranteed</li><li>This property accepts credit cards; cash is not accepted</li><li>Safety features at this property include a carbon monoxide detector, a fire extinguisher, a smoke detector, a security system, a first aid kit, and window guards</li><li>Please note that cultural norms and guest policies may differ by country and by property; the policies listed are provided by the property</li>  </ul></p><p>Special Instructions : Front desk staff will greet guests on arrival. For more details, please contact the property using the information on the booking confirmation.  The guest checking in must be the same guest who booked the reservation, and the name on the ID must match the name on the booking. The property reserves the right to refuse name changes on reservations.</p>",853-88676888,Free self parking Fitness facilities Children's club (surcharge) Hair salon Terrace ATM/banking Wheelchair accessible path of travel Concierge services Dry cleaning/laundry service Shopping on site Banquet hall Swimming pool Free wired Internet Free WiFi Number of bars/lounges - 1 Arcade/game room Number of poolside bars - 1 Number of outdoor pools - 1 Free casino shuttle In-room accessibility (in select rooms) Internet access in public areas - high speed Wheelchair accessible parking Free newspapers in lobby Full-service spa Tours/ticket assistance Free area shuttle 24-hour health club Luggage storage Express check-out Porter/bellhop Multilingual staff Business center 24-hour front desk Electric car charging station Spa services on site Smoke-free property Laundry facilities Sauna Steam room elevator,22.149123|113.564022,853-88686888,000,http://www.cityofdreamsmacau.com/en/hotels/detail/nuwa
MO,Macau,151142,Macau,1292217,Hotel Golden Dragon,FourStar,Rua de Malaca Macau ,Distances are displayed to the nearest 0.1 mile and kilometer. <br /> <p>Macau Fisherman s Wharf - 0.3 km / 0.2 mi <br /> Grand Prix Museum - 0.3 km / 0.2 mi <br /> Macau Forum - 0.3 km / 0.2 mi <br /> Lotus Square - 0.3 km / 0.2 mi <br /> Rio Casino - 0.4 km / 0.2 mi <br /> Macau Fisherman s Wharf Convention and Exhibition Centre - 0.4 km / 0.2 mi <br /> Roman Amphitheatre - 0.6 km / 0.4 mi <br /> Macau Ferry Terminal - 0.7 km / 0.4 mi <br /> Guia Hill Air Raid Shelter - 0.9 km / 0.5 mi <br /> Macau Cultural Centre - 0.9 km / 0.6 mi <br /> Macau Museum of Art - 0.9 km / 0.6 mi <br /> Handover Gifts Museum of Macau - 0.9 km / 0.6 mi <br /> Guia Fortress - 1.1 km / 0.7 mi <br /> Macau Science Center - 1.2 km / 0.8 mi <br /> Guan Yin Statue Waterfront Park - 1.3 km / 0.8 mi <br /> </p><p>The nearest airports are:<br />Macau Intl. Airport (MFM) - 7 km / 4.3 mi<br /> Hong Kong International Airport (HKG) - 55.9 km / 34.7 mi<br /> Zhuhai (ZUH-Jinwan) - 46.6 km / 28.9 mi<br /> </p><p></p>,"<p>HeadLine : Near Macau Fisherman s Wharf</p><p>Location : A stay at Hotel Golden Dragon places you in the heart of Macau, within a 5-minute walk of Macau Fisherman s Wharf and Grand Prix Museum.  This 4-star hotel is 1.2 mi (2 km) from Ruins of St. Paul s Cathedral and 1.3 mi (2.2 km) from Lisboa Casino.</p><p>Rooms : Make yourself at home in one of the 483 guestrooms featuring refrigerators and minibars. Complimentary wireless Internet access keeps you connected, and cable programming is available for your entertainment. Bathrooms with showers are provided. Conveniences include safes and electric kettles, and housekeeping is provided daily.</p><p>Dining : Satisfy your appetite at Dragon Palace, one of the hotel s 2 restaurants. Self-serve breakfasts are available daily from 7:00 AM to 10:00 AM for a fee.</p><p>Renovations : The property will be renovating from May 22 2023 to June 15 2023 (completion date subject to change). The following areas are affected:  <ul><li>Swimming pool</li></ul> During renovations, the hotel will make every effort to minimize noise and disturbance.</p><p>CheckIn Instructions : <ul>  <li>Extra-person charges may apply and vary depending on property policy</li><li>Government-issued photo identification and a credit card, debit card, or cash deposit may be required at check-in for incidental charges</li><li>Special requests are subject to availability upon check-in and may incur additional charges; special requests cannot be guaranteed</li><li>This property accepts credit cards and cash</li>  </ul></p><p>Special Instructions : Front desk staff will greet guests on arrival. At check-in, guests must provide a negative PCR COVID-19 test result. The negative COVID-19 test result requirement applies to all guests aged 1 and up, and the test must have been administered no more than 48 hours prior to check-in.</p>",853-28-361333,Dry cleaning/laundry service Banquet hall Outdoor seasonal pool Safe-deposit box at front desk In-room accessibility (in select rooms) Laundry facilities Tours/ticket assistance elevator Fitness facilities ATM/banking Concierge services Casino nearby Wheelchair accessible (may have limitations) Couples/private dining Ballroom Luggage storage Express check-in Business center Number of meeting rooms - 1 24-hour front desk Breakfast available (surcharge) Free WiFi,22.195503|113.554585,853-28-361999,25609,http://www.goldendragon.com.mo
