countyCode,countyName,cityCode,cityName,HotelCode,HotelName,HotelRating,Address,Attractions,Description,FaxNumber,HotelFacilities,Map,PhoneNumber,PinCode,HotelWebsiteUrl
MO,Macau,151142,Macau,1227506,Grand Waldo,FiveStar,Sul da Marina Taipa-sul Macau ,The Venetian Hotel & Exhibition Centre: within 4000 metre  University of Macau: within 10000 metre  Taipa Souvenir Street: within 6000 metre  Macau Tower Convention & Entertainment Centre: within 14000 metre ,"The hotel is 15 minutes away from the city's major ferry terminal and also just about 5 minutes away from the city centre of Cotai Strip. It is just 5 minutes away from Macau International Airport (approximately 3 km).

The hotel opened in May 2006 and was the first one-stop hotel and entertainment resort on the Cotai Strip. With an area of over 9,290 square metres, the casino resort consists of three blocks: the hotel, the casino and the entertainment block. Renovated in 2009, it is a modern hotel and entertainment complex. The air-conditioned establishment comprises 340 rooms and offers a lobby, hotel safe, currency exchange facilities, lift access, a hairdressing salon, a café, a bar and a restaurant. Business guests are sure to appreciate the conference facilities. Internet access and room and laundry services are also available.

The hotel offers luxurious guest rooms, most of which have a 180-degree harbour view. In-room facilities include a minibar, mini fridge, hairdryer, tea and coffee maker, safe, iron and iron board and central air conditioning. The rooms are quiet, modern, clean and tidy. The en suite bathrooms are fitted with a shower and bath. A direct dial telephone and satellite/cable TV also feature as standard.

Guests may make use of the outdoor swimming pool, solarium, gym and pool/snooker table. The hotel arranges entertainment programmes for adults.

The hotel offers a great variety of international cuisine. Dining options include the café, bar and Chinese restaurant, serving Shanghai cuisine, Thai shark fin, Portuguese cuisine, a buffet and fusion food sure to tantalise guests' taste buds.

Guest can take a taxi from Macau International Airport to the hotel, which costs about MOP 25 or HKD 25. The scheduled shuttle bus, which runs every 15 minutes, is also available between the ferry terminal and the hotel.",,Hotel American Express MasterCard Visa Bathroom Shower Bathtub Hairdryer Direct dial telephone TV Minibar Mini fridge Ironing set Centrally regulated air conditioning Safe Room service Laundry service Air conditioning in public areas Hotel safe Currency exchange facilities Lift access Sun terrace Gym Café Bar Restaurant Smoking area Air conditioning in Restaurant Conference room Entertainment programme for adults Casino Hairdressing salon Breakfast Buffet lunch À la carte lunch Set menu lunch Buffet dinner À la carte dinner Set menu dinner Fitness Billiards,22.14665|113.5519,,000000,
MO,Macau,151142,Macau,1227507,The Venetian Macao Resort Hotel,FiveStar,Estrada Da Baia De N. Senhora Da Esperanca TaipaMacao SAR ,,"Offering high-class and spacious guest rooms in Macau, The Venetian Macao features branded shopping options, an outdoor swimming pool and 30 stylish dining options serving Chinese, Japanese and international cuisines on site. Guests can enjoy a special discount for teamLab tickets during the stay.

Recently renovated in 2017, all guest rooms come with elegant tone and noble decor. It is fitted with a flat-screen TV, a wardrobe, a seating area with sofa and an en suite bathroom with bathtub. The thoughtful amenities include slippers, bathrobe, hairdryer and minibar are provided.

Staff at the front desk are glad to assist guests with car hire service, currency exchange, laundry and dry cleaning, ticketing service and free luggage storage. A free shuttle service is available from Macao Outer Harbour Ferry Terminal and Macau Taipa Ferry Terminal to the property. Other facilities and activities include minigolf courses and gondola rides.

The Venetian Macao is a 5-minute walk from The Shoppes at Four Seasons and an 8-minute drive from Taipa Ferry Terminal. Macau Ferry Terminal is a 14-minute drive away. Museum of Taipa and Coloane is 700 metres away. The nearest airport is Macau Airport, 2 km away. Please kindly note:
- Guests are required to provide names (same as the travel document) in English at the time of booking, and other languages are not accepted. Name changes after the booking is made are not permitted.
- All guests must be registered at check-in and present a valid passport or identification document, along with valid authorization to stay slip.
- Once the booking is completed, the hotel reserves the right to debit guests credit cards. A valid credit card is required for completing the transaction online. Virtual credit card is not accepted.
- The same physical credit card used for booking must be present by the cardholder at the time of check-in for verification/payment.
- The Hotel does not accept third-party payment unless a payment authorization form together with front and back copies of the credit card, and photo ID/passport of the credit card holder are all submitted to the hotel 7 days before the arrival date. Please contact the hotel directly for further information and assistance.
- Booking exceeding 2 rooms with the same guest name is not allowed.
- Guests aged under 18 must be accompanied by adults (aged above 18) when staying at the property.

The property offers free shuttle service from the airport, ferry terminals, and border gates. For running times and pickup/drop-off locations, please contact the property directly.

To enjoy a fast and efficient check-in experience without queuing at the hotel counter, guests have to complete the registration through a secure link sent by the property after the booking is made. More information will be shown in the hotels direct message.

Breakfast-included rate includes breakfast for up to 2 adults only. Breakfast for extra guests will be charged separately.

Please note that the hotel will charge the payment in hotel local currency (Macau Pataca) upon arrival with the exchange rate determined by the hotel.",853-2882-8889,Parking Indoor play area Restaurant Parking garage Room service electric vehicle charging station meeting/banquet facilities airport pick up Bar airport drop off 24-hour front desk coffee house on site Fitness centre Fitness Garden fitness/spa locker rooms Terrace Swimming pool Non-smoking rooms Airport shuttle Business centre babysitting/child services Laundry dry cleaning Facilities for disabled guests Family rooms Games room Casino Ironing service Free parking internet services lift express check-in/check-out Safety Deposit Box Valet parking Currency exchange Spa and wellness centre children's playground Hot tub/jacuzzi Car hire Tour desk Fax/photocopying Luggage storage wifi Mini golf Outdoor pool Free WiFi Air conditioning designated smoking area ATM/cash machine on site Snack Bar outdoor pool (all year) concierge service Private check-in/check-out shuttle service (free) shuttle service (additional charge) Trouser press airport shuttle (free) airport shuttle (additional charge) kids' club minimarket on site Evening entertainment Daily housekeeping parking on site Private parking Shuttle service 24-hour security Key card access Security alarm Smoke alarms CCTV in common areas CCTV outside property Fire extinguishers Swimming pool use of cleaning chemicals that are effective against coronavirus linens  towels and laundry washed in accordance with local authority guidelines physical distancing in dining areas staff follow all safety protocols as directed by local authorities hand sanitizer in guest accommodation and key areas process in place to check health of guests first aid kit available contactless check-in/check-out cashless payment available physical distancing rules followed screens or physical barriers placed between staff and guests in appropriate areas invoice provided all plates  cutlery  glasses and other tableware have been sanitized guests have the option to cancel any cleaning services for their accommodation during their stay thermometers for guests provided by property,22.14822|113.56049,853-28-828888,00000,https://www.booking.com/hotel/mo/the-venetian-macao-resort.html
MO,Macau,151142,Macau,1234266,Grand Emperor Hotel,FourStar,288 Avenida Comercial De Macau ,Distances are displayed to the nearest 0.1 mile and kilometer. <br /> <p>New Yaohan Department Store - 0.1 km / 0.1 mi <br /> Almeida Ribeiro Street - 0.3 km / 0.2 mi <br /> St. Augustine s Church - 0.4 km / 0.3 mi <br /> Dom Pedro V Theatre - 0.4 km / 0.3 mi <br /> Nam Van Lake Cybernetic Fountain - 0.5 km / 0.3 mi <br /> St. Joseph s Seminary and Church - 0.5 km / 0.3 mi <br /> Cineteatro Macau - 0.5 km / 0.3 mi <br /> Senado Square - 0.5 km / 0.3 mi <br /> Jardim do Sao Francisco - 0.5 km / 0.3 mi <br /> Macau Cathedral - 0.5 km / 0.3 mi <br /> St. Lawrence s Church - 0.6 km / 0.4 mi <br /> St. Dominic s Church - 0.6 km / 0.4 mi <br /> Lisboa Casino - 0.7 km / 0.4 mi <br /> Sai Van Lake - 0.8 km / 0.5 mi <br /> Ruins of St. Paul s Cathedral - 1 km / 0.6 mi <br /> </p><p>The nearest airports are:<br />Macau Intl. Airport (MFM) - 8.7 km / 5.4 mi<br /> Hong Kong International Airport (HKG) - 57.7 km / 35.9 mi<br /> Zhuhai (ZUH-Jinwan) - 56.3 km / 35 mi<br /> </p><p>The preferred airport for Grand Emperor Hotel is Macau Intl. Airport (MFM). </p>,"<p>HeadLine : Near New Yaohan Department Store</p><p>Location : With a stay at Grand Emperor Hotel in Macau, you ll be within a 5-minute walk of New Yaohan Department Store and Almeida Ribeiro Street.  This 4-star hotel is 0.7 mi (1.1 km) from Lisboa Casino and 1.2 mi (2 km) from Ruins of St. Paul s Cathedral.</p><p>Rooms : Make yourself at home in one of the 311 air-conditioned guestrooms. Complimentary wireless Internet access keeps you connected, and cable programming is available for your entertainment. Private bathrooms with showers feature complimentary toiletries and hair dryers. Conveniences include phones, as well as safes and desks.</p><p>Dining : Grab a bite at Royal Robatayaki, one of the hotel s 3 restaurants, or stay in and take advantage of the 24-hour room service. Snacks are also available at the coffee shop/cafe. Relax with a refreshing drink at one of the 2 bars/lounges. Cooked-to-order breakfasts are available daily from 7:00 AM to 10:30 AM for a fee.</p><p>CheckIn Instructions : <ul>  <li>Extra-person charges may apply and vary depending on property policy</li><li>Government-issued photo identification and a credit card, debit card, or cash deposit may be required at check-in for incidental charges</li><li>Special requests are subject to availability upon check-in and may incur additional charges; special requests cannot be guaranteed</li><li>This property accepts credit cards; cash is not accepted</li>  </ul></p><p>Special Instructions : Front desk staff will greet guests on arrival.</p>",853-28889933,Gift shops or newsstand Dry cleaning/laundry service Shopping on site Wheelchair accessible (may have limitations) Parking (limited spaces) Babysitting or childcare (surcharge) Conference space size (meters) - 147 Free WiFi Number of bars/lounges - 2 In-room accessibility (in select rooms) Luggage storage Express check-out Porter/bellhop 24-hour front desk Breakfast available (surcharge) Safe-deposit box at front desk Smoke-free property Number of coffee shops/cafes - 1 Laundry facilities elevator Free self parking Conference space ATM/banking Conference space size (feet) - 1582 Concierge services,22.190452|113.540769,853-28889988,1,http://www.grandemperor.com/
MO,Macau,151142,Macau,1234267,Inn Hotel Macau,ThreeStar,822 Estrada Governador Nobre Carvalho No. 822 TaipaMacau ,Distances are displayed to the nearest 0.1 mile and kilometer. <br /> <p>Carmel Garden - 0.3 km / 0.2 mi <br /> Flower City Garden - 0.4 km / 0.3 mi <br /> Our Lady of Carmel Church - 0.5 km / 0.3 mi <br /> Rua do Cunha - 0.6 km / 0.4 mi <br /> Taipa Houses-Museum - 0.6 km / 0.4 mi <br /> Tai Pa Village - 0.6 km / 0.4 mi <br /> Macau Matsu - 0.7 km / 0.5 mi <br /> Museum of Taipa and Coloane History - 0.7 km / 0.5 mi <br /> Qube at the Venetian - 1.1 km / 0.7 mi <br /> TeamLab SuperNature Macao - 1.1 km / 0.7 mi <br /> Mandarin s House - 1.1 km / 0.7 mi <br /> City of Dreams - 1.1 km / 0.7 mi <br /> Four Faces Buddha Shrine - 1.1 km / 0.7 mi <br /> Venetian Macao Casino - 1.2 km / 0.7 mi <br /> The Grand Canal Shoppes - 1.2 km / 0.8 mi <br /> </p><p>The nearest airports are:<br />Macau Intl. Airport (MFM) - 2.5 km / 1.5 mi<br /> Hong Kong International Airport (HKG) - 59.6 km / 37 mi<br /> Zhuhai (ZUH-Jinwan) - 49.8 km / 30.9 mi<br /> </p><p>The preferred airport for Inn Hotel Macau is Macau Intl. Airport (MFM). </p>,"<p>HeadLine : Near Carmel Garden</p><p>Location : Located in Taipa, Inn Hotel Macau is near the airport, within a 5-minute walk of Carmel Garden and Flower City Garden.  This hotel is 0.6 mi (1 km) from City of Dreams and 0.7 mi (1.2 km) from Venetian Macao Casino.</p><p>Rooms : Make yourself at home in one of the 285 air-conditioned rooms featuring refrigerators. Complimentary wireless Internet access is available to keep you connected. Private bathrooms with shower/tub combinations feature complimentary toiletries and hair dryers. Conveniences include safes and desks, and housekeeping is provided daily.</p><p>Dining : Enjoy a meal at the restaurant, or stay in and take advantage of the hotel s room service (during limited hours). Cooked-to-order breakfasts are available daily from 7 AM to 10:30 AM for a fee.</p><p>CheckIn Instructions : <ul>  <li>Extra-person charges may apply and vary depending on property policy</li><li>Government-issued photo identification and a credit card, debit card, or cash deposit may be required at check-in for incidental charges</li><li>Special requests are subject to availability upon check-in and may incur additional charges; special requests cannot be guaranteed</li><li>The name on the credit card used at check-in to pay for incidentals must be the primary name on the guestroom reservation</li><li>This property accepts credit cards; cash is not accepted</li>  </ul></p><p>Special Instructions : Front desk staff will greet guests on arrival.</p>",853-28820333,Dry cleaning/laundry service Luggage storage Express check-out Express check-in Porter/bellhop Multilingual staff 24-hour front desk Breakfast available (surcharge) Free WiFi Designated smoking areas Outdoor seasonal pool Assistive listening devices available Safe-deposit box at front desk Laundry facilities Free newspapers in lobby Accessible bathroom (in select rooms) elevator Free self parking Free area shuttle Concierge services,22.156809|113.560198,853-2882-1666,000853,http://macau.innhotel.com/index.php/en/
MO,Macau,151142,Macau,1236263,Emperor Hotel,ThreeStar,No. 51 Rua De Xangai Macau ,Distances are displayed to the nearest 0.1 mile and kilometer. <br /> <p>Lisboa Casino - 0.4 km / 0.3 mi <br /> Jardim do Sao Francisco - 0.6 km / 0.4 mi <br /> Rio Casino - 0.6 km / 0.4 mi <br /> Almeida Ribeiro Street - 0.7 km / 0.4 mi <br /> Cineteatro Macau - 0.7 km / 0.4 mi <br /> Hospital Conde S. Januario - 0.8 km / 0.5 mi <br /> Grand Prix Museum - 0.9 km / 0.5 mi <br /> New Yaohan Department Store - 0.9 km / 0.6 mi <br /> Guan Yin Statue Waterfront Park - 0.9 km / 0.6 mi <br /> Lotus Square - 1 km / 0.6 mi <br /> Tap Seac Multisport Pavilion - 1 km / 0.6 mi <br /> Statue of Guan Yin - 1 km / 0.6 mi <br /> Macau Cathedral - 1 km / 0.6 mi <br /> Macau Forum - 1 km / 0.6 mi <br /> Macau Cultural Centre - 1 km / 0.7 mi <br /> </p><p>The nearest airports are:<br />Macau Intl. Airport (MFM) - 7.7 km / 4.8 mi<br /> Hong Kong International Airport (HKG) - 56.4 km / 35.1 mi<br /> Zhuhai (ZUH-Jinwan) - 55 km / 34.2 mi<br /> </p><p>The preferred airport for Emperor Hotel is Macau Intl. Airport (MFM). </p>,"<p>HeadLine : Near Lisboa Casino</p><p>Location : When you stay at Emperor Hotel in Macau, you ll be in a shopping district, within a 10-minute walk of Lisboa Casino and Jardim do Sao Francisco.  This hotel is 0.7 mi (1.2 km) from Macau Fisherman s Wharf and 1.5 mi (2.5 km) from Ruins of St. Paul s Cathedral.</p><p>Rooms : Make yourself at home in one of the 390 air-conditioned rooms featuring minibars. Complimentary wireless Internet access is available to keep you connected. Private bathrooms with shower/tub combinations feature complimentary toiletries and hair dryers. Conveniences include phones, as well as safes and complimentary bottled water.</p><p>Dining : Enjoy a meal at Emperor Court, or stay in and take advantage of the hotel s room service (during limited hours). Buffet breakfasts are available daily from 7 AM to 10 AM for a fee.</p><p>CheckIn Instructions : <ul>  <li>Extra-person charges may apply and vary depending on property policy</li><li>Government-issued photo identification and a credit card, debit card, or cash deposit may be required at check-in for incidental charges</li><li>Special requests are subject to availability upon check-in and may incur additional charges; special requests cannot be guaranteed</li><li>This property accepts credit cards; cash is not accepted</li>  </ul></p><p>Special Instructions : Front desk staff will greet guests on arrival.</p>",853-2-8782287,Dry cleaning/laundry service Shopping on site Wheelchair accessible (may have limitations) Luggage storage Babysitting or childcare (surcharge) Business center Number of meeting rooms - 1 24-hour front desk Breakfast available (surcharge) Free WiFi Safe-deposit box at front desk Smoke-free property In-room accessibility (in select rooms) Laundry facilities Tours/ticket assistance elevator Free self parking Concierge services,22.191026|113.547961,+853 2878 1888,00000,http://www.emperorhotel.com.mo
MO,Macau,151142,Macau,1236264,Hotel Beverly Plaza,ThreeStar,70-106 Avenida do Dr. Rodrigo Rodrigues Macau ,Distances are displayed to the nearest 0.1 mile and kilometer. <br /> <p>Jardim do Sao Francisco - 0.3 km / 0.2 mi <br /> Almeida Ribeiro Street - 0.4 km / 0.2 mi <br /> Cineteatro Macau - 0.4 km / 0.2 mi <br /> Hospital Conde S. Januario - 0.5 km / 0.3 mi <br /> Lisboa Casino - 0.6 km / 0.4 mi <br /> New Yaohan Department Store - 0.6 km / 0.4 mi <br /> Macau Cathedral - 0.8 km / 0.5 mi <br /> Rio Casino - 0.8 km / 0.5 mi <br /> Tap Seac Multisport Pavilion - 0.8 km / 0.5 mi <br /> Grand Prix Museum - 0.9 km / 0.6 mi <br /> St. Dominic s Church - 0.9 km / 0.6 mi <br /> Senado Square - 0.9 km / 0.6 mi <br /> Lotus Square - 1 km / 0.6 mi <br /> Fortaleza do Monte - 1 km / 0.6 mi <br /> Dom Pedro V Theatre - 1 km / 0.6 mi <br /> </p><p>The nearest airports are:<br />Macau Intl. Airport (MFM) - 7.8 km / 4.9 mi<br /> Hong Kong International Airport (HKG) - 56.9 km / 35.3 mi<br /> Zhuhai (ZUH-Jinwan) - 47.5 km / 29.5 mi<br /> </p><p></p>,"<p>HeadLine : Near Lisboa Casino</p><p>Location : With a stay at Hotel Beverly Plaza, you ll be centrally located in Macau, a 8-minute walk from New Yaohan Department Store and 11 minutes by foot from Senado Square.  This hotel is 1.3 mi (2.1 km) from Ruins of St. Paul s Cathedral.</p><p>Rooms : Make yourself at home in one of the 300 guestrooms featuring refrigerators and minibars. Your pillowtop bed comes with premium bedding. 32-inch LCD televisions with satellite programming provide entertainment, while complimentary wireless Internet access keeps you connected. Private bathrooms with shower/tub combinations feature designer toiletries and bidets.</p><p>Dining : Enjoy a meal at Chinese restaurant, or stay in and take advantage of the hotel s room service (during limited hours). Wrap up your day with a drink at the bar/lounge. Buffet breakfasts are available daily from 7 AM to 10 AM for a fee.</p><p>CheckIn Instructions : <ul>  <li>Extra-person charges may apply and vary depending on property policy</li><li>Government-issued photo identification and a credit card, debit card, or cash deposit may be required at check-in for incidental charges</li><li>Special requests are subject to availability upon check-in and may incur additional charges; special requests cannot be guaranteed</li><li>This property accepts credit cards; cash is not accepted</li><li>Safety features at this property include a fire extinguisher, a smoke detector, a security system, and window guards</li>  </ul></p><p>Special Instructions : Front desk staff will greet guests on arrival.</p>",853-28780704,Dry cleaning/laundry service Wheelchair accessible (may have limitations) Babysitting or childcare (surcharge) Express check-in Number of meeting rooms - 1 Free WiFi Number of bars/lounges - 1 In-room accessibility (in select rooms) Free newspapers in lobby Tours/ticket assistance Free area shuttle Free ferry terminal shuttle Luggage storage Express check-out Porter/bellhop Multilingual staff Business center 24-hour front desk Breakfast available (surcharge) Safe-deposit box at front desk Smoke-free property Snack bar/deli Laundry facilities Sauna elevator ATM/banking Concierge services,22.191153|113.545549,853-28782288,999999,http://www.beverlyplaza.com.mo/
MO,Macau,151142,Macau,1236266,Metropark,ThreeStar,Rua de Pequim No. 199 Macau ,Distances are displayed to the nearest 0.1 mile and kilometer. <br /> <p>Rio Casino - 0.4 km / 0.3 mi <br /> Grand Prix Museum - 0.5 km / 0.3 mi <br /> Lisboa Casino - 0.5 km / 0.3 mi <br /> Jardim do Sao Francisco - 0.7 km / 0.4 mi <br /> Macau Forum - 0.8 km / 0.5 mi <br /> Cineteatro Macau - 0.8 km / 0.5 mi <br /> Lotus Square - 0.8 km / 0.5 mi <br /> Almeida Ribeiro Street - 0.8 km / 0.5 mi <br /> Hospital Conde S. Januario - 0.8 km / 0.5 mi <br /> Guia Hill Air Raid Shelter - 0.8 km / 0.5 mi <br /> Tap Seac Multisport Pavilion - 0.8 km / 0.5 mi <br /> Statue of Guan Yin - 0.9 km / 0.6 mi <br /> Guan Yin Statue Waterfront Park - 0.9 km / 0.6 mi <br /> Guia Fortress - 0.9 km / 0.6 mi <br /> Macau Cultural Centre - 1 km / 0.6 mi <br /> </p><p>The nearest airports are:<br />Macau Intl. Airport (MFM) - 7.8 km / 4.8 mi<br /> Hong Kong International Airport (HKG) - 56.4 km / 35.1 mi<br /> Zhuhai (ZUH-Jinwan) - 47.2 km / 29.3 mi<br /> </p><p>The preferred airport for Metropark Hotel Macau is Macau Intl. Airport (MFM). </p>,"<p>HeadLine : Near Hospital Conde S. Januario</p><p>Location : A stay at Metropark Hotel Macau places you in the heart of Macau, within a 10-minute walk of Rio Casino and Grand Prix Museum.  This hotel is 0.7 mi (1.2 km) from Macau Fisherman s Wharf and 0.9 mi (1.5 km) from Lisboa Casino.</p><p>Rooms : Make yourself at home in one of the 350 air-conditioned rooms featuring refrigerators and minibars. Complimentary wireless Internet access keeps you connected, and cable programming is available for your entertainment. Private bathrooms with shower/tub combinations feature complimentary toiletries and hair dryers. Conveniences include phones, as well as safes and desks.</p><p>Dining : Grab a bite at Sing Sing Lounge, one of the hotel s 3 restaurants, or stay in and take advantage of the 24-hour room service. Quench your thirst with your favorite drink at the bar/lounge.</p><p>CheckIn Instructions : <ul>  <li>Extra-person charges may apply and vary depending on property policy</li><li>Government-issued photo identification and a credit card, debit card, or cash deposit may be required at check-in for incidental charges</li><li>Special requests are subject to availability upon check-in and may incur additional charges; special requests cannot be guaranteed</li><li>Safety features at this property include a fire extinguisher, a smoke detector, a security system, a first aid kit, and window guards</li>  </ul></p><p>Special Instructions : This property doesn t offer after-hours check-in. Front desk staff will greet guests on arrival.</p>",853-28-781211,Dry cleaning/laundry service Wheelchair accessible Wheelchair accessible  no Luggage storage Business center Number of meeting rooms - 1 24-hour front desk Free WiFi Number of bars/lounges - 1 Health club Designated smoking areas Number of spa tubs - 1 Number of indoor pools - 1 Safe-deposit box at front desk Designated smoking areas (fines apply) Laundry facilities Sauna Tours/ticket assistance elevator,22.191963|113.548453,85328781233,33460,http://www.metroparkmacau.com
