countyCode,countyName,cityCode,cityName,HotelCode,HotelName,HotelRating,Address,Attractions,Description,FaxNumber,HotelFacilities,Map,PhoneNumber,PinCode,HotelWebsiteUrl
MO,Macau,151142,Macau,1016317,Sheraton Grand Macao Hotel Cotai Central,FourStar,Estrada do Istmo. s/n Cotai ,Distances are displayed to the nearest 0.1 mile and kilometer. <br /> <p>The Londoner Macao - 0.1 km / 0.1 mi <br /> City of Dreams - 0.5 km / 0.3 mi <br /> Venetian Macao Casino - 0.8 km / 0.5 mi <br /> Hard Rock Casino - 0.8 km / 0.5 mi <br /> Macau University of Science and Technology - 1 km / 0.6 mi <br /> Cotai Arena - 1.2 km / 0.7 mi <br /> Eiffel Tower at The Parisian Macao - 1.2 km / 0.7 mi <br /> The House of Dancing Water - 1.3 km / 0.8 mi <br /> Studio City Water Park - 1.5 km / 0.9 mi <br /> TeamLab SuperNature Macao - 1.5 km / 0.9 mi <br /> Carmel Garden - 1.6 km / 1 mi <br /> Qube at the Venetian - 1.6 km / 1 mi <br /> Macau East Asian Games Dome - 1.6 km / 1 mi <br /> The Grand Canal Shoppes - 1.6 km / 1 mi <br /> Cotai Strip - 1.6 km / 1 mi <br /> </p><p>The nearest airports are:<br />Macau Intl. Airport (MFM) - 5.4 km / 3.3 mi<br /> Hong Kong International Airport (HKG) - 61.7 km / 38.3 mi<br /> Zhuhai (ZUH-Jinwan) - 48.2 km / 30 mi<br /> </p><p></p>,"<p>HeadLine : Near Studio City Water Park</p><p>Location : When you stay at Sheraton Grand Macao in Cotai, you ll be connected to the convention center, within a 5-minute drive of Cotai Strip and Cotai Arena.  This 4.5-star hotel is 1.1 mi (1.8 km) from The Grand Canal Shoppes.</p><p>Rooms : Make yourself at home in one of the 4001 guestrooms featuring iPod docking stations and LCD televisions. Complimentary wired and wireless Internet access keeps you connected, and cable programming provides entertainment. Private bathrooms with separate bathtubs and showers feature deep soaking bathtubs and complimentary toiletries. Conveniences include phones, as well as laptop-compatible safes and desks.</p><p>Dining : Grab a bite at Feast, one of the hotel s 2 restaurants, or stay in and take advantage of the 24-hour room service. Quench your thirst with your favorite drink at the poolside bar. Buffet breakfasts are available daily from 6:30 AM to 10:30 AM for a fee.</p><p>CheckIn Instructions : <ul>  <li>Extra-person charges may apply and vary depending on property policy</li><li>Government-issued photo identification and a credit card, debit card, or cash deposit may be required at check-in for incidental charges</li><li>Special requests are subject to availability upon check-in and may incur additional charges; special requests cannot be guaranteed</li><li>The name on the credit card used at check-in to pay for incidentals must be the primary name on the guestroom reservation</li><li>This property accepts credit cards and cash</li><li>Safety features at this property include a carbon monoxide detector, a fire extinguisher, a smoke detector, a security system, a first aid kit, and window guards</li><li>Please note that cultural norms and guest policies may differ by country and by property; the policies listed are provided by the property</li>  </ul> <ul>  <li>Guests booking Club Room types at this property are granted Club access for the number of adults on the reservation. Additional adults and children over age 3 are charged access fees.</li><li>Guests age 13 and older will be considered adults.</li>  </ul></p><p>Special Instructions : Front desk staff will greet guests on arrival. For more details, please contact the property using the information on the booking confirmation.</p>",853-2880-2111,Pool sun loungers Conference space size (feet) - 267827 Concierge services Dry cleaning/laundry service Shopping on site Pool umbrellas Number of meeting rooms - 13 Conference space size (meters) - 24882 Swimming pool Free WiFi Designated smoking areas Number of poolside bars - 1 Number of outdoor pools - 2 In-room accessibility (in select rooms) Wheelchair accessible parking Roll-in shower (in select rooms) Tours/ticket assistance Accessible bathroom (in select rooms) Free airport transportation Wheelchair-accessible lounge Wheelchair-accessible on-site restaurant Visual alarms in hallways Multilingual staff Handrails in stairways Conference center Wheelchairs available on site Breakfast available (surcharge) Wheelchair-accessible meeting spaces/business center Laundry facilities elevator Fitness facilities Banquet hall Wheelchair accessible (may have limitations) Ballroom Wheelchair-accessible concierge desk Wheelchair-accessible van parking Wheelchair-accessible path to elevator Valet for wheelchair-equipped vehicle Wheelchair-accessible spa Wheelchair-accessible registration desk Wheelchair-accessible fitness center Wheelchair-accessible pool Wheelchair-accessible public washroom Spa treatment room(s) Well-lit path to entrance Garden Stair-free path to entrance Full-service spa Wedding services 24-hour fitness facilities Shopping mall on site Designer stores on site Luggage storage Express check-out Porter/bellhop Business center 24-hour front desk Golfing nearby Safe-deposit box at front desk Designated smoking areas (fines apply) Children's pool Sauna Steam room Conference space Self parking (surcharge) Pool cabanas (surcharge) Hair salon Terrace ATM/banking Wheelchair accessible path of travel,22.145334|113.56379,85328802000,,http://www.sheratongrandmacao.com/
MO,Macau,151142,Macau,1023746,Macau Masters Hotel,TwoStar,No.162 Rua Das Lorchas Macau ,Distances are displayed to the nearest 0.1 mile and kilometer. <br /> <p>Almeida Ribeiro Street - 0.2 km / 0.1 mi <br /> St. Joseph s Seminary and Church - 0.4 km / 0.2 mi <br /> St. Augustine s Church - 0.4 km / 0.3 mi <br /> Dom Pedro V Theatre - 0.4 km / 0.3 mi <br /> Senado Square - 0.6 km / 0.3 mi <br /> St. Lawrence s Church - 0.6 km / 0.4 mi <br /> St. Dominic s Church - 0.6 km / 0.4 mi <br /> Macau Cathedral - 0.7 km / 0.4 mi <br /> New Yaohan Department Store - 0.8 km / 0.5 mi <br /> Luis de Camoes Garden and Grotto - 0.8 km / 0.5 mi <br /> Ruins of St. Paul s Cathedral - 0.9 km / 0.5 mi <br /> Nam Van Lake Cybernetic Fountain - 0.9 km / 0.5 mi <br /> Old Protestant Cemetery - 0.9 km / 0.6 mi <br /> Cineteatro Macau - 1.1 km / 0.7 mi <br /> Museum of Macau - 1.1 km / 0.7 mi <br /> </p><p>The nearest airports are:<br />Macau Intl. Airport (MFM) - 9.7 km / 6 mi<br /> Hong Kong International Airport (HKG) - 57.6 km / 35.8 mi<br /> Zhuhai (ZUH-Jinwan) - 46.6 km / 29 mi<br /> </p><p>The preferred airport for Macau Masters Hotel is Macau Intl. Airport (MFM). </p>,"<p>HeadLine : Near St. Joseph s Seminary and Church</p><p>Location : A stay at Macau Masters Hotel places you in the heart of Macau, steps from Almeida Ribeiro Street and 5 minutes by foot from St. Joseph s Seminary and Church.  This hotel is 1 mi (1.5 km) from Lisboa Casino and 1.2 mi (1.9 km) from Ruins of St. Paul s Cathedral.</p><p>Rooms : Make yourself at home in one of the 75 air-conditioned rooms featuring minibars and LCD televisions. Complimentary wireless Internet access is available to keep you connected. Private bathrooms with shower/tub combinations feature hair dryers and slippers. Conveniences include safes and electric kettles.</p><p>Dining : Enjoy a meal at the restaurant, or stay in and take advantage of the hotel s room service.</p><p>CheckIn Instructions : <ul>  <li>Extra-person charges may apply and vary depending on property policy</li><li>Government-issued photo identification and a cash deposit may be required at check-in for incidental charges</li><li>Special requests are subject to availability upon check-in and may incur additional charges; special requests cannot be guaranteed</li><li>This property accepts credit cards</li>  </ul></p><p>Special Instructions : Front desk staff will greet guests on arrival.</p>",85-3-28937565,Dry cleaning/laundry service Safe-deposit box at front desk Smoke-free property Wheelchair accessible (may have limitations) Laundry facilities Luggage storage elevator 24-hour front desk Free WiFi,22.19464|113.535765,85-3-28937572,A,http://macaumastershotel.com/
MO,Macau,151142,Macau,1023754,Ole Tai Sam Un Hotel,ThreeStar,Rua Da Caldeira No. 43 45 R C A 43 Macau ,Distances are displayed to the nearest 0.1 mile and kilometer. <br /> <p>Almeida Ribeiro Street - 0.1 km / 0.1 mi <br /> St. Joseph s Seminary and Church - 0.4 km / 0.2 mi <br /> Dom Pedro V Theatre - 0.4 km / 0.2 mi <br /> St. Augustine s Church - 0.4 km / 0.2 mi <br /> St. Dominic s Church - 0.4 km / 0.3 mi <br /> Senado Square - 0.4 km / 0.3 mi <br /> Macau Cathedral - 0.6 km / 0.4 mi <br /> St. Lawrence s Church - 0.6 km / 0.4 mi <br /> Ruins of St. Paul s Cathedral - 0.7 km / 0.4 mi <br /> Luis de Camoes Garden and Grotto - 0.7 km / 0.4 mi <br /> New Yaohan Department Store - 0.7 km / 0.4 mi <br /> Old Protestant Cemetery - 0.8 km / 0.5 mi <br /> Nam Van Lake Cybernetic Fountain - 0.9 km / 0.5 mi <br /> Museum of Macau - 0.9 km / 0.5 mi <br /> Cineteatro Macau - 0.9 km / 0.6 mi <br /> </p><p>The nearest airports are:<br />Macau Intl. Airport (MFM) - 9.9 km / 6.2 mi<br /> Hong Kong International Airport (HKG) - 57.7 km / 35.8 mi<br /> Zhuhai (ZUH-Jinwan) - 46.6 km / 28.9 mi<br /> </p><p>The preferred airport for Ole Tai Sam Un Hotel is Macau Intl. Airport (MFM). </p>,"<p>HeadLine : Near Almeida Ribeiro Street</p><p>Location : A stay at Ole Tai Sam Un Hotel places you in the heart of Macau, steps from Almeida Ribeiro Street and 5 minutes by foot from St. Joseph s Seminary and Church.  This hotel is 0.9 mi (1.5 km) from Lisboa Casino and 1.2 mi (1.9 km) from Ruins of St. Paul s Cathedral.</p><p>Rooms : Make yourself at home in one of the 40 air-conditioned rooms featuring LCD televisions. Complimentary wired and wireless Internet access keeps you connected, and cable programming provides entertainment. Private bathrooms with showers feature complimentary toiletries and hair dryers. Conveniences include safes and blackout drapes/curtains, as well as phones with free local calls.</p><p>Dining : At Ole Tai Sam Un Hotel, enjoy a satisfying meal at the restaurant. Continental breakfasts are available daily from 8:30 AM to 11 AM for a fee.</p><p>CheckIn Instructions : <ul>  <li>Extra-person charges may apply and vary depending on property policy</li><li>Government-issued photo identification and a credit card, debit card, or cash deposit may be required at check-in for incidental charges</li><li>Special requests are subject to availability upon check-in and may incur additional charges; special requests cannot be guaranteed</li><li>This property accepts credit cards; cash is not accepted</li><li>Safety features at this property include a fire extinguisher</li>  </ul></p><p>Special Instructions : Front desk staff will greet guests on arrival.</p>",85-32-8938828,Dry cleaning/laundry service Babysitting or childcare (free) Luggage storage 24-hour front desk Breakfast available (surcharge) Free WiFi Safe-deposit box at front desk Smoke-free property Tours/ticket assistance elevator Concierge services,22.195052|113.537347,85-32-8938818,853,http://oletaisamunhotel.com
MO,Macau,151142,Macau,1024870,Vacation,ThreeStar,Estrada do Repouso 36-38 Macau ,,"The 2-star Holiday Hotel offers comfort and convenience whether you're on business or holiday in Macau. Featuring a complete list of amenities, guests will find their stay at the property a comfortable one. Free Wi-Fi in all rooms, daily housekeeping, ticket service, luggage storage, Wi-Fi in public areas are on the list of things guests can enjoy. Guestrooms are fitted with all the amenities you need for a good night's sleep. In some of the rooms, guests can find television LCD/plasma screen, internet access  wireless, air conditioning, shower, bathtub. The hotel offers various recreational opportunities. Holiday Hotel is an excellent choice from which to explore Macau or to simply relax and rejuvenate.",,Hotel Car hire Room service 24-hour security Bellboy service Lift access Luggage room Non-smoking establishment,22.197775|113.543617,,00000,
MO,Macau,151142,Macau,1027482,Towns Well Motel,TwoStar,No 6 6A Calcada Das Verdades  ,Distances are displayed to the nearest 0.1 mile and kilometer. <br /> <p>Lou Kau Mansion - 0.2 km / 0.1 mi <br /> Macau Cathedral - 0.2 km / 0.1 mi <br /> St. Dominic s Church - 0.2 km / 0.1 mi <br /> Senado Square - 0.3 km / 0.2 mi <br /> Holy House of Mercy - 0.3 km / 0.2 mi <br /> Cineteatro Macau - 0.4 km / 0.2 mi <br /> Leal Senado - 0.4 km / 0.2 mi <br /> Fortaleza do Monte - 0.4 km / 0.2 mi <br /> Ruins of St. Paul s Cathedral - 0.5 km / 0.3 mi <br /> Macau Legislative Assembly Building - 0.5 km / 0.3 mi <br /> Na Tcha Temple - 0.5 km / 0.3 mi <br /> Sir Robert Ho Tung Library - 0.6 km / 0.4 mi <br /> St. Joseph s Seminary and Church - 0.6 km / 0.4 mi <br /> Hospital Conde S. Januario - 0.6 km / 0.4 mi <br /> Tap Seac Multisport Pavilion - 0.6 km / 0.4 mi <br /> </p><p>The nearest airports are:<br />Macau Intl. Airport (MFM) - 9.1 km / 5.7 mi<br /> Hong Kong Intl. Airport (HKG) - 58.2 km / 36.2 mi<br /> Zhuhai (ZUI-Jiuzhou Ferry Port) - 10.8 km / 6.7 mi<br /> Zhuhai (ZUH-Sanzao Intl.) - 46.8 km / 29.1 mi<br /> </p><p>The preferred airport for Towns Well Motel is Macau Intl. Airport (MFM). </p>,"<p>HeadLine : Near Senado Square</p><p>Location : With a stay at Towns Well Motel, you ll be centrally located in Macau, just a 4-minute walk from Senado Square and 6 minutes by foot from Ruins of St. Paul s Cathedral.  This hotel is 2 mi (3.2 km) from Macau Tower and 6.3 mi (10.2 km) from Venetian Macao Casino.</p><p>Rooms : Make yourself at home in one of the 56 air-conditioned rooms featuring LCD televisions. Complimentary wireless Internet access keeps you connected, and cable programming is available for your entertainment. Private bathrooms with showers feature complimentary toiletries and hair dryers. Conveniences include phones, as well as desks and electric kettles.</p><p>Dining : At Towns Well Motel, enjoy a satisfying meal at the restaurant.</p><p>CheckIn Instructions : Extra-person charges may apply and vary depending on property policy Government-issued photo identification and a credit card, debit card, or cash deposit may be required at check-in for incidental charges Special requests are subject to availability upon check-in and may incur additional charges; special requests cannot be guaranteed No onsite parking is available This property accepts credit cards Safety features at this property include a fire extinguisher and a first aid kit</p><p>Special Instructions : Front desk staff will greet guests on arrival.</p>",853-853-28356333,elevator Smoke-free property Wheelchair accessible (may have limitations) 24-hour front desk Free WiFi Dry cleaning/laundry service Tours/ticket assistance Restaurant Laundry facilities,22.19487|113.54201,853-853-63721818,,http://www.townswellhotel.com/
MO,Macau,151142,Macau,1050979,Holiday Inn Macau,FourStar,Rua De Pequim 82-86 Macau ,Distances are displayed to the nearest 0.1 mile and kilometer. <br /> <p>Lisboa Casino - 0.4 km / 0.3 mi <br /> Rio Casino - 0.6 km / 0.4 mi <br /> Jardim do Sao Francisco - 0.6 km / 0.4 mi <br /> Almeida Ribeiro Street - 0.6 km / 0.4 mi <br /> Cineteatro Macau - 0.7 km / 0.4 mi <br /> Hospital Conde S. Januario - 0.7 km / 0.4 mi <br /> Grand Prix Museum - 0.8 km / 0.5 mi <br /> Lotus Square - 0.9 km / 0.5 mi <br /> Macau Forum - 0.9 km / 0.5 mi <br /> Tap Seac Multisport Pavilion - 0.9 km / 0.6 mi <br /> New Yaohan Department Store - 0.9 km / 0.6 mi <br /> Guan Yin Statue Waterfront Park - 1 km / 0.6 mi <br /> Macau Cathedral - 1 km / 0.6 mi <br /> Guia Hill Air Raid Shelter - 1.1 km / 0.7 mi <br /> Guia Fortress - 1.1 km / 0.7 mi <br /> </p><p>The nearest airports are:<br />Macau Intl. Airport (MFM) - 7.9 km / 4.9 mi<br /> Hong Kong International Airport (HKG) - 56.6 km / 35.1 mi<br /> Zhuhai (ZUH-Jinwan) - 55.1 km / 34.2 mi<br /> </p><p>The preferred airport for Holiday Inn Macau  an IHG Hotel is Macau Intl. Airport (MFM). </p>,"<p>HeadLine : Near Lisboa Casino</p><p>Location : Centrally located in Macau, Holiday Inn Macau, an IHG Hotel is within a 15-minute walk of Macau Fisherman s Wharf and Senado Square.  This 4-star hotel is 1 mi (1.7 km) from Macau Ferry Terminal and 1.2 mi (2 km) from Ruins of St. Paul s Cathedral.</p><p>Rooms : Make yourself at home in one of the 322 guestrooms featuring refrigerators and LCD televisions. Complimentary wireless Internet access keeps you connected, and satellite programming is available for your entertainment. Private bathrooms with showers feature complimentary toiletries and hair dryers. Conveniences include phones, as well as safes and desks.</p><p>Dining : Satisfy your appetite for lunch or dinner at the hotel s bar/lounge, Oskar s Bar, or stay in and take advantage of the 24-hour room service. Buffet breakfasts are available daily from 7:00 AM to 10:00 AM for a fee.</p><p>Renovations : The following facilities are closed on Sunday, Monday, Tuesday, Wednesday, and Thursday: <ul><li>Full-service spa</li><li>Sauna</li><li>Spa tub</li></ul> The following facilities are closed on Friday and Saturday: <ul><li>Full-service spa</li><li>Sauna</li><li>Spa tub</li></ul></p><p>CheckIn Instructions : <ul>  <li>Extra-person charges may apply and vary depending on property policy</li><li>Government-issued photo identification and a credit card, debit card, or cash deposit may be required at check-in for incidental charges</li><li>Special requests are subject to availability upon check-in and may incur additional charges; special requests cannot be guaranteed</li><li>This property accepts credit cards; cash is not accepted</li><li>Safety features at this property include a carbon monoxide detector, a fire extinguisher, a smoke detector, a security system, and a first aid kit</li><li>Please note that cultural norms and guest policies may differ by country and by property; the policies listed are provided by the property</li>  </ul></p><p>Special Instructions : To make arrangements for check-in please contact the property ahead of time using the information on the booking confirmation. If you are planning to arrive after midnight please contact the property in advance using the information on the booking confirmation. Guests must contact the property in advance for check-in instructions. Front desk staff will greet guests on arrival.  Guests booked in breakfast included rate plans receive breakfast for up to 2 adults who are sharing a guestroom. Breakfast fees apply for additional guests. Guests booked in dinner included rate plans receive dinner for up to 2 adults who are sharing a guestroom. Dinner fees apply for additional guests.</p>",853-2878-2321,Dry cleaning/laundry service Wheelchair accessible (may have limitations) Babysitting or childcare (surcharge) Meeting rooms Free WiFi Number of bars/lounges - 1 Health club Assistive listening devices available Number of indoor pools - 1 In-room accessibility (in select rooms) Full-service spa Tours/ticket assistance Free area shuttle Free ferry terminal shuttle Luggage storage Porter/bellhop Multilingual staff Business center 24-hour front desk Breakfast available (surcharge) Golfing nearby Spa services on site Safe-deposit box at front desk Smoke-free property Laundry facilities Steam room elevator Fitness facilities Conference space ATM/banking Wheelchair accessible path of travel Conference space size (feet) - 135 Concierge services,22.191542|113.547264,853-2878-3333,33460,http://www.holidayinn.com/macaumacau
MO,Macau,151142,Macau,1122251,Grand Coloane Resort,FourStar,1918 Estrada de Hac Sa P.O. Box 1429ColoaneMacao ,Distances are displayed to the nearest 0.1 mile and kilometer. <br /> <p>Hac Sa Beach - 1 km / 0.6 mi <br /> Macau Golf and Country Club - 1.3 km / 0.8 mi <br /> A-Ma Statue - 1.8 km / 1.1 mi <br /> A-Ma Cultural Village - 2 km / 1.2 mi <br /> Seac Pai Van Park - 2.7 km / 1.7 mi <br /> Macau Orient Golf Club - 3 km / 1.9 mi <br /> Macau East Asian Games Dome - 3.2 km / 2 mi <br /> Karting Track - 3.3 km / 2 mi <br /> The Londoner Macao - 3.6 km / 2.3 mi <br /> Studio City Water Park - 3.6 km / 2.3 mi <br /> Eiffel Tower at The Parisian Macao - 4.1 km / 2.5 mi <br /> Venetian Macao Casino - 4.2 km / 2.6 mi <br /> City of Dreams - 4.3 km / 2.6 mi <br /> Hard Rock Casino - 4.3 km / 2.7 mi <br /> Macau University of Science and Technology - 4.3 km / 2.7 mi <br /> </p><p>The nearest airports are:<br />Macau Intl. Airport (MFM) - 7.5 km / 4.6 mi<br /> Hong Kong International Airport (HKG) - 65.2 km / 40.5 mi<br /> Zhuhai (ZUH-Jinwan) - 54.2 km / 33.7 mi<br /> </p><p>The preferred airport for Grand Coloane Resort is Macau Intl. Airport (MFM). </p>,"<p>HeadLine : Near Macau Golf and Country Club</p><p>Location : Located in Coloane, Grand Coloane Resort is by the ocean, within a 5-minute drive of Macau Golf and Country Club and Karting Track.  This 4.5-star resort is 2.9 mi (4.6 km) from Venetian Macao Casino and 3 mi (4.9 km) from City of Dreams.</p><p>Rooms : Make yourself at home in one of the 208 guestrooms featuring minibars. Rooms have private balconies. Complimentary wired and wireless Internet access keeps you connected, and pay movies provides entertainment. Private bathrooms with separate bathtubs and showers feature complimentary toiletries and hair dryers.</p><p>Dining : Enjoy international cuisine at Cafe Panorama, one of the resort s 2 restaurants, or stay in and take advantage of the 24-hour room service. Snacks are also available at the coffee shop/cafe. Relax with your favorite drink at the bar/lounge or the poolside bar. Buffet breakfasts are available daily from 7:00 AM to 11:00 AM for a fee.</p><p>CheckIn Instructions : <ul>  <li>Extra-person charges may apply and vary depending on property policy</li><li>Government-issued photo identification and a credit card, debit card, or cash deposit may be required at check-in for incidental charges</li><li>Special requests are subject to availability upon check-in and may incur additional charges; special requests cannot be guaranteed</li><li>This property accepts credit cards and cash</li><li>Please note that cultural norms and guest policies may differ by country and by property; the policies listed are provided by the property</li>  </ul></p><p>Special Instructions : Front desk staff will greet guests on arrival.</p>",853-2887-1122,Dry cleaning/laundry service Parking (limited spaces) Babysitting or childcare (surcharge) Pool umbrellas Number of meeting rooms - 13 Sailing nearby Free WiFi Number of bars/lounges - 1 Designated smoking areas Number of spa tubs - 1 Number of poolside bars - 1 Number of outdoor pools - 1 Number of indoor pools - 1 In-room accessibility (in select rooms) Tours/ticket assistance Fitness classes on site Outdoor tennis courts - 4 Multilingual staff Breakfast available (surcharge) Coffee/tea in common areas Number of coffee shops/cafes - 1 Laundry facilities elevator Fitness facilities Children's club (surcharge) Bicycle rentals on site Mountain biking nearby Banquet hall Golfing on site Internet access in public areas - surcharge Garden Internet access in public areas - high speed Free newspapers in lobby Full-service spa Wedding services Golf driving range on site Yoga classes/instruction on site Golf lessons on site Luggage storage Express check-out Porter/bellhop Business center 24-hour front desk Playground on site Hiking/biking trails nearby Children's pool Sauna Steam room Free self parking Conference space Computer station Terrace ATM/banking Golf course on site Concierge services Pilates classes on site,22.125391|113.575936,853-2887-1111,00000,http://www.grandcoloane.com
