countyCode,countyName,cityCode,cityName,HotelCode,HotelName,HotelRating,Address,Attractions,Description,FaxNumber,HotelFacilities,Map,PhoneNumber,PinCode,HotelWebsiteUrl
MY,Malaysia,101095,Alor Setar,1947703,Keriang Hill Resort,ThreeStar,Jalan Gunung Keriang Mukim Gunung ,,"Keriang Hill Resort is conveniently located in the popular Alor Setar City Center area. Both business travelers and tourists can enjoy the property's facilities and services. Facilities like convenience store, daily housekeeping, gift/souvenir shop, portable wi-fi rental, taxi service are readily available for you to enjoy. Guestrooms are fitted with all the amenities you need for a good night's sleep. In some of the rooms, guests can find complimentary tea, closet, towels, clothes rack, scale. Enjoy the badminton court, dart board, fitness center, outdoor pool, fishing before retiring to your room for a well-deserved rest. Discover all Alor Setar has to offer by making Keriang Hill Resort your base.",,languages spoken Internet access fitness &amp; recreation things to do  ways to relax dining  drinking  and snacking services and conveniences for the kids getting around available in all rooms,6.1892947|100.32736699999998,+6047315233,06570,http://kerianghill.com.my/
MY,Malaysia,101095,Alor Setar,1948907,Chalet Purnama,All,Lot 1519-G Jalan Gunung Keriang Gunung Keriang Hilir ,,"Chalet Purnama is offering accommodation in Alor Setar. Every room is fitted with a patio.

At the hotel, all rooms include a balcony with a garden view. Complete with a private bathroom fitted with a bidet and free toiletries, all guest rooms at Chalet Purnama have a flat-screen TV and air conditioning, and selected rooms also offer a terrace. The units will provide guests with a desk and a kettle.

The nearest airport is Sultan Abdul Halim Airport, 10 km from the accommodation. From 1st January 2023, a tourist tax of RM 10 per room per night is applied to all foreign guests. This tax is not included in the room rate and must be paid upon check-in. Guests with a valid Malaysian Identity Card or valid permanent residents MY PR Card are exempted.",,Parking Room service Non-smoking rooms Family rooms Free parking Air conditioning Lockers parking on site Private parking Street parking Accessible parking,6.18679|100.33677,,06570,https://www.booking.com/hotel/my/chalet-purnama.html
MY,Malaysia,101095,Alor Setar,5209637,Hijrah Hotel,OneStar,"208 Jalan Shahab Perdana 4 , Shahab perdana ALOR SETAR ",,"Ideally located in the prime touristic area of Alor Setar City Center, Hijrah Hotel promises a relaxing and wonderful visit. The hotel offers a wide range of amenities and perks to ensure you have a great time. Free Wi-Fi in all rooms, 24-hour front desk, 24-hour room service, car park, airport transfer are on the list of things guests can enjoy. Designed for comfort, selected guestrooms offer television LCD/plasma screen, internet access  wireless, air conditioning, satellite/cable TV, toiletries to ensure a restful night. Recuperate from a full day of sightseeing in the comfort of your room or take advantage of the hotel's recreational facilities, including massage. Hijrah Hotel combines warm hospitality with a lovely ambiance to make your stay in Alor Setar unforgettable.",,Hotel Airport shuttle Room service Bellboy service Garden Luggage room Smoking area Non-smoking establishment,6.1399635|100.3541121,,5150,
MY,Malaysia,101095,Alor Setar,5225342,Happy Homestay Alor Setar,ThreeStar,"8F Jalan Seladang 2 Taman Seladang, Anak Bukit  ",Distances are displayed to the nearest 0.1 mile and kilometer. <br /> <p>Darul Aman Stadium - 4.2 km / 2.6 mi <br /> Paddy Museum - 5 km / 3.1 mi <br /> Aman Central - 5.2 km / 3.2 mi <br /> Menara Alor Star - 5.3 km / 3.3 mi <br /> Alor Setar Tower - 5.5 km / 3.4 mi <br /> Yellow Palace - 5.6 km / 3.5 mi <br /> Muzium Negeri - 5.6 km / 3.5 mi <br /> Galeri Sultan Abdul Halim - 5.6 km / 3.5 mi <br /> Clock Tower - 5.7 km / 3.5 mi <br /> Zahir Mosque - 5.7 km / 3.6 mi <br /> Padang - 5.7 km / 3.6 mi <br /> Wat Nikrodharam - 5.8 km / 3.6 mi <br /> Balai Besar - 5.8 km / 3.6 mi <br /> Balai Nobat - 5.8 km / 3.6 mi <br /> Kedah Royal Museum - 5.8 km / 3.6 mi <br /> </p><p>The nearest major airport is Alor Setar (AOR-Sultan Abdul Halim) - 5.5 km / 3.4 mi</p>,"<p>HeadLine : In Alor Setar</p><p>Location : Located in Alor Setar, this vacation home is within a 5-minute drive of Darul Aman Stadium and Paddy Museum.  This vacation home is 9.3 mi (14.9 km) from Kuala Kedah Jetty and 3.2 mi (5.2 km) from Aman Central.</p><p>Rooms : Make yourself comfortable in this air-conditioned vacation home, featuring a kitchenette with a full-sized refrigerator/freezer and a stovetop. An LED television with cable programming provides entertainment, while complimentary wireless Internet access keeps you connected. Conveniences include a coffee/tea maker and complimentary bottled water, and you can also request a rollaway/extra bed (surcharge).</p><p>Dining : Local cuisine breakfasts are available daily from 8 AM to 10 AM for a fee.</p><p>CheckIn Instructions : <ul>  <li>Extra-person charges may apply and vary depending on property policy</li><li>Government-issued photo identification and a cash deposit may be required at check-in for incidental charges</li><li>Special requests are subject to availability upon check-in and may incur additional charges; special requests cannot be guaranteed</li><li>This property accepts cash</li>  </ul></p><p>Special Instructions : There is no front desk at this property. To make arrangements for check-in please contact the property at least 24 hours before arrival using the information on the booking confirmation. Guests must contact the property for check-in instructions. At check-in, guests must provide a record of full COVID-19 vaccination.</p>",60-12-4880019,Playground on site Barbecue grill(s) Smoke-free property elevator Free self parking Breakfast available (surcharge) Free WiFi,6.170393|100.369101,60-12-4880019,06550,
MY,Malaysia,101095,Alor Setar,5320209,Box Homestay @ Alor Setar,ThreeStar,Jalan Gunung Perak 9  ,Distances are displayed to the nearest 0.1 mile and kilometer. <br /> <p>Muda River - 0.1 km / 0.1 mi <br /> Alor Star Mall - 1.2 km / 0.7 mi <br /> Kedah Royal Museum (Muzium Diraja Kedah) - 4.2 km / 2.6 mi <br /> Kedah State Art Gallery (Balai Seni Negeri) - 4.2 km / 2.6 mi <br /> Zahir Mosque - 4.3 km / 2.6 mi <br /> Balai Besar - 4.3 km / 2.6 mi <br /> Nobat Gallery (Balai Nobat) - 4.4 km / 2.7 mi <br /> State High Court (Mahkamah Tinggi Negeri) - 4.4 km / 2.8 mi <br /> Yellow Palace - 4.8 km / 3 mi <br /> Alor Setar Tower (Menara Alor Setar) - 4.9 km / 3 mi <br /> Aman Central - 4.9 km / 3 mi <br /> Wat Nikrodharam - 6.4 km / 4 mi <br /> Darul Aman Stadium - 6.4 km / 4 mi <br /> Kuala Kedah Jetty - 9.2 km / 5.7 mi <br /> Kuala Kedah Fort - 10.7 km / 6.7 mi <br /> </p><p>The nearest major airport is Alor Setar (AOR-Sultan Abdul Halim) - 23 km / 14.3 mi</p>,"<p>HeadLine : Near Alor Star Mall</p><p>Location : With a stay at this vacation home in Alor Setar, you ll be a 1-minute walk from Muda River and 14 minutes by foot from Alor Star Mall.  This vacation home is 5.7 mi (9.2 km) from Kuala Kedah Jetty and 2.6 mi (4.2 km) from Zahir Mosque.</p><p>Rooms : Make yourself comfortable in this air-conditioned vacation home, featuring a kitchenette with a full-sized refrigerator/freezer and an oven. There s a private patio. An LED television with digital programming provides entertainment, while complimentary wireless Internet access keeps you connected. Conveniences include a desk and a microwave.</p><p>CheckIn Instructions : <ul>  <li>Extra-person charges may apply and vary depending on property policy</li><li>Government-issued photo identification and a cash deposit may be required at check-in for incidental charges</li><li>Special requests are subject to availability upon check-in and may incur additional charges; special requests cannot be guaranteed</li><li>This property accepts cash</li>  </ul></p><p>Special Instructions : There is no front desk at this property. This property doesn t offer after-hours check-in. To make arrangements for check-in please contact the property at least 24 hours before arrival using the information on the booking confirmation. Guests must contact the property for check-in instructions.</p>",,Barbecue grill(s) Garden Free self parking Designated smoking areas,6.089091|100.358558,60-1110300459,05400,
MY,Malaysia,101095,Alor Setar,5343281,I Homey Guesthouse,TwoStar,No 158 Taman Berjaya Lorong Teratai Merah 1 Alor Setar Kedah  ,Distances are displayed to the nearest 0.1 mile and kilometer. <br /> <p>Muda River - 0.1 km / 0.1 mi <br /> Kedah State Art Gallery (Balai Seni Negeri) - 2.6 km / 1.6 mi <br /> Zahir Mosque - 2.7 km / 1.7 mi <br /> Balai Besar - 2.7 km / 1.7 mi <br /> Nobat Gallery (Balai Nobat) - 2.8 km / 1.7 mi <br /> State High Court (Mahkamah Tinggi Negeri) - 2.8 km / 1.8 mi <br /> Kedah Royal Museum (Muzium Diraja Kedah) - 2.9 km / 1.8 mi <br /> Alor Star Mall - 3.1 km / 2 mi <br /> Yellow Palace - 3.2 km / 2 mi <br /> Alor Setar Tower (Menara Alor Setar) - 3.2 km / 2 mi <br /> Aman Central - 3.2 km / 2 mi <br /> Wat Nikrodharam - 4 km / 2.5 mi <br /> Darul Aman Stadium - 5 km / 3.1 mi <br /> Kuala Kedah Jetty - 9.1 km / 5.7 mi <br /> Kuala Kedah Fort - 10.7 km / 6.6 mi <br /> </p><p>The nearest major airport is Alor Setar (AOR-Sultan Abdul Halim) - 13.6 km / 8.4 mi</p>,"<p>HeadLine : Near Kedah State Art Gallery (Balai Seni Negeri)</p><p>Location : With a stay at I-Homey Guesthouse in Alor Setar, you ll be steps from Muda River and a 3-minute drive from Kedah State Art Gallery (Balai Seni Negeri).  This guesthouse is 5.7 mi (9.1 km) from Kuala Kedah Jetty and 1.7 mi (2.7 km) from Zahir Mosque.</p><p>Rooms : Make yourself at home in one of the 20 air-conditioned guestrooms. Complimentary wireless Internet access keeps you connected, and cable programming is available for your entertainment. Private bathrooms with showers feature complimentary toiletries and hair dryers. Conveniences include complimentary bottled water, housekeeping is provided daily, and irons/ironing boards can be requested.</p><p>CheckIn Instructions : <ul>  <li>Extra-person charges may apply and vary depending on property policy</li><li>Government-issued photo identification and a cash deposit may be required at check-in for incidental charges</li><li>Special requests are subject to availability upon check-in and may incur additional charges; special requests cannot be guaranteed</li><li>This property accepts credit cards</li>  </ul></p><p>Special Instructions : Front desk staff will greet guests on arrival.</p>",60-4-7721333,Smoke-free property Terrace Free self parking Free WiFi 24-hour front desk,6.1039|100.355187,60-12-4728904,05050,
MY,Malaysia,101095,Alor Setar,5405294,OOI Homestay Alor Setar,ThreeStar,No. 2 Taman Nona 2 Jalan Alor Mengkudu  ,Distances are displayed to the nearest 0.1 mile and kilometer. <br /> <p>Muda River - 0.1 km / 0.1 mi <br /> Alor Star Mall - 6 km / 3.7 mi <br /> Kedah State Art Gallery (Balai Seni Negeri) - 6 km / 3.7 mi <br /> Balai Besar - 6.2 km / 3.8 mi <br /> Zahir Mosque - 6.2 km / 3.8 mi <br /> Nobat Gallery (Balai Nobat) - 6.3 km / 3.9 mi <br /> State High Court (Mahkamah Tinggi Negeri) - 6.4 km / 4 mi <br /> Kedah Royal Museum (Muzium Diraja Kedah) - 6.4 km / 4 mi <br /> Wat Nikrodharam - 7.1 km / 4.4 mi <br /> Yellow Palace - 7.8 km / 4.8 mi <br /> Alor Setar Tower (Menara Alor Setar) - 7.9 km / 4.9 mi <br /> Aman Central - 7.9 km / 4.9 mi <br /> Darul Aman Stadium - 9 km / 5.6 mi <br /> Kuala Kedah Jetty - 12.3 km / 7.6 mi <br /> Kuala Kedah Fort - 13.8 km / 8.6 mi <br /> </p><p>The preferred airport for this vacation home is Alor Setar (AOR-Sultan Abdul Halim) - 19 km / 11.8 mi </p>,"<p>HeadLine : In Alor Setar</p><p>Location : Located in Alor Setar, this vacation home is a 1-minute drive from Muda River and 7 minutes from Wat Nikrodharam.  This vacation home is 3.7 mi (6 km) from Alor Star Mall and 3.7 mi (6 km) from Kedah State Art Gallery (Balai Seni Negeri).</p><p>Rooms : Make yourself comfortable in this air-conditioned vacation home, featuring a kitchen with a refrigerator and a stovetop. A flat-screen television with cable programming provides entertainment, while complimentary wireless Internet access keeps you connected. Conveniences include a desk and an electric kettle, and you can also request a rollaway/extra bed (surcharge).</p><p>CheckIn Instructions : <ul>  <li>Extra-person charges may apply and vary depending on property policy</li><li>Government-issued photo identification and a cash deposit may be required at check-in for incidental charges</li><li>Special requests are subject to availability upon check-in and may incur additional charges; special requests cannot be guaranteed</li><li>This property accepts cash</li>  </ul></p><p>Special Instructions : There is no front desk at this property. This property doesn t offer after-hours check-in.</p>",60-4-9291051,Terrace Accessible bathroom Free self parking Wheelchair accessible parking In-room accessibility Smoke-free property,6.08901|100.39292,60-16-4729623,05400,
MY,Malaysia,101095,Alor Setar,5421171,KKP Homestay Alor Setar,ThreeStar,42 Jalan Kota Damai  ,Distances are displayed to the nearest 0.1 mile and kilometer. <br /> <p>Alor Star Mall - 3.8 km / 2.3 mi <br /> Mahathirs Birthplace - 4.3 km / 2.7 mi <br /> Rumah Kelahiran Mahathir - 4.4 km / 2.7 mi <br /> Kedah State Art Gallery - 4.9 km / 3 mi <br /> Padang - 5.1 km / 3.1 mi <br /> Zahir Mosque - 5.1 km / 3.1 mi <br /> Clock Tower - 5.2 km / 3.2 mi <br /> Pekan Rabu Complex - 5.2 km / 3.2 mi <br /> Balai Besar - 5.2 km / 3.3 mi <br /> Balai Nobat - 5.2 km / 3.3 mi <br /> Galeri Sultan Abdul Halim - 5.3 km / 3.3 mi <br /> Kedah Royal Museum - 5.3 km / 3.3 mi <br /> Alor Setar Tower - 5.6 km / 3.5 mi <br /> Yellow Palace - 5.7 km / 3.5 mi <br /> Muzium Negeri - 6.1 km / 3.8 mi <br /> </p><p>The nearest major airport is Alor Setar (AOR-Sultan Abdul Halim) - 25.6 km / 15.9 mi</p>,"<p>HeadLine : Near Alor Star Mall</p><p>Location : Located in Alor Setar, this vacation home is within a 10-minute drive of Alor Star Mall and Mahathirs Birthplace.  This vacation home is 4.5 mi (7.3 km) from Kuala Kedah Jetty and 2.8 mi (4.5 km) from Rumah Kelahiran Mahathir.</p><p>Rooms : Make yourself comfortable in this air-conditioned vacation home, featuring a kitchenette with a full-sized refrigerator/freezer and a stovetop. An LCD television with cable programming provides entertainment, while complimentary wireless Internet access keeps you connected. Conveniences include a microwave and complimentary bottled water.</p><p>CheckIn Instructions : <ul>  <li>Extra-person charges may apply and vary depending on property policy</li><li>Government-issued photo identification and a cash deposit may be required at check-in for incidental charges</li><li>Special requests are subject to availability upon check-in and may incur additional charges; special requests cannot be guaranteed</li><li>This property accepts cash</li>  </ul></p><p>Special Instructions : There is no front desk at this property. To make arrangements for check-in please contact the property at least 24 hours before arrival using the information on the booking confirmation. Guests must contact the property for check-in instructions.</p>",60-16-2652203,Playground on site Free self parking Smoke-free property,6.09031|100.3441,60-16-2652203,06600,
MY,Malaysia,101095,Alor Setar,5426963,Lyly Homestay,TwoStar,No 47 Taman Kota Damai 4 3 Taman Kota Damai  ,Distances are displayed to the nearest 0.1 mile and kilometer. <br /> <p>Kedah Royal Museum (Muzium Diraja Kedah) - 5.5 km / 3.4 mi <br /> Kedah State Art Gallery (Balai Seni Negeri) - 5.5 km / 3.4 mi <br /> Balai Besar - 5.7 km / 3.5 mi <br /> Zahir State Mosque (Masjid Zahir) - 5.7 km / 3.5 mi <br /> Nobat Gallery (Balai Nobat) - 5.8 km / 3.6 mi <br /> State High Court (Mahkamah Tinggi Negeri) - 5.9 km / 3.6 mi <br /> Alor Setar Tower (Menara Alor Setar) - 6.2 km / 3.9 mi <br /> Wat Nikrodharam - 6.8 km / 4.2 mi <br /> Yellow Palace - 6.9 km / 4.3 mi <br /> Darul Aman Stadium - 8.3 km / 5.2 mi <br /> Kuala Kedah Fort - 9.3 km / 5.8 mi <br /> Paddy Museum - 16.2 km / 10.1 mi <br /> </p><p>The nearest major airport is Alor Setar (AOR-Sultan Abdul Halim) - 20.1 km / 12.5 mi</p>,"<p>HeadLine : In Alor Setar</p><p>Location : With a stay at this vacation home in Alor Setar, you ll be within a 15-minute drive of Kedah State Art Gallery (Balai Seni Negeri) and Balai Besar.  This vacation home is 3.4 mi (5.5 km) from Kedah Royal Museum (Muzium Diraja Kedah) and 3.5 mi (5.7 km) from Zahir State Mosque (Masjid Zahir).</p><p>Rooms : Make yourself comfortable in this individually decorated vacation home, featuring a kitchen with a full-sized refrigerator/freezer and a stovetop. An LCD television is provided for your entertainment. Conveniences include a safe and a desk.</p><p>CheckIn Instructions : Extra-person charges may apply and vary depending on property policy. <br />Government-issued photo identification and a credit card, debit card, or cash deposit are required at check-in for incidental charges. <br />Special requests are subject to availability upon check-in and may incur additional charges. Special requests cannot be guaranteed. <ul> This property only accepts cash for all bookings and onsite payments.  </ul></p>",,Express check-in Terrace Express check-out Accessible bathroom Free self parking Roll-in shower In-room accessibility Smoke-free property Garden,6.08906|100.34457,60-19-4449144,05400,
MY,Malaysia,101095,Alor Setar,5508111,Puteri Homestay,ThreeStar,Jalan Pipit 2 77  ,Distances are displayed to the nearest 0.1 mile and kilometer. <br /> <p>Darul Aman Stadium - 2.4 km / 1.5 mi <br /> Wat Nikrodharam - 3.7 km / 2.3 mi <br /> Yellow Palace - 3.8 km / 2.4 mi <br /> Alor Setar Tower (Menara Alor Setar) - 4.1 km / 2.5 mi <br /> Balai Besar - 4.4 km / 2.8 mi <br /> Zahir State Mosque (Masjid Zahir) - 4.4 km / 2.8 mi <br /> State High Court (Mahkamah Tinggi Negeri) - 4.5 km / 2.8 mi <br /> Nobat Gallery (Balai Nobat) - 4.5 km / 2.8 mi <br /> Kedah Royal Museum (Muzium Diraja Kedah) - 4.6 km / 2.9 mi <br /> Kedah State Art Gallery (Balai Seni Negeri) - 4.6 km / 2.9 mi <br /> Paddy Museum - 10.2 km / 6.4 mi <br /> Darulaman Hills - 15.3 km / 9.5 mi <br /> Kuala Kedah Fort - 15.8 km / 9.8 mi <br /> </p><p>The nearest major airport is Alor Setar (AOR-Sultan Abdul Halim) - 7.9 km / 4.9 mi</p>,"<p>HeadLine : Near Darul Aman Stadium</p><p>Location : With a stay at this vacation home in Alor Setar, you ll be within a 10-minute drive of Darul Aman Stadium and Wat Nikrodharam.  This vacation home is 2.8 mi (4.5 km) from Alor Setar Tower (Menara Alor Setar) and 2.9 mi (4.6 km) from State High Court (Mahkamah Tinggi Negeri).</p><p>Rooms : Make yourself comfortable in this air-conditioned vacation home, featuring a kitchen with a full-sized refrigerator/freezer and a stovetop. Complimentary wireless Internet access keeps you connected, and satellite programming is available for your entertainment. Conveniences include a desk and a separate sitting area.</p><p>Renovations : This property is closed until further notice.</p><p>CheckIn Instructions : Extra-person charges may apply and vary depending on property policy. <br />Government-issued photo identification and a cash deposit are required at check-in for incidental charges. <br />Special requests are subject to availability upon check-in and may incur additional charges. Special requests cannot be guaranteed. <ul> This property only accepts cash for all bookings and onsite payments.  </ul></p>",60-4-7320112,Garden Accessible bathroom Free self parking Free WiFi,6.1378|100.38924,60-12-4076002,05200,
MY,Malaysia,101095,Alor Setar,5614550,A&h 81 Homestay Alor Setar,All,Jalan Raja 67 Taman Kota Damai Jalan Kota Damai 4  ,,"A&H 81 HOMESTAY ALOR SETAR is set in Alor Setar. Guests benefit from private parking available on site and free WiFi.

The air-conditioned villa consists of 3 bedrooms, a living room, a fully equipped kitchen with a fridge and a kettle, and 2 bathrooms with a shower and free toiletries. The accommodation also offers a flat-screen TV and 2 bathrooms with a hairdryer.

The nearest airport is Sultan Abdul Halim Airport, 16 km from the villa. From 1st January 2023, a tourist tax of RM 10 per room per night is applied to all foreign guests. This tax is not included in the room rate and must be paid upon check-in. Guests with a valid Malaysian Identity Card or valid permanent residents MY PR Card are exempted.
Managed by a private host",,Parking Non-smoking rooms Free parking internet services wifi Free WiFi Non-smoking throughout Air conditioning designated smoking area parking on site Private parking kids' outdoor play equipment Street parking Accessible parking Key access,6.08924|100.34381,,05150,https://www.booking.com/hotel/my/a-amp-h-81-homestay-alor-setar.html
