countyCode,countyName,cityCode,cityName,HotelCode,HotelName,HotelRating,Address,Attractions,Description,FaxNumber,HotelFacilities,Map,PhoneNumber,PinCode,HotelWebsiteUrl
NG,Nigeria,100225,Abuja,1428083,Ayalla Hotels Ltd,ThreeStar,"3 Ibi Close Off Ahmadu Bello Way Garki Area Ii Garki Area II Beside Sahad Stores, Off Ahmadu Bello Way,Area 11 GarkiAbuja 900001 ",Distances are displayed to the nearest 0.1 mile and kilometer. <br /> <p>Abuja International Conference Centre - 2.9 km / 1.8 mi <br /> Central Bank of Nigeria - 3 km / 1.9 mi <br /> Nigerian National Mosque - 3.9 km / 2.4 mi <br /> Federal Secretariat - 4.1 km / 2.5 mi <br /> Area 1 Shopping Centre - 4.3 km / 2.7 mi <br /> World Bank - 4.3 km / 2.7 mi <br /> Ecowas Secretariat - 4.5 km / 2.8 mi <br /> Millennium Park - 4.6 km / 2.8 mi <br /> National Assembly - 4.7 km / 2.9 mi <br /> International Conference Centre - 5.1 km / 3.2 mi <br /> National Hospital Abuja - 5.4 km / 3.3 mi <br /> American International School Abuja - 6.6 km / 4.1 mi <br /> Embassy of the European Union - 7.3 km / 4.5 mi <br /> Embassy of Italy - 7.4 km / 4.6 mi <br /> Embassy of the Netherlands - 7.4 km / 4.6 mi <br /> </p><p>The nearest major airport is Abuja (ABV-Nnamdi Azikiwe Intl.) - 41.8 km / 26 mi</p>,"<p>HeadLine : Near Abuja International Conference Centre</p><p>Location : A stay at Ayalla Hotel places you in the heart of Abuja, within a 5-minute drive of Abuja International Conference Centre and Federal Secretariat.  This hotel is 2.3 mi (3.7 km) from Central Bank of Nigeria and 2.6 mi (4.2 km) from Area 1 Shopping Centre.</p><p>Rooms : Make yourself at home in one of the 61 air-conditioned rooms featuring flat-screen televisions. Cable television is provided for your entertainment. Private bathrooms with bathtubs or showers feature rainfall showerheads and complimentary toiletries. Conveniences include desks, and housekeeping is provided on a limited basis.</p><p>Dining : Quench your thirst with your favorite drink at the bar/lounge. A complimentary continental breakfast is served daily from 7 AM to 10 AM.</p><p>CheckIn Instructions : <ul>  <li>Extra-person charges may apply and vary depending on property policy</li><li>Government-issued photo identification and a credit card, debit card, or cash deposit may be required at check-in for incidental charges</li><li>Special requests are subject to availability upon check-in and may incur additional charges; special requests cannot be guaranteed</li><li>This property accepts credit cards, debit cards, and cash</li>  </ul></p><p>Special Instructions : There is no front desk at this property.</p>",2348111124379,Dry cleaning/laundry service Banquet hall Airport transportation Meeting rooms Swimming pool Limo or Town Car service available Free WiFi Number of bars/lounges - 1 Number of outdoor pools - 1 Internet access Internet access - wireless Free continental breakfast Wheelchair accessible  no Luggage storage Free breakfast Business center Daily Safe-deposit box at front desk Smoke-free property Laundry facilities elevator Free self parking Fitness facilities Conference space Pool sun loungers Concierge services,9.037205|7.497338,234-8111124379,900001,https://hotelafri.ca/ayallahotels
NG,Nigeria,100225,Abuja,1428282,Jades Hotel,FourStar,24 Ndola Crescent Wuse Zone 5 Off Micheal Okpara Street 900285 Abuja ,Distances are displayed to the nearest 0.1 mile and kilometer. <br /> <p>Embassy of the European Union - 4.1 km / 2.5 mi <br /> Magicland Amusement Park - 4.3 km / 2.7 mi <br /> National Hospital Abuja - 4.7 km / 2.9 mi <br /> International Conference Centre - 4.9 km / 3 mi <br /> Area 1 Shopping Centre - 6.6 km / 4.1 mi <br /> Millennium Park - 6.8 km / 4.2 mi <br /> Federal Secretariat - 7.4 km / 4.6 mi <br /> Abuja Stadium - 8.1 km / 5 mi <br /> Jabi Lake Mall - 8.5 km / 5.3 mi <br /> Nigerian National Mosque - 8.7 km / 5.4 mi <br /> National Assembly - 8.7 km / 5.4 mi <br /> Central Bank of Nigeria - 9.8 km / 6.1 mi <br /> American International School Abuja - 11.9 km / 7.4 mi <br /> Ecowas Secretariat - 14.4 km / 8.9 mi <br /> World Bank - 14.9 km / 9.2 mi <br /> </p><p>The preferred airport for Jades Hotel is Abuja (ABV-Nnamdi Azikiwe Intl.) - 40.1 km / 24.9 mi </p>,"<p>HeadLine : Near Embassy of the European Union</p><p>Location : Located in Abuja, Jades Hotel is within a 15-minute drive of Jabi Lake Mall and Nigerian National Mosque.  This 4-star hotel is 3.2 mi (5.1 km) from International Conference Centre and 3.2 mi (5.2 km) from Embassy of the European Union.</p><p>Rooms : Make yourself at home in one of the 60 air-conditioned rooms featuring plasma televisions. Complimentary wireless Internet access keeps you connected, and satellite programming is available for your entertainment. Conveniences include phones, as well as desks and complimentary newspapers.</p><p>Dining : For lunch or dinner, stop by Jade, a restaurant that specializes in international cuisine. Dining is also available at the coffee shop/cafe, and 24-hour room service is provided. Need to unwind? Take a break with a tasty beverage at one of the 2 bars/lounges. A complimentary buffet breakfast is served daily from 6 AM to 10 AM.</p><p>CheckIn Instructions : <ul>  <li>Extra-person charges may apply and vary depending on property policy</li><li>Government-issued photo identification and a credit card, debit card, or cash deposit may be required at check-in for incidental charges</li><li>Special requests are subject to availability upon check-in and may incur additional charges; special requests cannot be guaranteed</li><li>Be prepared: check the latest COVID-19 travel requirements and measures in place for this destination before you travel.</li>  </ul></p><p>Special Instructions : To make arrangements for check-in please contact the property at least 24 hours before arrival using the information on the booking confirmation. Guests must contact the property in advance for check-in instructions. Front desk staff will greet guests on arrival.</p>",44-44-8435643960,Luggage storage Free Buffet Breakfast 24-hour business center Concierge services Designated smoking areas Ballroom Banquet hall Wheelchair accessible path of travel Accessible bathroom Roll-in shower Wheelchair accessible parking In-room accessibility Airport transportation (surcharge) Daily Number of outdoor pools - 1 Newspapers in lobby (surcharge) elevator Fitness facilities Number of bars/lounges - 2 Full-service spa 24-hour front desk Free breakfast Spa treatment room(s) Meeting rooms Tours/ticket assistance Free self parking Dry cleaning/laundry service Free WiFi Number of coffee shops/cafes - 1 Safe-deposit box at front desk Spa services on site Area shuttle (surcharge) Number of meeting rooms - 1 Braille or raised signage,9.060587|7.454576,234-234-9094970080,234,
NG,Nigeria,100225,Abuja,1429139,Chelsea Hotel Wuse II,FourStar,Plot 374E Adetokunbo Ademola Crescent Wuse Ii Wuse IIAbuja 130223 ,Distances are displayed to the nearest 0.1 mile and kilometer. <br /> <p>International Conference Centre - 0.6 km / 0.4 mi <br /> Federal Secretariat - 2.1 km / 1.3 mi <br /> Nigerian National Mosque - 2.2 km / 1.4 mi <br /> Central Bank of Nigeria - 3.3 km / 2 mi <br /> Millennium Park - 3.3 km / 2.1 mi <br /> National Assembly - 3.5 km / 2.2 mi <br /> Abuja International Conference Centre - 4.3 km / 2.7 mi <br /> Embassy of the European Union - 5.9 km / 3.7 mi <br /> Embassy of Italy - 6 km / 3.7 mi <br /> Embassy of the Netherlands - 6 km / 3.7 mi <br /> Embassy of Slovakia - 6 km / 3.7 mi <br /> National Hospital Abuja - 6.8 km / 4.2 mi <br /> World Bank - 6.9 km / 4.3 mi <br /> Ecowas Secretariat - 7.1 km / 4.4 mi <br /> Area 1 Shopping Centre - 7.2 km / 4.5 mi <br /> </p><p>The preferred airport for Hotel Chelsea Wuse 2 is Abuja (ABV-Nnamdi Azikiwe Intl.) - 41.8 km / 26 mi </p>,"<p>HeadLine : In Abuja (Wuse 2)</p><p>Location : With a stay at Hotel Chelsea Wuse 2 in Abuja (Wuse 2), you ll be within a 5-minute drive of International Conference Centre and Nigerian National Mosque.  This 4-star hotel is 1.4 mi (2.3 km) from Federal Secretariat and 1.6 mi (2.5 km) from Millennium Park.</p><p>Rooms : Make yourself at home in one of the 40 guestrooms featuring minibars (stocked with some free items) and flat-screen televisions. Complimentary wired and wireless Internet access keeps you connected, and cable programming provides entertainment. Private bathrooms with shower/tub combinations feature spring water baths and complimentary toiletries. Conveniences include safes and desks, and housekeeping is provided daily.</p><p>Dining : For lunch or dinner, stop by Mediterraneo, a restaurant that specializes in Mediterranean cuisine. Dining is also available at the coffee shop/cafe, and 24-hour room service is provided. Wrap up your day with a drink at the bar/lounge. A complimentary buffet breakfast is served daily from 7 AM to 11 AM.</p><p>CheckIn Instructions : <ul>  <li>Extra-person charges may apply and vary depending on property policy</li><li>Government-issued photo identification and a credit card, debit card, or cash deposit may be required at check-in for incidental charges</li><li>Special requests are subject to availability upon check-in and may incur additional charges; special requests cannot be guaranteed</li><li>This property accepts credit cards; cash is not accepted</li>  </ul></p><p>Special Instructions : This property doesn t offer after-hours check-in. Front desk staff will greet guests on arrival.</p>",234-9-7822080,Dry cleaning/laundry service Wheelchair accessible (may have limitations) Free wired Internet Free WiFi Number of bars/lounges - 1 Designated smoking areas Braille or raised signage In-room accessibility (in select rooms) Free newspapers in lobby Roll-in shower (in select rooms) Tours/ticket assistance Accessible bathroom (in select rooms) Area shuttle (surcharge) Free Buffet Breakfast Airport transportation (surcharge) Luggage storage Free breakfast Golf lessons available nearby Multilingual staff Business center 24-hour front desk Daily Safe-deposit box at front desk Number of coffee shops/cafes - 1 Laundry facilities elevator Free self parking Fitness facilities Free valet parking Concierge services,9.073026|7.490282,234-9-7822080,130223,http://www.chelseahotelabuja.com/?hotel=K3zTe-LVFX
NG,Nigeria,100225,Abuja,1429159,Casa Rerri Boutique Hotel,FourStar,7 Mousa Traore Street Near ECOWAS Near ECOWASAsokoroAbuja 900231 ,Distances are displayed to the nearest 0.1 mile and kilometer. <br /> <p>Ecowas Secretariat - 0.5 km / 0.3 mi <br /> World Bank - 0.7 km / 0.4 mi <br /> Aso Villa - 2.4 km / 1.5 mi <br /> Federal Secretariat - 4.9 km / 3.1 mi <br /> National Assembly - 5.8 km / 3.6 mi <br /> Central Bank of Nigeria - 6.1 km / 3.8 mi <br /> Nigerian National Mosque - 6.3 km / 3.9 mi <br /> Aso Rock - 6.8 km / 4.2 mi <br /> International Conference Centre - 7.4 km / 4.6 mi <br /> Millennium Park - 8.6 km / 5.4 mi <br /> National Hospital Abuja - 9.3 km / 5.8 mi <br /> Embassy of the European Union - 9.9 km / 6.1 mi <br /> Area 1 Shopping Centre - 10.2 km / 6.4 mi <br /> Abuja Stadium - 11 km / 6.8 mi <br /> Magicland Amusement Park - 11.4 km / 7.1 mi <br /> </p><p>The preferred airport for Casa Rerri Boutique Hotel Asokoro is Abuja (ABV-Nnamdi Azikiwe Intl.) - 45 km / 27.9 mi </p>,"<p>HeadLine : Near Ecowas Secretariat</p><p>Location : A stay at Casa Rerri Boutique Hotel Asokoro places you in the heart of Abuja, within a 10-minute walk of Ecowas Secretariat and World Bank.  This 4-star hotel is 3.3 mi (5.2 km) from Aso Villa and 3.3 mi (5.3 km) from Federal Secretariat.</p><p>Rooms : Make yourself at home in one of the 42 guestrooms featuring minibars and flat-screen televisions. Complimentary wireless Internet access keeps you connected, and cable programming is available for your entertainment. Bathrooms have showers and hair dryers. Conveniences include laptop-compatible safes and desks, and housekeeping is provided daily.</p><p>Dining : Enjoy a meal at the restaurant, or stay in and take advantage of the hotel s room service (during limited hours). Quench your thirst with your favorite drink at the bar/lounge. A complimentary continental breakfast is served daily from 6 AM to 10:30 AM.</p><p>CheckIn Instructions : <ul>  <li>Extra-person charges may apply and vary depending on property policy</li><li>Government-issued photo identification and a credit card, debit card, or cash deposit may be required at check-in for incidental charges</li><li>Special requests are subject to availability upon check-in and may incur additional charges; special requests cannot be guaranteed</li><li>Safety features at this property include a fire extinguisher and a smoke detector</li><li>Be prepared: check the latest COVID-19 travel requirements and measures in place for this destination before you travel.</li>  </ul></p><p>Special Instructions : This property offers transfers from the airport (surcharges may apply). Guests must contact the property with arrival details before travel, using the contact information on the booking confirmation. Front desk staff will greet guests on arrival.</p>",234-80-92172168,Safe-deposit box at front desk Daily Terrace Luggage storage Free continental breakfast Number of bars/lounges - 1 Concierge services 24-hour front desk Free breakfast Tours/ticket assistance Wheelchair accessible path of travel Accessible bathroom Free self parking Dry cleaning/laundry service Free WiFi Wheelchair accessible parking In-room accessibility Airport transportation (surcharge) Assistive listening devices available Braille or raised signage Garden,9.0411|7.528435,234-80-60373768,900231,http://www.casarerrihotel.com
NG,Nigeria,100225,Abuja,1441755,Calidonian Suites,FourStar,Usuama Street Off Gana Street Maitama Abuja 21 2 off Gana StreetMaitamaAbuja ,,"Caledonian Suites is set in Abuja, within 1.8 km of Cameroon Embassy and 4.3 km of Big Church. Among the facilities of this property are a restaurant, a 24-hour front desk and room service, along with free WiFi throughout the property. An outdoor swimming pool, an on-site bar and shared lounge are available.

The units come with air conditioning, a flat-screen TV with satellite channels, a fridge, a kettle, a shower, slippers and a desk. All guest rooms feature a private bathroom, a hairdryer and bed linen.

The hotel offers a continental or buffet breakfast.

Caledonian Suites offers a childrens playground.

The nearest airport is Nnamdi Azikiwe International, 27 km from the accommodation, and the property offers a paid airport shuttle service.",234-81-13333340,meeting/banquet facilities Bar 24-hour front desk Golf course (within 3 km) Newspapers Non-smoking rooms Airport shuttle Business centre Laundry dry cleaning Family rooms VIP room facilities breakfast in the room Parking Restaurant Room service Ironing service Bridal suite Free parking internet services express check-in/check-out Currency exchange Massage children's playground Soundproof rooms Car hire Tour desk Fax/photocopying wifi Outdoor pool Free WiFi Air conditioning ATM/cash machine on site Private check-in/check-out airport shuttle (additional charge) Lockers shared lounge/TV area Daily housekeeping parking on site wifi available in all areas Swimming pool use of cleaning chemicals that are effective against coronavirus linens  towels and laundry washed in accordance with local authority guidelines guest accommodation is disinfected between stays guest accommodation sealed after cleaning physical distancing in dining areas food can be delivered to guest accommodation staff follow all safety protocols as directed by local authorities hand sanitizer in guest accommodation and key areas process in place to check health of guests cashless payment available physical distancing rules followed property is cleaned by professional cleaning companies all plates  cutlery  glasses and other tableware have been sanitized breakfast takeaway containers delivered food is securely covered thermometers for guests provided by property face masks for guests available,9.07712|7.50076,2348060373768,900271,https://www.booking.com/hotel/ng/caledonian-suites.html
NG,Nigeria,100225,Abuja,1447857,Bolton White Hotels and Apartments,FourStar,7 Gwandu Street Beside Sahad Stores Area11Garki 2Abuja 900242 ,Distances are displayed to the nearest 0.1 mile and kilometer. <br /> <p>Area 1 Shopping Centre - 0.8 km / 0.5 mi <br /> Abuja International Conference Centre - 2.5 km / 1.6 mi <br /> American International School Abuja - 3.2 km / 2 mi <br /> Central Bank of Nigeria - 3.7 km / 2.3 mi <br /> National Hospital Abuja - 4.3 km / 2.7 mi <br /> Nigerian National Mosque - 4.6 km / 2.9 mi <br /> Embassy of the European Union - 3.9 km / 2.4 mi <br /> Embassy of Italy - 4 km / 2.5 mi <br /> Embassy of the Netherlands - 4 km / 2.5 mi <br /> Embassy of Slovakia - 4.1 km / 2.5 mi <br /> Abuja Stadium - 4.1 km / 2.6 mi <br /> Magicland Amusement Park - 5.5 km / 3.4 mi <br /> Federal Secretariat - 5.8 km / 3.6 mi <br /> Millennium Park - 6.3 km / 3.9 mi <br /> National Assembly - 6.7 km / 4.2 mi <br /> </p><p>The preferred airport for Bolton White Hotels and Apartments is Abuja (ABV-Nnamdi Azikiwe Intl.) - 38.4 km / 23.9 mi </p>,"<p>HeadLine : Near Area 1 Shopping Centre</p><p>Location : Located in Abuja, Bolton White Hotels and Apartments is within a 5-minute drive of Area 1 Shopping Centre and Abuja International Conference Centre.  This 4-star hotel is 2 mi (3.2 km) from American International School Abuja and 2.3 mi (3.6 km) from Central Bank of Nigeria.</p><p>Rooms : Make yourself at home in one of the 176 air-conditioned rooms featuring refrigerators and minibars (stocked with some free items). Your pillowtop bed comes with Egyptian cotton sheets. Complimentary wireless Internet access keeps you connected, and satellite programming is available for your entertainment. Private bathrooms with separate bathtubs and showers feature designer toiletries and bidets.</p><p>Dining : Enjoy international cuisine at 2, one of the hotel s 3 restaurants, or stay in and take advantage of the 24-hour room service. Snacks are also available at the coffee shop/cafe. Mingle with other guests at the complimentary reception, held daily. Relax with a refreshing drink from the poolside bar or one of the 4 bars/lounges. A complimentary buffet breakfast is served daily.</p><p>CheckIn Instructions : <ul>  <li>Extra-person charges may apply and vary depending on property policy</li><li>Government-issued photo identification and a credit card, debit card, or cash deposit may be required at check-in for incidental charges</li><li>Special requests are subject to availability upon check-in and may incur additional charges; special requests cannot be guaranteed</li><li>Guests must contact this property in advance to reserve onsite parking</li><li>This property accepts credit cards; cash is not accepted</li>  </ul></p><p>Special Instructions : This property offers transfers from the airport (surcharges may apply). To arrange pick-up, guests must contact the property 24 hours prior to arrival, using the contact information on the booking confirmation. Front desk staff will greet guests on arrival.</p>",234-9-4626960,Conference center Daily Barbecue grill(s) Coffee/tea in common areas Number of coffee shops/cafes - 1 Laundry facilities elevator Supervised childcare/activities (free) Express check-in Television in common areas 24-hour pool access Arcade/game room Picnic area Free use of nearby fitness center Free newspapers in lobby Full-service spa Wedding services 24-hour fitness facilities Area shuttle (surcharge) Beach shuttle (surcharge) Gift shops or newsstand Dry cleaning/laundry service Babysitting or childcare (free) Pool umbrellas Free reception Number of meeting rooms - 1 Limo or Town Car service available Free WiFi Number of bars/lounges - 4 Number of spa tubs - 1 Number of poolside bars - 1 Number of swim-up bars - 1 In-room accessibility (in select rooms) Tours/ticket assistance Accessible bathroom (in select rooms) Fireplace in lobby Shopping center shuttle (surcharge) Free Buffet Breakfast Rooftop terrace Airport transportation (surcharge) Free breakfast Multilingual staff Luggage storage Express check-out Grocery/convenience store Porter/bellhop Billiards or pool table 24-hour front desk Spa services on site Outdoor seasonal pool Safe-deposit box at front desk Smoke-free property Snack bar/deli Children's pool Sauna Steam room Conference space Free pool cabanas Hair salon Computer station ATM/banking Access to nearby outdoor pool Pool sun loungers Concierge services 24-hour business center,9.033565|7.477301,234-9-4626960,900001,http://www.boltonwhitehotel.com/
NG,Nigeria,100225,Abuja,1447858,Denis Hotel Abuja,ThreeStar,910 Njamena Street Wuse 2 Abuja ,Distances are displayed to the nearest 0.1 mile and kilometer. <br /> <p>International Conference Centre - 3.8 km / 2.4 mi <br /> Nigerian National Mosque - 4.5 km / 2.8 mi <br /> Federal Secretariat - 5.3 km / 3.3 mi <br /> Millennium Park - 5.4 km / 3.3 mi <br /> Central Bank of Nigeria - 5.6 km / 3.5 mi <br /> Jabi Lake Mall - 5.6 km / 3.5 mi <br /> National Assembly - 6.6 km / 4.1 mi <br /> Abuja International Conference Centre - 6.8 km / 4.2 mi <br /> Embassy of the European Union - 7.3 km / 4.5 mi <br /> Embassy of Italy - 7.4 km / 4.6 mi <br /> Embassy of the Netherlands - 7.4 km / 4.6 mi <br /> Embassy of Slovakia - 7.5 km / 4.6 mi <br /> National Hospital Abuja - 8.2 km / 5.1 mi <br /> Abuja Stadium - 8.3 km / 5.2 mi <br /> Area 1 Shopping Centre - 9.1 km / 5.6 mi <br /> </p><p>The preferred airport for Denis Hotel is Abuja (ABV-Nnamdi Azikiwe Intl.) - 41.7 km / 25.9 mi </p>,"<p>HeadLine : In Abuja (Wuse 2)</p><p>Location : Located in Abuja (Wuse 2), Denis Hotel is within a 5-minute drive of International Conference Centre and Nigerian National Mosque.  This hotel is 3.3 mi (5.3 km) from Federal Secretariat and 3.3 mi (5.4 km) from Millennium Park.</p><p>Rooms : Make yourself at home in one of the 80 air-conditioned rooms featuring refrigerators and LCD televisions. Complimentary wireless Internet access keeps you connected, and cable programming is available for your entertainment. Bathrooms have shower/tub combinations and hair dryers. Conveniences include safes and desks, and housekeeping is provided daily.</p><p>Dining : Satisfy your appetite for lunch or dinner at Eliza, a restaurant which specializes in African cuisine, or stay in and take advantage of the room service. Quench your thirst with your favorite drink at the bar/lounge.</p><p>CheckIn Instructions : <ul>  <li>Extra-person charges may apply and vary depending on property policy</li><li>Government-issued photo identification and a credit card, debit card, or cash deposit may be required at check-in for incidental charges</li><li>Special requests are subject to availability upon check-in and may incur additional charges; special requests cannot be guaranteed</li><li>This property accepts credit cards and cash</li><li>Safety features at this property include a fire extinguisher and a smoke detector</li>  </ul></p><p>Special Instructions : This property offers transfers from the airport (surcharges may apply). To arrange pick-up, guests must contact the property 72 hours prior to arrival, using the contact information on the booking confirmation. This property doesn t offer after-hours check-in. Front desk staff will greet guests on arrival.</p>",234-9-4616900,Laundry facilities elevator Free self parking Free valet parking Terrace Concierge services Wheelchair-accessible on-site restaurant Multilingual staff Business center 24-hour front desk Wheelchair-accessible meeting spaces/business center Smoke-free property Snack bar/deli Dry cleaning/laundry service Wheelchair accessible (may have limitations) Wheelchair-accessible concierge desk Airport transportation Meeting rooms Wheelchair-accessible registration desk Wheelchair-accessible fitness center Free WiFi Wheelchair-accessible pool Number of bars/lounges - 1 Number of outdoor pools - 1 Wheelchair accessible parking Free newspapers in lobby Tours/ticket assistance Shopping center shuttle (surcharge) Airport transportation (surcharge) Luggage storage,9.078663|7.461216,234-9-461 6900,900001,
