countyCode,countyName,cityCode,cityName,HotelCode,HotelName,HotelRating,Address,Attractions,Description,FaxNumber,HotelFacilities,Map,PhoneNumber,PinCode,HotelWebsiteUrl
MP,Northern Mariana Isl,102476,Garapan,1224598,Hyatt Regency Saipan,FourStar,Capital Hill Rural Branch PO Box 5087 Royal Palm AvenueGarapanSaipan 96950 ,Distances are displayed to the nearest 0.1 mile and kilometer. <br /> <p>American Memorial Park - 0.2 km / 0.1 mi <br /> Paseo de Marianas - 0.4 km / 0.2 mi <br /> Saipan American Memorial - 0.5 km / 0.3 mi <br /> Ni  Lala Spa - 0.5 km / 0.3 mi <br /> Smiling Cove Marina - 0.6 km / 0.4 mi <br /> Micro Beach - 0.6 km / 0.4 mi <br /> LagoonSpa - 1.1 km / 0.7 mi <br /> Garapan Street Market - 1.7 km / 1.1 mi <br /> Managaha Island - 2.8 km / 1.7 mi <br /> Managaha Beach - 2.8 km / 1.7 mi <br /> Saipan Zoo - 4.2 km / 2.6 mi <br /> Tanapag Beach - 5.9 km / 3.7 mi <br /> F.M. Palacios Field - 6.3 km / 3.9 mi <br /> Mount Tapochao - 6.4 km / 4 mi <br /> Unai Chalan Kiya - 6.6 km / 4.1 mi <br /> </p><p>The preferred airport for Hyatt Regency Saipan is Saipan (SPN-Saipan Intl.) - 12.7 km / 7.9 mi </p>,"<p>HeadLine : Near Paseo de Marianas</p><p>Location : A stay at Hyatt Regency Saipan places you in the heart of Saipan, steps from American Memorial Park and 4 minutes by foot from Paseo de Marianas.  This 4.5-star resort is 0.2 mi (0.4 km) from Saipan American Memorial and 0.3 mi (0.5 km) from Ni  Lala Spa.</p><p>Rooms : Make yourself at home in one of the 319 guestrooms featuring refrigerators and flat-screen televisions. Rooms have private balconies. Complimentary wired and wireless Internet access keeps you connected, and cable programming provides entertainment. Private bathrooms with shower/tub combinations feature hair dryers and slippers.</p><p>Dining : Enjoy Italian cuisine at Giovanni s, one of the resort s 4 restaurants, or stay in and take advantage of the room service (during limited hours). Snacks are also available at the coffee shop/cafe. Wrap up your day with a drink at the bar/lounge, the beach bar, or the poolside bar. Buffet breakfasts are available daily from 6:30 AM to 10:00 AM for a fee.</p><p>Renovations : The following facilities or services will be unavailable from August 4 2022 to December 31 2023 (dates subject to change): <ul><li>Bar/Lounge(s)</li></ul></p><p>CheckIn Instructions : <ul>  <li>Extra-person charges may apply and vary depending on property policy</li><li>Government-issued photo identification and a credit card, debit card, or cash deposit may be required at check-in for incidental charges</li><li>Special requests are subject to availability upon check-in and may incur additional charges; special requests cannot be guaranteed</li><li>The name on the credit card used at check-in to pay for incidentals must be the primary name on the guestroom reservation</li><li>This property accepts credit cards, debit cards, and cash</li><li>Please note that cultural norms and guest policies may differ by country and by property; the policies listed are provided by the property</li>  </ul></p><p>Special Instructions : This property offers transfers from the airport (surcharges may apply). Guests must contact the property with arrival details before travel, using the contact information on the booking confirmation. Front desk staff will greet guests on arrival.</p>",1-670-234-7745,Concierge services Conference space size (feet) - 4876 Pool sun loungers Access to nearby outdoor pool Computer station Motor boating on site Tennis on site Hair salon Kayaking on site Conference space Free self parking Steam room Sauna Hiking/biking trails nearby Snack bar/deli Rowing or canoeing on site Smoke-free property Safe-deposit box at front desk Golfing nearby Playground on site 24-hour front desk Business center Porter/bellhop Luggage storage Couples/private dining Private picnics Windsurfing on site Supervised childcare/activities (surcharge) Boat tours nearby Beach towels Wedding services Full-service spa Garden Spa treatment room(s) Skydiving Nearby Wheelchair-accessible registration desk Wheelchair-accessible path to elevator Beach umbrellas Wheelchair accessible Wheelchair accessible (may have limitations) Children's club (surcharge) Snorkeling on site Fitness facilities elevator Laundry facilities Number of coffee shops/cafes - 1 Ecotours nearby Breakfast available (surcharge) Parasailing nearby Multilingual staff Outdoor tennis courts - 2 Airport transportation (surcharge) Accessible bathroom (in select rooms) Tours/ticket assistance In-room accessibility (in select rooms) Number of beach bars - 1 Number of outdoor pools - 2 Number of poolside bars - 1 Number of bars/lounges - 1 Free WiFi Scuba diving nearby Sailing nearby Swimming pool Conference space size (meters) - 453 Number of meeting rooms - 1 Outdoor entertainment area Pool umbrellas Outdoor furniture Babysitting or childcare (surcharge) Free parking nearby Proposal/romance packages available Beach volleyball on site Dry cleaning/laundry service Gift shops or newsstand,15.216104|145.71782,1-670-2341234,96950,http://saipan.regency.hyatt.jp/hyatt/hotels/index.jsp
MP,Northern Mariana Isl,102476,Garapan,1227557,Fiesta Resort & Spa Saipan,FourStar,Coral Tree Avenue Garapan Saipan 96950 ,Distances are displayed to the nearest 0.1 mile and kilometer. <br /> <p>Paseo de Marianas - 0.2 km / 0.1 mi <br /> Ni  Lala Spa - 0.2 km / 0.1 mi <br /> Micro Beach - 0.3 km / 0.2 mi <br /> American Memorial Park - 0.3 km / 0.2 mi <br /> Saipan American Memorial - 0.7 km / 0.4 mi <br /> Smiling Cove Marina - 0.7 km / 0.5 mi <br /> LagoonSpa - 0.8 km / 0.5 mi <br /> Garapan Street Market - 1.4 km / 0.9 mi <br /> Managaha Island - 3 km / 1.9 mi <br /> Managaha Beach - 3 km / 1.9 mi <br /> Saipan Zoo - 4.5 km / 2.8 mi <br /> F.M. Palacios Field - 6 km / 3.7 mi <br /> Tanapag Beach - 6.3 km / 3.9 mi <br /> Unai Chalan Kiya - 6.3 km / 3.9 mi <br /> Saipan Country Club - 6.7 km / 4.2 mi <br /> </p><p>The preferred airport for Crowne Plaza Resort Saipan  an IHG Hotel is Saipan (SPN-Saipan Intl.) - 12.1 km / 7.5 mi </p>,"<p>HeadLine : Near Paseo de Marianas</p><p>Location : When you a stay at Crowne Plaza Resort Saipan, an IHG Hotel in Saipan, you ll be on the beach, just steps from Paseo de Marianas and Ni  Lala Spa.  This 4.5-star hotel is 0.2 mi (0.3 km) from Micro Beach and 0.3 mi (0.5 km) from American Memorial Park.</p><p>Rooms : Make yourself at home in one of the 422 air-conditioned rooms featuring refrigerators and minibars. Rooms have private balconies. Complimentary wireless Internet access keeps you connected, and cable programming is available for your entertainment. Private bathrooms have designer toiletries and bidets.</p><p>Dining : Enjoy international cuisine at The Terrace, one of the hotel s 2 restaurants, or stay in and take advantage of the room service (during limited hours). Snacks are also available at the coffee shop/cafe. Unwind at the end of the day with a drink at the bar/lounge or the beach bar. Buffet breakfasts are available daily from 6:30 AM to 10 AM for a fee.</p><p>CheckIn Instructions : <ul>  <li>Extra-person charges may apply and vary depending on property policy</li><li>Government-issued photo identification and a credit card, debit card, or cash deposit may be required at check-in for incidental charges</li><li>Special requests are subject to availability upon check-in and may incur additional charges; special requests cannot be guaranteed</li><li>This property accepts credit cards and cash</li><li>Safety features at this property include a fire extinguisher, a smoke detector, a security system, and a first aid kit</li><li>Please note that cultural norms and guest policies may differ by country and by property; the policies listed are provided by the property</li>  </ul></p><p>Special Instructions : This property offers transfers from the airport (surcharges may apply). Guests must contact the property with arrival details before travel, using the contact information on the booking confirmation. Front desk staff will greet guests on arrival.  Guests booked in breakfast included rate plans receive breakfast for up to 2 adults who are sharing a guestroom. Breakfast fees apply for additional guests. Guests booked in dinner included rate plans receive dinner for up to 2 adults who are sharing a guestroom. Dinner fees apply for additional guests.</p>",1-670-2347064,Gift shops or newsstand Dry cleaning/laundry service Beach volleyball on site Shopping on site Proposal/romance packages available Parking (limited spaces) Pool umbrellas Number of meeting rooms - 2 Conference space size (meters) - 500 Sailing nearby Free WiFi Number of bars/lounges - 1 Designated smoking areas Number of outdoor pools - 2 Number of beach bars - 1 In-room accessibility (in select rooms) Bicycle rentals nearby Wheelchair accessible parking Roll-in shower (in select rooms) Tours/ticket assistance Accessible bathroom (in select rooms) Fitness classes on site Airport transportation (surcharge) Wheelchair-accessible lounge Wheelchair-accessible on-site restaurant Outdoor tennis courts - 2 Multilingual staff Parasailing nearby Breakfast available (surcharge) Mountain climbing nearby Evening entertainment Number of coffee shops/cafes - 1 Laundry facilities elevator Children's club (free) Fitness facilities Snorkeling on site Basketball on site Banquet hall Wheelchair accessible (may have limitations) Beach umbrellas Table tennis Wheelchair-accessible path to elevator Karaoke Wheelchair-accessible registration desk Windsurfing nearby Wheelchair-accessible fitness center Wheelchair-accessible pool Wheelchair-accessible public washroom Arcade/game room Garden Picnic area Beach towels Boat tours nearby Cave exploring/spelunking nearby Couples/private dining Designer stores on site Luggage storage Grocery/convenience store Porter/bellhop Billiards or pool table Business center Personal motorized watercraft on site 24-hour front desk Playground on site Safe-deposit box at front desk Snack bar/deli Hiking/biking trails nearby Children's pool Free self parking Free beach cabanas Conference space Free pool cabanas Tennis on site Beach sun loungers Terrace ATM/banking Wheelchair accessible path of travel Pool sun loungers Conference space size (feet) - 5382 Concierge services,15.214347|145.71716,1-670-2346412,96950,http://www.fiestasaipan.com
MP,Northern Mariana Isl,102476,Garapan,1425603,Paradise Hotel Saipan,ThreeStar,11 Middle Road Garapan 96950 ,Distances are displayed to the nearest 0.1 mile and kilometer. <br /> <p>Micro Beach - 0.9 km / 0.6 mi <br /> Paseo de Marianas - 0.9 km / 0.6 mi <br /> American Memorial Park - 1 km / 0.6 mi <br /> Managaha Island - 2.1 km / 1.3 mi <br /> Managaha Beach - 2.1 km / 1.3 mi <br /> Saipan Zoo - 3.1 km / 1.9 mi <br /> Mount Tapochao - 5.8 km / 3.6 mi <br /> F.M. Palacios Field - 5.9 km / 3.7 mi <br /> Saipan Country Club - 6.1 km / 3.8 mi <br /> Marianas Country Club - 10.1 km / 6.3 mi <br /> Lau Lau Bay Beach - 11.1 km / 6.9 mi <br /> Saipan Botanical Garden - 11.2 km / 6.9 mi <br /> Lao Lao Bay Golf Resort - 13.3 km / 8.3 mi <br /> Banzai Cliff - 13.6 km / 8.5 mi <br /> Puntan Sabaneta - 13.6 km / 8.5 mi <br /> </p><p>The nearest major airport is Saipan (SPN-Saipan Intl.) - 11.6 km / 7.2 mi</p>,"<p>HeadLine : Near Paseo de Marianas</p><p>Location : With a stay at Paradise Hotel Saipan in Saipan, you ll be within a 5-minute drive of Managaha Island and Micro Beach.  This hotel is 0.6 mi (0.9 km) from Paseo de Marianas and 0.8 mi (1.2 km) from American Memorial Park.</p><p>Rooms : Make yourself at home in one of the 29 individually decorated guestrooms, featuring refrigerators and flat-screen televisions. Your pillowtop bed comes with premium bedding. Rooms have private balconies. Complimentary wireless Internet access keeps you connected, and satellite programming is available for your entertainment. Private bathrooms with shower/tub combinations feature rainfall showerheads and designer toiletries.</p><p>CheckIn Instructions : Extra-person charges may apply and vary depending on property policy. <br />Government-issued photo identification and a credit card, debit card, or cash deposit are required at check-in for incidental charges. <br />Special requests are subject to availability upon check-in and may incur additional charges. Special requests cannot be guaranteed. <ul>  </ul></p>",1-670-2335254,Smoke-free property Luggage storage Free self parking Free WiFi 24-hour front desk,15.210554|145.722687,1-670-2335266,96950,
MP,Northern Mariana Isl,102476,Garapan,1427357,Hotel Galleria,ThreeStar,Alaihai Ave. Garapan 96950 GarapanSaipan ,Distances are displayed to the nearest 0.1 mile and kilometer. <br /> <p>LagoonSpa - 0.4 km / 0.2 mi <br /> Micro Beach - 0.6 km / 0.4 mi <br /> Paseo de Marianas - 0.6 km / 0.4 mi <br /> Ni  Lala Spa - 0.7 km / 0.4 mi <br /> American Memorial Park - 0.8 km / 0.5 mi <br /> Garapan Street Market - 0.8 km / 0.5 mi <br /> Smiling Cove Marina - 1 km / 0.6 mi <br /> Saipan American Memorial - 1.2 km / 0.7 mi <br /> Managaha Island - 3 km / 1.9 mi <br /> Managaha Beach - 3 km / 1.9 mi <br /> Saipan Zoo - 3.9 km / 2.4 mi <br /> F.M. Palacios Field - 5.4 km / 3.3 mi <br /> Unai Chalan Kiya - 5.7 km / 3.5 mi <br /> Saipan Country Club - 6.1 km / 3.8 mi <br /> Tanapag Beach - 6.1 km / 3.8 mi <br /> </p><p>The preferred airport for Hotel Galleria is Saipan (SPN-Saipan Intl.) - 12.4 km / 7.7 mi </p>,"<p>HeadLine : Near LagoonSpa</p><p>Location : With a stay at Hotel Galleria, you ll be centrally located in Saipan, just a 5-minute walk from LagoonSpa and 7 minutes by foot from Micro Beach.  This hotel is 0.4 mi (0.6 km) from Paseo de Marianas and 0.5 mi (0.8 km) from American Memorial Park.</p><p>Rooms : Make yourself at home in one of the 30 individually furnished guestrooms, featuring refrigerators and plasma televisions. Complimentary wireless Internet access keeps you connected, and cable programming is available for your entertainment. Private bathrooms with showers feature rainfall showerheads and designer toiletries. Conveniences include safes and desks, and housekeeping is provided daily.</p><p>Dining : At Hotel Galleria, enjoy a satisfying meal at the restaurant.</p><p>CheckIn Instructions : <ul>  <li>Extra-person charges may apply and vary depending on property policy</li><li>Government-issued photo identification and a credit card, debit card, or cash deposit may be required at check-in for incidental charges</li><li>Special requests are subject to availability upon check-in and may incur additional charges; special requests cannot be guaranteed</li><li>This property accepts credit cards</li>  </ul></p><p>Special Instructions : This property offers transfers from the airport (surcharges may apply). To arrange pick-up, guests must contact the property 72 hours prior to arrival, using the contact information on the booking confirmation. Front desk staff will greet guests on arrival.</p>",670-232-2123,Airport transportation (surcharge) Free RV  bus  truck parking Luggage storage Express check-out Express check-in Business center 24-hour front desk Scuba diving nearby Free WiFi Safe-deposit box at front desk Smoke-free property In-room accessibility (in select rooms) Wheelchair accessible parking Accessible bathroom (in select rooms) Free self parking Conference space Free shopping center shuttle Terrace Wheelchair accessible path of travel,15.209791|145.718461,1-670-2332122,96950,http://galleria.hotel1s.com/
MP,Northern Mariana Isl,102476,Garapan,1446642,Capital Hotel,TwoStar,Filooris Ave Garapan GarapanSaipan 96950 ,Distances are displayed to the nearest 0.1 mile and kilometer. <br /> <p>Paseo de Marianas - 0.6 km / 0.4 mi <br /> Micro Beach - 0.6 km / 0.4 mi <br /> LagoonSpa - 0.6 km / 0.4 mi <br /> Ni  Lala Spa - 0.7 km / 0.4 mi <br /> American Memorial Park - 0.7 km / 0.5 mi <br /> Smiling Cove Marina - 1 km / 0.6 mi <br /> Garapan Street Market - 1.2 km / 0.7 mi <br /> Saipan American Memorial - 1.2 km / 0.7 mi <br /> Managaha Island - 2.6 km / 1.6 mi <br /> Managaha Beach - 2.6 km / 1.6 mi <br /> Saipan Zoo - 3.6 km / 2.2 mi <br /> F.M. Palacios Field - 5.7 km / 3.6 mi <br /> Tanapag Beach - 5.8 km / 3.6 mi <br /> Unai Chalan Kiya - 6.1 km / 3.8 mi <br /> Saipan Country Club - 6.2 km / 3.8 mi <br /> </p><p>The preferred airport for Capital Hotel is Saipan (SPN-Saipan Intl.) - 11.7 km / 7.3 mi </p>,"<p>HeadLine : Near LagoonSpa</p><p>Location : A stay at Capital Hotel places you in the heart of Saipan, within a 10-minute walk of Paseo de Marianas and Micro Beach.  This hotel is 0.4 mi (0.6 km) from LagoonSpa and 0.5 mi (0.7 km) from Ni  Lala Spa.</p><p>Rooms : Make yourself at home in one of the 26 individually decorated guestrooms, featuring refrigerators and flat-screen televisions. Your pillowtop bed comes with down comforters and premium bedding. Prepare your meals in the shared/communal kitchen. Complimentary wireless Internet access keeps you connected, and cable programming is available for your entertainment. Private bathrooms with showers feature rainfall showerheads and complimentary toiletries.</p><p>Dining : Take advantage of the hotel s room service. Cooked-to-order breakfasts are available daily from 7:30 AM to 8:30 AM for a fee.</p><p>CheckIn Instructions : <ul>  <li>Extra-person charges may apply and vary depending on property policy</li><li>Government-issued photo identification and a credit card, debit card, or cash deposit may be required at check-in for incidental charges</li><li>Special requests are subject to availability upon check-in and may incur additional charges; special requests cannot be guaranteed</li><li>Guests must contact this property in advance to reserve onsite parking</li><li>This property accepts credit cards</li>  </ul></p><p>Special Instructions : Front desk staff will greet guests on arrival.</p>",691-670-2336889,Wheelchair accessible  no Multilingual staff Business center Handrails in stairways Handrails in hallways 24-hour front desk Breakfast available (surcharge) Free WiFi Number of outdoor pools - 1 Well-lit path to entrance Golfing nearby Garden Safe-deposit box at front desk Smoke-free property Free use of nearby fitness center Laundry facilities Tours/ticket assistance Free self parking Beach towels Terrace Access to nearby outdoor pool Pool sun loungers Fence around pool,15.210676|145.720282,1 670-233-6888,96950,
MP,Northern Mariana Isl,102476,Garapan,1447512,Grandvrio Resort Saipan,ThreeStar,Garapan Saipan Garapan 96950Saipan ,Distances are displayed to the nearest 0.1 mile and kilometer. <br /> <p>LagoonSpa - 0.1 km / 0.1 mi <br /> Garapan Street Market - 0.7 km / 0.4 mi <br /> Micro Beach - 0.7 km / 0.4 mi <br /> Paseo de Marianas - 0.7 km / 0.4 mi <br /> Ni  Lala Spa - 0.7 km / 0.5 mi <br /> American Memorial Park - 0.8 km / 0.5 mi <br /> Smiling Cove Marina - 1.1 km / 0.7 mi <br /> Saipan American Memorial - 1.2 km / 0.8 mi <br /> Managaha Island - 3.1 km / 2 mi <br /> Managaha Beach - 3.1 km / 2 mi <br /> Saipan Zoo - 4.8 km / 3 mi <br /> F.M. Palacios Field - 5.2 km / 3.2 mi <br /> Unai Chalan Kiya - 5.5 km / 3.4 mi <br /> Saipan Country Club - 5.9 km / 3.7 mi <br /> Tanapag Beach - 6.3 km / 3.9 mi <br /> </p><p>The preferred airport for Grandvrio Resort Saipan is Saipan (SPN-Saipan Intl.) - 12.2 km / 7.6 mi </p>,"<p>HeadLine : Near LagoonSpa</p><p>Location : With a stay at Grandvrio Resort Saipan in Saipan, you ll be on the beach, just a 1-minute walk from LagoonSpa and 8 minutes by foot from Garapan Street Market.  This beach hotel is 0.4 mi (0.7 km) from Micro Beach and 0.5 mi (0.8 km) from Paseo de Marianas.</p><p>Rooms : Make yourself at home in one of the 425 air-conditioned rooms featuring refrigerators and flat-screen televisions. Rooms have private balconies. Complimentary wireless Internet access is available to keep you connected. Private bathrooms with bathtubs or showers feature complimentary toiletries and hair dryers.</p><p>Dining : Grab a bite to eat at Airi, one of the hotel s many dining establishments, which include 2 restaurants and a coffee shop/cafe. Relax with your favorite drink at the bar/lounge or the poolside bar. Full breakfasts are available daily from 7:00 AM to 10:00 AM for a fee.</p><p>CheckIn Instructions : <ul>  <li>Extra-person charges may apply and vary depending on property policy</li><li>Government-issued photo identification and a credit card, debit card, or cash deposit may be required at check-in for incidental charges</li><li>Special requests are subject to availability upon check-in and may incur additional charges; special requests cannot be guaranteed</li><li>This property accepts credit cards and cash</li>  </ul></p><p>Special Instructions : Front desk staff will greet guests on arrival.</p>",691-670-2372529,Pool sun loungers Dry cleaning/laundry service Parking (limited spaces) Meeting rooms Karaoke Scuba diving nearby Free WiFi Number of bars/lounges - 1 Number of poolside bars - 1 Number of outdoor pools - 3 Garden In-room accessibility (in select rooms) Full-service spa Tours/ticket assistance Accessible bathroom (in select rooms) Wheelchair accessible  no Luggage storage Grocery/convenience store Billiards or pool table 24-hour front desk Breakfast available (surcharge) Spa services on site Snack bar/deli Number of coffee shops/cafes - 1 Laundry facilities Children's pool elevator Fitness facilities Terrace,15.208973|145.71727,+16702346495,96950,http://www.hafadaisaipan.com
MP,Northern Mariana Isl,102476,Garapan,1472784,Beach Garden Hotel & Apartment,ThreeStar,Chichirica Ave. Garapan Saipan Mp Garapan 96950Saipan ,Distances are displayed to the nearest 0.1 mile and kilometer. <br /> <p>Garapan Street Market - 0.8 km / 0.5 mi <br /> LagoonSpa - 1.6 km / 1 mi <br /> Micro Beach - 2.2 km / 1.3 mi <br /> Paseo de Marianas - 2.2 km / 1.3 mi <br /> Ni  Lala Spa - 2.2 km / 1.4 mi <br /> American Memorial Park - 2.4 km / 1.5 mi <br /> Smiling Cove Marina - 2.6 km / 1.6 mi <br /> Saipan American Memorial - 2.7 km / 1.7 mi <br /> F.M. Palacios Field - 4 km / 2.5 mi <br /> Managaha Island - 4.2 km / 2.6 mi <br /> Managaha Beach - 4.2 km / 2.6 mi <br /> Unai Chalan Kiya - 4.6 km / 2.8 mi <br /> Saipan Country Club - 4.7 km / 2.9 mi <br /> Saipan Zoo - 4.8 km / 3 mi <br /> Pakpak Beach - 6 km / 3.7 mi <br /> </p><p>The preferred airport for Beach Garden Hotel is Saipan (SPN-Saipan Intl.) - 11 km / 6.8 mi </p>,"<p>HeadLine : Near Garapan Street Market</p><p>Location : Located in Saipan, Beach Garden Hotel is in the business district, a 2-minute drive from Micro Beach and 6 minutes from Saipan Country Club.  This beach hotel is 2.4 mi (3.8 km) from Managaha Island and 6.4 mi (10.3 km) from Lau Lau Bay Beach.</p><p>Rooms : Make yourself at home in one of the 45 individually decorated guestrooms, featuring kitchens. Your pillowtop bed comes with down comforters and Egyptian cotton sheets. 42-inch flat-screen televisions with cable programming provide entertainment, while complimentary wireless Internet access keeps you connected. Conveniences include blackout drapes/curtains, as well as phones with free local calls.</p><p>Dining : Take advantage of the hotel s room service (during limited hours). Relax with a refreshing drink from the poolside bar or one of the 3 swim-up bars. Cooked-to-order breakfasts are available daily from 7:30 AM to 8:30 AM for a fee.</p><p>CheckIn Instructions : <ul>  <li>Extra-person charges may apply and vary depending on property policy</li><li>Government-issued photo identification and a credit card, debit card, or cash deposit may be required at check-in for incidental charges</li><li>Special requests are subject to availability upon check-in and may incur additional charges; special requests cannot be guaranteed</li><li>Guests must contact this property in advance to reserve cribs/infant beds</li><li>This property accepts credit cards and cash</li><li>Noise-free guestrooms cannot be guaranteed</li><li>Safety features at this property include a fire extinguisher, a smoke detector, a security system, and window guards</li>  </ul></p><p>Special Instructions : Front desk staff will greet guests on arrival.</p>",691-670-2336889,Free self parking Fitness facilities Free pool cabanas Terrace Pool sun loungers Fence around pool Wheelchair accessible (may have limitations) Number of meeting rooms - 1 Free WiFi Designated smoking areas Number of poolside bars - 1 Well-lit path to entrance Number of indoor pools - 1 Number of swim-up bars - 3 Garden Picnic area In-room accessibility (in select rooms) Wheelchair accessible parking Beach towels Airport transportation (surcharge) Luggage storage Multilingual staff 24-hour front desk Breakfast available (surcharge) Safe-deposit box at front desk Designated smoking areas (fines apply) Laundry facilities,15.197039|145.718375,691-670-2336999,96950,
