countyCode,countyName,cityCode,cityName,HotelCode,HotelName,HotelRating,Address,Attractions,Description,FaxNumber,HotelFacilities,Map,PhoneNumber,PinCode,HotelWebsiteUrl
MP,Northern Mariana Isl,135845,Saipan,1091739,Hanamitsu Hotel & Spa,ThreeStar,Paseo de Marianas Garapan Garapan ,Distances are displayed to the nearest 0.1 mile and kilometer. <br /> <p>Paseo de Marianas - 0.1 km / 0.1 mi <br /> Ni  Lala Spa - 0.3 km / 0.2 mi <br /> American Memorial Park - 0.3 km / 0.2 mi <br /> Micro Beach - 0.4 km / 0.3 mi <br /> Smiling Cove Marina - 0.7 km / 0.4 mi <br /> LagoonSpa - 0.7 km / 0.5 mi <br /> Saipan American Memorial - 0.7 km / 0.5 mi <br /> Garapan Street Market - 1.3 km / 0.8 mi <br /> Managaha Island - 2.9 km / 1.8 mi <br /> Managaha Beach - 2.9 km / 1.8 mi <br /> Saipan Zoo - 3.7 km / 2.3 mi <br /> Tanapag Beach - 5.9 km / 3.7 mi <br /> F.M. Palacios Field - 6.1 km / 3.8 mi <br /> Mount Tapochao - 6.4 km / 4 mi <br /> Unai Chalan Kiya - 6.4 km / 4 mi <br /> </p><p>The preferred airport for Hanamitsu Hotel & Spa is Saipan (SPN-Saipan Intl.) - 12.7 km / 7.9 mi </p>,"<p>HeadLine : Near Paseo de Marianas</p><p>Location : When you a stay at Hanamitsu Hotel & Spa in Saipan, you ll be near the beach, within a 5-minute walk of Paseo de Marianas and Ni  Lala Spa.  This spa hotel is 0.1 mi (0.2 km) from American Memorial Park and 0.4 mi (0.6 km) from Saipan American Memorial.</p><p>Rooms : Treat yourself to a stay in one of the 20 individually furnished guestrooms, featuring private pools. Prepare your meals in the shared/communal kitchen. Complimentary wireless Internet access is available to keep you connected. Conveniences include safes and desks, as well as phones with free local calls.</p><p>Dining : Take advantage of the hotel s 24-hour room service.</p><p>CheckIn Instructions : <ul>  <li>Extra-person charges may apply and vary depending on property policy</li><li>Government-issued photo identification and a cash deposit may be required at check-in for incidental charges</li><li>Special requests are subject to availability upon check-in and may incur additional charges; special requests cannot be guaranteed</li><li>This property accepts credit cards</li><li>Safety features at this property include a carbon monoxide detector, a fire extinguisher, a smoke detector, and window guards</li>  </ul></p><p>Special Instructions : This property offers transfers from the airport (surcharges may apply). To arrange pick-up, guests must contact the property 72 hours prior to arrival, using the contact information on the booking confirmation. Front desk staff will greet guests on arrival.</p>",1-670-233-1817,Uncovered parking Scuba diving nearby Free WiFi Spa treatment room(s) Designated smoking areas Number of spa tubs - 1 Well-lit path to entrance Upper floors accessible by stairs only In-room accessibility (in select rooms) Full-service spa Wedding services Tours/ticket assistance Airport transportation (surcharge) Wheelchair accessible  no Luggage storage Multilingual staff Handrails in stairways Handrails in hallways 24-hour front desk Spa services on site Safe-deposit box at front desk Laundry facilities Sauna Free self parking Concierge services,15.213978|145.718346,16702331818,96950,http://www.saipanhanamitsu.com
MP,Northern Mariana Isl,135845,Saipan,1091742,Victoria Hotel,ThreeStar,Micro Beach Street  ,,"Property Location Located in Saipan Garapan, Victoria Hotel is minutes from American Memorial Park and Micro Beach. This inn is within close proximity of Managaha Beach and Saipan Zoo.Rooms Make yourself at home in one of the 27 air-conditioned rooms featuring refrigerators and microwaves. Cable television is provided for your entertainment. Bathrooms have complimentary toiletries and hair dryers. Conveniences include phones, as well as desks and coffee/tea makers.Dining Grab a bite to eat at the inn''s restaurant, where you can take in a garden view, or stay in and take advantage of room service during limited hours. Quench your thirst with your favorite drink at a bar/lounge.Business, Other Amenities Featured amenities include multilingual staff, laundry facilities, and a safe deposit box at the front desk. Limited parking is available onsite.",1-670-233-2037,Limited parking spaces Bathtub or shower Air Condition in rooms Air Conditioned Limited Time Reception coffee shop Safety Deposit Box WiFi everywhere Blackout drapes/curtains Non-Smoking Hotel Free Wireless Internet access Tea/Coffee Making Facilities Cable / Satellite Television JCB Card Free self parking Bar / Lounge Television Telephone Visa MasterCard Hair dryer (on request) 24 Hour Front Desk Toiletries Dry cleaning / laundry service Restaurant Writing Desk Iron/Ironing Board (On Request) Self Laundry Laundry service Pets Not Allowed Wireless Internet Access Bar Family rooms Fridge designated smoking area Multilingual staff Car Parking,15.216101166|145.7196629,1-670-233-2031,96950,
MP,Northern Mariana Isl,135845,Saipan,1091756,Himawari Hotel,ThreeStar,Bukiki Street GarapanPmb 252 Box 10003Saipan 96950 ,Distances are displayed to the nearest 0.1 mile and kilometer. <br /> <p>Paseo de Marianas - 0.7 km / 0.4 mi <br /> Micro Beach - 0.7 km / 0.4 mi <br /> LagoonSpa - 0.7 km / 0.4 mi <br /> Ni  Lala Spa - 0.7 km / 0.5 mi <br /> American Memorial Park - 0.8 km / 0.5 mi <br /> Garapan Street Market - 1.1 km / 0.7 mi <br /> Smiling Cove Marina - 1.1 km / 0.7 mi <br /> Saipan American Memorial - 1.2 km / 0.8 mi <br /> Managaha Island - 2.7 km / 1.7 mi <br /> Managaha Beach - 2.7 km / 1.7 mi <br /> Saipan Zoo - 3.7 km / 2.3 mi <br /> F.M. Palacios Field - 5.6 km / 3.5 mi <br /> Tanapag Beach - 5.8 km / 3.6 mi <br /> Unai Chalan Kiya - 6 km / 3.7 mi <br /> Saipan Country Club - 6.2 km / 3.9 mi <br /> </p><p>The nearest major airport is Saipan (SPN-Saipan Intl.) - 12.5 km / 7.8 mi</p>,"<p>HeadLine : Near LagoonSpa</p><p>Location : When you stay at Himawari Hotel in Saipan, you ll be near the beach, within a 10-minute walk of Paseo de Marianas and Micro Beach.  This hotel is 0.5 mi (0.8 km) from LagoonSpa and 0.5 mi (0.8 km) from Ni  Lala Spa.</p><p>Rooms : Make yourself at home in one of the 39 air-conditioned rooms featuring refrigerators and microwaves. Complimentary wireless Internet access keeps you connected, and cable programming is available for your entertainment. Private bathrooms with shower/tub combinations feature complimentary toiletries and hair dryers. Conveniences include safes and desks, and housekeeping is provided daily.</p><p>Dining : Satisfy your appetite at HIMAWARI, a restaurant which features a bar/lounge. Dining is also available at the coffee shop/cafe.</p><p>CheckIn Instructions : <ul>  <li>Extra-person charges may apply and vary depending on property policy</li><li>Government-issued photo identification and a credit card, debit card, or cash deposit may be required at check-in for incidental charges</li><li>Special requests are subject to availability upon check-in and may incur additional charges; special requests cannot be guaranteed</li><li>This property accepts credit cards and cash</li>  </ul></p><p>Special Instructions : The front desk is open daily from 7:00 AM - 11:30 PM. To make arrangements for check-in please contact the property ahead of time using the information on the booking confirmation. If you are planning to arrive after 11 PM please contact the property in advance using the information on the booking confirmation. Guests must contact the property in advance for check-in instructions. Front desk staff will greet guests on arrival.</p>",1-670-2331532,Gift shops or newsstand Airport transportation (surcharge) Wheelchair accessible  no Grocery/convenience store Nightclub Front desk (limited hours) Scuba diving nearby Free WiFi Number of bars/lounges - 1 Safe-deposit box at front desk Smoke-free property Number of coffee shops/cafes - 1 Laundry facilities Tours/ticket assistance Free self parking Tennis on site Bicycle rentals on site,15.21016|145.7199,1-670-2331530,96950,http://himawari-saipan.com
MP,Northern Mariana Isl,135845,Saipan,1091760,Holiday Saipan Resort,ThreeStar,Back Of T Galleria Pmb A17 Box 10001 Saipan Pmb A17 Box 10001Saipan 96950 ,Distances are displayed to the nearest 0.1 mile and kilometer. <br /> <p>LagoonSpa - 0.4 km / 0.3 mi <br /> Paseo de Marianas - 0.6 km / 0.4 mi <br /> Micro Beach - 0.6 km / 0.4 mi <br /> Ni  Lala Spa - 0.7 km / 0.4 mi <br /> American Memorial Park - 0.9 km / 0.5 mi <br /> Garapan Street Market - 0.9 km / 0.6 mi <br /> Smiling Cove Marina - 1 km / 0.6 mi <br /> Saipan American Memorial - 1.2 km / 0.8 mi <br /> Managaha Island - 3 km / 1.8 mi <br /> Managaha Beach - 3 km / 1.8 mi <br /> Saipan Zoo - 3.9 km / 2.4 mi <br /> F.M. Palacios Field - 5.4 km / 3.4 mi <br /> Unai Chalan Kiya - 5.8 km / 3.6 mi <br /> Tanapag Beach - 6.1 km / 3.8 mi <br /> Saipan Country Club - 6.2 km / 3.8 mi <br /> </p><p>The preferred airport for Holiday Saipan Hotel is Saipan (SPN-Saipan Intl.) - 11.7 km / 7.3 mi </p>,"<p>HeadLine : Near LagoonSpa</p><p>Location : With a stay at Holiday Saipan Hotel in Saipan, you ll be near the beach, within a 15-minute walk of Micro Beach and American Memorial Park.  This spa hotel is 1.8 mi (2.8 km) from Managaha Island and 3.8 mi (6.2 km) from Saipan Country Club.</p><p>Rooms : Make yourself at home in one of the 30 air-conditioned rooms featuring refrigerators. Rooms have private balconies. Complimentary wireless Internet access is available to keep you connected. Bathrooms have shower/tub combinations and complimentary toiletries.</p><p>CheckIn Instructions : <ul>  <li>Extra-person charges may apply and vary depending on property policy</li><li>Government-issued photo identification and a credit card, debit card, or cash deposit may be required at check-in for incidental charges</li><li>Special requests are subject to availability upon check-in and may incur additional charges; special requests cannot be guaranteed</li><li>This property accepts credit cards; cash is not accepted</li>  </ul></p><p>Special Instructions : The front desk is open daily from 6:00 AM - midnight. If you are planning to arrive after midnight please contact the property in advance using the information on the booking confirmation. Front desk staff will greet guests on arrival.</p>",1-670-2333331,Dry cleaning/laundry service Wheelchair accessible  no Express check-out Front desk (limited hours) Scuba diving nearby Free WiFi Smoke-free property In-room accessibility (in select rooms) Roll-in shower (in select rooms) Full-service spa Tours/ticket assistance Accessible bathroom (in select rooms) Free self parking Beach towels,15.21002|145.718969,+1 670 233 3337,96950,http://www.holidaysaipan.com/english/index.htm
MP,Northern Mariana Isl,135845,Saipan,1091764,Heaven II,ThreeStar,Pmb557 Box 10003 Capital Hill  ,Distances are calculated in a straight line from the property&apos;s location to the point of interest or attraction  and may not reflect actual travel distance. &lt;br /&gt;&lt;br /&gt; Distances are displayed to the nearest 0.1 mile and kilometer. &lt;p&gt;Saipan Zoo - 2 km / 1.3 mi &lt;br /&gt;Kingfisher Golf Links - 2 km / 1.3 mi &lt;br /&gt;Marianas Country Club - 4.9 km / 3 mi &lt;br /&gt;American Memorial Park - 4.9 km / 3.1 mi &lt;br /&gt;Mount Tapochao - 5.1 km / 3.2 mi &lt;br /&gt;Paseo de Marianas - 5.2 km / 3.2 mi &lt;br /&gt;Micro Beach - 5.2 km / 3.2 mi &lt;br /&gt;Managaha Beach - 5.6 km / 3.5 mi &lt;br /&gt;Managaha Island - 5.8 km / 3.6 mi &lt;br /&gt;Bird Island - 6.2 km / 3.9 mi &lt;br /&gt;Saipan Botanical Garden - 6.4 km / 4 mi &lt;br /&gt;Lau Lau Bay Beach - 7.2 km / 4.5 mi &lt;br /&gt;Lao Lao Bay Golf Resort - 7.6 km / 4.7 mi &lt;br /&gt;Saipan Country Club - 8.4 km / 5.2 mi &lt;br /&gt;Puntan Sabaneta - 8.4 km / 5.2 mi &lt;br /&gt;&lt;/p&gt;&lt;p&gt;The preferred airport for Heaven II is Saipan (SPN-Saipan Intl.) - 12.8 km / 7.9 mi. &lt;/p&gt;,"Property Location Located in Saipan, Heaven II is convenient to Saipan Zoo and Kingfisher Golf Links. This resort is within close proximity of Marianas Country Club and American Memorial Park.Rooms Make yourself at home in one of the air-conditioned guestrooms. Bathrooms have complimentary toiletries and hair dryers. Conveniences include safes and separate sitting areas, and you can also request cribs/infant beds.Rec, Spa, Premium Amenities Enjoy recreation amenities such as an outdoor pool or take in the view from a garden. This resort also features complimentary wireless Internet access and tour/ticket assistance.Dining Enjoy a satisfying meal at a restaurant serving guests of Heaven II. Relax with your favorite drink at a bar/lounge or a poolside bar. Cooked-to-order breakfasts are available daily for a fee.Business, Other Amenities The front desk is staffed during limited hours. A roundtrip airport shuttle is provided for a surcharge available on request.",16703220203,Soundproof rooms Air Condition in rooms Wireless Internet Access Air Conditioned Limited Time Reception Safety Deposit Box Water Sports Non-smoking rooms WiFi everywhere Outdoor Swimming Pool Separate sitting area Pay Shuttle Service Blackout drapes/curtains Poolside bar Room service Children's pool Family rooms Cribs Available Bar / Lounge Valet parking Restaurant Free Wireless Internet access Breakfast available (surcharge) In room safe Tour desk Toiletries Shuttle service No elevators Bar Hairdryer designated smoking area Multilingual staff Car Parking Airport shuttle (surcharge) Bathrobe Garden,15.22868|145.76421,001 670 3220102,96950,http://o2scuba02.cafe24.com/hotel/html/heaven2_sub2_hotel/heaven2_index_3.htm
MP,Northern Mariana Isl,135845,Saipan,1115082,Hotel Sun Palace,ThreeStar,Bwughos St. Susupe Vill. Susupe VillageSaipan 96950 ,Distances are displayed to the nearest 0.1 mile and kilometer. <br /> <p>F.M. Palacios Field - 0.1 km / 0.1 mi <br /> Unai Chalan Kiya - 0.3 km / 0.2 mi <br /> Pakpak Beach - 1.9 km / 1.2 mi <br /> Saipan Country Club - 2 km / 1.2 mi <br /> Garapan Street Market - 4.8 km / 3 mi <br /> LagoonSpa - 5.8 km / 3.6 mi <br /> Micro Beach - 5.8 km / 3.6 mi <br /> Paseo de Marianas - 5.9 km / 3.7 mi <br /> Ni  Lala Spa - 6.1 km / 3.8 mi <br /> American Memorial Park - 6.3 km / 3.9 mi <br /> Coral Ocean Point Resort Club - 6.5 km / 4 mi <br /> Saipan American Memorial - 6.6 km / 4.1 mi <br /> Lau Lau Bay Beach - 7.6 km / 4.7 mi <br /> Saipan Botanical Garden - 7.8 km / 4.9 mi <br /> Smiling Cove Marina - 7.9 km / 4.9 mi <br /> </p><p>The preferred airport for Hotel Sun Palace is Saipan (SPN-Saipan Intl.) - 7 km / 4.4 mi </p>,"<p>HeadLine : Near F.M. Palacios Field</p><p>Location : Located in Saipan, Hotel Sun Palace is near the beach, within a 5-minute walk of F.M. Palacios Field and Unai Chalan Kiya.  This hotel is 1.1 mi (1.8 km) from Pakpak Beach and 1.2 mi (2 km) from Saipan Country Club.</p><p>Rooms : Make yourself at home in one of the 30 air-conditioned guestrooms. Rooms have private balconies. Cable television is provided for your entertainment. Bathrooms have shower/tub combinations and complimentary toiletries.</p><p>Dining : Grab a bite from the snack bar/deli serving guests of Hotel Sun Palace.</p><p>CheckIn Instructions : <ul>  <li>Extra-person charges may apply and vary depending on property policy</li><li>Government-issued photo identification and a credit card, debit card, or cash deposit may be required at check-in for incidental charges</li><li>Special requests are subject to availability upon check-in and may incur additional charges; special requests cannot be guaranteed</li><li>This property accepts credit cards; cash is not accepted</li>  </ul></p><p>Special Instructions : This property doesn t offer after-hours check-in. Front desk staff will greet guests on arrival.</p>",670-234-6062,Free self parking Terrace Vending machine Wheelchair accessible  no Parking (limited spaces) Luggage storage 24-hour front desk Television in common areas Scuba diving nearby Free WiFi Garden Safe-deposit box at front desk Smoke-free property Snack bar/deli Laundry facilities Free newspapers in lobby,15.163125|145.707786,670-234-6639,96950,
MP,Northern Mariana Isl,135845,Saipan,1224598,Hyatt Regency Saipan,FourStar,Capital Hill Rural Branch PO Box 5087 Royal Palm AvenueGarapanSaipan 96950 ,Distances are displayed to the nearest 0.1 mile and kilometer. <br /> <p>American Memorial Park - 0.2 km / 0.1 mi <br /> Paseo de Marianas - 0.4 km / 0.2 mi <br /> Saipan American Memorial - 0.5 km / 0.3 mi <br /> Ni  Lala Spa - 0.5 km / 0.3 mi <br /> Smiling Cove Marina - 0.6 km / 0.4 mi <br /> Micro Beach - 0.6 km / 0.4 mi <br /> LagoonSpa - 1.1 km / 0.7 mi <br /> Garapan Street Market - 1.7 km / 1.1 mi <br /> Managaha Island - 2.8 km / 1.7 mi <br /> Managaha Beach - 2.8 km / 1.7 mi <br /> Saipan Zoo - 4.2 km / 2.6 mi <br /> Tanapag Beach - 5.9 km / 3.7 mi <br /> F.M. Palacios Field - 6.3 km / 3.9 mi <br /> Mount Tapochao - 6.4 km / 4 mi <br /> Unai Chalan Kiya - 6.6 km / 4.1 mi <br /> </p><p>The preferred airport for Hyatt Regency Saipan is Saipan (SPN-Saipan Intl.) - 12.7 km / 7.9 mi </p>,"<p>HeadLine : Near Paseo de Marianas</p><p>Location : A stay at Hyatt Regency Saipan places you in the heart of Saipan, steps from American Memorial Park and 4 minutes by foot from Paseo de Marianas.  This 4.5-star resort is 0.2 mi (0.4 km) from Saipan American Memorial and 0.3 mi (0.5 km) from Ni  Lala Spa.</p><p>Rooms : Make yourself at home in one of the 319 guestrooms featuring refrigerators and flat-screen televisions. Rooms have private balconies. Complimentary wired and wireless Internet access keeps you connected, and cable programming provides entertainment. Private bathrooms with shower/tub combinations feature hair dryers and slippers.</p><p>Dining : Enjoy Italian cuisine at Giovanni s, one of the resort s 4 restaurants, or stay in and take advantage of the room service (during limited hours). Snacks are also available at the coffee shop/cafe. Wrap up your day with a drink at the bar/lounge, the beach bar, or the poolside bar. Buffet breakfasts are available daily from 6:30 AM to 10:00 AM for a fee.</p><p>Renovations : The following facilities or services will be unavailable from August 4 2022 to December 31 2023 (dates subject to change): <ul><li>Bar/Lounge(s)</li></ul></p><p>CheckIn Instructions : <ul>  <li>Extra-person charges may apply and vary depending on property policy</li><li>Government-issued photo identification and a credit card, debit card, or cash deposit may be required at check-in for incidental charges</li><li>Special requests are subject to availability upon check-in and may incur additional charges; special requests cannot be guaranteed</li><li>The name on the credit card used at check-in to pay for incidentals must be the primary name on the guestroom reservation</li><li>This property accepts credit cards, debit cards, and cash</li><li>Please note that cultural norms and guest policies may differ by country and by property; the policies listed are provided by the property</li>  </ul></p><p>Special Instructions : This property offers transfers from the airport (surcharges may apply). Guests must contact the property with arrival details before travel, using the contact information on the booking confirmation. Front desk staff will greet guests on arrival.</p>",1-670-234-7745,Gift shops or newsstand Dry cleaning/laundry service Beach volleyball on site Proposal/romance packages available Free parking nearby Babysitting or childcare (surcharge) Outdoor furniture Pool umbrellas Outdoor entertainment area Number of meeting rooms - 1 Conference space size (meters) - 453 Swimming pool Sailing nearby Scuba diving nearby Free WiFi Number of bars/lounges - 1 Number of poolside bars - 1 Number of outdoor pools - 2 Number of beach bars - 1 In-room accessibility (in select rooms) Tours/ticket assistance Accessible bathroom (in select rooms) Airport transportation (surcharge) Outdoor tennis courts - 2 Multilingual staff Parasailing nearby Breakfast available (surcharge) Ecotours nearby Number of coffee shops/cafes - 1 Laundry facilities elevator Fitness facilities Snorkeling on site Children's club (surcharge) Wheelchair accessible (may have limitations) Wheelchair accessible Beach umbrellas Wheelchair-accessible path to elevator Wheelchair-accessible registration desk Skydiving Nearby Spa treatment room(s) Garden Full-service spa Wedding services Beach towels Boat tours nearby Supervised childcare/activities (surcharge) Windsurfing on site Private picnics Couples/private dining Luggage storage Porter/bellhop Business center 24-hour front desk Playground on site Golfing nearby Safe-deposit box at front desk Smoke-free property Rowing or canoeing on site Snack bar/deli Hiking/biking trails nearby Sauna Steam room Free self parking Conference space Kayaking on site Hair salon Tennis on site Motor boating on site Computer station Access to nearby outdoor pool Pool sun loungers Conference space size (feet) - 4876 Concierge services,15.216104|145.71782,1-670-2341234,96950,http://saipan.regency.hyatt.jp/hyatt/hotels/index.jsp
MP,Northern Mariana Isl,135845,Saipan,1227509,Saipan World Resort,ThreeStar,Beach Rd Saipan World Resort Saipan 96950 ,Distances are displayed to the nearest 0.1 mile and kilometer. <br /> <p>Unai Chalan Kiya - 0.2 km / 0.1 mi <br /> F.M. Palacios Field - 0.5 km / 0.3 mi <br /> Pakpak Beach - 1.5 km / 1 mi <br /> Saipan Country Club - 2.3 km / 1.4 mi <br /> Garapan Street Market - 5 km / 3.1 mi <br /> Coral Ocean Point Resort Club - 6.1 km / 3.8 mi <br /> LagoonSpa - 6.1 km / 3.8 mi <br /> Micro Beach - 6.2 km / 3.8 mi <br /> Paseo de Marianas - 6.2 km / 3.9 mi <br /> Ni  Lala Spa - 6.5 km / 4 mi <br /> American Memorial Park - 6.6 km / 4.1 mi <br /> Saipan American Memorial - 6.9 km / 4.3 mi <br /> Ladder Beach - 7.6 km / 4.7 mi <br /> Lau Lau Bay Beach - 7.9 km / 4.9 mi <br /> Saipan Botanical Garden - 8.2 km / 5.1 mi <br /> </p><p>The preferred airport for Saipan World Resort is Saipan (SPN-Saipan Intl.) - 6.7 km / 4.1 mi </p>,"<p>HeadLine : Near Unai Chalan Kiya</p><p>Location : Located in Saipan, Saipan World Resort is by the ocean, within a 10-minute drive of LagoonSpa and American Memorial Park.  This all-inclusive resort is 3.8 mi (6.2 km) from Micro Beach and 5.1 mi (8.3 km) from Managaha Island.</p><p>Rooms : Make yourself at home in one of the 259 guestrooms featuring refrigerators and flat-screen televisions. Rooms have private balconies. Complimentary wireless Internet access is available to keep you connected. Private bathrooms have complimentary toiletries and bidets.</p><p>Dining : This resort is all inclusive. Rates include meals and beverages at onsite dining establishments. Charges may be applied for dining at some restaurants, special dinners and dishes, some beverages, and other amenities. <p>Enjoy a meal at Buffet world or snacks in the resort s coffee shop/cafe. Relax with your favorite drink at the bar/lounge or the beach bar. Cooked-to-order breakfasts are available daily from 7:00 AM to 10:00 AM for a fee. </p></p><p>CheckIn Instructions : <ul>  <li>Extra-person charges may apply and vary depending on property policy</li><li>Government-issued photo identification and a credit card, debit card, or cash deposit may be required at check-in for incidental charges</li><li>Special requests are subject to availability upon check-in and may incur additional charges; special requests cannot be guaranteed</li><li>This property accepts credit cards; cash is not accepted</li>  </ul></p><p>Special Instructions : Front desk staff will greet guests on arrival.</p>",1-670-2345926,Gift shops or newsstand Dry cleaning/laundry service Beach volleyball on site Shopping on site Free water park access Beach umbrellas Pool umbrellas Outdoor entertainment area Meeting rooms Shared microwave Television in common areas Free WiFi Shared refrigerator Number of bars/lounges - 1 Designated smoking areas Number of beach bars - 1 Garden In-room accessibility (in select rooms) Tours/ticket assistance Accessible bathroom (in select rooms) Beach towels Windsurfing on site Wheelchair accessible  no Grocery/convenience store Porter/bellhop Multilingual staff 24-hour front desk Breakfast available (surcharge) Playground on site Safe-deposit box at front desk Snack bar/deli Number of coffee shops/cafes - 1 Laundry facilities elevator Free self parking Snorkeling on site Pool cabanas (surcharge) Kayaking on site Computer station Beach sun loungers Terrace ATM/banking Pool sun loungers Concierge services,15.16065|145.70594,1-670-2345900,96950,http://www.saipanworldresort.com/english/
