countyCode,countyName,cityCode,cityName,HotelCode,HotelName,HotelRating,Address,Attractions,Description,FaxNumber,HotelFacilities,Map,PhoneNumber,PinCode,HotelWebsiteUrl
MP,Northern Mariana Isl,102476,Garapan,1091714,Summer Holiday Hotel,TwoStar,"Alaihai Street, South Garapan South GarapanSaipan 96950 ",Distances are displayed to the nearest 0.1 mile and kilometer. <br /> <p>Garapan Street Market - 0.3 km / 0.2 mi <br /> LagoonSpa - 0.8 km / 0.5 mi <br /> Micro Beach - 1.3 km / 0.8 mi <br /> Paseo de Marianas - 1.4 km / 0.8 mi <br /> Ni  Lala Spa - 1.4 km / 0.9 mi <br /> American Memorial Park - 1.7 km / 1 mi <br /> Smiling Cove Marina - 1.7 km / 1.1 mi <br /> Saipan American Memorial - 1.9 km / 1.2 mi <br /> Managaha Island - 3.4 km / 2.1 mi <br /> Managaha Beach - 3.4 km / 2.1 mi <br /> F.M. Palacios Field - 4.7 km / 3 mi <br /> Saipan Zoo - 5 km / 3.1 mi <br /> Unai Chalan Kiya - 5 km / 3.1 mi <br /> Saipan Country Club - 5.4 km / 3.3 mi <br /> Tanapag Beach - 6.4 km / 4 mi <br /> </p><p>The preferred airport for Summer Holiday Hotel is Saipan (SPN-Saipan Intl.) - 11.7 km / 7.3 mi </p>,"<p>HeadLine : Near Garapan Street Market</p><p>Location : With a stay at Summer Holiday Hotel in Saipan, you ll be near the airport, just a 4-minute walk from Garapan Street Market and 9 minutes by foot from LagoonSpa.  This hotel is 0.8 mi (1.2 km) from Micro Beach and 0.8 mi (1.3 km) from Paseo de Marianas.</p><p>Rooms : Make yourself at home in one of the 26 air-conditioned rooms featuring kitchenettes. Complimentary wireless Internet access is available to keep you connected. Conveniences include desks and refrigerators, and housekeeping is provided daily.</p><p>Dining : Grab a bite from the grocery/convenience store serving guests of Summer Holiday Hotel.</p><p>CheckIn Instructions : <ul>  <li>Extra-person charges may apply and vary depending on property policy</li><li>Government-issued photo identification and a credit card, debit card, or cash deposit may be required at check-in for incidental charges</li><li>Special requests are subject to availability upon check-in and may incur additional charges; special requests cannot be guaranteed</li><li>This property accepts credit cards</li>  </ul></p><p>Special Instructions : </p>",67-023-43077,Dry cleaning/laundry service Shopping on site Airport transportation (surcharge) Barbecue grill(s) Safe-deposit box at front desk Wheelchair accessible parking Laundry facilities Grocery/convenience store Free self parking ATM/banking Scuba diving nearby,15.203753|145.717985,67-023-43182,96950,http://www.sholiday.com
MP,Northern Mariana Isl,102476,Garapan,1091716,Saipan Ocean View Hotel,ThreeStar,Beach Road Garapan GarapanSaipan 96950 ,Distances are displayed to the nearest 0.1 mile and kilometer. <br /> <p>LagoonSpa - 0.2 km / 0.1 mi <br /> Garapan Street Market - 0.5 km / 0.3 mi <br /> Micro Beach - 0.8 km / 0.5 mi <br /> Paseo de Marianas - 0.8 km / 0.5 mi <br /> Ni  Lala Spa - 0.9 km / 0.5 mi <br /> American Memorial Park - 1 km / 0.6 mi <br /> Smiling Cove Marina - 1.2 km / 0.7 mi <br /> Saipan American Memorial - 1.4 km / 0.8 mi <br /> Managaha Island - 3.2 km / 2 mi <br /> Managaha Beach - 3.2 km / 2 mi <br /> Saipan Zoo - 4.7 km / 2.9 mi <br /> F.M. Palacios Field - 5.1 km / 3.1 mi <br /> Unai Chalan Kiya - 5.4 km / 3.4 mi <br /> Saipan Country Club - 5.8 km / 3.6 mi <br /> Tanapag Beach - 6.6 km / 4.1 mi <br /> </p><p>The preferred airport for Saipan Ocean View Hotel is Saipan (SPN-Saipan Intl.) - 12.1 km / 7.5 mi </p>,"<p>HeadLine : Near LagoonSpa</p><p>Location : With a stay at Saipan Ocean View Hotel in Saipan, you ll be near the beach, just a 3-minute walk from LagoonSpa and 7 minutes by foot from Garapan Street Market.  This hotel is 0.5 mi (0.8 km) from Paseo de Marianas and 0.6 mi (1 km) from Ni  Lala Spa.</p><p>Rooms : Make yourself at home in one of the 90 air-conditioned rooms featuring refrigerators and LCD televisions. Rooms have private balconies. Satellite television is provided for your entertainment. Bathrooms have showers and complimentary toiletries.</p><p>Dining : At Saipan Ocean View Hotel, enjoy a satisfying meal at the restaurant. English breakfasts are available daily from 7 AM to noon for a fee.</p><p>CheckIn Instructions : <ul>  <li>Extra-person charges may apply and vary depending on property policy</li><li>Government-issued photo identification and a credit card, debit card, or cash deposit may be required at check-in for incidental charges</li><li>Special requests are subject to availability upon check-in and may incur additional charges; special requests cannot be guaranteed</li><li>This property accepts credit cards and cash</li>  </ul></p><p>Special Instructions : Front desk staff will greet guests on arrival.</p>",1-670-2349428,Free WiFi Number of outdoor pools - 1 Safe-deposit box at front desk Smoke-free property Wheelchair accessible parking Laundry facilities Tours/ticket assistance Accessible bathroom (in select rooms) elevator Gift shops or newsstand Airport transportation (surcharge) Luggage storage 24-hour front desk Breakfast available (surcharge) Scuba diving nearby,15.207977|145.717219,1-670-234-8900,96950,http://www.hotels.com/ho397470
MP,Northern Mariana Isl,102476,Garapan,1091719,Century Hotel,TwoStar,P.O. 501280 Chalan Pale Arnold Garapan P.O. 501280Garapan 96950Saipan ,Distances are displayed to the nearest 0.1 mile and kilometer. <br /> <p>LagoonSpa - 0.7 km / 0.4 mi <br /> American Memorial Park - 0.8 km / 0.5 mi <br /> Paseo de Marianas - 0.9 km / 0.5 mi <br /> Micro Beach - 0.9 km / 0.5 mi <br /> Ni  Lala Spa - 0.9 km / 0.6 mi <br /> Garapan Street Market - 1 km / 0.6 mi <br /> Smiling Cove Marina - 1.3 km / 0.8 mi <br /> Saipan American Memorial - 1.4 km / 0.9 mi <br /> Managaha Island - 2.6 km / 1.6 mi <br /> Managaha Beach - 2.6 km / 1.6 mi <br /> Saipan Zoo - 4.3 km / 2.7 mi <br /> F.M. Palacios Field - 5.6 km / 3.5 mi <br /> Tanapag Beach - 5.8 km / 3.6 mi <br /> Saipan Country Club - 5.8 km / 3.6 mi <br /> Unai Chalan Kiya - 6 km / 3.7 mi <br /> </p><p>The preferred airport for Century Hotel is Saipan (SPN-Saipan Intl.) - 12.2 km / 7.6 mi </p>,"<p>HeadLine : Near LagoonSpa</p><p>Location : Located in Saipan, Century Hotel is in the business district, within a 15-minute walk of LagoonSpa and American Memorial Park.  This hotel is 0.5 mi (0.8 km) from Micro Beach and 0.5 mi (0.8 km) from Paseo de Marianas.</p><p>Rooms : Make yourself at home in one of the 33 air-conditioned rooms featuring refrigerators. Your room comes with a pillowtop bed. Rooms have private balconies. Complimentary wireless Internet access keeps you connected, and cable programming is available for your entertainment. Private bathrooms with shower/tub combinations feature deep soaking bathtubs and complimentary toiletries.</p><p>Dining : Stop by the hotel s restaurant for lunch or dinner. Dining is also available at the coffee shop/cafe, and room service (during limited hours) is provided. Wrap up your day with a drink at the bar/lounge. Full breakfasts are available daily from 6:00 AM to 11:00 AM for a fee.</p><p>Renovations : The following facilities are closed on Sunday, Monday, Thursday, Friday, and Saturday: <ul><li>Children s pool</li><li>Fitness facility</li><li>Outdoor pool</li></ul></p><p>CheckIn Instructions : <ul>  <li>Extra-person charges may apply and vary depending on property policy</li><li>Government-issued photo identification and a credit card, debit card, or cash deposit may be required at check-in for incidental charges</li><li>Special requests are subject to availability upon check-in and may incur additional charges; special requests cannot be guaranteed</li><li>This property accepts credit cards and cash</li><li>Safety features at this property include a fire extinguisher, a smoke detector, a security system, a first aid kit, and window guards</li>  </ul></p><p>Special Instructions : This property offers transfers from the airport (surcharges may apply). To arrange pick-up, guests must contact the property 72 hours prior to arrival, using the contact information on the booking confirmation. This property doesn t offer after-hours check-in. Front desk staff will greet guests on arrival.</p>",1-670-2331424,Dry cleaning/laundry service Airport transportation (surcharge) Wheelchair accessible  no Parking (limited spaces) Luggage storage 24-hour front desk Breakfast available (surcharge) Television in common areas Free WiFi Number of bars/lounges - 1 Designated smoking areas Safe-deposit box at front desk Number of coffee shops/cafes - 1 Laundry facilities Free self parking Beach towels Free beach shuttle,15.208792|145.720722,+1 670 233 1420,96950,http://www.centuryhotel-saipan.com/
MP,Northern Mariana Isl,102476,Garapan,1091736,Micro Beach Hotel,TwoStar,Chalan Kanoa Saipan 96950 ,Distances are displayed to the nearest 0.1 mile and kilometer. <br /> <p>American Memorial Park - 0.1 km / 0.1 mi <br /> Paseo de Marianas - 0.2 km / 0.1 mi <br /> Ni  Lala Spa - 0.3 km / 0.2 mi <br /> Micro Beach - 0.4 km / 0.3 mi <br /> Saipan American Memorial - 0.5 km / 0.3 mi <br /> Smiling Cove Marina - 0.6 km / 0.4 mi <br /> LagoonSpa - 0.9 km / 0.6 mi <br /> Garapan Street Market - 1.5 km / 1 mi <br /> Managaha Island - 2.9 km / 1.8 mi <br /> Managaha Beach - 2.9 km / 1.8 mi <br /> Saipan Zoo - 3.7 km / 2.3 mi <br /> Tanapag Beach - 5.9 km / 3.7 mi <br /> F.M. Palacios Field - 6.1 km / 3.8 mi <br /> Mount Tapochao - 6.4 km / 4 mi <br /> Unai Chalan Kiya - 6.4 km / 4 mi <br /> </p><p>The preferred airport for Micro Beach Hotel is Saipan (SPN-Saipan Intl.) - 12.7 km / 7.9 mi </p>,"<p>HeadLine : Near Paseo de Marianas</p><p>Location : Located in Saipan, Micro Beach Hotel is near the beach, within a 5-minute walk of American Memorial Park and Paseo de Marianas.  This hotel is 0.3 mi (0.4 km) from Saipan American Memorial and 0.5 mi (0.8 km) from Micro Beach.</p><p>Rooms : Make yourself at home in one of the 48 air-conditioned rooms featuring refrigerators and flat-screen televisions. Complimentary wireless Internet access keeps you connected, and cable programming is available for your entertainment. Private bathrooms with showers feature rainfall showerheads and complimentary toiletries.</p><p>Dining : Enjoy a meal at the restaurant, or stay in and take advantage of the hotel s room service (during limited hours).</p><p>CheckIn Instructions : <ul>  <li>Extra-person charges may apply and vary depending on property policy</li><li>Government-issued photo identification and a cash deposit may be required at check-in for incidental charges</li><li>Special requests are subject to availability upon check-in and may incur additional charges; special requests cannot be guaranteed</li><li>This property accepts credit cards; cash is not accepted</li><li>Please note that cultural norms and guest policies may differ by country and by property; the policies listed are provided by the property</li>  </ul></p><p>Special Instructions : This property doesn t offer after-hours check-in. To make arrangements for check-in please contact the property at least 48 hours before arrival using the information on the booking confirmation. Guests must contact the property in advance for check-in instructions. Front desk staff will greet guests on arrival. For more details, please contact the property using the information on the booking confirmation.  Guests should notify this property in advance of their anticipated arrival time.</p>",670-233-2288,Gift shops or newsstand Shopping on site Wheelchair accessible  no Parking (limited spaces) Grocery/convenience store 24-hour front desk Scuba diving nearby Free WiFi Safe-deposit box at front desk Smoke-free property Tours/ticket assistance Hair salon,15.215326|145.718116,670-23-31368,96950,http://www.saipanmicrobeachhotel.com/
MP,Northern Mariana Isl,102476,Garapan,1091739,Hanamitsu Hotel & Spa,ThreeStar,Paseo de Marianas Garapan Garapan ,Distances are displayed to the nearest 0.1 mile and kilometer. <br /> <p>Paseo de Marianas - 0.1 km / 0.1 mi <br /> Ni  Lala Spa - 0.3 km / 0.2 mi <br /> American Memorial Park - 0.3 km / 0.2 mi <br /> Micro Beach - 0.4 km / 0.3 mi <br /> Smiling Cove Marina - 0.7 km / 0.4 mi <br /> LagoonSpa - 0.7 km / 0.5 mi <br /> Saipan American Memorial - 0.7 km / 0.5 mi <br /> Garapan Street Market - 1.3 km / 0.8 mi <br /> Managaha Island - 2.9 km / 1.8 mi <br /> Managaha Beach - 2.9 km / 1.8 mi <br /> Saipan Zoo - 3.7 km / 2.3 mi <br /> Tanapag Beach - 5.9 km / 3.7 mi <br /> F.M. Palacios Field - 6.1 km / 3.8 mi <br /> Mount Tapochao - 6.4 km / 4 mi <br /> Unai Chalan Kiya - 6.4 km / 4 mi <br /> </p><p>The preferred airport for Hanamitsu Hotel & Spa is Saipan (SPN-Saipan Intl.) - 12.7 km / 7.9 mi </p>,"<p>HeadLine : Near Paseo de Marianas</p><p>Location : When you a stay at Hanamitsu Hotel & Spa in Saipan, you ll be near the beach, within a 5-minute walk of Paseo de Marianas and Ni  Lala Spa.  This spa hotel is 0.1 mi (0.2 km) from American Memorial Park and 0.4 mi (0.6 km) from Saipan American Memorial.</p><p>Rooms : Treat yourself to a stay in one of the 20 individually furnished guestrooms, featuring private pools. Prepare your meals in the shared/communal kitchen. Complimentary wireless Internet access is available to keep you connected. Conveniences include safes and desks, as well as phones with free local calls.</p><p>Dining : Take advantage of the hotel s 24-hour room service.</p><p>CheckIn Instructions : <ul>  <li>Extra-person charges may apply and vary depending on property policy</li><li>Government-issued photo identification and a cash deposit may be required at check-in for incidental charges</li><li>Special requests are subject to availability upon check-in and may incur additional charges; special requests cannot be guaranteed</li><li>This property accepts credit cards</li><li>Safety features at this property include a carbon monoxide detector, a fire extinguisher, a smoke detector, and window guards</li>  </ul></p><p>Special Instructions : This property offers transfers from the airport (surcharges may apply). To arrange pick-up, guests must contact the property 72 hours prior to arrival, using the contact information on the booking confirmation. Front desk staff will greet guests on arrival.</p>",1-670-233-1817,Concierge services Free self parking Sauna Laundry facilities Safe-deposit box at front desk Spa services on site 24-hour front desk Handrails in hallways Handrails in stairways Multilingual staff Luggage storage Wheelchair accessible  no Airport transportation (surcharge) Tours/ticket assistance Wedding services Full-service spa In-room accessibility (in select rooms) Upper floors accessible by stairs only Well-lit path to entrance Number of spa tubs - 1 Designated smoking areas Spa treatment room(s) Free WiFi Scuba diving nearby Uncovered parking,15.213978|145.718346,16702331818,96950,http://www.saipanhanamitsu.com
MP,Northern Mariana Isl,102476,Garapan,1091742,Victoria Hotel,ThreeStar,Micro Beach Street  ,,"Property Location Located in Saipan Garapan, Victoria Hotel is minutes from American Memorial Park and Micro Beach. This inn is within close proximity of Managaha Beach and Saipan Zoo.Rooms Make yourself at home in one of the 27 air-conditioned rooms featuring refrigerators and microwaves. Cable television is provided for your entertainment. Bathrooms have complimentary toiletries and hair dryers. Conveniences include phones, as well as desks and coffee/tea makers.Dining Grab a bite to eat at the inn''s restaurant, where you can take in a garden view, or stay in and take advantage of room service during limited hours. Quench your thirst with your favorite drink at a bar/lounge.Business, Other Amenities Featured amenities include multilingual staff, laundry facilities, and a safe deposit box at the front desk. Limited parking is available onsite.",1-670-233-2037,Car Parking Multilingual staff designated smoking area Fridge Family rooms Bar Wireless Internet Access Pets Not Allowed Laundry service Self Laundry Iron/Ironing Board (On Request) Writing Desk Restaurant Dry cleaning / laundry service Toiletries 24 Hour Front Desk Hair dryer (on request) MasterCard Visa Telephone Television Bar / Lounge Free self parking JCB Card Cable / Satellite Television Tea/Coffee Making Facilities Free Wireless Internet access Non-Smoking Hotel Blackout drapes/curtains WiFi everywhere Safety Deposit Box coffee shop Limited Time Reception Air Conditioned Air Condition in rooms Bathtub or shower Limited parking spaces,15.216101166|145.7196629,1-670-233-2031,96950,
MP,Northern Mariana Isl,102476,Garapan,1091756,Himawari Hotel,ThreeStar,Bukiki Street GarapanPmb 252 Box 10003Saipan 96950 ,Distances are displayed to the nearest 0.1 mile and kilometer. <br /> <p>Paseo de Marianas - 0.7 km / 0.4 mi <br /> Micro Beach - 0.7 km / 0.4 mi <br /> LagoonSpa - 0.7 km / 0.4 mi <br /> Ni  Lala Spa - 0.7 km / 0.5 mi <br /> American Memorial Park - 0.8 km / 0.5 mi <br /> Garapan Street Market - 1.1 km / 0.7 mi <br /> Smiling Cove Marina - 1.1 km / 0.7 mi <br /> Saipan American Memorial - 1.2 km / 0.8 mi <br /> Managaha Island - 2.7 km / 1.7 mi <br /> Managaha Beach - 2.7 km / 1.7 mi <br /> Saipan Zoo - 3.7 km / 2.3 mi <br /> F.M. Palacios Field - 5.6 km / 3.5 mi <br /> Tanapag Beach - 5.8 km / 3.6 mi <br /> Unai Chalan Kiya - 6 km / 3.7 mi <br /> Saipan Country Club - 6.2 km / 3.9 mi <br /> </p><p>The nearest major airport is Saipan (SPN-Saipan Intl.) - 12.5 km / 7.8 mi</p>,"<p>HeadLine : Near LagoonSpa</p><p>Location : When you stay at Himawari Hotel in Saipan, you ll be near the beach, within a 10-minute walk of Paseo de Marianas and Micro Beach.  This hotel is 0.5 mi (0.8 km) from LagoonSpa and 0.5 mi (0.8 km) from Ni  Lala Spa.</p><p>Rooms : Make yourself at home in one of the 39 air-conditioned rooms featuring refrigerators and microwaves. Complimentary wireless Internet access keeps you connected, and cable programming is available for your entertainment. Private bathrooms with shower/tub combinations feature complimentary toiletries and hair dryers. Conveniences include safes and desks, and housekeeping is provided daily.</p><p>Dining : Satisfy your appetite at HIMAWARI, a restaurant which features a bar/lounge. Dining is also available at the coffee shop/cafe.</p><p>CheckIn Instructions : <ul>  <li>Extra-person charges may apply and vary depending on property policy</li><li>Government-issued photo identification and a credit card, debit card, or cash deposit may be required at check-in for incidental charges</li><li>Special requests are subject to availability upon check-in and may incur additional charges; special requests cannot be guaranteed</li><li>This property accepts credit cards and cash</li>  </ul></p><p>Special Instructions : The front desk is open daily from 7:00 AM - 11:30 PM. To make arrangements for check-in please contact the property ahead of time using the information on the booking confirmation. If you are planning to arrive after 11 PM please contact the property in advance using the information on the booking confirmation. Guests must contact the property in advance for check-in instructions. Front desk staff will greet guests on arrival.</p>",1-670-2331532,Bicycle rentals on site Tennis on site Free self parking Tours/ticket assistance Laundry facilities Number of coffee shops/cafes - 1 Smoke-free property Safe-deposit box at front desk Number of bars/lounges - 1 Free WiFi Scuba diving nearby Front desk (limited hours) Nightclub Grocery/convenience store Wheelchair accessible  no Airport transportation (surcharge) Gift shops or newsstand,15.21016|145.7199,1-670-2331530,96950,http://himawari-saipan.com
MP,Northern Mariana Isl,102476,Garapan,1091760,Holiday Saipan Resort,ThreeStar,Back Of T Galleria Pmb A17 Box 10001 Saipan Pmb A17 Box 10001Saipan 96950 ,Distances are displayed to the nearest 0.1 mile and kilometer. <br /> <p>LagoonSpa - 0.4 km / 0.3 mi <br /> Paseo de Marianas - 0.6 km / 0.4 mi <br /> Micro Beach - 0.6 km / 0.4 mi <br /> Ni  Lala Spa - 0.7 km / 0.4 mi <br /> American Memorial Park - 0.9 km / 0.5 mi <br /> Garapan Street Market - 0.9 km / 0.6 mi <br /> Smiling Cove Marina - 1 km / 0.6 mi <br /> Saipan American Memorial - 1.2 km / 0.8 mi <br /> Managaha Island - 3 km / 1.8 mi <br /> Managaha Beach - 3 km / 1.8 mi <br /> Saipan Zoo - 3.9 km / 2.4 mi <br /> F.M. Palacios Field - 5.4 km / 3.4 mi <br /> Unai Chalan Kiya - 5.8 km / 3.6 mi <br /> Tanapag Beach - 6.1 km / 3.8 mi <br /> Saipan Country Club - 6.2 km / 3.8 mi <br /> </p><p>The preferred airport for Holiday Saipan Hotel is Saipan (SPN-Saipan Intl.) - 11.7 km / 7.3 mi </p>,"<p>HeadLine : Near LagoonSpa</p><p>Location : With a stay at Holiday Saipan Hotel in Saipan, you ll be near the beach, within a 15-minute walk of Micro Beach and American Memorial Park.  This spa hotel is 1.8 mi (2.8 km) from Managaha Island and 3.8 mi (6.2 km) from Saipan Country Club.</p><p>Rooms : Make yourself at home in one of the 30 air-conditioned rooms featuring refrigerators. Rooms have private balconies. Complimentary wireless Internet access is available to keep you connected. Bathrooms have shower/tub combinations and complimentary toiletries.</p><p>CheckIn Instructions : <ul>  <li>Extra-person charges may apply and vary depending on property policy</li><li>Government-issued photo identification and a credit card, debit card, or cash deposit may be required at check-in for incidental charges</li><li>Special requests are subject to availability upon check-in and may incur additional charges; special requests cannot be guaranteed</li><li>This property accepts credit cards; cash is not accepted</li>  </ul></p><p>Special Instructions : The front desk is open daily from 6:00 AM - midnight. If you are planning to arrive after midnight please contact the property in advance using the information on the booking confirmation. Front desk staff will greet guests on arrival.</p>",1-670-2333331,Beach towels Free self parking Accessible bathroom (in select rooms) Tours/ticket assistance Full-service spa Roll-in shower (in select rooms) In-room accessibility (in select rooms) Smoke-free property Free WiFi Scuba diving nearby Front desk (limited hours) Express check-out Wheelchair accessible  no Dry cleaning/laundry service,15.21002|145.718969,+1 670 233 3337,96950,http://www.holidaysaipan.com/english/index.htm
