countyCode,countyName,cityCode,cityName,HotelCode,HotelName,HotelRating,Address,Attractions,Description,FaxNumber,HotelFacilities,Map,PhoneNumber,PinCode,HotelWebsiteUrl
PR,Puerto Rico,112454,Boqueron,1220626,Parador Boquemar,TwoStar,"Carr. 101 Calle Gil Bouyet Poblado Boqueron Cabo Rojo Poblado Boqueron, Cabo Rojo Poblado BoqueronCabo Rojo 00622 ",Distances are displayed to the nearest 0.1 mile and kilometer. <br /> <p>Balneario Boqueron - 0.2 km / 0.1 mi <br /> Tunel Guaniquilla - 3.7 km / 2.3 mi <br /> Buye Beach - 5.4 km / 3.3 mi <br /> Refugio Nacional Cabo Rojo - 7.6 km / 4.7 mi <br /> Cabo Rojo National Wildlife Refuge - 9.3 km / 5.8 mi <br /> Playa Salinas - 11.6 km / 7.2 mi <br /> Combate Beach - 13.2 km / 8.2 mi <br /> La Playita - 13.5 km / 8.4 mi <br /> Club Deportivo Del Oeste - 13.5 km / 8.4 mi <br /> Playa Moja Casabe - 13.8 km / 8.6 mi <br /> Isla de Ratones - 14.1 km / 8.8 mi <br /> Playa Bahía Salinas - 14.3 km / 8.9 mi <br /> Corozo Salt Flats - 14.7 km / 9.2 mi <br /> Playa Azul - 16.5 km / 10.3 mi <br /> Playa Sucia - 16.6 km / 10.3 mi <br /> </p><p>The nearest airports are:<br />Luis Munoz Marin Intl. Airport (SJU) - 191.5 km / 119 mi<br /> Mayagüez (MAZ-Eugenio María de Hostos) - 30.1 km / 18.7 mi<br /> </p><p>The preferred airport for Parador Boquemar is Luis Munoz Marin Intl. Airport (SJU). </p>,"<p>HeadLine : Near Balneario Boqueron</p><p>Location : With a stay at Parador Boquemar in Cabo Rojo, you ll be in the entertainment district, just steps from Balneario Boqueron and a 4-minute drive from Tunel Guaniquilla.  This hotel is 3.3 mi (5.4 km) from Buye Beach and 5.8 mi (9.3 km) from Cabo Rojo National Wildlife Refuge.</p><p>Rooms : Make yourself at home in one of the 75 air-conditioned rooms featuring refrigerators. Cable television is provided for your entertainment. Private bathrooms with showers feature complimentary toiletries and hair dryers. Conveniences include phones, as well as safes and blackout drapes/curtains.</p><p>CheckIn Instructions : <ul>  <li>Extra-person charges may apply and vary depending on property policy</li><li>Government-issued photo identification and a credit card, debit card, or cash deposit may be required at check-in for incidental charges</li><li>Special requests are subject to availability upon check-in and may incur additional charges; special requests cannot be guaranteed</li><li>This property accepts credit cards; cash is not accepted</li><li>Safety features at this property include a carbon monoxide detector, a fire extinguisher, a smoke detector, a security system, and a first aid kit</li><li>Please note that cultural norms and guest policies may differ by country and by property; the policies listed are provided by the property</li>  </ul></p><p>Special Instructions : Front desk staff will greet guests on arrival. At check-in, guests must provide a record of full COVID-19 vaccination. The COVID-19 vaccination record requirement applies to all guests aged 5 and up; guests must have received complete COVID-19 vaccination at least 1 days prior to check-in.  Guests under 5 years old must provide proof of a negative PCR/antigen test (issued within 24 hours before check-in) during check-in.</p>",1-787-851-7600,Banquet hall Wheelchair accessible Ballroom Vending machine Windsurfing nearby Scuba diving nearby Free WiFi Number of outdoor pools - 1 In-room accessibility (in select rooms) Wheelchair accessible parking Free newspapers in lobby Roll-in shower (in select rooms) Tours/ticket assistance Accessible bathroom (in select rooms) Beach towels Multilingual staff 24-hour front desk Golfing nearby Snorkeling nearby Safe-deposit box at front desk Smoke-free property Ecotours nearby Children's pool Kayaking nearby Free self parking Terrace ATM/banking Wheelchair accessible path of travel,18.025598|-67.174052,1 787 8512158,00622,http://www.boquemar.com/
PR,Puerto Rico,112454,Boqueron,1263486,Aquarius Vacation Club at Boqueron Beach Resort,ThreeStar,Carretera 101 Km 18.1 Acceso Balneario De Boqueron Acceso Balneario de Boqueron Acceso Balneario Km 18Boquerón 00622 ,Distances are displayed to the nearest 0.1 mile and kilometer. <br /> <p>Balneario Boqueron - 0.3 km / 0.2 mi <br /> Tunel Guaniquilla - 4.3 km / 2.6 mi <br /> Buye Beach - 6.3 km / 3.9 mi <br /> Refugio Nacional Cabo Rojo - 7.3 km / 4.5 mi <br /> Cabo Rojo National Wildlife Refuge - 9 km / 5.6 mi <br /> Playa Salinas - 11.6 km / 7.2 mi <br /> Combate Beach - 13.2 km / 8.2 mi <br /> La Playita - 13.4 km / 8.3 mi <br /> Club Deportivo Del Oeste - 13.5 km / 8.4 mi <br /> Playa Moja Casabe - 13.5 km / 8.4 mi <br /> Isla de Ratones - 14.1 km / 8.8 mi <br /> Playa Bahía Salinas - 14.3 km / 8.9 mi <br /> Corozo Salt Flats - 14.4 km / 9 mi <br /> Playa Azul - 16.5 km / 10.2 mi <br /> Playa Sucia - 16.6 km / 10.3 mi <br /> </p><p>The nearest airports are:<br />Luis Munoz Marin Intl. Airport (SJU) - 191.4 km / 118.9 mi<br /> Mayagüez (MAZ-Eugenio María de Hostos) - 30.1 km / 18.7 mi<br /> </p><p></p>,"<p>HeadLine : Near Balneario Boqueron</p><p>Location : Located in Cabo Rojo, Aquarius Vacation Club at Boqueron Beach Resort is in the mountains, a 1-minute drive from Balneario Boqueron and 5 minutes from Tunel Guaniquilla.  This beach hotel is 3.9 mi (6.3 km) from Buye Beach and 10.9 mi (17.5 km) from Mayagüez Mall.</p><p>Rooms : Make yourself at home in one of the 88 guestrooms featuring microwaves. Complimentary wireless Internet access keeps you connected, and cable programming is available for your entertainment. Bathrooms have complimentary toiletries and hair dryers. Conveniences include phones, as well as safes and desks.</p><p>Dining : Enjoy Latin American cuisine at Piscis Cafe & Bar, a poolside family restaurant which features a bar/lounge. Wrap up your day with a drink at the poolside bar.</p><p>CheckIn Instructions : <ul>  <li>Extra-person charges may apply and vary depending on property policy</li><li>Government-issued photo identification and a credit card may be required at check-in for incidental charges</li><li>Special requests are subject to availability upon check-in and may incur additional charges; special requests cannot be guaranteed</li><li>Minimum Spring Break check-in age is 21 years old</li><li>The name on the credit card used at check-in to pay for incidentals must be the primary name on the guestroom reservation</li><li>This property accepts credit cards; cash is not accepted</li><li>Safety features at this property include a carbon monoxide detector, a fire extinguisher, a smoke detector, and a security system</li><li>Please note that cultural norms and guest policies may differ by country and by property; the policies listed are provided by the property</li>  </ul></p><p>Special Instructions : The front desk is open daily from 7:00 AM - 11:00 PM. To make arrangements for check-in please contact the property at least 72 hours before arrival using the information on the booking confirmation. If you are planning to arrive after 5 PM please contact the property in advance using the information on the booking confirmation. Guests will receive an email 72 hours before arrival with check-in instructions. Front desk staff will greet guests on arrival. For more details, please contact the property using the information on the booking confirmation.  This hotels reception is open daily from 7 AM to midnight.</p>",1-787-254-5402,Marina nearby Ecotours nearby Rafting nearby elevator Fitness facilities Mountain biking nearby Wheelchair accessible Gated community Pool umbrellas Swimming nearby Sailing nearby Scuba diving nearby Free WiFi Number of bars/lounges - 1 Designated smoking areas Number of poolside bars - 1 Number of outdoor pools - 1 Assistive listening devices available Water skiing nearby In-room accessibility (in select rooms) Bicycle rentals nearby Wheelchair accessible parking Accessible bathroom (in select rooms) Golf lessons available nearby Multilingual staff Parasailing nearby Fishing nearby Vending machine Fully fenced Windsurfing nearby Arcade/game room Garden Beach towels Walkway to water Luggage storage Front desk (limited hours) Playground on site Golfing nearby Snorkeling nearby Hiking/biking trails nearby Children's pool Surfing/bodyboarding nearby Kayaking nearby Water park Self parking (surcharge) Waterslide Wheelchair accessible path of travel Pool sun loungers,18.023968|-67.169744,+1 787 254 5400,00622,http://www.aquariusvacationclub.com/
PR,Puerto Rico,112454,Boqueron,1454180,Cofresi Beach Hotel,ThreeStar,"Boquerón, PR Boqueron 00622 ",,"Situated facing Boqueron Bay, Cofresí Beach Hotel is an apartment complex that offers sun terraces by the outdoor pool, free Wi-Fi access in public areas and private parking on site.

The air-conditioned apartments can have 1, 2 or 3 separate bedrooms, private bathrooms with shower and an equipped kitchen with hob, fridge and microwave. They also feature a seating and dining area and views of the gardens. Apartments include cable TV and a coffee machine.

Within a 5-minute walk, guests at Cofresí Beach Hotel will be able to find a variety of restaurant options, mostly offering international-style and local cuisine.

Balneario Beach is just 5 minutes walk from Cofresí Beach Hotel and Boqueron Natural Reserve is 100 metres away.
Boqueron Domestic Airport can be reached in a short 5-minute drive from Cofresí Beach Hotel.",+1(0)7872541048,Free self parking Free newspapers in lobby Garden Terrace Fishing Facilities for disabled guests Family rooms Internet access Elevator/lift Safe-deposit box at front desk Tour desk Free WiFi Outdoor pool Free WiFi Non-smoking throughout Air conditioning Terrace Concierge services Private check-in/check-out Vending machine - Snacks & Drink Parking onsite Private parking Public Bath Children television networks Wheelchair accessible Toilet with grab rails Lower bathroom sink Rooftop pool,18.02614|-67.17031,+17872543000,00622,https://www.booking.com/hotel/pr/cofresa-beach.html
PR,Puerto Rico,112454,Boqueron,1484249,Boho Beach Club,TwoStar,Carr. 101 Km 18.1 00622 Boqueron ,Distances are displayed to the nearest 0.1 mile and kilometer. <br /> <p>Balneario Boqueron - 0.6 km / 0.4 mi <br /> Tunel Guaniquilla - 3.9 km / 2.4 mi <br /> Buye Beach - 5.7 km / 3.5 mi <br /> Refugio Nacional Cabo Rojo - 7 km / 4.3 mi <br /> Cabo Rojo National Wildlife Refuge - 8.7 km / 5.4 mi <br /> Playa Salinas - 10.9 km / 6.8 mi <br /> Combate Beach - 12.6 km / 7.8 mi <br /> Club Deportivo Del Oeste - 12.8 km / 7.9 mi <br /> La Playita - 12.8 km / 8 mi <br /> Playa Moja Casabe - 13.1 km / 8.1 mi <br /> Isla de Ratones - 13.5 km / 8.4 mi <br /> Playa Bahía Salinas - 13.7 km / 8.5 mi <br /> Corozo Salt Flats - 14.1 km / 8.8 mi <br /> Playa Azul - 15.9 km / 9.8 mi <br /> Playa Sucia - 15.9 km / 9.9 mi <br /> </p><p>The nearest airports are:<br />Luis Munoz Marin Intl. Airport (SJU) - 190.8 km / 118.6 mi<br /> Mayagüez (MAZ-Eugenio María de Hostos) - 29.4 km / 18.3 mi<br /> </p><p>The preferred airport for Boho Beach Club is Luis Munoz Marin Intl. Airport (SJU). </p>,"<p>HeadLine : Near Balneario Boqueron</p><p>Location : Located in Cabo Rojo, Boho Beach Club is within a 15-minute drive of Buye Beach and Cabo Rojo National Wildlife Refuge.  This hotel is 7.8 mi (12.6 km) from Combate Beach and 7.9 mi (12.8 km) from Club Deportivo Del Oeste.</p><p>Rooms : Make yourself at home in one of the 75 air-conditioned rooms featuring refrigerators. Private bathrooms with showers feature rainfall showerheads and complimentary toiletries. Conveniences include coffee/tea makers, as well as phones with free local calls.</p><p>Dining : Satisfy your appetite with international cuisine at Boho Kitchen, a restaurant which features a bar/lounge. Dining is also available at the coffee shop/cafe. Cooked-to-order breakfasts are available daily from 8:00 AM to noon for a fee.</p><p>Renovations : The following facilities are closed on Sunday, Monday, Tuesday, Wednesday, and Thursday: <ul><li>Children s pool</li><li>Outdoor pool</li></ul> The following facilities are closed on Friday and Saturday: <ul><li>Indoor pool</li><li>Outdoor pool</li></ul></p><p>CheckIn Instructions : <ul>  <li>Extra-person charges may apply and vary depending on property policy</li><li>Government-issued photo identification and a credit card, debit card, or cash deposit may be required at check-in for incidental charges</li><li>Special requests are subject to availability upon check-in and may incur additional charges; special requests cannot be guaranteed</li><li>This property accepts credit cards and cash</li>  </ul></p><p>Special Instructions : Front desk staff will greet guests on arrival.</p>",1-787-8517155,Wedding services Tours/ticket assistance Accessible bathroom (in select rooms) Free bicycles on site Golf driving range on site Golf lessons on site Golf caddy Clubhouse Multilingual staff 24-hour front desk Conference center Breakfast available (surcharge) Smoke-free property Number of coffee shops/cafes - 1 Ecotours on site elevator Free self parking Conference space ATM/banking Wheelchair accessible path of travel Conference space size (feet) - 4000 secured parking Uncovered parking Banquet hall Golf cart Casino nearby Number of meeting rooms - 1 Water sports equipment Conference space size (meters) - 372 Change of bed sheets (on request) Swimming pool Number of bars/lounges - 1 Number of outdoor pools - 2 Change of towels (on request) Garden Wheelchair accessible parking Concierge services,18.02707|-67.168828,+1 787 8517110,00622,http://bohobeachclubpr.com/
PR,Puerto Rico,112454,Boqueron,1621362,El Velero Boquerón,TwoStar,Carretera 307 Km. 9.3 Calle Enrique Aymat Boqueron 00622 ,Distances are displayed to the nearest 0.1 mile and kilometer. <br /> <p>Balneario Boqueron - 0.7 km / 0.4 mi <br /> Tunel Guaniquilla - 3.8 km / 2.3 mi <br /> Buye Beach - 5.8 km / 3.6 mi <br /> Refugio Nacional Cabo Rojo - 7.1 km / 4.4 mi <br /> Cabo Rojo National Wildlife Refuge - 8.7 km / 5.4 mi <br /> Combate Beach - 12.6 km / 7.9 mi <br /> Club Deportivo Del Oeste - 12.9 km / 8 mi <br /> Isla de Ratones - 13.6 km / 8.4 mi <br /> Cabo Rojo Lighthouse - 15.8 km / 9.8 mi <br /> Playa Sucia - 16.1 km / 10 mi <br /> Mayagüez Mall - 16.9 km / 10.5 mi <br /> Bioluminescent Bay - 18.3 km / 11.4 mi <br /> Church of Porta Coeli - 18.6 km / 11.5 mi <br /> Casa Morales - 18.6 km / 11.6 mi <br /> Catedral de San German de Auxerre - 18.6 km / 11.6 mi <br /> </p><p>The nearest airports are:<br />Mayaguez (MAZ-Eugenio Maria de Hostos) - 29.6 km / 18.4 mi<br /> Aguadilla (BQN-Rafael Hernandez) - 58.4 km / 36.3 mi<br /> </p><p>The preferred airport for El Velero Boquerón is Aguadilla (BQN-Rafael Hernandez). </p>,"<p><b>Property Location</b> <br />Located in Boqueron, El Velero Boquerón is by the ocean, a 2-minute drive from Balneario Boqueron and 9 minutes from Refugio Nacional Cabo Rojo.  This aparthotel is 9.8 mi (15.8 km) from Cabo Rojo Lighthouse and 10 mi (16.1 km) from Playa Sucia.</p><p><b>Rooms</b> <br />Make yourself at home in one of the 7 individually decorated guestrooms, featuring kitchens with refrigerators and stovetops. Rooms have private balconies. Flat-screen televisions are provided for your entertainment. Conveniences include microwaves and coffee/tea makers, and housekeeping is provided on a limited basis.</p><p><b>Amenities</b> <br />Take in the views from a terrace and a garden.</p><p><b>Business, Other Amenities</b> <br />Featured amenities include express check-out and multilingual staff. Free self parking is available onsite.</p>",,Year Built - 2002 Total number of rooms - 7 Terrace Smoke-free property Parking (limited spaces) Number of floors - 3 Number of buildings/towers - 1 Multilingual staff Garden Free self parking Express check-out,18.027160645|-67.169822693,+17876648557,00623,http://www.velerocondominiumpuertorico.com/
PR,Puerto Rico,112454,Boqueron,1673492,Vistas De La Bahia,TwoStar,Carr. #307 Km 7.4 Boqueron 00623 ,Distances are displayed to the nearest 0.1 mile and kilometer. <br /> <p>Balneario Boqueron - 2.1 km / 1.3 mi <br /> Tunel Guaniquilla - 3.2 km / 2 mi <br /> Buye Beach - 3.8 km / 2.4 mi <br /> Refugio Nacional Cabo Rojo - 9.4 km / 5.8 mi <br /> La Playita - 9.7 km / 6 mi <br /> Cabo Rojo National Wildlife Refuge - 10.7 km / 6.6 mi <br /> Playa Salinas - 13 km / 8.1 mi <br /> Club Deportivo Del Oeste - 13.2 km / 8.2 mi <br /> Isla de Ratones - 13.9 km / 8.7 mi <br /> Combate Beach - 14.6 km / 9.1 mi <br /> Playa Moja Casabe - 15.1 km / 9.4 mi <br /> Playa Bahía Salinas - 15.7 km / 9.7 mi <br /> Corozo Salt Flats - 16.1 km / 10 mi <br /> Playa Azul - 16.3 km / 10.1 mi <br /> Playa Punta Arenas - 16.7 km / 10.3 mi <br /> </p><p>The nearest airports are:<br />Luis Munoz Marin Intl. Airport (SJU) - 192.8 km / 119.8 mi<br /> Mayagüez (MAZ-Eugenio María de Hostos) - 29.9 km / 18.6 mi<br /> </p><p></p>,"<p>HeadLine : Near Tunel Guaniquilla</p><p>Location : When you stay at Vistas de la Bahia in Cabo Rojo, you ll be in the historical district, within a 5-minute drive of Tunel Guaniquilla and Balneario Boqueron.  This hotel is 2.2 mi (3.6 km) from Buye Beach and 10.8 mi (17.4 km) from Mayagüez Mall.</p><p>Rooms : Make yourself at home in one of the 23 air-conditioned rooms featuring flat-screen televisions. Rooms have private balconies or patios. Complimentary wireless Internet access keeps you connected, and satellite programming is available for your entertainment. Private bathrooms with showers feature complimentary toiletries and hair dryers.</p><p>CheckIn Instructions : <ul>  <li>Extra-person charges may apply and vary depending on property policy</li><li>Government-issued photo identification and a credit card, debit card, or cash deposit may be required at check-in for incidental charges</li><li>Special requests are subject to availability upon check-in and may incur additional charges; special requests cannot be guaranteed</li><li>This property accepts credit cards; cash is not accepted</li><li>Safety features at this property include a carbon monoxide detector, a fire extinguisher, a smoke detector, a security system, and a first aid kit</li>  </ul></p><p>Special Instructions : The front desk is open during the following times:<ul><li>Monday - Wednesday: 9:00 AM - 6:00 PM</li></ul> <ul><li>Thursday - Sunday: 9:00 AM - 8:00 PM</li></ul>This property doesn t offer after-hours check-in. To make arrangements for check-in please contact the property at least 72 hours before arrival using the information on the booking confirmation. Guests must contact the property in advance for check-in instructions. Front desk staff will greet guests on arrival.</p>",,Parking (limited spaces) Sailing nearby Windsurfing nearby Scuba diving nearby Free WiFi Number of outdoor pools - 2 Water skiing nearby Garden Picnic area In-room accessibility (in select rooms) Wheelchair accessible parking Accessible bathroom (in select rooms) Boat tours nearby Parasailing nearby Smoke-free property Children's pool Surfing/bodyboarding nearby Rafting nearby Kayaking nearby Free self parking Snorkeling on site Terrace Wheelchair accessible path of travel Pool sun loungers Concierge services,18.037274|-67.180118,1-939-3499730,00623,
PR,Puerto Rico,112454,Boqueron,5701632,El Retiro Lot 1 Poblado BoquerÓn,All,El Retiro Lot 1  ,,"Boasting city views, El Poblado Boquerón Cabo Rojo features accommodation with barbecue facilities and a balcony, around 19 km from Porta Coeli Religious Art Museum. Set 1.8 km from Boqueron Beach, the property offers a terrace and free private parking.

The air-conditioned holiday home consists of 2 bedrooms, a living room, a fully equipped kitchen with a fridge and a coffee machine, and 2 bathrooms with a shower and free toiletries. Towels and bed linen are offered in the holiday home.

If you would like to discover the area, fishing is possible in the surroundings.

Guanica Dry Forest is 39 km from the holiday home, while La Parguera BioBay is 19 km from the property. The nearest airport is Eugenio Maria de Hostos Airport, 30 km from El Poblado Boquerón Cabo Rojo. This property will not accommodate hen, stag or similar parties.
Please inform El Poblado Boquerón Cabo Rojo in advance of your expected arrival time. You can use the Special Requests box when booking, or contact the property directly with the contact details provided in your confirmation.
A damage deposit of USD 100 is required on arrival. This will be collected as a cash payment. You should be reimbursed on check-out. Your deposit will be refunded in full in cash, subject to an inspection of the property.
Managed by a private host",,guest accommodation is disinfected between stays linens  towels and laundry washed in accordance with local authority guidelines use of cleaning chemicals that are effective against coronavirus Fire extinguishers Smoke alarms Beach Outdoor furniture Accessible parking Parking garage secured parking Private parking parking on site Air conditioning Non-smoking throughout Diving staff follow all safety protocols as directed by local authorities BBQ facilities Canoeing Free parking Family rooms Fishing Non-smoking rooms Terrace Parking,18.03216|-67.17339,,00623,https://www.booking.com/hotel/pr/el-retiro-lot-1-poblado-boqueron.html
PR,Puerto Rico,112454,Boqueron,5769944,El Velero En Boqueron,All,Calle Aymat 101  ,,"Featuring city views, El Velero en Boqueron provides accommodation with a balcony, around 19 km from Porta Coeli Religious Art Museum. Set less than 1 km from Boqueron Beach, the property offers a garden and free private parking.

The air-conditioned apartment consists of 2 bedrooms, a living room, a fully equipped kitchen with a fridge and a coffee machine, and 1 bathroom with a bath or shower and a hairdryer. Towels and bed linen are featured in the apartment.

Guanica Dry Forest is 39 km from the apartment, while La Parguera BioBay is 18 km away. The nearest airport is Eugenio Maria de Hostos Airport, 29 km from El Velero en Boqueron. A damage deposit of USD 150 is required. The host charges this 14 days before arrival. This will be collected by credit card. You should be reimbursed within 7 days of check-out. Your deposit will be refunded in full via credit card, subject to an inspection of the property.
Managed by a private host",,Fire extinguishers Beach Street parking secured parking Private parking parking on site Air conditioning Non-smoking throughout Free WiFi wifi internet services Free parking Non-smoking rooms Garden Pets allowed Parking,18.02728|-67.16983,,00623,https://www.booking.com/hotel/pr/el-velero-en-boqueron.html
PR,Puerto Rico,112454,Boqueron,5810854,El Velero En Boqueron 201,All,Calle Aymat 201 Second Floor Condominio El Velero  ,,"Boasting city views, El Velero en Boqueron 201 provides accommodation with a balcony, around less than 1 km from Boqueron Beach. Featuring free private parking, the apartment is in an area where guests can engage in activities such as hiking and fishing.

The air-conditioned apartment consists of 2 bedrooms, a living room, a fully equipped kitchen with a fridge and a coffee machine, and 1 bathroom with a bath or shower and a hairdryer. Towels and bed linen are provided in the apartment.

Porta Coeli Religious Art Museum is 19 km from the apartment, while Guanica Dry Forest is 39 km away. The nearest airport is Eugenio Maria de Hostos Airport, 29 km from El Velero en Boqueron 201. This property will not accommodate hen, stag or similar parties.
A damage deposit of USD 150 is required. The host charges this 14 days before arrival. This will be collected by credit card. You should be reimbursed within 7 days of check-out. Your deposit will be refunded in full via credit card, subject to an inspection of the property.
Managed by a private host",,Parking Pets allowed Non-smoking rooms Fishing Free parking internet services Hiking wifi Free WiFi Non-smoking throughout Air conditioning parking on site Private parking,18.0273|-67.16988,,00623,https://www.booking.com/hotel/pr/el-velero-en-boqueron-201.html
