countyCode,countyName,cityCode,cityName,HotelCode,HotelName,HotelRating,Address,Attractions,Description,FaxNumber,HotelFacilities,Map,PhoneNumber,PinCode,HotelWebsiteUrl
PR,Puerto Rico,113521,Carolina,1015339,Royal Sonesta San Juan,FourStar,5961 Isla Verde Avenue San Juan 00979 ,Distances are displayed to the nearest 0.1 mile and kilometer. <br /> <p>Isla Verde Beach - 0.3 km / 0.2 mi <br /> Carolina Beach - 0.5 km / 0.3 mi <br /> Pine Grove Beach - 0.9 km / 0.5 mi <br /> Statue of Ponce de Leon - 3.2 km / 2 mi <br /> Calle Loiza - 3.7 km / 2.3 mi <br /> Playa Ocean Park - 4.8 km / 3 mi <br /> Balneario de Carolina - 2 km / 1.2 mi <br /> San Jorge Children s Hospital - 4.9 km / 3.1 mi <br /> Museo de Arte Contemporaneo de Puerto Rico - 5.1 km / 3.2 mi <br /> The Mall of San Juan - 5.3 km / 3.3 mi <br /> Museo de Arte de Puerto Rico - 5.6 km / 3.5 mi <br /> Centro Europa - 5.9 km / 3.7 mi <br /> Plaza Antonia Quinones - 6 km / 3.7 mi <br /> Centro de Bellas Artes Luis A. Ferre - 6 km / 3.7 mi <br /> Atlantic Beach - 6.2 km / 3.8 mi <br /> </p><p>The preferred airport for The Royal Sonesta San Juan is Luis Munoz Marin Intl. Airport (SJU) - 4.7 km / 2.9 mi </p>,"<p>HeadLine : In Carolina (Isla Verde)</p><p>Location : Located in Carolina (Isla Verde), The Royal Sonesta San Juan is within a 10-minute drive of Port of San Juan and Casino del Mar at La Concha Resort.  This 4-star hotel is 0.3 mi (0.5 km) from Carolina Beach and 3.8 mi (6.2 km) from Jose Miguel Agrelot Coliseum.</p><p>Rooms : Make yourself at home in one of the 398 individually decorated guestrooms, featuring iPod docking stations and minibars. Rooms have private balconies. 42-inch flat-screen televisions with cable programming provide entertainment, while complimentary wireless Internet access keeps you connected. Private bathrooms with showers feature complimentary toiletries and hair dryers.</p><p>Dining : Grab a bite at Karaya, one of the hotel s 3 restaurants, or stay in and take advantage of the room service (during limited hours). Snacks are also available at the coffee shop/cafe. When you are in need of a refreshing drink, visit the poolside bar or one of 2 bars/lounges, or 2 beach bars. Buffet breakfasts are available daily from 6:00 AM to 11:00 AM for a fee.</p><p>CheckIn Instructions : <ul>  <li>Extra-person charges may apply and vary depending on property policy</li><li>Government-issued photo identification and a credit card, debit card, or cash deposit may be required at check-in for incidental charges</li><li>Special requests are subject to availability upon check-in and may incur additional charges; special requests cannot be guaranteed</li><li>This property accepts credit cards; cash is not accepted</li><li>Safety features at this property include a carbon monoxide detector, a fire extinguisher, a smoke detector, a security system, a first aid kit, and window guards</li><li>Please note that cultural norms and guest policies may differ by country and by property; the policies listed are provided by the property</li>  </ul></p><p>Special Instructions : Front desk staff will greet guests on arrival.</p>",1-787-253-2510,Number of beach bars - 2 Assistive listening devices available Number of swim-up bars - 1 Water skiing nearby In-room accessibility (in select rooms) Bicycle rentals nearby Wheelchair accessible parking Roll-in shower (in select rooms) Tours/ticket assistance Accessible bathroom (in select rooms) RV  bus  truck parking No accessible shuttle Golf lessons available nearby Gift shops or newsstand Ziplining nearby Pool umbrellas Number of meeting rooms - 16 Conference space size (meters) - 2230 Swimming nearby Sailing nearby Scuba diving nearby Multilingual staff Parasailing nearby Personal motor watercraft nearby Breakfast available (surcharge) Number of accessible parking spaces - 20 Long-term parking Number of coffee shops/cafes - 1 elevator Fitness facilities Banquet hall Wheelchair accessible (may have limitations) Ballroom Beach umbrellas Change of bed sheets (on request) Wheelchair-accessible registration desk Television in common areas Windsurfing nearby Free WiFi Number of bars/lounges - 2 Number of poolside bars - 1 Braille or raised signage Number of outdoor pools - 1 Porter/bellhop 24-hour front desk Scooter/moped rentals nearby Golfing nearby Spa services on site Snorkeling nearby Smoke-free property Snack bar/deli Kayaking nearby Skydiving Nearby Spa treatment room(s) Change of towels (on request) Garden Full-service spa Wedding services Beach towels Boat tours nearby Luggage storage Express check-out Conference space Self parking (surcharge) Pool cabanas (surcharge) Valet parking (surcharge) Hair salon Beach sun loungers Terrace ATM/banking Wheelchair accessible path of travel Pool sun loungers Conference space size (feet) - 24000 Concierge services,18.442383|-66.01966,1-787-7916100,00979,http://www.interconti.com
PR,Puerto Rico,113521,Carolina,1016109,San Juan Water Beach Club Hotel,FourStar,2 Tartak Street Isla VerdeSan Juan 00979 ,Distances are displayed to the nearest 0.1 mile and kilometer. <br /> <p>Carolina Beach - 0.1 km / 0.1 mi <br /> Isla Verde Beach - 0.2 km / 0.1 mi <br /> Pine Grove Beach - 1.3 km / 0.8 mi <br /> Balneario de Carolina - 2.4 km / 1.5 mi <br /> Statue of Ponce de Leon - 3.4 km / 2.1 mi <br /> Calle Loiza - 3.4 km / 2.1 mi <br /> Playa Ocean Park - 4.6 km / 2.8 mi <br /> San Jorge Children s Hospital - 4.8 km / 3 mi <br /> Museo de Arte Contemporaneo de Puerto Rico - 5.3 km / 3.3 mi <br /> Museo de Arte de Puerto Rico - 5.7 km / 3.5 mi <br /> The Mall of San Juan - 5.8 km / 3.6 mi <br /> Centro Europa - 6.1 km / 3.8 mi <br /> Plaza Antonia Quinones - 6.1 km / 3.8 mi <br /> Centro de Bellas Artes Luis A. Ferre - 6.1 km / 3.8 mi <br /> Atlantic Beach - 6.3 km / 3.9 mi <br /> </p><p>The preferred airport for San Juan Water and Beach Club is Luis Munoz Marin Intl. Airport (SJU) - 4.7 km / 2.9 mi </p>,"<p>HeadLine : In Carolina (Isla Verde)</p><p>Location : With a stay at San Juan Water and Beach Club, you ll be centrally located in Carolina, within a 10-minute drive of Port of San Juan and Casino del Mar at La Concha Resort.  This 4-star hotel is 0.1 mi (0.1 km) from Carolina Beach and 3.9 mi (6.3 km) from Jose Miguel Agrelot Coliseum.</p><p>Rooms : Make yourself at home in one of the 80 guestrooms featuring espresso makers. Complimentary wireless Internet access is available to keep you connected. Bathrooms have designer toiletries and hair dryers. Conveniences include safes and complimentary bottled water, as well as phones with free local calls.</p><p>Dining : Satisfy your appetite at Kumo Rooftop, one of the hotel s 2 restaurants. Need to unwind? Take a break with a tasty beverage at one of the 2 bars/lounges.</p><p>CheckIn Instructions : <ul>  <li>Extra-person charges may apply and vary depending on property policy</li><li>Government-issued photo identification and a credit card may be required at check-in for incidental charges</li><li>Special requests are subject to availability upon check-in and may incur additional charges; special requests cannot be guaranteed</li><li>The name on the credit card used at check-in to pay for incidentals must be the primary name on the guestroom reservation</li><li>This property accepts credit cards; cash is not accepted</li><li>Safety features at this property include a carbon monoxide detector, a fire extinguisher, a smoke detector, a security system, a first aid kit, and window guards</li><li>Please note that cultural norms and guest policies may differ by country and by property; the policies listed are provided by the property</li>  </ul> <ul>  <li>This property requires a credit card deposit for any bookings where payment for the stay will be made on site instead of at the time of booking.</li>  </ul></p><p>Special Instructions : Front desk staff will greet guests on arrival. For more details, please contact the property using the information on the booking confirmation.</p>",787-2686073,Snorkeling nearby Safe-deposit box at front desk Smoke-free property Kayaking nearby Fitness facilities Beach sun loungers Terrace ATM/banking Pool sun loungers Concierge services Multilingual staff Luggage storage Wheelchair accessible  no LED light bulbs Eco-friendly toiletries Rooftop terrace Beach towels Tours/ticket assistance Bicycle rentals nearby Number of outdoor pools - 1 Number of bars/lounges - 2 Free WiFi Scuba diving nearby Windsurfing nearby Sailing nearby Pool umbrellas secured parking Golfing nearby Beach umbrellas 24-hour front desk Parasailing nearby,18.443642|-66.022913,787-7283666,00979,http://waterbeachhotel.com/
PR,Puerto Rico,113521,Carolina,1081655,Coqui Inn,ThreeStar,"Calle Mar Mediterraneo, 36 ISLA VERDE ",,This comfortable hotel is in Isla Verde. No pets are allowed on the premises.,7872682415,Hotel,18.44285|-66.02871,+10000000000,979,http://www.coqui-inn.com
PR,Puerto Rico,113521,Carolina,1097220,Embassy Suites by Hilton San Juan Hotel & Casino,ThreeStar,8000 Tartak Street CarolinaSan Juan 00979 ,Distances are displayed to the nearest 0.1 mile and kilometer. <br /> <p>Isla Verde Beach - 0.5 km / 0.3 mi <br /> Carolina Beach - 0.6 km / 0.4 mi <br /> Pine Grove Beach - 1.4 km / 0.8 mi <br /> Balneario de Carolina - 2.4 km / 1.5 mi <br /> Statue of Ponce de Leon - 3.3 km / 2.1 mi <br /> Calle Loiza - 3.8 km / 2.4 mi <br /> Playa Ocean Park - 5 km / 3.1 mi <br /> San Jorge Children s Hospital - 4.7 km / 2.9 mi <br /> Museo de Arte Contemporaneo de Puerto Rico - 5 km / 3.1 mi <br /> Museo de Arte de Puerto Rico - 5.4 km / 3.3 mi <br /> Centro Europa - 5.7 km / 3.6 mi <br /> The Mall of San Juan - 5.8 km / 3.6 mi <br /> Centro de Bellas Artes Luis A. Ferre - 5.8 km / 3.6 mi <br /> Plaza Antonia Quinones - 5.8 km / 3.6 mi <br /> Atlantic Beach - 6 km / 3.7 mi <br /> </p><p>The preferred airport for Embassy Suites by Hilton San Juan Hotel & Casino is Luis Munoz Marin Intl. Airport (SJU) - 5.2 km / 3.2 mi </p>,"<p>HeadLine : Near Isla Verde Beach</p><p>Location : With a stay at Embassy Suites by Hilton San Juan Hotel & Casino in Carolina (Isla Verde), you ll be a 1-minute drive from Isla Verde Beach and 7 minutes from Condado Beach.  This casino resort is 5.5 mi (8.9 km) from Plaza las Americas and 5.6 mi (9 km) from Puerto Rico Convention Center.</p><p>Rooms : Make yourself at home in one of the 313 air-conditioned rooms featuring refrigerators and microwaves. Wired and wireless Internet access is complimentary, while 55-inch flat-screen televisions with cable programming provide entertainment. Private bathrooms with shower/tub combinations feature complimentary toiletries and hair dryers. Conveniences include laptop-compatible safes and complimentary weekday newspapers, as well as phones with free local calls.</p><p>Dining : Grab a bite to eat at El Patio, a restaurant which features a bar/lounge, or stay in and take advantage of the room service. Quench your thirst with your favorite drink at the poolside bar. A complimentary cooked-to-order breakfast is served on weekdays from 6:30 AM to 9:00 AM and on weekends from 7:30 AM to 10:00 AM.</p><p>CheckIn Instructions : <ul>  <li>Extra-person charges may apply and vary depending on property policy</li><li>Government-issued photo identification and a credit card, debit card, or cash deposit may be required at check-in for incidental charges</li><li>Special requests are subject to availability upon check-in and may incur additional charges; special requests cannot be guaranteed</li><li>This property accepts credit cards, debit cards, and cash</li><li>Safety features at this property include a smoke detector</li><li>Please note that cultural norms and guest policies may differ by country and by property; the policies listed are provided by the property</li>  </ul></p><p>Special Instructions : Front desk staff will greet guests on arrival.</p>",1-787-791-7776,Computer station Beach sun loungers Wheelchair accessible path of travel Pool sun loungers Conference space size (feet) - 12000 24-hour business center Spa services on site Golfing nearby Coin laundry on site Windsurfing nearby Meeting rooms Beach umbrellas Covered parking Wheelchair accessible (may have limitations) Casino nearby Covered parking Casino Ecotours nearby Barbecue grill(s) Daily Parasailing nearby Free breakfast Free Cooked-to-Order Breakfast Conference space size (meters) - 1115 Pool umbrellas Dry cleaning/laundry service Gift shops or newsstand Concierge services ATM/banking Terrace Playground on site 24-hour front desk Business center Porter/bellhop Express check-out Luggage storage Couples/private dining 24-hour fitness facilities Beach towels Wedding services Free newspapers in lobby Stair-free path to entrance Well-lit path to entrance Wheelchair-accessible pool Wheelchair-accessible fitness center Television in common areas Wheelchair-accessible registration desk Valet for wheelchair-equipped vehicle Wheelchair-accessible path to elevator Fully fenced Wheelchair-accessible van parking Reception hall Wheelchair-accessible concierge desk Vending machine Ballroom Wheelchair accessible Banquet hall Fitness facilities elevator Laundry facilities Number of coffee shops/cafes - 1 Wheelchair-accessible meeting spaces/business center Personal motor watercraft nearby Multilingual staff Wheelchair-accessible on-site restaurant Eco-friendly toiletries Casino floor size square meters - 60 Accessible bathroom (in select rooms) Tours/ticket assistance Roll-in shower (in select rooms) Wheelchair accessible parking In-room accessibility (in select rooms) Assistive listening devices available Number of outdoor pools - 1 Braille or raised signage Number of poolside bars - 1 Number of spa tubs - 1 Number of bars/lounges - 1 Casino floor size square feet - 650 Free WiFi Scuba diving nearby Valet parking (surcharge) Sailing nearby Self parking (surcharge) Free wired Internet Conference space Bingo Kayaking nearby Swimming nearby Surfing/bodyboarding nearby Number of gaming tables - 6 Children's pool Water sports equipment Hiking/biking trails nearby Number of VIP gaming rooms - 1 Safe-deposit box at front desk Snorkeling nearby Outdoor furniture Number of slot machines - 114,18.43994|-66.02223,1-787-791-0505,00979,http://embassysuites.hilton.com/en/es/hotels/index.jhtml?ctyhocn=SJUESES
PR,Puerto Rico,113521,Carolina,1100322,Hampton Inn & Suites San Juan,ThreeStar,6530 Isla Verde Avenue San Juan 00979 ,Distances are displayed to the nearest 0.1 mile and kilometer. <br /> <p>Isla Verde Beach - 0.3 km / 0.2 mi <br /> Pine Grove Beach - 0.5 km / 0.3 mi <br /> Carolina Beach - 0.8 km / 0.5 mi <br /> Statue of Ponce de Leon - 3.6 km / 2.2 mi <br /> Calle Loiza - 4.1 km / 2.5 mi <br /> Balneario de Carolina - 1.6 km / 1 mi <br /> The Mall of San Juan - 4.9 km / 3.1 mi <br /> Playa Ocean Park - 5.2 km / 3.2 mi <br /> San Jorge Children s Hospital - 5.3 km / 3.3 mi <br /> Museo de Arte Contemporaneo de Puerto Rico - 5.5 km / 3.4 mi <br /> Museo de Arte de Puerto Rico - 5.9 km / 3.7 mi <br /> Centro Europa - 6.3 km / 3.9 mi <br /> Plaza Antonia Quinones - 6.4 km / 4 mi <br /> Centro de Bellas Artes Luis A. Ferre - 6.4 km / 4 mi <br /> Atlantic Beach - 6.5 km / 4.1 mi <br /> </p><p>The preferred airport for Hampton Inn & Suites San Juan is Luis Munoz Marin Intl. Airport (SJU) - 4.4 km / 2.7 mi </p>,"<p>HeadLine : In Carolina (Isla Verde)</p><p>Location : Located in Carolina (Isla Verde), Hampton Inn & Suites San Juan is within a 10-minute drive of Port of San Juan and Casino del Mar at La Concha Resort.  This hotel is 0.5 mi (0.9 km) from Carolina Beach and 4.1 mi (6.5 km) from Jose Miguel Agrelot Coliseum.</p><p>Rooms : Make yourself at home in one of the 201 guestrooms featuring refrigerators and LCD televisions. Complimentary wired and wireless Internet access keeps you connected, and cable programming provides entertainment. Private bathrooms with shower/tub combinations feature deep soaking bathtubs and complimentary toiletries. Conveniences include safes and desks, and housekeeping is provided daily.</p><p>Dining : Enjoy a satisfying meal at Guacamayo Pool Bar serving guests of Hampton Inn & Suites San Juan. Unwind at the end of the day with a drink at the bar/lounge or the poolside bar. A complimentary buffet breakfast is served daily from 6:00 AM to 10:00 AM.</p><p>CheckIn Instructions : <ul>  <li>Extra-person charges may apply and vary depending on property policy</li><li>Government-issued photo identification and a credit card, debit card, or cash deposit may be required at check-in for incidental charges</li><li>Special requests are subject to availability upon check-in and may incur additional charges; special requests cannot be guaranteed</li><li>This property accepts credit cards, debit cards, and cash</li><li>Safety features at this property include a carbon monoxide detector, a fire extinguisher, a smoke detector, a security system, a first aid kit, and window guards</li><li>Please note that cultural norms and guest policies may differ by country and by property; the policies listed are provided by the property</li>  </ul></p><p>Special Instructions : Front desk staff will greet guests on arrival.</p>",1-787-7918757,Wheelchair accessible parking Roll-in shower (in select rooms) Tours/ticket assistance Accessible bathroom (in select rooms) Free Buffet Breakfast Eco-friendly toiletries Free breakfast Multilingual staff Daily Wheelchair-accessible meeting spaces/business center Coffee/tea in common areas Laundry facilities elevator Fitness facilities Wheelchair accessible (may have limitations) Vending machine Wheelchair-accessible concierge desk Wheelchair-accessible van parking Meeting rooms Wheelchair-accessible path to elevator Wheelchair-accessible registration desk Television in common areas Wheelchair-accessible fitness center Wheelchair-accessible pool Wheelchair-accessible public washroom Well-lit path to entrance Garden Stair-free path to entrance Free newspapers in lobby Luggage storage Business center 24-hour front desk Playground on site Safe-deposit box at front desk Conference space Self parking (surcharge) Dry cleaning/laundry service Shared microwave Free wired Internet Free WiFi Number of bars/lounges - 1 Number of spa tubs - 1 Number of poolside bars - 1 Braille or raised signage Number of outdoor pools - 1 Assistive listening devices available Number of swim-up bars - 1 In-room accessibility (in select rooms) ATM/banking Pool sun loungers Concierge services 24-hour business center,18.442026|-66.01627,+17877918777,00979,http://hamptoninn.hilton.com/en/hp/hotels/index.jhtml?ctyhocn=SJUHHHX
PR,Puerto Rico,113521,Carolina,1107048,Hotel Villa Del Sol,ThreeStar,4 Calle Rosa Carolina00979 ,Distances are displayed to the nearest 0.1 mile and kilometer. <br /> <p>Pine Grove Beach - 0.3 km / 0.2 mi <br /> Isla Verde Beach - 0.5 km / 0.3 mi <br /> Carolina Beach - 1.1 km / 0.7 mi <br /> Balneario de Carolina - 1.5 km / 0.9 mi <br /> Statue of Ponce de Leon - 3.8 km / 2.4 mi <br /> Calle Loiza - 4.3 km / 2.7 mi <br /> The Mall of San Juan - 5 km / 3.1 mi <br /> Playa Ocean Park - 5.5 km / 3.4 mi <br /> San Jorge Children s Hospital - 5.5 km / 3.4 mi <br /> Museo de Arte Contemporaneo de Puerto Rico - 5.7 km / 3.6 mi <br /> Museo de Arte de Puerto Rico - 6.2 km / 3.8 mi <br /> Pocita de Piñones - 6.2 km / 3.8 mi <br /> Centro Europa - 6.6 km / 4.1 mi <br /> Plaza Antonia Quinones - 6.6 km / 4.1 mi <br /> Centro de Bellas Artes Luis A. Ferre - 6.6 km / 4.1 mi <br /> </p><p>The nearest major airport is Luis Munoz Marin Intl. Airport (SJU) - 4.5 km / 2.8 mi</p>,"<p>HeadLine : In Carolina (Isla Verde)</p><p>Location : With a stay at Hotel Villa del Sol in Carolina (Isla Verde), you ll be within a 15-minute walk of Isla Verde Beach and Carolina Beach.  This hotel is 1.1 mi (1.7 km) from Balneario de Carolina and 3.8 mi (6.2 km) from Pocita de Piñones.</p><p>Rooms : Make yourself at home in one of the 29 air-conditioned rooms featuring refrigerators and flat-screen televisions. Cable television is provided for your entertainment. Private bathrooms with showers feature complimentary toiletries and hair dryers. Housekeeping is provided daily, and both irons/ironing boards and rollaway/extra beds (surcharge) are available on request.</p><p>CheckIn Instructions : <ul>  <li>Extra-person charges may apply and vary depending on property policy</li><li>Government-issued photo identification and a credit card, debit card, or cash deposit may be required at check-in for incidental charges</li><li>Special requests are subject to availability upon check-in and may incur additional charges; special requests cannot be guaranteed</li><li>Guests must contact this property in advance to reserve rollaway/extra beds</li><li>This property accepts credit cards; cash is not accepted</li><li>Safety features at this property include a smoke detector</li>  </ul></p><p>Special Instructions : Front desk staff will greet guests on arrival.</p>",1-787-7915666,Parking (limited spaces) 24-hour front desk Swimming pool Free WiFi Number of outdoor pools - 1 Golfing nearby Safe-deposit box at front desk Smoke-free property In-room accessibility (in select rooms) Tours/ticket assistance Offsite parking discounted rates available Terrace,18.442817|-66.015745,1-787-791-2600,00979,
PR,Puerto Rico,113521,Carolina,1107050,Villa Verde Inn,TwoStar,Marginal Villamar 1295 Carolina 00979 ,,"Located across from the beautiful sands of Isla Verde Beach, this Carolina inn features an outdoor pool. Free Wi-Fi and a daily continental breakfast are also provided.

Cable TV, a microwave and a fridge are found in each bright room of the Villa Verde Inn. A balcony area and a work desk are also included.

Shuttle service to Isla Verde Avenue and the public beach is offered during the day. Access to a nearby tennis court and a gym is also available.

The Luis Munoz Marin International Airport is 5 minutes from the hotel. The Puerto Rico Museum of Art is less than 5 km away. Guests are required to show a photo identification and credit card upon check-in. Please note that all Special Requests are subject to availability and additional charges may apply.
Please note if you need to arrive after 4:00 AM, inform the hotel as otherwise the reservation will be charged with a No-Show Fee and the room may not be available.",+17877285912,guest accommodation is disinfected between stays guest accommodation sealed after cleaning staff follow all safety protocols as directed by local authorities shared stationery such as printed menus  magazines  pens  and paper removed hand sanitizer in guest accommodation and key areas first aid kit available cashless payment available physical distancing rules followed screens or physical barriers placed between staff and guests in appropriate areas invoice provided all plates  cutlery  glasses and other tableware have been sanitized guests have the option to cancel any cleaning services for their accommodation during their stay Parking Pets allowed 24-hour front desk Fire extinguishers Non-smoking rooms Swimming pool Laundry use of cleaning chemicals that are effective against coronavirus Facilities for disabled guests linens  towels and laundry washed in accordance with local authority guidelines breakfast in the room Free parking internet services Safety Deposit Box Tour desk Fax/photocopying Luggage storage wifi Outdoor pool Free WiFi Non-smoking throughout Air conditioning designated smoking area concierge service vending machine (drinks) Daily housekeeping parking on site Private parking wifi available in all areas Accessible parking Wheelchair accessible Toilet with grab rails Higher level toilet Lower bathroom sink Swimming pool Key access Smoke alarms CCTV in common areas CCTV outside property,18.4429|-66.02805,+17877279457,00979,https://www.booking.com/hotel/pr/carolina-marginal-villamar-1295.html
