countyCode,countyName,cityCode,cityName,HotelCode,HotelName,HotelRating,Address,Attractions,Description,FaxNumber,HotelFacilities,Map,PhoneNumber,PinCode,HotelWebsiteUrl
PR,Puerto Rico,150410,Arecibo,1481336,Ventana Al Atlantico Boutique Hotel,TwoStar,Pr 681 Km. 5.4 00612 Arecibo ,,"Situated in Arecibo in the North Puerto Rico region, Ventana al Atlantico Boutique Hotel at Arecibo 681 Ocean Drive features accommodation with free WiFi and free private parking, as well as access to a hot tub.

Accommodation is fitted with air conditioning, a fully equipped kitchenette, a flat-screen TV and a private bathroom with shower and a hairdryer. Some units have a balcony and/or a patio with sea or pool views.

The homestay offers a terrace.

Guests can swim in the outdoor swimming pool, go hiking or cycling, or relax in the garden and use the barbecue facilities.

Caza y Pesca Beach is 2.2 km from Ventana al Atlantico Boutique Hotel at Arecibo 681 Ocean Drive, while Arecibo Observatory is 25 km from the property. The nearest airport is Rafael Hernández, 60 km from the accommodation, and the property offers a paid airport shuttle service. Please inform Ventana al Atlantico Boutique Hotel at Arecibo 681 Ocean Drive in advance of your expected arrival time. You can use the Special Requests box when booking, or contact the property directly with the contact details provided in your confirmation.
This property will not accommodate hen, stag or similar parties.
In response to Coronavirus (COVID-19), additional safety and sanitation measures are in effect at this property.
As a result of Coronavirus (COVID-19), this property has temporarily suspended its shuttle services.
Due to Coronavirus (COVID-19), this property is taking steps to help protect the safety of guests and staff. Certain services and amenities may be reduced or unavailable as a result.
Due to Coronavirus (COVID-19), wearing a face mask is mandatory in all indoor common areas.
A deposit via PayPal is required to secure your reservation. The property will contact you after you book to provide any bank transfer instructions.",+1(0)7879337851,Parking Pets allowed Garden Terrace Non-smoking rooms Airport shuttle Fishing Laundry Free parking internet services Hot tub/jacuzzi Canoeing Hiking BBQ facilities Car hire Cycling Horse riding wifi Allergy-free room Outdoor pool Free WiFi Non-smoking throughout Air conditioning designated smoking area Sun terrace outdoor pool (all year) Private check-in/check-out shuttle service (additional charge) airport shuttle (additional charge) Beachfront Evening entertainment Daily housekeeping parking on site Private parking wifi available in all areas secured parking Street parking Accessible parking Pool with view Salt-water pool airport pick up airport drop off Strollers sun loungers or beach chairs Outdoor furniture Picnic area Swimming pool Beach Shuttle service Fire extinguishers Swimming pool use of cleaning chemicals that are effective against coronavirus linens  towels and laundry washed in accordance with local authority guidelines guest accommodation is disinfected between stays guest accommodation sealed after cleaning staff follow all safety protocols as directed by local authorities shared stationery such as printed menus  magazines  pens  and paper removed hand sanitizer in guest accommodation and key areas process in place to check health of guests contactless check-in/check-out cashless payment available physical distancing rules followed mobile app for room service screens or physical barriers placed between staff and guests in appropriate areas all plates  cutlery  glasses and other tableware have been sanitized guests have the option to cancel any cleaning services for their accommodation during their stay delivered food is securely covered,18.48721|-66.66428,+1(0)7872217519,613-3594,https://www.booking.com/hotel/pr/ventana-al-atlantico.html
PR,Puerto Rico,150410,Arecibo,1481338,Coastal Express Inn Hotel,ThreeStar,Carretera 681 Km 4 00612 Arecibo ,,"Situated within 25 km of Rio Camuy Cave Park and 45 km of Tortuguero Lagoon Natural Reserve, Coastal Express Inn & Suites #1 at 681 Ocean Drive provides rooms in Arecibo. The property is around 800 metres from Caza y Pesca Beach, 2.1 km from Poza del Obispo Beach and 24 km from Arecibo Observatory. Free private parking is available and the inn also features bike hire for guests who want to explore the surrounding area.

All guest rooms in the inn are equipped with a coffee machine. Rooms are complete with a private bathroom fitted with a shower, the rooms at Coastal Express Inn & Suites #1 at 681 Ocean Drive have a flat-screen TV and air conditioning, and certain rooms come with a balcony. At the accommodation rooms are fitted with bed linen and towels.

Arecibo Lighthouse & Historical Park is 3.1 km from Coastal Express Inn & Suites #1 at 681 Ocean Drive, while Cambalache Forest is 20 km from the property. The nearest airport is Rafael Hernández Airport, 58 km from the inn.",,Parking Pets allowed Room service Non-smoking rooms Family rooms Free parking internet services Air conditioning shuttle service (additional charge) parking on site Private parking secured parking Street parking Shuttle service bicycle rental,18.48436|-66.67767,,00612,https://www.booking.com/hotel/pr/surfside-doors-of-the-atlantic.html
PR,Puerto Rico,150410,Arecibo,1562864,Discovery Villas,All,PR 681 Km 6.4 Arecibo 00612 ,,"With sea views, Discovery Inn & Suites at 681 Ocean Drive has accommodation with a kitchenette set in Arecibo. All units feature air conditioning and a TV. A microwave and toaster are also offered, as well as a coffee machine. A bicycle rental service is available at the apartment. The nearest airport is Rafael Hernández Airport, 62 km from Discovery Inn & Suites at 681 Ocean Drive. Please inform Discovery Inn & Suites at 681 Ocean Drive in advance of your expected arrival time. You can use the Special Requests box when booking, or contact the property directly with the contact details provided in your confirmation.
A damage deposit of USD 97 is required on arrival. This will be collected by credit card. You should be reimbursed on check-out. Your deposit will be refunded in full via credit card, subject to an inspection of the property.",,Parking Pets allowed Garden Non-smoking rooms Airport shuttle Fishing Laundry Family rooms internet services Windsurfing Canoeing Hiking BBQ facilities Bowling Heating Diving Horse riding wifi Free WiFi Air conditioning designated smoking area shuttle service (additional charge) airport shuttle (additional charge) Beachfront Daily housekeeping grocery deliveries parking on site Private parking Street parking airport pick up airport drop off Beach Shuttle service bicycle rental,18.48823|-66.65461,,00612,https://www.booking.com/hotel/pr/discovery-villas.html
PR,Puerto Rico,150410,Arecibo,1673244,Vacation Rentals at Salitre,ThreeStar,Carretera Pr 681 Km 3.8 Islote Km 3.8IsloteArecibo 00612 ,Distances are displayed to the nearest 0.1 mile and kilometer. <br /> <p>La Poza Beach - 0.5 km / 0.3 mi <br /> Cano Tiburones Nature Reserve - 0.7 km / 0.4 mi <br /> Arecibo Lighthouse - 2.7 km / 1.7 mi <br /> Cave of the Indian - 4.2 km / 2.6 mi <br /> Cueva Ventana - 16.6 km / 10.3 mi <br /> Bosque Estatal De Cambalache - 19.7 km / 12.2 mi <br /> Arecibo Observatory - 23.3 km / 14.5 mi <br /> Rio Camuy Cave Park - 24.9 km / 15.5 mi <br /> Tres Pueblos Sinkhole - 26.2 km / 16.3 mi <br /> Puerto Rico Premium Outlets - 26.2 km / 16.3 mi <br /> Guajataca Beach - 33.4 km / 20.8 mi <br /> Parque Ceremonial Indigena de Caguana - 36.6 km / 22.7 mi <br /> Parque Ceremonial Indigena Caguana - 38.9 km / 24.2 mi <br /> Coffee Museum - 45.5 km / 28.3 mi <br /> Pozo de Jacinto - 48 km / 29.8 mi <br /> </p><p>The nearest airports are:<br />Aguadilla (BQN-Rafael Hernandez) - 63.2 km / 39.3 mi<br /> Ponce (PSE-Mercedita) - 80.1 km / 49.8 mi<br /> Mayaguez (MAZ-Eugenio Maria de Hostos) - 83.5 km / 51.9 mi<br /> San Juan (SJU-Luis Munoz Marin Intl.) - 87.7 km / 54.5 mi<br /> </p><p></p>,"<p><b>Property Location</b> <br />When you stay at Vacation Rentals at Salitre in Arecibo, you'll be on the beach, within a 10-minute walk of La Poza Beach and Cano Tiburones Nature Reserve.  This beach guesthouse is 14.5 mi (23.3 km) from Arecibo Observatory and 15.5 mi (24.9 km) from Rio Camuy Cave Park.</p><p><b>Rooms</b> <br />Make yourself at home in one of the 5 air-conditioned rooms featuring refrigerators and DVD players. Prepare your meals in the shared/communal kitchen. Flat-screen televisions with cable programming provide entertainment, while complimentary wireless Internet access keeps you connected. Private bathrooms with showers feature complimentary toiletries and hair dryers.</p><p><b>Amenities</b> <br />Take advantage of recreation opportunities such as an outdoor pool or take in the view from a terrace and a garden. Additional features at this guesthouse include complimentary wireless Internet access and concierge services.</p><p><b>Dining</b> <br />Enjoy local and international cuisine at Salitre, a restaurant which features a bar, or stay in and take advantage of the room service (during limited hours). A complimentary continental breakfast is served daily from 7 AM to 11 AM.</p><p><b>Business, Other Amenities</b> <br />Featured amenities include dry cleaning/laundry services, luggage storage, and a safe deposit box at the front desk. Free self parking is available onsite.</p>",,Accessible bathroom Concierge services Designated smoking areas Dry cleaning/laundry service Free WiFi Free breakfast Free self parking Front desk (limited hours) Garden In-room accessibility Luggage storage Number of buildings/towers - 1 Number of floors - 2 Outdoor pool Pets allowed Porter/bellhop Restaurant Roll-in shower Safe-deposit box at front desk Terrace Total number of rooms - 5,18.48422|-66.67861,,00612,
PR,Puerto Rico,150410,Arecibo,1832518,The Hill Inn At 681 Ocean Drive,ThreeStar,Bo Jarealito Calle 1 139 00612 Arecibo ,,"Featuring 3-star accommodation, The Hill Inn at Arecibo 681 Ocean Drive is situated in Arecibo, 500 metres from Caza y Pesca Beach and 600 metres from Poza del Obispo Beach. Featuring a garden, the 3-star hotel has air-conditioned rooms with free WiFi, each with a private bathroom. The accommodation features room service and a 24-hour front desk for guests.

Each room is fitted with a flat-screen TV, and some rooms at the hotel have a terrace. At The Hill Inn at Arecibo 681 Ocean Drive rooms have bed linen and towels.

Arecibo Observatory is 22 km from the accommodation, while Rio Camuy Cave Park is 23 km from the property. The nearest airport is Rafael Hernández Airport, 56 km from The Hill Inn at Arecibo 681 Ocean Drive. A damage deposit of USD 100 is required on arrival. This will be collected as a cash payment. You should be reimbursed on check-out. Your deposit will be refunded in full in cash, subject to an inspection of the property.",,Parking Pets allowed Room service 24-hour front desk Garden Non-smoking rooms Smoke alarms Fire extinguishers Family rooms Free parking internet services wifi Free WiFi Air conditioning shuttle service (additional charge) Daily housekeeping parking on site Private parking wifi available in all areas secured parking Accessible parking Beach Shuttle service Key access,18.47836|-66.69411,,00612,https://www.booking.com/hotel/pr/city-inn-hotels.html
PR,Puerto Rico,150410,Arecibo,5771423,Las Olas Beach House,All,Bo Islote Ii Pr 681 Calle 10 Bld 219  ,,"Las Olas Beach House features sea views, free WiFi and free private parking, set in Arecibo, 600 metres from Caza y Pesca Beach.

Every unit has a private bathroom and shower, air conditioning, a flat-screen TV and a microwave. There is also a kitchen in some of the units equipped with a fridge, a stovetop, and a toaster.

The apartment offers a terrace.

A barbecue is available on site and hiking can be enjoyed within close proximity of Las Olas Beach House.

Poza del Obispo Beach is 2 km from the accommodation, while Arecibo Observatory is 24 km from the property. The nearest airport is Rafael Hernández, 59 km from Las Olas Beach House, and the property offers a paid airport shuttle service.",,guest accommodation sealed after cleaning food can be delivered to guest accommodation staff follow all safety protocols as directed by local authorities shared stationery such as printed menus  magazines  pens  and paper removed hand sanitizer in guest accommodation and key areas first aid kit available contactless check-in/check-out cashless payment available physical distancing rules followed screens or physical barriers placed between staff and guests in appropriate areas all plates  cutlery  glasses and other tableware have been sanitized guests have the option to cancel any cleaning services for their accommodation during their stay Parking Pets allowed Terrace Non-smoking rooms Airport shuttle Fishing Family rooms Free parking internet services Windsurfing Hiking BBQ facilities Diving wifi Free WiFi Air conditioning Private beach area airport shuttle (additional charge) Water park Daily housekeeping parking on site Private parking wifi available in all areas secured parking airport pick up airport drop off Beach use of cleaning chemicals that are effective against coronavirus linens  towels and laundry washed in accordance with local authority guidelines guest accommodation is disinfected between stays,18.48435|-66.67816,,00612,https://www.booking.com/hotel/pr/las-olas-beach-house.html
PR,Puerto Rico,150410,Arecibo,6089777,Casa de Campo Rio Arriba,All,Bo.Rio Arriba Sect Canina#1Carr#10Km70 Hc4box 14845  ,,"Featuring a garden and a terrace, Casa de Campo Rio Arriba features accommodation in Arecibo with free WiFi and mountain views. Boasting free private parking, the apartment is in an area where guests can engage in activities such as fishing and canoeing.

The air-conditioned apartment consists of 2 bedrooms, a living room, a fully equipped kitchen with a fridge and a coffee machine, and 1 bathroom with a shower and a hairdryer. Towels and bed linen are available in the apartment.

Arecibo Observatory is 24 km from the apartment, while Rio Camuy Cave Park is 31 km from the property. The nearest airport is Mercedita Airport, 61 km from Casa de Campo Rio Arriba. This property will not accommodate hen, stag or similar parties.
Please inform Casa de Campo Rio Arriba in advance of your expected arrival time. You can use the Special Requests box when booking, or contact the property directly with the contact details provided in your confirmation.
In response to Coronavirus (COVID-19), additional safety and sanitation measures are in effect at this property.
Managed by a private host",,face masks for guests available Picnic area 24-hour security Security alarm Smoke alarms CCTV outside property Fire extinguishers use of cleaning chemicals that are effective against coronavirus linens  towels and laundry washed in accordance with local authority guidelines guest accommodation is disinfected between stays guest accommodation sealed after cleaning physical distancing in dining areas staff follow all safety protocols as directed by local authorities shared stationery such as printed menus  magazines  pens  and paper removed hand sanitizer in guest accommodation and key areas process in place to check health of guests first aid kit available contactless check-in/check-out cashless payment available physical distancing rules followed screens or physical barriers placed between staff and guests in appropriate areas invoice provided property is cleaned by professional cleaning companies all plates  cutlery  glasses and other tableware have been sanitized guests have the option to cancel any cleaning services for their accommodation during their stay breakfast takeaway containers delivered food is securely covered thermometers for guests provided by property Parking Pets allowed Garden Terrace Non-smoking rooms Fishing Family rooms Free parking internet services express check-in/check-out Canoeing Hiking wifi Free WiFi Non-smoking throughout Air conditioning designated smoking area Sun terrace Private check-in/check-out parking on site Private parking wifi available in all areas board games/puzzles Accessible parking Pet basket Pet bowls Outdoor furniture,18.34827|-66.66801,,00612,https://www.booking.com/hotel/pr/bo-rio-arriba-sect-canina-1carr-10km70.html
PR,Puerto Rico,105132,Barranquitas,1428671,Hacienda Margarita,All,KM 1.7 Calle Hacienda Margarita Bo. Quebrada GrandeBarranquitasPuerto Rico ,,"Featuring free WiFi access throughout the property, Hacienda Margarita offers accommodation in Barranquitas. Free private parking is also available on site.

Rooms are fitted with a private bathroom fitted with a bath or shower.

An array of activities can be enjoyed on site or in the surroundings, including hiking.

San Juan is 53 km from Hacienda Margarita, while Ponce is 68 km from the property. Luis Munoz Marin International Airport is 59 km away. Please inform Hacienda Margarita in advance of your expected arrival time. You can use the Special Requests box when booking, or contact the property directly with the contact details provided in your confirmation.
Please note Hacienda Margarita is currently under renovations. During this period, guests may experience some noise or light disturbances, and some hotel facilities and services may not be available. The Panoramic Restaurant is expected for 2017 opening.",,Parking Garden Terrace Non-smoking rooms Laundry Facilities for disabled guests Free parking internet services Hiking Heating wifi Outdoor pool Free WiFi Air conditioning Sun terrace outdoor pool (all year) Private check-in/check-out Daily housekeeping parking on site Private parking wifi available in all areas secured parking Accessible parking Higher level toilet Pool with view Pool Bar sun loungers or beach chairs Fence around pool Swimming pool 24-hour security Security alarm Smoke alarms CCTV in common areas CCTV outside property Fire extinguishers Swimming pool,18.19762|-66.29221,+17874511873,00794,http://www.haciendamargaritahotel.com/
PR,Puerto Rico,105132,Barranquitas,1457234,Canyon Boutique Hotel,TwoStar,Pr 719 Km 1.0 Hoya Honda 00794 Barranquitas ,,"El Canon Guest House is located in Barranquitas, just 10 minutes walk from the main market. Free Wi-Fi access is available in all areas.

The rooms here offer air conditioning and some of them have mountain views. Private bathrooms also come with a shower.

At El Canon Guest House you will find a terrace and a bar. Other facilities offered include a tour desk. The property offers free parking.

This property is 57 km from Ponce City Centre and 1 hours drive from Luis Muñoz Marín International Airport.",+1(0)7873088775,Parking meeting/banquet facilities Bar Non-smoking rooms Fishing Family rooms Free parking internet services Windsurfing Canoeing Car hire Tour desk Diving Snorkelling wifi Free WiFi Non-smoking throughout Air conditioning On-site parking wifi available in all areas secured parking,18.17837|-66.30421,+1(0)7873088775,00794,https://www.booking.com/hotel/pr/el-canon-guest-house.html
PR,Puerto Rico,111846,Bayamón,1244644,Hyatt Place San Juan Bayamón,ThreeStar,Carretera 167 Avenida Ramon Luis Rivera BAYAMON ,,"Ideally located near San Juan and Luis Munoz International Airport, and for getaway vacationers, there are many exciting nearby venues to explore, like the Luis A. Ferre Science Park, Bacardi Factory, Plaza del Sol Mall, and Rio Hondo Mall among others. This Hotel offers an enticing blend of Puerto Rican style and modern convenience for guests. Whether you're visiting Puerto Rico for business or family vacation, the hotel provides a wide array of complimentary amenities where guests can relax, play, and explore all this bustling island has to offer. Enjoy signature features in each of the spacious guest rooms, including complimentary hotel-wide Wi-Fi, savor freshly prepared snacks and entrees or Take a dip in our seasonal outdoor swimming pool.",,Set menu dinner Non-smoking establishment Fitness Hyatt - GBAC STAR Global Care & Cleanliness Commitment Hotel American Express JCB Diners Club MasterCard Visa Bathroom Shower Hairdryer Toiletries TV Fridge Ironing set Safe Housekeeping Laundry service Medical service Air conditioning in public areas Hotel safe Lift access Garden Terrace concierge Gym Newspapers Luggage room Clothes dryer Café Bar Restaurant Non-smoking area Highchairs Air conditioning in Restaurant Conference room Meeting room Projector Business centre Audio-visual equipment rental Sun loungers Casino TV lounge Breakfast Breakfast buffet À la carte lunch Set menu lunch À la carte dinner,18.409483|-66.159411,,961,www.bayamon.place.hyatt.com
PR,Puerto Rico,111846,Bayamón,1311750,San Miguel Plaza Hotel,ThreeStar,#2 Calle Las Rosas Esquina Calle De La RosaBayamon 00961-7011 ,Distances are displayed to the nearest 0.1 mile and kilometer. <br /> <p>Rio Bayamon Golf Course - 2.6 km / 1.6 mi <br /> Museo De Arte De Bayamon - 3 km / 1.9 mi <br /> Luis A. Ferre Science Park - 3.8 km / 2.4 mi <br /> Plaza Rio Hondo - 4.6 km / 2.9 mi <br /> Fort Buchanan - 5.3 km / 3.3 mi <br /> Guaynabo Performing Arts Center - 8.2 km / 5.1 mi <br /> Punto Verde - 9.5 km / 5.9 mi <br /> Luis Munoz Marin Park - 9.6 km / 5.9 mi <br /> Casa Bacardi - 9.6 km / 5.9 mi <br /> Plaza las Americas - 9.9 km / 6.2 mi <br /> Isla de Cabras - 11 km / 6.8 mi <br /> Centro Europa - 11.5 km / 7.1 mi <br /> Conservatory of Music of Puerto Rico - 11.5 km / 7.2 mi <br /> Pavia Santurce Hospital - 11.6 km / 7.2 mi <br /> Hiram Bithorn Stadium - 11.7 km / 7.3 mi <br /> </p><p>The preferred airport for San Miguel Plaza Hotel is Luis Munoz Marin Intl. Airport (SJU) - 19.9 km / 12.4 mi </p>,"<p>HeadLine : Near Rio Bayamon Golf Course</p><p>Location : With a stay at San Miguel Plaza Hotel, you ll be centrally located in Bayamon, within a 10-minute drive of Fort Buchanan and Plaza las Americas.  This hotel is 8.1 mi (13 km) from Condado Beach and 9.6 mi (15.5 km) from Carolina Beach.</p><p>Rooms : Make yourself at home in one of the 22 guestrooms. Your pillowtop bed comes with down comforters and premium bedding. Complimentary wireless Internet access keeps you connected, and satellite programming is available for your entertainment. Private bathrooms with bathtubs feature complimentary toiletries and hair dryers.</p><p>Renovations : This property is closed from March 18 2020 to December 31 2020 (dates subject to change).</p><p>CheckIn Instructions : Extra-person charges may apply and vary depending on property policy Government-issued photo identification and a credit card, debit card, or cash deposit may be required at check-in for incidental charges Special requests are subject to availability upon check-in and may incur additional charges; special requests cannot be guaranteed No onsite parking is available</p><p>Special Instructions : The front desk is open daily from 7:30 AM - midnight. This property doesn t offer after-hours check-in. Front desk staff will greet guests on arrival.</p>",787-300-4001,Number of meeting rooms - 2 Luggage storage elevator Mountain biking nearby Front desk (limited hours) Wheelchair accessible path of travel Accessible bathroom Free WiFi Wheelchair accessible parking Wedding services In-room accessibility Smoke-free property Hiking/biking trails nearby,18.396796|-66.14622,00787 300 4000,00961 7011,
PR,Puerto Rico,111846,Bayamón,1464416,Caparra Village Vacation Apartments,ThreeStar,Jardines de Caparra Calle 3 B 29 Bayamon 00959 ,,"Caparra Village Luxury Retreat boasts 4 apartments in the best location of Bayamon. Each was carefully decorated/furnished to be comfortable and functional. Dont worry about kitchen tools, towels, or linens - weve got you covered! Situated 8 km from Plaza Rio Hondo, Caparra Village Vacation Apartments features accommodation with free WiFi and free private parking.

The units have tiled floors and include a seating area with a TV, a fully equipped kitchen with a dining area and a private bathroom. A microwave, a fridge and oven are also available, as well as a coffee machine.

The apartment offers a terrace.

Guests at Caparra Village Vacation Apartments can enjoy hiking and cycling nearby, or make the most of the garden.

The nearest airport is Luis Munoz Marin International, 14 km from the accommodation, and the property offers a paid airport shuttle service.  A damage deposit of USD 150 is required on arrival. This will be collected by credit card. You should be reimbursed on check-out. Your deposit will be refunded in full via credit card, subject to an inspection of the property.",,Facilities for disabled guests wifi available in all areas shuttle service (additional charge) Bowling Horse riding Windsurfing Golf course (within 3 km) On-site parking Ticket service Stand-up comedy Live sport events (broadcast) airport shuttle (additional charge) grocery deliveries Air conditioning Pets allowed Cycling Garden Family rooms Daily housekeeping wifi Diving Free WiFi Non-smoking rooms internet services Live music/performance Tennis Court Parking Pub crawls Private parking Terrace Free parking Water park Airport shuttle express check-in/check-out Hiking Snorkelling,18.39347|-66.12883,,00959,https://www.booking.com/hotel/pr/caparra-village-luxury-retreat.html
