countyCode,countyName,cityCode,cityName,HotelCode,HotelName,HotelRating,Address,Attractions,Description,FaxNumber,HotelFacilities,Map,PhoneNumber,PinCode,HotelWebsiteUrl
RU,Russian Federation,150254,Adler,1225005,Imeretinskiy Hotel,FourStar,Morskoy Boulevard 1 Imeretinskaya Lowland Adler DistrictSochi  354340Krasnodar Krai ,Distances are displayed to the nearest 0.1 mile and kilometer. <br /> <p>Olympic Beach - 0.1 km / 0.1 mi <br /> Sochi Olympic Park - 1.2 km / 0.7 mi <br /> Mandarin Mall - 1.7 km / 1.1 mi <br /> Ice Cube Curling Center - 1.8 km / 1.1 mi <br /> Adler Beach - 1.8 km / 1.1 mi <br /> Adler Arena - 1.9 km / 1.2 mi <br /> St. Sarkis Cathedral - 1.9 km / 1.2 mi <br /> Seagull Beach - 1.9 km / 1.2 mi <br /> Shayba Arena - 2 km / 1.2 mi <br /> Adler History Museum - 2.1 km / 1.3 mi <br /> Bolshoy Ice Dome - 2.1 km / 1.3 mi <br /> Fisht Olympic Stadium - 2.2 km / 1.4 mi <br /> Singing Fountains - 2.3 km / 1.4 mi <br /> Noviy Vek - 2.4 km / 1.5 mi <br /> Iceberg Skating Palace - 2.4 km / 1.5 mi <br /> </p><p>The preferred airport for Imeretinskiy Hotel is Sochi (AER-Sochi Intl.) - 7 km / 4.3 mi </p>,"<p>HeadLine : Near Ice Cube Curling Center</p><p>Location : With a stay at Imeretinskiy Hotel in Adlersky, you ll be in the entertainment district, within a 10-minute drive of Adler Beach and Olympic Beach.  This 4-star hotel is 0.7 mi (1.2 km) from Sochi Olympic Park and 1.1 mi (1.8 km) from Ice Cube Curling Center.</p><p>Rooms : Make yourself at home in one of the 196 air-conditioned rooms featuring minibars and LCD televisions. Complimentary wireless Internet access keeps you connected, and satellite programming is available for your entertainment. Private bathrooms with showers feature designer toiletries and hair dryers. Conveniences include phones, as well as safes and desks.</p><p>Dining : Grab a bite at Biblioteka, one of the hotel s 2 restaurants, or stay in and take advantage of the 24-hour room service. Relax with a refreshing drink at the bar/lounge, the poolside bar, or one of 2 beach bars. Cooked-to-order breakfasts are available daily from 7 AM to 11 AM for a fee.</p><p>Renovations : </ul>The following facilities are closed on Sunday, Monday, Tuesday, Wednesday, and Thursday: <ul><li>Bar/lounge</li><li>Fitness facility</li><li>Indoor pool</li><li>Children s pool</li><li>Full-service spa</li><li>Outdoor pool</li><li>Restaurant</li><li>Sauna</li><li>Spa tub</li></ul> The following facilities are closed on Friday and Saturday: <ul><li>Fitness facility</li><li>Indoor pool</li><li>Children s pool</li><li>Full-service spa</li><li>Outdoor pool</li><li>Restaurant</li><li>Bar/lounge</li><li>Sauna</li><li>Spa tub</li></ul></p><p>CheckIn Instructions : Extra-person charges may apply and vary depending on property policy Government-issued photo identification and a credit card, debit card, or cash deposit may be required at check-in for incidental charges Special requests are subject to availability upon check-in and may incur additional charges; special requests cannot be guaranteed This property accepts credit cards, debit cards, and cash Safety features at this property include a carbon monoxide detector, a smoke detector, and a security system</p><p>Special Instructions : To make arrangements for check-in please contact the property at least 24 hours before arrival using the information on the booking confirmation. Guests must contact the property in advance for check-in instructions. Front desk staff will greet guests on arrival.</p>",7-862-270 11 11,Safe-deposit box at front desk Spa services on site Free parking nearby Breakfast available (surcharge) Conference space size (feet) - 6458 Banquet hall Reception hall Wheelchair accessible path of travel Beach towels Television in common areas Arcade/game room In-room accessibility Wheelchair-accessible registration desk Wheelchair-accessible pool Grocery/convenience store Wheelchair-accessible on-site restaurant Bar/lounge Wheelchairs available on site elevator Fitness facilities Lockers available Indoor pool 24-hour front desk Poolside bar Tours/ticket assistance Business center Beach sun loungers Turkish bath/Hammam Porter/bellhop Free self parking Dry cleaning/laundry service Outdoor pool Swimming pool On private beach Conference space size (meters) - 600 Luggage storage Hair salon ATM/banking Train station pickup (surcharge) Free WiFi Sauna Health club Smoke-free property Children's club (free) Hiking/biking trails nearby Children's pool Concierge services Gift shops or newsstand Wheelchair accessible (may have limitations) Pool umbrellas One meeting room Airport transportation (surcharge) Fireplace in lobby Barbecue grill(s) Rooftop terrace Train station drop-off (surcharge) Full-service spa Number of beach bars - 2 Free beach shuttle Marina on site Beach umbrellas Conference space,43.411053|39.935434,7-800-7077722,354340,http://im-hotel.ru/en/hotel/
RU,Russian Federation,150254,Adler,1226525,Azimut Hotel Resort & Spa Sochi 4,FourStar,"OLIMPIYSKIY PROSPEKT, 40 SOCHI ",Formula 1 : within 500 metre  Olympic park: within 100 metre  Rivera park: within 35000 metre  Krasnaya polyana: within 46000 metre  Sochi theme park: within 100 metre ,"This luxurious hotel is located in Sochi and boasts a prime beachfront situation, just a 20-minute driving distance from the airport. Nearby attractions include the Olympic Park and Olimpiysky Park Train Station is only a 4-minute drive away, providing easy access to other neighbouring cities.  This spacious property offers a wide range of different room types to suit all clients' needs. Designed with guests' comfort in mind, they all come with a functional décor and provide all the necessary services and amenities to guarantee a truly memorable stay. Business travellers may appreciate the spacious functional workplace as well as the conference room equipped with the latest technology. The state-of-the-art spa area is the best place to rejuvenate body and mind while the fully-equipped fitness centre is ideal for those wishing to enjoy an invigorating workout.",,Entertainment programme for children Nightclub Sauna Steam bath Turkish bath (hamam) Massage Spa treatments Beauty salon Spa centre Breakfast buffet Hot breakfast Buffet lunch À la carte lunch Set menu lunch Buffet dinner À la carte dinner Set menu dinner Breakfast and dinner Breakfast and lunch Half board with non-alcoholic drinks Full board with non-alcoholic drinks Special dietary options Vegetarian meal Snacks Table tennis Fitness Basketball Paddle tennis Hotel American Express Diners Club MasterCard Visa Maestro Visa Electrón Mobile phone coverage Transfer service Secure parking Room service Laundry service Multilingual staff 24-hour security Bellboy service Air conditioning in public areas Hotel safe Currency exchange facilities Cloakroom Lift access Shop Garden Terrace Sun terrace Gym Café Bar Restaurant Non-smoking area Highchairs Poolside snack bar Banquet hall Show cooking Swim-up bar Air conditioning in Restaurant Conference room Meeting room Projector Conference hostess Secretarial service Photocopier Business centre Sun loungers Parasols Children playground Kids club Entertainment programme for adults,43.4005863473638|39.9645794928108,,354349,azimuthotels.com/azimut_hotel_resort_and_spa_sochi
RU,Russian Federation,102140,Agoy,1420887,Hotel Maritel,All,Tuapse 352830 AgoyKrasnodar ,,"Located by the pebbly beach on the coast of the Black Sea, Hotel Maritel offers modern air-conditioned rooms in Agoy.  It features a garden with BBQ facilities, a sauna and billiards.

Rooms come with a flat-screen TV and private bathroom with shower and free toiletries.  Free Wi-Fi is available.

The restaurant at Maritel Hotel serves Russian cuisine. Other restaurants are a short walk away.

Tuapse Train Station is 9 km away, while Krasnodar International Airport is 160 km away. Guests are requested to inform the property of their expected arrival time. This can be noted in the Special Request box when booking or negotiated directly with the administration of the property., Please note that this property does not provide a visa support., Please note that the hotel will contact you directly regarding the prepayment of your reservation. Prepayment should be made within 5 days after booking. The hotel reserves the right to cancel your reservation in case the deposit has not been transferred.",,Free self parking Restaurant Meeting rooms Bar/lounge 24-hour front desk Sauna Garden Non-smoking rooms Laundry facilities Internet access Safe-deposit box at front desk Billiards or pool table BBQ facilities Heating Free WiFi Free WiFi Non-smoking throughout Air conditioning Area shuttle (surcharge) On private beach Parking onsite Private parking Kids  outdoor play equipment,44.14059|39.02346,+78612383339|+78612383232|+79186389340,352830,https://www.booking.com/hotel/ru/maritel-hotel.html
RU,Russian Federation,102140,Agoy,1427075,Kompliment Hotel,All,Ulitsa Tsentralnaya 27 E Agoy 352830 ,,"Set 300 metres from the Black Sea shore in Agoy, Kompliment Hotel offers free WiFi and free private parking.

The rooms feature a balcony with a sea view, air conditioning, hairdryer, flat-screen TV, fridge and electric kettle.

Guests are welcome to dine in various cafés and restaurants within a 5-minute walk from the hotel. Billiards and table tennis can be enjoyed on site. Other facilities include concierge service and tour desk.

The distance to Novorossiysk Train Station is 155 km, and Gelendzhik Airport is 125 km from Kompliment Hotel. A negative Coronavirus (COVID-19) PCR test result is mandatory to check-in to this property.
Guests are kindly requested not to use electric cooking appliances in the rooms.

From the 1-st of July all travelers are required to present a negative PCR test result or a certificate of complete vaccination. The test will be valid for 72 hours.

Press release about new restrictions on the website of the Krasnodar Territory Administration

From the1-st of August will be accepted only a certificate of vaccination. An exception will be made only for those travelers who have medical contraindications. They will need to get a negative PCR test for coronavirus and a medical record of vaccination.",,Table tennis Darts Soundproof rooms BBQ facilities Tour desk Heating Luggage storage wifi Free WiFi Non-smoking throughout Air conditioning designated smoking area Snack Bar concierge service Private check-in/check-out shuttle service (additional charge) airport shuttle (additional charge) Shared kitchen shared lounge/TV area Beachfront Daily housekeeping parking on site Private parking wifi available in all areas board games/puzzles kids' outdoor play equipment Movie nights Live sport events (broadcast) 24-hour security Smoke alarms CCTV in common areas CCTV outside property Fire extinguishers Parking Bar 24-hour front desk Non-smoking rooms Airport shuttle Laundry Family rooms Games room Ironing service Free parking internet services express check-in/check-out Safety Deposit Box Billiards,44.14042|39.02465,,352830,https://www.booking.com/hotel/ru/kompliment-agoy.html
RU,Russian Federation,102140,Agoy,1429511,Hotel Morosha,All,Sadovoe Tovaritshestvo Chernomorye 312 Poselok Agoy 352800Tuapse ,,"Situated in Agoy, Morosha Hotel has a seasonal outdoor swimming pool, BBQ facilities and free WiFi. Among the various facilities of this property are a garden and a terrace. Staff on site can arrange a shuttle service.

The rooms come with a flat-screen TV with satellite channels, fridge, a kettle, a shower and a wardrobe. Every room is equipped with a private bathroom, while certain rooms include a balcony and others also offer a mountain view.

Guests at the hotel can enjoy a buffet or a Full English/Irish breakfast.

Morosha Hotel offers a childrens playground.

Tuapse is 9 km from the accommodation, while Yuzhniy is 22 km from the property. Please note that free shuttle to the beach is available from June untill October.",,Free self parking Restaurant Sauna Garden Terrace Non-smoking rooms Laundry facilities Family rooms Internet access Children s playground Billiards or pool table Hiking BBQ facilities Free WiFi Free WiFi Non-smoking throughout Air conditioning Terrace Outdoor seasonal pool Private check-in/check-out Free area shuttle Shared kitchen Television in common areas Parking onsite Private parking Public Bath Games Children's books Kids  outdoor play equipment Street parking,44.14057|39.04738,+79182030244,352800,https://www.booking.com/hotel/ru/morosha.html
RU,Russian Federation,102140,Agoy,1762408,Germes,All,ul. Tsentralnaya 16 Agoy 352830 ,,"Set in Agoy, 200 metres from Agoy Beach, Germes Hotel offers accommodation with a restaurant, free private parking, a seasonal outdoor swimming pool and a bar. 2.7 km from Nebug Beach, the hotel provides a shared lounge and a garden. The hotel features family rooms.

The units come with air conditioning, a flat-screen TV with satellite channels, a minibar, a kettle, a shower, free toiletries and a wardrobe. Rooms are complete with a private bathroom, while certain units at the hotel also provide guests with a seating area.

Germes Hotel offers a childrens playground. Guests are required to show a photo identification and credit card upon check-in. Please note that all Special Requests are subject to availability and additional charges may apply.
Please inform Germes Hotel in advance of your expected arrival time. You can use the Special Requests box when booking, or contact the property directly with the contact details provided in your confirmation.
Payment before arrival via bank transfer is required. The property will contact you after you book to provide instructions.",,Parking Restaurant Bar Sauna Garden Terrace Non-smoking rooms Airport shuttle Laundry Family rooms Ironing service Free parking internet services express check-in/check-out Safety Deposit Box children's playground Soundproof rooms Packed lunches Heating Fax/photocopying wifi Allergy-free room Outdoor pool Free WiFi Non-smoking throughout Air conditioning designated smoking area Snack Bar Sun terrace outdoor pool (seasonal) concierge service Private check-in/check-out shuttle service (additional charge) Special diet menus (on request) airport shuttle (additional charge) Lockers shared lounge/TV area Beachfront Daily housekeeping parking on site Private parking wifi available in all areas kids' outdoor play equipment Baby safety gates Kid meals pool/beach towels Shallow end Pool cover Fence around pool Tour or class about local culture Live music/performance Live sport events (broadcast) Aerobics 24-hour security Security alarm Smoke alarms CCTV in common areas CCTV outside property Fire extinguishers Swimming pool use of cleaning chemicals that are effective against coronavirus linens  towels and laundry washed in accordance with local authority guidelines guest accommodation is disinfected between stays physical distancing in dining areas staff follow all safety protocols as directed by local authorities hand sanitizer in guest accommodation and key areas process in place to check health of guests first aid kit available contactless check-in/check-out cashless payment available physical distancing rules followed screens or physical barriers placed between staff and guests in appropriate areas invoice provided all plates  cutlery  glasses and other tableware have been sanitized guests have the option to cancel any cleaning services for their accommodation during their stay breakfast takeaway containers thermometers for guests provided by property face masks for guests available,44.13925|39.0245,,352830,https://www.booking.com/hotel/ru/giermies.html
RU,Russian Federation,102140,Agoy,1876876,Tatyana,All,Street Chernomorye 272 Agoy 352830 ,,"Offering a seasonal outdoor pool and views of the mountain, Tatyana is located in Agoy, within a 25-minute walk from the sea. Free private parking is provided on site.

Every air conditioned room at this inn features a TV, and a kitchen with a stove. Enjoy a cup of tea from your terrace or balcony. For your comfort, you will find free toiletries and a hairdryer. Tatyana features free WiFi .

There is free shuttle service at the property.

You can play darts at the inn. Lazarevskoye is 35 km from Tatyana, while Tuapse is 5 km from the property. Please inform Tatyana in advance of your expected arrival time. You can use the Special Requests box when booking, or contact the property directly with the contact details provided in your confirmation.",,Fax/photocopying wifi Outdoor pool Free WiFi Air conditioning designated smoking area outdoor pool (seasonal) Private check-in/check-out shuttle service (free) parking on site Private parking board games/puzzles kids' outdoor play equipment Baby safety gates Plunge pool Swimming pool Parking Pets allowed 24-hour front desk Garden Terrace Laundry Family rooms Ironing service Free parking internet services express check-in/check-out Darts BBQ facilities,44.14139|39.04353,,352830,https://www.booking.com/hotel/ru/tat-iana-agoy.html
RU,Russian Federation,102140,Agoy,1880620,Mini Hotel Neyva,All,SNT Dorozhnik 100B Tuapsinskiy RayonAgoy 352830 ,,"Mini-Hotel Neyva is offering accommodation in Agoy. The rooms come with a balcony.

The inn can conveniently provide information at the reception to help guests to get around the area.

Tuapse is 11 km from Mini-Hotel Neyva, while Yuzhniy is 23 km away. Guests are required to show a photo identification and credit card upon check-in. Please note that all Special Requests are subject to availability and additional charges may apply.
Please inform Mini-Hotel Neyva in advance of your expected arrival time. You can use the Special Requests box when booking, or contact the property directly with the contact details provided in your confirmation.
Payment before arrival via bank transfer is required. The property will contact you after you book to provide instructions.",,Free self parking 24-hour front desk Non-smoking rooms Family rooms Internet access Bicycle rental (additional charge) Library Free WiFi Free WiFi Air conditioning Private check-in/check-out Area shuttle (surcharge) Shared kitchen Parking onsite Private parking Games Children's books Kids  outdoor play equipment Children television networks,44.14193|39.02415,,352830,https://www.booking.com/hotel/ru/mini-hotel-neyva.html
RU,Russian Federation,102140,Agoy,1880748,Avtotransportnik Rossii,All,Ulitsa Tsentralnaya 53 Agoy 352830 ,,"Situated in Agoy, Avtotransportnik Rossii has a private beach area and a seasonal outdoor swimming pool. With a fitness centre, the property also features a garden, as well as a bar. The accommodation features a sauna, free WiFi and a 24-hour front desk.

At the resort, every room is equipped with a balcony. Featuring a private bathroom, rooms at Avtotransportnik Rossii also provide guests with a sea view. At the accommodation the rooms come with a wardrobe and a flat-screen TV.

Guests at Avtotransportnik Rossii can enjoy a buffet breakfast.

Hiking is among the activities that guests can enjoy near the resort.

Tuapse is 10 km from Avtotransportnik Rossii, while Yuzhniy is 23 km from the property.",+78616767101,Free self parking Restaurant Meeting rooms Bar/lounge 24-hour front desk Sauna Fitness facilities Garden Non-smoking rooms Airport shuttle Fishing Business center Internet access Elevator/lift Spa and wellness centre Massage Hiking Free WiFi Outdoor pool Free WiFi Air conditioning On private beach Outdoor seasonal pool Water sport facilities (on site) Airport transportation (surcharge) Kids  club Evening entertainment Daily housekeeping Parking onsite Private parking,44.14573|39.03883,+78616767100|+78616790986,352830,https://www.booking.com/hotel/ru/avtotransportnik-rossii-agoi1.html
RU,Russian Federation,102140,Agoy,1880914,Guest House Galatea,All,Agoy 352830  ,,"Providing free WiFi, a sun terrace with a swimming pool, BBQ facilities and garden, Guest House Galatea is situated in Agoy. Among the various facilities are a shared lounge and a bar. The accommodation offers a 24-hour front desk.

The units at the hotel are fitted with a seating area and a TV. Some rooms will provide you with a kitchenette with a stovetop. Guest rooms will provide guests with a fridge.

Guest House Galatea offers a childrens playground. Guests at the accommodation will be able to enjoy activities in and around Agoy, like hiking.

Tuapse is 9 km from Guest House Galatea.",,Free self parking Pets allowed Bar/lounge 24-hour front desk Tennis on site Garden Terrace Non-smoking rooms Airport shuttle Fishing Babysitting or childcare Laundry facilities Facilities for disabled guests Family rooms Arcade/game room Ironing service Internet access Express check-in Children s playground Table tennis Soundproof rooms Hiking BBQ facilities Tour desk Heating Horse riding Free WiFi Outdoor pool Free WiFi Air conditioning Designated smoking areas Terrace Outdoor seasonal pool Private check-in/check-out Area shuttle (surcharge) Airport transportation (surcharge) Shared kitchen Television in common areas Water park Parking onsite Private parking Games Children's books Indoor play area Kids  outdoor play equipment Baby safety gates Children television networks Street parking Higher level toilet,44.14166|39.04099,,352830,https://www.booking.com/hotel/ru/galatea.html
RU,Russian Federation,102140,Agoy,5281688,Usadba Dobrogo Doctora Guest House,All,Village Agoi Sadovoe Tovaritshestvo Chernomore 111  ,,"Featuring free WiFi, Usadba Dobrogo Doctora Guest House offers accommodation in Agoy. Free private parking is available on site. Free shuttle service to and from the beach is provided.

Each room includes a flat-screen TV with satellite channels. Some rooms have a seating area for your convenience. You will find a kettle in the room. For your comfort, you will find slippers, free toiletries and a hair dryer.

Guests can cook in the shared kitchen and enjoy tea and coffee free of charge. There is a 24-hour front desk at the property.

Lazarevskoye is 35 km from Usadba Dobrogo Doctora Guest House, while Tuapse is 7 km from the property. Payment before arrival via bank transfer is required. The property will contact you after you book to provide instructions.
Guests are required to show a photo identification and credit card upon check-in. Please note that all Special Requests are subject to availability and additional charges may apply.
Please inform Usadba Dobrogo Doctora Guest House in advance of your expected arrival time. You can use the Special Requests box when booking, or contact the property directly with the contact details provided in your confirmation.
Please note that all beds can be pushed together or put separately.",,Parking 24-hour front desk Terrace Non-smoking rooms Laundry Family rooms Free parking internet services children's playground Table tennis Library BBQ facilities Luggage storage wifi Outdoor pool Free WiFi Air conditioning designated smoking area Sun terrace outdoor pool (seasonal) Private check-in/check-out shuttle service (free) Shared kitchen shared lounge/TV area parking on site Private parking board games/puzzles books  dvds  music for children kids' outdoor play equipment Children television networks Heated pool pool/beach towels Live sport events (broadcast) Swimming pool use of cleaning chemicals that are effective against coronavirus linens  towels and laundry washed in accordance with local authority guidelines guest accommodation is disinfected between stays physical distancing in dining areas staff follow all safety protocols as directed by local authorities hand sanitizer in guest accommodation and key areas process in place to check health of guests contactless check-in/check-out cashless payment available physical distancing rules followed invoice provided thermometers for guests provided by property recycling bins are available to guests and waste is recycled green spaces such as gardens/rooftop gardens on the property,44.14143|39.04377,,352830,https://www.booking.com/hotel/ru/usadba-dobrogo-doctora-tuapse.html
