countyCode,countyName,cityCode,cityName,HotelCode,HotelName,HotelRating,Address,Attractions,Description,FaxNumber,HotelFacilities,Map,PhoneNumber,PinCode,HotelWebsiteUrl
RU,Russian Federation,101330,Abrau-Djurso,1426619,Usadba Krugloye Ozero,TwoStar,Abrau-Dyurso village Abrau Dyurso 353995 ,,"Featuring an outdoor pool, Usadba Krugloye Ozero is situated in Abrau Dyurso.

The rooms have a balcony, air conditioning, fridge and flat-screen TV with satellite channels. The bathrooms offer a hairdryer.

Guests are welcome to eat out in the cafés and restaurants in the city centre located a 5-minute drive away.

Novorossiysk Train Station is a 40-minute drive from Usadba Krugloye Ozero, and the distance to Anapa Airport is 72 km.",,airport shuttle (additional charge) kids' outdoor play equipment meeting/banquet facilities Bar 24-hour front desk Sauna Terrace Non-smoking rooms Airport shuttle internet services hammam Heating Horse riding wifi Free WiFi Air conditioning designated smoking area Private beach area Walking tours Themed dinner nights Tour or class about local culture Cooking class 24-hour security Fire extinguishers use of cleaning chemicals that are effective against coronavirus linens  towels and laundry washed in accordance with local authority guidelines guest accommodation is disinfected between stays physical distancing in dining areas staff follow all safety protocols as directed by local authorities process in place to check health of guests first aid kit available cashless payment available physical distancing rules followed screens or physical barriers placed between staff and guests in appropriate areas all plates  cutlery  glasses and other tableware have been sanitized guests have the option to cancel any cleaning services for their accommodation during their stay face masks for guests available,44.67789|37.59651,,353995,https://www.booking.com/hotel/ru/usadba-krugloe-ozero.html
RU,Russian Federation,101330,Abrau-Djurso,1749074,Hotel Sport,All,ul. Chekhova 1 Abrau-Dyurso 353995 ,,"Hotel Sport offers air-conditioned accommodation in Abrau-Dyurso. The hotel also features free WiFi and free private parking.

At the hotel, each room has a wardrobe. At Hotel Sport rooms come with a desk, a flat-screen TV and a private bathroom.

A continental breakfast is available each morning at the accommodation.

Guests at Hotel Sport will be able to enjoy activities in and around Abrau-Dyurso, like hiking.

Novorossiysk is 21 km from the hotel, while Kirillovka is 11 km from the property. The nearest airport is Anapa, 38 km from Hotel Sport, and the property offers a paid airport shuttle service.",,Air conditioning Free WiFi Facilities for disabled guests meeting/banquet facilities Sauna Private parking Free parking Non-smoking rooms designated smoking area Heating Live sport events (broadcast) internet services wifi available in all areas Airport shuttle airport shuttle (additional charge) Hiking wifi Parking On-site parking,44.71369|37.59304,,353995,https://www.booking.com/hotel/ru/gostinitsa-quot-sport-quot-abrau-diurso.html
RU,Russian Federation,101330,Abrau-Djurso,1875246,Krylya Mini Hotel,All,Ulitsa Maksima Gorkogo 9V Abrau-Dyurso 353995 ,,"Krylya Mini Hotel is set in Abrau-Dyurso and features on-site dining. Boasting a 24-hour front desk, this property also provides guests with a sun terrace. The inn features a hot tub and ticket service. Krylya Mini Hotel provides beautiful views of lake from many of  rooms.

The units in the inn are fitted with a flat-screen TV with satellite channels. Featuring a private bathroom, rooms at Krylya Mini Hotel also have free WiFi, while certain rooms have a balcony. All guest rooms feature a wardrobe.

A continental breakfast is served daily at the property.

At the accommodation guests are welcome to take advantage of a sauna and a Turkish bath.

Anapa is 30 km from Krylya Mini Hotel, while Gelendzhik is 42 km from the property. The nearest airport is Gelendzhik Airport, 37 km from the inn. Please inform Krylya Mini Hotel in advance of your expected arrival time. You can use the Special Requests box when booking, or contact the property directly with the contact details provided in your confirmation.
Guests need to meet one or more requirements to stay in this property: proof of full Coronavirus (Covid-19) vaccination, a recent valid negative Coronavirus PCR test, or recent proof of Coronavirus recovery.",,Billiards Karaoke Hot tub/jacuzzi Hiking Chapel/shrine hammam Heating Fax/photocopying Parking Restaurant Room service meeting/banquet facilities Bar 24-hour front desk Sauna Garden Terrace Non-smoking rooms Laundry Family rooms Games room breakfast in the room Ironing service Free parking internet services lift express check-in/check-out Safety Deposit Box Spa and wellness centre children's playground staff follow all safety protocols as directed by local authorities shared stationery such as printed menus  magazines  pens  and paper removed hand sanitizer in guest accommodation and key areas process in place to check health of guests first aid kit available cashless payment available physical distancing rules followed screens or physical barriers placed between staff and guests in appropriate areas guests have the option to cancel any cleaning services for their accommodation during their stay thermometers for guests provided by property face masks for guests available Private check-in/check-out shuttle service (additional charge) kids' club Daily housekeeping parking on site Private parking Indoor play area Kid meals Pool with view Heated pool Plunge pool pool/beach towels Pool cover Fence around pool 24-hour security Smoke alarms CCTV in common areas CCTV outside property Fire extinguishers Swimming pool use of cleaning chemicals that are effective against coronavirus linens  towels and laundry washed in accordance with local authority guidelines guest accommodation is disinfected between stays food can be delivered to guest accommodation Luggage storage wifi Indoor pool Free WiFi Air conditioning Sun terrace indoor pool (all year),44.70929|37.58716,+78617275187,353995,https://www.booking.com/hotel/ru/kryl-ia.html
RU,Russian Federation,101330,Abrau-Djurso,1876595,Avgustin Inn,All,Ulitsa Chekhova 4 Abrau-Dyurso 353995 ,,"Located 7 km from the Black Sea Coast in Abrau-Dyurso, Avgustin Inn offers free WiFi and free private parking.

All duplex rooms are air conditioned and come with a flat-screen TV, fridge and electric kettle. The private bathroom includes free toiletries and a hairdryer.

Guests can either order room service or use barbecue facilities for ana outdoor lunch.

Lake Abrau is 500 metres from the property and Church of Saint Blessed Xenia of St. Petersburg is 1 km away. Fishing, cycling and skiing can be enjoyed in the surroundings.

Novorossiysk Train Station is 22 km from Avgustin Inn.",,Free self parking Pets allowed Room service Golf course (within 3 km) Non-smoking rooms Airport shuttle Laundry facilities Family rooms Breakfast service Internet access Bicycle rental (additional charge) Hiking BBQ facilities Cycling Heating Horse riding Free WiFi Free WiFi Air conditioning Designated smoking areas Airport transportation (surcharge) Daily housekeeping Grocery/convenience store Parking onsite Private parking Street parking,44.71457|37.59266,,353995,https://www.booking.com/hotel/ru/avgustin-abrau-dyurso.html
RU,Russian Federation,101330,Abrau-Djurso,1879874,Mini Hotel Edem,All,Ul Primorskaya 29 Dyurso 353995 ,,"Set in Dyurso, 700 metres from Durso Beach, Guest House Edem offers rooms with air conditioning. Featuring family rooms, this property also provides guests with a childrens playground. Free WiFi is available and private parking can be arranged at an extra charge.

At the guest house, all rooms come with a wardrobe, a flat-screen TV and a private bathroom. The units will provide guests with a fridge.

The nearest airport is Anapa Airport, 39 km from Guest House Edem. Please inform Guest House Edem in advance of your expected arrival time. You can use the Special Requests box when booking, or contact the property directly with the contact details provided in your confirmation.
Guests are required to show a photo identification and credit card upon check-in. Please note that all Special Requests are subject to availability and additional charges may apply.",,Air conditioning guest accommodation is disinfected between stays Smoke alarms wifi pool/beach towels linens  towels and laundry washed in accordance with local authority guidelines cashless payment available first aid kit available staff follow all safety protocols as directed by local authorities Non-smoking rooms invoice provided Fire extinguishers Non-smoking throughout hand sanitizer in guest accommodation and key areas Parking children's playground internet services Library face masks for guests available Family rooms process in place to check health of guests Free WiFi On-site parking books  dvds  music for children designated smoking area use of cleaning chemicals that are effective against coronavirus guests have the option to cancel any cleaning services for their accommodation during their stay Games room board games/puzzles CCTV in common areas Private parking kids' outdoor play equipment thermometers for guests provided by property CCTV outside property,44.68505|37.56211,,353995,https://www.booking.com/hotel/ru/mini-edem.html
RU,Russian Federation,101330,Abrau-Djurso,1880702,Club Hotel Dyurso,All,Ulitsa Primorskaya 3 Dyurso 353995 ,,"Located in Dyurso, a few steps from Durso Beach, Club-Hotel Dyurso provides accommodation with a restaurant, free private parking, a bar and a terrace. The inn features family rooms.

At the inn, rooms include a wardrobe. Complete with a private bathroom equipped with a shower and bathrobes, all units at Club-Hotel Dyurso have a flat-screen TV and air conditioning, and some rooms will provide you with a balcony. At the accommodation every room is fitted with bed linen and towels.

The nearest airport is Anapa, 78 km from Club-Hotel Dyurso, and the property offers a paid airport shuttle service.",+78617217774,Parking Restaurant Room service Bar Terrace Non-smoking rooms Airport shuttle Fishing Laundry Family rooms breakfast in the room Ironing service Free parking express check-in/check-out Hiking Packed lunches Heating Fax/photocopying Air conditioning designated smoking area Private check-in/check-out airport shuttle (additional charge) Beachfront face masks for guests available linens  towels and laundry washed in accordance with local authority guidelines guest accommodation is disinfected between stays food can be delivered to guest accommodation staff follow all safety protocols as directed by local authorities hand sanitizer in guest accommodation and key areas first aid kit available cashless payment available invoice provided all plates  cutlery  glasses and other tableware have been sanitized guests have the option to cancel any cleaning services for their accommodation during their stay thermometers for guests provided by property Daily housekeeping grocery deliveries parking on site Private parking board games/puzzles Kid meals Kid-friendly buffet pool/beach towels 24-hour security Security alarm Smoke alarms CCTV in common areas CCTV outside property Fire extinguishers use of cleaning chemicals that are effective against coronavirus,44.67864|37.55977,+78617217773,353995,https://www.booking.com/hotel/ru/mini-dyurso.html
RU,Russian Federation,101330,Abrau-Djurso,1881027,Abrau Khutor,All,Gorkogho 2A Abrau Dyurso 353995 ,,"????? ????? features a restaurant, seasonal outdoor swimming pool, a bar and garden in Abrau-Dyurso. Featuring family rooms, this property also provides guests with a childrens playground. The accommodation provides a 24-hour front desk, airport transfers, room service and free WiFi throughout the property.

Complete with a private bathroom equipped with a shower and bathrobes, all units at the inn have a flat-screen TV and air conditioning, and selected rooms are fitted with a seating area. At ????? ????? each room includes bed linen and towels.

Guests at the accommodation can enjoy a continental breakfast.

????? ????? offers a terrace. Guests at the inn will be able to enjoy activities in and around Abrau-Dyurso, like hiking and fishing.

Novorossiysk is 21 km from ????? ?????, while Sukko is 17 km away. The nearest airport is Anapa Airport, 71 km from the accommodation.",,Hot tub/jacuzzi Soundproof rooms Hiking Packed lunches hammam Heating Fax/photocopying Luggage storage wifi Allergy-free room Parking Restaurant Room service meeting/banquet facilities Bar 24-hour front desk Sauna Garden Terrace Non-smoking rooms Airport shuttle Fishing Family rooms Ironing service Free parking internet services express check-in/check-out Valet parking Spa and wellness centre Massage children's playground Fire extinguishers Swimming pool use of cleaning chemicals that are effective against coronavirus linens  towels and laundry washed in accordance with local authority guidelines guest accommodation is disinfected between stays guest accommodation sealed after cleaning physical distancing in dining areas food can be delivered to guest accommodation staff follow all safety protocols as directed by local authorities hand sanitizer in guest accommodation and key areas Outdoor pool Free WiFi Air conditioning designated smoking area Sun terrace outdoor pool (seasonal) Private check-in/check-out shuttle service (additional charge) airport shuttle (additional charge) Daily housekeeping parking on site Private parking wifi available in all areas Open-air bath kids' outdoor play equipment Walking tours Live sport events (broadcast) 24-hour security Security alarm Smoke alarms CCTV in common areas CCTV outside property all plates  cutlery  glasses and other tableware have been sanitized guests have the option to cancel any cleaning services for their accommodation during their stay thermometers for guests provided by property face masks for guests available process in place to check health of guests first aid kit available contactless check-in/check-out cashless payment available physical distancing rules followed property is cleaned by professional cleaning companies,44.71396|37.58849,+78617790890,353995,https://www.booking.com/hotel/ru/abrau-khutor.html
RU,Russian Federation,101330,Abrau-Djurso,5605387,Guest House On Morstroievskaia 26,All,Ulitsa Morstroievskaia 26  ,,"Guest House Luidmila is located in Abrau-Dyurso. Private parking can be arranged at an extra charge.

At the guest house each room is fitted with a private bathroom.

Novorossiysk is 22 km from Guest House Luidmila, while Sukko is 17 km away. The nearest airport is Anapa Airport, 37 km from the accommodation.",,Air conditioning invoice provided Non-smoking rooms On-site parking Parking Family rooms Free parking Private parking,44.72121|37.60037,,353995,https://www.booking.com/hotel/ru/guest-house-on-promyshlennaya-50.html
RU,Russian Federation,100120,Abzakovo,1369048,Hotel Tau Tash,ThreeStar,33 Gornolyzhnaya St. NovoabzakovoRespublika Bashkortostan ,,"An aqua park with indoor swimming pool, Finnish sauna and a bowling alley are offered at this hotel complex in the Novo-Abzakovo ski resort. Guests enjoy a free minibus shuttle to the ski lift, 800 metres away.

Rooms at Tau-Tash Hotel Complex are warmly decorated with classic-style furniture. All rooms include cable TV and a private bathroom with shower.

A buffet breakfast and a selection of European dishes are served in the elegant restaurant, and drinks are served can be enjoyed at the bar. Free Wi-Fi is available in the bar and restaurant.

Ski equipment can be rented at the Tau-Tash Novo-Abzakovo. On-site leisure activities also include bowling, billiards, a childrens playground and a night club.

On-site parking is free at the Tau-Tash, and Novo-Abzakovo Train Station is just 800 metres away. The 24-hour reception can organise a shuttle service to Magnitogorsk Airport, 50 km away. Guests are required to show a photo identification and credit card upon check-in. Please note that all Special Requests are subject to availability and additional charges may apply.
Guests are kindly asked to present their passport upon check-in.",+73479270491,Free self parking Restaurant Pets allowed Meeting rooms Bar/lounge 24-hour front desk Sauna Non-smoking rooms Airport shuttle Skiing Family rooms Arcade/game room Ironing service Internet access Children s playground Billiards or pool table Table tennis Karaoke Gift shops or newsstand Bicycle rental (additional charge) Hiking BBQ facilities Packed lunches Bowling Heating Fax/photocopying Horse riding Free WiFi Ski storage Free WiFi Designated smoking areas Special diet menus (on request) Airport transportation (surcharge) Water park Parking onsite Indoor play area Kids  outdoor play equipment Children television networks Kid meals Street parking,53.8068|58.63577,+73519591277,453565,https://www.booking.com/hotel/ru/tau-tash.html
RU,Russian Federation,100120,Abzakovo,1383731,Aktiv Hotel Gorky,FourStar,Gornolygnaya Street 35 NovoabzakovoBeloretskiy Rayon ,,"Surrounded by pine forests, these studios and apartments are located in the resort area of Novoabzakovo. Guests can benefit from a Finnish sauna.

Gorkys accommodation is decorated in eco style with lots of wood and natural materials. Each unit includes a private entrance, a satellite TV and a kitchen area.

Breakfast is served in the main restaurant, which offers a selection of Russian and European dishes for dinner. There is also an Italian pizzeria.

Guests at The Gorky can enjoy a sauna session or arrange an excursion at the 24-hour front desk. The nearest ski lift is a 5-minute walk away, and ski equipment can be rented on site.

The property overlooks the landscape of the Southern Urals and is a 5-minute drive away from Novoabzakovo Train Station.",,Free self parking Restaurant Pets allowed Meeting rooms Bar/lounge 24-hour front desk Sauna Non-smoking rooms Airport shuttle Skiing Family rooms VIP room facilities Bridal suite Internet access Express check-in Children s playground Table tennis Gift shops or newsstand Darts Bicycle rental (additional charge) Hiking BBQ facilities Cycling Tour desk Heating Fax/photocopying Horse riding Shopping on site Free WiFi Golf course on site Free WiFi Non-smoking throughout Designated smoking areas Indoor pool Concierge services Nightclub Private check-in/check-out Area shuttle (surcharge) Airport transportation (surcharge) Grocery/convenience store Children's books Kids  outdoor play equipment Kid meals Street parking,53.80556|58.63434,+7 (347) 246-06-18,453565,https://www.booking.com/hotel/ru/gorky.html
RU,Russian Federation,100120,Abzakovo,1408976,Hotel Smile,OneStar,Shkolnaya Street 44 Abzakovo 453565 ,,"Featuring a café, BBQ and free Wi-Fi, Hotel Smile is 5 km from Novoabzakovo Ski Resort. Non-Stop Entertainment Complex is a 5-minute drive away.

The classic-style rooms feature a TV, wardrobe and kettle. The private bathroom comes with a bath and free toiletries.

Smile Hotel is 60 km from Magnitogorsk Airport and 25 km from Beloretsk city centre. Novoabzakovo Train Station is a 5-minute drive away.",,Free self parking Pets allowed 24-hour front desk Non-smoking rooms Airport shuttle Family rooms Internet access Gift shops or newsstand BBQ facilities Heating Shopping on site Free WiFi Free WiFi Non-smoking throughout Snack bar/deli Free airport transportation Parking onsite Private parking Street parking,53.83103|58.59884,8 351 920-74-96,453565,https://www.booking.com/hotel/ru/smile.html
RU,Russian Federation,100120,Abzakovo,1417989,Edelweiss Hotel,ThreeStar,Gorniy Proezd 1A 453565 Abzakovo ,,"This hotel complex is located in Abzakovo Ski Resort, 1 km from the ski centre. Edelweiss Hotel offers free Wi-Fi and a spa area with a sauna, 2 Russian steam rooms and an indoor pool.

Interiors at Edelweiss Hotel Abzakovo are individually furnished and feature colourful décor. A TV and a private bathroom can be found in all rooms.

Breakfast is served in the café each morning.

The Edelweiss is an ideal base for skiing and snowboarding here in the Southern Urals. On-site activities also include tennis and karaoke, and there is also a childrens playground.

The hotel is 300 metres from ski-lifts, bowling and a water park.  A zoo and ski centre are located 800 metres away.

On-site parking is free at Hotel Edelweiss. It is 20 km from Beloretsk town and 60 km from Magnitogorsk.",8 (3519) 207496,Free self parking Pets allowed Meeting rooms 24-hour front desk Sauna Non-smoking rooms Airport shuttle Laundry facilities Skiing Arcade/game room Ironing service Internet access Children s playground Billiards or pool table Table tennis Karaoke Gift shops or newsstand Bicycle rental (additional charge) Hiking BBQ facilities Bowling Fax/photocopying Horse riding Shopping on site Free WiFi Free WiFi ATM/banking Ski equipment hire (on site) Airport transportation (surcharge) Water park Daily housekeeping Parking onsite Private parking Kids  outdoor play equipment,53.8111|58.63616,8 (3519) 2063248 (3519) 206324,453565,https://www.booking.com/hotel/ru/edelveys.html
RU,Russian Federation,100120,Abzakovo,1425347,33 Bears Hotel,All,Ulitsa Energetikov 8 453565 Novoabzakovo ,,"Offering a sauna and a ski storage, 33 Bears Hotel is located in Novoabzakovo, 1.5 km from the nearest ski slope. Free WiFi access is available.

Each room here will provide you with a TV and satellite channels. There is a full a kitchenette with a refrigerator and kitchenware. Featuring a shower, private bathroom also comes with free toiletries. You can enjoy mountain view from the rooms.

The on-site restaurant serves European cuisine, and a variety of drinks is offered at the bar.

At 33 Bears Hotel you will find a shuttle service, a childrens playground and a 24-hour front desk. Other facilities offered at the property include entertainment staff, a shared lounge and a games room. An array of activities can be enjoyed on site or in the surroundings, including skiing, cycling and hiking. The property offers free parking.

Magnitogorsk is 60 km away. Please inform 33 Bears Hotel in advance of your expected arrival time. You can use the Special Requests box when booking, or contact the property directly with the contact details provided in your confirmation.
Payment before arrival via bank transfer is required. The property will contact you after you book to provide instructions.
Please note that cafe Berloga is closed from 12 until 28 May 2016.",,Parking 24-hour front desk Terrace Skiing Family rooms Free parking internet services Table tennis wifi Ski storage Free WiFi designated smoking area ski equipment hire on site shared lounge/TV area parking on site Private parking 24-hour security Smoke alarms CCTV in common areas CCTV outside property Fire extinguishers,53.80544|58.64589,+79128054321|+79177600760|+73479273906|+7961577279,453565,http://www.33bears.com
RU,Russian Federation,100120,Abzakovo,1426436,Hotel Yash-Tan,All,Ulitsa Gornolyzhnaya 34 Abzakovo 453565 ,,"Boasting a seasonal outdoor swimming pool and a bar, Hotel Yash-Tan is located in Abzakovo. Featuring a 24-hour front desk, this property also provides guests with a restaurant. Both private parking and free WiFi are accessible at this property.

All units are equipped with a TV with cable channels, fridge, a kettle, a shower and a wardrobe.

A continental breakfast is available each morning at the hotel.

Skiing is among the activities that guests can enjoy near Hotel Yash-Tan. Swimming pool is closed from Sun 01 Sept 2019 until Tue 30 Jun 2020",,Free self parking Restaurant Pets allowed Room service Bar/lounge 24-hour front desk Sauna Non-smoking rooms Airport shuttle Skiing Family rooms Breakfast service Ironing service Internet access Billiards or pool table Gift shops or newsstand Soundproof rooms Hiking BBQ facilities Packed lunches Heating Free WiFi Ski storage Ski school Outdoor pool Free WiFi Designated smoking areas Outdoor seasonal pool Area shuttle (surcharge) Airport transportation (surcharge) Daily housekeeping Parking onsite Private parking Kids  outdoor play equipment Children television networks Street parking,53.80605|58.63711,,453565,https://www.booking.com/hotel/ru/yash-tan.html
