countyCode,countyName,cityCode,cityName,HotelCode,HotelName,HotelRating,Address,Attractions,Description,FaxNumber,HotelFacilities,Map,PhoneNumber,PinCode,HotelWebsiteUrl
RU,Russian Federation,150941,Achinsk,1845920,Hotel New Fortress,ThreeStar,Krupskaya 28 Achinsk 662150Krasnoyarsk Krai ,Distances are displayed to the nearest 0.1 mile and kilometer. <br /> <p>Achinsk Drama Theater - 0.9 km / 0.6 mi <br /> </p>,"<p>HeadLine : Near Achinsk Drama Theater</p><p>Location : When you stay at Hotel New Fortress in Achinsk, you ll be 11 minutes by foot from Achinsk Drama Theater.</p><p>Rooms : Make yourself at home in one of the 17 guestrooms. Complimentary wireless Internet access is available to keep you connected. Private bathrooms with showers feature complimentary toiletries and hair dryers. Conveniences include desks, as well as phones with free local calls.</p><p>Dining : Enjoy a meal at the restaurant, or stay in and take advantage of the hotel s room service (during limited hours). Continental breakfasts are available daily from 7:30 AM to 10 AM for a fee.</p><p>CheckIn Instructions : <ul>  <li>Extra-person charges may apply and vary depending on property policy</li><li>Government-issued photo identification and a credit card, debit card, or cash deposit may be required at check-in for incidental charges</li><li>Special requests are subject to availability upon check-in and may incur additional charges; special requests cannot be guaranteed</li><li>This property accepts credit cards</li>  </ul></p><p>Special Instructions : Front desk staff will greet guests on arrival.</p>",,Smoke-free property Laundry facilities Tours/ticket assistance Luggage storage Free self parking Airport transportation - pickup (surcharge) 24-hour front desk Breakfast available (surcharge) Free WiFi,56.27829|90.50737,+73915168898,662150,http://hotel-krepost.narod.ru
RU,Russian Federation,150941,Achinsk,1879630,Antei,All,Krasnoyarskoye Shosse Stroenie 12 Achinsk 662150 ,,"Providing free WiFi, Antei is situated in Achinsk. The accommodation provides a 24-hour front desk.

Guest rooms at the hotel are equipped with a seating area and a flat-screen TV.",,Free self parking Pets allowed 24-hour front desk Non-smoking rooms Family rooms Internet access BBQ facilities Free WiFi Free WiFi Daily housekeeping Parking onsite Private parking,56.27147|90.5754,,662150,https://www.booking.com/hotel/ru/antei.html
RU,Russian Federation,150941,Achinsk,1880421,Hotel Arga,TwoStar,Ulitsa Kirova 83 Achinsk 662155 ,,"Hotel Arga is located in Achinsk. This 2-star inn offers a 24-hour front desk and luggage storage space. The property provides free private parking and free WiFi.

At the inn, every room is equipped with a desk, a flat-screen TV, a private bathroom, bed linen and towels. All units will provide guests with a wardrobe and a kettle.

A continental breakfast is available daily at Hotel Arga.

The accommodation offers 2-star accommodation with a hot tub.",,Parking meeting/banquet facilities 24-hour front desk Non-smoking rooms Laundry Family rooms Ironing service Free parking internet services express check-in/check-out Safety Deposit Box Hot tub/jacuzzi Library Heating Fax/photocopying Luggage storage wifi Free WiFi Non-smoking throughout Air conditioning Private check-in/check-out Special diet menus (on request) Daily housekeeping parking on site Private parking wifi available in all areas Tour or class about local culture Smoke alarms CCTV in common areas CCTV outside property Fire extinguishers use of cleaning chemicals that are effective against coronavirus linens  towels and laundry washed in accordance with local authority guidelines guest accommodation is disinfected between stays physical distancing in dining areas staff follow all safety protocols as directed by local authorities hand sanitizer in guest accommodation and key areas process in place to check health of guests first aid kit available cashless payment available physical distancing rules followed all plates  cutlery  glasses and other tableware have been sanitized guests have the option to cancel any cleaning services for their accommodation during their stay breakfast takeaway containers delivered food is securely covered thermometers for guests provided by property face masks for guests available,56.30559|90.53711,+73915138760|+73915138761|+73915138762,662155,https://www.booking.com/hotel/ru/arga.html
RU,Russian Federation,150941,Achinsk,5284449,Gostiniy Dvor,All,Ulitsa Krasnoyarskaya 25  ,,"Situated in Achinsk, Gostiniy Dvor offers a shared lounge and terrace. The accommodation features a 24-hour front desk, airport transfers, room service and free WiFi throughout the property.

At the guest house, rooms come with a wardrobe, a flat-screen TV, a private bathroom, bed linen and towels. Every room includes a kettle, while some rooms include a balcony and others also boast city views. The rooms will provide guests with a fridge.

Guests at Gostiniy Dvor can enjoy a continental breakfast.",,physical distancing rules followed invoice provided all plates  cutlery  glasses and other tableware have been sanitized guests have the option to cancel any cleaning services for their accommodation during their stay thermometers for guests provided by property face masks for guests available Parking Pets allowed Room service 24-hour front desk Sauna Terrace Non-smoking rooms Airport shuttle Laundry Family rooms breakfast in the room Ironing service Free parking internet services express check-in/check-out Hot tub/jacuzzi Heating Fax/photocopying wifi Indoor pool Free WiFi designated smoking area indoor pool (all year) Private check-in/check-out shuttle service (additional charge) vending machine (drinks) airport shuttle (additional charge) shared lounge/TV area Daily housekeeping parking on site Private parking wifi available in all areas Heated pool pool/beach towels Pool cover Security alarm Smoke alarms CCTV in common areas CCTV outside property Fire extinguishers Swimming pool use of cleaning chemicals that are effective against coronavirus linens  towels and laundry washed in accordance with local authority guidelines guest accommodation is disinfected between stays guest accommodation sealed after cleaning physical distancing in dining areas food can be delivered to guest accommodation staff follow all safety protocols as directed by local authorities shared stationery such as printed menus  magazines  pens  and paper removed hand sanitizer in guest accommodation and key areas process in place to check health of guests first aid kit available cashless payment available,56.27792|90.51151,+79504352555+73915140919,662150,https://www.booking.com/hotel/ru/gostiniy-dvor-achinsk.html
RU,Russian Federation,150941,Achinsk,6096814,1stHostel,TwoStar,Southeast Housing Estate 62 Building 66  ,Distances are displayed to the nearest 0.1 mile and kilometer. <br /> <p>Achinsk Drama Theater - 3.9 km / 2.4 mi <br /> </p>,"<p>HeadLine : Near Achinsk Drama Theater</p><p>Location : When you stay at 1stHostel in Achinsk, you ll be within a 5-minute drive of Achinsk Drama Theater.</p><p>Rooms : Make yourself at home in one of the 18 guestrooms. Prepare your meals in the shared/communal kitchen. Complimentary wireless Internet access is available to keep you connected. Bathrooms feature showers with rainfall showerheads and hair dryers.</p><p>CheckIn Instructions : <ul>  <li>Extra-person charges may apply and vary depending on property policy</li><li>Government-issued photo identification and a credit card, debit card, or cash deposit may be required at check-in for incidental charges</li><li>Special requests are subject to availability upon check-in and may incur additional charges; special requests cannot be guaranteed</li><li>This property accepts credit cards, debit cards, and cash</li>  </ul></p><p>Special Instructions : There is no front desk at this property.</p>",,Free self parking Lockers available Smoke-free property Laundry facilities Free WiFi,56.253492|90.505214,7-9138307272,662159,
RU,Russian Federation,150254,Adler,1021510,Medovaya Hotel,ThreeStar,Medovaya Ulitsa 41 Adler 354340 ,Distances are displayed to the nearest 0.1 mile and kilometer. <br /> <p>Adler Beach - 1 km / 0.6 mi <br /> Sochi Discovery World Aquarium - 1.1 km / 0.7 mi <br /> Amfibius Aquapark - 1.9 km / 1.2 mi <br /> Caucasian State Nature Biosphere Reserve - 8.7 km / 5.4 mi <br /> A.A.S. Tree Plastique Art Gallery - 9.5 km / 5.9 mi <br /> Amfibius Aquapark - 9.7 km / 6.1 mi <br /> Noviy Vek - 10.9 km / 6.8 mi <br /> Adler History Museum - 11.1 km / 6.9 mi <br /> St. Sarkis Cathedral - 11.2 km / 7 mi <br /> Mandarin Mall - 11.4 km / 7.1 mi <br /> Seagull Beach - 11.8 km / 7.4 mi <br /> River Mzymta - 12.4 km / 7.7 mi <br /> Novoy Matseste Aquarium - 12.9 km / 8 mi <br /> Olympic Beach - 13.6 km / 8.5 mi <br /> Sochi Olympic Park - 13.8 km / 8.6 mi <br /> </p><p>The preferred airport for Medovaya Hotel is Sochi (AER-Sochi Intl.) - 11.4 km / 7.1 mi </p>,"<p>HeadLine : Near Sochi Discovery World Aquarium</p><p>Location : With a stay at Medovaya Hotel in Sochi, you ll be within a 15-minute walk of Adler Beach and Sochi Discovery World Aquarium.  This guesthouse is 3.5 mi (5.7 km) from Amfibius Aquapark and 5.4 mi (8.7 km) from Caucasian State Nature Biosphere Reserve.</p><p>Rooms : Stay in one of 18 guestrooms featuring flat-screen televisions. Complimentary wireless Internet access keeps you connected, and cable programming is available for your entertainment. Bathrooms with showers are provided. Conveniences include safes and complimentary newspapers, and housekeeping is provided daily.</p><p>Dining : Enjoy a meal at the restaurant or snacks in the coffee shop/cafe. The guesthouse also offers room service (during limited hours). Quench your thirst with your favorite drink at the bar/lounge. A complimentary full breakfast is served daily from 7:00 AM to 10:00 AM.</p><p>CheckIn Instructions : <ul>  <li>Extra-person charges may apply and vary depending on property policy</li><li>Government-issued photo identification and a credit card, debit card, or cash deposit may be required at check-in for incidental charges</li><li>Special requests are subject to availability upon check-in and may incur additional charges; special requests cannot be guaranteed</li><li>This property only accepts cash</li><li>Safety features at this property include a carbon monoxide detector, a fire extinguisher, a smoke detector, and a first aid kit</li>  </ul></p><p>Special Instructions : This property offers transfers from the airport. Guests must contact the property with arrival details before travel, using the contact information on the booking confirmation. The front desk is open daily from 8:00 AM - 10:00 PM. If you are planning to arrive after 8:30 AM please contact the property in advance using the information on the booking confirmation. Front desk staff will greet guests on arrival.</p>",,Free full breakfast Free parking nearby Street parking Television in common areas Free WiFi Number of bars/lounges - 1 Designated smoking areas Number of outdoor pools - 1 Upper floors accessible by stairs only Garden Picnic area Free newspapers in lobby Tours/ticket assistance Free airport transportation - pickup Beach towels Wheelchair accessible  no Free breakfast Front desk (limited hours) Library Daily Barbecue grill(s) Safe-deposit box at front desk Coffee/tea in common areas Designated smoking areas (fines apply) Snack bar/deli Number of coffee shops/cafes - 1 Laundry facilities Sauna Hair salon Beach sun loungers Terrace Concierge services,43.47495|39.900663,7-9284516966,354340,http://www.medovaya.ru/
RU,Russian Federation,150254,Adler,1027860,Malekon,ThreeStar,B. Khmelnickogo Street 68 354341 Sochi Adler354000 SotschiKrasnodarskiy Krai ,,"Billiards room and a sauna are offered at this hotel, located 5 minutes walk from the private Black Sea beach in Adler town. Malekon Hotel provides rooms with air conditioning.

Each classically decorated room features floor-to-ceiling windows and carpeted floors. A hairdryer is provided in the bathrooms.

Malekons restaurant serves European dishes, as well as a daily breakfast. Cocktails and liquor are offered at the on-site bar. Free WiFi is available on site.

Relaxation facilities at the hotel include the sauna and the outdoor swimming pool. Billiards room can also be found on site.

A bus stop is 3 minutes walk from Malekon Hotel offering access to Adlers centre and Sochi Airport. Adler Train Station is 6 minutes drive away, and a shuttle service is available.",78622401204,Daily housekeeping Parking onsite Private parking Free WiFi Free self parking Restaurant 24-hour front desk Sauna Non-smoking rooms Laundry facilities Ironing service Internet access Elevator/lift Safe-deposit box at front desk Billiards or pool table Table tennis Heating Free WiFi Non-smoking throughout Air conditioning Designated smoking areas On private beach Terrace Outdoor seasonal pool,43.42896|39.91582,78622408770,354000,https://www.booking.com/hotel/ru/malekon.html
RU,Russian Federation,150254,Adler,1035689,Golden Dolphin Hotel,TwoStar,"LENIN ST., 219 ADLER ",,"This simple hotel is in Adler. Dolphin features a total of 31 units. Visitors will not be bothered during their stay, as this is not a pet-friendly property.",,Hotel,43.4343234|39.9339462,,354340,http://www.zolotoy-delfin.com/
RU,Russian Federation,150254,Adler,1035692,"Radisson Blu Resort & Congress Centre, Sochi",FiveStar,Golubaya Street 1a Adler DistrictImeretinskaya LowlandSochi 354350 ,Distances are displayed to the nearest 0.1 mile and kilometer. <br /> <p>Olympic Beach - 0.1 km / 0.1 mi <br /> Sochi Olympic Park - 0.9 km / 0.5 mi <br /> Shayba Arena - 1.8 km / 1.1 mi <br /> Fisht Olympic Stadium - 2 km / 1.2 mi <br /> Adler Arena - 2 km / 1.3 mi <br /> Mandarin Mall - 2 km / 1.3 mi <br /> St. Sarkis Cathedral - 2.2 km / 1.3 mi <br /> River Mzymta - 2.2 km / 1.4 mi <br /> Seagull Beach - 2.3 km / 1.4 mi <br /> Adler History Museum - 2.4 km / 1.5 mi <br /> Singing Fountains - 2.4 km / 1.5 mi <br /> Bolshoy Ice Dome - 2.5 km / 1.5 mi <br /> Iceberg Skating Palace - 2.6 km / 1.6 mi <br /> Noviy Vek - 2.7 km / 1.7 mi <br /> Ice Cube Curling Center - 2.7 km / 1.7 mi <br /> </p><p>The preferred airport for Radisson Blu Resort & Congress Centre  Sochi is Sochi (AER-Sochi Intl.) - 7.2 km / 4.4 mi </p>,"<p>HeadLine : Near Mandarin Mall</p><p>Location : A stay at Radisson Blu Resort & Congress Centre, Sochi places you in the heart of Sirius, steps from Olympic Beach and 10 minutes by foot from Sochi Olympic Park.  This 5-star hotel is 0.9 mi (1.4 km) from Ice Cube Curling Center and 1 mi (1.7 km) from River Mzymta.</p><p>Rooms : Make yourself at home in one of the 508 air-conditioned rooms featuring minibars. Rooms have private balconies. Complimentary wired and wireless Internet access keeps you connected, and digital programming provides entertainment. Bathrooms feature bathtubs or showers with rainfall showerheads and designer toiletries.</p><p>Dining : Grab a bite at Grenadine, one of the hotel s 3 restaurants, or stay in and take advantage of the 24-hour room service. Snacks are also available at the 3 coffee shops/cafes. Wind down with a drink at one of the 3 bars/lounges or 2 poolside bars. Buffet breakfasts are served on weekdays from 6:30 AM to 11 AM and on weekends from 7:00 AM to noon for a fee.</p><p>Renovations : The following facilities are closed seasonally each year. They will be closed from December 1 to December 15:<ul><li>One of the swimming pools</li></ul></p><p>CheckIn Instructions : <ul>  <li>Extra-person charges may apply and vary depending on property policy</li><li>Government-issued photo identification and a credit card, debit card, or cash deposit may be required at check-in for incidental charges</li><li>Special requests are subject to availability upon check-in and may incur additional charges; special requests cannot be guaranteed</li><li>This property accepts credit cards and debit cards; cash is not accepted</li>  </ul></p><p>Special Instructions : This property offers transfers from the airport (surcharges may apply). To arrange pick-up, guests must contact the property 24 hours prior to arrival, using the contact information on the booking confirmation. Front desk staff will greet guests on arrival.</p>",7-862-2433325,No single-use plastic water bottles Airport transportation (surcharge) Ski-in/ski-out access Turkish bath/Hammam Wheelchair accessible (may have limitations) Nightclub Change of bed sheets (on request) Health club Spa treatment room(s) Marina on site Change of towels (on request) Full-service spa Free beach shuttle Billiards or pool table Lifeguard on site Outdoor seasonal pool Safe-deposit box at front desk Smoke-free property Children's pool Sauna Steam room Free self parking Conference space Waterslide Computer station Pool sun loungers Conference space size (feet) - 16146 24-hour business center Bicycle rentals on site Guest education on local ecosystems and culture Annual carbon offsets Organic food Banquet hall Showcase for local artists Wheelchair accessible Wheelchair-accessible concierge desk Humane animal treatment Reception hall Locally-owned & organized tours & activities Express check-in Wheelchair-accessible registration desk Television in common areas Arcade/game room Garden Free newspapers in lobby Wedding services 24-hour fitness facilities Water-efficient toilets only Luggage storage Water-efficient showers only Express check-out Business center 24-hour front desk Library Playground on site Housekeeping on request Hair salon Terrace ATM/banking Concierge services Gift shops or newsstand Dry cleaning/laundry service Train station pickup (surcharge) Comprehensive recycling policy Vegetarian breakfast available Biodegradable/compostable stirrers Pool umbrellas No single-use plastic straws Number of meeting rooms - 33 Conference space size (meters) - 1500 No single-use plastic stirrers Reusable cups only Reusable tableware only Biodegradable/compostable straws Supervised childcare/activities (free) Double-glazing on all windows Locally-sourced food on site (80% or more) Coworking spaces Free wired Internet Free WiFi Number of bars/lounges - 3 Bicycle parking available Number of spa tubs - 2 Number of poolside bars - 2 Number of outdoor pools - 2 Assistive listening devices available Number of indoor pools - 1 In-room accessibility (in select rooms) Wheelchair accessible parking Roll-in shower (in select rooms) Tours/ticket assistance Accessible bathroom (in select rooms) Eco-friendly cleaning products provided Energy-saving features in guest rooms LED light bulbs Living plant wall Wheelchair-accessible lounge Vegan menu options available Wheelchair-accessible on-site restaurant Vegetarian menu options available Outdoor tennis courts - 1 Multilingual staff Conference center Breakfast available (surcharge) Wheelchair-accessible meeting spaces/business center Number of coffee shops/cafes - 3 Laundry facilities elevator Children's club (free) Fitness facilities,43.40924|39.93787,78622433300,354350,http://www.radissonblu.com/resort-congress-sochi
RU,Russian Federation,150254,Adler,1062040,Ederan,ThreeStar,Urozhaynaya Street 85 Adler354349 Sochi ,,"Free Wi-Fi, an outdoor pool and a large shared balcony with Black Sea views are offered at this hotel in Adler. Ederan Hotel provides a free transfer to the beach, a 20-minute walk away.

Rooms at Ederan Hotel Adler feature classic décor and air conditioning. Cable TV, a refrigerator and a private bathroom are standard in all rooms. Rooms offer a view of the Caucasus Mountains.

An American breakfast is available each morning in the café, which includes a large landscape painting. Russian and European dishes are also served here.

In summer, guests are welcome to relax at the pool bar. There is also a childrens playground.

Free parking spaces are available nearbly. The Ederan Hotel is a 30-minute drive from Adler Train Station and Adler-Sochi International Airport. The mountain ski resort of Krasnaya Polyana is within a 1-hour drive. The hotel offers shuttle service to/from Rosa Khutor ski resort at surcharge.",+78622416189,Non-smoking rooms Airport shuttle Laundry facilities Dry cleaning/laundry service Skiing Barber/beauty shop Ironing service Free self parking Internet access Express check-in Safe-deposit box at front desk Massage Children s playground Gift shops or newsstand Bicycle rental (additional charge) Library Packed lunches Car hire Tour desk Heating Fax/photocopying Luggage storage Shopping on site Free WiFi Ski storage Free WiFi Non-smoking throughout Air conditioning Designated smoking areas Outdoor seasonal pool Ski equipment hire (on site) Special diet menus (on request) Free airport transportation Shared kitchen Mini-market on site Daily housekeeping 24-hour front desk Terrace,43.39778|40.00401,(7) 8622416189,354375,https://www.booking.com/hotel/ru/ederan.html
RU,Russian Federation,150254,Adler,1062055,Vesna Hotel & Spa,ThreeStar,Lenina Street 219A Adler354364 Sochi ,Distances are displayed to the nearest 0.1 mile and kilometer. <br /> <p>Adler Beach - 0.5 km / 0.3 mi <br /> Sochi Dolphinarium - 0.6 km / 0.4 mi <br /> Sochi Discovery World Aquarium - 0.6 km / 0.4 mi <br /> Aquapark Amfibius - 0.8 km / 0.5 mi <br /> Khosta Beach - 6.3 km / 3.9 mi <br /> Adler History Museum - 6.4 km / 4 mi <br /> St. Sarkis Cathedral - 6.4 km / 4 mi <br /> Mandarin Mall - 6.5 km / 4 mi <br /> Noviy Vek - 7.8 km / 4.8 mi <br /> Ice Cube Curling Center - 9.5 km / 5.9 mi <br /> Bolshoy Ice Dome - 9.6 km / 6 mi <br /> Shayba Arena - 9.6 km / 6 mi <br /> Olympic Park - 10.7 km / 6.6 mi <br /> Sochi Autodrom - 11.1 km / 6.9 mi <br /> Iceberg Skating Palace - 11.2 km / 7 mi <br /> </p><p>The nearest major airport is Sochi (AER-Sochi Intl.) - 6.3 km / 3.9 mi</p>,"<p><b>Property Location</b> <br />When you stay at Vesna Hotel & Spa in Adler, you'll be on the beach, within a 10-minute walk of Adler Beach and Sochi Dolphinarium.  This beach hotel is 0.5 mi (0.8 km) from Aquapark Amfibius and 0.8 mi (1.2 km) from Sochi Discovery World Aquarium.</p><p><b>Rooms</b> <br />Make yourself at home in one of the 458 air-conditioned rooms featuring refrigerators. Rooms have private balconies. Complimentary wireless Internet access keeps you connected, and digital programming is available for your entertainment. Private bathrooms have jetted bathtubs and complimentary toiletries.</p><p><b>Amenities</b> <br />Pamper yourself with onsite massages and body treatments. You're sure to appreciate the recreational amenities, including a water park (surcharge), an outdoor pool, and an indoor pool. This hotel also features complimentary wireless Internet access, a hair salon, and tour/ticket assistance.</p><p><b>Dining</b> <br />At Vesna Hotel & Spa, enjoy a satisfying meal at the restaurant. Quench your thirst with your favorite drink at the poolside bar. Buffet breakfasts are available daily from 8:30 AM to 10 AM for a fee.</p><p><b>Business, Other Amenities</b> <br />Featured amenities include a business center, dry cleaning/laundry services, and a 24-hour front desk. Event facilities at this hotel consist of a conference center and meeting rooms. Self parking (subject to charges) is available onsite.</p>",+78622463399,24-hour front desk Billiards or pool table Breakfast available (surcharge) Business center Children's pool Conference center Dry cleaning/laundry service Fitness facilities Free WiFi Hair salon Indoor pool Laundry facilities Meeting rooms - 3 Outdoor pool Outdoor seasonal pool Pool sun loungers Pool umbrellas Poolside bar Restaurant Safe-deposit box at front desk Sauna Self parking (surcharge) Spa treatment room(s) Total number of rooms - 458 Tours/ticket assistance Water park access (surcharge) Waterslide,43.468509674|39.897769928,7-862-2463399,354364,http://www.vesna-sochi.ru/
