countyCode,countyName,cityCode,cityName,HotelCode,HotelName,HotelRating,Address,Attractions,Description,FaxNumber,HotelFacilities,Map,PhoneNumber,PinCode,HotelWebsiteUrl
SK,Slovakia,109840,Banska Stiavnica (Schemnitz),1418041,Hotel Kerling,OneStar,Dolná 12 A 96901 Banská tiavnica ,,"Hotel Kerling is located 700 metres from the medieval centre of the UNESCO-listed town of Banská tiavnica. Housing a sauna and gym, it also offers free WiFi.

All well-lit rooms come with hardwood floors and feature a private bathroom with shower or bathtub. Satellite TV is provided.

Guests can unwind in the stylish bar in the Kerling, or sample international cuisine at the modern restaurant. Meals can also be enjoyed on the summer terrace. A special kids menu and a childrens corner are available.

The Old as well as the New Castle are both a 15-minute walk away. tiavnické jazerá Lakes are 4 km away. Sklene Teplice Thermal Spa can be reached within 12 km.

In addition to the free public parking, a private underground garage is offered at a surcharge.",,Parking Restaurant Pets allowed Bar Non-smoking rooms Laundry Skiing Family rooms Games room internet services lift Massage Billiards Fitness centre Garden Terrace Hiking Car hire Heating Luggage storage wifi Ski storage Free WiFi Air conditioning designated smoking area Snack Bar Sun terrace wifi available in all areas Parking garage Fire extinguishers,48.45481|18.90301,045/694 99 12,96901,https://www.booking.com/hotel/sk/kerling.html
SK,Slovakia,109840,Banska Stiavnica (Schemnitz),1593936,Penzion Cosmopolitan II.,ThreeStar,Andreja Kmeta 18 969 01 Banská tiavnica ,Distances are displayed to the nearest 0.1 mile and kilometer. <br /> <p>Historic Town of Banská tiavnica and the Technical Monuments in its Vicinity - 0.1 km / 0.1 mi <br /> The Church of the Assumption of the Virgin Mary - 0.2 km / 0.1 mi <br /> Holy Church of St. Catherine - 0.2 km / 0.1 mi <br /> Banska Stiavnica Botanical Garden - 0.2 km / 0.1 mi <br /> Evangelical Church - 0.2 km / 0.1 mi <br /> Church of Ascenssion of the Virgin - 0.3 km / 0.2 mi <br /> Trinity Square - 0.3 km / 0.2 mi <br /> Slovak Mining Museum - Jozef Kollar Gallery - 0.3 km / 0.2 mi <br /> New Castle - 0.4 km / 0.2 mi <br /> Novy zamok - 0.5 km / 0.3 mi <br /> Open-Air Mining Museum - 1.6 km / 1 mi <br /> Kalvária - 1.6 km / 1 mi <br /> Salamandra Resort - 4.6 km / 2.9 mi <br /> Chateau Svaty Anton - 5.8 km / 3.6 mi <br /> Ludovita Stura Park - 30.1 km / 18.7 mi <br /> </p><p>The nearest airports are:<br />Bratislava (BTS-M.R.Stefanika) - 162.6 km / 101 mi<br /> Kosice (KSC-Barca) - 234.1 km / 145.5 mi<br /> Zilina (ILZ) - 129 km / 80.2 mi<br /> Poprad (TAT-Poprad - Tatry) - 169.3 km / 105.2 mi<br /> </p><p></p>,"<p>HeadLine : Near The Church of the Assumption of the Virgin Mary</p><p>Location : With a stay at Penzión Cosmopolitan II. in Banska Stiavnica, you ll be just steps from Historic Town of Banská tiavnica and the Technical Monuments in its Vicinity and The Church of the Assumption of the Virgin Mary.  This pension is 0.1 mi (0.2 km) from Holy Church of St. Catherine and 0.1 mi (0.2 km) from Evangelical Church.</p><p>Rooms : Make yourself at home in one of the 9 guestrooms. Complimentary wireless Internet access keeps you connected, and digital programming is available for your entertainment. Bathrooms have bathtubs or showers and complimentary toiletries. Conveniences include safes and desks, and housekeeping is provided once per stay.</p><p>Dining : Take advantage of the pension s room service (during limited hours).</p><p>CheckIn Instructions : <ul>  <li>Extra-person charges may apply and vary depending on property policy</li><li>Government-issued photo identification and a credit card, debit card, or cash deposit may be required at check-in for incidental charges</li><li>Special requests are subject to availability upon check-in and may incur additional charges; special requests cannot be guaranteed</li><li>Guests must contact this property in advance to reserve cribs/infant beds</li><li>This property accepts credit cards</li>  </ul></p><p>Special Instructions : This property doesn t offer after-hours check-in. Front desk staff will greet guests on arrival.</p>",,Distance from property (meters) - 100 Safe-deposit box at front desk Smoke-free property Tours/ticket assistance Luggage storage Distance from property (ft) - 328 Multilingual staff Number of meeting rooms - 15 Shared microwave Free WiFi Shared refrigerator,48.45838|18.89545,421-456921113,96901,http://2.penzioncosmopolitan.sk
SK,Slovakia,109840,Banska Stiavnica (Schemnitz),1643008,Hotel Bristol,ThreeStar,Andreja Kmeta 123/11 96901 Banska Stiavnica ,Distances are displayed to the nearest 0.1 mile and kilometer. <br /> <p>Historic Town of Banská tiavnica and the Technical Monuments in its Vicinity - 0.1 km / 0.1 mi <br /> Evangelical Church - 0.1 km / 0.1 mi <br /> Holy Church of St. Catherine - 0.1 km / 0.1 mi <br /> The Church of the Assumption of the Virgin Mary - 0.2 km / 0.2 mi <br /> Banska Stiavnica Botanical Garden - 0.3 km / 0.2 mi <br /> Trinity Square - 0.3 km / 0.2 mi <br /> Slovak Mining Museum - Jozef Kollar Gallery - 0.3 km / 0.2 mi <br /> Church of Ascenssion of the Virgin - 0.4 km / 0.2 mi <br /> New Castle - 0.4 km / 0.3 mi <br /> Novy zamok - 0.6 km / 0.3 mi <br /> Open-Air Mining Museum - 1.7 km / 1.1 mi <br /> Kalvária - 1.7 km / 1.1 mi <br /> Salamandra Resort - 4.6 km / 2.9 mi <br /> Chateau Svaty Anton - 5.9 km / 3.6 mi <br /> Ludovita Stura Park - 30.1 km / 18.7 mi <br /> </p><p>The preferred airport for Hotel Bristol is Bratislava (BTS-M.R.Stefanika) - 160.6 km / 99.8 mi </p>,"<p>HeadLine : Near Salamandra Resort</p><p>Location : A stay at Hotel Bristol places you in the heart of Banska Stiavnica, steps from Historic Town of Banská tiavnica and the Technical Monuments in its Vicinity and Evangelical Church.  This family-friendly hotel is 0.1 mi (0.1 km) from Holy Church of St. Catherine and 0.2 mi (0.3 km) from The Church of the Assumption of the Virgin Mary.</p><p>Rooms : Stay in one of 16 guestrooms featuring flat-screen televisions. Your room comes with a Select Comfort bed. Complimentary wireless Internet access keeps you connected, and cable programming is available for your entertainment. Bathrooms have showers and complimentary toiletries.</p><p>Dining : Enjoy a meal at the restaurant or snacks in the coffee shop/cafe. The hotel also offers room service (during limited hours). Quench your thirst with your favorite drink at the bar/lounge. Buffet breakfasts are available daily from 8 AM to 10 AM for a fee.</p><p>CheckIn Instructions : <ul>  <li>Extra-person charges may apply and vary depending on property policy</li><li>Government-issued photo identification and a credit card, debit card, or cash deposit may be required at check-in for incidental charges</li><li>Special requests are subject to availability upon check-in and may incur additional charges; special requests cannot be guaranteed</li><li>This property accepts credit cards</li>  </ul></p><p>Special Instructions : The front desk is open daily from 8 AM - 7:00 PM. This property doesn t offer after-hours check-in. Front desk staff will greet guests on arrival. At check-in, guests must provide a negative Antigen COVID-19 test result. The negative COVID-19 test result requirement applies to all guests aged 12 and up, and the test must have been administered no more than 48 hours prior to check-in.</p>",421-905-771211,Sauna Offsite parking reservations required Children's club (surcharge) Terrace Dry cleaning/laundry service Distance from property (meters) - 300 Mountain biking nearby Banquet hall Food and water bowls Babysitting or childcare (surcharge) Street parking Number of meeting rooms - 1 Television in common areas Free WiFi Downhill skiing nearby Number of bars/lounges - 1 Cross-country skiing nearby Ski storage Garden Bicycle rentals nearby Free newspapers in lobby Snowboarding Nearby Tours/ticket assistance Volleyball on site Supervised childcare/activities (surcharge) Fishing on site Luggage storage Distance from property (ft) - 984 Multilingual staff Ski equipment rental shops nearby Front desk (limited hours) Ski lessons available nearby Breakfast available (surcharge) Ski-in/ski-out access Library Barbecue grill(s) Safe-deposit box at front desk Smoke-free property Ecotours nearby Number of coffee shops/cafes - 1 Laundry facilities,48.45863|18.89437,421-905-771211,96901,
SK,Slovakia,109840,Banska Stiavnica (Schemnitz),1683166,Penzion Resla Pri Klopacke,ThreeStar,Dolna Resla 2 969 01 Banska Stiavnica ,Distances are displayed to the nearest 0.1 mile and kilometer. <br /> <p>Historic Town of Banská tiavnica and the Technical Monuments in its Vicinity - 0.1 km / 0.1 mi <br /> New Castle - 0.3 km / 0.2 mi <br /> Evangelical Church - 0.3 km / 0.2 mi <br /> Holy Church of St. Catherine - 0.3 km / 0.2 mi <br /> Trinity Square - 0.4 km / 0.2 mi <br /> Slovak Mining Museum - Jozef Kollar Gallery - 0.4 km / 0.2 mi <br /> Novy zamok - 0.4 km / 0.3 mi <br /> The Church of the Assumption of the Virgin Mary - 0.6 km / 0.4 mi <br /> Banska Stiavnica Botanical Garden - 0.6 km / 0.4 mi <br /> Church of Ascenssion of the Virgin - 0.7 km / 0.4 mi <br /> Open-Air Mining Museum - 1.8 km / 1.1 mi <br /> Kalvária - 1.8 km / 1.1 mi <br /> Salamandra Resort - 4.3 km / 2.7 mi <br /> Chateau Svaty Anton - 6.2 km / 3.8 mi <br /> Ludovita Stura Park - 30.8 km / 19.2 mi <br /> </p><p>The nearest airports are:<br />Bratislava (BTS-M.R.Stefanika) - 161.3 km / 100.2 mi<br /> Kosice (KSC-Barca) - 234.9 km / 145.9 mi<br /> Zilina (ILZ) - 129.8 km / 80.7 mi<br /> Poprad (TAT-Poprad - Tatry) - 170.1 km / 105.7 mi<br /> </p><p></p>,"<p>HeadLine : Near Evangelical Church</p><p>Location : A stay at Resla Residence places you in the heart of Banska Stiavnica, steps from Historic Town of Banská tiavnica and the Technical Monuments in its Vicinity and 3 minutes by foot from New Castle.  This hotel is 0.3 mi (0.4 km) from Novy zamok and 0.5 mi (0.7 km) from Evangelical Church.</p><p>Rooms : Make yourself at home in one of the 14 guestrooms. Complimentary wireless Internet access keeps you connected, and satellite programming is available for your entertainment. Conveniences include phones and electric kettles, and housekeeping is provided daily.</p><p>Dining : Enjoy a meal at the restaurant or snacks in the hotel s coffee shop/cafe. Wrap up your day with a drink at the bar/lounge. Buffet breakfasts are available daily from 8:00 AM to 10:00 AM for a fee.</p><p>CheckIn Instructions : <ul>  <li>Extra-person charges may apply and vary depending on property policy</li><li>Government-issued photo identification and a credit card, debit card, or cash deposit may be required at check-in for incidental charges</li><li>Special requests are subject to availability upon check-in and may incur additional charges; special requests cannot be guaranteed</li><li>This property accepts credit cards, debit cards, and cash</li>  </ul></p><p>Special Instructions : The front desk is open daily from 8:00 AM - 10:00 PM. To make arrangements for check-in please contact the property at least 24 hours before arrival using the information on the booking confirmation. Guests must contact the property in advance for check-in instructions. Front desk staff will greet guests on arrival.</p>",421918802995,Uncovered parking Wheelchair accessible  no Luggage storage Firepit Outdoor furniture Multilingual staff Front desk (limited hours) Breakfast available (surcharge) Free WiFi Number of bars/lounges - 1 Barbecue grill(s) Spa services on site Garden Picnic area Smoke-free property Number of coffee shops/cafes - 1 Self parking (surcharge) Terrace,48.457521|18.892541,421918802995,96901,http://www.penzionresla.sk
SK,Slovakia,109840,Banska Stiavnica (Schemnitz),1750921,Hostel Skautsky Dom,All,Antona Pecha 2 96901 Banska Stiavnica ,,"Hostel Skautský dom is set in a historic building in the UNESCO-protected town of Banská tiavnica, next to the Old Castle. It offers a garden with a terrace, playground and barbecue facilities. Free WiFi is provided.

All rooms feature wooden furniture and a seating area. Bathrooms are private or shared.

Guests of the Skautský dom can use a fully equipped shared kitchen and relax in the common living room with a TV. Table tennis is also available.

Numerous restaurants serving local specialities are in the immediate vicinity. The Klinger and Vodarenska Lakes are 2 km away. and the Main Bus and Train Stations are within 3 km from the hostel. Please inform Hostel Skautský dom in advance of your expected arrival time. You can use the Special Requests box when booking, or contact the property directly with the contact details provided in your confirmation.",,Parking Pets allowed meeting/banquet facilities Garden Terrace Non-smoking rooms Family rooms Games room internet services Table tennis Hiking BBQ facilities Cycling Heating Luggage storage wifi Free WiFi Non-smoking throughout Sun terrace Private check-in/check-out Shared kitchen parking on site Private parking wifi available in all areas Indoor play area kids' outdoor play equipment Outdoor furniture Picnic area Key access Fire extinguishers staff follow all safety protocols as directed by local authorities hand sanitizer in guest accommodation and key areas first aid kit available invoice provided,48.45883|18.89079,+421905382885,96901,https://www.booking.com/hotel/sk/hostel-skautsky-dom.html
SK,Slovakia,109840,Banska Stiavnica (Schemnitz),1787205,Penzion Altmayer,All,Horna Roven 431 Stiavnicke Bane969 81 Banska Stiavnica ,,"Featuring mountain views, Penzión Altmayer in Banská tiavnica features accommodation, a terrace, a restaurant, a bar and barbecue facilities. The bed and breakfast features both WiFi and private parking free of charge.

Hiking and skiing are possible within the area, and Penzión Altmayer offers ski storage space.

Kremnica Town Castle is 49 km from the accommodation, while The Church of St. Catherine is 4.7 km from the property. The nearest airport is Budapest Ferenc Liszt International Airport, 155 km from Penzión Altmayer.",,Parking Restaurant Pets allowed meeting/banquet facilities Bar Sauna Terrace Non-smoking rooms Skiing Family rooms Ironing service Free parking internet services Hot tub/jacuzzi Hiking BBQ facilities Heating Luggage storage wifi Ski storage Free WiFi Non-smoking throughout Lockers parking on site Private parking Kid meals secured parking Wine/champagne use of cleaning chemicals that are effective against coronavirus linens  towels and laundry washed in accordance with local authority guidelines guest accommodation is disinfected between stays guest accommodation sealed after cleaning physical distancing in dining areas food can be delivered to guest accommodation staff follow all safety protocols as directed by local authorities shared stationery such as printed menus  magazines  pens  and paper removed hand sanitizer in guest accommodation and key areas process in place to check health of guests first aid kit available contactless check-in/check-out cashless payment available physical distancing rules followed mobile app for room service screens or physical barriers placed between staff and guests in appropriate areas invoice provided property is cleaned by professional cleaning companies all plates  cutlery  glasses and other tableware have been sanitized guests have the option to cancel any cleaning services for their accommodation during their stay breakfast takeaway containers delivered food is securely covered thermometers for guests provided by property face masks for guests available,48.44768|18.87473,,969 81,http://www.penzionaltmayer.sk
SK,Slovakia,109840,Banska Stiavnica (Schemnitz),1788044,Gavalier Design Rooms,FourStar,Namestie Svatej Trojice 14 969 01 Banska Stiavnica ,,"Gavalier Design Rooms offers accommodation in Banská tiavnica.

Each room is equipped with a flat-screen TV with satellite channels. Some rooms feature a seating area to relax in after a busy day. You will find a kettle in the room. Rooms are equipped with a private bathroom equipped with a shower. For your comfort, you will find slippers and free toiletries.

Old Chateau Banska Stiavnica is 100 metres from Gavalier Design Rooms, while New Chateau Banska Stiavnica is 200 metres from the property. This property will not accommodate hen, stag or similar parties.
If you expect to arrive outside reception opening hours, please inform the property in advance. Contact details are stated in the booking confirmation.",,Private check-in/check-out wifi available in all areas Pets allowed Bar Terrace Non-smoking rooms internet services Safety Deposit Box Soundproof rooms Heating wifi Free WiFi Non-smoking throughout,48.46039|18.89228,,969 01,https://www.booking.com/hotel/sk/gavalier-design-rooms.html
SK,Slovakia,109840,Banska Stiavnica (Schemnitz),1848850,Divná Pani Luxury Gallery Rooms,FiveStar,Andreja Kmeta 120/8 969 01 Banská Stiavnica ,Distances are displayed to the nearest 0.1 mile and kilometer. <br /> <p>Historic Town of Banská tiavnica and the Technical Monuments in its Vicinity - 0.1 km / 0.1 mi <br /> Evangelical Church - 0.2 km / 0.1 mi <br /> Holy Church of St. Catherine - 0.2 km / 0.1 mi <br /> The Church of the Assumption of the Virgin Mary - 0.2 km / 0.1 mi <br /> Banska Stiavnica Botanical Garden - 0.3 km / 0.2 mi <br /> Trinity Square - 0.3 km / 0.2 mi <br /> Slovak Mining Museum - Jozef Kollar Gallery - 0.3 km / 0.2 mi <br /> Church of Ascenssion of the Virgin - 0.3 km / 0.2 mi <br /> New Castle - 0.4 km / 0.2 mi <br /> Novy zamok - 0.5 km / 0.3 mi <br /> Open-Air Mining Museum - 1.7 km / 1.1 mi <br /> Kalvária - 1.7 km / 1.1 mi <br /> Salamandra Resort - 4.6 km / 2.9 mi <br /> Chateau Svaty Anton - 5.9 km / 3.6 mi <br /> Ludovita Stura Park - 30.1 km / 18.7 mi <br /> </p><p>The nearest airports are:<br />Bratislava (BTS-M.R.Stefanika) - 160.8 km / 99.9 mi<br /> Kosice (KSC-Barca) - 234.2 km / 145.5 mi<br /> Zilina (ILZ) - 129.1 km / 80.2 mi<br /> Poprad (TAT-Poprad - Tatry) - 169.4 km / 105.3 mi<br /> </p><p></p>,"<p>HeadLine : Near Holy Church of St. Catherine</p><p>Location : With a stay at Divná Pani Luxury Gallery Rooms in Banska Stiavnica, you ll be just steps from Historic Town of Banská tiavnica and the Technical Monuments in its Vicinity and Evangelical Church.  This 5-star hotel is 0.1 mi (0.1 km) from Holy Church of St. Catherine and 0.1 mi (0.2 km) from The Church of the Assumption of the Virgin Mary.</p><p>Rooms : Make yourself at home in one of the 10 guestrooms featuring minibars. Rooms have private balconies or patios. Complimentary wireless Internet access is available to keep you connected. Private bathrooms with showers feature designer toiletries and hair dryers.</p><p>Dining : Satisfy your appetite at the hotel s coffee shop/cafe, or stay in and take advantage of the room service (during limited hours). Quench your thirst with your favorite drink at the bar/lounge. A complimentary continental breakfast is served daily from 7:30 AM to 1:00 PM.</p><p>CheckIn Instructions : <ul>  <li>Extra-person charges may apply and vary depending on property policy</li><li>Government-issued photo identification and a credit card may be required at check-in for incidental charges</li><li>Special requests are subject to availability upon check-in and may incur additional charges; special requests cannot be guaranteed</li><li>Guests must contact this property in advance to reserve cribs/infant beds, rollaway/extra beds, and sofa beds</li><li>This property accepts credit cards; cash is not accepted</li>  </ul></p><p>Special Instructions : The front desk is open daily from 7 AM - 10 PM. To make arrangements for check-in please contact the property at least 24 hours before arrival using the information on the booking confirmation. If you are planning to arrive after 9 PM please contact the property in advance using the information on the booking confirmation. Guests must contact the property in advance for check-in instructions. Front desk staff will greet guests on arrival.</p>",,Children's club (free) Self parking (surcharge) Terrace Free continental breakfast Concierge services Dry cleaning/laundry service Luggage storage Free breakfast Front desk (limited hours) Free WiFi Library Number of bars/lounges - 1 Daily Garden Safe-deposit box at front desk Smoke-free property Bicycle rentals nearby Snack bar/deli Number of coffee shops/cafes - 1 Laundry facilities Free newspapers in lobby Tours/ticket assistance,48.45857|18.8946,421-421-948019013,96901,
SK,Slovakia,109840,Banska Stiavnica (Schemnitz),1855968,Penzión Na Kopci,ThreeStar,portová 8 96901 Banská tiavnica ,Distances are displayed to the nearest 0.1 mile and kilometer. <br /> <p>Historic Town of Banská tiavnica and the Technical Monuments in its Vicinity - 0.1 km / 0.1 mi <br /> Church of Ascenssion of the Virgin - 0.9 km / 0.6 mi <br /> Banska Stiavnica Botanical Garden - 0.9 km / 0.6 mi <br /> The Church of the Assumption of the Virgin Mary - 1 km / 0.6 mi <br /> Open-Air Mining Museum - 1.1 km / 0.7 mi <br /> Kalvária - 1.1 km / 0.7 mi <br /> Evangelical Church - 1.3 km / 0.8 mi <br /> Holy Church of St. Catherine - 1.3 km / 0.8 mi <br /> Trinity Square - 1.3 km / 0.8 mi <br /> Slovak Mining Museum - Jozef Kollar Gallery - 1.3 km / 0.8 mi <br /> New Castle - 1.4 km / 0.9 mi <br /> Novy zamok - 1.5 km / 0.9 mi <br /> Chateau Svaty Anton - 5.3 km / 3.3 mi <br /> Salamandra Resort - 11.4 km / 7.1 mi <br /> Ludovita Stura Park - 30.4 km / 18.9 mi <br /> </p><p>The nearest airports are:<br />Bratislava (BTS-M.R.Stefanika) - 162.9 km / 101.2 mi<br /> Kosice (KSC-Barca) - 234.4 km / 145.7 mi<br /> Zilina (ILZ) - 129.3 km / 80.4 mi<br /> Poprad (TAT-Poprad - Tatry) - 169.6 km / 105.4 mi<br /> </p><p></p>,"<p>HeadLine : Near Church of Ascenssion of the Virgin</p><p>Location : With a stay at Penzión na Kopci in Banska Stiavnica, you ll be a 1-minute walk from Historic Town of Banská tiavnica and the Technical Monuments in its Vicinity and 11 minutes by foot from Church of Ascenssion of the Virgin.  This pension is 0.7 mi (1.1 km) from Open-Air Mining Museum and 0.7 mi (1.1 km) from Kalvária.</p><p>Rooms : Make yourself at home in one of the 9 guestrooms featuring refrigerators and flat-screen televisions. Rooms have private balconies or patios. Complimentary wireless Internet access is available to keep you connected. Private bathrooms with showers feature complimentary toiletries and hair dryers.</p><p>Dining : At Penzión na Kopci, enjoy a satisfying meal at the restaurant. A complimentary continental breakfast is served daily.</p><p>CheckIn Instructions : <ul>  <li>Extra-person charges may apply and vary depending on property policy</li><li>Government-issued photo identification and a credit card, debit card, or cash deposit may be required at check-in for incidental charges</li><li>Special requests are subject to availability upon check-in and may incur additional charges; special requests cannot be guaranteed</li><li>This property accepts credit cards</li>  </ul></p><p>Special Instructions : The front desk is open daily from 8 AM - 8:00 PM. To make arrangements for check-in please contact the property at least 24 hours before arrival using the information on the booking confirmation. Prior to arrival, guests must complete online registration with the property via a secure link. If you are planning to arrive after 8 PM please contact the property in advance using the information on the booking confirmation. Guests planning to arrive outside of normal check-in hours must contact the property in advance for check-in instructions and key retrieval information. Front desk staff will greet guests on arrival.</p>",421-905317122,Luggage storage Free breakfast Meeting rooms Front desk (limited hours) Free WiFi Playground on site Daily Barbecue grill(s) Garden Picnic area Smoke-free property Wheelchair accessible parking Free newspapers in lobby Roll-in shower (in select rooms) Accessible bathroom (in select rooms) Free self parking Terrace Free continental breakfast Wheelchair accessible path of travel,48.45691|18.90397,421-905317122,96901,http://nakopci.sk
