countyCode,countyName,cityCode,cityName,HotelCode,HotelName,HotelRating,Address,Attractions,Description,FaxNumber,HotelFacilities,Map,PhoneNumber,PinCode,HotelWebsiteUrl
ES,Spain,100323,A Coruña,5360651,Casa Rural A Cobacha,ThreeStar,Acobacha Parroquia San Xulian De Vigo 50  ,Distances are displayed to the nearest 0.1 mile and kilometer. <br /> <p>Irmans Garcia Naveira Square - 9.1 km / 5.7 mi <br /> Betanzos Church of San Francisco - 9.6 km / 6 mi <br /> Parque el Pasatiempo - 10.2 km / 6.4 mi <br /> Museo das Marinas - 10.3 km / 6.4 mi <br /> Pazo de Marinan - 14.9 km / 9.3 mi <br /> Monastery of Santa María de Monfero - 16.4 km / 10.2 mi <br /> Seca do Pedrido - 17.9 km / 11.1 mi <br /> Praia do Pedrido - 17.9 km / 11.1 mi <br /> Punta de Fos - 18.2 km / 11.3 mi <br /> Xurela - 18.3 km / 11.4 mi <br /> Praia da Insua - 18.4 km / 11.4 mi <br /> Praia da Abeleira - 18.6 km / 11.5 mi <br /> Praia da Alameda - 18.7 km / 11.6 mi <br /> Praia de Cabana - 19.1 km / 11.9 mi <br /> Praia de Gandarío - 19.2 km / 11.9 mi <br /> </p><p>The nearest airports are:<br />Santiago de Compostela (SCQ-Lavacolla) - 77.5 km / 48.2 mi<br /> La Coruna (LCG) - 35.9 km / 22.3 mi<br /> </p><p></p>,"<p>HeadLine : Next to a golf course</p><p>Location : With a stay at Casa Rural A Cobacha in Paderne, you ll be 5.7 mi (9.1 km) from Irmans Garcia Naveira Square and 6 mi (9.6 km) from Betanzos Church of San Francisco.  This golf guesthouse is 6.4 mi (10.2 km) from Parque el Pasatiempo and 9.3 mi (14.9 km) from Pazo de Marinan.</p><p>Rooms : Make yourself at home in one of the 2 individually decorated guestrooms, featuring kitchens with full-sized refrigerators/freezers and ovens. Your bed comes with down comforters and premium bedding. Rooms have private patios. 45-inch flat-screen televisions with digital programming provide entertainment, while complimentary wireless Internet access keeps you connected.</p><p>Dining : Relax with a refreshing drink at one of the 10 beach bars. A complimentary continental breakfast is served daily from 6:00 AM to 11:30 AM.</p><p>Renovations : The property is closed between July 15 and December 31.</p><p>CheckIn Instructions : <ul>  <li>Extra-person charges may apply and vary depending on property policy</li><li>Government-issued photo identification and a credit card, debit card, or cash deposit may be required at check-in for incidental charges</li><li>Special requests are subject to availability upon check-in and may incur additional charges; special requests cannot be guaranteed</li><li>Guests must contact this property in advance to reserve cribs/infant beds and rollaway/extra beds</li><li>This property accepts credit cards, debit cards, and cash</li>  </ul></p><p>Special Instructions : To make arrangements for check-in please contact the property at least 24 hours before arrival using the information on the booking confirmation. If you are planning to arrive after 8:00 PM please contact the property in advance using the information on the booking confirmation. Guests must contact the property in advance for check-in instructions. Front desk staff will greet guests on arrival.</p>",34-0034-305258175,Golf cart Optional golf privileges Beach umbrellas Express check-in Free WiFi Hiking/biking trails on site Number of beach bars - 10 Garden Picnic area In-room accessibility (in select rooms) Roll-in shower (in select rooms) Tours/ticket assistance Beach towels Free continental breakfast Free bicycles on site Golf lessons on site Clubhouse Luggage storage Free breakfast Express check-out Hunting nearby 24-hour front desk Library Daily Barbecue grill(s) Smoke-free property Ecotours nearby Laundry facilities Free self parking Beach sun loungers Terrace,43.26889|-8.13638,34-0034-605258175,15314,
ES,Spain,100323,A Coruña,5442705,Muinos do Mainzoso,All,Vilamourel O Batan  ,,"Located in Paderne in the Galicia region and Tower of Hercules reachable within 33 km, Casas del Molino - Muiños do Mainzoso Turismo Rural provides accommodation with free WiFi, BBQ facilities, a garden and free private parking.

The accommodation comes with a flat-screen TV and a private bathroom with bath or shower and free toiletries, while the kitchen features a fridge, an oven and a microwave. A stovetop and toaster are also featured, as well as a coffee machine.

If you would like to discover the area, hiking is possible in the surroundings.

Aquarium Finisterrae is 33 km from the holiday home, while Marina Sada is 18 km away. The nearest airport is A Coruña Airport, 22 km from Casas del Molino - Muiños do Mainzoso Turismo Rural.",,Parking Pets allowed Golf course (within 3 km) Garden Fishing Free parking internet services Hiking BBQ facilities Heating Horse riding wifi Free WiFi parking on site Private parking wifi available in all areas Public Bath Fire extinguishers invoice provided,43.2782|-8.16514,,15314,https://www.booking.com/hotel/es/muinos-do-mainzoso.html
ES,Spain,100323,A Coruña,5487863,Holiday Home Aldea Campelo,ThreeStar,Aldea Campelo 22  ,Distances are displayed to the nearest 0.1 mile and kilometer. <br /> <p>Pozo Bastón - 2.7 km / 1.7 mi <br /> Hórreo do Araño - 9.1 km / 5.6 mi <br /> Praia de Sosolmos - 13.1 km / 8.2 mi <br /> Torres do Oeste - 13.5 km / 8.4 mi <br /> Ría de Arousa - 13.6 km / 8.5 mi <br /> Praia da Torre - 13.7 km / 8.5 mi <br /> Praia do Pazo - 14.5 km / 9 mi <br /> Punta Fincheira - 16.7 km / 10.4 mi <br /> Praia de Quenxo - 16.7 km / 10.4 mi <br /> Praia de Tanxil - 16.8 km / 10.5 mi <br /> Praia do Tronco - 17.2 km / 10.7 mi <br /> Praia Riba de MAr - 18.6 km / 11.5 mi <br /> Praia de Porrón - 18.7 km / 11.6 mi <br /> Praia de Lodeiro - 18.9 km / 11.8 mi <br /> Praia de Sartaxes - 19.3 km / 12 mi <br /> </p><p>The nearest major airport is Santiago de Compostela (SCQ-Lavacolla) - 55.7 km / 34.6 mi</p>,"<p>HeadLine : Near Pozo Bastón</p><p>Location : When you stay at this vacation home in Rianxo, you ll be 9 minutes by car from Pozo Bastón.  This vacation home is 5.6 mi (9.1 km) from Hórreo do Araño and 8.2 mi (13.1 km) from Praia de Sosolmos.</p><p>Rooms : Make yourself comfortable in this vacation home, which features a fireplace and a flat-screen TV. A kitchen is outfitted with a refrigerator, a stovetop, and a microwave. Conveniences include a washer/dryer and an iron/ironing board.</p><p>CheckIn Instructions : <ul>  <li>Extra-person charges may apply and vary depending on property policy</li><li>Government-issued photo identification and a cash deposit may be required at check-in for incidental charges</li><li>Special requests are subject to availability upon check-in and may incur additional charges; special requests cannot be guaranteed</li>  </ul></p><p>Special Instructions : Guests can choose to either self-clean the property prior to check-out, or pay an additional cleaning fee at check-out.</p>",,Barbecue grill(s) Laundry facilities Terrace Garden Free self parking,42.737998|-8.775151,1-331-75435488,15984,
ES,Spain,100323,A Coruña,5514108,Apartment Plaza Virgen De Guadalupe,ThreeStar,Plaza Virgen De Guadalupe 9  ,Distances are displayed to the nearest 0.1 mile and kilometer. <br /> <p>Ría de Arousa - 0.4 km / 0.3 mi <br /> Praia do Pazo - 0.9 km / 0.5 mi <br /> Praia de Quenxo - 1.1 km / 0.7 mi <br /> Punta Fincheira - 1.2 km / 0.7 mi <br /> Praia de Tanxil - 1.2 km / 0.8 mi <br /> Praia da Torre - 1.3 km / 0.8 mi <br /> Praia de Sosolmos - 1.8 km / 1.1 mi <br /> Praia do Tronco - 1.8 km / 1.1 mi <br /> Praia de Porrón - 2.5 km / 1.6 mi <br /> Praia de Lodeiro - 2.8 km / 1.7 mi <br /> Laxe de Leiro - 4 km / 2.5 mi <br /> Praia de Sartaxes - 4.1 km / 2.5 mi <br /> Hórreo do Araño - 6.8 km / 4.2 mi <br /> Praia Riba de MAr - 11 km / 6.8 mi <br /> Pozo Bastón - 11.1 km / 6.9 mi <br /> </p><p>The nearest major airport is Santiago de Compostela (SCQ-Lavacolla) - 57.8 km / 35.9 mi</p>,"<p>HeadLine : Near Praia do Pazo</p><p>Location : When you stay at this apartment in Rianxo, you ll be next to a golf course, within a 15-minute walk of Ría de Arousa and Praia do Pazo.  This golf apartment is 0.7 mi (1.2 km) from Praia de Quenxo and 0.9 mi (1.4 km) from Punta Fincheira.</p><p>Rooms : Make yourself comfortable in this apartment, featuring a kitchen with a refrigerator and a stovetop. Complimentary wireless Internet access keeps you connected, and a DVD player is provided for your entertainment. Conveniences include a microwave and a washer/dryer.</p><p>Renovations : This property is closed from 15 March 2020 to 11 April 2020 (dates subject to change).</p><p>CheckIn Instructions : Extra-person charges may apply and vary depending on property policy. <br />Government-issued photo identification and a cash deposit are required at check-in for incidental charges. <br />Special requests are subject to availability upon check-in and may incur additional charges. Special requests cannot be guaranteed. <ul>  </ul></p>",,elevator Laundry facilities Smoke-free property Free self parking Free WiFi,42.653568|-8.816045,33175435488,15920,
ES,Spain,100004,A Fonsagrada,1119371,Casa da Bastida,TwoStar,Lugar A Bastida 2 27112 A FonsagradaLugo ,Distances are calculated in a straight line from the property&apos;s location to the point of interest or attraction  and may not reflect actual travel distance. &lt;br /&gt;&lt;br /&gt; Distances are displayed to the nearest 0.1 mile and kilometer. &lt;p&gt;Praza Maior - 40.6 km / 25.2 mi &lt;br /&gt;Museo Provincial - 40.7 km / 25.3 mi &lt;br /&gt;Lugo Cathedral - 40.8 km / 25.3 mi &lt;br /&gt;Parque Rosalia de Castro - 41 km / 25.5 mi &lt;br /&gt;Lugo City Walls - 41 km / 25.5 mi &lt;br /&gt;Isla Pancha Lighthouse - 46.7 km / 29 mi &lt;br /&gt;Samos Monastery - 49 km / 30.5 mi &lt;br /&gt;Constitution Plaza - 51.3 km / 31.8 mi &lt;br /&gt;Tower of Andrade - 51.4 km / 31.9 mi &lt;br /&gt;St. Mary&apos;s Church - 51.4 km / 31.9 mi &lt;br /&gt;Covas Beach - 72.5 km / 45.1 mi &lt;br /&gt;Area Beach - 73.2 km / 45.5 mi &lt;br /&gt;Esteiro Beach - 74.2 km / 46.1 mi &lt;br /&gt;Abadia da Cova - 76.2 km / 47.4 mi &lt;br /&gt;Arealonga Beach - 82.3 km / 51.2 mi &lt;br /&gt;&lt;/p&gt;&lt;p&gt;The preferred airport for Casa da Bastida is La Coruna (LCG) - 106.4 km / 66.1 mi. &lt;/p&gt;,"<p><b>Property Location</b> <br />You''ll be in a national park with a stay at Casa da Bastida in Fonsagrada.</p><p><b>Rooms</b> <br />Make yourself at home in one of the 6 guestrooms, featuring kitchens. Conveniences include refrigerators, and both irons/ironing boards and rollaway/extra beds are available on request.</p><p><b>Rec, Spa, Premium Amenities</b> <br />Take in the views from a garden and make use of amenities such as concierge services and tour/ticket assistance.</p><p><b>Business, Other Amenities</b> <br />Featured amenities include multilingual staff and laundry facilities. Free self parking is available onsite.</p>",,Visa Free self parking Garden,43.1372889786783|-7.08862781524658,+34982340438,27112,http://www.casadabastida.com/index-english.html
ES,Spain,100004,A Fonsagrada,1126279,Hotel Spa Fonte Sacra,FourStar,A Fonsagrada Galicien ,City centre : 600mts Nearest Bus / Metro Stop : 60000mts Beach : 58000mts,"HotelDescription#This comfortable Rural house is situated in Lugo. Situated within 600 metres from the town centre, the Rural house is easily accessible on foot to a host of places of interest. This property offers a total of 38 units. Guests can make use of internet access to stay connected to work or home. The reception desk is open all day long. Fontesacra Hotel & Spa is not a pet-friendly establishment.",,NO Connecting rooms Rural house Bathroom Shower Bathtub Hairdryer Internet access Direct dial telephone TV Minibar Centrally regulated air conditioning   Safe NO Small pets allowed (under 5 kg) NO Large pets allowed (over 5 kg) NO Wheelchair-accessible NO Car park NO Garage 24-hour reception Wired Internet Room service Air conditioning in public areas   Hotel safe Café Restaurant Spa treatments Breakfast buffet  ,43.1192933768034|-7.072382345795631,,,
ES,Spain,100004,A Fonsagrada,1612319,Casa do Cabo,All,Braña 5 27112 FonsagradaVeiga de Logares ,,"Apartamentos rurales Casa Do Cabo has garden views, free WiFi and free private parking, set in Vega de Logares.

The country house provides guests with a terrace, mountain views, a seating area, a flat-screen TV, a fully equipped kitchen with a fridge and an oven, and a private bathroom with bidet and free toiletries. A microwave, a stovetop and toaster are also offered, as well as a coffee machine.

A garden, barbecue and a childrens playground are featured at Apartamentos rurales Casa Do Cabo.

The nearest airport is Asturias Airport, 133 km from the accommodation.",,Outdoor furniture Picnic area Outdoor fireplace Beach Fire extinguishers use of cleaning chemicals that are effective against coronavirus linens  towels and laundry washed in accordance with local authority guidelines guest accommodation is disinfected between stays staff follow all safety protocols as directed by local authorities hand sanitizer in guest accommodation and key areas first aid kit available contactless check-in/check-out physical distancing rules followed screens or physical barriers placed between staff and guests in appropriate areas invoice provided Parking Pets allowed 24-hour front desk Garden Terrace Fishing Facilities for disabled guests Family rooms Games room Ironing service Free parking internet services children's playground BBQ facilities Tour desk Heating Fax/photocopying wifi Free WiFi Sun terrace Private check-in/check-out parking on site Private parking board games/puzzles Indoor play area kids' outdoor play equipment Street parking Accessible parking,43.24928|-7.07644,+34982154784|+34982154784,27112,https://www.booking.com/hotel/es/casa-do-cabo.html
ES,Spain,100004,A Fonsagrada,1615269,Pensión Casa Manolo,ThreeStar,Buron 37 27100 FonsagradaLugo ,Distances are displayed to the nearest 0.1 mile and kilometer. <br /> <p>Seimeira de Vilagocende Waterfall - 5.6 km / 3.5 mi <br /> Church of Santa Maria - 35.6 km / 22.1 mi <br /> Teixois - 37 km / 23 mi <br /> Casa del Agua - 43.4 km / 27 mi <br /> Praia Fluvial de Baltar - 44.4 km / 27.6 mi <br /> Museum of the Mills of Mazonovo - 48.4 km / 30.1 mi <br /> </p>,"<p>HeadLine : In Fonsagrada</p><p>Location : When you stay at Pensión casa Manolo in Fonsagrada, you ll be 6 minutes by car from Seimeira de Vilagocende Waterfall.  This pension is 22.1 mi (35.6 km) from Church of Santa Maria and 23 mi (37 km) from Teixois.</p><p>Rooms : Stay in one of 5 guestrooms featuring flat-screen televisions. Complimentary wireless Internet access keeps you connected, and cable programming is available for your entertainment. Bathrooms have showers and complimentary toiletries. Conveniences include complimentary newspapers and blackout drapes/curtains, and housekeeping is provided daily.</p><p>Dining : Enjoy a meal at the restaurant or snacks in the pension s coffee shop/café. Mingle with other guests at the complimentary reception, held daily. Quench your thirst with your favorite drink at the bar/lounge. Local cuisine breakfasts are available daily from 7 AM to noon for a fee.</p><p>CheckIn Instructions : <ul>  <li>Extra-person charges may apply and vary depending on property policy</li><li>Government-issued photo identification and a credit card, debit card, or cash deposit may be required at check-in for incidental charges</li><li>Special requests are subject to availability upon check-in and may incur additional charges; special requests cannot be guaranteed</li><li>This property accepts Visa, Mastercard, debit cards, and cash</li><li>Noise-free guestrooms cannot be guaranteed</li><li>Please note that cultural norms and guest policies may differ by country and by property; the policies listed are provided by the property</li>  </ul></p><p>Special Instructions : To make arrangements for check-in please contact the property at least 72 hours before arrival using the information on the booking confirmation. If you are planning to arrive after midnight please contact the property in advance using the information on the booking confirmation. Guests must contact the property in advance for check-in instructions. Front desk staff will greet guests on arrival.  This property is located in the city s Low Emission Zone; only low-emission vehicles are permitted to enter. Guests with non-Spanish license plates must register their vehicle with the city in advance.</p>",,Free reception Bar/lounge Coffee/tea in common areas Wheelchair accessible  no Free parking nearby Breakfast available (surcharge) Snack bar/deli 24-hour front desk Laundry facilities Restaurant Tours/ticket assistance Coffee shop or café Free WiFi Smoke-free property Free newspapers in lobby,43.12776|-7.06768,+34982340408,27100,http://www.pension-casamanolo.es/
ES,Spain,100004,A Fonsagrada,1842566,Apartamentos Vilarchao,TwoStar,Calle Vilarchao 2 27100 A FonsagradaLugo ,Distances are displayed to the nearest 0.1 mile and kilometer. <br /> <p>Seimeira de Vilagocende Waterfall - 19.3 km / 12 mi <br /> Teixois - 23.2 km / 14.4 mi <br /> Museum of the Mills of Mazonovo - 25.5 km / 15.9 mi <br /> Casa del Agua - 29.5 km / 18.3 mi <br /> Church of Santa Maria - 38.4 km / 23.9 mi <br /> Os Bloques - 47.6 km / 29.6 mi <br /> Oficina de Turismo de Bual - 49.5 km / 30.8 mi <br /> Andina Caves - 50.7 km / 31.5 mi <br /> Playa De Penarronda - 50.9 km / 31.6 mi <br /> Playa De Santa Gadea - 51.3 km / 31.9 mi <br /> Praia Areosa - 51.7 km / 32.1 mi <br /> Praia Olga - 51.8 km / 32.2 mi <br /> </p>,"<p>HeadLine : In Fonsagrada</p><p>Location : With a stay at this apartment in Fonsagrada, you ll be 12 mi (19.3 km) from Seimeira de Vilagocende Waterfall and 14.4 mi (23.2 km) from Teixois.  This apartment is 15.9 mi (25.5 km) from Museum of the Mills of Mazonovo and 18.3 mi (29.5 km) from Casa del Agua.</p><p>Rooms : Make yourself comfortable in this apartment, which features a fireplace. A kitchen is outfitted with a full-sized refrigerator/freezer, an oven, and a stovetop. Complimentary wireless Internet access is available to keep you connected. Conveniences include a separate sitting area and a microwave.</p><p>CheckIn Instructions : <ul>  <li>Extra-person charges may apply and vary depending on property policy</li><li>Government-issued photo identification and a credit card, debit card, or cash deposit may be required at check-in for incidental charges</li><li>Special requests are subject to availability upon check-in and may incur additional charges; special requests cannot be guaranteed</li><li>Guests must contact this property in advance to reserve cribs/infant beds</li><li>This property accepts Visa and Mastercard</li><li>Please note that cultural norms and guest policies may differ by country and by property; the policies listed are provided by the property</li>  </ul></p><p>Special Instructions : To make arrangements for check-in please contact the property at least 48 hours before arrival using the information on the booking confirmation. Guests must contact the property in advance for check-in instructions. Front desk staff will greet guests on arrival.  This property is located in the city s Low Emission Zone; only low-emission vehicles are permitted to enter. Guests with non-Spanish license plates must register their vehicle with the city in advance.</p>",34-606-864949,Barbecue grill(s) Laundry facilities Terrace Tours/ticket assistance Free self parking Dry cleaning/laundry service In-room accessibility Smoke-free property Garden 24-hour front desk,43.20722|-7.01269,+34606864949,27100,http://turismoruralvilarchao.com/
ES,Spain,100004,A Fonsagrada,5535299,Casa Rural Oventorrillo,ThreeStar,Ventorrillo Fonsagrada  ,Distances are displayed to the nearest 0.1 mile and kilometer. <br /> <p>Teixois - 16.9 km / 10.5 mi <br /> Museum of the Mills of Mazonovo - 19.2 km / 11.9 mi <br /> Seimeira de Vilagocende Waterfall - 25.4 km / 15.8 mi <br /> Casa del Agua - 30.2 km / 18.7 mi <br /> Bay of Biscay - 35.5 km / 22 mi <br /> Os Bloques - 44.3 km / 27.5 mi <br /> Cargadeiro - 46.6 km / 29 mi <br /> Andina Caves - 47.5 km / 29.5 mi <br /> Playa De Penarronda - 47.6 km / 29.6 mi <br /> Praia Areosa - 48.4 km / 30.1 mi <br /> Praia Olga - 48.5 km / 30.1 mi <br /> Salto do Coro - 48.9 km / 30.4 mi <br /> Playa Del Sarello - 49.2 km / 30.6 mi <br /> Ponte do Pasatempo - 49.6 km / 30.8 mi <br /> Punta de La Cruz - 49.7 km / 30.9 mi <br /> </p>,"<p>HeadLine : In Fonsagrada</p><p>Location : With a stay at Casa Rural O Ventorrillo in Fonsagrada, you ll be 22 mi (35.5 km) from Bay of Biscay and 10.5 mi (16.9 km) from Teixois.  This vacation home is 11.9 mi (19.2 km) from Museum of the Mills of Mazonovo and 15.8 mi (25.4 km) from Seimeira de Vilagocende Waterfall.</p><p>Rooms : Stay in one of 6 guestrooms featuring flat-screen televisions. Complimentary wireless Internet access is available to keep you connected. Bathrooms have bathtubs and complimentary toiletries. Housekeeping is provided daily, and cribs/infant beds (complimentary) can be requested.</p><p>Dining : Enjoy a satisfying meal at oventorrillo serving guests of Casa Rural O Ventorrillo. Quench your thirst with your favorite drink at the bar/lounge. Local cuisine breakfasts are available daily from 9:00 AM to noon for a fee.</p><p>CheckIn Instructions : <ul>  <li>Extra-person charges may apply and vary depending on property policy</li><li>Government-issued photo identification and a credit card, debit card, or cash deposit may be required at check-in for incidental charges</li><li>Special requests are subject to availability upon check-in and may incur additional charges; special requests cannot be guaranteed</li><li>Guests must contact this property in advance to reserve cribs/infant beds</li><li>This property accepts credit cards, debit cards, and cash</li>  </ul></p><p>Special Instructions : There is no front desk at this property. To make arrangements for check-in please contact the property at least 24 hours before arrival using the information on the booking confirmation. Guests must contact the property for check-in instructions.</p>",,In-room accessibility (in select rooms) Free self parking Breakfast available (surcharge) Free WiFi Number of bars/lounges - 1 Garden Smoke-free property,43.2453|-7.064411,34-678551717,27112,
ES,Spain,100004,A Fonsagrada,5705242,Albergue Pension Cantabrico Fonsagrada,All,Calle Ron Numero 5  ,,"Albergue Pensión Cantábrico Fonsagrada is located in Fonsagrada. Among the facilities at this property are a shared kitchen and a 24-hour front desk, along with free WiFi throughout the property. The guest house has a garden and provides a sun terrace.

Guests at the guest house can enjoy a buffet breakfast.

The nearest airport is A Coruña Airport, 142 km from Albergue Pensión Cantábrico Fonsagrada.",,24-hour front desk Garden Non-smoking rooms Laundry Family rooms internet services Fire extinguishers Tour desk wifi Free WiFi Non-smoking throughout Sun terrace Shared kitchen wifi available in all areas Street parking Picnic area CCTV in common areas,43.12557|-7.06713,,27100,https://www.booking.com/hotel/es/cantabrico-fonsagrada.html
ES,Spain,100004,A Fonsagrada,6099004,Hotel Pórtico,ThreeStar,"Calle Mayor, 26  ",Distances are displayed to the nearest 0.1 mile and kilometer. <br /> <p>Seimeira de Vilagocende Waterfall - 5.6 km / 3.5 mi <br /> Church of Santa Maria - 35.5 km / 22 mi <br /> Teixois - 37.1 km / 23.1 mi <br /> Museum of the Mills of Mazonovo - 39.5 km / 24.6 mi <br /> Casa del Agua - 43.5 km / 27.1 mi <br /> Praia Fluvial de Baltar - 44.1 km / 27.4 mi <br /> </p>,"<p>HeadLine : In Fonsagrada</p><p>Location : When you stay at Hotel Pórtico in Fonsagrada, you ll be 12 minutes by car from Seimeira de Vilagocende Waterfall.  This pension is 22 mi (35.5 km) from Church of Santa Maria and 23.1 mi (37.1 km) from Teixois.</p><p>Rooms : Make yourself at home in one of the 9 guestrooms. Complimentary wireless Internet access is available to keep you connected. Private bathrooms with showers feature complimentary toiletries and hair dryers.</p><p>Dining : Buffet breakfasts are available daily from 7:30 AM to 10:00 AM for a fee.</p><p>CheckIn Instructions : Extra-person charges may apply and vary depending on property policy Government-issued photo identification and a credit card, debit card, or cash deposit may be required at check-in for incidental charges Special requests are subject to availability upon check-in and may incur additional charges; special requests cannot be guaranteed No onsite parking is available Guests must contact this property in advance to reserve rollaway/extra beds</p><p>Special Instructions : There is no front desk at this property.</p>",,Breakfast available (surcharge) Smoke-free property Free WiFi Free parking nearby,43.1247|-7.06837,34-630 34 72 24,27100,
