countyCode,countyName,cityCode,cityName,HotelCode,HotelName,HotelRating,Address,Attractions,Description,FaxNumber,HotelFacilities,Map,PhoneNumber,PinCode,HotelWebsiteUrl
ES,Spain,100323,A Coruña,1648624,Turismo Rural O Xastre de Anos,ThreeStar,O Cruceiro 4 Lg Anós Lugar de Anos15149 Cabana de Bergantinos ,Distances are displayed to the nearest 0.1 mile and kilometer. <br /> <p>Torres do Allo - 3.6 km / 2.2 mi <br /> Praia do Pendón - 7.2 km / 4.4 mi <br /> Praia da Urixeira - 7.8 km / 4.9 mi <br /> Birthplace of Eduardo Pondal - 9.9 km / 6.2 mi <br /> Praia de Rebordelo - 10.6 km / 6.6 mi <br /> Dolmen de Donbate - 11 km / 6.9 mi <br /> Praia de San Pedro - 11.2 km / 7 mi <br /> Praia de Balarés - 14.9 km / 9.3 mi <br /> Castelo de Vimianzo - 15.9 km / 9.9 mi <br /> Praia de Armado - 15.9 km / 9.9 mi <br /> Praia de Area das Vacas - 16.1 km / 10 mi <br /> Praia de Area Pequena da Barda - 16.2 km / 10 mi <br /> Laxe Beach - 16.2 km / 10.1 mi <br /> Praia de Area Grande da Barda - 16.3 km / 10.1 mi <br /> Praia do Castrillón - 16.3 km / 10.1 mi <br /> </p><p>The nearest major airport is La Coruna (LCG) - 60.4 km / 37.5 mi</p>,"<p>HeadLine : Near Torres do Allo</p><p>Location : Located in Cabana de Bergantinos, Turismo Rural - O Xastre de Anos is in a rural location, within a 15-minute drive of Torres do Allo and Dolmen de Donbate.  This guesthouse is 4.4 mi (7.2 km) from Praia do Pendón and 4.9 mi (7.8 km) from Praia da Urixeira.</p><p>Rooms : Make yourself at home in one of the 6 guestrooms. Complimentary wireless Internet access is available to keep you connected. Bathrooms feature bathtubs, complimentary toiletries, and hair dryers. Conveniences include separate sitting areas and washing machines, and housekeeping is provided on request.</p><p>Dining : Enjoy a meal at the restaurant or snacks in the guesthouse s coffee shop/cafe. Wrap up your day with a drink at the bar/lounge.</p><p>CheckIn Instructions : <ul>  <li>Extra-person charges may apply and vary depending on property policy</li><li>Government-issued photo identification and a credit card, debit card, or cash deposit may be required at check-in for incidental charges</li><li>Special requests are subject to availability upon check-in and may incur additional charges; special requests cannot be guaranteed</li><li>This property only accepts cash</li><li>Noise-free guestrooms cannot be guaranteed</li>  </ul></p><p>Special Instructions : There is no front desk at this property. This property doesn t offer after-hours check-in. To make arrangements for check-in please contact the property at least 24 hours before arrival using the information on the booking confirmation. Guests must contact the property in advance for check-in instructions. The host will greet guests on arrival.</p>",,Bulk dispenser for toiletries No single-use plastic straws Meeting rooms Number of meeting rooms - 1 Change of bed sheets (on request) No single-use plastic stirrers Reusable cups only Free wired Internet Reusable tableware only Television in common areas Free WiFi No single-use plastic water bottles Number of bars/lounges - 1 Well-lit path to entrance Change of towels (on request) Garden Picnic area Free newspapers in lobby Tours/ticket assistance Energy-saving features in guest rooms Wheelchair accessible  no Express check-out Handrails in stairways Library Barbecue grill(s) Housekeeping on request Smoke-free property Number of coffee shops/cafes - 1 Free self parking Terrace Double-glazing on all windows Sustainability/community reinvestment (10% revenue or more) Guest education on local ecosystems and culture,43.168624|-8.911336,34-64-6202410,15149,http://www.oxastredeanos.com
ES,Spain,100323,A Coruña,1702074,Hotel Bela Fisterra,ThreeStar,Rúa Anchoa 56 Escasela15154 Coruña ,Distances are displayed to the nearest 0.1 mile and kilometer. <br /> <p>Cape Finisterre - 0.1 km / 0.1 mi <br /> Praia Langosteira - 0.6 km / 0.4 mi <br /> Mar de Fora Beach - 1.7 km / 1 mi <br /> Praia de Ribeira - 2.1 km / 1.3 mi <br /> Praia de Talón - 2.5 km / 1.5 mi <br /> Praia de Corveiro - 2.6 km / 1.6 mi <br /> Praia de Arnela - 3.5 km / 2.2 mi <br /> Praia do Sardiñeiro - 4.5 km / 2.8 mi <br /> Praia do Rostro - 4.9 km / 3 mi <br /> Praia de Restrelo - 4.9 km / 3.1 mi <br /> Cape Finisterre Lighthouse - 4.8 km / 3 mi <br /> Praia de Estorde - 5.9 km / 3.7 mi <br /> Praia de Quenxe - 9.7 km / 6 mi <br /> Praia da Concha - 11.3 km / 7 mi <br /> Molinos de San Adrián de Toba - 12.5 km / 7.8 mi <br /> </p>,"<p>HeadLine : Near Praia Langosteira</p><p>Location : With a stay at Hotel Bela Fisterra in Fisterra, you ll be on the beach, just a 1-minute walk from Cape Finisterre and 7 minutes by foot from Praia Langosteira.  This beach hotel is 3 mi (4.8 km) from Cape Finisterre Lighthouse and 1 mi (1.6 km) from Mar de Fora Beach.</p><p>Rooms : Make yourself at home in one of the 16 individually decorated guestrooms, featuring minibars and Smart televisions. Your memory foam bed comes with premium bedding. Complimentary wireless Internet access keeps you connected, and cable programming is available for your entertainment. Private bathrooms with showers feature rainfall showerheads and complimentary toiletries.</p><p>Dining : Grab a bite from the snack bar/deli, or stay in and take advantage of the hotel s room service (during limited hours). Wrap up your day with a drink at the bar/lounge. Buffet breakfasts are available daily from 8:30 AM to 11:00 AM for a fee.</p><p>CheckIn Instructions : <ul>  <li>Extra-person charges may apply and vary depending on property policy</li><li>Government-issued photo identification and a credit card, debit card, or cash deposit may be required at check-in for incidental charges</li><li>Special requests are subject to availability upon check-in and may incur additional charges; special requests cannot be guaranteed</li><li>This property accepts credit cards, debit cards, mobile payments, and cash</li><li>Mobile payment options include: Google Pay, Apple Pay, and Samsung Pay</li><li>Safety features at this property include a carbon monoxide detector, a fire extinguisher, a smoke detector, a security system, and a first aid kit</li>  </ul></p><p>Special Instructions : The front desk is open daily from 7:30 AM - 11:30 PM. If you are planning to arrive after noon please contact the property in advance using the information on the booking confirmation. Front desk staff will greet guests on arrival.</p>",34-0034-981110311,Gift shops or newsstand secured parking Uncovered parking Wheelchair accessible (may have limitations) Food and water bowls Meeting rooms Number of meeting rooms - 1 Wheelchair-accessible path to elevator Change of bed sheets (on request) Wheelchair-accessible registration desk Free WiFi Number of bars/lounges - 1 Bicycle parking available Well-lit path to entrance Change of towels (on request) Garden In-room accessibility (in select rooms) Wheelchair accessible parking Stair-free path to entrance Tours/ticket assistance Off-street parking Luggage storage Visual alarms in hallways Handrails in stairways Front desk (limited hours) Electric car charging station Breakfast available (surcharge) Secured bicycle storage Library Safe-deposit box at front desk Smoke-free property Snack bar/deli Laundry facilities elevator Free self parking Terrace Bicycle rentals on site Concierge services,42.921156|-9.265344,34-0034-647645185,15154,http://www.belafisterra.com/
ES,Spain,100323,A Coruña,1730965,Albergue Dharma Gaia,OneStar,Escañoi 1 AmbroaIrixoa15313 A Coruna ,Distances are displayed to the nearest 0.1 mile and kilometer. <br /> <p>Monastery of Santa María de Monfero - 7.1 km / 4.4 mi <br /> Fragas do Eume Natural Park - 10.5 km / 6.5 mi <br /> Praia da Abeleira - 12.8 km / 7.9 mi <br /> Praia da Alameda - 12.8 km / 8 mi <br /> Praia da Ribeira - 13 km / 8.1 mi <br /> Praia do Sumiño - 13.3 km / 8.2 mi <br /> O Couce - 14 km / 8.7 mi <br /> Punta do gafo - 14.2 km / 8.8 mi <br /> Praia Grande - 14.5 km / 9 mi <br /> Irmans Garcia Naveira Square - 14.8 km / 9.2 mi <br /> Punta de Fos - 15.2 km / 9.4 mi <br /> Betanzos Church of San Francisco - 15.3 km / 9.5 mi <br /> Xurela - 15.4 km / 9.5 mi <br /> Praia da Insua - 15.5 km / 9.6 mi <br /> Museo das Marinas - 15.5 km / 9.6 mi <br /> </p><p>The nearest major airport is La Coruna (LCG) - 37.8 km / 23.5 mi</p>,"<p>HeadLine : In Irixoa</p><p>Location : When you stay at Albergue Dharma Gaia in Irixoa, you ll be 12 minutes by car from Monastery of Santa María de Monfero.  This hostel is 6.5 mi (10.5 km) from Fragas do Eume Natural Park and 7.9 mi (12.8 km) from Praia da Abeleira.</p><p>Rooms : Make yourself at home in one of the 5 air-conditioned rooms featuring microwaves and flat-screen televisions. Bathrooms with showers are provided. Conveniences include irons/ironing boards and blackout drapes/curtains.</p><p>CheckIn Instructions : <ul>  <li>Extra-person charges may apply and vary depending on property policy</li><li>Government-issued photo identification and a credit card, debit card, or cash deposit may be required at check-in for incidental charges</li><li>Special requests are subject to availability upon check-in and may incur additional charges; special requests cannot be guaranteed</li><li>Safety features at this property include a fire extinguisher and a first aid kit</li><li>Be prepared: check the latest COVID-19 travel requirements and measures in place for this destination before you travel.</li>  </ul></p><p>Special Instructions : There is no front desk at this property. To make arrangements for check-in please contact the property at least 24 hours before arrival using the information on the booking confirmation. Guests must contact the property for check-in instructions.</p>",34-622-163089,Barbecue grill(s) Picnic area Terrace Coffee/tea in common areas Number of outdoor pools - 1 Shared microwave Shared refrigerator Meeting rooms Tours/ticket assistance Television in common areas Free self parking Smoke-free property Garden,43.321434|-8.090155,34-622-163089,15313,http://www.dharmagaia.es
ES,Spain,100323,A Coruña,1732633,Albergue Pension Casa da Gandara,All,Gandara 49 Boimorto15817 A Coruna ,,"Located in Boimorto, Albergue-Hostel Casa da Gandara features a garden, shared lounge, terrace, and free WiFi throughout the property. Featuring room service, this property also provides guests with a barbecue. Certain rooms at the property include a balcony with a city view.

At the hostel, every room has a wardrobe. Albergue-Hostel Casa da Gandara provides some units with garden views, and all rooms come with a patio. At the accommodation each room includes bed linen and towels.

Guests at Albergue-Hostel Casa da Gandara will be able to enjoy activities in and around Boimorto, like hiking.

Santiago de Compostela Cathedral is 47 km from the hostel, while Santiago de Compostela Convention Center is 42 km away. The nearest airport is Santiago de Compostela Airport, 35 km from Albergue-Hostel Casa da Gandara. In response to Coronavirus (COVID-19), additional safety and sanitation measures are in effect at this property.
Food & beverage services at this property may be limited or unavailable due to Coronavirus (COVID-19).
Due to Coronavirus (COVID-19), this property is taking steps to help protect the safety of guests and staff. Certain services and amenities may be reduced or unavailable as a result.",,physical distancing in dining areas staff follow all safety protocols as directed by local authorities hand sanitizer in guest accommodation and key areas cashless payment available physical distancing rules followed invoice provided property is cleaned by professional cleaning companies all plates  cutlery  glasses and other tableware have been sanitized guests have the option to cancel any cleaning services for their accommodation during their stay delivered food is securely covered Parking Room service Garden Terrace Laundry Facilities for disabled guests Family rooms Games room Free parking internet services Hiking BBQ facilities Tour desk Heating wifi Allergy-free room Free WiFi designated smoking area Snack Bar Sun terrace Private check-in/check-out vending machine (drinks) Lockers shared lounge/TV area Daily housekeeping wifi available in all areas Open-air bath Public Bath board games/puzzles Indoor play area Street parking Accessible parking Wine/champagne sun loungers or beach chairs Sun umbrellas Outdoor furniture Picnic area Outdoor fireplace fitness/spa locker rooms Smoke alarms Fire extinguishers use of cleaning chemicals that are effective against coronavirus linens  towels and laundry washed in accordance with local authority guidelines guest accommodation is disinfected between stays guest accommodation sealed after cleaning,42.9997|-8.13462,+34981516114,15817,https://www.booking.com/hotel/es/casa-da-gandara.html
ES,Spain,100323,A Coruña,1733656,Casa dos Casqueiros,ThreeStar,Rúa Do Porto 47 Corrubedo Riveira15969 A Coruña ,,"Casa dos Casqueiros is situated in Corrubedo and has a terrace and a shared lounge. Featuring a tour desk, this property also provides guests with a restaurant. Both private parking and free WiFi are available on site.

All rooms in the hotel are fitted with a flat-screen TV. The rooms will provide guests with a fridge.

The nearest airport is Santiago de Compostela Airport, 88 km from the property. Please inform Casa dos Casqueiros in advance of your expected arrival time. You can use the Special Requests box when booking, or contact the property directly with the contact details provided in your confirmation.",,Open-air bath Private parking Daily housekeeping On private beach Television in common areas Airport transportation (surcharge) Area shuttle (surcharge) Terrace Non-smoking throughout Free WiFi Free WiFi Tour desk Internet access Family rooms Laundry facilities Airport shuttle Non-smoking rooms Terrace Pets allowed Restaurant Free self parking,42.57428|-9.07147,+34609826856,15969,https://www.booking.com/hotel/es/casa-dos-casqueiros.html
ES,Spain,100323,A Coruña,1763457,Aldea Os Muiños,All,As Mirans 6 15984 RianxoA Coruña ,,"This rural guest house features an outdoor swimming pool and hot tub. It offers free bicycles and elegant accommodation with free Wi-Fi. Rianxo Marina is a 15-minute drive away.

Aldea Os Muiños is located in a renovated, early 19th-century mill. All rooms and apartments feature a modern rustic décor with hardwood floors, exposed stone walls and wooden ceiling beams. All have central heating and the apartments also have a fireplace.

There is a communal lounge, kitchen and dining area. The lounge has a large fireplace and there is also a garden with a barbecue. The town of Rianxo has several bars, restaurants and shops.

The beach is just 4.5 km away. Staff can provide more information about hiking and cycling trails in the surrounding area.

Santiago de Compostela can be reached in about 30 minutes by car and Pontevedra is 40 minutes away. Please inform Aldea Os Muiños in advance of your expected arrival time. You can use the Special Requests box when booking, or contact the property directly with the contact details provided in your confirmation.
This property will not accommodate hen, stag or similar parties.",,Facilities for disabled guests Family rooms Ironing service Free parking internet services Massage Hot tub/jacuzzi Canoeing Hiking BBQ facilities Cycling Tour desk Heating Diving Horse riding wifi Outdoor pool Free WiFi Non-smoking throughout Air conditioning designated smoking area Sun terrace outdoor pool (seasonal) vending machine (drinks) shared lounge/TV area parking on site Private parking board games/puzzles Baby safety gates Accessible parking Salt-water pool Plunge pool breakfast takeaway containers guests have the option to cancel any cleaning services for their accommodation during their stay all plates  cutlery  glasses and other tableware have been sanitized invoice provided screens or physical barriers placed between staff and guests in appropriate areas physical distancing rules followed sun loungers or beach chairs Sun umbrellas Outdoor furniture Back massage Neck massage Full body massage Swimming pool Key access CCTV outside property Fire extinguishers Swimming pool use of cleaning chemicals that are effective against coronavirus linens  towels and laundry washed in accordance with local authority guidelines guest accommodation is disinfected between stays guest accommodation sealed after cleaning physical distancing in dining areas staff follow all safety protocols as directed by local authorities shared stationery such as printed menus  magazines  pens  and paper removed hand sanitizer in guest accommodation and key areas process in place to check health of guests first aid kit available contactless check-in/check-out cashless payment available Parking Golf course (within 3 km) Garden Non-smoking rooms Fishing Laundry,42.6944|-8.77836,+34 981 863 374,15984,https://www.booking.com/hotel/es/aldea-os-muia-os.html
ES,Spain,100323,A Coruña,1949233,Aparthotel Porto Cabana,ThreeStar,A Carballa s/n Cesulla ,Distances are displayed to the nearest 0.1 mile and kilometer. <br /> <p>Praia do Pendón - 0.2 km / 0.1 mi <br /> Praia da Urixeira - 1.1 km / 0.7 mi <br /> Praia de Area das Vacas - 3.7 km / 2.3 mi <br /> Praia de Rebordelo - 4.1 km / 2.5 mi <br /> Birthplace of Eduardo Pondal - 4.4 km / 2.7 mi <br /> Praia de San Pedro - 4.5 km / 2.8 mi <br /> Dolmen de Donbate - 5.7 km / 3.5 mi <br /> Laxe Beach - 6 km / 3.7 mi <br /> Praia de Balarés - 8.4 km / 5.2 mi <br /> Praia dos Cristais - 9.1 km / 5.6 mi <br /> Praia do Río Covo - 9.9 km / 6.2 mi <br /> Praia de Area Pequena da Barda - 10.3 km / 6.4 mi <br /> Praia de Area Grande da Barda - 10.4 km / 6.5 mi <br /> Praia de Armado - 10.6 km / 6.6 mi <br /> Praia do Castrillón - 10.7 km / 6.7 mi <br /> </p><p>The nearest major airport is La Coruna (LCG) - 71.9 km / 44.7 mi</p>,"<p>HeadLine : Near Praia do Pendón</p><p>Location : With a stay at Aparthotel Porto Cabana in Cabana de Bergantinos, you ll be on the boardwalk, just a 3-minute walk from Praia do Pendón and 14 minutes by foot from Praia da Urixeira.  This beach apartment is 2.2 mi (3.6 km) from Praia de Area das Vacas and 2.4 mi (3.9 km) from Praia de Rebordelo.</p><p>Rooms : Make yourself at home in one of the 16 individually decorated guestrooms, featuring kitchens with full-sized refrigerators/freezers and ovens. Complimentary wireless Internet access keeps you connected, and flat-screen televisions are provided for your entertainment. Private bathrooms with shower/tub combinations feature deep soaking bathtubs and rainfall showerheads. Conveniences include safes and microwaves, and housekeeping is provided weekly.</p><p>CheckIn Instructions : <ul>  <li>Extra-person charges may apply and vary depending on property policy</li><li>Government-issued photo identification and a credit card, debit card, or cash deposit may be required at check-in for incidental charges</li><li>Special requests are subject to availability upon check-in and may incur additional charges; special requests cannot be guaranteed</li><li>Guests must contact this property in advance to reserve high chair</li><li>This property accepts credit cards and cash</li><li>Safety features at this property include a fire extinguisher and a first aid kit</li>  </ul></p><p>Special Instructions : This property doesn t offer after-hours check-in. To make arrangements for check-in please contact the property at least 24 hours before arrival using the information on the booking confirmation. Guests must contact the property in advance for check-in instructions. Front desk staff will greet guests on arrival.</p>",34-981-705332,Terrace Concierge services 24-hour front desk Laundry facilities Parking (limited spaces) Meeting rooms Tours/ticket assistance Free WiFi Wheelchair accessible parking Self parking (surcharge) In-room accessibility Airport transportation (surcharge) Smoke-free property Garden Free newspapers in lobby,43.220281|-8.930315,+34981705332,15115,http://www.portocabana.com
ES,Spain,100323,A Coruña,5203409,Casas de Cuncheiro,ThreeStar,Rua Canduas 27  ,Distances are displayed to the nearest 0.1 mile and kilometer. <br /> <p>Praia de Rebordelo - 1.8 km / 1.1 mi <br /> Praia de Area das Vacas - 2.1 km / 1.3 mi <br /> Praia de San Pedro - 2.3 km / 1.4 mi <br /> Praia do Pendón - 2.6 km / 1.6 mi <br /> Praia da Urixeira - 3.6 km / 2.2 mi <br /> Dolmen de Donbate - 3.8 km / 2.4 mi <br /> Laxe Beach - 4 km / 2.5 mi <br /> Birthplace of Eduardo Pondal - 6.2 km / 3.8 mi <br /> Praia dos Cristais - 6.9 km / 4.3 mi <br /> Praia de Armado - 8.5 km / 5.3 mi <br /> Praia do Castrillón - 8.6 km / 5.3 mi <br /> Soesto Beach - 9 km / 5.6 mi <br /> Torres do Allo - 10.2 km / 6.3 mi <br /> Praia de Balarés - 10.5 km / 6.5 mi <br /> Praia do Río Covo - 12 km / 7.5 mi <br /> </p><p>The nearest major airport is La Coruna (LCG) - 70.9 km / 44.1 mi</p>,"<p>HeadLine : Near Praia de Rebordelo</p><p>Location : When you stay at Casas de Cuncheiro in Cabana de Bergantinos, you ll be near the beach, within a 5-minute drive of Praia de Rebordelo and Praia de San Pedro.  This apartment is 1.3 mi (2.1 km) from Praia de Area das Vacas and 1.6 mi (2.6 km) from Praia do Pendón.</p><p>Rooms : Make yourself at home in one of the 4 guestrooms, featuring kitchens with full-sized refrigerators/freezers and ovens. Complimentary wireless Internet access keeps you connected, and flat-screen televisions are provided for your entertainment. Conveniences include microwaves and coffee/tea makers.</p><p>CheckIn Instructions : <ul>  <li>Extra-person charges may apply and vary depending on property policy</li><li>Government-issued photo identification and a credit card, debit card, or cash deposit may be required at check-in for incidental charges</li><li>Special requests are subject to availability upon check-in and may incur additional charges; special requests cannot be guaranteed</li>  </ul></p><p>Special Instructions : There is no front desk at this property.</p>",34-679-209583,Barbecue grill(s) Picnic area Terrace Tours/ticket assistance Free self parking Free WiFi Smoke-free property Garden,43.214955|-8.954072,34-679-209583,15116,
ES,Spain,100323,A Coruña,5301014,Casa Rural Da Ermida,All,Ermida 2 Araño  ,,"Located in A Ermida, 23 km from Vilagarcia de Arousa, Casa Rural Da Ermida provides a shared lounge and free WiFi.

A continental breakfast is available daily at the country house.

Casa Rural Da Ermida offers a terrace.

A garden, barbecue and a childrens playground are provided at the accommodation.

Santiago de Compostela is 43 km from Casa Rural Da Ermida, while Pontevedra is 46 km away. The nearest airport is Santiago de Compostela, 55 km from the country house, and the property offers a paid airport shuttle service. Please inform Casa Rural Da Ermida in advance of your expected arrival time. You can use the Special Requests box when booking, or contact the property directly with the contact details provided in your confirmation.",,use of cleaning chemicals that are effective against coronavirus staff follow all safety protocols as directed by local authorities internet services guests have the option to cancel any cleaning services for their accommodation during their stay Non-smoking throughout physical distancing rules followed On-site parking cashless payment available linens  towels and laundry washed in accordance with local authority guidelines all plates  cutlery  glasses and other tableware have been sanitized Heating shared lounge/TV area children's playground Free WiFi first aid kit available Laundry shared stationery such as printed menus  magazines  pens  and paper removed Parking Private parking Terrace guest accommodation sealed after cleaning Airport shuttle wifi babysitting/child services guest accommodation is disinfected between stays Free parking BBQ facilities airport shuttle (additional charge) hand sanitizer in guest accommodation and key areas Garden,42.7059|-8.76937,981844347,15984,https://www.booking.com/hotel/es/conutry-house-da-ermida.html
