countyCode,countyName,cityCode,cityName,HotelCode,HotelName,HotelRating,Address,Attractions,Description,FaxNumber,HotelFacilities,Map,PhoneNumber,PinCode,HotelWebsiteUrl
LC,St Lucia,114016,Castries,1173108,Sandals Halcyon Beach,FourStar,Choc Bay Choc BayCastriesSaint Lucia ,Distances are displayed to the nearest 0.1 mile and kilometer. <br /> <p>Windward Islands - 0.1 km / 0.1 mi <br /> Choc Bay - 0.1 km / 0.1 mi <br /> Choc Beach - 0.1 km / 0.1 mi <br /> Vigie Beach - 2 km / 1.2 mi <br /> Labrelotte Bay - 3.3 km / 2.1 mi <br /> Castries Central Market - 3.4 km / 2.1 mi <br /> Embassy of Mexico - 3.4 km / 2.1 mi <br /> Saint Lucia National Archives - 3.5 km / 2.2 mi <br /> Vendors Arcade - 3.5 km / 2.2 mi <br /> The Embassy of France in Saint Lucia - 3.5 km / 2.2 mi <br /> La Place Carenage Duty Free Mall - 3.7 km / 2.3 mi <br /> St. Lucia Town Hall - 3.8 km / 2.4 mi <br /> Cathedral Basilica of the Immaculate Conception - 4 km / 2.5 mi <br /> St. Lucia National Library - 4.1 km / 2.5 mi <br /> Derek Walcott Square - 4.2 km / 2.6 mi <br /> </p><p>The nearest airports are:<br />Hewanorra Intl. Airport (UVF) - 58.4 km / 36.3 mi<br /> George F. L. Charles Airport (SLU) - 4.8 km / 3 mi<br /> </p><p>The preferred airport for Sandals Halcyon - ALL INCLUSIVE Couples Only is Hewanorra Intl. Airport (UVF). </p>,"<p>HeadLine : Near Choc Beach</p><p>Location : When you a stay at Sandals Halcyon - ALL INCLUSIVE Couples Only in Castries, you ll be on the beach, just steps from Windward Islands and Choc Bay.  This 4.5-star property is 6.4 mi (10.2 km) from Pigeon Island National Park and 10 mi (16.1 km) from Marigot Bay.</p><p>Rooms : Make yourself at home in one of the 169 individually decorated guestrooms, featuring refrigerators and LED televisions. Rooms have private furnished balconies or patios. Complimentary wireless Internet access keeps you connected, and cable programming is available for your entertainment. Private bathrooms with shower/tub combinations feature complimentary toiletries and hair dryers.</p><p>Dining : This property is all inclusive. Rates include meals and beverages at onsite dining establishments. Charges may be applied for dining at some restaurants, special dinners and dishes, some beverages, and other amenities. <p>Enjoy Italian cuisine at Marios Restaurant, one of the property s 6 restaurants, or stay in and take advantage of the room service. Need to unwind? Take a break at the bar/lounge, the beach bar, or the swim-up bar for a tasty beverage. A complimentary full breakfast is included. </p></p><p>CheckIn Instructions : <ul>  <li>Extra-person charges may apply and vary depending on property policy</li><li>Government-issued photo identification and a credit card, debit card, or cash deposit may be required at check-in for incidental charges</li><li>Special requests are subject to availability upon check-in and may incur additional charges; special requests cannot be guaranteed</li><li>This property accepts credit cards; cash is not accepted</li><li>Safety features at this property include a carbon monoxide detector and a smoke detector</li><li>Please note that cultural norms and guest policies may differ by country and by property; the policies listed are provided by the property</li>  </ul> <ul>  <li>This hotel is exclusively for adult couples.</li>  </ul></p><p>Special Instructions : To make arrangements for check-in please contact the property ahead of time using the information on the booking confirmation. If you are planning to arrive after 3:00 PM please contact the property in advance using the information on the booking confirmation. Guests must contact the property in advance for check-in instructions. Front desk staff will greet guests on arrival. For more details, please contact the property using the information on the booking confirmation.  This property caters to couples, including same-sex couples.
 Guests who book a room category with butler service included must contact this hotel in advance to provide their preferences.</p>",1-758-4518435,Roll-in shower (in select rooms) Tours/ticket assistance Sailing on site Fitness classes on site Scuba diving on site Free airport transportation Wheelchair-accessible on-site restaurant Free breakfast Golf lessons available nearby Outdoor tennis courts - 1 Multilingual staff Wheelchairs available on site Fitness facilities Snorkeling on site Wheelchair accessible (may have limitations) Wheelchair accessible Beach umbrellas Well-lit path to entrance Garden Gift shops or newsstand Dry cleaning/laundry service Shopping on site Free full breakfast Proposal/romance packages available Pool umbrellas Conference space size (meters) - 23 Swimming pool Free WiFi Number of bars/lounges - 1 Number of outdoor pools - 3 Number of beach bars - 1 Number of swim-up bars - 1 In-room accessibility (in select rooms) Concierge services 24-hour business center Picnic area Free use of nearby fitness center Stair-free path to entrance Full-service spa Wedding services Tennis lessons on site Beach towels Water skiing on site Boat tours nearby Windsurfing on site 24-hour health club Couples/private dining Luggage storage Billiards or pool table 24-hour front desk Lifeguard on site Golfing nearby Spa services on site Safe-deposit box at front desk Smoke-free property Snack bar/deli Free self parking Conference space Hair salon Tennis on site Beach sun loungers Terrace Wheelchair accessible path of travel Access to nearby outdoor pool Pool sun loungers Conference space size (feet) - 250,14.03146|-60.97548,1-758-4530222,999999,http://www.sandals.com/main/halcyon/ha-home.cfm
LC,St Lucia,114016,Castries,1290956,Villa Beach Cottages,ThreeStar,Choc Bay P.O. Box 129 Castries St. Lucia Choc BayCastriesWindward Islands ,Distances are displayed to the nearest 0.1 mile and kilometer. <br /> <p>Windward Islands - 0.1 km / 0.1 mi <br /> Choc Bay - 0.1 km / 0.1 mi <br /> Choc Beach - 0.1 km / 0.1 mi <br /> Vigie Beach - 2.4 km / 1.5 mi <br /> Labrelotte Bay - 3 km / 1.8 mi <br /> Castries Central Market - 3.8 km / 2.3 mi <br /> Embassy of Mexico - 3.8 km / 2.4 mi <br /> Saint Lucia National Archives - 3.9 km / 2.4 mi <br /> Vendors Arcade - 3.9 km / 2.4 mi <br /> The Embassy of France in Saint Lucia - 3.9 km / 2.4 mi <br /> La Place Carenage Duty Free Mall - 4.1 km / 2.6 mi <br /> St. Lucia Town Hall - 4.2 km / 2.6 mi <br /> Cathedral Basilica of the Immaculate Conception - 4.3 km / 2.7 mi <br /> St. Lucia National Library - 4.5 km / 2.8 mi <br /> Derek Walcott Square - 4.5 km / 2.8 mi <br /> </p><p>The nearest airports are:<br />Hewanorra Intl. Airport (UVF) - 58.4 km / 36.3 mi<br /> George F. L. Charles Airport (SLU) - 4.4 km / 2.7 mi<br /> </p><p>The preferred airport for Villa Beach Cottages is Hewanorra Intl. Airport (UVF). </p>,"<p>HeadLine : Near Choc Beach</p><p>Location : When you a stay at Villa Beach Cottages in Castries, you ll be on the beach, just steps from Windward Islands and Choc Bay.  This beach hotel is 6.1 mi (9.8 km) from Pigeon Island National Park and 9.8 mi (15.7 km) from Marigot Bay.</p><p>Rooms : Make yourself at home in one of the 20 air-conditioned rooms featuring kitchens with refrigerators and microwaves. Rooms have private balconies. Wired and wireless Internet access is complimentary, and flat-screen televisions with cable programming provide entertainment. Conveniences include phones, as well as safes and desks.</p><p>Dining : Grab a bite from the grocery/convenience store, or stay in and take advantage of the hotel s room service (during limited hours).</p><p>CheckIn Instructions : <ul>  <li>Extra-person charges may apply and vary depending on property policy</li><li>Government-issued photo identification and a credit card, debit card, or cash deposit may be required at check-in for incidental charges</li><li>Special requests are subject to availability upon check-in and may incur additional charges; special requests cannot be guaranteed</li><li>This property accepts credit cards, debit cards, and cash</li>  </ul></p><p>Special Instructions : The front desk is open daily from 8:00 AM - 10:00 PM. If you are planning to arrive after 10:00 PM please contact the property in advance using the information on the booking confirmation. Front desk staff will greet guests on arrival.</p>",1-758-4504529,Beach towels Private picnics Couples/private dining Luggage storage Grocery/convenience store Porter/bellhop Horse riding nearby Front desk (limited hours) Scooter/moped rentals nearby Library Barbecue grill(s) Spa services on site Segway rental/tour nearby Safe-deposit box at front desk Smoke-free property Ecotours nearby Hiking/biking trails nearby Laundry facilities Children's pool Free self parking Snorkeling on site Kayaking on site Computer station Beach sun loungers Terrace Pool sun loungers Concierge services Gift shops or newsstand Dry cleaning/laundry service Mountain biking nearby Free grocery shopping service Proposal/romance packages available Beach umbrellas Pool umbrellas Free wired Internet Free WiFi Number of spa tubs - 1 Number of outdoor pools - 2 Garden Wedding services Tours/ticket assistance,14.03408|-60.97361,17584502884,0,
LC,St Lucia,114016,Castries,1446608,La Vista Guest Inn,TwoStar,City Gate Vigie Roundabout  ,Distances are calculated in a straight line from the property&apos;s location to the point of interest or attraction  and may not reflect actual travel distance. &lt;br /&gt;&lt;br /&gt; Distances are displayed to the nearest 0.1 mile and kilometer. &lt;p&gt;Vigie Beach - 0.9 km / 0.5 mi &lt;br /&gt;Vendors Arcade - 1.4 km / 0.9 mi &lt;br /&gt;Castries Central Market - 1.4 km / 0.9 mi &lt;br /&gt;St. Lucia Town Hall - 1.5 km / 1 mi &lt;br /&gt;La Place Carenage Duty Free Mall - 1.5 km / 1 mi &lt;br /&gt;The Embassy of France in Saint Lucia - 1.6 km / 1 mi &lt;br /&gt;St. Lucia Cathedral - 1.6 km / 1 mi &lt;br /&gt;Saint Lucia National Archives - 1.7 km / 1 mi &lt;br /&gt;Immaculate Conception Church - 1.7 km / 1 mi &lt;br /&gt;St. Lucia National Library - 1.7 km / 1.1 mi &lt;br /&gt;Derek Walcott Square - 1.8 km / 1.1 mi &lt;br /&gt;Choc Beach - 1.8 km / 1.1 mi &lt;br /&gt;Vigie Lighthouse - 2.2 km / 1.4 mi &lt;br /&gt;La Toc Battery - 2.3 km / 1.4 mi &lt;br /&gt;St. Lucia Government House - 2.5 km / 1.5 mi &lt;br /&gt;&lt;/p&gt;&lt;p&gt;The nearest airports are:&lt;br /&gt;Castries (SLU-George F. L. Charles) - 1.2 km / 0.8 mi&lt;br /&gt;Vieux Fort (UVF-Hewanorra Intl.) - 32 km / 19.9 mi&lt;br /&gt;&lt;/p&gt;&lt;p&gt;The preferred airport for La Vista Guest Inn is Vieux Fort (UVF-Hewanorra Intl.). &lt;/p&gt;,"Property Location When you stay at La Vista Guest Inn in Castries, you''ll be near the airport and convenient to Vigie Beach and Vendors Arcade. This inn is within close proximity of Castries Central Market and St. Lucia Town Hall.Rooms Prepare your meals in the shared/communal kitchen. Complimentary wireless Internet access is available to keep you connected. Conveniences include in-room child care surcharge, housekeeping is provided daily, and refrigerators can be requested.Rec, Spa, Premium Amenities Make use of convenient amenities such as complimentary wireless Internet access, concierge services, and babysitting/childcare surcharge. Additional amenities include wedding services, a television in the lobby, and tour/ticket assistance. The shuttle surcharge will take you to the nearby beach or shopping center.Business, Other Amenities Featured amenities include limo/town car service, express check-in, and express check-out. For a surcharge, guests may use a shuttle from the hotel to the airport available on request and a cruise ship terminal shuttle.",1-758-7206454,Limited parking spaces Meeting rooms Cruise terminal shuttle (surcharge) Wedding services American Express Fridge (On Request) Ferry terminal shuttle (surcharge) Free Wireless Internet access Free Wireless Internet access (inroom) Shopping center shuttle (surcharge) Television in lobby Television Concierge Desk Visa MasterCard Area shuttle (surcharge) Beach shuttle (surcharge) Casino shuttle (surcharge) Tour desk Babysitting or child care (surcharge) Dry cleaning / laundry service Iron/Ironing Board (On Request) Self Laundry Luggage storage Shared / communal kitchen Free parking nearby designated smoking area Express Check In / Check Out Limousine service available,14.02242|-60.98356,001 758 452 3506,1758,
LC,St Lucia,114016,Castries,1451421,Harbour Vista Inn,TwoStar,Cooper Road  ,,"Harbor View Inn is located outside of Castries Town Centre. It is just 500 metres from the Caribbean Sea and offers guests spacious apartments with free Wi-Fi.

Select apartments at the property comes with a kitchenette, which includes pots and pans, and a quaint dining area. Guests also enjoy a comfortable seating area with a cable TV. Plus some apartments offer sea views.

Laundry facilities are provided on site, and a wide variety of dining options are available within 3 km, including restaurants serving national and international cuisine. Beauty treatments and massage services are available.

The property can arrange island tours, car rental and activities like diving and snorkelling. Meals can be provided on request.

Vigie Beach is 3 km from Harbor View Inn, while guests can reach George FL Charles Airport in a 10-minute drive This property will not accommodate hen, stag or similar parties.",+1(0)7587276902,Parking Garden Terrace Airport shuttle Laundry Family rooms breakfast in the room Ironing service Free parking internet services Car hire wifi Free WiFi designated smoking area shuttle service (additional charge) airport shuttle (additional charge) Shared kitchen shared lounge/TV area parking on site wifi available in all areas secured parking Street parking Accessible parking airport pick up airport drop off Shuttle service Key access Smoke alarms CCTV outside property bicycle rental use of cleaning chemicals that are effective against coronavirus linens  towels and laundry washed in accordance with local authority guidelines guest accommodation is disinfected between stays guest accommodation sealed after cleaning physical distancing in dining areas food can be delivered to guest accommodation staff follow all safety protocols as directed by local authorities shared stationery such as printed menus  magazines  pens  and paper removed hand sanitizer in guest accommodation and key areas process in place to check health of guests first aid kit available contactless check-in/check-out cashless payment available physical distancing rules followed mobile app for room service screens or physical barriers placed between staff and guests in appropriate areas invoice provided property is cleaned by professional cleaning companies all plates  cutlery  glasses and other tableware have been sanitized guests have the option to cancel any cleaning services for their accommodation during their stay breakfast takeaway containers delivered food is securely covered thermometers for guests provided by property face masks for guests available,14.00802|-60.99671,1 758 727 6902,west.indies,https://www.booking.com/hotel/lc/harbor-view-guesthouse.html
LC,St Lucia,114016,Castries,1452371,Villa Cybelle,ThreeStar,Coubaril Park  ,Distances are calculated in a straight line from the property&apos;s location to the point of interest or attraction  and may not reflect actual travel distance. &lt;br /&gt;&lt;br /&gt; Distances are displayed to the nearest 0.1 mile and kilometer. &lt;p&gt;La Toc Beach - 0.6 km / 0.4 mi &lt;br /&gt;La Toc Battery - 1.3 km / 0.8 mi &lt;br /&gt;Mont Fortune Historic Area - 1.6 km / 1 mi &lt;br /&gt;St. Lucia Government House - 1.7 km / 1 mi &lt;br /&gt;Vigie Lighthouse - 2.1 km / 1.3 mi &lt;br /&gt;Saint Lucia National Archives - 2.1 km / 1.3 mi &lt;br /&gt;The Embassy of France in Saint Lucia - 2.2 km / 1.4 mi &lt;br /&gt;St. Lucia National Library - 2.4 km / 1.5 mi &lt;br /&gt;La Place Carenage Duty Free Mall - 2.4 km / 1.5 mi &lt;br /&gt;Derek Walcott Square - 2.4 km / 1.5 mi &lt;br /&gt;Immaculate Conception Church - 2.4 km / 1.5 mi &lt;br /&gt;St. Lucia Cathedral - 2.5 km / 1.6 mi &lt;br /&gt;St. Lucia Town Hall - 2.6 km / 1.6 mi &lt;br /&gt;Vendors Arcade - 2.6 km / 1.6 mi &lt;br /&gt;Castries Central Market - 2.6 km / 1.6 mi &lt;br /&gt;&lt;/p&gt;&lt;p&gt;The nearest airports are:&lt;br /&gt;Castries (SLU-George F. L. Charles) - 2.5 km / 1.6 mi&lt;br /&gt;Vieux Fort (UVF-Hewanorra Intl.) - 30.8 km / 19.2 mi&lt;br /&gt;&lt;/p&gt;&lt;p&gt;The preferred airport for Villa Cybelle is Vieux Fort (UVF-Hewanorra Intl.). &lt;/p&gt;,"<p><b>Property Location</b> <br />With a stay at Villa Cybelle in Castries, you''ll be close to La Toc Beach and Marigot Bay. This villa is within close proximity of La Toc Battery and Mont Fortune Historic Area.</p><p><b>Rooms</b> <br />Make yourself at home in one of the air-conditioned rooms featuring private pools. Rooms have private balconies or patios. Kitchens are outfitted with refrigerators, stovetops, and microwaves. Cable programming and iPod docking stations are provided for your entertainment, while complimentary wireless Internet access keeps you connected.</p><p><b>Rec, Spa, Premium Amenities</b> <br />Take advantage of recreation opportunities such as an outdoor pool or take in the view from a terrace and a garden. Additional features include complimentary wireless Internet access and a picnic area.</p><p><b>Business, Other Amenities</b> <br />The front desk is staffed during limited hours. Free self parking is available onsite.</p>",,Hair dryer (on request) Climate Control Stovetop / hob Writing Desk Shower Self Laundry Pets Not Allowed Fridge Dishwasher Kitchen Iron & Board Fan Picnic area Bathrobe Garden Microwave Limited housekeeping Private bathrooms Air Condition in rooms Cookware  dishware  utensil-cutlery Private balcony / terrace Air Conditioned Limited Time Reception Private pool Outdoor Swimming Pool Separate sitting area Separate living room Separate dining area Separate bedroom Free Wireless Internet access Cable / Satellite Television Free self parking Free Wireless Internet access (inroom) Visa MasterCard iPod Docking Station Terrace / Patio,14.007322279563|-61.006908416748,,,
LC,St Lucia,114016,Castries,1452869,Wild Serenity Villa,FourStar,La Toc  ,Distances are calculated in a straight line from the property&apos;s location to the point of interest or attraction  and may not reflect actual travel distance. &lt;br /&gt;&lt;br /&gt; Distances are displayed to the nearest 0.1 mile and kilometer. &lt;p&gt;La Toc Beach - 0.4 km / 0.3 mi &lt;br /&gt;La Toc Battery - 1.2 km / 0.7 mi &lt;br /&gt;Mont Fortune Historic Area - 1.5 km / 0.9 mi &lt;br /&gt;St. Lucia Government House - 1.5 km / 1 mi &lt;br /&gt;Vigie Lighthouse - 1.9 km / 1.2 mi &lt;br /&gt;Saint Lucia National Archives - 1.9 km / 1.2 mi &lt;br /&gt;The Embassy of France in Saint Lucia - 2 km / 1.3 mi &lt;br /&gt;St. Lucia National Library - 2.2 km / 1.4 mi &lt;br /&gt;La Place Carenage Duty Free Mall - 2.2 km / 1.4 mi &lt;br /&gt;Derek Walcott Square - 2.2 km / 1.4 mi &lt;br /&gt;Immaculate Conception Church - 2.2 km / 1.4 mi &lt;br /&gt;St. Lucia Cathedral - 2.4 km / 1.5 mi &lt;br /&gt;St. Lucia Town Hall - 2.4 km / 1.5 mi &lt;br /&gt;Vendors Arcade - 2.4 km / 1.5 mi &lt;br /&gt;Castries Central Market - 2.5 km / 1.5 mi &lt;br /&gt;&lt;/p&gt;&lt;p&gt;The preferred airport for Wild Serenity Villa is Castries (SLU-George F. L. Charles) - 2.3 km / 1.4 mi. &lt;/p&gt;,"<p><b>Property Location</b> <br />With a stay at Wild Serenity Villa in Castries, you''ll be minutes from La Toc Beach and close to Marigot Bay. This 4-star villa is within close proximity of La Toc Battery and Mont Fortune Historic Area.</p><p><b>Rooms</b> <br />Make yourself at home in one of the air-conditioned rooms featuring kitchens with full-sized refrigerators/freezers and stovetops. Rooms have private furnished balconies. Flat-screen televisions with cable programming provide entertainment, while complimentary wireless Internet access keeps you connected. Conveniences include separate sitting areas and microwaves, and housekeeping is provided daily.</p><p><b>Rec, Spa, Premium Amenities</b> <br />Relax on the private beach or enjoy other recreational amenities such as an outdoor pool. Additional features include complimentary wireless Internet access and barbecue grills.</p><p><b>Business, Other Amenities</b> <br />Featured amenities include laundry facilities and a safe deposit box at the front desk. Free self parking is available onsite.</p>",,Microwave Private bathrooms Air Condition in rooms Private Beach Cookware  dishware  utensil-cutlery Safety Deposit Box Outdoor Swimming Pool Furnished balcony / patio Separate sitting area Separate living room Separate dining area Separate bedroom Free Wireless Internet access Cable / Satellite Television Free self parking Free Wireless Internet access (inroom) Tea/Coffee Making Facilities Barbecue / Grill Hair dryer (on request) Flat screen TV (LCD  LED or Plasma TV) Stovetop / hob Shower Self Laundry Pets Not Allowed Kitchen Fridge Iron & Board Fan Garden,14.00787|-61.01196,,,
LC,St Lucia,114016,Castries,1461300,Heritage House,ThreeStar,St Victors View St. Victors ViewCastries ,Distances are calculated in a straight line from the property&apos;s location to the point of interest or attraction  and may not reflect actual travel distance. &lt;br /&gt;&lt;br /&gt; Distances are displayed to the nearest 0.1 mile and kilometer. &lt;p&gt;Saint Lucia National Archives - 0 km / 0 mi &lt;br /&gt;The Embassy of France in Saint Lucia - 0.2 km / 0.1 mi &lt;br /&gt;Vigie Lighthouse - 0.7 km / 0.4 mi &lt;br /&gt;Vigie Beach - 0.8 km / 0.5 mi &lt;br /&gt;La Toc Battery - 1 km / 0.6 mi &lt;br /&gt;La Place Carenage Duty Free Mall - 1.2 km / 0.8 mi &lt;br /&gt;Vendors Arcade - 1.3 km / 0.8 mi &lt;br /&gt;Castries Central Market - 1.4 km / 0.9 mi &lt;br /&gt;St. Lucia National Library - 1.4 km / 0.9 mi &lt;br /&gt;Immaculate Conception Church - 1.4 km / 0.9 mi &lt;br /&gt;St. Lucia Town Hall - 1.4 km / 0.9 mi &lt;br /&gt;Derek Walcott Square - 1.5 km / 0.9 mi &lt;br /&gt;St. Lucia Cathedral - 1.5 km / 0.9 mi &lt;br /&gt;La Toc Beach - 1.5 km / 1 mi &lt;br /&gt;St. Lucia Government House - 1.6 km / 1 mi &lt;br /&gt;&lt;/p&gt;&lt;p&gt;The nearest airports are:&lt;br /&gt;Castries (SLU-George F. L. Charles) - 0.5 km / 0.3 mi&lt;br /&gt;Vieux Fort (UVF-Hewanorra Intl.) - 31.9 km / 19.8 mi&lt;br /&gt;&lt;/p&gt;&lt;p&gt;The preferred airport for Heritage House is Vieux Fort (UVF-Hewanorra Intl.). &lt;/p&gt;,"<p><b>Property Location</b> <br />When you stay at Heritage House in Castries, you''ll be in the historical district and minutes from Saint Lucia National Archives and The Embassy of France in Saint Lucia.  This aparthotel is within close proximity of Vigie Lighthouse and Vigie Beach.</p><p><b>Rooms</b> <br />Make yourself at home in one of the 7 air-conditioned rooms featuring refrigerators and iPod docking stations. Complimentary wireless Internet access keeps you connected, and cable programming is available for your entertainment. Conveniences include safes and desks, as well as phones with free local calls.</p><p><b>Rec, Spa, Premium Amenities</b> <br />Enjoy recreation amenities such as an outdoor pool or take in the view from a terrace. Additional features include complimentary wireless Internet access, concierge services, and babysitting/childcare (surcharge).</p><p><b>Dining</b> <br />Satisfy your appetite at the aparthotel''s restaurant, which serves lunch and dinner. Dining is also available at a coffee shop/café, and room service (during limited hours) is provided.</p><p><b>Business, Other Amenities</b> <br />Featured amenities include a business center, a computer station, and express check-in. Free self parking is available onsite.</p>",,Computer station Air Condition in rooms Air Conditioned Limited Time Reception coffee shop Wedding services American Express Outdoor Swimming Pool Souvenirs / Gift Shop Free grocery shopping service Snack Bar Free Wireless Internet access Cable / Satellite Television Bottled Water Free self parking Free Wireless Internet access (inroom) Tea/Coffee Making Facilities Television Telephone Concierge Desk Visa MasterCard Free local calls iPod Docking Station Terrace / Patio In room safe Tour desk Breakfast included Babysitting or child care (surcharge) Dry cleaning / laundry service Writing Desk Library Pets Not Allowed Shop Arcade Luggage storage Iron & Board Hairdryer Babysitting service Fridge designated smoking area Self Laundry Housekeeping Picnic area Express Check In / Check Out Coffee/tea in lobby Business centre,14.01939|-60.99881,001 758 4536761,99999,http://www.slu.lc/heritagehouse-uc/index.html
