countyCode,countyName,cityCode,cityName,HotelCode,HotelName,HotelRating,Address,Attractions,Description,FaxNumber,HotelFacilities,Map,PhoneNumber,PinCode,HotelWebsiteUrl
LC,St Lucia,113829,Cape Estate,1144865,Capri,TwoStar,12 Cap Drive  ,,"Formerly an Embassy, accommodation in this beautiful villa is comfortable and well appointed. Villa Capri is offering nine-air-conditioned rooms, all with en-suite facilities and TV. You are guaranteed a friendly welcome and personal touch Just 1.5 km from the popular Reduit Beach in Cap Estate, this beautiful villa features an outdoor swimming pool and excellent ocean views. Villa Capri also offers free Wi-Fi.

This enormous 9-bedroom villa features a seating and dining area, as well as a fully equipped kitchen with a buffet area. There is also a stereo system and a cable TV with a DVD player.

Guests will find a large supermarket 1.5 km away from Villa Capri, and there is a pizzeria just 400 metres away. There are other water-front dining options within 300 metres of the property.

There is a golf course 3.5 km away, and guests will find a shopping centre offering national and international brands within 800 metres. George FL Charles Airport is 8.0 km from the villa. Please inform Villa Capri in advance of your expected arrival time. You can use the Special Requests box when booking, or contact the property directly with the contact details provided in your confirmation.
This property will not accommodate hen, stag or similar parties.",,Windsurfing Car hire thermometers for guests provided by property internet services Horse riding guest accommodation is disinfected between stays Kid meals Shallow end Non-smoking throughout process in place to check health of guests airport shuttle (additional charge) Packed lunches Airport shuttle Luggage storage Hiking Water park Spa and wellness centre Children television networks linens  towels and laundry washed in accordance with local authority guidelines Restaurant Bar Free WiFi Tour desk Swimming pool toys hand sanitizer in guest accommodation and key areas 24-hour security Safety Deposit Box Sun terrace food can be delivered to guest accommodation BBQ facilities staff follow all safety protocols as directed by local authorities Outdoor pool Evening entertainment board games/puzzles wifi Bridal suite Laundry screens or physical barriers placed between staff and guests in appropriate areas use of cleaning chemicals that are effective against coronavirus Diving physical distancing in dining areas Fence around pool outdoor pool (all year) guests have the option to cancel any cleaning services for their accommodation during their stay access to health care professionals  pool/beach towels shuttle service (additional charge) guest accommodation sealed after cleaning Karaoke babysitting/child services Terrace shared stationery such as printed menus  magazines  pens  and paper removed books  dvds  music for children Canoeing Library Air conditioning first aid kit available Ironing service Swimming pool Fitness centre cashless payment available On-site parking Fire extinguishers Special diet menus (on request) Private parking Baby safety gates Golf course (within 3 km) Smoke alarms Parking Family rooms grocery deliveries all plates  cutlery  glasses and other tableware have been sanitized Garden wifi available in all areas physical distancing rules followed Massage Tennis Court Daily housekeeping designated smoking area Snorkelling Non-smoking rooms Fishing face masks for guests available Free parking,14.1019|-60.94568,,0000,https://www.booking.com/hotel/lc/villa-capri.html
LC,St Lucia,113829,Cape Estate,1148758,Royalton Saint Lucia Resort & Spa All inclusive,FourStar,St.Lucia Address Gros Islet 0 St. Lucia Gros Islet ,Distances are displayed to the nearest 0.1 mile and kilometer. <br /> <p>Windward Islands - 0.1 km / 0.1 mi <br /> Sandals Golf and Country Club - 1.7 km / 1.1 mi <br /> Smugglers Cove - 2.3 km / 1.4 mi <br /> Rodney Bay Aquatic Centre - 2.8 km / 1.7 mi <br /> Saint Joseph the Worker Catholic Church - 3 km / 1.9 mi <br /> Cas en Bas Beach - 3.2 km / 2 mi <br /> Friday Night Street Party - 3.2 km / 2 mi <br /> Pigeon Island National Park - 3.2 km / 2 mi <br /> Rodney Bay Marina - 3.6 km / 2.3 mi <br /> Bonne Terre Tropical Gardens - 4.8 km / 3 mi <br /> Baywalk Shopping Mall - 5.1 km / 3.2 mi <br /> Daren Sammy Cricket Ground - 5.7 km / 3.6 mi <br /> Reduit Beach - 6 km / 3.7 mi <br /> Splash Island Water Park Saint Lucia - 6.1 km / 3.8 mi <br /> Labrelotte Bay - 8.9 km / 5.5 mi <br /> </p><p>The nearest airports are:<br />Hewanorra Intl. Airport (UVF) - 67.5 km / 41.9 mi<br /> George F. L. Charles Airport (SLU) - 13.5 km / 8.4 mi<br /> </p><p>The preferred airport for Royalton Saint Lucia  An Autograph Collection All-Inclusive Resort is Hewanorra Intl. Airport (UVF). </p>,"<p>HeadLine : Near Smugglers Cove</p><p>Location : With a stay at Royalton Saint Lucia, An Autograph Collection All-Inclusive Resort in Gros Islet (Cap Estate), you ll be steps from Windward Islands and a 3-minute drive from Sandals Golf and Country Club.  This 4.5-star property is 2 mi (3.2 km) from Pigeon Island National Park and 15.5 mi (25 km) from Marigot Bay.</p><p>Rooms : Make yourself at home in one of the 290 guestrooms featuring free minibar items and flat-screen televisions. Rooms have private balconies. Complimentary wireless Internet access keeps you connected, and satellite programming is available for your entertainment. Bathrooms with separate bathtubs and showers feature jetted bathtubs and complimentary toiletries.</p><p>Dining : This property is all inclusive. Rates include meals and beverages at onsite dining establishments. Charges may be applied for dining at some restaurants, special dinners and dishes, some beverages, and other amenities. <p>Enjoy local and international cuisine at Gourmet Marche, one of the property s 9 restaurants, or stay in and take advantage of the 24-hour room service. Snacks are also available at the coffee shop/cafe. Relax with a refreshing drink from the poolside bar or one of the 10 bars/lounges. </p></p><p>CheckIn Instructions : <ul>  <li>Extra-person charges may apply and vary depending on property policy</li><li>Government-issued photo identification and a credit card, debit card, or cash deposit may be required at check-in for incidental charges</li><li>Special requests are subject to availability upon check-in and may incur additional charges; special requests cannot be guaranteed</li><li>This property accepts credit cards; cash is not accepted</li>  </ul></p><p>Special Instructions : Front desk staff will greet guests on arrival.</p>",1-758-4845058,Full-service spa Wedding services Tours/ticket assistance Volleyball on site Supervised childcare/activities (surcharge) Luggage storage Outdoor tennis courts - 1 Business center 24-hour front desk Playground on site Spa services on site Safe-deposit box at front desk Snack bar/deli Babysitting or childcare (surcharge) Nightclub Free wired Internet Free WiFi Number of bars/lounges - 10 Designated smoking areas Number of poolside bars - 1 Number of outdoor pools - 4 Garden In-room accessibility (in select rooms) Wheelchair accessible parking Number of coffee shops/cafes - 1 Children's pool Sauna elevator Free self parking Children's club (free) Fitness facilities Snorkeling on site Terrace Wheelchair accessible path of travel Concierge services,14.097217|-60.95,1-758-4574100,LC01101,http://www.royaltonresorts.com
LC,St Lucia,113829,Cape Estate,1160877,The BodyHoliday,FourStar,Cariblue Beach Cap Estate CASTRIES ,,"The hotel is located on the northwest slope of the Caribbean island of St. Lucia. It is a 30-minute drive from the capital Castries and George F.L. Charles Airport, and Hewanorra International Airport is 90 minutes away. The establishment offers 275 m of beachfront access and comfortable accommodation in a total of 154 guest rooms. Guests will be greeted by a friendly staff in the spacious lobby and will be provided with the opportunity to choose between several restaurants. The suites reflect the real West Indian style. They are equipped with an iPod station and CD player, and guests can enjoy their favourite music, while watching the glorious St. Lucian sunsets from the large private balcony.",,Hotel Bathroom Shower Bathtub Hairdryer Direct dial telephone TV Safe Room service Laundry service Hotel safe Cloakroom Lift access Bar Restaurant Non-smoking area Poolside snack bar Conference room Sun loungers Parasols Massage Green Globe 21  Windsurfing Horse riding Volleyball Golf,14.103202609071378|-60.946426123337005,,437,https://www.thebodyholiday.com/
LC,St Lucia,113829,Cape Estate,1212121,Sandals Grande St. Lucia Spa & Beach Resort,FourStar,P.O. Box G.I. (PO Box GI 2247) Gros IsletSaint Lucia ,Distances are displayed to the nearest 0.1 mile and kilometer. <br /> <p>Windward Islands - 0.1 km / 0.1 mi <br /> Pigeon Island National Park - 0.5 km / 0.3 mi <br /> Saint Joseph the Worker Catholic Church - 1.7 km / 1.1 mi <br /> Friday Night Street Party - 1.8 km / 1.1 mi <br /> Rodney Bay Aquatic Centre - 2.1 km / 1.3 mi <br /> Rodney Bay Marina - 3 km / 1.9 mi <br /> Sandals Golf and Country Club - 3 km / 1.9 mi <br /> Smugglers Cove - 3.7 km / 2.3 mi <br /> Cas en Bas Beach - 3.8 km / 2.4 mi <br /> Bonne Terre Tropical Gardens - 4.5 km / 2.8 mi <br /> Baywalk Shopping Mall - 4.8 km / 3 mi <br /> Daren Sammy Cricket Ground - 5 km / 3.1 mi <br /> Reduit Beach - 5.3 km / 3.3 mi <br /> Splash Island Water Park Saint Lucia - 5.4 km / 3.4 mi <br /> Labrelotte Bay - 8.1 km / 5.1 mi <br /> </p><p>The nearest airports are:<br />Hewanorra Intl. Airport (UVF) - 66.9 km / 41.6 mi<br /> George F. L. Charles Airport (SLU) - 12.9 km / 8 mi<br /> </p><p>The preferred airport for Sandals Grande St. Lucian - ALL INCLUSIVE Couples Only is Hewanorra Intl. Airport (UVF). </p>,"<p>HeadLine : In Gros Islet (Cap Estate)</p><p>Location : With a stay at Sandals Grande St. Lucian - ALL INCLUSIVE Couples Only in Gros Islet (Cap Estate), you ll be steps from Windward Islands and 6 minutes by foot from Pigeon Island National Park.  This 4.5-star property is 15.1 mi (24.2 km) from Marigot Bay and 1.1 mi (1.7 km) from Saint Joseph the Worker Catholic Church.</p><p>Rooms : Make yourself at home in one of the 311 individually furnished guestrooms, featuring refrigerators and LED televisions. Rooms have private furnished balconies or patios. Cable programming and iPod docking stations are provided for your entertainment, while complimentary wireless Internet access keeps you connected. Private bathrooms with showers feature complimentary toiletries and hair dryers.</p><p>Dining : This property is all inclusive. Rates include meals and beverages at onsite dining establishments. Charges may be applied for dining at some restaurants, special dinners and dishes, some beverages, and other amenities. <p>Grab a bite at Toscaninis, one of the property s 12 restaurants, or stay in and take advantage of the room service. Snacks are also available at the coffee shop/cafe. Relax with a refreshing drink at the beach bar, the poolside bar, or one of 8 bars/lounges. A complimentary buffet breakfast is served daily from 7:30 AM to 11:00 AM. </p></p><p>CheckIn Instructions : <ul>  <li>Extra-person charges may apply and vary depending on property policy</li><li>Government-issued photo identification and a credit card, debit card, or cash deposit may be required at check-in for incidental charges</li><li>Special requests are subject to availability upon check-in and may incur additional charges; special requests cannot be guaranteed</li><li>This property accepts credit cards; cash is not accepted</li><li>Safety features at this property include a carbon monoxide detector and a smoke detector</li><li>Please note that cultural norms and guest policies may differ by country and by property; the policies listed are provided by the property</li>  </ul></p><p>Special Instructions : To make arrangements for check-in please contact the property ahead of time using the information on the booking confirmation. If you are planning to arrive after 3:00 PM please contact the property in advance using the information on the booking confirmation. Guests must contact the property in advance for check-in instructions. Front desk staff will greet guests on arrival. For more details, please contact the property using the information on the booking confirmation.  This property caters to couples, including same-sex couples. This hotel is exclusively for adult couples. Guests who book a room category with butler service included must contact this hotel in advance to provide their preferences.</p>",1-758-455-2001,Gift shops or newsstand Dry cleaning/laundry service Shopping on site Optional golf privileges Ziplining nearby Golf clubs (equipment) Pool umbrellas Limo or Town Car service available Free WiFi Number of bars/lounges - 8 Number of poolside bars - 1 Number of outdoor pools - 5 Number of beach bars - 1 Number of swim-up bars - 1 In-room accessibility (in select rooms) Tours/ticket assistance Sailing on site Fitness classes on site Scuba diving on site Free Buffet Breakfast Free airport transportation Free breakfast Golf lessons available nearby Outdoor tennis courts - 2 Multilingual staff Conference center Daily Ecotours nearby Number of coffee shops/cafes - 1 elevator Snorkeling on site Wheelchair accessible Beach umbrellas Nightclub Meeting rooms Arcade/game room Spa treatment room(s) Garden Picnic area Full-service spa Wedding services Volleyball on site Beach towels Water skiing on site Boat tours nearby Windsurfing on site Pro shop 24-hour health club Clubhouse Luggage storage Billiards or pool table 24-hour front desk Golfing nearby Spa services on site Safe-deposit box at front desk Smoke-free property Snack bar/deli Hiking/biking trails nearby Sauna Steam room Free self parking Conference space Kayaking on site Hair salon Tennis on site Beach sun loungers Terrace Wheelchair accessible path of travel Access to nearby outdoor pool Pool sun loungers Concierge services,14.091578|-60.958528,1-758-455-2000,999999,http://www.sandals.com/main/grande/gl-home/
LC,St Lucia,113829,Cape Estate,1266796,Club St. Lucia By Splash,ThreeStar,Po. Box 915 Cap. Estate Smugglers Village Gros Islet Gros Islet ,,"HotelDescription#This all inclusive resort is situated on the beach, in around 26 hectares of tropical gardens. The garden path leads directly to the beach. The range of services offered and the countless activities available make this resort the perfect place for romantic couples, active singles and families.

The 26 hectare resort was designed for the 5 holiday villages gathered around Seaside Cove, where guests may find the swimming pools, daytime and nighttime entertainment and restaurants. In addition to this, the resort also provides accommodation in bungalows. There are a total of 372 rooms available, of which 72 are suites. Amongst the hotel's facilities count a lobby area with a reception desk manned around the clock and a safe. Furthermore, the resort offers a café, a mini supermarket, 4 bars, 5 speciality restaurants with a separate eating area for children and public Internet access. Younger guests may let off steam in the kid's club. The laundry service (charges apply) rounds up the facilities available here. Parking is available for guests arriving by car.

Each of the resort's villages has its own signature colour and playful name: Julie Mango, Whispering Palms, Magic Parrot, Banana Liming and Hummingbird. The rooms all come with an en suite bathroom with hairdryer. Furthermore all rooms are equipped with cable TV, a telephone, a safe (a fee will be charged), a clock radio, a coffee maker, ironing equipment and a king-size bed. The air conditioning can be individually regulated.",001758450862,Year of construction : 1979 Suites : 72 NO Connecting rooms American Express MasterCard Visa Shower Bathtub Hairdryer Direct dial telephone TV Radio Tea and coffee making facilities Ironing set Individually adjustable air conditioning   Safe NO Small pets allowed (under 5 kg) NO Large pets allowed (over 5 kg) NO Wheelchair-accessible NO Car park NO Garage 24-hour reception Wired Internet Laundry service(Additional Fee) Medical service(Additional Fee) Air conditioning in public areas   Hotel safe(Additional Fee) Supermarket Shop Garden Café Bar Restaurant : 5 Poolside snack bar Kids club Hot tub(Additional Fee) Massage(Additional Fee) Spa treatments(Additional Fee) Breakfast buffet   Buffet lunch Buffet dinner Aqua fit Waterskiing Jet ski Diving Windsurfing Pedal boating Table tennis Basketball Beach volleyball Golf Tennis,14.097578|-60.949761,7584577900,,
LC,St Lucia,113829,Cape Estate,1324599,Cap Maison Resort & Spa,FiveStar,Po Box 2188 Smugglers Cove Drive Cap EstateGros Islet ,Distances are displayed to the nearest 0.1 mile and kilometer. <br /> <p>Windward Islands - 0.1 km / 0.1 mi <br /> Smugglers Cove - 0.1 km / 0.1 mi <br /> Sandals Golf and Country Club - 1.9 km / 1.2 mi <br /> Saint Joseph the Worker Catholic Church - 3.1 km / 1.9 mi <br /> Cas en Bas Beach - 3.5 km / 2.2 mi <br /> Rodney Bay Aquatic Centre - 3.6 km / 2.2 mi <br /> Friday Night Street Party - 4 km / 2.5 mi <br /> Pigeon Island National Park - 4 km / 2.5 mi <br /> Rodney Bay Marina - 4.4 km / 2.8 mi <br /> Bonne Terre Tropical Gardens - 5.5 km / 3.4 mi <br /> Baywalk Shopping Mall - 5.8 km / 3.6 mi <br /> Daren Sammy Cricket Ground - 6.4 km / 4 mi <br /> Reduit Beach - 6.7 km / 4.2 mi <br /> Splash Island Water Park Saint Lucia - 6.8 km / 4.2 mi <br /> Labrelotte Bay - 9.5 km / 5.9 mi <br /> </p><p>The nearest airports are:<br />Hewanorra Intl. Airport (UVF) - 68.3 km / 42.4 mi<br /> George F. L. Charles Airport (SLU) - 14.3 km / 8.9 mi<br /> </p><p>The preferred airport for Cap Maison Resort & Spa is Hewanorra Intl. Airport (UVF). </p>,"<p>HeadLine : In Gros Islet (Cap Estate)</p><p>Location : With a stay at Cap Maison Resort & Spa in Gros Islet (Cap Estate), you ll be steps from Windward Islands and Smugglers Cove.  This 5-star resort is 2.4 mi (3.9 km) from Pigeon Island National Park and 15.9 mi (25.6 km) from Marigot Bay.</p><p>Rooms : Make yourself at home in one of the 49 air-conditioned rooms featuring minibars and flat-screen televisions. Complimentary wireless Internet access keeps you connected, and digital programming is available for your entertainment. Bathrooms have designer toiletries and hair dryers. Conveniences include phones, as well as safes and coffee/tea makers.</p><p>Dining : All-inclusive rates are available at this resort. Meals and beverages at onsite dining establishments are included in all-inclusive rates. Charges may be applied for dining at some restaurants, special dinners and dishes, some beverages, and other amenities. <p>Grab a bite to eat at the Cliff at Cap, a restaurant where you can take in the pool view, or stay in and take advantage of room service. Mingle with other guests at the complimentary reception, held daily. Relax with your favorite drink at the bar/lounge or the beach bar. </p></p><p>CheckIn Instructions : <ul>  <li>Extra-person charges may apply and vary depending on property policy</li><li>Government-issued photo identification and a credit card, debit card, or cash deposit may be required at check-in for incidental charges</li><li>Special requests are subject to availability upon check-in and may incur additional charges; special requests cannot be guaranteed</li><li>This property accepts credit cards and debit cards; cash is not accepted</li>  </ul></p><p>Special Instructions : Front desk staff will greet guests on arrival.</p>",1-758-450-8847,Gift shops or newsstand Dry cleaning/laundry service Mountain biking nearby Wheelchair accessible Free grocery shopping service Beach umbrellas Free reception Scuba diving nearby Free WiFi Number of bars/lounges - 1 Health club Spa treatment room(s) Number of spa tubs - 1 Number of outdoor pools - 2 Number of beach bars - 1 Garden Wheelchair accessible parking Full-service spa Wedding services Tours/ticket assistance Beach towels Water skiing on site Sailing on site Supervised childcare/activities (surcharge) Windsurfing on site Yoga classes/instruction on site Luggage storage Golf lessons available nearby Parasailing nearby Personal motorized watercraft on site 24-hour front desk Library Golfing nearby Safe-deposit box at front desk Smoke-free property Ecotours nearby Hiking/biking trails nearby Laundry facilities Free self parking Fitness facilities Kayaking on site Hair salon Terrace Concierge services,14.099393|-60.950514,1-758-4578670,0000,http://capmaison.com/
LC,St Lucia,113829,Cape Estate,1448624,Belle Kaye,TwoStar,Castries-Gros Islet Hwy Gros IsletCap Estate ,Distances are displayed to the nearest 0.1 mile and kilometer. <br /> <p>Windward Islands - 0.1 km / 0.1 mi <br /> Rodney Bay Aquatic Centre - 1.2 km / 0.7 mi <br /> Saint Joseph the Worker Catholic Church - 1.4 km / 0.9 mi <br /> Sandals Golf and Country Club - 1.6 km / 1 mi <br /> Friday Night Street Party - 1.6 km / 1 mi <br /> Pigeon Island National Park - 1.7 km / 1 mi <br /> Rodney Bay Marina - 2 km / 1.2 mi <br /> Smugglers Cove - 2.3 km / 1.4 mi <br /> Cas en Bas Beach - 2.5 km / 1.5 mi <br /> Bonne Terre Tropical Gardens - 3.5 km / 2.2 mi <br /> Baywalk Shopping Mall - 3.8 km / 2.4 mi <br /> Daren Sammy Cricket Ground - 4.1 km / 2.6 mi <br /> Reduit Beach - 4.7 km / 2.9 mi <br /> Splash Island Water Park Saint Lucia - 4.8 km / 3 mi <br /> Labrelotte Bay - 7.3 km / 4.5 mi <br /> </p><p>The nearest airports are:<br />Hewanorra Intl. Airport (UVF) - 66 km / 41 mi<br /> George F. L. Charles Airport (SLU) - 12 km / 7.5 mi<br /> </p><p>The preferred airport for Belle Kaye is Hewanorra Intl. Airport (UVF). </p>,"<p>HeadLine : In Gros Islet (Cap Estate)</p><p>Location : With a stay at Belle Kaye in Gros Islet (Cap Estate), you ll be steps from Windward Islands and 14 minutes by foot from Rodney Bay Aquatic Centre.  This apartment is 1 mi (1.7 km) from Pigeon Island National Park and 14.5 mi (23.4 km) from Marigot Bay.</p><p>Rooms : Make yourself at home in one of the 8 air-conditioned rooms featuring refrigerators and microwaves. Rooms have private balconies. Cable programming and DVD players are provided for your entertainment, while complimentary wireless Internet access keeps you connected. Bathrooms with showers are provided.</p><p>Dining : Take advantage of the apartment s room service.</p><p>CheckIn Instructions : <ul>  <li>Extra-person charges may apply and vary depending on property policy</li><li>Government-issued photo identification and a credit card, debit card, or cash deposit may be required at check-in for incidental charges</li><li>Special requests are subject to availability upon check-in and may incur additional charges; special requests cannot be guaranteed</li><li>This property accepts credit cards</li><li>Safety features at this property include a fire extinguisher, a smoke detector, a security system, and a first aid kit</li>  </ul></p><p>Special Instructions : This property offers transfers from the airport (surcharges may apply). Guests must contact the property with arrival details before travel, using the contact information on the booking confirmation. The front desk is open daily from 8:00 AM - noon. To make arrangements for check-in please contact the property at least 72 hours before arrival using the information on the booking confirmation. Guests must contact the property in advance for check-in instructions. Front desk staff will greet guests on arrival.</p>",1-758-5185865,Wheelchair accessible parking Laundry facilities Accessible bathroom (in select rooms) Free self parking Terrace Wheelchair accessible path of travel Airport transportation (surcharge) Energy-saving features in guest rooms Luggage storage Babysitting or childcare (surcharge) Locally-owned & organized tours & activities Express check-out Express check-in Front desk (limited hours) Free WiFi Barbecue grill(s) Number of outdoor pools - 1 Golfing nearby Change of towels (on request) Garden Smoke-free property,14.090983|-60.948766,1-758-5185865,Gros Islet Hwy,https://www.bellekaye.com/
