countyCode,countyName,cityCode,cityName,HotelCode,HotelName,HotelRating,Address,Attractions,Description,FaxNumber,HotelFacilities,Map,PhoneNumber,PinCode,HotelWebsiteUrl
LC,St Lucia,113829,Cape Estate,1452754,Manderley Villa,FourStar,Cap Estate  ,Distances are calculated in a straight line from the property&apos;s location to the point of interest or attraction  and may not reflect actual travel distance. &lt;br /&gt;&lt;br /&gt; Distances are displayed to the nearest 0.1 mile and kilometer. &lt;p&gt;Rodney Bay Marina - 0.4 km / 0.3 mi &lt;br /&gt;Bonne Terre Tropical Gardens - 0.8 km / 0.5 mi &lt;br /&gt;Reduit Beach - 1 km / 0.6 mi &lt;br /&gt;Baywalk Shopping Mall - 1 km / 0.6 mi &lt;br /&gt;Splash Island Water Park Saint Lucia - 1.1 km / 0.7 mi &lt;br /&gt;Rodney Bay Aquatic Centre - 1.3 km / 0.8 mi &lt;br /&gt;St. Joseph the Worker Parish - 1.3 km / 0.8 mi &lt;br /&gt;Beausejour Stadium - 1.5 km / 0.9 mi &lt;br /&gt;Cas en Bas Beach - 2.6 km / 1.6 mi &lt;br /&gt;St. Lucia Golf &amp; Country Club - 2.8 km / 1.8 mi &lt;br /&gt;Pigeon Island National Park - 2.9 km / 1.8 mi &lt;br /&gt;Smugglers Cove - 3.1 km / 1.9 mi &lt;br /&gt;Choc Beach - 5.1 km / 3.2 mi &lt;br /&gt;Marquis Plantation - 6.3 km / 3.9 mi &lt;br /&gt;Vigie Beach - 7.6 km / 4.7 mi &lt;br /&gt;&lt;/p&gt;&lt;p&gt;The nearest airports are:&lt;br /&gt;Castries (SLU-George F. L. Charles) - 7.9 km / 4.9 mi&lt;br /&gt;Vieux Fort (UVF-Hewanorra Intl.) - 37.3 km / 23.2 mi&lt;br /&gt;&lt;/p&gt;&lt;p&gt;The preferred airport for Manderley Villa is Vieux Fort (UVF-Hewanorra Intl.). &lt;/p&gt;,"<p><b>Property Location</b> <br />With a stay at Manderley Villa in Gros Islet (Rodney Bay), you''ll be minutes from Rodney Bay Marina and close to Reduit Beach. This 4-star villa is within close proximity of Bonne Terre Tropical Gardens and Baywalk Shopping Mall.</p><p><b>Rooms</b> <br />Make yourself at home in one of the air-conditioned rooms featuring kitchens with refrigerators and microwaves. Rooms have private balconies or patios. Flat-screen televisions with cable programming provide entertainment, while complimentary wireless Internet access keeps you connected. Conveniences include separate sitting areas and ceiling fans, and housekeeping is provided daily.</p><p><b>Rec, Spa, Premium Amenities</b> <br />Enjoy recreation amenities such as an outdoor pool or take in the view from a garden. Additional features include complimentary wireless Internet access and a picnic area.</p><p><b>Business, Other Amenities</b> <br />Free self parking is available onsite.</p>",,Microwave Private bathrooms Air Condition in rooms Outdoor Swimming Pool Separate sitting area Separate living room Separate dining area Separate bedroom Free Wireless Internet access Cable / Satellite Television Free self parking Free Wireless Internet access (inroom) Hair dryer (on request) Flat screen TV (LCD  LED or Plasma TV) Shower Self Laundry Pets Not Allowed Fridge Kitchen Iron & Board Fan Picnic area Garden,14.07226|-60.94526,,,
LC,St Lucia,113829,Cape Estate,1461312,South Sea House,ThreeStar,South Hills S N  ,Distances are displayed to the nearest 0.1 mile and kilometer. <br /> <p>Windward Islands - 0.1 km / 0.1 mi <br /> Cas en Bas Beach - 1.6 km / 1 mi <br /> Sandals Golf and Country Club - 1.8 km / 1.1 mi <br /> Smugglers Cove - 2.5 km / 1.6 mi <br /> Rodney Bay Aquatic Centre - 2.6 km / 1.6 mi <br /> Saint Joseph the Worker Catholic Church - 2.8 km / 1.8 mi <br /> Friday Night Street Party - 3 km / 1.9 mi <br /> Pigeon Island National Park - 3.1 km / 1.9 mi <br /> Rodney Bay Marina - 3.5 km / 2.1 mi <br /> Daren Sammy Cricket Ground - 4.4 km / 2.8 mi <br /> Bonne Terre Tropical Gardens - 4.9 km / 3.1 mi <br /> Baywalk Shopping Mall - 5.6 km / 3.5 mi <br /> Reduit Beach - 6.5 km / 4 mi <br /> Splash Island Water Park Saint Lucia - 6.5 km / 4.1 mi <br /> Labrelotte Bay - 9.2 km / 5.7 mi <br /> </p><p>The nearest airports are:<br />Hewanorra Intl. Airport (UVF) - 68 km / 42.3 mi<br /> George F. L. Charles Airport (SLU) - 14 km / 8.7 mi<br /> </p><p>The preferred airport for South Sea House is Hewanorra Intl. Airport (UVF). </p>,"<p>HeadLine : In Gros Islet (Cap Estate)</p><p>Location : With a stay at South Sea House in Gros Islet (Cap Estate), you ll be within a 5-minute drive of Sandals Golf and Country Club and Cas en Bas Beach.  This villa is 1.5 mi (2.4 km) from Smugglers Cove and 2.3 mi (3.7 km) from Pigeon Island National Park.</p><p>Rooms : Treat yourself to a stay in one of the 3 individually decorated guestrooms, featuring private plunge pools and flat-screen televisions. Rooms have private balconies or patios. Kitchens are outfitted with refrigerators, stovetops, and microwaves. Cable programming and MP3 docking stations are provided for your entertainment, while complimentary wireless Internet access keeps you connected.</p><p>Dining : Wrap up your day with a drink at the beach bar.</p><p>CheckIn Instructions : <ul>  <li>Extra-person charges may apply and vary depending on property policy</li><li>Government-issued photo identification and a credit card, debit card, or cash deposit may be required at check-in for incidental charges</li><li>Special requests are subject to availability upon check-in and may incur additional charges; special requests cannot be guaranteed</li><li>This property accepts credit cards; cash is not accepted</li><li>Safety features at this property include a fire extinguisher, a smoke detector, and window guards</li>  </ul></p><p>Special Instructions : This property offers transfers from the airport (surcharges may apply). Guests must contact the property with arrival details before travel, using the contact information on the booking confirmation. There is no front desk at this property. Guests will receive an email 7 days before arrival with check-in instructions. The host will greet guests on arrival.</p>",1-758-458-4848,Airport transportation (surcharge) Vegetable garden Uncovered parking Energy-saving features in guest rooms Free grocery shopping service LED light bulbs Water dispenser use by guests actively encouraged Wheelchair accessible  no Luggage storage Locally-owned & organized tours & activities Water dispenser Barbecue grill(s) Number of outdoor pools - 1 Number of beach bars - 1 Garden Laundry facilities Tours/ticket assistance Free self parking Terrace,14.08951|-60.938436,1 758 720 5128,000124,
LC,St Lucia,113829,Cape Estate,1481269,Villa Atlantis,ThreeStar,Golf Ridge Cap Estate ,Distances are displayed to the nearest 0.1 mile and kilometer. <br /> <p>Windward Islands - 0.1 km / 0.1 mi <br /> Sandals Golf and Country Club - 1.1 km / 0.7 mi <br /> Smugglers Cove - 1.7 km / 1.1 mi <br /> Cas en Bas Beach - 2 km / 1.2 mi <br /> Rodney Bay Aquatic Centre - 2.4 km / 1.5 mi <br /> Saint Joseph the Worker Catholic Church - 2.7 km / 1.7 mi <br /> Pigeon Island National Park - 2.9 km / 1.8 mi <br /> Friday Night Street Party - 3.1 km / 1.9 mi <br /> Rodney Bay Marina - 3.2 km / 2 mi <br /> Bonne Terre Tropical Gardens - 4.6 km / 2.8 mi <br /> Daren Sammy Cricket Ground - 4.8 km / 3 mi <br /> Baywalk Shopping Mall - 4.8 km / 3 mi <br /> Reduit Beach - 5.7 km / 3.5 mi <br /> Splash Island Water Park Saint Lucia - 5.8 km / 3.6 mi <br /> Labrelotte Bay - 8.5 km / 5.3 mi <br /> </p><p>The nearest airports are:<br />Hewanorra Intl. Airport (UVF) - 67.3 km / 41.8 mi<br /> George F. L. Charles Airport (SLU) - 13.3 km / 8.2 mi<br /> </p><p></p>,"<p>HeadLine : In Gros Islet (Cap Estate)</p><p>Location : With a stay at this villa in Gros Islet (Cap Estate), you ll be steps from Windward Islands and 13 minutes by foot from Sandals Golf and Country Club.  This villa is 1.8 mi (2.9 km) from Pigeon Island National Park and 15.2 mi (24.4 km) from Marigot Bay.</p><p>Rooms : Make yourself comfortable in this air-conditioned villa, which features a fireplace and a flat-screen TV. There s a private balcony or patio. A kitchen is outfitted with a full-sized refrigerator/freezer, an oven, and a stovetop. Complimentary wireless Internet access keeps you connected, and cable programming is available for your entertainment.</p><p>Dining : At this villa, enjoy a satisfying meal at the restaurant.</p><p>CheckIn Instructions : <ul>  <li>Extra-person charges may apply and vary depending on property policy</li><li>Government-issued photo identification and a cash deposit may be required at check-in for incidental charges</li><li>Special requests are subject to availability upon check-in and may incur additional charges; special requests cannot be guaranteed</li><li>This property accepts cash</li>  </ul></p><p>Special Instructions : There is no front desk at this property. The host will greet guests on arrival.</p>",44-759-5710169,Wheelchair accessible  no Luggage storage Reception hall Free WiFi Designated smoking areas Number of outdoor pools - 1 Spa services on site Garden Safe-deposit box at front desk Picnic area Laundry facilities Free self parking Terrace,14.094151|-60.942898,44-759-5710169,LC01 101,
LC,St Lucia,113829,Cape Estate,1511929,Hideaway at Royalton Saint Lucia,FourStar,St Lucia Address Gros Islet 000 Gros Islet ,Distances are displayed to the nearest 0.1 mile and kilometer. <br /> <p>Windward Islands - 0.1 km / 0.1 mi <br /> Sandals Golf and Country Club - 1.7 km / 1.1 mi <br /> Smugglers Cove - 2.3 km / 1.4 mi <br /> Rodney Bay Aquatic Centre - 2.8 km / 1.7 mi <br /> Saint Joseph the Worker Catholic Church - 3 km / 1.9 mi <br /> Cas en Bas Beach - 3.2 km / 2 mi <br /> Friday Night Street Party - 3.2 km / 2 mi <br /> Pigeon Island National Park - 3.2 km / 2 mi <br /> Rodney Bay Marina - 3.7 km / 2.3 mi <br /> Bonne Terre Tropical Gardens - 4.8 km / 3 mi <br /> Baywalk Shopping Mall - 5.2 km / 3.2 mi <br /> Daren Sammy Cricket Ground - 5.8 km / 3.6 mi <br /> Reduit Beach - 6.1 km / 3.8 mi <br /> Splash Island Water Park Saint Lucia - 6.1 km / 3.8 mi <br /> Labrelotte Bay - 8.9 km / 5.5 mi <br /> </p><p>The nearest airports are:<br />Hewanorra Intl. Airport (UVF) - 67.5 km / 42 mi<br /> George F. L. Charles Airport (SLU) - 13.5 km / 8.4 mi<br /> </p><p>The preferred airport for Hideaway at Royalton Saint Lucia  An Autograph Collection All-Inclusive Resort - Adults Only is Hewanorra Intl. Airport (UVF). </p>,"<p>HeadLine : In Gros Islet (Cap Estate)</p><p>Location : With a stay at Hideaway at Royalton Saint Lucia, An Autograph Collection All-Inclusive Resort - Adults Only in Gros Islet (Cap Estate), you ll be steps from Windward Islands and a 3-minute drive from Sandals Golf and Country Club.  This 4.5-star property is 2 mi (3.3 km) from Pigeon Island National Park and 15.5 mi (25 km) from Marigot Bay.</p><p>Rooms : Make yourself at home in one of the 166 air-conditioned rooms featuring minibars and flat-screen televisions. Your memory foam bed comes with premium bedding. Rooms have private balconies or patios. Complimentary wireless Internet access keeps you connected, and satellite programming is available for your entertainment. Bathrooms with shower/tub combinations feature jetted bathtubs and complimentary toiletries.</p><p>Dining : This property is all inclusive. Rates include meals and beverages at onsite dining establishments. Charges may be applied for dining at some restaurants, special dinners and dishes, some beverages, and other amenities. <p>Enjoy international cuisine at Gourmet Marche, one of the property s 8 restaurants, or stay in and take advantage of the 24-hour room service. Snacks are also available at the coffee shop/cafe. When you are in need of a refreshing drink, visit the beach bar or one of 10 bars/lounges, or 2 poolside bars. </p></p><p>CheckIn Instructions : <ul>  <li>Extra-person charges may apply and vary depending on property policy</li><li>Government-issued photo identification and a credit card, debit card, or cash deposit may be required at check-in for incidental charges</li><li>Special requests are subject to availability upon check-in and may incur additional charges; special requests cannot be guaranteed</li><li>This property accepts credit cards; cash is not accepted</li>  </ul></p><p>Special Instructions : This property doesn t offer after-hours check-in. Front desk staff will greet guests on arrival.</p>",758-484-5058,Beach volleyball on site Nightclub Scuba diving nearby Free WiFi Number of bars/lounges - 10 Health club Designated smoking areas Number of poolside bars - 2 Number of outdoor pools - 3 Number of beach bars - 1 Garden In-room accessibility (in select rooms) Bicycle rentals nearby Roll-in shower (in select rooms) Full-service spa Wedding services Tours/ticket assistance Accessible bathroom (in select rooms) Tennis lessons on site Volleyball on site Beach towels Fitness classes on site Wheelchair accessible  no Luggage storage Outdoor tennis courts - 1 Multilingual staff Business center 24-hour front desk Spa services on site Snack bar/deli Number of coffee shops/cafes - 1 Sauna elevator Free self parking Fitness facilities Snorkeling on site Beach sun loungers Terrace Pool sun loungers Concierge services Pilates classes on site,14.09737|-60.95026,758-7311000,lc01101,http://www.royaltonresorts.com/en/Hideaway-at-Royalton-Saint-Lucia.aspx
LC,St Lucia,113829,Cape Estate,1547999,Les Chaudieres,All,Cap Estate  ,Distances are calculated in a straight line from the property&apos;s location to the point of interest or attraction  and may not reflect actual travel distance. &lt;br /&gt;&lt;br /&gt; Distances are displayed to the nearest 0.1 mile and kilometer. &lt;p&gt;L&apos;Anse la Raye Beach - 0.7 km / 0.4 mi &lt;br /&gt;River Rock Waterfall - 0.9 km / 0.5 mi &lt;br /&gt;Anse Cochon Beach - 1.4 km / 0.9 mi &lt;br /&gt;Canaries Bay - 3.9 km / 2.4 mi &lt;br /&gt;Millet Bird Sanctuary - 4 km / 2.5 mi &lt;br /&gt;Roseau Valley Banana Plantation - 4 km / 2.5 mi &lt;br /&gt;Marigot Harbour - 4.1 km / 2.6 mi &lt;br /&gt;Marigot Bay - 4.2 km / 2.6 mi &lt;br /&gt;Anse Mamin Beach - 8 km / 4.9 mi &lt;br /&gt;Anse Chastanet Beach - 8.4 km / 5.2 mi &lt;br /&gt;St. Lucia Rain Forest - 8.6 km / 5.3 mi &lt;br /&gt;Turtle Reef - 8.7 km / 5.4 mi &lt;br /&gt;Aqua Dulce Trail - 8.7 km / 5.4 mi &lt;br /&gt;French Wall Trail - 8.7 km / 5.4 mi &lt;br /&gt;Mont Fortune Historic Area - 8.7 km / 5.4 mi &lt;br /&gt;&lt;/p&gt;&lt;p&gt;The nearest airports are:&lt;br /&gt;Castries (SLU-George F. L. Charles) - 11.1 km / 6.9 mi&lt;br /&gt;Vieux Fort (UVF-Hewanorra Intl.) - 24.5 km / 15.2 mi&lt;br /&gt;&lt;/p&gt;&lt;p&gt;The preferred airport for Les Chaudieres is Vieux Fort (UVF-Hewanorra Intl.). &lt;/p&gt;,"<p><b>Property Location</b> <br />With a stay at Les Chaudieres in Anse La Raye, you''ll be close to L''Anse la Raye Beach and Marigot Bay. This 4-star villa is within close proximity of River Rock Waterfall and Anse Cochon Beach.</p><p><b>Rooms</b> <br />Make yourself at home in one of the air-conditioned rooms featuring kitchens with refrigerators and microwaves. Rooms have private balconies or patios. Flat-screen televisions with cable programming provide entertainment, while complimentary wireless Internet access keeps you connected. Conveniences include separate sitting areas and coffee/tea makers, and housekeeping is provided daily.</p><p><b>Rec, Spa, Premium Amenities</b> <br />Take advantage of recreation opportunities such as an outdoor pool or take in the view from a terrace and a garden. This villa also features complimentary wireless Internet access and a picnic area.</p><p><b>Business, Other Amenities</b> <br />Free self parking is available onsite.</p>",,Microwave Private bathrooms Air Condition in rooms Private balcony / terrace Outdoor Swimming Pool Separate sitting area Separate living room Separate dining area Separate bedroom Free Wireless Internet access Cable / Satellite Television Free self parking Free Wireless Internet access (inroom) Tea/Coffee Making Facilities Visa MasterCard Terrace / Patio Hair dryer (on request) Flat screen TV (LCD  LED or Plasma TV) Shower Self Laundry Pets Not Allowed Fridge Kitchen Iron & Board Fan Picnic area Garden,13.9355|-61.04812,,,
LC,St Lucia,113829,Cape Estate,1674838,Villa Hall,ThreeStar,. Cap Estate 00124 Cap Estate ,Distances are displayed to the nearest 0.1 mile and kilometer. <br /> <p>Windward Islands - 0.1 km / 0.1 mi <br /> Sandals Golf and Country Club - 0.1 km / 0.1 mi <br /> Smugglers Cove - 1.9 km / 1.2 mi <br /> Cas en Bas Beach - 2.6 km / 1.6 mi <br /> Rodney Bay Aquatic Centre - 2.8 km / 1.7 mi <br /> Saint Joseph the Worker Catholic Church - 3.2 km / 2 mi <br /> Pigeon Island National Park - 3.2 km / 2 mi <br /> Friday Night Street Party - 3.4 km / 2.1 mi <br /> Rodney Bay Marina - 3.8 km / 2.4 mi <br /> Bonne Terre Tropical Gardens - 4.8 km / 3 mi <br /> Baywalk Shopping Mall - 5.1 km / 3.2 mi <br /> Daren Sammy Cricket Ground - 5.7 km / 3.6 mi <br /> Reduit Beach - 6 km / 3.8 mi <br /> Splash Island Water Park Saint Lucia - 6.1 km / 3.8 mi <br /> Labrelotte Bay - 8.9 km / 5.5 mi <br /> </p><p>The nearest airports are:<br />Hewanorra Intl. Airport (UVF) - 67.3 km / 41.8 mi<br /> George F. L. Charles Airport (SLU) - 13.6 km / 8.5 mi<br /> </p><p></p>,"<p>HeadLine : In Gros Islet (Cap Estate)</p><p>Location : With a stay at this villa in Gros Islet (Cap Estate), you ll be steps from Windward Islands and Sandals Golf and Country Club.  This villa is 2 mi (3.2 km) from Pigeon Island National Park and 15.5 mi (25 km) from Marigot Bay.</p><p>Rooms : Make yourself comfortable in this air-conditioned villa, featuring a kitchen with a full-sized refrigerator/freezer and an oven. There s a private balcony or patio. A plasma television with cable programming provides entertainment, while complimentary wireless Internet access keeps you connected. Conveniences include a safe and a desk, and housekeeping is provided daily.</p><p>CheckIn Instructions : <ul>  <li>Extra-person charges may apply and vary depending on property policy</li><li>Government-issued photo identification and a credit card, debit card, or cash deposit may be required at check-in for incidental charges</li><li>Special requests are subject to availability upon check-in and may incur additional charges; special requests cannot be guaranteed</li><li>This property accepts credit cards; cash is not accepted</li>  </ul></p><p>Special Instructions : There is no front desk at this property. This property doesn t offer after-hours check-in. The host will greet guests on arrival.</p>",1-416-8372320,Sailing nearby Windsurfing nearby Scuba diving nearby Free WiFi Number of outdoor pools - 1 Water skiing nearby Garden Picnic area Beach towels Boat tours nearby Wheelchair accessible  no Parasailing nearby Barbecue grill(s) Spa services on site Snorkeling nearby Smoke-free property Laundry facilities Surfing/bodyboarding nearby Rafting nearby Kayaking nearby Free self parking Fitness facilities Terrace Concierge services,14.096724|-60.937802,1-416-8372320,00124,
LC,St Lucia,113829,Cape Estate,1853420,Tranquil Sunset,TwoStar,6 Golf Park Road Cap Estate ,Distances are calculated in a straight line from the property's location to the point of interest or attraction  and may not reflect actual travel distance. <br /><br /> Distances are displayed to the nearest 0.1 mile and kilometer. <p>St. Lucia Golf & Country Club - 0.9 km / 0.6 mi <br />Smugglers Cove - 1.1 km / 0.7 mi <br />Cas en Bas Beach - 2.2 km / 1.4 mi <br />Rodney Bay Aquatic Centre - 2.4 km / 1.5 mi <br />Pigeon Island National Park - 2.6 km / 1.6 mi <br />St. Joseph the Worker Parish - 2.9 km / 1.8 mi <br />Friday Night Street Party - 3 km / 1.9 mi <br />Splash Island Water Park Saint Lucia - 3.3 km / 2 mi <br />Rodney Bay Marina - 3.3 km / 2.1 mi <br />Reduit Beach - 3.7 km / 2.3 mi <br />Daren Sammy Cricket Ground - 4.1 km / 2.5 mi <br />Baywalk Shopping Mall - 4.2 km / 2.6 mi <br />Bonne Terre Tropical Gardens - 4.4 km / 2.8 mi <br />Choc Beach - 8.6 km / 5.4 mi <br />Marquis Plantation - 9.2 km / 5.7 mi <br /></p><p>The nearest airports are:<br />Castries (SLU-George F. L. Charles) - 11 km / 6.8 mi<br />Vieux Fort (UVF-Hewanorra Intl.) - 40.9 km / 25.4 mi<br /></p><p>The preferred airport for Tranquil Sunset is Vieux Fort (UVF-Hewanorra Intl.). </p>,"<p><b>Property Location</b> <br />With a stay at Tranquil Sunset in Cap Estate, you'll be convenient to St. Lucia Golf & Country Club and Pigeon Island National Park.  This aparthotel is within close proximity of Smugglers Cove and Cas en Bas Beach.</p><p><b>Rooms</b> <br />Make yourself at home in one of the 4 air-conditioned rooms featuring kitchens with full-sized refrigerators/freezers and ovens. Complimentary wireless Internet access keeps you connected, and flat-screen televisions are provided for your entertainment. Conveniences include microwaves and complimentary bottled water, and housekeeping is provided on request.</p><p><b>Amenities</b> <br />Take in the views from a garden and make use of amenities such as complimentary wireless Internet access and concierge services.</p><p><b>Dining</b> <br />Full breakfasts are available daily from 9 AM to 11 AM for a fee.</p><p><b>Business, Other Amenities</b> <br />Featured amenities include express check-in, express check-out, and dry cleaning/laundry services. A roundtrip airport shuttle is provided for a surcharge (available 24 hours), and free self parking is available onsite.</p>",,Free self parking Garden Laundry facilities Smoke-free property Television in common areas Total number of rooms - 4 Tours/ticket assistance Airport transportation (surcharge) Breakfast available (surcharge) Concierge services Dry cleaning/laundry service Express check-in Express check-out Free WiFi,14.10447|-60.94064,,,
LC,St Lucia,113829,Cape Estate,1888037,Mount Royal Luxury Condos,FourStar,Belle Vue Gros Islet Castries ,,"Situated in Cap Estate, Mount Royal Saint Lucia features free WiFi and units fitted with a kitchen.

All units feature air conditioning and a 50 inch smart flat-screen TV. Every unit is outfitted with a full sized German designed kitchen., a dishwasher, microwave, blender, kettle, and double door fridge with water and ice dispenser.

Guests can relax in the garden at the property.

Mount Royal is a 3 minute drive from Pigeon Island National Park. Mount Royal is less than a 10 minute drive from the islands nightlife, banks, supermarkets, restaurants, shopping mall and casino. George F L Charles Airport is 9 km away. Please inform Mount Royal Saint Lucia in advance of your expected arrival time. You can use the Special Requests box when booking, or contact the property directly with the contact details provided in your confirmation.",,Parking 24-hour front desk Golf course (within 3 km) Garden Terrace Non-smoking rooms Airport shuttle Fishing babysitting/child services Laundry dry cleaning Family rooms Ironing service Bridal suite Free parking internet services express check-in/check-out Currency exchange Windsurfing Hot tub/jacuzzi Soundproof rooms Hiking BBQ facilities Car hire Tour desk Heating Fax/photocopying Diving Horse riding Luggage storage wifi Outdoor pool Free WiFi Air conditioning designated smoking area Sun terrace outdoor pool (all year) concierge service Private check-in/check-out shuttle service (additional charge) airport shuttle (additional charge) Water park Daily housekeeping grocery deliveries On-site parking Private parking wifi available in all areas Baby safety gates Children television networks secured parking Street parking Accessible parking,14.09078|-60.94236,,,https://www.booking.com/hotel/lc/mount-royal.html
