countyCode,countyName,cityCode,cityName,HotelCode,HotelName,HotelRating,Address,Attractions,Description,FaxNumber,HotelFacilities,Map,PhoneNumber,PinCode,HotelWebsiteUrl
LC,St Lucia,113829,Cape Estate,5266074,Chateau Devaux,ThreeStar,No 1 Manowar Drive  ,Distances are displayed to the nearest 0.1 mile and kilometer. <br /> <p>Windward Islands - 0.1 km / 0.1 mi <br /> Sandals Golf and Country Club - 2 km / 1.2 mi <br /> Cas en Bas Beach - 2.6 km / 1.6 mi <br /> Smugglers Cove - 2.8 km / 1.7 mi <br /> Saint Joseph the Worker Catholic Church - 4.8 km / 3 mi <br /> Friday Night Street Party - 4.9 km / 3.1 mi <br /> Pigeon Island National Park - 5 km / 3.1 mi <br /> Rodney Bay Aquatic Centre - 4.4 km / 2.7 mi <br /> Rodney Bay Marina - 5.1 km / 3.2 mi <br /> Bonne Terre Tropical Gardens - 6.4 km / 4 mi <br /> Baywalk Shopping Mall - 6.7 km / 4.2 mi <br /> Daren Sammy Cricket Ground - 7.3 km / 4.6 mi <br /> Splash Island Water Park Saint Lucia - 7.7 km / 4.8 mi <br /> Reduit Beach - 8 km / 5 mi <br /> Labrelotte Bay - 10.4 km / 6.5 mi <br /> </p><p>The nearest airports are:<br />Hewanorra Intl. Airport (UVF) - 69.2 km / 43 mi<br /> George F. L. Charles Airport (SLU) - 15.2 km / 9.4 mi<br /> </p><p></p>,"<p>HeadLine : In Gros Islet (Cap Estate)</p><p>Location : With a stay at this villa in Gros Islet (Cap Estate), you ll be a 3-minute drive from Sandals Golf and Country Club and 6 minutes from Pigeon Island National Park.  This villa is 3.2 mi (5.1 km) from Rodney Bay Marina and 5 mi (8 km) from Reduit Beach.</p><p>Rooms : Make yourself comfortable in your air-conditioned villa, featuring a refrigerator and a microwave. Complimentary wireless Internet access is available to keep you connected. The bathroom has a shower.Conveniences include a washer/dryer and an iron/ironing board, as well as a phone with free local calls.</p><p>Dining : At this villa, enjoy a satisfying meal at the restaurant. Quench your thirst with your favorite drink at the bar/lounge.</p><p>CheckIn Instructions : <ul>  <li>Extra-person charges may apply and vary depending on property policy</li><li>Government-issued photo identification and a credit card, debit card, or cash deposit may be required at check-in for incidental charges</li><li>Special requests are subject to availability upon check-in and may incur additional charges; special requests cannot be guaranteed</li><li>This property accepts credit cards and cash</li>  </ul></p><p>Special Instructions : There is no front desk at this property.</p>",,Dock Outdoor furniture Fully fenced Outdoor entertainment area Free WiFi Number of bars/lounges - 1 Designated smoking areas Barbecue grill(s) Number of outdoor pools - 1 Housekeeping on request Garden Free self parking Terrace,14.106569|-60.933736,1-7584849621,,
LC,St Lucia,113829,Cape Estate,5384098,Our Beachfront Villas,All,34 Becune  ,,"BeachFront Villa is one minute away from the beach and within a 2 mile radius of restaurants, Rodney Bay Marina, excursions, shopping outlets, nightlife and other nearby beaches. Free WiFi is available throughout the property.

The property has a fully equipped kitchen and living/dining room. Free private parking is also available at this villa.

Car hire is available at the property and the area is popular for golfing, horse riding and snorkeling. BeachFront Villa is nearby shopping malls, restaurants, beaches and nightlife excursions. The property is right next to Royalton Resort and offers day passes for surcharge.

Sainte-Luce is 42 km from BeachFront Villa, while Sainte-Anne is 39 km from the property. The nearest airport is George F L Charles Airport, 9 km from Our Beachfront Villas. Please inform BeachFront Villa in advance of your expected arrival time. You can use the Special Requests box when booking, or contact the property directly with the contact details provided in your confirmation.
Guests are required to show a photo identification and credit card upon check-in. Please note that all Special Requests are subject to availability and additional charges may apply.
Payment before arrival via bank transfer is required. The property will contact you after you book to provide instructions.
This property will not accommodate hen, stag or similar parties.
All Guest must sign Owners lease agreement in order to stay at the our property.

When 2 guests book this Villa, they will only have access to 1 room. In order to get access to the second room, a surcharge of $45 will be placed to the final price of reservation.
Managed by a private host",,Hiking BBQ facilities Car hire Diving Horse riding Snorkelling wifi Free WiFi Non-smoking throughout Air conditioning designated smoking area Sun terrace nightclub/dj shuttle service (additional charge) airport shuttle (additional charge) Beachfront Outdoor furniture grocery deliveries Picnic area parking on site Private parking wifi available in all areas Indoor play area secured parking Fruits sun loungers or beach chairs Parking Tennis Court Golf course (within 3 km) Garden Terrace Non-smoking rooms Airport shuttle Fishing babysitting/child services Laundry Barber/beauty shop Family rooms Casino Ironing service Free parking internet services Safety Deposit Box Massage children's playground Windsurfing Soundproof rooms Canoeing thermometers for guests provided by property face masks for guests available Beach Shuttle service use of cleaning chemicals that are effective against coronavirus linens  towels and laundry washed in accordance with local authority guidelines guest accommodation is disinfected between stays guest accommodation sealed after cleaning food can be delivered to guest accommodation staff follow all safety protocols as directed by local authorities shared stationery such as printed menus  magazines  pens  and paper removed hand sanitizer in guest accommodation and key areas process in place to check health of guests first aid kit available contactless check-in/check-out cashless payment available physical distancing rules followed mobile app for room service screens or physical barriers placed between staff and guests in appropriate areas property is cleaned by professional cleaning companies all plates  cutlery  glasses and other tableware have been sanitized guests have the option to cancel any cleaning services for their accommodation during their stay,14.09456|-60.95211,,,https://www.booking.com/hotel/lc/our-beachfront-villa.html
LC,St Lucia,113829,Cape Estate,5650961,Sephina Villa St Lucia Island Dream Holidays,All,Gros Islet  ,,"Situated in Cap Estate Cap Estate Gros Islet, an 8 minutes drive from Rodney Bay town center and 5 minutes drive from The town of Gros Islet, this air conditioned holiday home, features free WiFi and a patio. Free private parking is offered.

There is a seating area as well as a kitchen equipped with an oven in the apartment. A flat screen TV is provided in all 3 accommodations. For the Private Rooms, there is a refrigerator, microwave and electric kettle. Other facilities at Sephina Villa include a sun terrace. Massage services are offered, for an extra fee. Please inform Sephina Villa St Lucia Island Dream Holidays in advance of your expected arrival time. You can use the Special Requests box when booking, or contact the property directly with the contact details provided in your confirmation.
This property will not accommodate hen, stag or similar parties.
In response to Coronavirus (COVID-19), additional safety and sanitation measures are in effect at this property.
As a result of Coronavirus (COVID-19), this property has temporarily suspended its shuttle services.
Due to Coronavirus (COVID-19), this property is taking steps to help protect the safety of guests and staff. Certain services and amenities may be reduced or unavailable as a result.",,guests have the option to cancel any cleaning services for their accommodation during their stay delivered food is securely covered thermometers for guests provided by property face masks for guests available Parking Golf course (within 3 km) Garden Terrace Non-smoking rooms Airport shuttle Laundry Family rooms Free parking internet services Massage Hot tub/jacuzzi wifi Free WiFi Non-smoking throughout Air conditioning designated smoking area Private beach area Sun terrace Private check-in/check-out shuttle service (additional charge) airport shuttle (additional charge) parking on site Private parking wifi available in all areas Accessible parking Wine/champagne Outdoor furniture Spa lounge/relaxation area Full body massage Beach Shuttle service Smoke alarms Fire extinguishers use of cleaning chemicals that are effective against coronavirus linens  towels and laundry washed in accordance with local authority guidelines guest accommodation is disinfected between stays guest accommodation sealed after cleaning staff follow all safety protocols as directed by local authorities shared stationery such as printed menus  magazines  pens  and paper removed hand sanitizer in guest accommodation and key areas process in place to check health of guests first aid kit available cashless payment available physical distancing rules followed invoice provided all plates  cutlery  glasses and other tableware have been sanitized,14.0976|-60.94298,,,https://www.booking.com/hotel/lc/sephina-villa.html
LC,St Lucia,113829,Cape Estate,5651042,Beachfront Cottage,All,Bamboo Road  ,,"Featuring a garden, a terrace, and a restaurant, Beachfront Cottage features accommodation in Gros Islet with free WiFi and sea views. Boasting free private parking, the villa is in an area where guests can engage in activities such as hiking, windsurfing and fishing.

The air-conditioned villa consists of 1 bedroom, a living room, a fully equipped kitchen with a fridge and a kettle, and 2 bathrooms with a shower and free toiletries. Towels and bed linen are available in the villa.

The reception at the villa can provide tips on the area.

A childrens playground and barbecue facilities are available for guests at Beachfront Cottage to use.

Pigeon Island Beach is 1.5 km from the accommodation, while Smugglers Cove Beach is 2.7 km from the property. The nearest airport is George F. L. Charles, 12 km from Beachfront Cottage, and the property offers a paid airport shuttle service. Guests are required to show a photo identification and credit card upon check-in. Please note that all Special Requests are subject to availability and additional charges may apply.
This property will not accommodate hen, stag or similar parties.
Please Note: All Guests must sign Owners lease agreement in order to stay at the property. The property will contact you after you book to provide instructions.
Managed by a private host",,Parking Restaurant Room service 24-hour front desk Tennis Court Golf course (within 3 km) Garden Terrace Non-smoking rooms Airport shuttle Fishing Laundry Barber/beauty shop Family rooms Ironing service Free parking internet services express check-in/check-out Free WiFi Non-smoking throughout Air conditioning designated smoking area Sun terrace concierge service nightclub/dj shuttle service (additional charge) water sport facilities on site Safety Deposit Box children's playground Windsurfing Soundproof rooms Hiking BBQ facilities Car hire Diving Horse riding wifi contactless check-in/check-out cashless payment available physical distancing rules followed mobile app for room service screens or physical barriers placed between staff and guests in appropriate areas all plates  cutlery  glasses and other tableware have been sanitized guests have the option to cancel any cleaning services for their accommodation during their stay breakfast takeaway containers delivered food is securely covered thermometers for guests provided by property face masks for guests available airport shuttle (additional charge) Beachfront Evening entertainment Water park grocery deliveries parking on site Private parking wifi available in all areas secured parking airport pick up airport drop off Outdoor furniture Picnic area Beach Shuttle service CCTV in common areas CCTV outside property Fire extinguishers use of cleaning chemicals that are effective against coronavirus linens  towels and laundry washed in accordance with local authority guidelines guest accommodation is disinfected between stays guest accommodation sealed after cleaning physical distancing in dining areas food can be delivered to guest accommodation staff follow all safety protocols as directed by local authorities shared stationery such as printed menus  magazines  pens  and paper removed hand sanitizer in guest accommodation and key areas process in place to check health of guests first aid kit available,14.09532|-60.95182,,,https://www.booking.com/hotel/lc/beachfront-cottage-gros-islet.html
LC,St Lucia,113829,Cape Estate,5751104,Baydreams 1 bed 1 bath Condo,All,Gate Park Cap Estate  ,,"Boasting an outdoor swimming pool and a garden, Baydreams 1-bed/1-bath condo features accommodation in Gros Islet with access to free WiFi and sea views.

The apartment has 1 separate bedroom, 1 bathroom, a fully equipped kitchen with a dining area and oven, and a living room.

The apartment offers a balcony.

 Pigeon Island is 2 km from Baydreams 1-bed/1-bath condo, while Rodney Bay is 4 km from the property. This property will not accommodate hen, stag or similar parties.
Please inform Baydreams 1-bed/1-bath condo in advance of your expected arrival time. You can use the Special Requests box when booking, or contact the property directly with the contact details provided in your confirmation.
Managed by a private host",,Parking Golf course (within 3 km) Garden Non-smoking rooms Free parking internet services wifi Outdoor pool Free WiFi Non-smoking throughout Air conditioning Sun terrace outdoor pool (all year) parking on site Private parking wifi available in all areas Pool with view pool/beach towels Fence around pool Swimming pool,14.09091|-60.94732,,,https://www.booking.com/hotel/lc/100-2-bed-47-2-bath-condo.html
LC,St Lucia,113829,Cape Estate,6042357,Cap Estate Villa Pool Air Con Wifi,All,Imortel Drive  ,,"Boasting air-conditioned accommodation with a private pool, Cap Estate Villa Sleeps 2 Pool Air Con WiFi is set in Cap Estate. Located 1.7 km from Donkey Beach, the property provides an outdoor swimming pool and free private parking.

Featuring a DVD player, the villa has a kitchen with a microwave, a fridge and an oven, a living room, a dining area, 1 bedroom, and 1 bathroom with a bath or shower. A TV with cable channels is provided.

The nearest airport is George F. L. Charles Airport, 11 km from the villa. Guests are required to show a photo identification and credit card upon check-in. Please note that all Special Requests are subject to availability and additional charges may apply.
Please inform Cap Estate Villa Sleeps 2 Pool Air Con WiFi in advance of your expected arrival time. You can use the Special Requests box when booking, or contact the property directly with the contact details provided in your confirmation.
Payment before arrival via bank transfer is required. The property will contact you after you book to provide instructions.",,Parking Family rooms Free parking Outdoor pool Air conditioning outdoor pool (all year) parking on site Private parking Swimming pool,14.09894|-60.93401,,97227,https://www.booking.com/hotel/lc/cap-estate-villa-sleeps-2-pool-air-con-wifi.html
LC,St Lucia,113829,Cape Estate,6042364,Cap Estate Villa Pool Air Con Wifi,All,Unnamed Road  ,,"Boasting air-conditioned accommodation with a private pool, Cap Estate Villa Sleeps 4 Pool Air Con WiFi is situated in Cap Estate. Set 2.3 km from Donkey Beach, the property offers an outdoor swimming pool and free private parking.

Featuring a DVD player, the villa has a kitchen with a microwave, a fridge and an oven, a living room, a dining area, 2 bedrooms, and 2 bathrooms with a bath or shower. A TV with cable channels is featured.

The nearest airport is George F. L. Charles Airport, 10 km from the villa. Payment before arrival via bank transfer is required. The property will contact you after you book to provide instructions.
Please inform Cap Estate Villa Sleeps 4 Pool Air Con WiFi in advance of your expected arrival time. You can use the Special Requests box when booking, or contact the property directly with the contact details provided in your confirmation.
Guests are required to show a photo identification and credit card upon check-in. Please note that all Special Requests are subject to availability and additional charges may apply.",,Air conditioning Private parking Family rooms Outdoor pool outdoor pool (all year) Swimming pool Free parking Parking On-site parking,14.09584|-60.94004,,97227,https://www.booking.com/hotel/lc/cap-estate-villa-sleeps-4-pool-air-con-wifi.html
LC,St Lucia,113829,Cape Estate,6042451,Cap Estate Villa Pool Air Con Wifi,All,Unnamed Road  ,,"Featuring air-conditioned accommodation with a private pool, Cap Estate Villa Sleeps 8 Pool Air Con WiFi is set in Cap Estate. Situated 2.2 km from Donkey Beach, the property features an outdoor swimming pool and free private parking.

Boasting a DVD player, the villa has a kitchen with a microwave, a fridge and an oven, a living room, a dining area, 3 bedrooms, and 3 bathrooms with a bath or shower. A TV with cable channels is offered.

The nearest airport is George F. L. Charles Airport, 10 km from the villa. Payment before arrival via bank transfer is required. The property will contact you after you book to provide instructions.
Please inform Cap Estate Villa Sleeps 8 Pool Air Con WiFi in advance of your expected arrival time. You can use the Special Requests box when booking, or contact the property directly with the contact details provided in your confirmation.
Guests are required to show a photo identification and credit card upon check-in. Please note that all Special Requests are subject to availability and additional charges may apply.
A damage deposit of USD 875 is required. The host charges this 14 days before arrival. This will be collected by credit card. You should be reimbursed within 14 days of check-out. Your deposit will be refunded in full via credit card, subject to an inspection of the property.",,Air conditioning Free parking On-site parking Family rooms Parking Swimming pool Outdoor pool outdoor pool (all year) Private parking,14.09755|-60.93944,,97227,https://www.booking.com/hotel/lc/cap-estate-villa-sleeps-8-pool-air-con-wifi-cap-estate12.html
LC,St Lucia,113829,Cape Estate,6042459,Cap Estate Villa Pool Wifi,All,Unnamed Road  ,,"Featuring a private pool and pool views, Cap Estate Villa Sleeps 6 Pool WiFi is set in Cap Estate. Situated 2.4 km from Donkey Beach, the property features an outdoor swimming pool and free private parking.

Boasting a DVD player, the villa has a kitchen with a microwave, a fridge and an oven, a living room, a dining area, 3 bedrooms, and 3 bathrooms with a bath or shower. A TV with cable channels is available.

The nearest airport is George F. L. Charles Airport, 11 km from the villa. Payment before arrival via bank transfer is required. The property will contact you after you book to provide instructions.
Please inform Cap Estate Villa Sleeps 6 Pool WiFi in advance of your expected arrival time. You can use the Special Requests box when booking, or contact the property directly with the contact details provided in your confirmation.
Guests are required to show a photo identification and credit card upon check-in. Please note that all Special Requests are subject to availability and additional charges may apply.",,Parking Family rooms Free parking Outdoor pool outdoor pool (all year) parking on site Private parking Swimming pool,14.10347|-60.94,,97227,https://www.booking.com/hotel/lc/cap-estate-villa-sleeps-6-pool-wifi.html
LC,St Lucia,113829,Cape Estate,6042467,Cap Estate Villa Pool Air Con Wifi,All,Unnamed Road  ,,"Boasting air-conditioned accommodation with a private pool, Cap Estate Villa Sleeps 6 Pool Air Con WiFi is set in Cap Estate. Located 2.3 km from Pigeon Island Beach, the property provides an outdoor swimming pool and free private parking.

Featuring a DVD player, the villa has a kitchen with a microwave, a fridge and an oven, a living room, a dining area, 3 bedrooms, and 3 bathrooms with a bath or shower. A TV with cable channels is provided.

The nearest airport is George F. L. Charles Airport, 11 km from the villa. Please inform Cap Estate Villa Sleeps 6 Pool Air Con WiFi in advance of your expected arrival time. You can use the Special Requests box when booking, or contact the property directly with the contact details provided in your confirmation.
Payment before arrival via bank transfer is required. The property will contact you after you book to provide instructions.
Guests are required to show a photo identification and credit card upon check-in. Please note that all Special Requests are subject to availability and additional charges may apply.",,Outdoor pool Private parking Swimming pool outdoor pool (all year) Air conditioning Parking Family rooms Free parking On-site parking,14.10716|-60.94665,,97227,https://www.booking.com/hotel/lc/cap-estate-villa-sleeps-6-pool-air-con-wifi.html
LC,St Lucia,113829,Cape Estate,6042483,Cap Estate Villa 0 Pool Air Con Wifi,All,Unnamed Road  ,,"Featuring air-conditioned accommodation with a private pool, Cap Estate Villa Sleeps 10 Pool Air Con WiFi is set in Cap Estate. Situated 2.3 km from Pigeon Island Beach, the property features an outdoor swimming pool and free private parking.

Boasting a DVD player, the villa has a kitchen with a microwave, a fridge and an oven, a living room, a dining area, 5 bedrooms, and 4 bathrooms with a bath or shower. A TV with cable channels is available.

The nearest airport is George F. L. Charles Airport, 11 km from the villa. Please inform Cap Estate Villa Sleeps 10 Pool Air Con WiFi in advance of your expected arrival time. You can use the Special Requests box when booking, or contact the property directly with the contact details provided in your confirmation.
Payment before arrival via bank transfer is required. The property will contact you after you book to provide instructions.
Guests are required to show a photo identification and credit card upon check-in. Please note that all Special Requests are subject to availability and additional charges may apply.",,outdoor pool (all year) Parking Air conditioning Family rooms Private parking Free parking On-site parking Outdoor pool Swimming pool,14.10739|-60.94605,,97227,https://www.booking.com/hotel/lc/cap-estate-villa-sleeps-10-pool-air-con-wifi.html
LC,St Lucia,113829,Cape Estate,6042499,Cap Estate Villa 0 Pool Air Con Wifi,All,Unnamed Road  ,,"Featuring air-conditioned accommodation with a private pool, Cap Estate Villa Sleeps 10 Pool Air Con WiFi is set in Cap Estate. Situated 2.3 km from Donkey Beach, the property features an outdoor swimming pool and free private parking.

Boasting a DVD player, the villa has a kitchen with a microwave, a fridge and an oven, a living room, a dining area, 5 bedrooms, and 4 bathrooms with a bath or shower. A TV with cable channels is offered.

The nearest airport is George F. L. Charles Airport, 10 km from the villa. Guests are required to show a photo identification and credit card upon check-in. Please note that all Special Requests are subject to availability and additional charges may apply.
Please inform Cap Estate Villa Sleeps 10 Pool Air Con WiFi in advance of your expected arrival time. You can use the Special Requests box when booking, or contact the property directly with the contact details provided in your confirmation.
Payment before arrival via bank transfer is required. The property will contact you after you book to provide instructions.",,Free parking On-site parking Air conditioning Parking Private parking Outdoor pool Family rooms outdoor pool (all year) Swimming pool,14.09771|-60.93968,,97227,https://www.booking.com/hotel/lc/cap-estate-villa-sleeps-10-pool-air-con-wifi-cap-estate.html
LC,St Lucia,113829,Cape Estate,6042507,Cap Estate Villa Pool Air Con Wifi,All,Unnamed Road  ,,"Boasting air-conditioned accommodation with a private pool, Cap Estate Villa Sleeps 2 Pool Air Con WiFi is set in Cap Estate. Located 1.7 km from Donkey Beach, the property provides an outdoor swimming pool and free private parking.

Featuring a DVD player, the villa has a kitchen with a microwave, a fridge and an oven, a living room, a dining area, 1 bedroom, and 1 bathroom with a bath or shower. A TV with cable channels is provided.

The nearest airport is George F. L. Charles Airport, 11 km from the villa. Guests are required to show a photo identification and credit card upon check-in. Please note that all Special Requests are subject to availability and additional charges may apply.
Please inform Cap Estate Villa Sleeps 2 Pool Air Con WiFi in advance of your expected arrival time. You can use the Special Requests box when booking, or contact the property directly with the contact details provided in your confirmation.
Payment before arrival via bank transfer is required. The property will contact you after you book to provide instructions.",,Parking Family rooms Free parking Outdoor pool Air conditioning outdoor pool (all year) parking on site Private parking Swimming pool,14.09894|-60.93401,,97227,https://www.booking.com/hotel/lc/cap-estate-villa-sleeps-2-pool-air-con-wifi.html
