countyCode,countyName,cityCode,cityName,HotelCode,HotelName,HotelRating,Address,Attractions,Description,FaxNumber,HotelFacilities,Map,PhoneNumber,PinCode,HotelWebsiteUrl
TR,Turkey,100575,Afyonkarahisar,1093250,Cakmak Marble Hotel,FourStar,Suleyman Goncer Caddesi No:2 SÜLEYMAN GÖNÇER CADDESI NO 2 Süleyman Göncer Caddesi 23200 Afyonkarahisar ,Distances are displayed to the nearest 0.1 mile and kilometer. <br /> <p>Anit Park - 0.2 km / 0.1 mi <br /> Zafer Museum - 0.3 km / 0.2 mi <br /> Imaret Mosque - 0.5 km / 0.3 mi <br /> Mevlevi Mosque - 0.9 km / 0.5 mi <br /> Ottoman Houses - 1 km / 0.6 mi <br /> Ulu Cami - 1 km / 0.6 mi <br /> Archaeological Museum - 1 km / 0.6 mi <br /> Afyon Stadium - 1 km / 0.6 mi <br /> Castle of Afyon - 1.4 km / 0.9 mi <br /> Afyonkarahisar Archeological Museum - 1.7 km / 1.1 mi <br /> Ikbal Cami - 1.8 km / 1.1 mi <br /> Afyon Mansion - 4.3 km / 2.7 mi <br /> Afium Outlet Shopping Center - 9.2 km / 5.7 mi <br /> Ayazini Metropolis Caves - 32.8 km / 20.4 mi <br /> </p><p>The nearest major airport is Kutahya (KZR-Zafer) - 61.6 km / 38.3 mi</p>,"<p>HeadLine : Near Zafer Museum</p><p>Location : A stay at MCG Marble Hotel places you in the heart of Afyonkarahisar, steps from Anit Park and 3 minutes by foot from Zafer Museum.  This hotel is 0.4 mi (0.6 km) from Imaret Mosque and 0.6 mi (0.9 km) from Castle of Afyon.</p><p>Rooms : Make yourself at home in one of the 114 air-conditioned rooms featuring minibars. Complimentary wireless Internet access keeps you connected, and cable programming is available for your entertainment. Private bathrooms with showers feature complimentary toiletries and hair dryers. Conveniences include safes and complimentary newspapers, and housekeeping is provided daily.</p><p>Dining : Enjoy a meal at the restaurant, or stay in and take advantage of the hotel s room service (during limited hours). Quench your thirst with your favorite drink at the bar/lounge. A complimentary buffet breakfast is served daily from 7 AM to 10 AM.</p><p>CheckIn Instructions : <ul>  <li>Extra-person charges may apply and vary depending on property policy</li><li>Government-issued photo identification and a credit card, debit card, or cash deposit may be required at check-in for incidental charges</li><li>Special requests are subject to availability upon check-in and may incur additional charges; special requests cannot be guaranteed</li><li>This property accepts credit cards</li>  </ul></p><p>Special Instructions : Front desk staff will greet guests on arrival.</p>",90-272-2143309,Dry cleaning/laundry service Games Wheelchair accessible (may have limitations) Table tennis Number of meeting rooms - 1 Wheelchair-accessible path to elevator Free wired Internet Wheelchair-accessible registration desk Free WiFi Number of bars/lounges - 1 Number of indoor pools - 1 Garden In-room accessibility (in select rooms) Wheelchair accessible parking Free newspapers in lobby Roll-in shower (in select rooms) Accessible bathroom (in select rooms) Free Buffet Breakfast Rooftop terrace Luggage storage Wheelchair-accessible on-site restaurant Free breakfast Billiards or pool table 24-hour front desk Library Daily Safe-deposit box at front desk Laundry facilities Children's pool Sauna elevator Free self parking Fitness facilities Free valet parking Terrace Concierge services,38.75711|30.53992,90-272-2143300,03100,http://www.cakmakmarblehotel.com
TR,Turkey,100575,Afyonkarahisar,1141433,Orucoglu Thermal Resort,FiveStar,Kütahya Karayolu 14 Km AfyonAfyonkarahisar ,Distances are displayed to the nearest 0.1 mile and kilometer. <br /> <p>Afium Outlet Shopping Center - 5.7 km / 3.6 mi <br /> Afyon Mansion - 11.5 km / 7.2 mi <br /> Ikbal Cami - 13.4 km / 8.4 mi <br /> Ottoman Houses - 13.9 km / 8.6 mi <br /> Ulu Cami - 13.9 km / 8.6 mi <br /> Archaeological Museum - 13.9 km / 8.6 mi <br /> Anit Park - 14 km / 8.7 mi <br /> Castle of Afyon - 14.4 km / 9 mi <br /> Imaret Mosque - 14.5 km / 9 mi <br /> Afyon Stadium - 14.6 km / 9.1 mi <br /> Zafer Museum - 14.6 km / 9.1 mi <br /> Mevlevi Mosque - 14.8 km / 9.2 mi <br /> Afyonkarahisar Archeological Museum - 15.6 km / 9.7 mi <br /> Ayazini Metropolis Caves - 31.8 km / 19.8 mi <br /> Seydisul Tomb - 40.5 km / 25.2 mi <br /> </p><p>The nearest airports are:<br />Antalya Intl. Airport (AYT) - 278 km / 172.7 mi<br /> Kutahya (KZR-Zafer) - 46.3 km / 28.8 mi<br /> </p><p>The preferred airport for Orucoglu Thermal Resort is Antalya Intl. Airport (AYT). </p>,"<p>HeadLine : In Afyonkarahisar</p><p>Location : Located in Afyonkarahisar, Orucoglu Thermal Resort is within a 15-minute drive of Afium Outlet Shopping Center and Afyon Mansion.  This 5-star hotel is 8.4 mi (13.4 km) from Ikbal Cami and 8.6 mi (13.9 km) from Ottoman Houses.</p><p>Rooms : Treat yourself to a stay in one of the 293 guestrooms, featuring heated floors and flat-screen televisions. Complimentary wireless Internet access keeps you connected, and satellite programming is available for your entertainment. Conveniences include phones, as well as safes and separate sitting areas.</p><p>Dining : Grab a bite at Amorium Bistro, one of the hotel s 2 restaurants, or stay in and take advantage of the 24-hour room service. Snacks are also available at the coffee shop/cafe. Wrap up your day with a drink at the bar/lounge. A complimentary buffet breakfast is served daily from 7 AM to 10 AM.</p><p>CheckIn Instructions : <ul>  <li>Extra-person charges may apply and vary depending on property policy</li><li>Government-issued photo identification and a credit card, debit card, or cash deposit may be required at check-in for incidental charges</li><li>Special requests are subject to availability upon check-in and may incur additional charges; special requests cannot be guaranteed</li><li>This property accepts credit cards; cash is not accepted</li>  </ul></p><p>Special Instructions : Front desk staff will greet guests on arrival.</p>",90-272-2515060,Gift shops or newsstand Dry cleaning/laundry service Newspapers in lobby (surcharge) Reception hall Number of meeting rooms - 5 Free WiFi Number of bars/lounges - 1 Arcade/game room Designated smoking areas Garden In-room accessibility (in select rooms) Roll-in shower (in select rooms) Tours/ticket assistance Accessible bathroom (in select rooms) Free Buffet Breakfast Free area shuttle Airport transportation (surcharge) Luggage storage Free breakfast Grocery/convenience store Porter/bellhop Billiards or pool table Multilingual staff 24-hour front desk Library Playground on site Daily Safe-deposit box at front desk Coffee/tea in common areas Snack bar/deli Number of coffee shops/cafes - 1 Laundry facilities Sauna Fitness facilities Hair salon Terrace Wheelchair accessible path of travel Concierge services Steam room elevator Free self parking,38.838327|30.431516,90 272 2515050,03000,https://orucoglu.com/de/
TR,Turkey,100575,Afyonkarahisar,1141435,The Omer Thermal Hotel & Holiday Village,ThreeStar,Afyon-Kutahya Karayolu 14km Afyon ,City centre : 15000mts Bus/Train station : 11000mts Nearest Bus / Metro Stop : 1000mts,"HotelDescription#Offering both hotel rooms and villas, this thermal holiday village offers a wide range of thermal treatments making use of the natural spring waters the Afyon region is famous for. Additionally, the complex has meeting and conference facilities and is suitable for those interested in health treatments or wishing to combine both. Located in a picturesque, pastoral area, the complex is 15 km from the centre of Afyon in north west Turkey. The main road is a 10-15 minute walk away. Excellent for a relaxing and therapeutic break, guests can also benefit from a range of facilities such as table tennis, a fitness centrjogging track.",+902722515014,24-hour reception NO Smoking rooms TV lounge 220V power supply Laundry service(Additional Fee) NO Disability-friendly bathroom Turkish bath (hamam) YES Car park Steam bath YES Wheelchair-accessible Breakfast and dinner Garden Bellboy service TV WaterSlides Balcony Childrens play area MasterCard Mini fridge Restaurant Carpeted floors Gym Pool / snooker NO Garage Medical service(Additional Fee) Bar Direct dial telephone 24-hour security NO Wheelchair-accessible NO Large pets allowed (over 5 kg) NO Connecting rooms Sauna Spa treatments(Additional Fee) Table tennis Non-smoking area Wi-fi Bathroom Double bed Meeting room Holiday complex Hairdryer Hydro-massage bath Projector Massage(Additional Fee) Childrens swimming area Visa Café Outdoor freshwater pool Conference room(Additional Fee) NO Small pets allowed (under 5 kg) Shop Games room,38.817566867567|30.442084393848,+902722515010,,http://www.omerthermal.com.tr/
TR,Turkey,100575,Afyonkarahisar,1223369,Korel Thermal Resort,FiveStar,Kütahya Karayolu Afyonkarahisar ,,"The luxurious Korel Thermal Resort offers 5 swimming pools and a large spa with vegetable baths, mud baths and slimming cures. There is also a separate outdoor pool for women in the summer season. The guest rooms come with free WiFi.

The hotel rooms are spacious and equipped with air conditioning, satellite TVs and private bathrooms with hairdryers.

Guests can enjoy their meals at the 2 restaurants or sit down for a healthy drink at the Vitamin Bar. There are 3 other bars as well as an Orient Café. The cottage in the garden offers a cosy atmosphere and guests can have grilled chestnut and potatoes in winter, Turkish pancakes in summer season, in the cottage. All vegetables are organic and grown on-site while the meat is supplied from propertys own farm.

Guests of the Koral Thermal Resort can enjoy the thermal baths and pools or get professional advice from the hotels specialists and physiotherapists.

The Korel Thermal is situated 47.5 km from Zafer Airport. Please note that alcoholic beverages are not served in the property.",+902722522222,Restaurant Room service meeting/banquet facilities Bar 24-hour front desk Sauna Fitness centre Garden Terrace Non-smoking rooms Airport shuttle Laundry dry cleaning Facilities for disabled guests Barber/beauty shop Family rooms Games room Parking secured parking Street parking Public transport tickets Accessible parking Wheelchair accessible Toilet with grab rails Lower bathroom sink Emergency cord in bathroom Fruits coffee house on site sun loungers or beach chairs Sun umbrellas Outdoor furniture Picnic area Outdoor fireplace Beauty Services Facial treatments Waxing services Make up services hair treatments Manicure Pedicure breakfast in the room Ironing service Free parking internet services lift express check-in/check-out Safety Deposit Box Valet parking Currency exchange Spa and wellness centre Massage children's playground Billiards Table tennis Karaoke Darts Hot tub/jacuzzi Car hire Bowling Tour desk hammam Heating Fax/photocopying Luggage storage wifi Free WiFi Non-smoking throughout Air conditioning designated smoking area Snack Bar outdoor pool (all year) outdoor pool (seasonal) indoor pool (all year) Indoor pool (seasonal) concierge service Entertainment staff Private check-in/check-out shuttle service (additional charge) Special diet menus (on request) Trouser press Hot spring bath airport shuttle (additional charge) Lockers shared lounge/TV area kids' club minimarket on site Evening entertainment Water park Daily housekeeping parking on site Private parking wifi available in all areas Public Bath board games/puzzles Indoor play area kids' outdoor play equipment 24-hour security Key card access Security alarm CCTV in common areas CCTV outside property Fire extinguishers Swimming pool hair cut hair colouring hair styling Body Treatments Body scrub Body wrap Light therapy Spa Facilities Steam room Spa lounge/relaxation area Foot bath Spa/wellness packages Massage chair Fitness fitness classes Personal trainer fitness/spa locker rooms kids' pool Swimming pool Shuttle service Movie nights Walking tours Tour or class about local culture Live music/performance Archery Aerobics,38.82002|30.44037,+902722522222+902722522222,03200,https://www.booking.com/hotel/tr/korel-thermal-resort.html
TR,Turkey,100575,Afyonkarahisar,1223562,Ikbal Thermal Hotel and Spa,FiveStar,Izmir Karayolu km 9 Afyonkarahisar ,Distances are displayed to the nearest 0.1 mile and kilometer. <br /> <p>Afium Outlet Shopping Center - 0.1 km / 0.1 mi <br /> Afyon Mansion - 6.2 km / 3.9 mi <br /> Ikbal Cami - 8.1 km / 5.1 mi <br /> Ottoman Houses - 8.6 km / 5.3 mi <br /> Ulu Cami - 8.6 km / 5.3 mi <br /> Archaeological Museum - 8.6 km / 5.3 mi <br /> Anit Park - 8.7 km / 5.4 mi <br /> Castle of Afyon - 9.1 km / 5.7 mi <br /> Imaret Mosque - 9.1 km / 5.7 mi <br /> Afyon Stadium - 9.3 km / 5.8 mi <br /> Zafer Museum - 9.3 km / 5.8 mi <br /> Mevlevi Mosque - 9.5 km / 5.9 mi <br /> Afyonkarahisar Archeological Museum - 10.3 km / 6.4 mi <br /> Ayazini Metropolis Caves - 37.5 km / 23.3 mi <br /> Seydisul Tomb - 46 km / 28.6 mi <br /> </p><p>The preferred airport for Ikbal Thermal Hotel & Spa is Kutahya (KZR-Zafer) - 51.8 km / 32.2 mi </p>,"<p>HeadLine : Near Afium Outlet Shopping Center</p><p>Location : A stay at Ikbal Thermal Hotel & Spa places you in the heart of Afyonkarahisar, a 1-minute drive from Afium Outlet Shopping Center and 10 minutes from Imaret Mosque.  This 5-star hotel is 5.7 mi (9.1 km) from Castle of Afyon and 5.8 mi (9.3 km) from Zafer Museum.</p><p>Rooms : Treat yourself to a stay in one of the 286 individually decorated guestrooms, featuring fireplaces and heated floors. 32-inch LCD televisions with satellite programming provide entertainment, while complimentary wireless Internet access keeps you connected. Conveniences include phones, as well as safes and desks.</p><p>Dining : Stop by the hotel s restaurant, Kadayif Restaurant, for lunch or dinner. Dining is also available at the 2 coffee shops/cafes, and 24-hour room service is provided. Unwind at the end of the day with a drink at the bar/lounge or the poolside bar.</p><p>CheckIn Instructions : <ul>  <li>Extra-person charges may apply and vary depending on property policy</li><li>Government-issued photo identification and a credit card, debit card, or cash deposit may be required at check-in for incidental charges</li><li>Special requests are subject to availability upon check-in and may incur additional charges; special requests cannot be guaranteed</li><li>The name on the credit card used at check-in to pay for incidentals must be the primary name on the guestroom reservation</li><li>This property accepts credit cards; cash is not accepted</li><li>Safety features at this property include a carbon monoxide detector, a fire extinguisher, a smoke detector, a security system, a first aid kit, and window guards</li>  </ul></p><p>Special Instructions : Front desk staff will greet guests on arrival.</p>",90-272-2525614,Free valet parking Hair salon Computer station ATM/banking Pool sun loungers Conference space size (feet) - 15662 Concierge services 24-hour business center Porter/bellhop Billiards or pool table Business center 24-hour front desk Library Playground on site Racquetball/squash on site Safe-deposit box at front desk Snack bar/deli Children's pool Sauna Steam room Free self parking Conference space Gift shops or newsstand Dry cleaning/laundry service RV  bus  truck parking (surcharge) Babysitting or childcare (free) Pool umbrellas Conference space size (meters) - 1455 Free wired Internet Free WiFi Number of bars/lounges - 1 Designated smoking areas Number of spa tubs - 1 Number of poolside bars - 1 Number of outdoor pools - 1 Number of indoor pools - 1 In-room accessibility (in select rooms) Wheelchair accessible parking Tours/ticket assistance Accessible bathroom (in select rooms) Airport transportation (surcharge) Wheelchair-accessible lounge Wheelchair-accessible on-site restaurant Multilingual staff Handrails in stairways Electric car charging station Wheelchairs available on site Wheelchair-accessible meeting spaces/business center Turkish bath/Hammam Coffee/tea in common areas Number of coffee shops/cafes - 2 Laundry facilities elevator Children's club (free) Fitness facilities Infant/toddler toys Banquet hall Wheelchair accessible (may have limitations) Wheelchair-accessible concierge desk Hot springs on site Nightclub Meeting rooms Valet for wheelchair-equipped vehicle Wheelchair-accessible spa Wheelchair-accessible registration desk Television in common areas Arcade/game room Health club Spa treatment room(s) Garden Free newspapers in lobby Full-service spa Wedding services Shopping mall on site Luggage storage Grocery/convenience store,38.793104|30.455853,90--272-2525600,03009,http://ikbal.com.tr/
TR,Turkey,100575,Afyonkarahisar,1332177,Dundar Thermal,ThreeStar,Afyon Kütahya Karayolu 14 Km Demircevre MevkiiAfyon 03300 ,Distances are displayed to the nearest 0.1 mile and kilometer. <br /> <p>Afium Outlet Shopping Center - 3 km / 1.9 mi <br /> Afyon Mansion - 9.5 km / 5.9 mi <br /> Ikbal Cami - 10.8 km / 6.7 mi <br /> Ottoman Houses - 11.4 km / 7.1 mi <br /> Ulu Cami - 11.4 km / 7.1 mi <br /> Archaeological Museum - 11.4 km / 7.1 mi <br /> Anit Park - 11.6 km / 7.2 mi <br /> Castle of Afyon - 12 km / 7.5 mi <br /> Imaret Mosque - 12 km / 7.5 mi <br /> Afyon Stadium - 12.1 km / 7.5 mi <br /> Zafer Museum - 12.2 km / 7.6 mi <br /> Mevlevi Mosque - 12.4 km / 7.7 mi <br /> Afyonkarahisar Archeological Museum - 13.2 km / 8.2 mi <br /> Ayazini Metropolis Caves - 34.4 km / 21.4 mi <br /> Seydisul Tomb - 43.1 km / 26.8 mi <br /> </p><p>The preferred airport for Dundar Thermal Villa Otel is Kutahya (KZR-Zafer) - 48.8 km / 30.4 mi </p>,"<p>HeadLine : On the Strip</p><p>Location : Located in Afyonkarahisar, Dundar Thermal Villa Otel is on the Strip, a 5-minute drive from Afium Outlet Shopping Center and 14 minutes from Afyon Stadium.  This villa is 7.7 mi (12.4 km) from Mevlevi Mosque and 8.2 mi (13.2 km) from Afyonkarahisar Archeological Museum.</p><p>Rooms : Treat yourself to a stay in one of the 100 individually decorated guestrooms, featuring private spa tubs and LCD televisions. Your pillowtop bed comes with down comforters and Egyptian cotton sheets, and all rooms are furnished with single sofa beds. Rooms have private balconies. Kitchens are outfitted with full-sized refrigerators/freezers and stovetops. Complimentary wireless Internet access keeps you connected, and DVD players are provided for your entertainment.</p><p>Dining : Satisfy your appetite at the villa s coffee shop/cafe, or stay in and take advantage of the room service (during limited hours). Mingle with other guests at the complimentary reception, held daily. Full breakfasts are available daily from 8:00 AM to 1:00 PM for a fee.</p><p>CheckIn Instructions : <ul>  <li>Extra-person charges may apply and vary depending on property policy</li><li>Government-issued photo identification and a credit card or cash deposit may be required at check-in for incidental charges</li><li>Special requests are subject to availability upon check-in and may incur additional charges; special requests cannot be guaranteed</li><li>The name on the credit card used at check-in to pay for incidentals must be the primary name on the guestroom reservation</li><li>This property accepts major credit cards</li>  </ul></p><p>Special Instructions : This property offers transfers from the airport (surcharges may apply). Guests must contact the property with arrival details before travel, using the contact information on the booking confirmation. To make arrangements for check-in please contact the property at least 72 hours before arrival using the information on the booking confirmation. Guests must contact the property in advance for check-in instructions. Front desk staff will greet guests on arrival.</p>",90-246-2525124,Sauna Steam room Free self parking Fitness facilities Free valet parking Hair salon Terrace Wheelchair accessible path of travel 24-hour business center Mountain biking nearby Wheelchair accessible Babysitting or childcare (surcharge) Express check-in Free reception Free WiFi Number of spa tubs - 1 Horse riding/rental on site Garden Picnic area In-room accessibility (in select rooms) Wheelchair accessible parking Free newspapers in lobby Roll-in shower (in select rooms) Tours/ticket assistance Accessible bathroom (in select rooms) Area shuttle (surcharge) Free bicycles on site Airport transportation (surcharge) Luggage storage Express check-out Billiards or pool table Multilingual staff 24-hour front desk Breakfast available (surcharge) Free train station pickup Playground on site Barbecue grill(s) Spa services on site Safe-deposit box at front desk Smoke-free property Coffee/tea in common areas Number of coffee shops/cafes - 1 Laundry facilities Children's pool,38.818077|30.441881,+902722525121,03300,http://www.dundartermal.com
TR,Turkey,100575,Afyonkarahisar,1350656,Jura Hotels Afyon Thermal Hotel,FiveStar,AFYON-IZMIR KARAYOLU 8.KM SA - AFYON ,Distances are displayed to the nearest 0.1 mile and kilometer. <br /> <p>Afium Outlet Shopping Center - 1.4 km / 0.9 mi <br /> Afyon Mansion - 4.2 km / 2.6 mi <br /> Ikbal Cami - 5.9 km / 3.7 mi <br /> Ottoman Houses - 6.6 km / 4.1 mi <br /> Ulu Cami - 6.6 km / 4.1 mi <br /> Archaeological Museum - 6.6 km / 4.1 mi <br /> Anit Park - 6.6 km / 4.1 mi <br /> Castle of Afyon - 7.1 km / 4.4 mi <br /> Imaret Mosque - 7.1 km / 4.4 mi <br /> Zafer Museum - 7.3 km / 4.5 mi <br /> Afyon Stadium - 7.3 km / 4.5 mi <br /> Mevlevi Mosque - 7.5 km / 4.6 mi <br /> Afyonkarahisar Archeological Museum - 8.2 km / 5.1 mi <br /> Ayazini Metropolis Caves - 35.4 km / 22 mi <br /> Mechul Asker Aniti - 47.6 km / 29.6 mi <br /> </p><p>The preferred airport for Jura Hotels Afyon Thermal is Kutahya (KZR-Zafer) - 53.6 km / 33.3 mi </p>,"<p>HeadLine : Near Afium Outlet Shopping Center</p><p>Location : A stay at Jura Hotels Afyon Thermal places you in the heart of Afyonkarahisar, a 2-minute drive from Afium Outlet Shopping Center and 6 minutes from Afyon Mansion.  This family-friendly hotel is 3.7 mi (5.9 km) from Ikbal Cami and 4.1 mi (6.6 km) from Ottoman Houses.</p><p>Rooms : Make yourself at home in one of the 195 air-conditioned rooms featuring LCD televisions. Your Select Comfort bed comes with premium bedding. Complimentary wireless Internet access keeps you connected, and satellite programming is available for your entertainment. Bathrooms with shower/tub combinations feature jetted bathtubs and hair dryers.</p><p>Dining : Enjoy a meal at the restaurant, or stay in and take advantage of the hotel s 24-hour room service. Relax with your favorite drink at the bar/lounge or the poolside bar. A complimentary buffet breakfast is served daily from 7:30 AM to 9:30 AM.</p><p>CheckIn Instructions : <ul>  <li>Extra-person charges may apply and vary depending on property policy</li><li>Government-issued photo identification and a credit card may be required at check-in for incidental charges</li><li>Special requests are subject to availability upon check-in and may incur additional charges; special requests cannot be guaranteed</li><li>This property accepts credit cards; cash is not accepted</li>  </ul></p><p>Special Instructions : Front desk staff will greet guests on arrival.</p>",02722463637,Dry cleaning/laundry service Lockers available Free WiFi Number of bars/lounges - 1 Designated smoking areas Number of spa tubs - 1 Number of poolside bars - 1 Number of outdoor pools - 1 Number of indoor pools - 1 In-room accessibility (in select rooms) Free Buffet Breakfast Wheelchair-accessible on-site restaurant Free breakfast Multilingual staff Daily Turkish bath/Hammam Laundry facilities elevator Covered parking Games Uncovered parking Wheelchair accessible (may have limitations) Wheelchair accessible Meeting rooms Wheelchair-accessible registration desk Television in common areas Health club Spa treatment room(s) Garden Full-service spa Wedding services 24-hour fitness facilities Luggage storage Express check-out Porter/bellhop Billiards or pool table Children's club 24-hour front desk Spa services on site Snack bar/deli Children's pool Sauna Free self parking Conference space Free valet parking Hair salon Concierge services 24-hour business center,38.784837|30.474233,90-24-2324 12 62,03030,www.anemonhotels.com
