countyCode,countyName,cityCode,cityName,HotelCode,HotelName,HotelRating,Address,Attractions,Description,FaxNumber,HotelFacilities,Map,PhoneNumber,PinCode,HotelWebsiteUrl
TR,Turkey,100034,Adiyaman,1424280,Samos Hotel,ThreeStar,Bahcelievler Mah. Ataturk Bulvari No:328 A Ataturk Bulvari 328 A02290 Adiyaman ,Distances are displayed to the nearest 0.1 mile and kilometer. <br /> <p>Adiyaman Museum - 1.3 km / 0.8 mi <br /> Severan Bridge - 1.6 km / 1 mi <br /> Adiyaman Fortress - 1.7 km / 1.1 mi <br /> Pirin Caves - 6.1 km / 3.8 mi <br /> Karakus Tümülüs - 41.3 km / 25.6 mi <br /> Severan Bridge - 50.3 km / 31.3 mi <br /> Cendere Bridge - 51 km / 31.7 mi <br /> </p><p>The nearest major airport is Adiyaman (ADF) - 19.9 km / 12.4 mi</p>,"<p>HeadLine : Near Adiyaman Museum</p><p>Location : Located in Adiyaman, Samos Hotel is within a 5-minute drive of Severan Bridge and Adiyaman Museum.  This hotel is 1.3 mi (2.2 km) from Adiyaman Fortress and 3.8 mi (6.1 km) from Pirin Caves.</p><p>Rooms : Make yourself at home in one of the 63 guestrooms featuring minibars and LCD televisions. Complimentary wireless Internet access keeps you connected, and satellite programming is available for your entertainment. Private bathrooms with showers feature complimentary toiletries and slippers. Conveniences include safes and desks, and housekeeping is provided daily.</p><p>Dining : At Samos Hotel, enjoy a satisfying meal at the restaurant. Quench your thirst with your favorite drink at the bar/lounge. A complimentary buffet breakfast is served daily from 7 AM to 10 AM.</p><p>CheckIn Instructions : <ul>  <li>Extra-person charges may apply and vary depending on property policy</li><li>Government-issued photo identification and a credit card, debit card, or cash deposit may be required at check-in for incidental charges</li><li>Special requests are subject to availability upon check-in and may incur additional charges; special requests cannot be guaranteed</li><li>This property accepts credit cards and cash</li><li>Safety features at this property include a fire extinguisher, a smoke detector, a security system, a first aid kit, and window guards</li>  </ul></p><p>Special Instructions : This property doesn t offer after-hours check-in. Front desk staff will greet guests on arrival.</p>",90-416-2149000,Dry cleaning/laundry service Number of meeting rooms - 1 Free WiFi Number of bars/lounges - 1 Designated smoking areas Number of outdoor pools - 1 Garden In-room accessibility (in select rooms) Tours/ticket assistance Free Buffet Breakfast Airport transportation (surcharge) Wheelchair accessible  no Luggage storage Free breakfast 24-hour front desk Daily Outdoor seasonal pool Safe-deposit box at front desk Coffee/tea in common areas Laundry facilities Free self parking Terrace Concierge services,37.763029|38.29148,+904162147373,02290,http://hotelsamos.com.tr/
TR,Turkey,100034,Adiyaman,1434968,Unal Hotel,ThreeStar,Harikci Cad. No14 Merkez02100 Adiyaman ,Distances are displayed to the nearest 0.1 mile and kilometer. <br /> <p>Adiyaman Fortress - 0.5 km / 0.3 mi <br /> Adiyaman Museum - 0.5 km / 0.3 mi <br /> Pirin Caves - 4.8 km / 3 mi <br /> Severan Bridge - 43.8 km / 27.2 mi <br /> </p><p>The nearest major airport is Adiyaman (ADF) - 21.4 km / 13.3 mi</p>,"<p><b>Property Location</b> <br />With a stay at Unal Hotel in Adiyaman, you'll be within a 10-minute walk of Adiyaman Fortress and Adiyaman Museum.  This hotel is 3 mi (4.8 km) from Pirin Caves and 27.2 mi (43.8 km) from Severan Bridge.</p><p><b>Rooms</b> <br />Make yourself at home in one of the 30 air-conditioned rooms featuring refrigerators and LCD televisions. Complimentary wireless Internet access keeps you connected, and satellite programming is available for your entertainment. Private bathrooms with showers feature complimentary toiletries and hair dryers. Conveniences include safes and desks, and housekeeping is provided daily.</p><p><b>Dining</b> <br />Take advantage of the hotel's room service (during limited hours). A complimentary buffet breakfast is served on weekdays from 7 AM to 10 AM and on weekends from 7 AM to 10:30 AM.</p><p><b>Business, Other Amenities</b> <br />Featured amenities include a 24-hour front desk and a safe deposit box at the front desk. Free self parking is available onsite.</p>",,24-hour front desk Designated smoking areas Free WiFi Free breakfast Free self parking Number of buildings/towers - 1 One meeting room Safe-deposit box at front desk Total number of rooms - 30,37.76018|38.27855,,02100,
TR,Turkey,100034,Adiyaman,1435628,Arsames Hotel,ThreeStar,Mehmet Akif Mah. ATATÜRK BULV.NO.327 AdiyamanTurkey ,Distances are displayed to the nearest 0.1 mile and kilometer. <br /> <p>Adiyaman Museum - 1 km / 0.6 mi <br /> Adiyaman Fortress - 1.3 km / 0.8 mi <br /> Pirin Caves - 4.5 km / 2.8 mi <br /> </p><p>The nearest major airport is Adiyaman (ADF) - 20.9 km / 13 mi</p>,"<p>HeadLine : Near Adiyaman Museum</p><p>Location : Located in Adiyaman, Arsames Hotel is a 1-minute drive from Adiyaman Museum and 5 minutes from Adiyaman Fortress.  This hotel is 3.1 mi (4.9 km) from Pirin Caves.</p><p>Rooms : Make yourself at home in one of the 50 air-conditioned rooms featuring refrigerators and LCD televisions. Rooms have private balconies. Complimentary wired and wireless Internet access keeps you connected, and satellite programming provides entertainment. Private bathrooms with showers feature complimentary toiletries and hair dryers.</p><p>Dining : Satisfy your appetite for lunch or dinner at the hotel s restaurant, or stay in and take advantage of the 24-hour room service. Quench your thirst with your favorite drink at the poolside bar. A complimentary buffet breakfast is served daily from 7 AM to 10 AM.</p><p>CheckIn Instructions : Extra-person charges may apply and vary depending on property policy. <br />Government-issued photo identification and a credit card, debit card, or cash deposit may be required at check-in for incidental charges. <br />Special requests are subject to availability upon check-in and may incur additional charges. Special requests cannot be guaranteed. <ul> </ul></p><p>Special Instructions : Front desk staff will greet guests on arrival.</p>",90-416-2139597,24-hour front desk Poolside bar Free breakfast Restaurant Meeting rooms Tours/ticket assistance Free self parking Dry cleaning/laundry service Free WiFi Free valet parking Outdoor pool Free wired Internet Babysitting or childcare (surcharge) Safe-deposit box at front desk Luggage storage Concierge services Designated smoking areas Laundry facilities Wheelchair accessible path of travel Accessible bathroom Wheelchair accessible parking In-room accessibility Braille or raised signage Garden Free newspapers in lobby,37.76349|38.287832,+904162139596,02000,http://www.hotelarsames.com
TR,Turkey,100034,Adiyaman,1438976,Vadi i Leman Hotel,ThreeStar,Hoca Omer Mah Golbasi Cad 02100 Adiyaman ,Distances are displayed to the nearest 0.1 mile and kilometer. <br /> <p>Adiyaman Fortress - 0.3 km / 0.2 mi <br /> Adiyaman Museum - 0.5 km / 0.3 mi <br /> Pirin Caves - 4.7 km / 2.9 mi <br /> Severan Bridge - 43.7 km / 27.2 mi <br /> Sofraz Ruins - 51.8 km / 32.2 mi <br /> </p><p>The nearest major airport is Adiyaman (ADF) - 21.6 km / 13.4 mi</p>,"<p>HeadLine : Near Adiyaman Fortress</p><p>Location : With a stay at Vadi-i Leman Hotel, you ll be centrally located in Adiyaman, just a 4-minute walk from Adiyaman Fortress and 6 minutes by foot from Adiyaman Museum.  This hotel is 3 mi (4.8 km) from Pirin Caves and 27.2 mi (43.7 km) from Severan Bridge.</p><p>Rooms : Make yourself at home in one of the 36 air-conditioned rooms featuring refrigerators and LCD televisions. Complimentary wireless Internet access keeps you connected, and satellite programming is available for your entertainment. Private bathrooms with showers feature complimentary toiletries and hair dryers. Conveniences include safes and desks, and housekeeping is provided daily.</p><p>Dining : Enjoy a meal at the restaurant, or stay in and take advantage of the hotel s 24-hour room service. A complimentary buffet breakfast is served daily from 7 AM to 10:30 AM.</p><p>CheckIn Instructions : Extra-person charges may apply and vary depending on property policy. <br />Government-issued photo identification and a credit card, debit card, or cash deposit are required at check-in for incidental charges. <br />Special requests are subject to availability upon check-in and may incur additional charges. Special requests cannot be guaranteed. <ul>  </ul></p>",90-416-2168000,Free breakfast Laundry facilities Luggage storage Restaurant Coffee/tea in common areas Free WiFi Airport transportation (surcharge) Rooftop terrace Designated smoking areas 24-hour front desk,37.760395|38.276783,90-416-2168000,02100,http://vadiileman.com/tr/index.php
TR,Turkey,100037,Adrasan-Cavus,1012225,Buhana Hotel,ThreeStar,Adrasan Beldesi Deniz Mh. 130 Sk. No 25 130 Sokak 2507370 AdrasanAntalya ,Distances are displayed to the nearest 0.1 mile and kilometer. <br /> <p>Adrasan Beach - 0.4 km / 0.3 mi <br /> Sazak koyu - 8.7 km / 5.4 mi <br /> Olimpos Ruins - 16.4 km / 10.2 mi <br /> Olympos Beach - 16.6 km / 10.3 mi <br /> Korsan Beach - 17.2 km / 10.7 mi <br /> Papaz Iskelesi - 19.1 km / 11.9 mi <br /> Gelidonia Lighthouse - 24.3 km / 15.1 mi <br /> Ulupinar Park - 25.7 km / 16 mi <br /> Yanartas - 27.8 km / 17.3 mi <br /> Chimaera - 27.9 km / 17.3 mi <br /> Ancient Olympos - 31.4 km / 19.5 mi <br /> Çirali Beach - 31.8 km / 19.8 mi <br /> Rhodiapolis - 36.4 km / 22.6 mi <br /> Phaselis Museum - 41.2 km / 25.6 mi <br /> Kleopatra Beach - 41.3 km / 25.7 mi <br /> </p>,"<p>HeadLine : Near Adrasan Beach</p><p>Location : When you stay at Buhana Hotel in Kumluca, you ll be by the sea and 5 minutes by foot from Adrasan Beach.  This beach hotel is 10.3 mi (16.6 km) from Olympos Beach and 19.5 mi (31.4 km) from Ancient Olympos.</p><p>Rooms : Make yourself at home in one of the 39 air-conditioned rooms featuring refrigerators and LCD televisions. Complimentary wireless Internet access keeps you connected, and satellite programming is available for your entertainment. Bathrooms have showers and hair dryers. Conveniences include safes and desks, and housekeeping is provided daily.</p><p>Dining : At Buhana Hotel, enjoy a satisfying meal at the restaurant. Quench your thirst with your favorite drink at the bar/lounge. A complimentary full breakfast is served daily from 8 AM to 10 AM.</p><p>CheckIn Instructions : <ul>  <li>Extra-person charges may apply and vary depending on property policy</li><li>Government-issued photo identification and a credit card, debit card, or cash deposit may be required at check-in for incidental charges</li><li>Special requests are subject to availability upon check-in and may incur additional charges; special requests cannot be guaranteed</li><li>This property accepts credit cards</li>  </ul></p><p>Special Instructions : This property offers transfers from the airport (surcharges may apply). Guests must contact the property with arrival details before travel, using the contact information on the booking confirmation. The front desk is open daily from 7 AM - midnight. Front desk staff will greet guests on arrival.</p>",90-242-8831324,Airport transportation (surcharge) Free full breakfast Free breakfast Front desk (limited hours) Free WiFi Number of bars/lounges - 1 Designated smoking areas Daily Number of outdoor pools - 1 Garden Coffee/tea in common areas Free self parking,36.294515|30.467329,90-543-8836323,07370,http://www.buhanahotel.com
TR,Turkey,100351,Afyon,1015975,NG Afyon Wellness and Convention,FiveStar,Izmir Karayolu 7 Km 03000 Afyon ,Distances are displayed to the nearest 0.1 mile and kilometer. <br /> <p>Afium Outlet Shopping Center - 1.8 km / 1.1 mi <br /> Afyon Mansion - 3.9 km / 2.4 mi <br /> Ikbal Cami - 6.5 km / 4 mi <br /> Ottoman Houses - 6.9 km / 4.3 mi <br /> Ulu Cami - 6.9 km / 4.3 mi <br /> Archaeological Museum - 6.9 km / 4.3 mi <br /> Afyon Stadium - 7.6 km / 4.7 mi <br /> Anit Park - 10.4 km / 6.5 mi <br /> Castle of Afyon - 10.9 km / 6.7 mi <br /> Imaret Mosque - 10.9 km / 6.8 mi <br /> Zafer Museum - 11 km / 6.9 mi <br /> Mevlevi Mosque - 11.3 km / 7 mi <br /> Afyonkarahisar Archeological Museum - 12 km / 7.5 mi <br /> Ayazini Metropolis Caves - 39.2 km / 24.4 mi <br /> Mechul Asker Aniti - 48 km / 29.8 mi <br /> </p><p>The preferred airport for NG Afyon is Kutahya (KZR-Zafer) - 54 km / 33.6 mi </p>,"<p>HeadLine : Near Afium Outlet Shopping Center</p><p>Location : Located in Afyonkarahisar, NG Afyon is a 2-minute drive from Afium Outlet Shopping Center and 7 minutes from Ikbal Cami.  This 5-star hotel is 4.3 mi (6.9 km) from Ottoman Houses and 4.3 mi (6.9 km) from Ulu Cami.</p><p>Rooms : Make yourself at home in one of the 428 individually decorated guestrooms, featuring minibars and plasma televisions. Rooms have private balconies. Complimentary wireless Internet access keeps you connected, and satellite programming is available for your entertainment. Private bathrooms with showers feature complimentary toiletries and hair dryers.</p><p>Dining : Grab a bite to eat at one of the hotel s 2 restaurants, or stay in and take advantage of the 24-hour room service. Snacks are also available at the coffee shop/cafe. Need to unwind? Take a break with a tasty beverage at one of the 3 bars/lounges. A complimentary buffet breakfast is served daily from 7 AM to 10 AM.</p><p>CheckIn Instructions : <ul>  <li>Extra-person charges may apply and vary depending on property policy</li><li>Government-issued photo identification and a credit card, debit card, or cash deposit may be required at check-in for incidental charges</li><li>Special requests are subject to availability upon check-in and may incur additional charges; special requests cannot be guaranteed</li><li>This property accepts credit cards; cash is not accepted</li>  </ul></p><p>Special Instructions : Front desk staff will greet guests on arrival.</p>",90-272-2463399,Grocery/convenience store Porter/bellhop Billiards or pool table Business center 24-hour front desk Playground on site Spa services on site Safe-deposit box at front desk Snack bar/deli Children's pool Sauna Steam room Free self parking Conference space Waterslide Free valet parking Hair salon Tennis on site Computer station Terrace Wheelchair accessible path of travel Pool sun loungers Conference space size (feet) - 15371 Concierge services 24-hour business center Basketball on site Banquet hall Hot springs on site Reception hall Nightclub Meeting rooms Television in common areas Arcade/game room Spa treatment room(s) Garden Free newspapers in lobby Full-service spa Wedding services Volleyball on site Luggage storage Turkish bath/Hammam Coffee/tea in common areas Number of coffee shops/cafes - 1 Laundry facilities elevator Children's club (free) Fitness facilities Supervised childcare/activities (free) Pool umbrellas Conference space size (meters) - 1428 Free WiFi Number of bars/lounges - 3 Designated smoking areas Number of outdoor pools - 3 Number of indoor pools - 13 In-room accessibility (in select rooms) Wheelchair accessible parking Roll-in shower (in select rooms) Tours/ticket assistance Accessible bathroom (in select rooms) Shopping center shuttle (surcharge) Free Buffet Breakfast Airport transportation (surcharge) Free breakfast Outdoor tennis courts - 1 Multilingual staff Conference center Daily Barbecue grill(s) Gift shops or newsstand Dry cleaning/laundry service,38.78342|30.478068,90-272-2202222,03000,http://www.nghotels.com.tr
TR,Turkey,100351,Afyon,1093250,Cakmak Marble Hotel,FourStar,Suleyman Goncer Caddesi No:2 SÜLEYMAN GÖNÇER CADDESI NO 2 Süleyman Göncer Caddesi 23200 Afyonkarahisar ,Distances are displayed to the nearest 0.1 mile and kilometer. <br /> <p>Anit Park - 0.2 km / 0.1 mi <br /> Zafer Museum - 0.3 km / 0.2 mi <br /> Imaret Mosque - 0.5 km / 0.3 mi <br /> Mevlevi Mosque - 0.9 km / 0.5 mi <br /> Ottoman Houses - 1 km / 0.6 mi <br /> Ulu Cami - 1 km / 0.6 mi <br /> Archaeological Museum - 1 km / 0.6 mi <br /> Afyon Stadium - 1 km / 0.6 mi <br /> Castle of Afyon - 1.4 km / 0.9 mi <br /> Afyonkarahisar Archeological Museum - 1.7 km / 1.1 mi <br /> Ikbal Cami - 1.8 km / 1.1 mi <br /> Afyon Mansion - 4.3 km / 2.7 mi <br /> Afium Outlet Shopping Center - 9.2 km / 5.7 mi <br /> Ayazini Metropolis Caves - 32.8 km / 20.4 mi <br /> </p><p>The nearest major airport is Kutahya (KZR-Zafer) - 61.6 km / 38.3 mi</p>,"<p>HeadLine : Near Zafer Museum</p><p>Location : A stay at MCG Marble Hotel places you in the heart of Afyonkarahisar, steps from Anit Park and 3 minutes by foot from Zafer Museum.  This hotel is 0.4 mi (0.6 km) from Imaret Mosque and 0.6 mi (0.9 km) from Castle of Afyon.</p><p>Rooms : Make yourself at home in one of the 114 air-conditioned rooms featuring minibars. Complimentary wireless Internet access keeps you connected, and cable programming is available for your entertainment. Private bathrooms with showers feature complimentary toiletries and hair dryers. Conveniences include safes and complimentary newspapers, and housekeeping is provided daily.</p><p>Dining : Enjoy a meal at the restaurant, or stay in and take advantage of the hotel s room service (during limited hours). Quench your thirst with your favorite drink at the bar/lounge. A complimentary buffet breakfast is served daily from 7 AM to 10 AM.</p><p>CheckIn Instructions : <ul>  <li>Extra-person charges may apply and vary depending on property policy</li><li>Government-issued photo identification and a credit card, debit card, or cash deposit may be required at check-in for incidental charges</li><li>Special requests are subject to availability upon check-in and may incur additional charges; special requests cannot be guaranteed</li><li>This property accepts credit cards</li>  </ul></p><p>Special Instructions : Front desk staff will greet guests on arrival.</p>",90-272-2143309,Dry cleaning/laundry service Games Wheelchair accessible (may have limitations) Table tennis Number of meeting rooms - 1 Wheelchair-accessible path to elevator Free wired Internet Wheelchair-accessible registration desk Free WiFi Number of bars/lounges - 1 Number of indoor pools - 1 Garden In-room accessibility (in select rooms) Wheelchair accessible parking Free newspapers in lobby Roll-in shower (in select rooms) Accessible bathroom (in select rooms) Free Buffet Breakfast Rooftop terrace Luggage storage Wheelchair-accessible on-site restaurant Free breakfast Billiards or pool table 24-hour front desk Library Daily Safe-deposit box at front desk Laundry facilities Children's pool Sauna elevator Free self parking Fitness facilities Free valet parking Terrace Concierge services,38.75711|30.53992,90-272-2143300,03100,http://www.cakmakmarblehotel.com
TR,Turkey,100351,Afyon,1120288,Safran Thermal Resort,FiveStar,Kume Evleri No 265 Hudai Kaplicalari Girisi Cakir Mah. Küme Evleri 26503400 SandikliAfyonkarahisar ,Distances are displayed to the nearest 0.1 mile and kilometer. <br /> <p>Sandikli Devlet Hospital - 8.3 km / 5.2 mi <br /> Hidden Prayer Society Memorial Forest - 9.2 km / 5.7 mi <br /> </p><p>The nearest major airport is Kutahya (KZR-Zafer) - 111.3 km / 69.2 mi</p>,"<p>HeadLine : In Sandikli</p><p>Location : When you stay at Safran Thermal Resort in Sandikli, you ll be within a 10-minute drive of Sandikli Devlet Hospital and Hidden Prayer Society Memorial Forest.</p><p>Rooms : Make yourself at home in one of the 351 air-conditioned rooms featuring minibars and LCD televisions. Rooms have private balconies. Complimentary wireless Internet access is available to keep you connected. Private bathrooms have deep soaking bathtubs and complimentary toiletries.</p><p>Dining : Grab a bite at one of the resort s 2 restaurants, or stay in and take advantage of the 24-hour room service. Need to unwind? Take a break with a tasty beverage at one of the 2 bars/lounges. A complimentary buffet breakfast is served daily from 7 AM to 10 AM.</p><p>CheckIn Instructions : <ul>  <li>Extra-person charges may apply and vary depending on property policy</li><li>Government-issued photo identification and a credit card, debit card, or cash deposit may be required at check-in for incidental charges</li><li>Special requests are subject to availability upon check-in and may incur additional charges; special requests cannot be guaranteed</li><li>This property accepts credit cards; cash is not accepted</li><li>Please note that cultural norms and guest policies may differ by country and by property; the policies listed are provided by the property</li>  </ul> <ul>  <li>This property offers only separate men s and women s swimming pools and wet areas.</li>  </ul></p><p>Special Instructions : Front desk staff will greet guests on arrival. For more details, please contact the property using the information on the booking confirmation.</p>",90-272-5357575,Gift shops or newsstand Dry cleaning/laundry service Free water park access Pool umbrellas Meeting rooms Television in common areas Free WiFi Number of bars/lounges - 2 Arcade/game room Spa treatment room(s) Designated smoking areas Number of spa tubs - 1 Number of outdoor pools - 1 Number of indoor pools - 1 Garden In-room accessibility (in select rooms) Full-service spa Wedding services Accessible bathroom (in select rooms) Free Buffet Breakfast Luggage storage Free breakfast Grocery/convenience store Billiards or pool table Business center 24-hour front desk Playground on site Daily Turkish bath/Hammam Safe-deposit box at front desk Children's pool Sauna Free self parking Fitness facilities Waterslide Free valet parking Hair salon Terrace Wheelchair accessible path of travel Pool sun loungers Concierge services,38.433406|30.192491,90-272-5357575,03500,http://safrantermal.com/
TR,Turkey,100351,Afyon,1141433,Orucoglu Thermal Resort,FiveStar,Kütahya Karayolu 14 Km AfyonAfyonkarahisar ,Distances are displayed to the nearest 0.1 mile and kilometer. <br /> <p>Afium Outlet Shopping Center - 5.7 km / 3.6 mi <br /> Afyon Mansion - 11.5 km / 7.2 mi <br /> Ikbal Cami - 13.4 km / 8.4 mi <br /> Ottoman Houses - 13.9 km / 8.6 mi <br /> Ulu Cami - 13.9 km / 8.6 mi <br /> Archaeological Museum - 13.9 km / 8.6 mi <br /> Anit Park - 14 km / 8.7 mi <br /> Castle of Afyon - 14.4 km / 9 mi <br /> Imaret Mosque - 14.5 km / 9 mi <br /> Afyon Stadium - 14.6 km / 9.1 mi <br /> Zafer Museum - 14.6 km / 9.1 mi <br /> Mevlevi Mosque - 14.8 km / 9.2 mi <br /> Afyonkarahisar Archeological Museum - 15.6 km / 9.7 mi <br /> Ayazini Metropolis Caves - 31.8 km / 19.8 mi <br /> Seydisul Tomb - 40.5 km / 25.2 mi <br /> </p><p>The nearest airports are:<br />Antalya Intl. Airport (AYT) - 278 km / 172.7 mi<br /> Kutahya (KZR-Zafer) - 46.3 km / 28.8 mi<br /> </p><p>The preferred airport for Orucoglu Thermal Resort is Antalya Intl. Airport (AYT). </p>,"<p>HeadLine : In Afyonkarahisar</p><p>Location : Located in Afyonkarahisar, Orucoglu Thermal Resort is within a 15-minute drive of Afium Outlet Shopping Center and Afyon Mansion.  This 5-star hotel is 8.4 mi (13.4 km) from Ikbal Cami and 8.6 mi (13.9 km) from Ottoman Houses.</p><p>Rooms : Treat yourself to a stay in one of the 293 guestrooms, featuring heated floors and flat-screen televisions. Complimentary wireless Internet access keeps you connected, and satellite programming is available for your entertainment. Conveniences include phones, as well as safes and separate sitting areas.</p><p>Dining : Grab a bite at Amorium Bistro, one of the hotel s 2 restaurants, or stay in and take advantage of the 24-hour room service. Snacks are also available at the coffee shop/cafe. Wrap up your day with a drink at the bar/lounge. A complimentary buffet breakfast is served daily from 7 AM to 10 AM.</p><p>CheckIn Instructions : <ul>  <li>Extra-person charges may apply and vary depending on property policy</li><li>Government-issued photo identification and a credit card, debit card, or cash deposit may be required at check-in for incidental charges</li><li>Special requests are subject to availability upon check-in and may incur additional charges; special requests cannot be guaranteed</li><li>This property accepts credit cards; cash is not accepted</li>  </ul></p><p>Special Instructions : Front desk staff will greet guests on arrival.</p>",90-272-2515060,Gift shops or newsstand Dry cleaning/laundry service Newspapers in lobby (surcharge) Reception hall Number of meeting rooms - 5 Free WiFi Number of bars/lounges - 1 Arcade/game room Designated smoking areas Garden In-room accessibility (in select rooms) Roll-in shower (in select rooms) Tours/ticket assistance Accessible bathroom (in select rooms) Free Buffet Breakfast Free area shuttle Airport transportation (surcharge) Luggage storage Free breakfast Grocery/convenience store Porter/bellhop Billiards or pool table Multilingual staff 24-hour front desk Library Playground on site Daily Safe-deposit box at front desk Coffee/tea in common areas Snack bar/deli Number of coffee shops/cafes - 1 Laundry facilities Sauna Fitness facilities Hair salon Terrace Wheelchair accessible path of travel Concierge services Steam room elevator Free self parking,38.838327|30.431516,90 272 2515050,03000,https://orucoglu.com/de/
