countyCode,countyName,cityCode,cityName,HotelCode,HotelName,HotelRating,Address,Attractions,Description,FaxNumber,HotelFacilities,Map,PhoneNumber,PinCode,HotelWebsiteUrl
TR,Turkey,101328,Abant,1252699,Büyük Abant Hotel,FiveStar,Abant Gol Kenari 14030 BoluAbant ,Distances are displayed to the nearest 0.1 mile and kilometer. <br /> <p>Abant Nature Park - 0.2 km / 0.1 mi <br /> Tokad-i Hayreddin Mausoleum - 25.4 km / 15.8 mi <br /> Akkaya Travertine - 27.2 km / 16.9 mi <br /> Becikoglu Shopping Center - 33.8 km / 21 mi <br /> Bolu Belediyesi Ressam Mehmet Yuceturk Sanat Merkezi - 34.4 km / 21.3 mi <br /> Tabaklar Turkish Bath - 34.5 km / 21.4 mi <br /> Bolu Museum - 34.6 km / 21.5 mi <br /> Orta Turkish Bath - 34.7 km / 21.6 mi <br /> Bolu Yildirim Beyazit Mosque - 35 km / 21.8 mi <br /> Sarachane Museum - 35.1 km / 21.8 mi <br /> Imaret Mosque - 35.1 km / 21.8 mi <br /> Abant Izzet Baysal University - 35.6 km / 22.1 mi <br /> Ataturk Orman Park - 35.8 km / 22.3 mi <br /> Kadi Mosque - 36.2 km / 22.5 mi <br /> Gölcük Natural Park - 48.6 km / 30.2 mi <br /> </p><p>The preferred airport for Büyük Abant Oteli is Istanbul (IST) - 313.3 km / 194.7 mi </p>,"<p>HeadLine : Near Abant Nature Park</p><p>Location : With a stay at Büyük Abant Oteli in Mudurnu, you ll be on a lake and 3 minutes by foot from Abant Nature Park.  This 5-star hotel is 15.8 mi (25.4 km) from Tokad-i Hayreddin Mausoleum and 16.9 mi (27.2 km) from Akkaya Travertine.</p><p>Rooms : Make yourself at home in one of the 197 guestrooms featuring minibars and LCD televisions. Complimentary wireless Internet access keeps you connected, and satellite programming is available for your entertainment. Private bathrooms have complimentary toiletries and hair dryers. Conveniences include phones, as well as safes and complimentary bottled water.</p><p>Dining : Grab a bite at Geyikli Bar, one of the hotel s 3 restaurants, or stay in and take advantage of the 24-hour room service. Mingle with other guests at the complimentary reception, held daily. Quench your thirst with your favorite drink at the bar/lounge. A complimentary buffet breakfast is served daily from 7 AM to 10:30 AM.</p><p>CheckIn Instructions : Extra-person charges may apply and vary depending on property policy Government-issued photo identification and a credit card, debit card, or cash deposit may be required at check-in for incidental charges Special requests are subject to availability upon check-in and may incur additional charges; special requests cannot be guaranteed No onsite parking is available Safety features at this property include a fire extinguisher, a smoke detector, a security system, and a first aid kit</p><p>Special Instructions : Front desk staff will greet guests on arrival.</p>",90-0374-2245031,Barbecue grill(s) Picnic area Bar/lounge Coffee/tea in common areas Number of indoor pools - 2 elevator Fitness facilities 24-hour front desk Free breakfast Business center Billiards or pool table Porter/bellhop Meeting rooms - 5 Dry cleaning/laundry service Steam room Free WiFi Sauna Babysitting or childcare (surcharge) Bicycle rentals on site Nightclub Children's club (surcharge) Hiking/biking trails nearby Supervised childcare/activities (surcharge) Children's pool Conference space size (meters) - 700 Free reception Luggage storage Hair salon Mountain biking nearby Conference space size (feet) - 7532 Gift shops or newsstand Designated smoking areas Ballroom Wheelchair accessible (may have limitations) Outdoor tennis court Banquet hall Laundry facilities Television in common areas Accessible bathroom Arcade/game room In-room accessibility Garden Tennis on site Fireplace in lobby,40.612098|31.280425,90-0374-2245033,14030,http://www.buyukabantoteli.com
TR,Turkey,101331,Adalar,1352291,Büyükada Comfort Hotel,All,23 Nisan Cd No 28 Buyukada Buyukada34970 Adalar ,,"Located on the island of Buyukada, the Panorama Boutique Hotel is a small property featuring beautiful views of the Marmara Sea.

The hotel features just 15 guest rooms, all of which are neatly designed and offer clean and comfortable accommodation.  Guests can enjoy the pretty sea views from the majority of the rooms.

The hotels Cafe Panorama is the perfect place to relax and enjoy a drink and light snack.  The Panorama Lounge overlooks the Marmara Sea.

The Panorama Boutique Hotel is opposite the sea-bus landing site and just 100-metres from the ferry and motorboat port. Please inform Buyukada Comfort in advance of your expected arrival time. You can use the Special Requests box when booking, or contact the property directly with the contact details provided in your confirmation.
Guests are required to show a photo identification and credit card upon check-in. Please note that all Special Requests are subject to availability and additional charges may apply.
Payment before arrival via bank transfer is required. The property will contact you after you book to provide instructions.
In accordance with government guidelines to minimise transmission of the Coronavirus (COVID-19), this property currently isnt accepting guests from certain countries, during dates where such guidelines exist.
In response to Coronavirus (COVID-19), additional safety and sanitation measures are in effect at this property.
Food & beverage services at this property may be limited or unavailable due to Coronavirus (COVID-19).
As a result of Coronavirus (COVID-19), this property has temporarily suspended its shuttle services.
Due to Coronavirus (COVID-19), this property is taking steps to help protect the safety of guests and staff. Certain services and amenities may be reduced or unavailable as a result.
Due to Coronavirus (COVID-19), this property has reduced reception and service operating hours.
In accordance with government guidelines to minimise transmission of the Coronavirus (COVID-19), this property may request additional documentation from guests to validate identity, travel itinerary and other relevant information, during dates where such guidelines exist.
Spa and gym facilities at this property are unavailable due to Coronavirus (COVID-19).",+902163825050,Restaurant Cycling Heating Fax/photocopying Luggage storage Room service meeting/banquet facilities Bar 24-hour front desk Garden Terrace Non-smoking rooms internet services lift express check-in/check-out Safety Deposit Box Currency exchange Chapel/shrine Packed lunches Themed dinner nights Live music/performance 24-hour security Key card access Security alarm Smoke alarms CCTV in common areas CCTV outside property bicycle rental use of cleaning chemicals that are effective against coronavirus wifi Allergy-free room Free WiFi Non-smoking throughout Air conditioning designated smoking area Snack Bar Sun terrace concierge service Private check-in/check-out Trouser press shared lounge/TV area Evening entertainment Adult only Daily housekeeping grocery deliveries wifi available in all areas Indoor play area Kid meals Kid-friendly buffet Wine/champagne Fruits coffee house on site Outdoor furniture Bike tours guests have the option to cancel any cleaning services for their accommodation during their stay delivered food is securely covered thermometers for guests provided by property face masks for guests available linens  towels and laundry washed in accordance with local authority guidelines guest accommodation is disinfected between stays guest accommodation sealed after cleaning physical distancing in dining areas food can be delivered to guest accommodation staff follow all safety protocols as directed by local authorities shared stationery such as printed menus  magazines  pens  and paper removed hand sanitizer in guest accommodation and key areas process in place to check health of guests contactless check-in/check-out cashless payment available physical distancing rules followed mobile app for room service screens or physical barriers placed between staff and guests in appropriate areas property is cleaned by professional cleaning companies all plates  cutlery  glasses and other tableware have been sanitized,40.87329|29.12682,(90) (0)2163823030,34970,https://www.booking.com/hotel/tr/buyukada-panorama-butik.html
TR,Turkey,101331,Adalar,1471062,Buyukada Apart Hotel Yeni Apart,All,Yeni Sok. No:10 Buyukada Buyukada34970 AdalarIstanbul ,,"Situated in Buyukada, 600 metres from Blue Beach Buyukada and 1.3 km from Naki Bey Beach, Yeni Apart Hotel features accommodation with free WiFi, air conditioning, a shared lounge and a terrace.

Each unit comes with a fully equipped kitchen with a dining table, a flat-screen TV with satellite channels and a private bathroom with shower, free toiletries and a hairdryer. Some units have a balcony and/or a patio with city or sea views.

The aparthotel provides an ironing service, as well as business facilities like fax and photocopying.

A bicycle rental service is available at Yeni Apart Hotel.

Nizam Beach is 1.9 km from the accommodation, while St. George Monastery is 8.5 km from the property. This property will not accommodate hen, stag or similar parties.",+902163822184,Terrace Non-smoking rooms Family rooms Ironing service internet services express check-in/check-out Currency exchange Soundproof rooms Heating Fax/photocopying Luggage storage wifi Allergy-free room Free WiFi Air conditioning designated smoking area Private check-in/check-out Shared kitchen shared lounge/TV area Daily housekeeping wifi available in all areas 24-hour security Key access Security alarm Smoke alarms CCTV in common areas CCTV outside property Fire extinguishers bicycle rental use of cleaning chemicals that are effective against coronavirus linens  towels and laundry washed in accordance with local authority guidelines guest accommodation is disinfected between stays physical distancing in dining areas staff follow all safety protocols as directed by local authorities shared stationery such as printed menus  magazines  pens  and paper removed hand sanitizer in guest accommodation and key areas process in place to check health of guests first aid kit available cashless payment available physical distancing rules followed screens or physical barriers placed between staff and guests in appropriate areas invoice provided property is cleaned by professional cleaning companies all plates  cutlery  glasses and other tableware have been sanitized guests have the option to cancel any cleaning services for their accommodation during their stay face masks for guests available,40.87278|29.12793,+902163822029,34970,https://www.booking.com/hotel/tr/buyukada-apart-otel-yeni-apart.html
TR,Turkey,101331,Adalar,1553345,More Guesthouse,All,Malul Gazi Cd Büyükada-Maden MhAdalar ,Distances are calculated in a straight line from the property&apos;s location to the point of interest or attraction  and may not reflect actual travel distance. &lt;br /&gt;&lt;br /&gt; Distances are displayed to the nearest 0.1 mile and kilometer. &lt;p&gt;Dock Square - 0.4 km / 0.3 mi &lt;br /&gt;Adalar Museum - 0.4 km / 0.3 mi &lt;br /&gt;Prinkipo Greek Orphanage - 1.4 km / 0.9 mi &lt;br /&gt;Yorukali Plaji - 1.9 km / 1.2 mi &lt;br /&gt;Yorukali Beach - 2.2 km / 1.4 mi &lt;br /&gt;Ayia Yorgi Church and Monastery - 2.8 km / 1.8 mi &lt;br /&gt;St. George Monastery - 2.9 km / 1.8 mi &lt;br /&gt;Eskibag plaji - 4 km / 2.5 mi &lt;br /&gt;Kartal Art Playhouse - 5 km / 3.1 mi &lt;br /&gt;Pendik Marina - 5.1 km / 3.2 mi &lt;br /&gt;Sultans Trail - 5.3 km / 3.3 mi &lt;br /&gt;Aya Yorgi Church - 6.3 km / 3.9 mi &lt;br /&gt;Karma Karting - 6.4 km / 4 mi &lt;br /&gt;Cartland Carting - 7.2 km / 4.5 mi &lt;br /&gt;Yunus Emre Kultur Ve Sanat Merkezi - 7.6 km / 4.7 mi &lt;br /&gt;&lt;/p&gt;&lt;p&gt;The nearest airports are:&lt;br /&gt;Istanbul (SAW-Sabiha Gokcen Intl.) - 15.3 km / 9.5 mi&lt;br /&gt;Istanbul (IST-Ataturk Intl.) - 28.8 km / 17.9 mi&lt;br /&gt;&lt;/p&gt;&lt;p&gt;&lt;/p&gt;,"&lt;p&gt;&lt;b&gt;Property Location&lt;/b&gt; &lt;br /&gt;With a stay at More Guesthouse in Adalar (Buyukada), you&apos;ll be minutes from Dock Square and Adalar Museum.  This guesthouse is within close proximity of Prinkipo Greek Orphanage and Yorukali Plaji.&lt;/p&gt;&lt;p&gt;&lt;b&gt;Rooms&lt;/b&gt; &lt;br /&gt;Make yourself at home in one of the 6 air-conditioned rooms featuring flat-screen televisions. Rooms have private balconies or patios. Complimentary wireless Internet access keeps you connected, and satellite programming is available for your entertainment. Partially open bathrooms with showers feature complimentary toiletries and hair dryers.&lt;/p&gt;&lt;p&gt;&lt;b&gt;Amenities&lt;/b&gt; &lt;br /&gt;Enjoy recreation amenities such as bicycles to rent or take in the view from a garden. This guesthouse also features complimentary wireless Internet access and concierge services.&lt;/p&gt;&lt;p&gt;&lt;b&gt;Dining&lt;/b&gt; &lt;br /&gt;Grab a bite to eat at the guesthouse&apos;s restaurant, which features a bar, or stay in and take advantage of room service (during limited hours). A complimentary buffet breakfast is served daily.&lt;/p&gt;&lt;p&gt;&lt;b&gt;Business, Other Amenities&lt;/b&gt; &lt;br /&gt;Featured amenities include complimentary newspapers in the lobby, dry cleaning/laundry services, and a 24-hour front desk.&lt;/p&gt;",,24-hour front desk Coffee shop or café Coffee/tea in common areas Concierge services Designated smoking areas Dry cleaning/laundry service Free WiFi Free breakfast Free newspapers in lobby Garden Laundry facilities Library Luggage storage Pets allowed Restaurant Total number of rooms - 6,40.870587948475|29.133887761902,,,
TR,Turkey,101331,Adalar,1554028,Cicekli Yali Pansiyon,All,Cicekli Yali Sok 5 Buyukada Maden Mahallesi34970 Adalar ,Distances are calculated in a straight line from the property&apos;s location to the point of interest or attraction  and may not reflect actual travel distance. &lt;br /&gt;&lt;br /&gt; Distances are displayed to the nearest 0.1 mile and kilometer. &lt;p&gt;Dock Square - 0.1 km / 0.1 mi &lt;br /&gt;Adalar Museum - 0.2 km / 0.1 mi &lt;br /&gt;Prinkipo Greek Orphanage - 1.5 km / 0.9 mi &lt;br /&gt;Yorukali Plaji - 2 km / 1.2 mi &lt;br /&gt;Yorukali Beach - 2.2 km / 1.4 mi &lt;br /&gt;Ayia Yorgi Church and Monastery - 3 km / 1.8 mi &lt;br /&gt;St. George Monastery - 3 km / 1.9 mi &lt;br /&gt;Eskibag plaji - 4.1 km / 2.6 mi &lt;br /&gt;Kartal Art Playhouse - 5.2 km / 3.2 mi &lt;br /&gt;Pendik Marina - 5.3 km / 3.3 mi &lt;br /&gt;Sultans Trail - 5.3 km / 3.3 mi &lt;br /&gt;Aya Yorgi Church - 6 km / 3.7 mi &lt;br /&gt;Karma Karting - 6.6 km / 4.1 mi &lt;br /&gt;Cartland Carting - 7 km / 4.3 mi &lt;br /&gt;Zihni Pasa Cami - 7.3 km / 4.6 mi &lt;br /&gt;&lt;/p&gt;&lt;p&gt;The nearest airports are:&lt;br /&gt;Istanbul (SAW-Sabiha Gokcen Intl.) - 15.5 km / 9.6 mi&lt;br /&gt;Istanbul (IST-Ataturk Intl.) - 28.5 km / 17.7 mi&lt;br /&gt;&lt;/p&gt;&lt;p&gt;&lt;/p&gt;,"&lt;p&gt;&lt;b&gt;Property Location&lt;/b&gt; &lt;br /&gt;With a stay at Cicekli Yali Pansiyon in Adalar (Buyukada), you&apos;ll be minutes from Dock Square and Adalar Museum.  This pension is within close proximity of Prinkipo Greek Orphanage and Yorukali Plaji.&lt;/p&gt;&lt;p&gt;&lt;b&gt;Rooms&lt;/b&gt; &lt;br /&gt;Make yourself at home in one of the 4 air-conditioned rooms featuring LCD televisions. Complimentary wireless Internet access keeps you connected, and satellite programming is available for your entertainment. Bathrooms feature showers, complimentary toiletries, and hair dryers. Conveniences include desks and complimentary bottled water, and housekeeping is provided on a limited basis.&lt;/p&gt;&lt;p&gt;&lt;b&gt;Business, Other Amenities&lt;/b&gt; &lt;br /&gt;Featured amenities include a 24-hour front desk and luggage storage.&lt;/p&gt;",,24-hour front desk Designated smoking areas Free WiFi Luggage storage Total number of rooms - 4,40.8716|29.1293,+905370177060,34970,http://www.cicekliyalipansiyon.com
TR,Turkey,101331,Adalar,1557054,Tiara Buyukada,All,23 Nisan Caddesi 22 BuyukadaAdalar 34970 ,,"Boasting a shared lounge, terrace, bar and free WiFi, Tiara Buyukada is situated in Buyukada, 400 metres from Blue Beach Buyukada and 1.4 km from Naki Bey Beach. The accommodation features room service, a 24-hour front desk and currency exchange for guests.

The rooms are fitted with air conditioning, a flat-screen TV with satellite channels, a minibar, a coffee machine, a shower, free toiletries and a desk. Rooms have a private bathroom with a hairdryer, while certain rooms are fitted with a balcony and others also boast city views. At the hotel every room is equipped with bed linen and towels.

Nizam Beach is 1.9 km from Tiara Buyukada, while St. George Monastery is 8.5 km from the property. Guests are required to show a photo identification and credit card upon check-in. Please note that all Special Requests are subject to availability and additional charges may apply.
Please inform Tiara Buyukada in advance of your expected arrival time. You can use the Special Requests box when booking, or contact the property directly with the contact details provided in your confirmation.",,Room service meeting/banquet facilities Bar 24-hour front desk Terrace Non-smoking rooms Laundry dry cleaning Family rooms Ironing service internet services lift express check-in/check-out Currency exchange Soundproof rooms Chapel/shrine Packed lunches Tour desk Heating Fax/photocopying Luggage storage wifi Allergy-free room Free WiFi Non-smoking throughout Air conditioning designated smoking area Snack Bar Private check-in/check-out shuttle service (additional charge) Trouser press shared lounge/TV area Daily housekeeping grocery deliveries Wine/champagne Fruits coffee house on site Outdoor furniture Shuttle service,40.87345|29.12709,+902163825555,34970,https://www.booking.com/hotel/tr/tiara-buyukada.html
TR,Turkey,101331,Adalar,1583245,Nizam Butik Otel Buyukada,OneStar,Nizam Cd Büyükada Nizam Mahallesi Büyükada-Nizam Mahallesi34970 Adalar ,Distances are displayed to the nearest 0.1 mile and kilometer. <br /> <p>Sea of Marmara - 0.1 km / 0.1 mi <br /> Dilburnu Recreation Area - 0.2 km / 0.2 mi <br /> Troçki Evi Büyükada - 0.9 km / 0.5 mi <br /> Buyukada National Park - 1 km / 0.6 mi <br /> Yorukali Beach - 1.1 km / 0.7 mi <br /> Mizzi Mansion - 1.2 km / 0.7 mi <br /> Prinkipo Greek Orphanage - 1.5 km / 0.9 mi <br /> St. Nikola Monastery - 1.7 km / 1 mi <br /> Aya Nikola Halk Plaji - 1.7 km / 1 mi <br /> Yorukali Plaji - 1.7 km / 1.1 mi <br /> Ayia Yorgi Church and Monastery - 1.8 km / 1.1 mi <br /> Museum of the Princes  Islands - 1.8 km / 1.1 mi <br /> Adalar Museum - 1.9 km / 1.2 mi <br /> Dock Square - 1.9 km / 1.2 mi <br /> Eskibag plaji - 3.3 km / 2 mi <br /> </p><p>The nearest major airport is Istanbul Sabiha Gokcen Intl. Airport (SAW) - 24.3 km / 15.1 mi</p>,"<p>HeadLine : Near Yorukali Beach</p><p>Location : Located in Adalar, Nizam Butik Otel Buyukada is near the beach, a 3-minute walk from Dilburnu Recreation Area and 10 minutes by foot from Troçki Evi Büyükada.  This hotel is 0.7 mi (1.2 km) from Mizzi Mansion and 0.9 mi (1.5 km) from Prinkipo Greek Orphanage.</p><p>Rooms : Make yourself at home in one of the 9 air-conditioned rooms featuring LCD televisions. Complimentary wireless Internet access keeps you connected, and satellite programming is available for your entertainment. Private bathrooms with showers feature complimentary toiletries and hair dryers. Conveniences include phones, as well as complimentary bottled water and blackout drapes/curtains.</p><p>Dining : Enjoy a meal at the restaurant or snacks in the coffee shop/cafe. The hotel also offers 24-hour room service. Quench your thirst with your favorite drink at the bar/lounge. A complimentary continental breakfast is served daily from 8 AM to 11 AM.</p><p>CheckIn Instructions : <ul>  <li>Extra-person charges may apply and vary depending on property policy</li><li>Government-issued photo identification and a credit card, debit card, or cash deposit may be required at check-in for incidental charges</li><li>Special requests are subject to availability upon check-in and may incur additional charges; special requests cannot be guaranteed</li><li>Guests must contact this property in advance to reserve cribs/infant beds, rollaway/extra beds, and high chair</li><li>This property accepts credit cards; cash is not accepted</li>  </ul></p><p>Special Instructions : Front desk staff will greet guests on arrival.</p>",90-216-3821012,Number of coffee shops/cafes - 1 Laundry facilities Terrace Bicycle rentals on site Concierge services Barbecue grill(s) Safe-deposit box at front desk Snack bar/deli Dry cleaning/laundry service Distance from property (meters) - 5 Free parking nearby Street parking Change of bed sheets (on request) Free WiFi Number of bars/lounges - 1 Designated smoking areas Change of towels (on request) Garden Picnic area Free newspapers in lobby Tours/ticket assistance Free continental breakfast Airport transportation (surcharge) Wheelchair accessible  no Luggage storage Distance from property (ft) - 16 Free breakfast Express check-out 24-hour front desk Daily,40.863444|29.116406,+90 216 3821012,34970,http://nizambutikotel.com/
TR,Turkey,100237,Adana,1022980,Sheraton Grand Adana,FiveStar,Haci Sabanci Boulevard No. 7 01220 Adana ,Distances are displayed to the nearest 0.1 mile and kilometer. <br /> <p>Merkez Park - 1 km / 0.6 mi <br /> Adana Merkez Camii - 1 km / 0.6 mi <br /> Mavi Su Aqualand - 1.2 km / 0.7 mi <br /> Stone Bridge - 1.3 km / 0.8 mi <br /> Adana State Theatre - 1.3 km / 0.8 mi <br /> Sabanci Central Mosque - 1.4 km / 0.9 mi <br /> Ataturk Scientific & Cultural Museum - 1.5 km / 0.9 mi <br /> Saint Paul Church - 2.1 km / 1.3 mi <br /> Adana Ethnography Museum - 2.1 km / 1.3 mi <br /> Grand Mosque - 2.2 km / 1.4 mi <br /> Great Clock Tower - 2.3 km / 1.4 mi <br /> Yeni Camii - 2.3 km / 1.4 mi <br /> Yag Camii - 2.4 km / 1.5 mi <br /> Oil Mosque - 2.5 km / 1.5 mi <br /> Sokun Karting - 2.6 km / 1.6 mi <br /> </p><p>The preferred airport for Sheraton Grand Adana is Adana (ADA-Sakirpasa) - 5.5 km / 3.4 mi </p>,"<p>HeadLine : In Adana (Yüregir)</p><p>Location : You ll be centrally located in Adana with a stay at Sheraton Grand Adana, within a 15-minute walk of Merkez Park and Adana Merkez Camii.  This 5-star hotel is 0.9 mi (1.4 km) from Sabanci Central Mosque and 1 mi (1.6 km) from Ataturk Scientific & Cultural Museum.</p><p>Rooms : Make yourself at home in one of the 240 guestrooms featuring minibars and LED televisions. Your bed comes with down comforters and Egyptian cotton sheets. Complimentary wireless Internet access keeps you connected, and satellite programming is available for your entertainment. Private bathrooms have complimentary toiletries and bidets.</p><p>Dining : Grab a bite at Brooks Pool Bar & Cafe, one of the hotel s 2 restaurants, or stay in and take advantage of the 24-hour room service. Snacks are also available at the coffee shop/cafe. Relax with a refreshing drink from the poolside bar or one of the 2 bars/lounges. Buffet breakfasts are available daily from 6:00 AM to 10:30 AM for a fee.</p><p>CheckIn Instructions : <ul>  <li>Extra-person charges may apply and vary depending on property policy</li><li>Government-issued photo identification and a credit card, debit card, or cash deposit may be required at check-in for incidental charges</li><li>Special requests are subject to availability upon check-in and may incur additional charges; special requests cannot be guaranteed</li><li>This property accepts credit cards, debit cards, and cash</li><li>Safety features at this property include a carbon monoxide detector, a fire extinguisher, a smoke detector, a security system, a first aid kit, and window guards</li>  </ul></p><p>Special Instructions : Front desk staff will greet guests on arrival.</p>",90-322-2371818,Spa treatment room(s) Garden Internet access in public areas - high speed Full-service spa Wedding services Shopping mall on site Luggage storage Grocery/convenience store Porter/bellhop Business center 24-hour front desk Spa services on site Outdoor seasonal pool Safe-deposit box at front desk Snack bar/deli Children's pool Sauna Steam room Free self parking Conference space Valet parking (surcharge) Hair salon Tennis on site Computer station Terrace ATM/banking Wheelchair accessible path of travel Pool sun loungers Conference space size (feet) - 21703 Concierge services 24-hour business center Gift shops or newsstand Dry cleaning/laundry service Shopping on site Proposal/romance packages available Outdoor furniture Number of meeting rooms - 13 Conference space size (meters) - 2016 Swimming pool Limo or Town Car service available Number of bars/lounges - 2 Designated smoking areas Number of poolside bars - 1 Number of indoor pools - 1 In-room accessibility (in select rooms) Wheelchair accessible parking Roll-in shower (in select rooms) Accessible bathroom (in select rooms) Wheelchair-accessible on-site restaurant Outdoor tennis courts - 1 Visual alarms in hallways Multilingual staff Conference center Electric car charging station Breakfast available (surcharge) Wheelchair-accessible meeting spaces/business center Turkish bath/Hammam Coffee/tea in common areas Number of coffee shops/cafes - 1 Laundry facilities elevator Fitness facilities Basketball on site Bicycle rentals on site Wheelchair accessible (may have limitations) Ballroom Wheelchair-accessible concierge desk Food and water bowls Wheelchair-accessible van parking Wheelchair-accessible spa Wheelchair-accessible registration desk Television in common areas Wheelchair-accessible fitness center Wheelchair-accessible pool Arcade/game room Health club,36.995144|35.341053,+903222371717,01220,http://www.sheratonadanahotel.com/
