countyCode,countyName,cityCode,cityName,HotelCode,HotelName,HotelRating,Address,Attractions,Description,FaxNumber,HotelFacilities,Map,PhoneNumber,PinCode,HotelWebsiteUrl
VU,Vanuatu,132315,Port Vila,1182166,Eratap Beach Resort,FourStar,Po Box 3037 PO Box 3037Port Vila ,Distances are displayed to the nearest 0.1 mile and kilometer. <br /> <p>University of the South Pacific - 12.8 km / 8 mi <br /> Supreme Court - 14.2 km / 8.8 mi <br /> Independence Park - 14.2 km / 8.8 mi <br /> Michoutouchkine & Pilioko Foundation Art Gallery - 14.2 km / 8.8 mi <br /> British Residency - 14.2 km / 8.8 mi <br /> French Residency - 14.2 km / 8.8 mi <br /> Georges Pompidou Building - 14.5 km / 9 mi <br /> Sacré Coeur Cathedral - 14.5 km / 9 mi <br /> Porte du Ciel - 14.6 km / 9.1 mi <br /> Parliament House - 14.7 km / 9.1 mi <br /> National Museum - 14.7 km / 9.2 mi <br /> Tana Russet Plaza - 14.8 km / 9.2 mi <br /> WWI memorial - 14.8 km / 9.2 mi <br /> Chinatown - 14.9 km / 9.2 mi <br /> Lookout Point - 14.9 km / 9.3 mi <br /> </p><p>The preferred airport for Eratap Beach Resort is Port Vila (VLI-Bauerfield) - 18.9 km / 11.7 mi </p>,"<p>HeadLine : On the beach</p><p>Location : With a stay at Eratap Beach Resort in Eratap, you ll be on the beach, and 8 mi (12.8 km) from University of the South Pacific and 8.8 mi (14.2 km) from Supreme Court.  This 4.5-star resort is 8.8 mi (14.2 km) from Independence Park and 8.8 mi (14.2 km) from Michoutouchkine & Pilioko Foundation Art Gallery.</p><p>Rooms : Make yourself at home in one of the 12 air-conditioned rooms featuring flat-screen televisions. Rooms have private balconies. Complimentary wireless Internet access keeps you connected, and cable programming is available for your entertainment. Bathrooms have separate bathtubs and showers and complimentary toiletries.</p><p>Dining : Enjoy a meal at the restaurant, or stay in and take advantage of the resort s room service (during limited hours). Relax with your favorite drink at the bar/lounge or the poolside bar.</p><p>CheckIn Instructions : <ul>  <li>Extra-person charges may apply and vary depending on property policy</li><li>Government-issued photo identification and a credit card, debit card, or cash deposit may be required at check-in for incidental charges</li><li>Special requests are subject to availability upon check-in and may incur additional charges; special requests cannot be guaranteed</li><li>Be prepared: check the latest COVID-19 travel requirements and measures in place for this destination before you travel.</li><li>Please note that cultural norms and guest policies may differ by country and by property; the policies listed are provided by the property</li>  </ul></p><p>Special Instructions : This property offers transfers from the airport. Guests must contact the property with arrival details before travel, using the contact information on the booking confirmation. Front desk staff will greet guests on arrival. For more details, please contact the property using the information on the booking confirmation.  This property offers airport shuttle pickup service (on request) from Port Vila international airport only.</p>",61-2-80791154,Wheelchair accessible  no Kayaking on site Laundry facilities Garden Snorkeling on site Number of outdoor pools - 1 Surfing/bodyboarding on site Fitness facilities Number of bars/lounges - 1 Free airport transportation Number of poolside bars - 1 Full-service spa Front desk (limited hours) Tours/ticket assistance Free self parking Dry cleaning/laundry service Free WiFi Boat tours on site Safe-deposit box at front desk Free area shuttle Spa services on site Terrace Luggage storage,-17.798683|168.349623,61-433235982,3037,http://www.eratap.com/
VU,Vanuatu,132315,Port Vila,1182168,The Havannah,FourStar,The Havannah Port Vila Efale IslandVanuatu ,Distances are displayed to the nearest 0.1 mile and kilometer. <br /> <p>Chief Roi Matas Domain - 12.1 km / 7.5 mi <br /> Mele Cascades - 17.4 km / 10.8 mi <br /> Mele Bay - 20.3 km / 12.6 mi <br /> Port Vila Golf Country Club - 20.5 km / 12.7 mi <br /> Wet N Wild Zorbing - 20.6 km / 12.8 mi <br /> The Summit Gardens - 22.9 km / 14.2 mi <br /> Tana Russet Plaza - 27 km / 16.8 mi <br /> Georges Pompidou Building - 27.7 km / 17.2 mi <br /> Sacré Coeur Cathedral - 27.9 km / 17.3 mi <br /> Porte du Ciel - 27.9 km / 17.4 mi <br /> Nambawan Market & Café - 28 km / 17.4 mi <br /> Iririki Island - 28 km / 17.4 mi <br /> Lookout Point - 28.2 km / 17.5 mi <br /> WWI memorial - 28.2 km / 17.5 mi <br /> Feiawa Park - 28.2 km / 17.5 mi <br /> </p><p>The preferred airport for The Havannah Vanuatu - Exclusively for adults is Port Vila (VLI-Bauerfield) - 25.9 km / 16.1 mi </p>,"<p>HeadLine : By the ocean</p><p>Location : When you stay at The Havannah Vanuatu - Exclusively for adults in Samoa Point, you ll be on the waterfront and 15 minutes by car from Chief Roi Matas Domain.  This 4.5-star hotel is 17.4 mi (28 km) from Iririki Island and 17.7 mi (28.5 km) from Port Vila Market.</p><p>Rooms : Make yourself at home in one of the 17 guestrooms featuring refrigerators and LCD televisions. Rooms have private furnished balconies or patios. Complimentary wireless Internet access keeps you connected, and satellite programming is available for your entertainment. Bathrooms have rainfall showerheads and designer toiletries.</p><p>Dining : Grab a bite to eat at The Point, a beachfront restaurant where you can enjoy drinks at the bar/lounge, take in the ocean view, and even dine alfresco. You can also stay in and take advantage of the room service (during limited hours). A complimentary cooked-to-order breakfast is served daily from 7 AM to 11 AM.</p><p>Renovations : The property is closed between January 29 and February 11.</p><p>CheckIn Instructions : <ul>  <li>Extra-person charges may apply and vary depending on property policy</li><li>Government-issued photo identification and a credit card, debit card, or cash deposit may be required at check-in for incidental charges</li><li>Special requests are subject to availability upon check-in and may incur additional charges; special requests cannot be guaranteed</li><li>This property accepts credit cards; cash is not accepted</li><li>This property uses eco-friendly cleaning products</li><li>Safety features at this property include a fire extinguisher, a smoke detector, and a first aid kit</li>  </ul></p><p>Special Instructions : Guests must transfer via required shuttle to the property. Guests must contact the property at least 72 hours before travel, using the contact information on the confirmation received after booking. This property offers transfers from the airport. To arrange pick-up, guests must contact the property 72 hours prior to arrival, using the contact information on the booking confirmation. The front desk is open daily from 7:00 AM - 10:00 PM. Front desk staff will greet guests on arrival.</p>",6785518062,Gift shops or newsstand Beach volleyball on site Comprehensive recycling policy Proposal/romance packages available Bulk dispenser for toiletries Vegetarian breakfast available Ziplining nearby Eco-friendly cleaning products used Pool umbrellas No single-use plastic straws Number of meeting rooms - 1 Water sports equipment No single-use plastic soda bottles No single-use plastic stirrers Reusable cups only Biodegradable/compostable straws Scuba diving nearby Free WiFi No single-use plastic water bottles Number of bars/lounges - 1 Designated smoking areas Pedal boat on site Number of outdoor pools - 1 Tours/ticket assistance Sailing on site Free shopping center shuttle Free Cooked-to-Order Breakfast Free airport transportation On private beach Comprehensive food waste policy Eco-friendly toiletries Vegan menu options available Vegetarian menu options available Free breakfast Outdoor tennis courts - 1 Multilingual staff Mountain climbing nearby Daily Ecotours nearby Coffee/tea in common areas Laundry facilities Snorkeling on site Locally-sourced food on site (80% or more) Sustainability/community reinvestment (10% revenue or more) Guest education on local ecosystems and culture Showcase for local artists Beach umbrellas Locally-owned & organized tours & activities Spa treatment room(s) Garden Picnic area Full-service spa Wedding services Beach towels Boat tours nearby Fishing on site Free bicycles on site Free area shuttle Boat and paddles on site Boat on site Private picnics Couples/private dining Wheelchair accessible  no Luggage storage Front desk (limited hours) Golfing nearby Spa services on site Rowing or canoeing on site Hiking/biking trails nearby Free self parking Kayaking on site Free pool cabanas Tennis on site Beach sun loungers Terrace Pool sun loungers Concierge services,-17.572702|168.249036,678-35600,0000,http://www.thehavannah.com
VU,Vanuatu,132315,Port Vila,1248703,Moorings Hotel,TwoStar,Lini Highway PO Box 1404Port VillaEfate ,Distances are displayed to the nearest 0.1 mile and kilometer. <br /> <p>Tana Russet Plaza - 0.1 km / 0.1 mi <br /> Georges Pompidou Building - 0.6 km / 0.4 mi <br /> Sacré Coeur Cathedral - 0.7 km / 0.4 mi <br /> Chinatown - 0.7 km / 0.5 mi <br /> Porte du Ciel - 0.8 km / 0.5 mi <br /> Nambawan Market & Café - 0.9 km / 0.5 mi <br /> Feiawa Park - 0.9 km / 0.6 mi <br /> WWI memorial - 1 km / 0.6 mi <br /> Lookout Point - 1 km / 0.6 mi <br /> Iririki Island - 1.2 km / 0.7 mi <br /> Port Vila Market - 1.3 km / 0.8 mi <br /> Independence Park - 1.3 km / 0.8 mi <br /> University of the South Pacific - 1.4 km / 0.9 mi <br /> Supreme Court - 1.5 km / 0.9 mi <br /> Michoutouchkine & Pilioko Foundation Art Gallery - 1.6 km / 1 mi <br /> </p><p>The preferred airport for Moorings Hotel is Port Vila (VLI-Bauerfield) - 4.2 km / 2.6 mi </p>,"<p>HeadLine : Near Tana Russet Plaza</p><p>Location : A stay at Moorings Hotel places you in the heart of Port Vila, steps from Tana Russet Plaza and a 1-minute drive from Port Vila Market.  This beach hotel is 1.3 mi (2.2 km) from Parliament House and 1.4 mi (2.2 km) from National Museum.</p><p>Rooms : Make yourself at home in one of the 30 air-conditioned rooms featuring minibars and LCD televisions. Rooms have private furnished balconies or patios. Wireless Internet access (surcharge) keeps you connected, and satellite programming is available for your entertainment. Private bathrooms with showers feature rainfall showerheads and complimentary toiletries.</p><p>Dining : Enjoy Fusion cuisine at Moorings Restaurant, a beachfront restaurant where you can take in the garden view and dine alfresco. You can also stay in and take advantage of the room service. Unwind at the end of the day with a drink at the bar/lounge or the poolside bar. A complimentary continental breakfast is included.</p><p>CheckIn Instructions : <ul>  <li>Extra-person charges may apply and vary depending on property policy</li><li>Government-issued photo identification and a credit card may be required at check-in for incidental charges</li><li>Special requests are subject to availability upon check-in and may incur additional charges; special requests cannot be guaranteed</li><li>The name on the credit card used at check-in to pay for incidentals must be the primary name on the guestroom reservation</li><li>This property accepts credit cards; cash is not accepted</li><li>Noise-free guestrooms cannot be guaranteed</li><li>Safety features at this property include a fire extinguisher, a smoke detector, a security system, a first aid kit, and window guards</li>  </ul></p><p>Special Instructions : This property offers transfers from the airport (surcharges may apply). To arrange pick-up, guests must contact the property 72 hours prior to arrival, using the contact information on the booking confirmation. If you are planning to arrive after 5:00 PM please contact the property in advance using the information on the booking confirmation. Front desk staff will greet guests on arrival.</p>",678-2-2172,Dry cleaning/laundry service Mountain biking nearby Game viewing nearby Direct access to private beach Ziplining nearby Number of meeting rooms - 1 Wheelchair accessible parking Wedding services Tours/ticket assistance Beach towels Boat tours nearby Free continental breakfast Airport transportation (surcharge) Wheelchair accessible  no Luggage storage Free breakfast Multilingual staff Front desk (limited hours) Library Barbecue grill(s) Golfing nearby Snorkeling nearby Safe-deposit box at front desk Ecotours nearby Snack bar/deli Number of coffee shops/cafes - 1 Hiking/biking trails nearby Sailing nearby Television in common areas Scuba diving nearby Free WiFi Number of bars/lounges - 1 Designated smoking areas Number of poolside bars - 1 Number of outdoor pools - 1 Internet access in public areas - surcharge Garden Internet access in public areas - high speed Concierge services Pool sun loungers Terrace Beach sun loungers Kayaking on site Free self parking Surfing/bodyboarding nearby Laundry facilities,-17.730706|168.311526,678-2-6800,Port Vila,http://www.mooringsvanuatu.com
VU,Vanuatu,132315,Port Vila,1250571,Hideaway Island Resort,ThreeStar,Hideaway Island Port Vila ,Distances are displayed to the nearest 0.1 mile and kilometer. <br /> <p>Mele Bay - 0.5 km / 0.3 mi <br /> Port Vila Golf Country Club - 1.6 km / 1 mi <br /> Mele Cascades - 3.3 km / 2 mi <br /> Wet N Wild Zorbing - 3.8 km / 2.3 mi <br /> The Summit Gardens - 5.4 km / 3.4 mi <br /> Tana Russet Plaza - 7.5 km / 4.6 mi <br /> Georges Pompidou Building - 8.3 km / 5.2 mi <br /> Sacré Coeur Cathedral - 8.4 km / 5.2 mi <br /> Porte du Ciel - 8.5 km / 5.3 mi <br /> Chinatown - 8.5 km / 5.3 mi <br /> Nambawan Market & Café - 8.5 km / 5.3 mi <br /> Iririki Island - 8.5 km / 5.3 mi <br /> Feiawa Park - 8.6 km / 5.4 mi <br /> Lookout Point - 8.9 km / 5.6 mi <br /> Port Vila Market - 8.9 km / 5.6 mi <br /> </p><p>The preferred airport for Hideaway Island Resort is Port Vila (VLI-Bauerfield) - 6.5 km / 4 mi </p>,"<p>HeadLine : Near Port Vila Golf Country Club</p><p>Location : When you stay at Hideaway Island Resort in Hideaway Island, you ll be on the waterfront, within a 5-minute drive of Mele Bay and Port Vila Golf Country Club.  This beach resort is 5.3 mi (8.5 km) from Iririki Island and 5.6 mi (8.9 km) from Port Vila Market.</p><p>Rooms : Make yourself at home in one of the 27 individually decorated guestrooms. Conveniences include safes and ceiling fans, and housekeeping is provided once per stay.</p><p>Dining : You can enjoy a meal at the restaurant serving the guests of Hideaway Island Resort, or stop in at the snack bar/deli. Unwind at the end of the day with a drink at the bar/lounge or the beach bar.</p><p>CheckIn Instructions : <ul>  <li>Extra-person charges may apply and vary depending on property policy</li><li>Government-issued photo identification and a credit card, debit card, or cash deposit may be required at check-in for incidental charges</li><li>Special requests are subject to availability upon check-in and may incur additional charges; special requests cannot be guaranteed</li><li>This property accepts credit cards; cash is not accepted</li>  </ul></p><p>Special Instructions : Guests must transfer via boat and shuttle to the property. Guests must contact the property at least 72 hours before travel, using the contact information on the confirmation received after booking. The front desk is open daily from 8 AM - 8 PM. Front desk staff will greet guests on arrival.</p>",67823867,Gift shops or newsstand Beach volleyball on site Beach umbrellas Babysitting or childcare (surcharge) Ziplining nearby Reception hall Pool umbrellas Free WiFi Number of bars/lounges - 1 Designated smoking areas Number of outdoor pools - 1 Number of beach bars - 1 Garden Picnic area Bicycle rentals nearby Wedding services Tours/ticket assistance Beach towels Boat tours on site Scuba diving on site Free ferry terminal shuttle Airport transportation (surcharge) On private beach Wheelchair accessible  no Luggage storage Front desk (limited hours) Scooter/moped rentals nearby Library Barbecue grill(s) Golfing nearby Segway rental/tour nearby Safe-deposit box at front desk Ecotours nearby Rowing or canoeing on site Snack bar/deli Laundry facilities Free self parking Snorkeling on site Kayaking on site Beach sun loungers Terrace Pool sun loungers Concierge services,-17.696382|168.263565,678-2-2963,12623,http://hideaway.com.vu
VU,Vanuatu,132315,Port Vila,1252733,Benjor Beach Club,ThreeStar,DEVILS POINT ROADMELE BAY PORT VILA VANUATU MELE BAY ,,"Boutique 3,5 star 17 Villa property located ocean front on 21 acres of Tropical grounds. Just 20 mins from the hustle and bustle of Port Vila - this beautiful resort caters for families and romance! Great snorkelling, oceanfront pool and large spacious Villas - all with ocean views - this Resort offers a great relaxing get-away. The Villas range from Ocean Single to five Bedroom Chief's Villa with two bedroom self-contained villas also on offer. Within five minutes from most major attractions such as the Cascade Waterfalls, Tanna Coffee, Hideaway Island, Fire Dancing, Botanical Gardens and the Port Vila International Golf Course - something for everyone....",,Babysitting service Currency exchange facilities Breakfast Horse riding Tennis Hotel American Express MasterCard Visa Safe Room service Launderette Medical service,-17.81945|168.38179,,000,https://www.benjor.vu/
VU,Vanuatu,132315,Port Vila,1254959,Poppy's On The Lagoon,ThreeStar,Erakor Lagoon Erakor LagoonPO Box 920Port Vila ,Distances are displayed to the nearest 0.1 mile and kilometer. <br /> <p>Erakor Lagoon - 0.1 km / 0.1 mi <br /> Parliament House - 1.1 km / 0.7 mi <br /> Independence Park - 1.1 km / 0.7 mi <br /> National Museum - 1.1 km / 0.7 mi <br /> Port Vila Market - 1.3 km / 0.8 mi <br /> Iririki Island - 1.4 km / 0.9 mi <br /> Feiawa Park - 1.6 km / 1 mi <br /> Lookout Point - 1.6 km / 1 mi <br /> Supreme Court - 1.6 km / 1 mi <br /> Michoutouchkine & Pilioko Foundation Art Gallery - 1.7 km / 1 mi <br /> British Residency - 1.7 km / 1 mi <br /> French Residency - 1.7 km / 1 mi <br /> University of the South Pacific - 1.7 km / 1 mi <br /> Chinatown - 1.9 km / 1.2 mi <br /> WWI memorial - 1.9 km / 1.2 mi <br /> </p><p>The preferred airport for Poppys On The Lagoon is Port Vila (VLI-Bauerfield) - 7.4 km / 4.6 mi </p>,"<p>HeadLine : Near Independence Park</p><p>Location : With a stay at Poppys On The Lagoon in Port Vila, you ll be on the waterfront, just a 1-minute walk from Erakor Lagoon and 13 minutes by foot from Parliament House.  This beach hotel is 0.9 mi (1.4 km) from Iririki Island and 1.2 mi (1.9 km) from Port Vila Market.</p><p>Rooms : Make yourself at home in one of the 31 individually furnished guestrooms, featuring kitchenettes with refrigerators and stovetops. Rooms have private furnished balconies. 54-cm flat-screen televisions with DVD players and satellite programming provide entertainment. Conveniences include microwaves and coffee/tea makers, and housekeeping is provided daily.</p><p>Dining : Grab a bite to eat at Banana Leaf, a beachfront restaurant where you can enjoy drinks at the bar/lounge, take in the garden view, and even dine alfresco. You can also stay in and take advantage of the room service (during limited hours). A complimentary continental breakfast is served daily from 7:30 AM to 10 AM.</p><p>CheckIn Instructions : <ul>  <li>Extra-person charges may apply and vary depending on property policy</li><li>Government-issued photo identification and a credit card, debit card, or cash deposit may be required at check-in for incidental charges</li><li>Special requests are subject to availability upon check-in and may incur additional charges; special requests cannot be guaranteed</li><li>This property accepts credit cards; cash is not accepted</li><li>Safety features at this property include a fire extinguisher and a first aid kit</li>  </ul></p><p>Special Instructions : This property offers transfers from the airport (surcharges may apply). To arrange pick-up, guests must contact the property 72 hours prior to arrival, using the contact information on the booking confirmation. The front desk is open daily from 7:30 AM - 7:30 PM. To make arrangements for check-in please contact the property at least 48 hours before arrival using the information on the booking confirmation. If you are planning to arrive after 7:30 PM please contact the property in advance using the information on the booking confirmation. Guests must contact the property in advance for check-in instructions. Front desk staff will greet guests on arrival.</p>",678-2-3421,Gift shops or newsstand Dry cleaning/laundry service Shopping on site Babysitting or childcare (surcharge) Ziplining nearby Pool umbrellas Free wired Internet Sailing nearby Scuba diving nearby Free WiFi Number of bars/lounges - 1 Designated smoking areas Number of outdoor pools - 3 In-room accessibility (in select rooms) Wheelchair accessible parking Tours/ticket assistance Accessible bathroom (in select rooms) Free continental breakfast Airport transportation (surcharge) Free breakfast Golf lessons available nearby Multilingual staff Parasailing nearby Daily Barbecue grill(s) Ecotours nearby Number of coffee shops/cafes - 1 Laundry facilities Snorkeling on site Children's club (surcharge) Supervised childcare/activities (free) Mountain biking nearby Direct access to private beach Beach umbrellas Windsurfing nearby Spa treatment room(s) Garden Picnic area Free newspapers in lobby Wedding services Beach towels Boat tours nearby Luggage storage Private beach nearby Grocery/convenience store Front desk (limited hours) Scooter/moped rentals nearby Library Golfing nearby Spa services on site Safe-deposit box at front desk Rowing or canoeing on site Snack bar/deli Hiking/biking trails nearby Surfing/bodyboarding nearby Free self parking Hot springs nearby Kayaking on site Beach sun loungers Terrace Wheelchair accessible path of travel Pool sun loungers Concierge services,-17.745272|168.323902,678-2-3425,Seaside,http://www.poppys.com.vu
VU,Vanuatu,132315,Port Vila,1254970,Sunset Bungalows Resort,ThreeStar,Teouma Rd 2Nd Lagoon 2nd LagoonPO Box 3236Port Vila ,Distances are displayed to the nearest 0.1 mile and kilometer. <br /> <p>Erakor Lagoon - 1.9 km / 1.2 mi <br /> University of the South Pacific - 2.5 km / 1.6 mi <br /> Supreme Court - 3.6 km / 2.2 mi <br /> Michoutouchkine & Pilioko Foundation Art Gallery - 3.7 km / 2.3 mi <br /> British Residency - 3.7 km / 2.3 mi <br /> French Residency - 3.7 km / 2.3 mi <br /> Independence Park - 3.8 km / 2.4 mi <br /> Georges Pompidou Building - 4 km / 2.5 mi <br /> WWI memorial - 4.2 km / 2.6 mi <br /> Parliament House - 4.3 km / 2.6 mi <br /> National Museum - 4.3 km / 2.7 mi <br /> Porte du Ciel - 4.3 km / 2.7 mi <br /> Iririki Island - 4.4 km / 2.7 mi <br /> Sacré Coeur Cathedral - 4.4 km / 2.7 mi <br /> Feiawa Park - 4.4 km / 2.7 mi <br /> </p><p>The preferred airport for Sunset Bungalows is Port Vila (VLI-Bauerfield) - 8.5 km / 5.3 mi </p>,"<p>HeadLine : Near University of the South Pacific</p><p>Location : Located in Port Vila, Sunset Bungalows is on the waterfront, within a 5-minute drive of Erakor Lagoon and University of the South Pacific.  This resort is 3.1 mi (4.9 km) from Port Vila Market and 3.1 mi (5 km) from Iririki Island.</p><p>Rooms : Make yourself at home in one of the 19 guestrooms featuring refrigerators and DVD players. Rooms have private furnished balconies or patios. Cable television is provided for your entertainment. Private bathrooms have complimentary toiletries and hair dryers.</p><p>Dining : Grab a bite to eat at Bungalow Ate, a beachfront restaurant where you can take in the ocean view and dine alfresco. You can also stay in and take advantage of the room service (during limited hours). Quench your thirst with your favorite drink at the bar/lounge.</p><p>CheckIn Instructions : <ul>  <li>Extra-person charges may apply and vary depending on property policy</li><li>Government-issued photo identification and a credit card, debit card, or cash deposit may be required at check-in for incidental charges</li><li>Special requests are subject to availability upon check-in and may incur additional charges; special requests cannot be guaranteed</li><li>This property accepts credit cards; cash is not accepted</li><li>Safety features at this property include a smoke detector</li>  </ul></p><p>Special Instructions : This property offers transfers from the airport (surcharges may apply). To arrange pick-up, guests must contact the property 72 hours prior to arrival, using the contact information on the booking confirmation. The front desk is open daily from 7 AM - 9 PM. Front desk staff will greet guests on arrival.</p>",678-2-9970,Tours/ticket assistance Beach towels Boat tours nearby Airport transportation (surcharge) Luggage storage Express check-out Multilingual staff Front desk (limited hours) Library Golfing nearby Safe-deposit box at front desk Ecotours nearby Hiking/biking trails nearby Free self parking Snorkeling on site Kayaking on site Wheelchair accessible path of travel Pool sun loungers Dry cleaning/laundry service Ziplining nearby Sailing nearby Scuba diving nearby Free WiFi Number of bars/lounges - 1 Designated smoking areas Number of outdoor pools - 1 Garden In-room accessibility (in select rooms) Wheelchair accessible parking Wedding services,-17.739848|168.347583,678-2-9968,PORT VILA,http://www.sunset-bungalows.com/
