countyCode,countyName,cityCode,cityName,HotelCode,HotelName,HotelRating,Address,Attractions,Description,FaxNumber,HotelFacilities,Map,PhoneNumber,PinCode,HotelWebsiteUrl
VU,Vanuatu,132315,Port Vila,1255573,Grand Hotel & Casino,FourStar,Lini Highway P.O Box 3061 Port VilaVanuatu ,Distances are displayed to the nearest 0.1 mile and kilometer. <br /> <p>Iririki Island - 0.1 km / 0.1 mi <br /> Port Vila Market - 0.2 km / 0.1 mi <br /> Feiawa Park - 0.4 km / 0.2 mi <br /> Independence Park - 0.4 km / 0.3 mi <br /> Parliament House - 0.7 km / 0.4 mi <br /> Chinatown - 0.7 km / 0.4 mi <br /> Lookout Point - 0.7 km / 0.4 mi <br /> National Museum - 0.7 km / 0.4 mi <br /> Nambawan Market & Café - 0.8 km / 0.5 mi <br /> WWI memorial - 0.9 km / 0.6 mi <br /> Sacré Coeur Cathedral - 1 km / 0.6 mi <br /> Porte du Ciel - 1.1 km / 0.7 mi <br /> Georges Pompidou Building - 1.3 km / 0.8 mi <br /> Erakor Lagoon - 1.3 km / 0.8 mi <br /> Supreme Court - 1.5 km / 0.9 mi <br /> </p><p>The preferred airport for Grand Hotel and Casino is Port Vila (VLI-Bauerfield) - 5.7 km / 3.5 mi </p>,"<p>HeadLine : Near Port Vila Market</p><p>Location : A stay at Grand Hotel and Casino places you in the heart of Port Vila, steps from Iririki Island and 3 minutes by foot from Port Vila Market.  This 4-star hotel is 0.2 mi (0.4 km) from Feiawa Park and 0.4 mi (0.7 km) from Independence Park.</p><p>Rooms : Make yourself at home in one of the 74 guestrooms featuring refrigerators and LCD televisions. Rooms have private furnished balconies. Complimentary wireless Internet access keeps you connected, and satellite programming is available for your entertainment. Private bathrooms with separate bathtubs and showers feature complimentary toiletries and hair dryers.</p><p>Dining : Grab a bite to eat at the Crystals Restaurant, a restaurant where you can take in the pool view, or stay in and take advantage of 24-hour room service. Relax with a refreshing drink from the poolside bar or one of the 2 bars/lounges. Buffet breakfasts are available daily from 7:00 AM to 10:00 AM for a fee.</p><p>CheckIn Instructions : <ul>  <li>Extra-person charges may apply and vary depending on property policy</li><li>Government-issued photo identification and a credit card, debit card, or cash deposit may be required at check-in for incidental charges</li><li>Special requests are subject to availability upon check-in and may incur additional charges; special requests cannot be guaranteed</li><li>This property accepts credit cards, debit cards, and cash</li><li>Safety features at this property include a fire extinguisher, a smoke detector, a security system, and a first aid kit</li>  </ul></p><p>Special Instructions : This property offers transfers from the airport (surcharges may apply). Guests must contact the property with arrival details before travel, using the contact information on the booking confirmation. Front desk staff will greet guests on arrival.</p>",678-2-8883,Free WiFi Conference space size (meters) - 200 Meeting rooms Pool umbrellas Babysitting or childcare (surcharge) Dry cleaning/laundry service Boat tours nearby Accessible bathroom (in select rooms) Tours/ticket assistance Free newspapers in lobby Wheelchair accessible parking Internet access in public areas - high speed In-room accessibility (in select rooms) Number of outdoor pools - 1 Number of poolside bars - 1 Designated smoking areas Number of bars/lounges - 2 Concierge services Conference space size (feet) - 2153 Pool sun loungers Wheelchair accessible path of travel ATM/banking Terrace Computer station Conference space Kayaking nearby elevator Laundry facilities Coffee/tea in common areas Safe-deposit box at front desk Snorkeling nearby Golfing nearby Breakfast available (surcharge) 24-hour front desk Business center Multilingual staff Porter/bellhop Luggage storage Off-street parking Airport transportation (surcharge),-17.742276|168.314292,678-2-8882,48300,http://www.grandvanuatu.com
VU,Vanuatu,132315,Port Vila,1255576,Mangoes Resort,ThreeStar,Rue De Wales PO Box 862Port Vila ,Distances are displayed to the nearest 0.1 mile and kilometer. <br /> <p>Erakor Lagoon - 0.1 km / 0.1 mi <br /> Parliament House - 1 km / 0.6 mi <br /> Independence Park - 1 km / 0.6 mi <br /> National Museum - 1 km / 0.6 mi <br /> Port Vila Market - 1.2 km / 0.8 mi <br /> Iririki Island - 1.3 km / 0.8 mi <br /> Feiawa Park - 1.5 km / 0.9 mi <br /> Lookout Point - 1.5 km / 0.9 mi <br /> Supreme Court - 1.5 km / 0.9 mi <br /> Michoutouchkine & Pilioko Foundation Art Gallery - 1.6 km / 1 mi <br /> British Residency - 1.6 km / 1 mi <br /> French Residency - 1.6 km / 1 mi <br /> University of the South Pacific - 1.6 km / 1 mi <br /> Chinatown - 1.8 km / 1.1 mi <br /> WWI memorial - 1.8 km / 1.1 mi <br /> </p><p>The preferred airport for Mangoes Resort is Port Vila (VLI-Bauerfield) - 6.6 km / 4.1 mi </p>,"<p>HeadLine : Near Erakor Lagoon</p><p>Location : With a stay at Mangoes Resort in Port Vila, you ll be near the airport, just a 1-minute walk from Erakor Lagoon and 12 minutes by foot from Parliament House.  This hotel is 0.8 mi (1.3 km) from Iririki Island and 1.1 mi (1.8 km) from Port Vila Market.</p><p>Rooms : Make yourself at home in one of the 29 guestrooms featuring refrigerators and LCD televisions. Rooms have private balconies. Wireless Internet access (surcharge) keeps you connected, and satellite programming is available for your entertainment. Private bathrooms with showers feature complimentary toiletries and hair dryers.</p><p>Dining : Enjoy Regional cuisine at Mangoes Resort Restaurant, a restaurant where you can enjoy drinks at the bar/lounge and dine alfresco. Or stay in and take advantage of the room service (during limited hours). Continental breakfasts are available daily from 7 AM to 10:30 AM for a fee.</p><p>CheckIn Instructions : <ul>  <li>Extra-person charges may apply and vary depending on property policy</li><li>Government-issued photo identification and a credit card, debit card, or cash deposit may be required at check-in for incidental charges</li><li>Special requests are subject to availability upon check-in and may incur additional charges; special requests cannot be guaranteed</li><li>This property accepts credit cards; cash is not accepted</li><li>Safety features at this property include a first aid kit</li>  </ul></p><p>Special Instructions : This property offers transfers from the airport (surcharges may apply). To arrange pick-up, guests must contact the property 72 hours prior to arrival, using the contact information on the booking confirmation. The front desk is open daily from 7 AM - 7 PM. To make arrangements for check-in please contact the property at least 24 hours before arrival using the information on the booking confirmation. If you are planning to arrive after 7:00 PM please contact the property in advance using the information on the booking confirmation. Guests must contact the property in advance for check-in instructions. Front desk staff will greet guests on arrival.</p>",67-8-24037,Concierge services Pool sun loungers Terrace Fitness facilities Free self parking Kayaking nearby Surfing/bodyboarding nearby Laundry facilities Ecotours nearby Safe-deposit box at front desk Snorkeling nearby Golfing nearby Scooter/moped rentals nearby Breakfast available (surcharge) Front desk (limited hours) Parasailing nearby Outdoor tennis courts - 1 Luggage storage Wheelchair accessible  no Airport transportation (surcharge) Yoga classes/instruction on site Boat tours nearby Beach towels Tours/ticket assistance Wedding services Internet access - wireless Garden Number of outdoor pools - 1 Designated smoking areas Number of bars/lounges - 1 Free WiFi Scuba diving nearby Sailing nearby Meeting rooms Pool umbrellas Dry cleaning/laundry service,-17.74579|168.32266,67 82 4923,000,http://www.mangoesresort.com
VU,Vanuatu,132315,Port Vila,1362827,Starfish Cove,ThreeStar,P.O.Box 1402; Port Vila; Vanuatu PORT VILA ,,This charming hotel is situated in Port Vila. Pets are not allowed at this hotel.,678-2-8163,Hotel,-17.74306|168.3536,135656323,2nd Lagoon,http://www.starfishcove.vu/
VU,Vanuatu,132315,Port Vila,1413148,Olympic Hotel,ThreeStar,Rue Bougainville Port VilaVanuatu ,Distances are displayed to the nearest 0.1 mile and kilometer. <br /> <p>Chinatown - 0.1 km / 0.1 mi <br /> Nambawan Market & Café - 0.1 km / 0.1 mi <br /> Feiawa Park - 0.2 km / 0.1 mi <br /> Sacré Coeur Cathedral - 0.3 km / 0.2 mi <br /> Porte du Ciel - 0.4 km / 0.2 mi <br /> Iririki Island - 0.5 km / 0.3 mi <br /> Georges Pompidou Building - 0.5 km / 0.3 mi <br /> Lookout Point - 0.5 km / 0.3 mi <br /> WWI memorial - 0.5 km / 0.3 mi <br /> Port Vila Market - 0.6 km / 0.4 mi <br /> Independence Park - 0.7 km / 0.5 mi <br /> Tana Russet Plaza - 0.8 km / 0.5 mi <br /> Supreme Court - 1 km / 0.6 mi <br /> Michoutouchkine & Pilioko Foundation Art Gallery - 1.2 km / 0.7 mi <br /> British Residency - 1.2 km / 0.7 mi <br /> </p><p>The preferred airport for Hotel Olympic is Port Vila (VLI-Bauerfield) - 4.9 km / 3.1 mi </p>,"<p>HeadLine : Near Nambawan Market & Café</p><p>Location : With a stay at Hotel Olympic in Port Vila, you ll be within a 10-minute walk of Iririki Island and Georges Pompidou Building.  This hotel is 0.3 mi (0.5 km) from Port Vila Market and 0.5 mi (0.8 km) from Tana Russet Plaza.</p><p>Rooms : Make yourself at home in one of the 19 guestrooms. Complimentary wireless Internet access is available to keep you connected. Bathrooms have showers and complimentary toiletries. Conveniences include coffee/tea makers, housekeeping is provided daily, and refrigerators can be requested.</p><p>Dining : Enjoy a satisfying meal at Yumi Restaurant serving guests of Hotel Olympic.</p><p>CheckIn Instructions : <ul>  <li>Extra-person charges may apply and vary depending on property policy</li><li>Government-issued photo identification and a credit card or cash deposit may be required at check-in for incidental charges</li><li>Special requests are subject to availability upon check-in and may incur additional charges; special requests cannot be guaranteed</li><li>Guests must contact this property in advance to reserve rollaway/extra beds</li><li>This property accepts credit cards; cash is not accepted</li><li>Please note that cultural norms and guest policies may differ by country and by property; the policies listed are provided by the property</li>  </ul></p><p>Special Instructions : This property offers transfers from the airport (surcharges may apply). Guests must contact the property with arrival details before travel, using the contact information on the booking confirmation. The front desk is open during the following times:<ul><li>Monday - Friday: 8:00 AM - 7 PM</li></ul> <ul><li>Saturday - Sunday: 8:00 AM - 4 PM</li></ul>If you are planning to arrive after 7:00 PM please contact the property in advance using the information on the booking confirmation. Front desk staff will greet guests on arrival. For more details, please contact the property using the information on the booking confirmation.  Guests arriving after 7 PM on Monday-Friday or after 4 PM on Saturday-Sunday should contact the property ahead of time.</p>",678-678-23841,Upper floors accessible by stairs only Designated smoking areas Airport transportation (surcharge) Dry cleaning/laundry service Free WiFi Terrace Luggage storage Tours/ticket assistance Wheelchair accessible  no Safe-deposit box at front desk,-17.736019|168.312495,678-678-23841,,http://www.businessclasshotelvanuatu.com/
VU,Vanuatu,132315,Port Vila,1413209,Airlines Business Hotel,OneStar,Lini Highway Tagabe Road Port Vila ,,"Offering free WiFi, Airlines Business Hotel is just a 2-minute drive from Bauerfield Airport from which guests enjoy free a shuttle between 08:00 and 18:00. Guests can experience international cuisine from the on-site restaurant.

Each room offers a flat-screen TV with satellite channels. There is tea and coffee making facilities and a dining table. They also include either a private bathroom or access to shared bathroom facilities.

Airlines Business Hotel features a 24-hour front desk and laundry facilities. The property offers free parking and a games room. Free transfers are available to and from Bauerfield International Airport between 08:00 and 18:00. You must inform Airlines Business Hotel of your flight details in advance if you want to use this service. You can use the Special Requests box when booking, or contact the property using the contact details found on the booking confirmation. Transfers between 19:00 and 07:00 will incur an additional charge of AUD $30.",,Free self parking Restaurant Room service Meeting rooms Bar/lounge 24-hour front desk Golf course (within 3 km) Non-smoking rooms Fishing Business center Laundry facilities Family rooms Breakfast service Internet access Express check-in Currency exchange Karaoke Gift shops or newsstand Business services Packed lunches Car hire Tour desk Fax/photocopying Diving Horse riding Snorkelling Luggage storage Free WiFi Free WiFi Air conditioning ATM/banking Private check-in/check-out Special diet menus (on request) Trouser press Mini-market on site Daily housekeeping Street parking,-17.70575|168.3087,+6787788887,,https://www.booking.com/hotel/vu/airlines-business.html
VU,Vanuatu,132315,Port Vila,1442843,Paray Lodge Hostel,TwoStar,Nambatu Paray Area NambatuPO Box 3121Port Vila ,,"Paray Lodge is Special because it has a Unique local built Natagora Kitchen for Guest comfort during breakfast and even to sit around and enjoy a FREE fastast WIFI to connect with Families and Friends around the world.We also create ducks, swams or elephants made out of towels as guest welcoming token and honour to their rooms. We also treat our Guest with comfort and take great care of them during their Hosting with us, making sure that their stay is an enjoyable, adventurous and mostly a memorable one. Only 15 minutes walk from the centre of Port Vila, Paray Lodge provides free parking and free Wi-Fi access. Rooms are simply furnished and have either a private or shared bathroom.

Each room comes with a fan, while shared areas in the property include a fully equipped kitchen area.

Restaurants and shops can be found only a 5-minute walk away. The tour desk can organize trips to Mele Cascade Waterfalls, Lelepa Island tours and Hideaway Island. The Bauerfield International Airport is a 15-minute ride away.",678-0000,internet services Free WiFi Tour desk shuttle service (additional charge) Terrace Free parking On-site parking Garden Parking wifi Shared kitchen Private parking Laundry wifi available in all areas,-17.75605|168.31664,00678 55 26289,000,https://www.booking.com/hotel/vu/paray-lodge.html
VU,Vanuatu,132315,Port Vila,1448429,Coco Beach Resort,FourStar,Paradise Cove PangoEfatePort Vila ,Distances are displayed to the nearest 0.1 mile and kilometer. <br /> <p>Pango Point - 3.2 km / 2 mi <br /> Erakor Lagoon - 6.5 km / 4.1 mi <br /> Iririki Island - 7.3 km / 4.6 mi <br /> WWI memorial - 7.4 km / 4.6 mi <br /> Parliament House - 7.5 km / 4.6 mi <br /> National Museum - 7.5 km / 4.7 mi <br /> Port Vila Market - 8.1 km / 5 mi <br /> Independence Park - 8.2 km / 5.1 mi <br /> Feiawa Park - 8.3 km / 5.1 mi <br /> Lookout Point - 8.6 km / 5.3 mi <br /> Chinatown - 8.7 km / 5.4 mi <br /> Supreme Court - 8.8 km / 5.5 mi <br /> Michoutouchkine & Pilioko Foundation Art Gallery - 8.9 km / 5.5 mi <br /> British Residency - 8.9 km / 5.5 mi <br /> French Residency - 8.9 km / 5.5 mi <br /> </p><p>The preferred airport for Coco Beach Resort is Port Vila (VLI-Bauerfield) - 14.5 km / 9 mi </p>,"<p>HeadLine : Near Pango Point</p><p>Location : Located in Port Vila, Coco Beach Resort is by the ocean, within a 15-minute drive of Pango Point and Parliament House.  This 4-star resort is 4.7 mi (7.5 km) from National Museum.</p><p>Rooms : Make yourself at home in one of the 15 individually decorated guestrooms. Rooms have private furnished patios. Complimentary wireless Internet access is available to keep you connected. Private bathrooms with showers feature rainfall showerheads and complimentary toiletries.</p><p>Dining : Enjoy a meal at the restaurant or snacks in the coffee shop/cafe. The resort also offers room service (during limited hours). Relax with your favorite drink at the bar/lounge or the beach bar.</p><p>CheckIn Instructions : <ul>  <li>Extra-person charges may apply and vary depending on property policy</li><li>Government-issued photo identification and a credit card, debit card, or cash deposit may be required at check-in for incidental charges</li><li>Special requests are subject to availability upon check-in and may incur additional charges; special requests cannot be guaranteed</li><li>This property accepts credit cards; cash is not accepted</li>  </ul></p><p>Special Instructions : This property offers transfers from the airport (surcharges may apply). To arrange pick-up, guests must contact the property 24 hours prior to arrival, using the contact information on the booking confirmation. Front desk staff will greet guests on arrival.</p>",6785552220,Private picnics Couples/private dining Wheelchair accessible  no Luggage storage Dry cleaning/laundry service Proposal/romance packages available Parking (limited spaces) Ziplining nearby Reception hall Number of meeting rooms - 1 Conference space size (meters) - 200 Scuba diving nearby Free WiFi Number of bars/lounges - 1 Marina on site Number of outdoor pools - 1 Number of beach bars - 1 Garden Wedding services Tours/ticket assistance Beach towels Boat tours nearby Airport transportation (surcharge) On private beach Golf lessons available nearby Horse riding nearby Multilingual staff Parasailing nearby 24-hour front desk Scooter/moped rentals nearby Golfing nearby Safe-deposit box at front desk Smoke-free property Ecotours nearby Number of coffee shops/cafes - 1 Laundry facilities Surfing/bodyboarding nearby Conference space Snorkeling on site Kayaking on site Beach sun loungers Terrace Pool sun loungers Conference space size (feet) - 2153,-17.765132|168.276037,678- 5552220,3294,http://www.stay-cocobeach.com/
VU,Vanuatu,132315,Port Vila,1448766,Vale Vale Beachfront Villas,FourStar,Vale Vale Beach Pango Rd Vale Vale BeachPort Vila ,Distances are displayed to the nearest 0.1 mile and kilometer. <br /> <p>Pango Point - 1.5 km / 0.9 mi <br /> Erakor Lagoon - 3.4 km / 2.1 mi <br /> Parliament House - 4.9 km / 3 mi <br /> National Museum - 4.9 km / 3.1 mi <br /> Iririki Island - 4.9 km / 3.1 mi <br /> Port Vila Market - 5.1 km / 3.2 mi <br /> Independence Park - 5.2 km / 3.2 mi <br /> Feiawa Park - 5.3 km / 3.3 mi <br /> Lookout Point - 5.6 km / 3.5 mi <br /> Chinatown - 5.7 km / 3.5 mi <br /> WWI memorial - 5.8 km / 3.6 mi <br /> Supreme Court - 5.9 km / 3.6 mi <br /> Michoutouchkine & Pilioko Foundation Art Gallery - 5.9 km / 3.7 mi <br /> British Residency - 5.9 km / 3.7 mi <br /> French Residency - 5.9 km / 3.7 mi <br /> </p><p>The nearest major airport is Port Vila (VLI-Bauerfield) - 11.5 km / 7.2 mi</p>,"<p>HeadLine : Near Pango Point</p><p>Location : Located in Port Vila, Vale Vale Beachfront Villas is by the sea, within a 5-minute drive of Pango Point and Erakor Lagoon.  This 4-star cottage is 2.9 mi (4.7 km) from Iririki Island and 3.2 mi (5.1 km) from Port Vila Market.</p><p>Rooms : Make yourself at home in one of the 13 air-conditioned rooms featuring private plunge pools and flat-screen televisions. Rooms have private balconies. Kitchens are outfitted with full-sized refrigerators/freezers, stovetops, and microwaves. Complimentary wireless Internet access keeps you connected, while iPod docking stations help you enjoy your music in the comfort of your room.</p><p>CheckIn Instructions : <ul>  <li>Extra-person charges may apply and vary depending on property policy</li><li>Government-issued photo identification and a credit card, debit card, or cash deposit may be required at check-in for incidental charges</li><li>Special requests are subject to availability upon check-in and may incur additional charges; special requests cannot be guaranteed</li><li>This property accepts credit cards and cash</li><li>Please note that cultural norms and guest policies may differ by country and by property; the policies listed are provided by the property</li>  </ul></p><p>Special Instructions : There is no front desk at this property. This property doesn t offer after-hours check-in. The host will greet guests on arrival. For more details, please contact the property using the information on the booking confirmation.  Guests planning to arrive outside of normal check-in hours must contact this property in advance to arrange check-in.</p>",678-03-92521051,Terrace Free self parking Tours/ticket assistance Laundry facilities Garden Barbecue grill(s) Designated smoking areas Free WiFi Airport transportation Luggage storage Wheelchair accessible  no Airport transportation (surcharge) Dry cleaning/laundry service,-17.775542|168.293578,678-04-12403816,0000,
VU,Vanuatu,132315,Port Vila,1457952,Angelfish Cove Villas,FourStar,Angelfish Cove Pango PangoPort Vila ,Distances are displayed to the nearest 0.1 mile and kilometer. <br /> <p>Pango Point - 3.3 km / 2.1 mi <br /> Iririki Island - 7.7 km / 4.8 mi <br /> Parliament House - 8.1 km / 5 mi <br /> National Museum - 8.1 km / 5 mi <br /> Port Vila Market - 8.7 km / 5.4 mi <br /> Mele Bay - 9.5 km / 5.9 mi <br /> University of the South Pacific - 9.7 km / 6 mi <br /> Ekasup Village - 9.9 km / 6.2 mi <br /> Tana Russet Plaza - 10.3 km / 6.4 mi <br /> Port Vila Golf Country Club - 17.2 km / 10.7 mi <br /> Mele Cascades - 19.9 km / 12.4 mi <br /> Wet N Wild Zorbing - 20.4 km / 12.7 mi <br /> The Summit Gardens - 21.9 km / 13.6 mi <br /> </p><p>The preferred airport for Angelfish Cove Villas is Port Vila (VLI-Bauerfield) - 14.4 km / 8.9 mi </p>,"<p>HeadLine : Near Pango Point</p><p>Location : Located in Port Vila, Angelfish Cove Villas is within a 15-minute drive of Pango Point and Iririki Island.  This 4-star apartment is 5 mi (8.1 km) from National Museum and 5.4 mi (8.7 km) from Port Vila Market.</p><p>Rooms : Make yourself at home in one of the 12 air-conditioned rooms featuring kitchenettes with refrigerators and stovetops. Rooms have private furnished balconies or patios. Complimentary wireless Internet access keeps you connected, and flat-screen televisions are provided for your entertainment. Conveniences include separate sitting areas and microwaves, and housekeeping is provided daily.</p><p>CheckIn Instructions : Extra-person charges may apply and vary depending on property policy. <br />Government-issued photo identification and a credit card, debit card, or cash deposit are required at check-in for incidental charges. <br />Special requests are subject to availability upon check-in and may incur additional charges. Special requests cannot be guaranteed. <ul>  </ul></p>",,Garden Babysitting or childcare (surcharge) Free WiFi Free self parking Number of outdoor pools - 6 Luggage storage Tours/ticket assistance Picnic area Laundry facilities Barbecue grill(s) Front desk (limited hours),-17.765482|168.275326,678-87750833,,http://www.angelfishcovevillas.com/
