countyCode,countyName,cityCode,cityName,HotelCode,HotelName,HotelRating,Address,Attractions,Description,FaxNumber,HotelFacilities,Map,PhoneNumber,PinCode,HotelWebsiteUrl
VU,Vanuatu,126715,Luganville,1673114,Luganvilla Business Hotel and Restaurant,ThreeStar,"Boulevard Higginson P.O. Box 96, Espiritu Santo LuganvilleSanto ",Distances are displayed to the nearest 0.1 mile and kilometer. <br /> <p>Unity Park - 0.7 km / 0.4 mi <br /> Luganville Market - 1 km / 0.6 mi <br /> Ammunition Bunkers - 1.4 km / 0.9 mi <br /> Rotary Park - 1.4 km / 0.9 mi <br /> SS President Coolidge - 6.4 km / 4 mi <br /> Mount Hope Waterfall - 10 km / 6.2 mi <br /> Santo Golf Course - 10 km / 6.2 mi <br /> Millenium Cave - 12.7 km / 7.9 mi <br /> Riri Blue Hole - 19.8 km / 12.3 mi <br /> Matevulu Blue Hole - 20.7 km / 12.9 mi <br /> Nanda Blue Hole - 28.5 km / 17.7 mi <br /> Lonnoc Beach - 51.1 km / 31.7 mi <br /> </p><p>The preferred airport for Luganvilla Business Hotel and Restaurant is Luganville (SON-Santo-Pekoa Intl.) - 5.4 km / 3.4 mi </p>,"<p>HeadLine : Near Ammunition Bunkers</p><p>Location : When you stay at Luganvilla Business Hotel and Restaurant in Luganville, you ll be near the beach, within a 15-minute walk of Unity Park and Luganville Market.  This hotel is 0.9 mi (1.4 km) from Ammunition Bunkers and 0.9 mi (1.4 km) from Rotary Park.</p><p>Rooms : Make yourself at home in one of the 30 air-conditioned rooms featuring refrigerators and flat-screen televisions. Rooms have private balconies or patios. Complimentary wireless Internet access is available to keep you connected. Private bathrooms with shower/tub combinations feature complimentary toiletries and hair dryers.</p><p>Dining : Satisfy your appetite for lunch or dinner at Luganvilla Restaurant, a restaurant which specializes in Chinese cuisine, or stay in and take advantage of the room service (during limited hours). A complimentary continental breakfast is served daily from 7:00 AM to 10:30 AM.</p><p>CheckIn Instructions : <ul>  <li>Extra-person charges may apply and vary depending on property policy</li><li>Government-issued photo identification and a credit card, debit card, or cash deposit may be required at check-in for incidental charges</li><li>Special requests are subject to availability upon check-in and may incur additional charges; special requests cannot be guaranteed</li><li>This property accepts credit cards; cash is not accepted</li>  </ul></p><p>Special Instructions : The front desk is open daily from 7:00 AM - 6:00 PM. Front desk staff will greet guests on arrival.</p>",678-678-36548,Dry cleaning/laundry service Wheelchair accessible (may have limitations) Free parking nearby Wheelchair-accessible registration desk Free WiFi Designated smoking areas Number of outdoor pools - 1 Upper floors accessible by stairs only Garden Picnic area In-room accessibility (in select rooms) Tours/ticket assistance Free continental breakfast Luggage storage Free breakfast Multilingual staff Front desk (limited hours) Daily Snack bar/deli Laundry facilities Children's pool Free self parking Terrace Concierge services,-15.512254|167.180159,678-678-36498,,http://www.luganvillasanto.com/
VU,Vanuatu,126715,Luganville,1870725,Santo Seaside Villas,ThreeStar,Corner Cook Street And Main Street LuganvilleSanto ,,"Set 10 km from SS President Coolidge, Santo Seaside Villas offers accommodation with a garden, a terrace and room service for your convenience. The villa features both WiFi and private parking free of charge.

Santo Seaside Villas offers a seating area with a TV and a private bathroom with free toiletries and shower. There is also a kitchen in some of the units equipped with an oven and a stovetop.

Continental and buffet breakfast options are available every morning at the accommodation.

If you would like to discover the area, snorkelling and canoeing are possible in the surroundings and Santo Seaside Villas can arrange a car rental service.

Popular points of interest near the villa include Aimbuei Bay, La Roseraie and Douane. The nearest airport is Santo-Pekoa International, 9 km from Santo Seaside Villas, and the property offers a paid airport shuttle service. Please inform Santo Seaside Villas in advance of your expected arrival time. You can use the Special Requests box when booking, or contact the property directly with the contact details provided in your confirmation.
Food & beverage services at this property may be limited or unavailable due to Coronavirus (COVID-19).
As a result of Coronavirus (COVID-19), this property has temporarily suspended its shuttle services.
Due to Coronavirus (COVID-19), this property is taking steps to help protect the safety of guests and staff. Certain services and amenities may be reduced or unavailable as a result.
Due to Coronavirus (COVID-19), this property has reduced reception and service operating hours.
Due to Coronavirus (COVID-19), this property adheres to strict physical distancing measures.
Free transfers are available to and from Santo-Pekoa International Airport. Please inform Santo Seaside Villas in advance if you want to use this service, using the contact details found on the booking confirmation.",,Parking Room service Golf course (within 3 km) Garden Terrace Non-smoking rooms Airport shuttle Fishing Laundry breakfast in the room Ironing service Free parking internet services Massage Canoeing Hiking BBQ facilities Car hire Diving Horse riding Snorkelling Luggage storage wifi Free WiFi Non-smoking throughout designated smoking area Sun terrace shuttle service (additional charge) airport shuttle (additional charge) Beachfront Daily housekeeping parking on site Private parking wifi available in all areas secured parking Accessible parking airport pick up airport drop off Outdoor furniture Picnic area Outdoor fireplace Beach Shuttle service Tour or class about local culture Key access Fire extinguishers use of cleaning chemicals that are effective against coronavirus linens  towels and laundry washed in accordance with local authority guidelines guest accommodation is disinfected between stays guest accommodation sealed after cleaning physical distancing in dining areas food can be delivered to guest accommodation staff follow all safety protocols as directed by local authorities hand sanitizer in guest accommodation and key areas first aid kit available contactless check-in/check-out cashless payment available physical distancing rules followed screens or physical barriers placed between staff and guests in appropriate areas invoice provided all plates  cutlery  glasses and other tableware have been sanitized guests have the option to cancel any cleaning services for their accommodation during their stay breakfast takeaway containers delivered food is securely covered thermometers for guests provided by property face masks for guests available,-15.52901|167.15483,+6787755431|+6785907864,,https://www.booking.com/hotel/vu/santo-seaside-villas.html
VU,Vanuatu,129062,Moso Island,1253615,Tranquility Island Resort,TwoStar,Moso Island PO Box 991Moso Island ,Distances are displayed to the nearest 0.1 mile and kilometer. <br /> <p>Chief Roi Matas Domain - 13.7 km / 8.5 mi <br /> Mele Cascades - 17.6 km / 10.9 mi <br /> Mele Bay - 20.3 km / 12.6 mi <br /> Port Vila Golf Country Club - 20.7 km / 12.9 mi <br /> Wet N Wild Zorbing - 20.9 km / 13 mi <br /> The Summit Gardens - 23.1 km / 14.3 mi <br /> Tana Russet Plaza - 27 km / 16.8 mi <br /> Georges Pompidou Building - 27.9 km / 17.3 mi <br /> Sacré Coeur Cathedral - 28 km / 17.4 mi <br /> Porte du Ciel - 28 km / 17.4 mi <br /> Chinatown - 28.1 km / 17.4 mi <br /> Nambawan Market & Café - 28.1 km / 17.4 mi <br /> Iririki Island - 28.1 km / 17.5 mi <br /> Feiawa Park - 28.2 km / 17.5 mi <br /> Lookout Point - 28.5 km / 17.7 mi <br /> </p><p>The preferred airport for Tranquility Island Resort is Port Vila (VLI-Bauerfield) - 26 km / 16.1 mi </p>,"<p>HeadLine : On the beach</p><p>Location : When you stay at Tranquility Island Resort in Moso Island, you ll be on the beach and 10.9 mi (17.6 km) from Mele Cascades.  This beach hotel is 17.5 mi (28.1 km) from Iririki Island and 17.7 mi (28.5 km) from Port Vila Market.</p><p>Rooms : Treat yourself to a stay in one of the 7 individually decorated guestrooms, featuring fireplaces. Rooms have private furnished patios. Conveniences include safes and complimentary bottled water, and housekeeping is provided daily.</p><p>Dining : Enjoy a satisfying meal at The Beach House serving guests of Tranquility Island Resort. Quench your thirst with your favorite drink at the bar/lounge. Continental breakfasts are available for a fee.</p><p>CheckIn Instructions : <ul>  <li>Extra-person charges may apply and vary depending on property policy</li><li>Government-issued photo identification and a credit card, debit card, or cash deposit may be required at check-in for incidental charges</li><li>Special requests are subject to availability upon check-in and may incur additional charges; special requests cannot be guaranteed</li><li>Guests must contact this property in advance to reserve cribs/infant beds</li><li>This property accepts credit cards and cash</li><li>This property reserves the right to pre-authorize the guest s credit card prior to arrival.</li><li>Electricity is not provided</li>  </ul></p><p>Special Instructions : Guests must transfer via boat and shuttle to the property. Guests must contact the property at least 48 hours before travel, using the contact information on the confirmation received after booking. This property offers transfers from the airport (surcharges may apply). To arrange pick-up, guests must contact the property 48 hours prior to arrival, using the contact information on the booking confirmation. There is no front desk at this property. To make arrangements for check-in please contact the property ahead of time using the information on the booking confirmation. If you are planning to arrive after 3:30 PM please contact the property in advance using the information on the booking confirmation. Guests must contact the property in advance for check-in instructions. Guests can access their accommodation through a private entrance. For more details, please contact the property using the information on the booking confirmation.</p>",678-678-22979,Airport transportation (surcharge) Cave exploring/spelunking on site Wheelchair accessible  no Luggage storage Free parking nearby Breakfast available (surcharge) Free WiFi Number of bars/lounges - 1 Designated smoking areas Helicopter/airplane tours on site Barbecue grill(s) Garden Safe-deposit box at front desk Picnic area Ecotours on site Tours/ticket assistance Snorkeling on site Kayaking on site Beach sun loungers Terrace Scuba diving on site,-17.56252|168.2286,678-678-25020,0000,http://tranquillitydive.com/
VU,Vanuatu,129062,Moso Island,1681228,The Moso,FourStar,14 Emotu Bay Savannah AreaEfate BayVanuatu ,Distances are displayed to the nearest 0.1 mile and kilometer. <br /> <p>Chief Roi Matas Domain - 20.8 km / 12.9 mi <br /> Mele Cascades - 24.7 km / 15.3 mi <br /> Mele Bay - 27.4 km / 17 mi <br /> Port Vila Golf Country Club - 27.8 km / 17.3 mi <br /> Wet N Wild Zorbing - 28 km / 17.4 mi <br /> The Summit Gardens - 30.1 km / 18.7 mi <br /> Tana Russet Plaza - 34.1 km / 21.2 mi <br /> Georges Pompidou Building - 35 km / 21.7 mi <br /> Sacré Coeur Cathedral - 35.1 km / 21.8 mi <br /> Porte du Ciel - 35.1 km / 21.8 mi <br /> Nambawan Market & Café - 35.2 km / 21.9 mi <br /> Iririki Island - 35.2 km / 21.9 mi <br /> Feiawa Park - 35.3 km / 21.9 mi <br /> Chinatown - 35.4 km / 22 mi <br /> Lookout Point - 35.6 km / 22.1 mi <br /> </p><p>The preferred airport for The Moso Vanuatu is Port Vila (VLI-Bauerfield) - 33.1 km / 20.6 mi </p>,"<p>HeadLine : By the ocean</p><p>Location : With a stay at The Moso Vanuatu in Moso Island, you ll be on the waterfront, and 21.9 mi (35.2 km) from Iririki Island and 22.1 mi (35.6 km) from Port Vila Market.  This 4-star hotel is 12.9 mi (20.8 km) from Chief Roi Matas Domain and 15.3 mi (24.7 km) from Mele Cascades.</p><p>Rooms : Make yourself at home in one of the 6 guestrooms. Private bathrooms have complimentary toiletries and hair dryers. Conveniences include complimentary bottled water and ceiling fans, and housekeeping is provided daily.</p><p>Dining : Grab a bite to eat at The Bistro, a bistro which features a bar/lounge, or stay in and take advantage of the room service (during limited hours). Cooked-to-order breakfasts are available daily from 7:00 AM to 10:00 AM for a fee.</p><p>CheckIn Instructions : <ul>  <li>Extra-person charges may apply and vary depending on property policy</li><li>Government-issued photo identification and a credit card, debit card, or cash deposit may be required at check-in for incidental charges</li><li>Special requests are subject to availability upon check-in and may incur additional charges; special requests cannot be guaranteed</li><li>This property accepts credit cards; cash is not accepted</li>  </ul></p><p>Special Instructions : Guests must transfer to the property via boat and must arrange the transfers by contacting the property before travel, using the contact information on the booking confirmation. This property offers transfers from the airport (surcharges may apply). Guests must contact the property with arrival details before travel, using the contact information on the booking confirmation. Front desk staff will greet guests on arrival. For more details, please contact the property using the information on the booking confirmation.</p>",678-678-7711365,Dry cleaning/laundry service Paddleboard on site Outdoor furniture Swimming nearby Scuba diving nearby Free WiFi Number of bars/lounges - 1 Designated smoking areas Number of outdoor pools - 1 Tours/ticket assistance Nature reserve Airport transportation (surcharge) On private beach Accessible airport shuttle Firepit Multilingual staff Water dispenser Breakfast available (surcharge) Laundry facilities Snorkeling on site Games Books Spa treatment room(s) Marina on site Garden Wedding services Beach towels Fishing on site Boat tours on site Area shuttle (surcharge) Wheelchair accessible  no Luggage storage Grocery/convenience store Porter/bellhop 24-hour front desk Library Spa services on site Safe-deposit box at front desk Rowing or canoeing on site Snack bar/deli Hot springs nearby Self parking (surcharge) Kayaking on site Motor boating on site Beach sun loungers Terrace ATM/banking Concierge services,-17.537695|168.270417,678-678-7711365,,https://www.themosovanuatu.com
VU,Vanuatu,129062,Moso Island,5651121,The Reef House,All,Teouma Bay  ,,"Located in Port Vila, just 19 km from Konanda Reef, The Reef House provides beachfront accommodation with an outdoor swimming pool, a garden, a private beach area and free WiFi. This holiday home features a private pool, barbecue facilities and free private parking.

This holiday home comes with a kitchen, a seating area, a dining area and a cable flat-screen TV.

Fishing and canoeing can be enjoyed nearby. Please inform The Reef House in advance of your expected arrival time. You can use the Special Requests box when booking, or contact the property directly with the contact details provided in your confirmation.
Payment before arrival via bank transfer is required. The property will contact you after you book to provide instructions.",,Garden Non-smoking rooms babysitting/child services Fishing Swimming pool Massage On-site parking airport shuttle (additional charge) Daily housekeeping Airport shuttle Canoeing wifi outdoor pool (all year) grocery deliveries Free WiFi Free parking Parking Private beach area Beachfront internet services BBQ facilities Private parking,-17.80164|168.37953,,,https://www.booking.com/hotel/vu/the-reef-house.html
VU,Vanuatu,132315,Port Vila,1023395,Tamanu on the Beach,FourStar,White Sands Road SE Efate Port VilaEfate ,Distances are displayed to the nearest 0.1 mile and kilometer. <br /> <p>Eden on the River - 11.9 km / 7.4 mi <br /> University of the South Pacific - 15.3 km / 9.5 mi <br /> Supreme Court - 16.4 km / 10.2 mi <br /> Michoutouchkine & Pilioko Foundation Art Gallery - 16.4 km / 10.2 mi <br /> British Residency - 16.4 km / 10.2 mi <br /> French Residency - 16.4 km / 10.2 mi <br /> Independence Park - 16.6 km / 10.3 mi <br /> Georges Pompidou Building - 16.7 km / 10.4 mi <br /> Sacré Coeur Cathedral - 16.8 km / 10.5 mi <br /> Porte du Ciel - 16.9 km / 10.5 mi <br /> Parliament House - 17 km / 10.6 mi <br /> National Museum - 17.1 km / 10.6 mi <br /> WWI memorial - 17.1 km / 10.6 mi <br /> Tana Russet Plaza - 17.1 km / 10.7 mi <br /> Chinatown - 17.2 km / 10.7 mi <br /> </p><p>The preferred airport for Tamanu on the Beach is Port Vila (VLI-Bauerfield) - 21.3 km / 13.2 mi </p>,"<p>HeadLine : On the beach</p><p>Location : With a stay at Tamanu on the Beach in Teouma, you ll be on the beach, and 11 mi (17.6 km) from Port Vila Market and 11.3 mi (18.2 km) from Iririki Island.  This 4-star resort is 7.4 mi (11.9 km) from Eden on the River and 9.5 mi (15.3 km) from University of the South Pacific.</p><p>Rooms : Make yourself at home in one of the 15 individually decorated guestrooms, featuring iPod docking stations and minibars. Your pillowtop bed comes with premium bedding. Rooms have private furnished balconies. Pay movies and DVD players are provided for your entertainment, while complimentary wireless Internet access keeps you connected. Private bathrooms with shower/tub combinations feature complimentary toiletries and hair dryers.</p><p>Dining : Enjoy local cuisine at Tamanu on the Beach, a beachfront fine-dining restaurant where you can enjoy drinks at the bar/lounge, take in the ocean view, and even dine alfresco. You can also stay in and take advantage of the room service (during limited hours). Quench your thirst with your favorite drink at the beach bar. A complimentary full breakfast is served daily from 7:30 AM to 10:30 AM.</p><p>CheckIn Instructions : <ul>  <li>Extra-person charges may apply and vary depending on property policy</li><li>Government-issued photo identification and a credit card, debit card, or cash deposit may be required at check-in for incidental charges</li><li>Special requests are subject to availability upon check-in and may incur additional charges; special requests cannot be guaranteed</li><li>This property accepts credit cards; cash is not accepted</li><li>Safety features at this property include a fire extinguisher and a first aid kit</li><li>Please note that cultural norms and guest policies may differ by country and by property; the policies listed are provided by the property</li>  </ul></p><p>Special Instructions : This property offers transfers from the airport (surcharges may apply). To arrange pick-up, guests must contact the property 72 hours prior to arrival, using the contact information on the booking confirmation. The front desk is open daily from 8:00 AM - 5:00 PM. To make arrangements for check-in please contact the property ahead of time using the information on the booking confirmation. If you are planning to arrive after 5:00 PM please contact the property in advance using the information on the booking confirmation. Guests must contact the property in advance for check-in instructions. Front desk staff will greet guests on arrival. For more details, please contact the property using the information on the booking confirmation.  Please note that children are allowed at this property during school holiday periods.</p>",678-2-4470,Picnic area Wheelchair accessible parking Wedding services Tours/ticket assistance Beach towels Boat tours nearby Airport transportation (surcharge) Luggage storage Free breakfast Front desk (limited hours) Library Daily Golfing nearby Safe-deposit box at front desk Smoke-free property Ecotours nearby Laundry facilities Free self parking Snorkeling on site Beach sun loungers Terrace Bicycle rentals on site Concierge services Dry cleaning/laundry service Free full breakfast Beach umbrellas Scuba diving nearby Free WiFi Number of bars/lounges - 1 Number of outdoor pools - 1 Number of beach bars - 1 Garden,-17.824438|168.395325,67827279,,http://www.tamanuonthebeach.com/
VU,Vanuatu,132315,Port Vila,1023397,Surfside Vanuatu,FourStar,Pango Road PO Box 3478Port Vila ,,"The 4-star Surfside Vanuatu offers comfort and convenience whether you're on business or holiday in Port Vila. The hotel offers a wide range of amenities and perks to ensure you have a great time. Wi-Fi in public areas, car park, airport transfer, babysitting, tours are just some of the facilities on offer. Comfortable guestrooms ensure a good night's sleep with some rooms featuring facilities such as internet access  wireless, private pool, non smoking rooms, air conditioning, desk. Enjoy the hotel's recreational facilities, including outdoor pool, massage, before retiring to your room for a well-deserved rest. A welcoming atmosphere and excellent service are what you can expect during your stay at Surfside Vanuatu.",,airport transfer babysitting bicycle rental car park shops tours Wi-Fi in public areas,-17.77705|168.291,67822727,3478,http://surfsidevanuatu.com/
VU,Vanuatu,132315,Port Vila,1023401,Mariner Apartments,ThreeStar,Lini Highway Port Vila ,Distances are displayed to the nearest 0.1 mile and kilometer. <br /> <p>Iririki Island - 0.1 km / 0.1 mi <br /> Port Vila Market - 0.5 km / 0.3 mi <br /> Parliament House - 0.5 km / 0.3 mi <br /> National Museum - 0.5 km / 0.3 mi <br /> Feiawa Park - 0.6 km / 0.4 mi <br /> Independence Park - 0.7 km / 0.4 mi <br /> Lookout Point - 0.9 km / 0.6 mi <br /> Chinatown - 1 km / 0.6 mi <br /> Erakor Lagoon - 1.1 km / 0.7 mi <br /> Nambawan Market & Café - 1.1 km / 0.7 mi <br /> WWI memorial - 1.1 km / 0.7 mi <br /> Sacré Coeur Cathedral - 1.3 km / 0.8 mi <br /> Porte du Ciel - 1.3 km / 0.8 mi <br /> Georges Pompidou Building - 1.4 km / 0.9 mi <br /> Supreme Court - 1.6 km / 1 mi <br /> </p><p>The preferred airport for Mariner Apartments is Port Vila (VLI-Bauerfield) - 5.9 km / 3.7 mi </p>,"<p>HeadLine : Near Parliament House</p><p>Location : A stay at Mariner Apartments places you in the heart of Port Vila, steps from Iririki Island and 6 minutes by foot from Port Vila Market.  This hotel is 0.3 mi (0.5 km) from Parliament House and 0.3 mi (0.5 km) from National Museum.</p><p>Rooms : Make yourself at home in one of the 11 air-conditioned rooms featuring kitchens with full-sized refrigerators/freezers and ovens. Rooms have private furnished balconies or patios. 55-inch Smart televisions with satellite programming provide entertainment, while complimentary wireless Internet access keeps you connected. Conveniences include microwaves and coffee/tea makers, and housekeeping is provided daily.</p><p>Dining : Take advantage of the hotel s room service.</p><p>CheckIn Instructions : <ul>  <li>Extra-person charges may apply and vary depending on property policy</li><li>Government-issued photo identification and a credit card may be required at check-in for incidental charges</li><li>Special requests are subject to availability upon check-in and may incur additional charges; special requests cannot be guaranteed</li><li>This property accepts credit cards, debit cards, and cash</li>  </ul></p><p>Special Instructions : Guests must transfer via required shuttle to the property. Guests must contact the property at least 72 hours before travel, using the contact information on the confirmation received after booking. This property offers transfers from the airport. To arrange pick-up, guests must contact the property 72 hours prior to arrival, using the contact information on the booking confirmation. The front desk is open daily from 8:00 AM - 4:00 PM. Front desk staff will greet guests on arrival.</p>",678-22160,Concierge services Dry cleaning/laundry service Eco-friendly cleaning products provided Free grocery shopping service Wheelchair accessible  no Luggage storage Babysitting or childcare (surcharge) Express check-in Multilingual staff Front desk (limited hours) Television in common areas Limo or Town Car service available Free WiFi Designated smoking areas Number of outdoor pools - 1 Laundry facilities Tours/ticket assistance Free self parking Pool sun loungers Free airport transportation,-17.744459|168.314296,678-35444,0000,http://www.marinerapartmentsportvila.com/
