countyCode,countyName,cityCode,cityName,HotelCode,HotelName,HotelRating,Address,Attractions,Description,FaxNumber,HotelFacilities,Map,PhoneNumber,PinCode,HotelWebsiteUrl
VE,Venezuela,113504,Caracas,1299047,Cumberland Chacao ,ThreeStar,Av. Santa Lucia Con Av. Principal Del Bosque Chaca 1020 1060 Cumberland ChacaitoCaracas ,,"<p>HeadLine : Connected to a shopping center</p><p>Rooms : Make yourself at home in one of the 78 air-conditioned rooms featuring LCD televisions. Complimentary wireless Internet access keeps you connected, and cable programming is available for your entertainment. Bathrooms have bathtubs and hair dryers. Conveniences include phones, as well as laptop-compatible safes and desks.</p><p>Dining : Satisfy your appetite for lunch or dinner at the hotel s restaurant, El Golozo, or stay in and take advantage of the room service (during limited hours). Quench your thirst with your favorite drink at the bar/lounge. A complimentary local cuisine breakfast is served daily from 7 AM to 10 AM.</p><p>CheckIn Instructions : Extra-person charges may apply and vary depending on property policy. <br />Government-issued photo identification and a credit card, debit card, or cash deposit are required at check-in for incidental charges. <br />Special requests are subject to availability upon check-in and may incur additional charges. Special requests cannot be guaranteed.  <ul><li>No onsite parking is available. </li>Please note that cultural norms and guest policies may differ by country and by property. The policies listed are provided by the property. </ul></p>",58-212-761 5126,Free newspapers in lobby Smoke-free property Dry cleaning/laundry service Free WiFi 24-hour fitness facilities Restaurant Laundry facilities Airport transportation Free breakfast Banquet hall 24-hour front desk Ballroom Gift shops or newsstand Elevator/lift Luggage storage Bar/lounge,10.492396|-66.867087,58-212-9558712,1060,http://www.hotelescumberland.com/cumberlandccs/
VE,Venezuela,113504,Caracas,1312767,President,FourStar,"Av Valparaiso, Los Caobos CARACAS ",,"This hotel is located in the city centre of Caracas. It offers guests a convenient location, close to a number of local places of interest and attractions. They will find various entertainment and shopping venues nearby, as well as dining opportunities. In addition to an ideal location, this hotel provides comfortable accommodation and modern amenities, making it a smart choice for both business travellers and holidaymakers alike. Guests are welcomed to enjoy a hot drink in the cosy coffee shop or make use of the fitness centre. All 165 rooms provide premium bedding and are equipped with a minibar and air conditioning.",,Hotel TV Minibar Centrally regulated air conditioning Café Conference room,10.497393|-66.88166,,1050,http://www.hotelpresidentcaracas.com
VE,Venezuela,113504,Caracas,1313535,Continental Altamira,TwoStar,Avda. San Juan Bosco Entre 2Da Y 3Ra Transversal 1050 Caracas 3ra transversal Altamira AltamiraCaracas ,,"<p>HeadLine : Near a metro station</p><p>Rooms : Make yourself at home in one of the 81 guestrooms featuring refrigerators and minibars. Rooms have private balconies. LCD televisions with cable programming provide entertainment, while complimentary wireless Internet access keeps you connected. Bathrooms have showers and hair dryers.</p><p>Dining : Enjoy a satisfying meal at La Terraza serving guests of Hotel Continental Altamira. Relax with your favorite drink at the bar/lounge or the poolside bar. A complimentary cooked-to-order breakfast is served daily from 6:30 AM to 9:30 AM.</p><p>CheckIn Instructions : <ul>  <li>Extra-person charges may apply and vary depending on property policy</li><li>Government-issued photo identification and a credit card, debit card, or cash deposit may be required at check-in for incidental charges</li><li>Special requests are subject to availability upon check-in and may incur additional charges; special requests cannot be guaranteed</li><li>This property accepts credit cards</li>  </ul></p><p>Special Instructions : Front desk staff will greet guests on arrival.</p>",58-212-2610644,Dry cleaning/laundry service Banquet hall Ballroom Free breakfast 24-hour front desk Free WiFi Number of bars/lounges - 1 Number of poolside bars - 1 Daily Braille or raised signage Number of outdoor pools - 1 Garden Smoke-free property Laundry facilities Wedding services elevator Free self parking Free Cooked-to-Order Breakfast,10.499369|-66.84975,58-212-2610644,1062,http://www.hotel-continental.com.ve/contacto.html
VE,Venezuela,113504,Caracas,1362823,Garden Suites,ThreeStar,5A Transversal De Altamira CARACAS ,,"In operation since 2000, this hotel was conceived, designed and equipped to meet high standards, positioning itself as a unique concept in residential suite hotels. It has suites with kitchenette and all amenities for comfort and safety. The services and facilities include a cafeteria, laundry service, gym with steam room and free parking 24 hours and six meeting rooms equipped with up to 85 people.",+582122666776,Hotel,10.502185|-66.8517429,1164245336620,1060,http://www.gardensuites.org/
VE,Venezuela,113504,Caracas,1375776,Eduard'S,FourStar,Av. La Playa Con Calle 1 Urb A Lamo LA GUAIRA ,Balneario de Camurí: within 3300 metre  Paseo la Playa: within 550 metre  C.C. MAIQUETIA PLAZA : within 7300 metre ,"The Eduard's hotel suite & resort offers you the privilege of being a few minutes from the international airport Maiquetia and enjoy the freshness of the ocean view. Its 106 rooms with sea view, have TV. satellite, air conditioning, hot water, telephone, wireless, safe (optional) and daily room service. Free transfer airport hotel airport 24 hours (reporting 24 hours in advance). Multiple Area: This is an area where you can entertain yourself with games while enjoying your stay in our hotel. Internet room: This room has four (4) modules totally free and open 24 hours. We also have to comodad Wi-Fi in all areas of the hotel. Reception Hall: This is a show dedicated to your events, conferences, banquets and wedding parties or fifteen years with the best advice you can offer. Restaurants: The Churuata: This is a restaurant that offers the highest quality seafood and where they can find a select variety of whole kingdom of the sea.",,Hotel MasterCard Visa Maestro Bathroom Shower Hairdryer Toiletries TV Mini fridge Individually adjustable air conditioning Safe Mobile phone coverage Room service Air conditioning in public areas Hotel safe Lift access Garden Terrace Gym Café Bar Restaurant Air conditioning in Restaurant Conference room Meeting room Sun loungers Parasols Beach volleyball Billiards Tennis,10.60524647|-66.90073498,,1162,www.hoteleduards.com
VE,Venezuela,113504,Caracas,1383999,Cayena Caracas,FourStar,Av. Don Eugenio Mendoza Entre Calles El Bosque Y Jose Angel Lamas. La Castellana José Angel lamas y El Bosque Entre Calles el Bosque y José Ángel LamasCaracas 1060La Castellana ,,"<p>HeadLine : In the business district</p><p>Rooms : Make yourself at home in one of the 47 individually decorated guestrooms, featuring iPod docking stations and LED televisions. Your pillowtop bed comes with down comforters and Frette Italian sheets. Complimentary wireless Internet access keeps you connected, and cable programming is available for your entertainment. Private bathrooms with showers feature rainfall showerheads and designer toiletries.</p><p>Dining : Enjoy Italian cuisine at La Sibilla, a fine-dining restaurant which features a bar/lounge, or stay in and take advantage of the 24-hour room service. Mingle with other guests at the complimentary reception, held daily. A complimentary buffet breakfast is served daily from 6:30 AM to 10:30 AM.</p><p>CheckIn Instructions : <ul>  <li>Extra-person charges may apply and vary depending on property policy</li><li>Government-issued photo identification and a credit card, debit card, or cash deposit may be required at check-in for incidental charges</li><li>Special requests are subject to availability upon check-in and may incur additional charges; special requests cannot be guaranteed</li><li>This property accepts credit cards</li>  </ul></p><p>Special Instructions : This property offers transfers from the airport (surcharges may apply). Guests must contact the property with arrival details before travel, using the contact information on the booking confirmation. Front desk staff will greet guests on arrival.</p>",58-212-2748280,Dry cleaning/laundry service Pool umbrellas Free reception Number of meeting rooms - 1 Conference space size (meters) - 37 Free WiFi Number of bars/lounges - 1 Spa treatment room(s) Number of outdoor pools - 1 Free breakfast Garden In-room accessibility (in select rooms) Internet access in public areas - high speed Wheelchair accessible parking Free newspapers in lobby Tours/ticket assistance 24-hour fitness facilities Area shuttle (surcharge) Free Buffet Breakfast Rooftop terrace Airport transportation (surcharge) Luggage storage Pool sun loungers Conference space size (feet) - 398 Concierge services Porter/bellhop Business center 24-hour front desk Daily Golfing nearby Spa services on site Safe-deposit box at front desk Smoke-free property Laundry facilities elevator Free self parking Conference space Free valet parking Wheelchair accessible path of travel,10.499511|-66.8531,58-212-2748200,1060,http://www.hotelcayena.com
VE,Venezuela,113504,Caracas,1390496,Savoy,ThreeStar,Segunda Transversal De Las Delicias CARACAS ,,"This traditional hotel is set at the heart of Sabana Grande, just a short driving distance away from Caracas. The hotel is located in the commercial area of the city, where a variety of shopping, dining and entertainment venues can be found. The hotel lies within easy access of many of the area's main attractions. The hotel enjoys an attractive design, welcoming visitors with warm hospitality and excellent service. The guest rooms offer comfort, convenience and a peaceful ambiance, in which to work and rest in comfort. This hotel offers a number of facilities and services, meeting the needs of every type of traveller.",,Hotel American Express EC JCB Diners Club MasterCard Visa Maestro Visa Electrón EuroCard Euro 6000,10.493523|-66.871723,,1510,
VE,Venezuela,113504,Caracas,1438239,Hotel Aladdin Caracas,ThreeStar,Street Guaicaipuro El Rosal Chacao Caracas El RosalCaracas ,,"<p>HeadLine : Near a metro station</p><p>Rooms : Make yourself at home in one of the 60 air-conditioned rooms featuring plasma televisions. Complimentary wireless Internet access keeps you connected, and digital programming is available for your entertainment. Bathrooms with separate bathtubs and showers are provided.</p><p>Dining : Take advantage of the hotel s 24-hour room service. A complimentary continental breakfast is served daily.</p><p>CheckIn Instructions : Extra-person charges may apply and vary depending on property policy. <br />Government-issued photo identification and a credit card, debit card, or cash deposit may be required at check-in for incidental charges. <br />Special requests are subject to availability upon check-in and may incur additional charges. Special requests cannot be guaranteed.  <ul><li>Please note this is a love hotel. It is designed for adult entertainment. </li>Noise-free guestrooms cannot be guaranteed. Please note that cultural norms and guest policies may differ by country and by property. The policies listed are provided by the property. </ul></p><p>Special Instructions : Front desk staff will greet guests on arrival.</p>",58-212-9513066,Free breakfast Free self parking Free WiFi 24-hour front desk,10.488295|-66.868571,58-212-9513066,1060,http://www.hotelaladdin.com/hotel.php?id=3
VE,Venezuela,113504,Caracas,1442072,La Alameda,ThreeStar,Residencias La Alameda Calle B Residencias la AlamedaCaracas 1080 ,,"<p>HeadLine : In La Alameda</p><p>Rooms : Make yourself at home in one of the 25 individually furnished guestrooms, featuring kitchens with full-sized refrigerators/freezers and stovetops. 43-inch plasma televisions with premium TV channels provide entertainment, while complimentary wireless Internet access keeps you connected. Conveniences include safes and microwaves, and housekeeping is provided daily.</p><p>CheckIn Instructions : Extra-person charges may apply and vary depending on property policy. <br />Government-issued photo identification and a credit card, debit card, or cash deposit are required at check-in for incidental charges. <br />Special requests are subject to availability upon check-in and may incur additional charges. Special requests cannot be guaranteed. <ul>  </ul></p>",58-212-9757625,Elevator/lift Free self parking Free WiFi 24-hour front desk,10.470634|-66.876074,58-414-3277855,1080,
VE,Venezuela,113504,Caracas,1487260,Hotel Posada del Hidalgo,ThreeStar,"Av. La Playa, Urb. Alamo MACUTO ",,"Fifteen minutes from Simon Bolivar International Airport, expect our inn with intimacy and comfort of a hotel. 33 cozy rooms with all amenities to ensure your comfort. All equipped with private bathroom, color TV with cable and air conditioning and telephone. We have daily maid service, Bar-Restaurant, with live music, Room Service, Laundry, FREE parking, taxi line and private security.",,Hotel,10.604149|-66.902725,,0,
