countyCode,countyName,cityCode,cityName,HotelCode,HotelName,HotelRating,Address,Attractions,Description,FaxNumber,HotelFacilities,Map,PhoneNumber,PinCode,HotelWebsiteUrl
VE,Venezuela,113504,Caracas,1079228,Renaissance Caracas La Castellana Hotel,FourStar,Av Eugenio Mendoza Con Calle Urdaneta La Castellana con Calle UrdanetaLa CastellanaCaracas 1060 ,,"<p>HeadLine : Near a metro station</p><p>Rooms : Make yourself at home in one of the 193 air-conditioned rooms featuring refrigerators and LCD televisions. Your bed comes with down comforters and premium bedding. Cable programming provides entertainment, and wired and wireless Internet access is available for a surcharge. Private bathrooms with showers feature complimentary toiletries and hair dryers.</p><p>Dining : Satisfy your appetite for lunch or dinner at the hotel s restaurant, Mijao Asian Bistro, or stay in and take advantage of the 24-hour room service. Quench your thirst with your favorite drink at the bar/lounge. Buffet breakfasts are available daily from 6:30 AM to 10 AM for a fee.</p><p>CheckIn Instructions : Extra-person charges may apply and vary depending on property policy. <br />Government-issued photo identification and a credit card, debit card, or cash deposit are required at check-in for incidental charges. <br />Special requests are subject to availability upon check-in and may incur additional charges. Special requests cannot be guaranteed. <ul>  </ul></p>",58-212-9083222,Express check-in Bar/lounge 24-hour front desk Business center Conference space Express check-out Tours/ticket assistance Meeting rooms Restaurant Dry cleaning/laundry service Self parking (surcharge) WiFi (surcharge) Outdoor pool Valet parking (surcharge) Wired Internet access - surcharge Area shuttle (surcharge) Spa services on site Terrace Luggage storage Hair salon Breakfast available (surcharge) Concierge services Gift shops or newsstand Designated smoking areas Banquet hall Laundry facilities Accessible bathroom Roll-in shower In-room accessibility Airport transportation (surcharge) 24-hour health club Free newspapers in lobby,10.496632|-66.851389,58-212-9084222,1060,http://www.espanol.marriott.com/hotels/travel/ccsbr-renaissance-caracas-la-castellana-hotel/
VE,Venezuela,113504,Caracas,1096332,Ambassador Suites Hotel Caracas,ThreeStar,Av Francisco De Miranda Con Av. Campo Alegre 1060 Caracas CON AV PARQUE CAMPO ALEGRE Campo AlegreCaracas 1060 ,,"<p>Rooms : Stay in one of 248 guestrooms featuring flat-screen televisions. Complimentary wireless Internet access is available to keep you connected. Private bathrooms have deep soaking bathtubs and complimentary toiletries. Conveniences include phones, as well as safes and irons/ironing boards.</p><p>Dining : Enjoy a meal at the restaurant or snacks in the hotel s coffee shop/café. Quench your thirst with your favorite drink at the bar/lounge. A complimentary continental breakfast is served daily from 8 AM to 10 AM.</p><p>CheckIn Instructions : Extra-person charges may apply and vary depending on property policy Government-issued photo identification and a credit card, debit card, or cash deposit may be required at check-in for incidental charges Special requests are subject to availability upon check-in and may incur additional charges; special requests cannot be guaranteed This property accepts credit cards</p><p>Special Instructions : Front desk staff will greet guests on arrival.</p>",58-212-2764200,Library Bar/lounge elevator 24-hour front desk Banquet hall Free breakfast Restaurant Coffee shop or café 24-hour fitness facilities Free WiFi Self parking (surcharge) Pool waterfall Outdoor pool Smoke-free property,10.492|-66.86183,58-212-7004200,1064,http://klmhotels.com/id-8924.html
VE,Venezuela,113504,Caracas,1133220,Hotel Ole Caribe,FiveStar,Final Avenida Intercomunal El Playon El PlayónMacutoEstado Vargas ,,"Surrounded by mountains and amidst tropical vegetation, Hotel Olé Caribe offers beachfront accommodations overlooking the Caribbean Sea in Macuto. Guests at the hotel can enjoy the outdoor pool, dine in the on site restaurants, and drink freshwater from a mountain spring. Free WiFi access is available.

Each of the spacious and luminous rooms at Olé Caribe Hotel features air conditioning, a flat-screen cable TV, a minibar and a safety deposit box. Some rooms have a seating area, a terrace, and views of the mountains or sea. Bathroom facilities are private, some include a bath tub.

Guests at Hotel Olé Caribe can unwind in the on site bars, relax in the sauna, or workout in the fitness centre. A games room, a tennis court and a sun terrace are also available. Massage therapies can be arranged. Services provided by the hotel include a 24-hour front desk, luggage storage and airport shuttles. The property offers free parking.

Hotel Olé Caribe is 300 metres from Vargas Water Park and 14 km from Simon Bolívar International Airport. Please inform Hotel Olé Caribe in advance of your expected arrival time. You can use the Special Requests box when booking, or contact the property directly with the contact details provided in your confirmation.
Payment before arrival via bank transfer is required. The property will contact you after you book to provide instructions.
Due to Coronavirus (COVID-19), this property is taking steps to help protect the safety of guests and staff. Certain services and amenities may be reduced or unavailable as a result.
Due to Coronavirus (COVID-19), wearing a face mask is mandatory in all indoor common areas.
Please note reservations must be fully payed before arrival, credit card details are required.
Please note an international credit card is required to make the payment.",00582 126 202060,Outdoor furniture Fitness kids' pool Swimming pool Shuttle service Parking 24-hour security Key card access Smoke alarms CCTV in common areas Fire extinguishers Swimming pool use of cleaning chemicals that are effective against coronavirus linens  towels and laundry washed in accordance with local authority guidelines guest accommodation is disinfected between stays physical distancing in dining areas Restaurant food can be delivered to guest accommodation Room service staff follow all safety protocols as directed by local authorities shared stationery such as printed menus  magazines  pens  and paper removed hand sanitizer in guest accommodation and key areas first aid kit available contactless check-in/check-out cashless payment available physical distancing rules followed all plates  cutlery  glasses and other tableware have been sanitized meeting/banquet facilities guests have the option to cancel any cleaning services for their accommodation during their stay Bar 24-hour front desk Tennis Court Sauna Fitness centre Garden Terrace Non-smoking rooms Airport shuttle Business centre Laundry Facilities for disabled guests Family rooms Games room breakfast in the room Ironing service Free parking internet services lift Safety Deposit Box Billiards Table tennis Soundproof rooms Packed lunches Tour desk Fax/photocopying Squash Luggage storage wifi Outdoor pool Free WiFi Non-smoking throughout Air conditioning Sun terrace outdoor pool (all year) shuttle service (additional charge) Special diet menus (on request) Trouser press airport shuttle (additional charge) delivered food is securely covered shared lounge/TV area Daily housekeeping parking on site Private parking wifi available in all areas Indoor play area Kid meals Parking garage Accessible parking Wheelchair accessible Salt-water pool Shallow end Wine/champagne Fruits airport pick up airport drop off tennis equipment coffee house on site sun loungers or beach chairs Sun umbrellas,10.6078|-66.88084,+582126202000,1160,https://www.booking.com/hotel/ve/ole-caribe.html
VE,Venezuela,113504,Caracas,1140413,Altamira Suites,FiveStar,1A. Ave. Con 1A. Transversal De Los Palos Grandes CARACAS ,,"It is a 5-star hotel in the city center of Caracas. All its 233 rooms are suites, which makes us to get an idea of luxury and comfort. It is a hotel of a high category, so its rooms are equipped with an iron and an ironing board, a safe, internet, a dining room and a kitchenette; so customers will see that they don't miss a thing during their stay. The rest of the hotel is not less prepared, because among its facilities it has a wide range of possibilities: a heated pool, a tennis court, a gym, room service, a dry cleaning and a laundry, a shop... To complete the offer of this hotel, customers can dedicate part of theri time with the good gastronomy of a famous Venezuelan chef , or if they prefer they can take pizza and a cocktail or taste something more informal in the snack bar. Visit the hotel, you will feel better than in your own home.",,Hotel American Express Diners Club MasterCard Visa Mobile phone coverage Room service Laundry service Launderette Hairdressing salon Breakfast Breakfast buffet Continental Breakfast À la carte lunch Set menu lunch À la carte dinner Set menu dinner Special dietary options Medical service Air conditioning in public areas Hotel safe Cloakroom Lift access Newspaper stand Shop Garden Gym Café Bar Restaurant Non-smoking area Smoking area Poolside snack bar Air conditioning in Restaurant Conference room Sun loungers Parasols Nightclub Pub Sauna Steam bath Massage Spa treatments,10.498916|-66.847639,,1060,WWW.HOTELALTAMIRASUITES.COM
VE,Venezuela,113504,Caracas,1140416,Hotel CCT,ThreeStar,La Estancia Centro Comercial Ciudad Tamanaco Centro Ciudad Comercial Tamanaco Torre D Nivel LobbyChuaoCaracas 1060A ,,"<p>HeadLine : Connected to a shopping center</p><p>Rooms : Make yourself at home in one of the 119 guestrooms featuring refrigerators and LCD televisions. Your Select Comfort bed comes with premium bedding. Complimentary wireless Internet access keeps you connected, and cable programming is available for your entertainment. Private bathrooms with showers feature complimentary toiletries and bidets.</p><p>Dining : Enjoy a meal at the restaurant, or stay in and take advantage of the hotel s room service (during limited hours). Wrap up your day with a drink at the bar/lounge. A complimentary cooked-to-order breakfast is served daily from 6:30 AM to 10:30 AM.</p><p>CheckIn Instructions : <ul>  <li>Extra-person charges may apply and vary depending on property policy</li><li>Government-issued photo identification and a credit card, debit card, or cash deposit may be required at check-in for incidental charges</li><li>Special requests are subject to availability upon check-in and may incur additional charges; special requests cannot be guaranteed</li><li>This property accepts credit cards</li><li>Please note that cultural norms and guest policies may differ by country and by property; the policies listed are provided by the property</li>  </ul></p><p>Special Instructions : </p>",58-212-700-8029,Shopping on site Free breakfast Outdoor tennis courts - 2 Multilingual staff Number of meeting rooms - 4 Television in common areas Free WiFi Number of bars/lounges - 1 Spa treatment room(s) Daily Number of outdoor pools - 1 Spa services on site Smoke-free property Free use of nearby fitness center Laundry facilities Full-service spa Wedding services elevator Free self parking Conference space Free Cooked-to-Order Breakfast 24-hour business center,10.485082|-66.853829,58-212-700-8000,1060,http://www.hotelcct.com.ve
VE,Venezuela,113504,Caracas,1142428,Costa Real Suites,ThreeStar,Av La Playa Caraballeda Urbanizacion Tanaguarena Urbanizacion TanaguarenaCaraballeda 1165Caracas ,,"<p>HeadLine : Near the beach</p><p>Rooms : Make yourself at home in one of the 14 air-conditioned rooms featuring kitchenettes. Cable television is provided for your entertainment. Conveniences include separate sitting areas and refrigerators, and housekeeping is provided daily.</p><p>Dining : Unwind at the end of the day with a drink at the bar/lounge or the poolside bar. Continental breakfasts are available daily for a fee.</p><p>CheckIn Instructions : <ul>  <li>This property is managed by a professional host; the provision of housing is linked to their trade, business, or profession, within the meaning of article 155 of the French Tax Code</li><li>Extra-person charges may apply and vary depending on property policy</li><li>Government-issued photo identification and a credit card, debit card, or cash deposit may be required at check-in for incidental charges</li><li>Special requests are subject to availability upon check-in and may incur additional charges; special requests cannot be guaranteed</li><li>This property accepts Visa, Mastercard, and American Express</li>  </ul></p><p>Special Instructions : Front desk staff will greet guests on arrival.</p>",58-212-9770110,Safe-deposit box at front desk Number of outdoor pools - 1 elevator Rooftop terrace Breakfast available (surcharge) Number of bars/lounges - 1 Number of poolside bars - 1 Concierge services 24-hour front desk Pool umbrellas Free self parking Free WiFi Airport transportation (surcharge) Multilingual staff,10.611509|-66.825866,58-212-3377874,1165,
VE,Venezuela,113504,Caracas,1152745,Avila,FourStar,"Avenida Washington, Urbanización San Bernardino CARACAS ",Boulevard de Sabana Grande: within 10000 metre ,"Since its creation in 1942 by Nelson Rockefeller was conceived for the peace and quiet that you can enjoy the cozy atmosphere it offers, framed by the lush landscape of tropical vegetation, fresh air and pure mountain, you'll find it at Only 15 minutes from Downtown and Boulevard de Sabana Grande Modern away from the daily bustle. All this makes for a real garden in the heart of downtown Caracas.",,Visa Bathroom Shower Bathtub Hairdryer TV Individually adjustable air conditioning Balcony Terrace Hotel safe Cloakroom Lift access Garden Gym Café Restaurant Air conditioning in Restaurant Conference room Sun loungers Parasols Hairdressing salon Tennis Hotel American Express EC Diners Club MasterCard,10.5166765|-66.8988172,,621,http://www.hotelavila.com.ve
VE,Venezuela,113504,Caracas,1154202,Alba Caracas,FiveStar,Av Libertador Y Sur 25 El Conde1010 Caracas ,,"Stuated in Caracas, the Hotel Alba Caracas is a five-minute drive from the heart of the city. It has a gym, an outdoor pool and a sauna. This Caracas hotel features outdoor tennis courts and a spa and wellness centre. It provides a ballroom, a kids pool and a cafeteria. The spacious rooms at the Alba Caracas have a mini bar, a private bathroom and a refrigerator. Each features a hair dryer and a TV. The Hotel Alba Caracas Venezuela offers a varied dining experience, including restaurant and a bar. A wide variety of cafes and restaurants are also found in close proximity to the property.The Alba Caracas Hotel ( Formerly Hilton Caracas Hotel ) is a  hotel. Located in Caracas area.",58-212-5035003,Air conditioning Bar Complimentary Wifi Access Doctor On Call Elevators Florist Tour desk Night Club Restaurant Room Service-Limited Hours,10.500523567|-66.899505615,+582125035000,1010,http://hotel.venetur.gob.ve/index.php?hotel=ALBACARACAS
VE,Venezuela,113504,Caracas,1155456,Hotel Caracas Cumberland,ThreeStar,2Da. Av. Las Delicias De Sabana Grande entre Av. Solano y LibertadorCaracas ,,"<p>HeadLine : In a shopping district</p><p>Rooms : Make yourself at home in one of the 119 air-conditioned guestrooms. Rooms have private balconies. Complimentary wired Internet access keeps you connected, and cable programming is available for your entertainment. Bathrooms have bathtubs or showers and complimentary toiletries.</p><p>Dining : Grab a bite to eat at Rest. Principal, a restaurant which features a bar/lounge, or stay in and take advantage of the room service. A complimentary local cuisine breakfast is served daily from 7 AM to 10 AM.</p><p>Renovations : The following facilities or services will be unavailable from January 1 2022 to June 1 2022 (dates subject to change): <ul><li>Dining venue(s)</li></ul></p><p>CheckIn Instructions : <ul>  <li>Extra-person charges may apply and vary depending on property policy</li><li>Government-issued photo identification and a credit card, debit card, or cash deposit may be required at check-in for incidental charges</li><li>Special requests are subject to availability upon check-in and may incur additional charges; special requests cannot be guaranteed</li><li>This property accepts credit cards</li><li>Please note that cultural norms and guest policies may differ by country and by property; the policies listed are provided by the property</li>  </ul></p><p>Special Instructions : Front desk staff will greet guests on arrival.</p>",58-212-7615126,Meeting rooms Tours/ticket assistance Free self parking Dry cleaning/laundry service Free WiFi Wheelchair accessible parking Free wired Internet Number of coffee shops/cafes - 1 Wheelchair accessible Multilingual staff Free newspapers in lobby Daily Luggage storage Number of bars/lounges - 1 Free breakfast (local cuisine) Gift shops or newsstand 24-hour front desk Laundry facilities Free breakfast,10.493968|-66.87136,+582127629961,1050,
VE,Venezuela,113504,Caracas,1156745,Eurobuilding Hotel & Suites Caracas,FourStar,Final Calle La Guarita Chuao 1060 A Caracas ChuaoCaracas ,,"<p>HeadLine : In the business district</p><p>Rooms : Make yourself at home in one of the 617 guestrooms featuring minibars. Complimentary wired and wireless Internet access keeps you connected, and cable programming provides entertainment. Private bathrooms with shower/tub combinations feature complimentary toiletries and bidets. Conveniences include phones, as well as safes and desks.</p><p>Dining : Enjoy international cuisine at Jardin Cristal, one of the hotel s 4 restaurants, or stay in and take advantage of the 24-hour room service. Relax with a refreshing drink from the poolside bar or one of the 2 bars/lounges. Buffet breakfasts are available daily from 6 AM to 11 AM for a fee.</p><p>Renovations : The following facilities or services will be unavailable from July 1 2021 to January 1 2022 (dates subject to change): <ul><li>Dining venue(s)</li><li>Fitness facilities</li></ul></p><p>CheckIn Instructions : <ul>  <li>This property is managed by a professional host; the provision of housing is linked to their trade, business, or profession, within the meaning of article 155 of the French Tax Code</li><li>Extra-person charges may apply and vary depending on property policy</li><li>Government-issued photo identification and a credit card, debit card, or cash deposit may be required at check-in for incidental charges</li><li>Special requests are subject to availability upon check-in and may incur additional charges; special requests cannot be guaranteed</li><li>This property accepts Visa, Mastercard, and American Express</li><li>Please note that cultural norms and guest policies may differ by country and by property; the policies listed are provided by the property</li>  </ul></p><p>Special Instructions : Front desk staff will greet guests on arrival.</p>",58-212-9939285,Conference space Spa treatment room(s) Meeting rooms Tours/ticket assistance Steam room Free WiFi Sauna Free wired Internet Babysitting or childcare (surcharge) Smoke-free property Children's pool Safe-deposit box at front desk Spa services on site Area shuttle (surcharge) Breakfast available (surcharge) Conference space size (feet) - 0 Laundry facilities Wheelchair accessible path of travel Television in common areas Accessible bathroom Roll-in shower Wheelchair accessible parking Wedding services In-room accessibility Assistive listening devices available Braille or raised signage Garden Multilingual staff Free newspapers in lobby Number of outdoor pools - 1 Number of spa tubs - 1 elevator Fitness facilities 24-hour front desk Business center Porter/bellhop Express check-out Dry cleaning/laundry service Self parking (surcharge) Valet parking (surcharge) Computer station Conference space size (meters) - 0 Number of meeting rooms - 1 Terrace Luggage storage Hair salon ATM/banking Concierge services Gift shops or newsstand Conference center Snack bar/deli Shopping on site Airport transportation (surcharge) Number of bars/lounges - 1 Number of poolside bars - 1,10.482632|-66.850506,58-212-902 2222,1010A,http://www.radisson.com
VE,Venezuela,113504,Caracas,1157841,Gran Meliá Caracas,FourStar,Ave Casanova Calle El Recreo Urb. Bellomonte1050 Caracas ,,"<p>HeadLine : Connected to a shopping center</p><p>Rooms : Make yourself at home in one of the 428 air-conditioned rooms featuring minibars and plasma televisions. Wireless Internet access (surcharge) keeps you connected, and cable programming is available for your entertainment. Bathrooms have deep soaking bathtubs and rainfall showerheads. Conveniences include phones, as well as safes and desks.</p><p>Dining : Stop by the hotel s restaurant, Mediterraneo, for lunch. Dining is also available at the coffee shop/cafe, and 24-hour room service is provided. Mingle with other guests at the complimentary reception, held daily. Quench your thirst with your favorite drink at the bar/lounge. Local cuisine breakfasts are available daily from 6:30 AM to 10:30 AM for a fee.</p><p>CheckIn Instructions : <ul>  <li>Extra-person charges may apply and vary depending on property policy</li><li>Government-issued photo identification and a credit card, debit card, or cash deposit may be required at check-in for incidental charges</li><li>Special requests are subject to availability upon check-in and may incur additional charges; special requests cannot be guaranteed</li><li>The name on the credit card used at check-in to pay for incidentals must be the primary name on the guestroom reservation</li><li>Special cancellation policies or charges may apply for group reservations (more than 8 rooms for the same property / stay dates)</li><li>Guests must contact this property in advance to reserve cribs/infant beds</li><li>This property accepts credit cards</li><li>This property uses eco-friendly cleaning products</li><li>Please note that cultural norms and guest policies may differ by country and by property; the policies listed are provided by the property</li>  </ul></p><p>Special Instructions : Front desk staff will greet guests on arrival. For more details, please contact the property using the information on the booking confirmation.  This property does not permit name changes on reservations. The name on the booking must match the name of the guest who is checking in and staying at the property; photo ID is required. The credit card used to book the reservation must be presented by the cardholder at check-in along with matching photo identification. Any other arrangements must be coordinated with the property prior to arrival.</p>",58-21-27623737,Gift shops or newsstand Dry cleaning/laundry service Shopping on site Eco-friendly cleaning products used Free reception Swimming pool Free wired Internet Limo or Town Car service available Free WiFi Number of bars/lounges - 1 Designated smoking areas Number of spa tubs - 1 Number of outdoor pools - 1 Number of indoor pools - 1 In-room accessibility (in select rooms) Accessible bathroom (in select rooms) Airport transportation (surcharge) Eco-friendly toiletries Eco-friendly cleaning products provided Multilingual staff Breakfast available (surcharge) Coffee/tea in common areas Number of coffee shops/cafes - 1 Babysitting or childcare Laundry facilities elevator Fitness facilities Banquet hall Meeting rooms Health club Free newspapers in lobby Luggage storage Porter/bellhop Business center 24-hour front desk Golfing nearby Spa services on site Outdoor seasonal pool Safe-deposit box at front desk Designated smoking areas (fines apply) Snack bar/deli Children's pool Sauna Self parking (surcharge) Hair salon Terrace Concierge services,10.492778|-66.87717,58-212-7628111,1050,http://www.solmelia.com
VE,Venezuela,113504,Caracas,1196177,Hotel Las Americas,ThreeStar,"Av Casanova, Sabana Grande CARACAS ",Estadio Universitario: within 1300 metre  Centro Comercial El Recreo: within 600 metre  Universidad Central de Venezuela: within 1800 metre  Jardin Botanico de Caracas: within 2400 metre  Centro Ciudad Comercial Tamanaco: within 2000 metre ,"This establishment is located at the end of Casanova Avenue, Caracas, just a five-minute walk from Chacaito subway station and close to El Rosal and Las Mercedes. Some of the city's most important venues are situated nearby. This charming hotel welcomes guests in a relaxed atmosphere, exuding traditional hospitality. Warmly decorated, it offers fabulous suites and great rooms to stay in the city, whether for business or family recreation. It has a restaurant with a panoramic view of the hills with a great variety of national and international cuisine for the most discerning palates. This establishment provides 6 conference rooms ideal for conventions and meetings.",,Conference room Meeting room Sun loungers Parasols Children playground Sauna Steam bath Hot tub Turkish bath (hamam) Massage Spa treatments Hairdressing salon Beauty salon Spa centre Breakfast Hotel MasterCard Visa Bathroom Shower Hairdryer Direct dial telephone TV 220V power supply Plug adaptor Minibar Fridge Mini fridge Centrally regulated air conditioning Individually adjustable air conditioning Safe Mobile phone coverage Secure parking Laundry service 24-hour security Bellboy service Air conditioning in public areas Hotel safe Garden Terrace Sun terrace Café Bar Air conditioning in Restaurant,10.490297|-66.870524,,1000,WWW.TRAVELCONSULTORES.COM
